"2107.02873","Ricardo Franquiz Flores","Ricardo J. Franquiz Flores and John W. MacQuarrie","Blocks of profinite groups with cyclic defect group","13 pages. To appear in the Bulletin of the London Mathematical
  Society",,,,"math.GR math.RT","http://creativecommons.org/licenses/by/4.0/","  We demonstrate that the blocks of a profinite group whose defect groups are
cyclic have a Brauer tree algebra structure analogous to the case of finite
groups. We show further that the Brauer tree of a block with defect group
$\mathbb{Z}_{p}$ is of star type.
","[{""version"":""v1"",""created"":""Tue, 6 Jul 2021 20:13:53 GMT""},{""version"":""v2"",""created"":""Mon, 21 Feb 2022 19:46:19 GMT""}]","2022-02-23"
"2107.02874","Yi-Hsiang Chen","Yi-Hsiang Chen","Quantum state driving: measurements versus pulses",,,,,"quant-ph","http://creativecommons.org/licenses/by/4.0/","  The quantum Zeno effect is well-known for fixing a system to an eigenstate by
frequent measurements. It is also known that applying frequent unitary pulses
induces a Zeno subspace that can also pin the system to an eigenspace. Both
approaches have been studied as means to maintain a system in a certain
subspace. Extending the two concepts, we consider making the
measurements/pulses dynamical so that the state can move with the motion of the
measurement axis/pulse basis. We show that the system stays in the dynamical
eigenbasis when the measurements/pulses are slowly changing. Explicit bounds
for the apply rate that guarantees a success probability are provided. In
addition, both methods are inherently resilient against non-Markovian noise.
Finally, we discuss the similarities and differences between the two methods
and their connection to adiabatic quantum computation.
","[{""version"":""v1"",""created"":""Tue, 6 Jul 2021 20:24:15 GMT""},{""version"":""v2"",""created"":""Thu, 9 Sep 2021 18:07:16 GMT""}]","2021-09-13"
"2107.02875","Won Ik Cho","Won Ik Cho, Seok Min Kim, Hyunchang Cho, Nam Soo Kim","Kosp2e: Korean Speech to English Translation Corpus","Interspeech 2021 Camera-ready",,,,"cs.CL","http://creativecommons.org/licenses/by-sa/4.0/","  Most speech-to-text (S2T) translation studies use English speech as a source,
which makes it difficult for non-English speakers to take advantage of the S2T
technologies. For some languages, this problem was tackled through corpus
construction, but the farther linguistically from English or the more
under-resourced, this deficiency and underrepresentedness becomes more
significant. In this paper, we introduce kosp2e (read as `kospi'), a corpus
that allows Korean speech to be translated into English text in an end-to-end
manner. We adopt open license speech recognition corpus, translation corpus,
and spoken language corpora to make our dataset freely available to the public,
and check the performance through the pipeline and training-based approaches.
Using pipeline and various end-to-end schemes, we obtain the highest BLEU of
21.3 and 18.0 for each based on the English hypothesis, validating the
feasibility of our data. We plan to supplement annotations for other target
languages through community contributions in the future.
","[{""version"":""v1"",""created"":""Tue, 6 Jul 2021 20:34:06 GMT""}]","2021-07-08"
"2107.02876","Kevin Krisciunas","Kevin Krisciunas","Including Atmospheric Extinction in a Performance Evaluation of a Fixed
  Grid of Solar Panels","28 pages, 11 figures",,,,"astro-ph.IM","http://creativecommons.org/licenses/by/4.0/","  We characterize the performance of a fixed grid of solar panels on the basis
of data taken under clear sky conditions over 12 months. We confirm that the
power output is linearly proportional to cos(theta), where theta is the angular
difference of direction toward the Sun and the vector perpendicular to the
panels. In order to confirm this we applied methods from astronomical
photometry reduction. From late March through August we find that the median
effective atmospheric extinction term is 0.145 mag/airmass. From October to
mid-March the median extinction term is 0.081 mag/airmass. The proportionality
""constant"" scaling cos(theta) appears to be seasonally dependent, with the
smallest scaling factors occurring when the extinction term is largest.
Finally, we find that extinction-corrected power often underperforms the linear
relationship late in the morning or early in the afternoon. This is most likely
because the efficiency of solar panels depends on their operating temperature,
and the panel temperature increases over the course of time on a sunny day.
","[{""version"":""v1"",""created"":""Tue, 6 Jul 2021 20:34:11 GMT""},{""version"":""v2"",""created"":""Tue, 26 Oct 2021 14:06:29 GMT""},{""version"":""v3"",""created"":""Wed, 8 Jun 2022 12:15:21 GMT""}]","2022-06-09"
"2107.02878","Liliia Kulish","Liliia D.Kulish, Graeme R.Blake","Static and dynamic magnetic properties of K3CrO4","A high-resolution version with supplementary material can be found at
  https://www.sciencedirect.com/science/article/pii/S0304885321004893?via%3Dihub.
  arXiv admin note: text overlap with arXiv:1912.05997","Journal of Magnetism and Magnetic Materials 537 (2021) 168213","10.1016/j.jmmm.2021.168213",,"cond-mat.str-el cond-mat.mtrl-sci","http://arxiv.org/licenses/nonexclusive-distrib/1.0/","  We report on the magnetic properties of geometrically frustrated K3CrO4, in
which Cr5+ cations are arranged on a distorted pyrochlore lattice. The crystal
structure, static and dynamic magnetic properties of the compound are
investigated in detail. A combination of DC and AC magnetic susceptibility
measurements together with thermoremanent magnetization decay measurements
reveal several magnetic transitions: the onset of glassy canted
antiferromagnetic order occurs at 36 K, followed by the appearance of
ferromagnetic/ferrimagnetic cluster glass behavior below the freezing
temperature of 20 K. Further field-induced, temperature-dependent transitions
are observed in the range 3-10 K. The frequency dependence of the freezing
temperature for the cluster glass state is analyzed on the basis of dynamic
scaling laws including the critical slowing down formula and the Vogel-Fulcher
law.
","[{""version"":""v1"",""created"":""Tue, 6 Jul 2021 20:40:30 GMT""}]","2021-07-08"
"2107.02880","Liliia Kulish","Liliia D. Kulish, Pavan Nukala, Rick Scholtens, A. G. Mike Uiterwijk,
  Ruben Hamming-Green and Graeme R. Blake","Structural modulation in potassium birnessite single crystals","A high-resolution version with supplementary information can be found
  at
  https://pubs.rsc.org/en/content/articlelanding/2021/TC/D0TC05396A#!divAbstract","Journal of Materials Chemistry C 9 (2021) 1370-1377","10.1039/D0TC05396A",,"cond-mat.mtrl-sci","http://arxiv.org/licenses/nonexclusive-distrib/1.0/","  We report on the growth of single-crystal potassium birnessite
(K0.31MnO2*0.41H2O) and present both the average and local structural
characterization of this frustrated magnetic system. Single crystals were
obtained employing a flux growth method with a KNO3/B2O3 flux at 700 {\deg}C.
Single-crystal X-ray diffraction revealed an average orthorhombic symmetry,
with space group Cmcm. A combination of high angle annular dark field scanning
transmission electron microscopy (HAADF-STEM) with atomic resolution energy
dispersive X-ray spectroscopy (EDS) demonstrated the layered structure of
potassium birnessite with manganese-containing planes well separated by layers
of potassium atoms. MnO6 octahedra and the K/H2O planes were clearly imaged via
integrated differential phase contrast (iDPC) STEM. Furthermore, iDPC-STEM also
revealed the existence of local domains with alternating contrast of the
manganese oxide planes, most likely originating from charge ordering of Mn3+
and Mn4+ along the c-axis. These charge-ordered domains are clearly correlated
with a reduction in the c-lattice parameter compared to the rest of the matrix.
The insight gained from this work allows for a better understanding of the
correlation between structure and magnetic properties.
","[{""version"":""v1"",""created"":""Tue, 6 Jul 2021 20:42:59 GMT""}]","2021-07-08"
"2107.02881","Lucas Snyder","L. Snyder and M. Anastasiou and N.S. Bowden and J. Bundgaard and R.J.
  Casperson and D.A. Cebra and T. Classen and D.H. Dongwi and N. Fotiades and
  J. Gearhart and V. Geppert-Kleinrath and U. Greife and C. Hagmann and M.
  Heffner and D. Hensle and D. Higgins and L.D. Isenhower and K. Kazkaz and A.
  Kemnitz and J. King and J.L. Klay and J. Latta and E. Leal-Cidoncha and W.
  Loveland and J.A. Magee and B. Manning and M.P. Mendenhall and M. Monterial
  and S. Mosby and D. Neudecker and C. Prokop and S. Sangiorgio and K.T.
  Schmitt and B. Seilhan and F. Tovesson and R.S. Towell and N. Walsh and T.S.
  Watson and L. Yao and W. Younes","Measurement of the $^{239}$Pu(n,f)/$^{235}$U(n,f) Cross-Section Ratio
  with the NIFFTE fission Time Projection Chamber",,,,,"nucl-ex","http://arxiv.org/licenses/nonexclusive-distrib/1.0/","  The $^{239}$Pu(n,f)/$^{235}$U(n,f) cross-section ratio has been measured with
the fission Time Projection Chamber (fissionTPC) from 100 keV to 100 MeV. The
fissionTPC provides three-dimensional reconstruction of fission-fragment
ionization profiles, allowing for a precise quantification of measurement
uncertainties. The measurement was performed at the Los Alamos Neutron Science
Center which provides a pulsed white source of neutrons. The data are
recommended to be used as a cross-section ratio shape. A discussion of the
status of the absolute normalization and comparisons to ENDF evaluations and
previous measurements is included.
","[{""version"":""v1"",""created"":""Tue, 6 Jul 2021 20:44:14 GMT""}]","2021-07-08"
"2107.02882","\'Edouard Bonnet","\'Edouard Bonnet, Eun Jung Kim, Amadeus Reinald, St\'ephan Thomass\'e,
  R\'emi Watrigant","Twin-width and polynomial kernels","32 pages, 11 figures",,,,"cs.DS cs.CC cs.DM math.CO","http://arxiv.org/licenses/nonexclusive-distrib/1.0/","  We study the existence of polynomial kernels, for parameterized problems
without a polynomial kernel on general graphs, when restricted to graphs of
bounded twin-width. Our main result is that a polynomial kernel for
$k$-Dominating Set on graphs of twin-width at most 4 would contradict a
standard complexity-theoretic assumption. The reduction is quite involved,
especially to get the twin-width upper bound down to 4, and can be tweaked to
work for Connected $k$-Dominating Set and Total $k$-Dominating Set (albeit with
a worse upper bound on the twin-width). The $k$-Independent Set problem admits
the same lower bound by a much simpler argument, previously observed [ICALP
'21], which extends to $k$-Independent Dominating Set, $k$-Path, $k$-Induced
Path, $k$-Induced Matching, etc. On the positive side, we obtain a simple
quadratic vertex kernel for Connected $k$-Vertex Cover and Capacitated
$k$-Vertex Cover on graphs of bounded twin-width. Interestingly the kernel
applies to graphs of Vapnik-Chervonenkis density 1, and does not require a
witness sequence. We also present a more intricate $O(k^{1.5})$ vertex kernel
for Connected $k$-Vertex Cover. Finally we show that deciding if a graph has
twin-width at most 1 can be done in polynomial time, and observe that most
optimization/decision graph problems can be solved in polynomial time on graphs
of twin-width at most 1.
","[{""version"":""v1"",""created"":""Tue, 6 Jul 2021 20:46:27 GMT""},{""version"":""v2"",""created"":""Tue, 14 Sep 2021 15:08:21 GMT""}]","2021-09-15"
"2107.02884","Vismika Ranasinghe","Vismika Ranasinghe, Nandana Rajatheva, Matti Latva-aho","Graph Neural Network Based Access Point Selection for Cell-Free Massive
  MIMO Systems",,,,,"cs.IT math.IT","http://arxiv.org/licenses/nonexclusive-distrib/1.0/","  A graph neural network (GNN) based access point (AP) selection algorithm for
cell-free massive multiple-input multiple-output (MIMO) systems is proposed.
Two graphs, a homogeneous graph which includes only AP nodes representing the
structure of the APs in the network, and a heterogeneous graph which includes
both AP nodes and user equipment (UE) nodes are constructed to represent a
cell-free massive MIMO network. A GNN based on the inductive graph learning
framework GraphSAGE is used to obtain the embeddings which are then used to
predict the links between the nodes. The numerical results show that compared
to the proximity-based AP selection algorithms, the proposed GNN based
algorithm predicts the potential APs with more accuracy. Compared to the large
scale fading coefficient based AP selection algorithms, the proposed algorithm
does not require measured and sorted signal strengths of all the neighbouring
APs. Furthermore, the proposed algorithm is scalable in terms of the number of
users in the cell-free system.
","[{""version"":""v1"",""created"":""Tue, 6 Jul 2021 20:49:14 GMT""},{""version"":""v2"",""created"":""Mon, 27 Sep 2021 06:31:02 GMT""}]","2021-09-28"
"2107.02887","Macy Huston","Julia LaFond, Jason T. Wright, Macy J. Huston","Furthering a Comprehensive SETI Bibliography","7 pages, 3 figures, accepted to JBIS","JBIS 74 (2021) 252-255",,,"cs.DL astro-ph.IM","http://creativecommons.org/licenses/by-nc-nd/4.0/","  In 2019, Reyes & Wright used the NASA Astrophysics Data System (ADS) to
initiate a comprehensive bibliography for SETI accessible to the public. Since
then, updates to the library have been incomplete, partly due to the difficulty
in managing the large number of false positive publications generated by
searching ADS using simple search terms. In preparation for a recent update,
the scope of the library was revised and reexamined. The scope now includes
social sciences and commensal SETI. Results were curated based on five SETI
keyword searches: ""SETI"", ""technosignature"", ""Fermi Paradox,"" ""Drake Equation"",
and ""extraterrestrial intelligence."" These keywords returned 553 publications
that merited inclusion in the bibliography that were not previously present. A
curated library of false positive results is now concurrently maintained to
facilitate their exclusion from future searches. A search query and workflow
was developed to capture nearly all SETI-related papers indexed by ADS while
minimizing false positives. These tools will enable efficient, consistent
updates of the SETI library by future curators, and could be adopted for other
bibliography projects as well.
","[{""version"":""v1"",""created"":""Tue, 6 Jul 2021 20:55:03 GMT""}]","2021-08-06"
"2107.02888","Riccardo Saulle","Nickolas Gagnon, Riccardo D. Saulle, Henrik W. Zaunbrecher","Decreasing Incomes Increase Selfishness",,,,,"econ.GN q-fin.EC","http://arxiv.org/licenses/nonexclusive-distrib/1.0/","  We use a controlled laboratory experiment to study the causal impact of
income decreases within a time period on redistribution decisions at the end of
that period, in an environment where we keep fixed the sum of incomes over the
period. First, we investigate the effect of a negative income trend
(intra-personal decrease), which means a decreasing income compared to one's
recent past. Second, we investigate the effect ofa negative income trend
relative to the income trend of another person (inter-personal decrease). If
intra-personal or inter-personal decreases create dissatisfaction for an
individual, that person may become more selfish to obtain compensation. We
formal-ize both effects in a multi-period model augmenting a standard model of
inequality aversion. Overall, conditional on exhibiting sufficiently-strong
social preferences, we find that individuals indeed behave more selfishly when
they experience decreasing incomes. While many studies examine the effect of
income inequality on redistribution decisions, we delve into the history behind
one's income to isolate the effect of income changes.
","[{""version"":""v1"",""created"":""Tue, 6 Jul 2021 20:57:32 GMT""}]","2021-07-08"
"2107.02890","Raz Saremi","Hamid Shamszare, Razieh Saremi, Sanam Jena","From Zero to The Hero: A Collaborative Market Aware Recommendation
  System for Crowd Workers","11 pages, 7 figures, 4 tables",,,,"cs.SE cs.HC cs.LG cs.SI","http://arxiv.org/licenses/nonexclusive-distrib/1.0/","  The success of software crowdsourcing depends on active and trustworthy pool
of worker supply. The uncertainty of crowd workers' behaviors makes it
challenging to predict workers' success and plan accordingly. In a competitive
crowdsourcing marketplace, competition for success over shared tasks adds
another layer of uncertainty in crowd workers' decision-making process.
Preliminary analysis on software worker behaviors reveals an alarming task
dropping rate of 82.9%. These factors lead to the need for an automated
recommendation system for CSD workers to improve the visibility and
predictability of their success in the competition. To that end, this paper
proposes a collaborative recommendation system for crowd workers. The proposed
recommendation system method uses five input metrics based on workers'
collaboration history in the pool, workers' preferences in taking tasks in
terms of monetary prize and duration, workers' specialty, and workers'
proficiency. The proposed method then recommends the most suitable tasks for a
worker to compete on based on workers' probability of success in the task.
Experimental results on 260 active crowd workers demonstrate that just
following the top three success probabilities of task recommendations, workers
can achieve success up to 86%
","[{""version"":""v1"",""created"":""Tue, 6 Jul 2021 21:02:36 GMT""}]","2021-07-08"
"2107.02907","Dylan Losey","Dylan P. Losey, Hong Jun Jeon, Mengxi Li, Krishnan Srinivasan, Ajay
  Mandlekar, Animesh Garg, Jeannette Bohg and Dorsa Sadigh","Learning Latent Actions to Control Assistive Robots",,,,,"cs.RO","http://arxiv.org/licenses/nonexclusive-distrib/1.0/","  Assistive robot arms enable people with disabilities to conduct everyday
tasks on their own. These arms are dexterous and high-dimensional; however, the
interfaces people must use to control their robots are low-dimensional.
Consider teleoperating a 7-DoF robot arm with a 2-DoF joystick. The robot is
helping you eat dinner, and currently you want to cut a piece of tofu. Today's
robots assume a pre-defined mapping between joystick inputs and robot actions:
in one mode the joystick controls the robot's motion in the x-y plane, in
another mode the joystick controls the robot's z-yaw motion, and so on. But
this mapping misses out on the task you are trying to perform! Ideally, one
joystick axis should control how the robot stabs the tofu and the other axis
should control different cutting motions. Our insight is that we can achieve
intuitive, user-friendly control of assistive robots by embedding the robot's
high-dimensional actions into low-dimensional and human-controllable latent
actions. We divide this process into three parts. First, we explore models for
learning latent actions from offline task demonstrations, and formalize the
properties that latent actions should satisfy. Next, we combine learned latent
actions with autonomous robot assistance to help the user reach and maintain
their high-level goals. Finally, we learn a personalized alignment model
between joystick inputs and latent actions. We evaluate our resulting approach
in four user studies where non-disabled participants reach marshmallows, cook
apple pie, cut tofu, and assemble dessert. We then test our approach with two
disabled adults who leverage assistive devices on a daily basis.
","[{""version"":""v1"",""created"":""Tue, 6 Jul 2021 21:07:53 GMT""},{""version"":""v2"",""created"":""Sat, 10 Jul 2021 18:41:39 GMT""}]","2021-07-13"
"2107.02911","Alkis Gotovos","Alkis Gotovos, Rebekka Burkholz, John Quackenbush, and Stefanie
  Jegelka","Scaling up Continuous-Time Markov Chains Helps Resolve
  Underspecification",,,,,"cs.LG stat.ML","http://creativecommons.org/licenses/by/4.0/","  Modeling the time evolution of discrete sets of items (e.g., genetic
mutations) is a fundamental problem in many biomedical applications. We
approach this problem through the lens of continuous-time Markov chains, and
show that the resulting learning task is generally underspecified in the usual
setting of cross-sectional data. We explore a perhaps surprising remedy:
including a number of additional independent items can help determine time
order, and hence resolve underspecification. This is in sharp contrast to the
common practice of limiting the analysis to a small subset of relevant items,
which is followed largely due to poor scaling of existing methods. To put our
theoretical insight into practice, we develop an approximate likelihood
maximization method for learning continuous-time Markov chains, which can scale
to hundreds of items and is orders of magnitude faster than previous methods.
We demonstrate the effectiveness of our approach on synthetic and real cancer
data.
","[{""version"":""v1"",""created"":""Tue, 6 Jul 2021 21:14:49 GMT""}]","2021-07-08"
"2107.02912","Ankit Shah","Ankit Shah, Pritish Kamath, Shen Li, Patrick Craven, Kevin Landers,
  Kevin Oden, Julie Shah","Supervised Bayesian Specification Inference from Demonstrations",,,,,"cs.AI cs.LG cs.RO","http://arxiv.org/licenses/nonexclusive-distrib/1.0/","  When observing task demonstrations, human apprentices are able to identify
whether a given task is executed correctly long before they gain expertise in
actually performing that task. Prior research into learning from demonstrations
(LfD) has failed to capture this notion of the acceptability of a task's
execution; meanwhile, temporal logics provide a flexible language for
expressing task specifications. Inspired by this, we present Bayesian
specification inference, a probabilistic model for inferring task specification
as a temporal logic formula. We incorporate methods from probabilistic
programming to define our priors, along with a domain-independent likelihood
function to enable sampling-based inference. We demonstrate the efficacy of our
model for inferring specifications, with over 90% similarity observed between
the inferred specification and the ground truth, both within a synthetic domain
and during a real-world table setting task.
","[{""version"":""v1"",""created"":""Tue, 6 Jul 2021 21:16:37 GMT""}]","2021-07-08"
"2107.02913","Siming He","Yishu Gong and Siming He and Alexander Kiselev","Random search in fluid flow aided by chemotaxis",,,,,"math.PR math.AP","http://arxiv.org/licenses/nonexclusive-distrib/1.0/","  In this paper, we consider the dynamics of a 2D target-searching agent
performing Brownian motion under the influence of fluid shear flow and chemical
attraction. The analysis is motivated by numerous situations in biology where
these effects are present, such as broadcast spawning of marine animals and
other reproduction processes or workings of the immune systems. We rigorously
characterize the limit of the expected hit time in the large flow amplitude
limit as corresponding to the effective one-dimensional problem. We also
perform numerical computations to characterize the finer properties of the
expected duration of the search. The numerical experiments show many
interesting features of the process, and in particular existence of the optimal
value of the shear flow that minimizes the expected target hit time and
outperforms the large flow limit.
","[{""version"":""v1"",""created"":""Tue, 6 Jul 2021 21:17:28 GMT""},{""version"":""v2"",""created"":""Fri, 27 May 2022 18:56:56 GMT""}]","2022-05-31"
"2107.02914","David Lowry-Duda","Theresa C. Anderson, Ayla Gafni, Robert J. Lemke Oliver, David
  Lowry-Duda, George Shakan, Ruixiang Zhang","Quantitative Hilbert irreducibility and almost prime values of
  polynomial discriminants","Minor revisions",,,,"math.NT","http://arxiv.org/licenses/nonexclusive-distrib/1.0/","  We study two polynomial counting questions in arithmetic statistics via a
combination of Fourier analytic and arithmetic methods. First, we obtain new
quantitative forms of Hilbert's Irreducibility Theorem for degree $n$
polynomials $f$ with $\mathrm{Gal}(f) \subseteq A_n$. We study this both for
monic polynomials and non-monic polynomials. Second, we study lower bounds on
the number of degree $n$ monic polynomials with almost prime discriminants, as
well as the closely related problem of lower bounds on the number of degree $n$
number fields with almost prime discriminants.
","[{""version"":""v1"",""created"":""Tue, 6 Jul 2021 21:19:20 GMT""},{""version"":""v2"",""created"":""Wed, 14 Jul 2021 16:15:43 GMT""},{""version"":""v3"",""created"":""Wed, 15 Sep 2021 16:17:02 GMT""}]","2021-09-16"
