"2107.03050","Nayyer Aafaq Mr.","Nayyer Aafaq, Naveed Akhtar, Wei Liu, Mubarak Shah and Ajmal Mian","Controlled Caption Generation for Images Through Adversarial Attacks",,,,,"cs.CV cs.LG","http://creativecommons.org/publicdomain/zero/1.0/","  Deep learning is found to be vulnerable to adversarial examples. However, its
adversarial susceptibility in image caption generation is under-explored. We
study adversarial examples for vision and language models, which typically
adopt an encoder-decoder framework consisting of two major components: a
Convolutional Neural Network (i.e., CNN) for image feature extraction and a
Recurrent Neural Network (RNN) for caption generation. In particular, we
investigate attacks on the visual encoder's hidden layer that is fed to the
subsequent recurrent network. The existing methods either attack the
classification layer of the visual encoder or they back-propagate the gradients
from the language model. In contrast, we propose a GAN-based algorithm for
crafting adversarial examples for neural image captioning that mimics the
internal representation of the CNN such that the resulting deep features of the
input image enable a controlled incorrect caption generation through the
recurrent network. Our contribution provides new insights for understanding
adversarial attacks on vision systems with language component. The proposed
method employs two strategies for a comprehensive evaluation. The first
examines if a neural image captioning system can be misled to output targeted
image captions. The second analyzes the possibility of keywords into the
predicted captions. Experiments show that our algorithm can craft effective
adversarial images based on the CNN hidden layers to fool captioning framework.
Moreover, we discover the proposed attack to be highly transferable. Our work
leads to new robustness implications for neural image captioning.
","[{""version"":""v1"",""created"":""Wed, 7 Jul 2021 07:22:41 GMT""}]","2021-07-08"
"2107.03051","Shinnosuke Okawa","Akira Ishii, Shinnosuke Okawa, Hokuto Uehara","Exceptional collections on $\Sigma _{ 2 }$","43 pages",,,,"math.AG","http://creativecommons.org/licenses/by/4.0/","  Structure theorems for exceptional objects and exceptional collections of the
bounded derived category of coherent sheaves on del Pezzo surfaces are
established by Kuleshov and Orlov. In this paper we propose conjectures which
generalize these results to weak del Pezzo surfaces. Unlike del Pezzo surfaces,
an exceptional object on a weak del Pezzo surface is not necessarily a shift of
a sheaf and is not determined by its class in the Grothendieck group. Our
conjectures explain how these complications are taken care of by spherical
twists, the categorification of $(-2)$-reflections acting on the derived
category.
  This paper is devoted to solving the conjectures for the prototypical weak
del Pezzo surface $\Sigma _{ 2 }$, the Hirzebruch surface of degree $2$.
Specifically, we prove the following results: Any exceptional object is sent to
the shift of the uniquely determined exceptional vector bundle by a product of
spherical twists which acts trivially on the Grothendieck group of the derived
category. Any exceptional collection on $\Sigma _{ 2 }$ is part of a full
exceptional collection. We moreover prove that the braid group on $4$ strands
acts transitively on the set of exceptional collections of length $4$ (up to
shifts).
","[{""version"":""v1"",""created"":""Wed, 7 Jul 2021 07:28:47 GMT""}]","2021-07-08"
"2107.03052","Matthias Dodenh\""oft M.Sc.","Matthias Dodenh\""oft and Sebastian Vohburger and Christoph
  Hugenschmidt","Total-Reflection High-Energy Positron Diffractometer at NEPOMUC --
  Instrumentation, Simulation and First Measurements","10 pages, 6 figures","Rev. Sci. Instrum. 92 115103 (2021)","10.1063/5.0062412",,"physics.ins-det","http://arxiv.org/licenses/nonexclusive-distrib/1.0/","  We report the instrumentation of a new positron diffractometer that is
connected to the high-intensity positron source NEPOMUC. Crucial elements for
the adaption of the positron beam are presented, which include the magnetic
field termination, the optional transmission-type remoderator for brightness
enhancement and the electrostatic system for acceleration and beam optics. The
positron trajectories of the remoderated and the twofold remoderated beam have
been simulated to optimize the system, i.e. to obtain a coherent beam of small
diameter. Within a first beamtime we tuned the system and characterized the
direct beam. For the twofold remoderated beam of 10keV energy, we
experimentally observe a beam diameter of d < 1.3mm, which agrees well with the
simulation.
","[{""version"":""v1"",""created"":""Wed, 7 Jul 2021 07:29:23 GMT""}]","2021-11-05"
"2107.03053","Harkirat Singh Dr.","Basit Iqbal, Harkirat Singh","Identification of Desired Pixels in an Image Using Grover's Quantum
  Search Algorithm","11 Pages",,,,"quant-ph","http://arxiv.org/licenses/nonexclusive-distrib/1.0/","  Quantum Information Theory promises to speed up computation so is observed in
real quantum computers as proved to its classical counterpart. This
revolutionizes every field linked directly or indirectly with computation.
Grover algorithm in quantum information gives quadratic speed up in
unstructured database search. With the availability of public online resources
for quantum computers like IBM, quantum image processing came into the picture
for making use of quantum computers in the image processing field. Our research
interest is to find all darker pixels in a 2x2 grayscale image using Grover's
algorithm. We studied it in two different ways. In the first method, I ran
Grover's algorithm on the python generated classical image. In the second
method, I converted a python-generated 2x2 image into a quantum image and then
ran Grover's algorithm to locate the darker pixels. As has been observed in
complexity analysis, Grover's unstructured search has the O(2^{n}) while as for
classical schemes O(2^{2n+2m}), where m and n denote the dimensions of the
image.
","[{""version"":""v1"",""created"":""Wed, 7 Jul 2021 07:30:21 GMT""}]","2021-07-08"
"2107.03054","Xueyuan Lin","Xueyuan Lin, Haihong E, Wenyu Song, Haoran Luo","EchoEA: Echo Information between Entities and Relations for Entity
  Alignment",,,,,"cs.CL cs.AI","http://arxiv.org/licenses/nonexclusive-distrib/1.0/","  Entity alignment (EA) plays an important role in automatically integrating
knowledge graphs (KGs) from multiple sources. Recent approaches based on Graph
Neural Network (GNN) obtain entity representation from relation information and
have achieved promising results. Besides, more and more methods introduce
semi-supervision to ask for more labeled training data. However, two challenges
still exist in GNN-based EA methods: (1) Deeper GNN Encoder: The GNN encoder of
current methods has limited depth (usually 2-layers). (2) Low-quality
Bootstrapping: The generated semi-supervised data is of low quality. In this
paper, we propose a novel framework, Echo Entity Alignment (EchoEA), which
leverages 4-levels self-attention mechanism to spread entity information to
relations and echo back to entities. Furthermore, we propose attribute-combined
bi-directional global-filtered strategy (ABGS) to improve bootstrapping, reduce
false samples and generate high-quality training data. The experimental results
on three real-world cross-lingual datasets are stable at around 96\% at hits@1
on average, showing that our approach not only significantly outperforms the
state-of-the-art GNN-based methods, but also is universal and transferable for
existing EA methods.
","[{""version"":""v1"",""created"":""Wed, 7 Jul 2021 07:34:21 GMT""},{""version"":""v2"",""created"":""Mon, 25 Oct 2021 03:00:15 GMT""}]","2021-10-26"
"2107.03055","Anran Liu","Anran Liu, Yihao Liu, Jinjin Gu, Yu Qiao, Chao Dong","Blind Image Super-Resolution: A Survey and Beyond",,,,,"cs.CV","http://arxiv.org/licenses/nonexclusive-distrib/1.0/","  Blind image super-resolution (SR), aiming to super-resolve low-resolution
images with unknown degradation, has attracted increasing attention due to its
significance in promoting real-world applications. Many novel and effective
solutions have been proposed recently, especially with the powerful deep
learning techniques. Despite years of efforts, it still remains as a
challenging research problem. This paper serves as a systematic review on
recent progress in blind image SR, and proposes a taxonomy to categorize
existing methods into three different classes according to their ways of
degradation modelling and the data used for solving the SR model. This taxonomy
helps summarize and distinguish among existing methods. We hope to provide
insights into current research states, as well as to reveal novel research
directions worth exploring. In addition, we make a summary on commonly used
datasets and previous competitions related to blind image SR. Last but not
least, a comparison among different methods is provided with detailed analysis
on their merits and demerits using both synthetic and real testing images.
","[{""version"":""v1"",""created"":""Wed, 7 Jul 2021 07:38:14 GMT""}]","2021-07-08"
"2107.03056","Erkan Zergeroglu","Samet Gul, Erkan Zergeroglu and Enver Tatlicioglu","Position Constrained, Adaptive Control of Robotic Manipulators without
  Velocity Measurements","10 pages, 3 figures",,,,"eess.SY cs.SY","http://arxiv.org/licenses/nonexclusive-distrib/1.0/","  This work presents the design and the corresponding stability analysis of a
model based, joint position tracking error constrained, adaptive output
feedback controller for robot manipulators. Specifically, provided that the
initial joint position tracking error starts within a predefined region, the
proposed controller algorithm ensures that the joint tracking error remains
inside this region and asymptotically approaches to zero, despite the lack of
joint velocity measurements and uncertainties associated with the system
dynamics. The need for the joint velocity measurements are removed via the use
of a surrogate filter formulation in conjunction with the use of desired model
compensation. The stability and the convergence of the closed loop system are
proved via a barrier Lyapunov function based argument. A simulation performed
on a two-link robotic manipulator is provided in order to illustrate the
feasibility and effectiveness of the proposed method.
","[{""version"":""v1"",""created"":""Wed, 7 Jul 2021 07:40:06 GMT""}]","2021-07-08"
"2107.03057","Furong Yang","Furong Yang (1 and 2 and 3), Qinghua Wu (1), Zhenyu Li (1), Yanmei Liu
  (4), Giovanni Pau (5 and 6), Gaogang Xie (7) ((1) ICT/CAS, (2) UCAS, (3)
  Sorbonne University, (4) Alibaba Group, (5) University of Bologna, (6) UCLA,
  (7) CNIC/CAS)","BBRv2+:Towards Balancing Aggressiveness and Fairness with Delay-based
  Bandwidth Probing","Submitted to Computer Networks (under review)",,,,"cs.NI","http://arxiv.org/licenses/nonexclusive-distrib/1.0/","  BBRv2, proposed by Google, aims at addressing BBR's shortcomings of
unfairness against loss-based congestion control algorithms (CCAs) and
excessive retransmissions in shallow-buffered networks. In this paper, we first
comprehensively study BBRv2's performance under various network conditions and
show that BBRv2 mitigates the shortcomings of BBR. Nevertheless, BBRv2's
benefits come with several costs, including the slow responsiveness to
bandwidth dynamics as well as the low resilience to random losses. We then
propose BBRv2+ to address BBRv2's performance issues without sacrificing its
advantages over BBR. To this end, BBRv2+ incorporates delay information into
its path model, which cautiously guides the aggressiveness of its bandwidth
probing to not reduce its fairness against loss-based CCAs. BBRv2+ also
integrates mechanisms for improved resilience to random losses as well as
network jitters. Extensive experiments demonstrate the effectiveness of BBRv2+.
Especially, it achieves 25% higher throughput and comparable queuing delay in
comparison with BBRv2 in high-mobility network scenarios.
","[{""version"":""v1"",""created"":""Wed, 7 Jul 2021 07:40:31 GMT""}]","2021-07-08"
"2107.03058","Wenwen Cui Dr.","Shicong Ding, Pan Zhang, Kang Yang, Cailong Liu, Jian Hao, Wenwen Cui,
  Jingming Shi, and Yinwei Li","Seven-coordinated Silicon in a SiO2He Compound Formed under the Extreme
  Conditions of Planetary Interiors",,,,,"cond-mat.mtrl-sci cond-mat.other","http://creativecommons.org/licenses/by/4.0/","  Changes in atomic coordination numbers at high pressures are fundamental to
condensed-matter physics because they initiate the emergence of unexpected
structures and phenomena. Silicon is capable of forming eight-, nine-, and
ten-coordinated structures under compression,in addition to the usual
six-coordinated structures. The missing seven-coordinated silicon remains an
open question, but here our theoretical study provides evidence for its
existence at high pressures. A combination of a crystal-structure prediction
method and first-principles calculations allowed prediction of a stable SiO2He
compound containing unique SiO7 polyhedrons, which is a configuration unknown
in any proposed silica phase. Consequently, seven-coordinated SiO7 is a
possible form of silica at high pressures. Further calculations indicate that
the SiO2He phase remains energetically stable with a solid character over a
wide range of pressures exceeding 607 GPa and temperatures of 0-9000 K,
covering the extreme conditions of the core-mantle boundary in super-Earth
exoplanets, or even the Solar System's ice giant planets. Our results may
provide theoretical guidance for the discovery of other silicides at high
pressures, promote the exploration of materials at planetary core-mantle
boundaries, and enable planetary models to be refined.
","[{""version"":""v1"",""created"":""Wed, 7 Jul 2021 07:43:06 GMT""}]","2021-07-08"
"2107.03059","Amin Azari","Mojtaba Vaezi, Amin Azari, Saeed R. Khosravirad, Mahyar
  Shirvanimoghaddam, M. Mahdi Azari, Danai Chasaki, and Petar Popovski","Cellular, Wide-Area, and Non-Terrestrial IoT: A Survey on 5G Advances
  and the Road Towards 6G","Submitted for review to IEEE CS&T","2021",,,"cs.NI eess.SP","http://creativecommons.org/licenses/by/4.0/","  The next wave of wireless technologies is proliferating in connecting things
among themselves as well as to humans. In the era of the Internet of things
(IoT), billions of sensors, machines, vehicles, drones, and robots will be
connected, making the world around us smarter. The IoT will encompass devices
that must wirelessly communicate a diverse set of data gathered from the
environment for myriad new applications. The ultimate goal is to extract
insights from this data and develop solutions that improve quality of life and
generate new revenue. Providing large-scale, long-lasting, reliable, and near
real-time connectivity is the major challenge in enabling a smart connected
world. This paper provides a comprehensive survey on existing and emerging
communication solutions for serving IoT applications in the context of
cellular, wide-area, as well as non-terrestrial networks. Specifically,
wireless technology enhancements for providing IoT access in fifth-generation
(5G) and beyond cellular networks, and communication networks over the
unlicensed spectrum are presented. Aligned with the main key performance
indicators of 5G and beyond 5G networks, we investigate solutions and standards
that enable energy efficiency, reliability, low latency, and scalability
(connection density) of current and future IoT networks. The solutions include
grant-free access and channel coding for short-packet communications,
non-orthogonal multiple access, and on-device intelligence. Further, a vision
of new paradigm shifts in communication networks in the 2030s is provided, and
the integration of the associated new technologies like artificial
intelligence, non-terrestrial networks, and new spectra is elaborated. Finally,
future research directions toward beyond 5G IoT networks are pointed out.
","[{""version"":""v1"",""created"":""Wed, 7 Jul 2021 07:44:44 GMT""}]","2021-07-08"
"2107.03060","Soumyakanti Bose","Soumyakanti Bose, Hyunseok Jeong","Quantum teleportation of hybrid qubits and single-photon qubits using
  Gaussian resources",,,"10.1103/PhysRevA.105.032434",,"quant-ph","http://arxiv.org/licenses/nonexclusive-distrib/1.0/","  In this paper, we compare single-photon qubits and hybrid qubits as
information carriers through quantum teleportation using a Gaussian
continuous-variable channel. A hybrid qubit in our study is in the form of
entanglement between a coherent state and a single photon. We find that hybrid
qubits outperform photonic qubits when coherent amplitudes of the hybrid qubits
are as low as $\alpha\lesssim 1$, while photonic qubits yield better results
for larger amplitudes. We analyze effects of photon losses, and observe that
the overall character of teleportation for different qubits remains the same
although the teleportation fidelities are degraded by photon losses. Our work
provides a comparative look at practical quantum information processing with
different types of qubits.
","[{""version"":""v1"",""created"":""Wed, 7 Jul 2021 07:44:45 GMT""}]","2022-04-06"
"2107.03061","Mourad Choulli","Mourad Choulli","Comments on the determination of the conductivity at the boundary from
  the Dirichlet-to-Neumann map",,,,,"math.AP","http://arxiv.org/licenses/nonexclusive-distrib/1.0/","  We revisit the stability issue of determining the conductivity at the
boundary from the corresponding Dirichlet-to-Neumann map. We discuss both the
method based on singular solutions and the one built on the localized
oscillating solutions. Our primary objective is not establishing new results on
this subject even if the present work contains some new ones. We mainly clarify
some points in the existing proofs and make some comments. We also derive some
consequences of the stability inequality of the determination of the
conductivity at the boundary from the Dirichlet-to-Neumann map.
","[{""version"":""v1"",""created"":""Wed, 7 Jul 2021 07:49:43 GMT""},{""version"":""v2"",""created"":""Wed, 29 Dec 2021 07:35:33 GMT""}]","2021-12-30"
"2107.03062","Salvatore Esposito","Salvatore Esposito","From England to Italy: the intriguing story of Poli's engine for the
  King of Naples","25 pages, 6 figures",,"10.1007/s00016-021-00277-1",,"physics.hist-ph physics.pop-ph physics.soc-ph","http://arxiv.org/licenses/nonexclusive-distrib/1.0/","  An interesting, yet unknown, episode concerning the effective permeation of
the scientific revolution in the XVIII century Kingdom of Naples (and, more
generally, Italy) is recounted. The quite intriguing story of Watt's steam
engine prepared for serving a Royal Estate of the King of Naples in Carditello
reveals a fascinating piece of the history of that Kingdom, as well as an
unknown step in the history of Watt's steam engine, whose final entrepreneurial
success for the celebrated Boulton & Watt company was a direct consequence.
That story unveils that, contrary to what claimed in the literature, the first
introduction in Italy of the most important technological innovation of the
XVIII century did not take place with the construction of the first steamship
of the Mediterranean Sea, but rather 30 years before that, thanks to the
incomparable work of Giuseppe Saverio Poli, a leading scholar and a very
influential figure in the Kingdom of Naples. The tragic epilogue of Poli's
engine testifies for its vanishing in the historical memory.
","[{""version"":""v1"",""created"":""Wed, 7 Jul 2021 07:51:21 GMT""}]","2021-11-03"
"2107.03063","Gang-Feng Wang","X. M. Liang and G. F. Wang","A Friction Model of Fractal Rough Surfaces Accounting for Size
  Dependence at Nanoscale","31 pages, 10 figures","Acta Mechanica 2022, 233,1233","10.1007/s00707-021-03109-y",,"cond-mat.mtrl-sci","http://creativecommons.org/licenses/by/4.0/","  Traditional laws of friction believe that the friction coefficient of two
specific solids takes constant value. However, molecular simulations revealed
that the friction coefficient of nanosized asperity depends strongly on contact
size and asperity radius. Since contacting surfaces are always rough consisting
of asperities varying dramatically in geometric size, a theoretical model is
developed to predict the friction behavior of fractal rough surfaces in this
work. The result of atomic-scale simulations of sphere-on-flat friction is
summarized into a uniform expression. Then, the size dependent feature of
friction at nanoscale is incorporated into the analysis of fractal rough
surfaces. The obtained results display the dependence of friction coefficient
on roughness, material properties and load. It is revealed that the friction
coefficient decreases with increasing contact area or external load. This model
gives a theoretical guideline for the prediction of friction coefficient and
the design of friction pairs.
","[{""version"":""v1"",""created"":""Wed, 7 Jul 2021 07:54:31 GMT""}]","2022-08-01"
"2107.03064","Gauthier Leterrier","Gauthier Leterrier","On the Mordell--Weil lattice of $y^2 = x^3 + b x + t^{3^n + 1}$ in
  characteristic $3$","v2: Minor revisions. Comments are welcome. 23 pages","Research in Number Theory, volume 8, Article number 23 (2022)","10.1007/s40993-022-00321-0",,"math.NT","http://creativecommons.org/licenses/by/4.0/","  We study the elliptic curves given by $y^2 = x^3 + b x + t^{3^n+1}$ over
global function fields of characteristic $3$; in particular we perform an
explicit computation of the $L$-function by relating it to the zeta function of
a certain superelliptic curve $u^3 + b u = v^{3^n + 1}$.
  In this way, using the N\'eron-Tate height on the Mordell--Weil group, we
obtain lattices in dimension $2 \cdot 3^n$ for every $n \geq 1$, which improve
on the currently best known sphere packing densities in dimensions 162 (case
$n=4$) and 486 (case $n=5$). For $n=3$, the construction has the same packing
density as the best currently known sphere packing in dimension $54$, and for
$n=1$ it has the same density as the lattice $E_6$ in dimension $6$.
","[{""version"":""v1"",""created"":""Wed, 7 Jul 2021 07:59:04 GMT""},{""version"":""v2"",""created"":""Sun, 27 Mar 2022 07:31:58 GMT""}]","2022-03-29"
"2107.03065","Qinghua Wu","Qinghua Wu, Quanbo Shen, Jian Luan, YuJun Wang","Msdtron: a high-capability multi-speaker speech synthesis system for
  diverse data using characteristic information","Accepted by ICASSP-2022",,,,"cs.SD eess.AS","http://arxiv.org/licenses/nonexclusive-distrib/1.0/","  In multi-speaker speech synthesis, data from a number of speakers usually
tend to have great diversity due to the fact that the speakers may differ
largely in ages, speaking styles, emotions, and so on. It is important but
challenging to improve the modeling capabilities for multi-speaker speech
synthesis. To address the issue, this paper proposes a high-capability speech
synthesis system, called Msdtron, in which 1) a representation of the harmonic
structure of speech, called excitation spectrogram, is designed to directly
guide the learning of harmonics in mel-spectrogram. 2) conditional gated LSTM
(CGLSTM) is proposed to control the flow of text content information through
the network by re-weighting the gates of LSTM using speaker information. The
experiments show a significant reduction in reconstruction error of
mel-spectrogram in the training of the multi-speaker model, and a great
improvement is observed in the subjective evaluation of speaker adapted model.
","[{""version"":""v1"",""created"":""Wed, 7 Jul 2021 08:00:58 GMT""},{""version"":""v2"",""created"":""Thu, 8 Jul 2021 07:21:40 GMT""},{""version"":""v3"",""created"":""Tue, 28 Sep 2021 12:13:03 GMT""},{""version"":""v4"",""created"":""Fri, 11 Feb 2022 06:50:42 GMT""}]","2022-02-14"
