"2107.03203","Zeren Simon Wang","Kingman Cheung, Kechen Wang, Zeren Simon Wang","Time-delayed electrons from neutral currents at the LHC","v1: 13 pages, 13 figures, 1 table; v2: added notes about the history
  of the timing technique after publication, no change otherwise",,"10.1007/JHEP09(2021)026",,"hep-ph","http://arxiv.org/licenses/nonexclusive-distrib/1.0/","  We investigate long-lived particles (LLPs) produced in pair from neutral
currents and decaying into a displaced electron plus two jets at the LHC,
utilizing the proposed minimum ionizing particle timing detector at CMS. We
study two benchmark models: the R-parity-violating supersymmetry with the
lightest neutralinos being the lightest supersymmetric particle and two
different $U(1)$ extensions of the standard model with heavy neutral leptons
(HNLs). The light neutralinos are produced from the standard model $Z$-boson
decays via small Higgsino components, and the HNLs arise from decays of a heavy
gauge boson, $Z'$. By simulating the signal processes at the HL-LHC with the
center-of-mass energy $\sqrt{s}=$ 14 TeV and integrated luminosity of 3
ab$^{-1}$, our analyses indicate that the search strategy based on a timing
trigger and the final state kinematics has the potential to probe the parameter
space that is complementary to other traditional LLP search strategies such as
those based on the displaced vertex.
","[{""version"":""v1"",""created"":""Wed, 7 Jul 2021 13:19:50 GMT""},{""version"":""v2"",""created"":""Thu, 18 Nov 2021 12:13:22 GMT""}]","2021-11-19"
"2107.03204","Yujin Cho","Yujin Cho, Jin Ho Kang, Liangbo Liang, Xiangru Kong, Subhajit Ghosh,
  Fariborz Kargar, Chaowei Hu, Alexander A. Balandin, Alexander A. Puretzky, Ni
  Ni and Chee Wei Wong","Phonon modes and Raman signatures of MnBi2nTe3n+1 (n=1,2,3,4) magnetic
  topological heterostructures","9 pages, 4 figures",,,,"cond-mat.mtrl-sci physics.optics","http://creativecommons.org/licenses/by-nc-nd/4.0/","  An intrinsic antiferromagnetic topological insulator $\mathrm{MnBi_2Te_4}$
can be realized by intercalating Mn-Te bilayer chain in a topological
insulator, $\mathrm{Bi_2Te_3}$. $\mathrm{MnBi_2Te_4}$ provides not only a
stable platform to demonstrate exotic physical phenomena, but also easy
tunability of the physical properties. For example, inserting more
$\mathrm{Bi_2Te_3}$ layers in between two adjacent $\mathrm{MnBi_2Te_4}$
weakens the interlayer magnetic interactions between the $\mathrm{MnBi_2Te_4}$
layers. Here we present the first observations on the inter- and intra-layer
phonon modes of $\mathrm{MnBi_{2n}Te_{3n+1}}$ (n=1,2,3,4) using cryogenic
low-frequency Raman spectroscopy. We experimentally and theoretically
distinguish the Raman vibrational modes using various polarization
configurations. The two peaks at 66 cm$^{-1}$ and 112 cm$^{-1}$ show an
abnormal perturbation in the Raman linewidths below the magnetic transition
temperature due to spin-phonon coupling. In $\mathrm{MnBi_4Te_7}$, the
$\mathrm{Bi_2Te_3}$ layers induce Davydov splitting of the A$_{1g}$ mode around
137 cm$^{-1}$ at 5 K. Using the linear chain model, we estimate the
out-of-plane interlayer force constant to be $(3.98 \pm 0.14) \times 10^{19}$
N/m$^3$ at 5 K, three times weaker than that of $\mathrm{Bi_2Te_3}$. Our work
discovers the dynamics of phonon modes of the $\mathrm{MnBi_2Te_4}$ and the
effect of the additional $\mathrm{Bi_2Te_3}$ layers, providing the
first-principles guidance to tailor the physical properties of layered
heterostructures.
","[{""version"":""v1"",""created"":""Wed, 7 Jul 2021 13:20:53 GMT""},{""version"":""v2"",""created"":""Mon, 26 Jul 2021 20:13:40 GMT""}]","2021-07-28"
"2107.03205","Giuseppe Maria Patern\`o","Arianna Magni, Gaia Bondelli, Giuseppe Maria Paterno, Samim Sardar,
  Valentina Sesti, Cosimo DAndrea, Chiara Bertarelli, Guglielmo Lanzani","Azobenzene photoisomerization probes cell membrane nanoviscosity",,,"10.1039/D1CP05881A",,"physics.chem-ph","http://creativecommons.org/licenses/by/4.0/","  The viscosity of cell membranes is a crucial parameter that affects the
diffusion of small molecules both across and within the lipidic membrane and
that is related to several diseases. Therefore, the possibility to measure
quantitatively membrane viscosity on the nanoscale is of great interest. Here,
we report a complete investigation of the photophysics of an amphiphilic
membrane-targeted azobenzene (ZIAPIN2) and we validate its use as viscosity
probe for cell membranes. We exploit ZIAPIN2 the trans-cis photoisomerization
to develop a molecular viscometer and to assess the viscosity of Escherichia
coli bacteria membranes employing time-resolved fluorescence spectroscopy.
Lifetime measurements of ZIAPIN2 in E. coli bacteria suspensions correctly
indicate that membrane viscosity decreases as the samples were heated up. Our
results report a membrane viscosity value in live E. coli cells going from 10
to 5 cP, increasing the temperature from 22 {\deg}C up to 40 {\deg}C.
","[{""version"":""v1"",""created"":""Wed, 7 Jul 2021 13:27:20 GMT""}]","2022-04-27"
"2107.03206","Valentin Decoene","Valentin Decoene, Olivier Martineau-Huynh, Mat\`ias Tueros, Simon
  Chiche","A reconstruction procedure for near horizon extensive air showers based
  on radio signals","8 pages, ICRC2021 proceeding",,"10.22323/1.395.0211",,"astro-ph.IM astro-ph.HE","http://arxiv.org/licenses/nonexclusive-distrib/1.0/","  Very inclined extensive air showers (EAS), with both down-going and up-going
trajectories, are particularly targeted by the next generation of extended
radio arrays, such as GRAND. Methods to reconstruct the incoming direction,
core position, primary energy and composition of showers with these specific
geometries, remain to be developed. Towards that goal, we present a new
reconstruction procedure based on the arrival times and the amplitudes of the
radio signal, measured at each antenna station. This hybrid reconstruction
method, harnesses the fact that the emission is observed, at the antenna level,
far away from the emission region, thus allowing for a point-like emission
description. Thanks to this assumption, the arrival times are modelled
following a spherical wavefront emission, which offers the possibility to
reconstruct the radio emission zone as a fixed point along the shower axis.
From that point the amplitude distribution at the antenna level is described
through an Angular Distribution Function (ADF) taking into account at once all
geo-magnetic asymmetries and early late effects as well as additional signal
asymmetries featured by very inclined EAS. This method shows promising results
in terms of arrival direction reconstruction, within the 0.1{\deg} range, even
when taking into account experimental uncertainties, and interesting potential
for the energy reconstruction and primary composition identification.
","[{""version"":""v1"",""created"":""Wed, 7 Jul 2021 13:30:43 GMT""}]","2022-09-21"
"2107.03207","Yixuan Zhang","Yixuan Zhang, Feng Zhou, Zhidong Li, Yang Wang, Fang Chen","Bias-Tolerant Fair Classification",,,,,"cs.LG cs.CY","http://arxiv.org/licenses/nonexclusive-distrib/1.0/","  The label bias and selection bias are acknowledged as two reasons in data
that will hinder the fairness of machine-learning outcomes. The label bias
occurs when the labeling decision is disturbed by sensitive features, while the
selection bias occurs when subjective bias exists during the data sampling.
Even worse, models trained on such data can inherit or even intensify the
discrimination. Most algorithmic fairness approaches perform an empirical risk
minimization with predefined fairness constraints, which tends to trade-off
accuracy for fairness. However, such methods would achieve the desired fairness
level with the sacrifice of the benefits (receive positive outcomes) for
individuals affected by the bias. Therefore, we propose a
Bias-TolerantFAirRegularizedLoss (B-FARL), which tries to regain the benefits
using data affected by label bias and selection bias. B-FARL takes the biased
data as input, calls a model that approximates the one trained with fair but
latent data, and thus prevents discrimination without constraints required. In
addition, we show the effective components by decomposing B-FARL, and we
utilize the meta-learning framework for the B-FARL optimization. The
experimental results on real-world datasets show that our method is empirically
effective in improving fairness towards the direction of true but latent
labels.
","[{""version"":""v1"",""created"":""Wed, 7 Jul 2021 13:31:38 GMT""}]","2021-07-08"
"2107.03208","Daniel Li","Pascal Lef\`evre (UA), Daniel Li (UA), Herv\'e Queff\'elec, Luis
  Rodriguez-Piazza","Compactification and decompactification by weights on Bergman spaces",,,,,"math.FA","http://arxiv.org/licenses/nonexclusive-distrib/1.0/","  We characterize the symbols $\Phi$ for which there exists a weight w such
that the weighted composition operator M w C $\Phi$ is compact on the weighted
Bergman space B 2 $\alpha$. We also characterize the symbols for which there
exists a weight w such that M w C $\Phi$ is bounded but not compact. We also
investigate when there exists w such that M w C $\Phi$ is Hilbert-Schmidt on B
2 $\alpha$.
","[{""version"":""v1"",""created"":""Wed, 7 Jul 2021 13:32:42 GMT""}]","2021-07-08"
"2107.03209","Maria Arazo","Maria Arazo, Montserrat Guilleumas, Ricardo Mayol, Michele Modugno","Dynamical generation of dark-bright solitons through the domain wall of
  two immiscible Bose-Einstein condensates","7 pages, 5 figures",,"10.1103/PhysRevA.104.043312",,"cond-mat.quant-gas quant-ph","http://arxiv.org/licenses/nonexclusive-distrib/1.0/","  We theoretically investigate the one-dimensional dynamics of a dark soliton
in a two-component immiscible mixture of Bose-Einstein condensates with
repulsive interactions. We analyze the reflection and transmission of a soliton
when it propagates through the domain wall, and we show that a dark-bright
soliton can be dynamically generated by the interaction of the dark soliton
with the domain wall, outside the regime of parameters where stationary
solutions are known to exist. The dynamics of this dark-bright soliton is
harmonic like, with a numerical frequency that is in good agreement with the
predictions of a semi-analytical model.
","[{""version"":""v1"",""created"":""Wed, 7 Jul 2021 13:36:32 GMT""}]","2021-10-26"
"2107.03210","Chengming Bai","Yanyong Hong and Chengming Bai","On antisymmetric infinitesimal conformal bialgebras","25 pages","Journal of Algebra (2021) 586: 325-356",,,"math.QA math-ph math.MP math.RA","http://creativecommons.org/licenses/by/4.0/","  In this paper, we construct a bialgebra theory for associative conformal
algebras, namely antisymmetric infinitesimal conformal bialgebras. On the one
hand, it is an attempt to give conformal structures for antisymmetric
infinitesimal bialgebras. On the other hand, under certain conditions, such
structures are equivalent to double constructions of Frobenius conformal
algebras, which are associative conformal algebras that are decomposed into the
direct sum of another associative conformal algebra and its conformal dual as
$\mathbb{C}[\partial]$-modules such that both of them are subalgebras and the
natural conformal bilinear form is invariant. The coboundary case leads to the
introduction of associative conformal Yang-Baxter equation whose antisymmetric
solutions give antisymmetric infinitesimal conformal bialgebras. Moreover, the
construction of antisymmetric solutions of associative conformal Yang-Baxter
equation is given from $\mathcal{O}$-operators of associative conformal
algebras as well as dendriform conformal algebras.
","[{""version"":""v1"",""created"":""Wed, 7 Jul 2021 13:36:42 GMT""}]","2022-07-14"
"2107.03211","Damian Sobota","Christian Bargetz, Jerzy K\k{a}kol, Damian Sobota","On complemented copies of the space $c_0$ in spaces $C_p(X,E)$","13 pages, comments are welcome!",,,,"math.FA math.GN","http://arxiv.org/licenses/nonexclusive-distrib/1.0/","  We study the question for which Tychonoff spaces $X$ and locally convex
spaces $E$ the space $C_p(X,E)$ of continuous $E$-valued functions on $X$
contains a complemented copy of the space
$(c_0)_p=\{x\in\mathbb{R}^\omega\colon x(n)\to0\}$, both endowed with the
pointwise topology. We provide a positive answer for a vast class of spaces,
extending classical theorems of Cembranos, Freniche, and Doma\'nski and
Drewnowski, proved for the case of Banach and Fr\'echet spaces $C_k(X,E)$.
Also, for given infinite Tychonoff spaces $X$ and $Y$, we show that
$C_p(X,C_p(Y))$ contains a complemented copy of $(c_0)_p$ if and only if any of
the spaces $C_p(X)$ and $C_p(Y)$ contains such a subspace.
","[{""version"":""v1"",""created"":""Wed, 7 Jul 2021 13:37:34 GMT""},{""version"":""v2"",""created"":""Tue, 15 Mar 2022 16:42:04 GMT""}]","2022-03-16"
"2107.03212","Lu Yin","Lu Yin, Vlado Menkovski, Shiwei Liu, Mykola Pechenizkiy","Hierarchical Semantic Segmentation using Psychometric Learning","Accepted by the 13th Asian Conference on Machine Learning (ACML
  2021), 17 pages, 12 figures",,,,"cs.CV cs.AI","http://arxiv.org/licenses/nonexclusive-distrib/1.0/","  Assigning meaning to parts of image data is the goal of semantic image
segmentation. Machine learning methods, specifically supervised learning is
commonly used in a variety of tasks formulated as semantic segmentation. One of
the major challenges in the supervised learning approaches is expressing and
collecting the rich knowledge that experts have with respect to the meaning
present in the image data. Towards this, typically a fixed set of labels is
specified and experts are tasked with annotating the pixels, patches or
segments in the images with the given labels. In general, however, the set of
classes does not fully capture the rich semantic information present in the
images. For example, in medical imaging such as histology images, the different
parts of cells could be grouped and sub-grouped based on the expertise of the
pathologist.
  To achieve such a precise semantic representation of the concepts in the
image, we need access to the full depth of knowledge of the annotator. In this
work, we develop a novel approach to collect segmentation annotations from
experts based on psychometric testing. Our method consists of the psychometric
testing procedure, active query selection, query enhancement, and a deep metric
learning model to achieve a patch-level image embedding that allows for
semantic segmentation of images. We show the merits of our method with
evaluation on the synthetically generated image, aerial image and histology
image.
","[{""version"":""v1"",""created"":""Wed, 7 Jul 2021 13:38:33 GMT""},{""version"":""v2"",""created"":""Thu, 16 Dec 2021 21:31:18 GMT""}]","2021-12-20"
"2107.03213","Henning Urbat","Henning Urbat and Daniel Hausmann and Stefan Milius and Lutz
  Schr\""oder","Nominal B\""uchi Automata with Name Allocation",,,,,"cs.FL","http://creativecommons.org/licenses/by/4.0/","  Infinite words over infinite alphabets serve as models of the temporal
development of the allocation and (re-)use of resources over linear time. We
approach omega-languages over infinite alphabets in the setting of nominal
sets, and study languages of infinite bar strings, i.e. infinite sequences of
names that feature binding of fresh names; binding corresponds roughly to
reading letters from input words in automata models with registers. We
introduce regular nominal nondeterministic B\""uchi automata (B\""uchi RNNAs), an
automata model for languages of infinite bar strings, repurposing the
previously introduced RNNAs over finite bar strings. Our machines feature
explicit binding (i.e. resource-allocating) transitions and process their input
via a B\""uchi-type acceptance condition. They emerge from the abstract
perspective on name binding given by the theory of nominal sets. As our main
result we prove that, in contrast to most other nondeterministic automata
models over infinite alphabets, language inclusion of B\""uchi RNNAs is
decidable and in fact elementary. This makes B\""uchi RNNAs a suitable tool for
applications in model checking.
","[{""version"":""v1"",""created"":""Wed, 7 Jul 2021 13:38:35 GMT""},{""version"":""v2"",""created"":""Sat, 10 Jul 2021 09:38:21 GMT""}]","2021-07-13"
"2107.03214","James Haigh","J. A. Haigh, A. Nunnenkamp, and A. J. Ramsay","Polarization dependent scattering in cavity optomagnonics","5 pages, 3 figures","Phys. Rev. Lett. 127, 143601 (2021)","10.1103/PhysRevLett.127.143601",,"cond-mat.mes-hall physics.optics","http://arxiv.org/licenses/nonexclusive-distrib/1.0/","  The polarization dependence of magnon-photon scattering in an optical
microcavity is reported. Due to the short cavity length, the mode-matching
conditions found in previously explored, large path-length whispering gallery
resonators are absent. Nonetheless, for cross-polarized scattering a strong and
broadband suppression of one side-band is observed. This arises due to an
interference between the Faraday and second-order Cotton-Mouton effects. To
fully account for the suppression of the cross-polarized scattering, it is
necessary to consider the squeezing of magnon modes intrinsic to thin-film
geometry. A co-polarized scattering due to Cotton-Mouton effect is also
observed. In addition, the magnon modes involved are identified as
Damon-Eshbach surface modes, whose non-reciprocal propagation could be
exploited in devices applications. This work experimentally demonstrates the
important role of second order Cotton-Mouton effect for optomagnonic devices.
","[{""version"":""v1"",""created"":""Wed, 7 Jul 2021 13:38:53 GMT""}]","2021-10-04"
"2107.03215","Hanbin Dai","Hanbin Dai, Hailin Shi, Wu Liu, Linfang Wang, Yinglu Liu and Tao Mei","FasterPose: A Faster Simple Baseline for Human Pose Estimation","14 pages",,,,"cs.CV","http://arxiv.org/licenses/nonexclusive-distrib/1.0/","  The performance of human pose estimation depends on the spatial accuracy of
keypoint localization. Most existing methods pursue the spatial accuracy
through learning the high-resolution (HR) representation from input images. By
the experimental analysis, we find that the HR representation leads to a sharp
increase of computational cost, while the accuracy improvement remains marginal
compared with the low-resolution (LR) representation. In this paper, we propose
a design paradigm for cost-effective network with LR representation for
efficient pose estimation, named FasterPose. Whereas the LR design largely
shrinks the model complexity, yet how to effectively train the network with
respect to the spatial accuracy is a concomitant challenge. We study the
training behavior of FasterPose, and formulate a novel regressive cross-entropy
(RCE) loss function for accelerating the convergence and promoting the
accuracy. The RCE loss generalizes the ordinary cross-entropy loss from the
binary supervision to a continuous range, thus the training of pose estimation
network is able to benefit from the sigmoid function. By doing so, the output
heatmap can be inferred from the LR features without loss of spatial accuracy,
while the computational cost and model size has been significantly reduced.
Compared with the previously dominant network of pose estimation, our method
reduces 58% of the FLOPs and simultaneously gains 1.3% improvement of accuracy.
Extensive experiments show that FasterPose yields promising results on the
common benchmarks, i.e., COCO and MPII, consistently validating the
effectiveness and efficiency for practical utilization, especially the
low-latency and low-energy-budget applications in the non-GPU scenarios.
","[{""version"":""v1"",""created"":""Wed, 7 Jul 2021 13:39:08 GMT""}]","2021-07-08"
"2107.03216","Shunning He","Haiwei Pan, Shuning He, Kejia Zhang, Bo Qu, Chunling Chen, and Kun Shi","MuVAM: A Multi-View Attention-based Model for Medical Visual Question
  Answering",,,,,"cs.CV","http://arxiv.org/licenses/nonexclusive-distrib/1.0/","  Medical Visual Question Answering (VQA) is a multi-modal challenging task
widely considered by research communities of the computer vision and natural
language processing. Since most current medical VQA models focus on visual
content, ignoring the importance of text, this paper proposes a multi-view
attention-based model(MuVAM) for medical visual question answering which
integrates the high-level semantics of medical images on the basis of text
description. Firstly, different methods are utilized to extract the features of
the image and the question for the two modalities of vision and text. Secondly,
this paper proposes a multi-view attention mechanism that include
Image-to-Question (I2Q) attention and Word-to-Text (W2T) attention. Multi-view
attention can correlate the question with image and word in order to better
analyze the question and get an accurate answer. Thirdly, a composite loss is
presented to predict the answer accurately after multi-modal feature fusion and
improve the similarity between visual and textual cross-modal features. It
consists of classification loss and image-question complementary (IQC) loss.
Finally, for data errors and missing labels in the VQA-RAD dataset, we
collaborate with medical experts to correct and complete this dataset and then
construct an enhanced dataset, VQA-RADPh. The experiments on these two datasets
show that the effectiveness of MuVAM surpasses the state-of-the-art method.
","[{""version"":""v1"",""created"":""Wed, 7 Jul 2021 13:40:25 GMT""}]","2021-07-08"
"2107.03217","Songhao Wang","Qun Meng, Songhao Wang, Szu Hui Ng","Combined Global and Local Search for Optimization with Gaussian Process
  Models",,,,,"stat.ML cs.LG","http://creativecommons.org/licenses/by-nc-nd/4.0/","  Gaussian process (GP) model based optimization is widely applied in
simulation and machine learning. In general, it first estimates a GP model
based on a few observations from the true response and then employs this model
to guide the search, aiming to quickly locate the global optimum. Despite its
successful applications, it has several limitations that may hinder its broader
usage. First, building an accurate GP model can be difficult and
computationally expensive, especially when the response function is multi-modal
or varies significantly over the design space. Second, even with an appropriate
model, the search process can be trapped in suboptimal regions before moving to
the global optimum due to the excessive effort spent around the current best
solution. In this work, we adopt the Additive Global and Local GP (AGLGP) model
in the optimization framework. The model is rooted in the inducing-points-based
GP sparse approximations and is combined with independent local models in
different regions. With these properties, the AGLGP model is suitable for
multi-modal responses with relatively large data sizes. Based on this AGLGP
model, we propose a Combined Global and Local search for Optimization (CGLO)
algorithm. It first divides the whole design space into disjoint local regions
and identifies a promising region with the global model. Next, a local model in
the selected region is fit to guide detailed search within this region. The
algorithm then switches back to the global step when a good local solution is
found. The global and local natures of CGLO enable it to enjoy the benefits of
both global and local search to efficiently locate the global optimum.
","[{""version"":""v1"",""created"":""Wed, 7 Jul 2021 13:40:37 GMT""}]","2021-07-08"
"2107.03218","Larisa Beilina","Mohammad Asadzadeh and Larisa Beilina","Stability and convergence analysis of a domain decomposition FE/FD
  method for the Maxwell's equations in time domain",,,,,"math.NA cs.NA","http://creativecommons.org/licenses/by/4.0/","  Stability and convergence analysis for the domain decomposition finite
element/finite difference (FE/FD) method is presented. The analysis is designed
for semi-discrete finite element scheme for the time-dependent Maxwell's
equations. The explicit finite element schemes in different settings of the
spatial domain are constructed and domain decomposition algorithm is
formulated. Several numerical examples validate convergence rates obtained in
the theoretical studies.
","[{""version"":""v1"",""created"":""Wed, 7 Jul 2021 13:46:27 GMT""}]","2021-07-08"
"2107.03219","Jiawei Li","Jiawei Li, Zhongmin Qian and Mingrui Zhou","On distributions of velocity random fields in turbulent flows","3 figures",,,,"math-ph math.MP physics.flu-dyn","http://creativecommons.org/licenses/by/4.0/","  The purpose of the present paper is to derive a partial differential equation
(PDE) for the single-time single-point probability density function (PDF) of
the velocity field of a turbulent flow. The PDF PDE is a highly non-linear
parabolic-transport equation, which depends on two conditional statistical
numerics of important physical significance. The PDF PDE is a general form of
the classical Reynolds mean flow equation, and is a precise formulation of the
PDF transport equation. The PDF PDE provides us with a new method for modelling
turbulence. An explicit example is constructed, though the example is seemingly
artificial, but it demonstrates the PDF method based on the new PDF PDE.
","[{""version"":""v1"",""created"":""Wed, 7 Jul 2021 13:46:47 GMT""}]","2021-07-08"
