"2107.02698","Chu Li","Chu Li, Aydin Sezgin, Zhu Han","On the Impact of Oscillator Phase Noise in an IRS-assisted MISO TDD
  System",,,,,"eess.SP","http://arxiv.org/licenses/nonexclusive-distrib/1.0/","  In this work, we study the impact of the multiplicative phase noise in an
IRS-assisted system. We consider an IRS-assisted system with multiplicative
phase noise both at the BS and user. A novel channel estimation algorithm is
proposed considering the phase noise. By utilizing the proposed channel
estimates we investigate the system performance in the downlink, more
specifically, we derive the ergodic capacity in closed form. Simulation results
verify the correctness of the closed-form expression. We observe that the
system becomes more robust against the phase noise as the number of reflective
elements increases. Moreover, the influence of the additive channel noise in
uplink vanishes as the number of reflecting elements grows asymptotically
large.
","[{""version"":""v1"",""created"":""Tue, 6 Jul 2021 16:01:24 GMT""},{""version"":""v2"",""created"":""Sun, 10 Oct 2021 19:51:24 GMT""}]","2021-10-12"
"2107.02699","Simon Baker","Simon Baker","On normal numbers and self-similar measures","This article has been superseded by arXiv:2111.10082",,,,"math.DS math.CA math.NT","http://arxiv.org/licenses/nonexclusive-distrib/1.0/","  In this paper we prove that if $\{\varphi_i(x)=\lambda x+t_i\}$ is an
equicontractive iterated function system and $b$ is a positive integer
satisfying $\frac{\log b}{\log |\lambda|}\notin\mathbb{Q},$ then almost every
$x$ is normal in base $b$ for any non-atomic self-similar measure of
$\{\varphi_i\}$.
","[{""version"":""v1"",""created"":""Tue, 6 Jul 2021 16:01:52 GMT""},{""version"":""v2"",""created"":""Thu, 15 Jul 2021 08:12:19 GMT""},{""version"":""v3"",""created"":""Mon, 22 Nov 2021 14:34:48 GMT""}]","2021-11-23"
"2107.02700","Tong Jiang","Tong Jiang, Ning Dai, Yungui Gong, Dicong Liang, Chao Zhang","Constraint on Brans-Dicke theory from intermediate/extreme mass ratio
  inspirals","Major revision by adding discussions on more mass ratios, but
  conclusions are strengthened, matched to the published JCAP version","JCAP12(2022)023","10.1088/1475-7516/2022/12/023",,"gr-qc astro-ph.CO hep-th","http://arxiv.org/licenses/nonexclusive-distrib/1.0/","  Intermediate/Extreme mass ratio inspiral (I/EMRI) system provides a good tool
to test the nature of gravity in strong field. Based on the method of
osculating orbits, we compute the orbital evolutions of I/EMRIs on
quasi-elliptic orbits in both Einstein's general relativity and Brans-Dicke
theory. The extra monopolar and dipolar channels in Brans-Dicke theory
accelerate the orbital decay, so it is important to consider the effects of
monopolar and dipolar emissions on the waveform. With the help of accurate
orbital motion, we generate waveform templates which include both monopolar and
dipolar contributions for I/EMRIs on eccentric orbits in Brans-Dicke theory.
With a two-year observation of gravitational waves emitted from I/EMRIs by
LISA, we get the most stringent constraint on the Brans-Dicke coupling
parameter $\omega_0>10^6$.
","[{""version"":""v1"",""created"":""Tue, 6 Jul 2021 16:03:42 GMT""},{""version"":""v2"",""created"":""Wed, 7 Jul 2021 14:50:50 GMT""},{""version"":""v3"",""created"":""Wed, 21 Dec 2022 05:04:02 GMT""}]","2022-12-22"
"2107.02701","Rongjun Qin","Hessah Albanwan, Rongjun Qin","Spatiotemporal Fusion in Remote Sensing",,,,,"cs.CV","http://arxiv.org/licenses/nonexclusive-distrib/1.0/","  Remote sensing images and techniques are powerful tools to investigate earth
surface. Data quality is the key to enhance remote sensing applications and
obtaining a clear and noise-free set of data is very difficult in most
situations due to the varying acquisition (e.g., atmosphere and season),
sensor, and platform (e.g., satellite angles and sensor characteristics)
conditions. With the increasing development of satellites, nowadays Terabytes
of remote sensing images can be acquired every day. Therefore, information and
data fusion can be particularly important in the remote sensing community. The
fusion integrates data from various sources acquired asynchronously for
information extraction, analysis, and quality improvement. In this chapter, we
aim to discuss the theory of spatiotemporal fusion by investigating previous
works, in addition to describing the basic concepts and some of its
applications by summarizing our prior and ongoing works.
","[{""version"":""v1"",""created"":""Tue, 6 Jul 2021 16:04:04 GMT""}]","2021-07-07"
"2107.02702","Sandeep Kumar Mondal","Sandeep Kumar Mondal, Raj Prince, Nayantara Gupta, Avik Kumar Das","Spectral Modeling of Flares in Long Term Gamma-Ray Light Curve of PKS
  0903-57","29 pages, 22 figures, 14 tables, Accepted for Publication in ApJ","2021 ApJ 922 160","10.3847/1538-4357/ac11fa",,"astro-ph.HE","http://creativecommons.org/licenses/by/4.0/","  A detailed study of the BL Lacertae PKS 0903-57 has been done for the first
time with 12 years of Fermi Large Area Telescope data. We have identified two
bright gamma-ray flares in 2018 and 2020. Many sub-structures were observed
during multiple time binning of these flares. We have performed detailed
temporal and spectral study on all the sub-structures separately. A single-zone
emission model is used for time-dependent leptonic modeling of the
multi-wavelength spectral energy distributions. Our estimated values of
variability time scale, magnetic field in the emission region, jet power
obtained from leptonic modeling of PKS 0903-57 are presented in this work.
Currently, we have a minimal number of observations in X-rays and other bands.
Hence, more simultaneous multi-wavelength monitoring of this source is required
to have a better understanding of the physical processes happening in the jet
of the blazar PKS 0903-57.
","[{""version"":""v1"",""created"":""Tue, 6 Jul 2021 16:04:42 GMT""}]","2021-12-02"
"2107.02703","Andres Vega","Andres Vega, Thomas Pertsch, Frank Setzpfandt, Andrey A. Sukhorukov","Metasurface-Assisted Quantum Ghost Discrimination of Polarization
  Objects",,"Phys. Rev. Applied 16, 064032 (2021)","10.1103/PhysRevApplied.16.064032",,"quant-ph physics.optics","http://arxiv.org/licenses/nonexclusive-distrib/1.0/","  We develop a concept of metasurface-assisted ghost imaging for non-local
discrimination between a set of polarization objects. The specially designed
metasurfaces are incorporated in the imaging system to perform parallel state
transformations in general elliptical bases of quantum-entangled or
classically-correlated photons. Then, only four or fewer correlation
measurements between multiple metasurface outputs and a simple
polarization-insensitive bucket detector after the object can allow for the
identification of fully or partially transparent polarization elements and
their arbitrary orientation angles. We rigorously establish that entangled
photon states offer a fundamental advantage compared to classical correlations
for a broad class of objects. The approach can find applications for real-time
and low-light imaging across diverse spectral regions in dynamic environments.
","[{""version"":""v1"",""created"":""Tue, 6 Jul 2021 16:06:58 GMT""}]","2022-05-10"
"2107.02704","Divya Varadarajan","Divya Varadarajan, Katherine L. Bouman, Andre van der Kouwe, Bruce
  Fischl, Adrian V. Dalca","Unsupervised learning of MRI tissue properties using MRI physics models","11 Pages, 9 figures",,,,"eess.IV cs.CV q-bio.NC q-bio.QM","http://creativecommons.org/licenses/by-nc-nd/4.0/","  In neuroimaging, MRI tissue properties characterize underlying neurobiology,
provide quantitative biomarkers for neurological disease detection and
analysis, and can be used to synthesize arbitrary MRI contrasts. Estimating
tissue properties from a single scan session using a protocol available on all
clinical scanners promises to reduce scan time and cost, enable quantitative
analysis in routine clinical scans and provide scan-independent biomarkers of
disease. However, existing tissue properties estimation methods - most often
$\mathbf{T_1}$ relaxation, $\mathbf{T_2^*}$ relaxation, and proton density
($\mathbf{PD}$) - require data from multiple scan sessions and cannot estimate
all properties from a single clinically available MRI protocol such as the
multiecho MRI scan. In addition, the widespread use of non-standard acquisition
parameters across clinical imaging sites require estimation methods that can
generalize across varying scanner parameters. However, existing learning
methods are acquisition protocol specific and cannot estimate from heterogenous
clinical data from different imaging sites. In this work we propose an
unsupervised deep-learning strategy that employs MRI physics to estimate all
three tissue properties from a single multiecho MRI scan session, and
generalizes across varying acquisition parameters. The proposed strategy
optimizes accurate synthesis of new MRI contrasts from estimated latent tissue
properties, enabling unsupervised training, we also employ random acquisition
parameters during training to achieve acquisition generalization. We provide
the first demonstration of estimating all tissue properties from a single
multiecho scan session. We demonstrate improved accuracy and generalizability
for tissue property estimation and MRI synthesis.
","[{""version"":""v1"",""created"":""Tue, 6 Jul 2021 16:07:14 GMT""}]","2021-07-07"
"2107.02705","Fernando Szechtman","Rachel Quinlan, Moumita Shau, and Fernando Szechtman","Linear diophantine equations in several variables",,,,,"math.RA","http://arxiv.org/licenses/nonexclusive-distrib/1.0/","  Let $R$ be a ring and let $(a_1,\dots,a_n)\in R^n$ be a unimodular vector,
where $n\geq 2$ and each $a_i$ is in the center of $R$. Consider the linear
equation $a_1X_1+\cdots+a_nX_n=0$, with solution set $S$. Then
$S=S_1+\cdots+S_n$, where each $S_i$ is naturally derived from
$(a_1,\dots,a_n)$, and we give a presentation of $S$ in terms of generators
taken from the $S_i$ and appropriate relations. Moreover, under suitable
assumptions, we elucidate the structure of each quotient module $S/S_i$.
Furthermore, assuming that $R$ is a principal ideal domain, we provide a simple
way to construct a basis of $S$ and, as an application, we determine the
structure of the quotient module $S/U_i$, where each $U_i$ is a specific module
containing $S_i$.
","[{""version"":""v1"",""created"":""Tue, 6 Jul 2021 16:08:09 GMT""},{""version"":""v2"",""created"":""Wed, 13 Oct 2021 13:32:32 GMT""},{""version"":""v3"",""created"":""Mon, 27 Dec 2021 15:30:36 GMT""}]","2021-12-28"
"2107.02706","Kristin Willa","Kristin Willa, Fr\'ed\'eric Hardy, Dai Aoki, Dexin Li, Paul Wiecki,
  G\'erard Lapertot, Christoph Meingast","Thermodynamic signatures of short-range magnetic correlations in UTe$_2$",,,"10.1103/PhysRevB.104.205107",,"cond-mat.supr-con cond-mat.str-el","http://creativecommons.org/licenses/by/4.0/","  The normal-state out of which unconventional superconductivity in UTe$_2$
emerges is studied in detail using a variety of thermodynamic and transport
probes. Clear evidence for a broad Schottky-like anomaly with roughly R ln 2
entropy around $T^{*} \approx 12$K is observed in all measured quantities.
Comparison with high magnetic field transport data allows the construction of
an $H\text{-}T$ phase diagram resembling that of the ferromagnetic
superconductor URhGe. The low field electronic Gr\""uneisen parameter of $T^{*}$
and that of the metamagnetic transition at $H_m \approx 35$T are comparable
pointing to a common origin of both phenomena. Enhanced Wilson and Korringa
ratios suggests that the existence of short range ferromagnetic fluctuations
cannot be ruled out.
","[{""version"":""v1"",""created"":""Tue, 6 Jul 2021 16:11:00 GMT""}]","2021-11-17"
"2107.02707","Fernando Szechtman","Fernando Szechtman","Linear systems of diophantine equations",,,,,"math.RA","http://arxiv.org/licenses/nonexclusive-distrib/1.0/","  Given free modules $M\subseteq L$ of finite rank $f\geq 1$ over a principal
ideal domain $R$, we give a procedure to construct a basis of $L$ from a basis
of $M$ assuming the invariant factors or elementary divisors of $L/M$ are
known. Given a matrix $A\in M_{m,n}(R)$ of rank $r$, its nullspace~$L$ in $R^n$
is a free $R$-module of rank~$f=n-r$. We construct a free submodule $M$ of $L$
of rank~$f$ naturally associated to $A$ and whose basis is easily computable,
we determine the invariant factors of the quotient module $L/M$, and then
indicate how to apply the previous procedure to build a basis of $L$ from one
of $M$.
","[{""version"":""v1"",""created"":""Tue, 6 Jul 2021 16:11:27 GMT""},{""version"":""v2"",""created"":""Sat, 23 Oct 2021 13:52:41 GMT""}]","2021-10-26"
"2107.02708","Hanqi Guo","Hanqi Guo and Tom Peterka","Exact Analytical Parallel Vectors",,"2021 IEEE Visualization Conference (VIS)","10.1109/VIS49827.2021.9623310","ANL/MCS-P9507-0621","cs.GR","http://arxiv.org/licenses/nonexclusive-distrib/1.0/","  This paper demonstrates that parallel vector curves are piecewise cubic
rational curves in 3D piecewise linear vector fields. Parallel vector curves --
loci of points where two vector fields are parallel -- have been widely used to
extract features including ridges, valleys, and vortex core lines in scientific
data. We define the term \emph{generalized and underdetermined eigensystem} in
the form of
$\mathbf{A}\mathbf{x}+\mathbf{a}=\lambda(\mathbf{B}\mathbf{x}+\mathbf{b})$ in
order to derive the piecewise rational representation of 3D parallel vector
curves. We discuss how singularities of the rationals lead to different types
of intersections with tetrahedral cells.
","[{""version"":""v1"",""created"":""Tue, 6 Jul 2021 16:13:52 GMT""}]","2022-01-14"
"2107.02709","BoZhen Zhou","Bozhen Zhou, Yumeng Zeng, Shu Chen","Exact zeros of the Loschmidt echo and quantum speed limit time for the
  dynamical quantum phase transition in finite-size systems","9 pages, 7 figures","Phys. Rev. B 104, 094311 (2021)","10.1103/PhysRevB.104.094311",,"quant-ph cond-mat.quant-gas","http://arxiv.org/licenses/nonexclusive-distrib/1.0/","  We study exact zeros of Loschmidt echo and quantum speed limit time for
dynamical quantum phase transition in finite size systems. Our results
illustrate that exact zeros of Loschmidt echo exist even in finite size quantum
systems when the postquench parameter takes some discrete values in regions
with the corresponding equilibrium phase different from the initial phase. As
the system size increases and tends to infinity, the discrete parameters
distribute continuously in the parameter regions. We further analyze the time
for the appearance of the first exact zero of Loschmidt echo which is known as
the quantum speed limit time $\tau_{\text{QSL}}$. We demonstrate that the
maximal value of $\tau_{\text{QSL}}$ is proportional to $L$ and approaches
infinity in the thermodynamical limit, when we quench the initial non-critical
state to the critical phase. We also calculate the minimal value of
$\tau_{\text{QSL}}$ and find that its behavior is dependent on the phase of
initial state.
","[{""version"":""v1"",""created"":""Tue, 6 Jul 2021 16:14:07 GMT""},{""version"":""v2"",""created"":""Wed, 8 Sep 2021 01:04:02 GMT""},{""version"":""v3"",""created"":""Wed, 29 Sep 2021 06:45:19 GMT""}]","2021-09-30"
"2107.02710","Bas Lemmens","Bas Lemmens and Kieran Power","Horofunction compactifications and duality","Minor revision from previous version (47 pp)",,,,"math.GT math.CV math.MG","http://creativecommons.org/licenses/by-nc-sa/4.0/","  We study the global topology of the horofunction compactification of smooth
manifolds with a Finsler distance. The main goal is to show, for certain
classes of these spaces, that the horofunction compactification is naturally
homeomorphic to the closed unit ball of the dual norm of the norm in the
tangent space (at the base point) that generates the Finsler distance. We
construct explicit homeomorphisms for a variety of spaces in three settings:
bounded convex domains in $\mathbb{C}^n$ with the Kobayashi distance, Hilbert
geometries, and finite dimensional normed spaces. For the spaces under
consideration, the horofunction boundary has an intrinsic partition into so
called parts. The natural connection with the dual norm arises through the fact
that the homeomorphism maps each part in the horofunction boundary onto the
relative interior of a boundary face of the dual unit ball. For normed spaces
the connection between the global topology of the horofunction boundary and the
dual norm was suggested by Kapovich and Leeb. We confirm this connection for
Euclidean Jordan algebras equipped with the spectral norm.
","[{""version"":""v1"",""created"":""Tue, 6 Jul 2021 16:18:31 GMT""},{""version"":""v2"",""created"":""Wed, 1 Sep 2021 13:39:54 GMT""},{""version"":""v3"",""created"":""Mon, 31 Jan 2022 19:59:36 GMT""}]","2022-02-02"
"2107.02711","Tengyu Xu","Tengyu Xu, Zhuoran Yang, Zhaoran Wang, Yingbin Liang","A Unified Off-Policy Evaluation Approach for General Value Function","submitted for publication",,,,"cs.LG cs.AI math.ST stat.TH","http://creativecommons.org/licenses/by/4.0/","  General Value Function (GVF) is a powerful tool to represent both the {\em
predictive} and {\em retrospective} knowledge in reinforcement learning (RL).
In practice, often multiple interrelated GVFs need to be evaluated jointly with
pre-collected off-policy samples. In the literature, the gradient temporal
difference (GTD) learning method has been adopted to evaluate GVFs in the
off-policy setting, but such an approach may suffer from a large estimation
error even if the function approximation class is sufficiently expressive.
Moreover, none of the previous work have formally established the convergence
guarantee to the ground truth GVFs under the function approximation settings.
In this paper, we address both issues through the lens of a class of GVFs with
causal filtering, which cover a wide range of RL applications such as reward
variance, value gradient, cost in anomaly detection, stationary distribution
gradient, etc. We propose a new algorithm called GenTD for off-policy GVFs
evaluation and show that GenTD learns multiple interrelated multi-dimensional
GVFs as efficiently as a single canonical scalar value function. We further
show that unlike GTD, the learned GVFs by GenTD are guaranteed to converge to
the ground truth GVFs as long as the function approximation power is
sufficiently large. To our best knowledge, GenTD is the first off-policy GVF
evaluation algorithm that has global optimality guarantee.
","[{""version"":""v1"",""created"":""Tue, 6 Jul 2021 16:20:34 GMT""}]","2021-07-07"
"2107.02712","Luis Henrique De Oliveira Alves","L. H. O. Alves, J. L. Rebelatto, R. D. Souza, G. Brante","Network-Coded Cooperative LoRa Network with D2D Communication","11 pages, 7 figures, published on the IEEE Internet of Things Journal",,"10.1109/JIOT.2021.3107784",,"cs.IT math.IT","http://arxiv.org/licenses/nonexclusive-distrib/1.0/","  We evaluate the outage probability and the energy efficiency (EE) of a LoRa
network when the end-devices (EDs) are capable of exchanging messages with a
device-to-device (D2D) technology. Our proposal is to assess the performance of
the network when operating under the concept of network-coded cooperation
(NCC), where the EDs are capable of transmitting linear combinations of more
than one frame (including frames of another ED), performed over a non-binary
finite field. We consider both connection and collision probabilities when
modelling the outage probability of an ED, as well as a realistic power
consumption model to evaluate the EE. Our results indicate that the proposed
scheme, which we refer to as NCC-LoRa, provides considerable gains in terms of
both outage probability and EE when compared to a regular LoRa network, even
when considering the additional consumption of D2D communication.
","[{""version"":""v1"",""created"":""Tue, 6 Jul 2021 16:21:52 GMT""},{""version"":""v2"",""created"":""Tue, 7 Dec 2021 09:45:02 GMT""}]","2021-12-08"
"2107.02713","Zhenzhong Chen","Leitian Tao, Li Mi, Nannan Li, Xianhang Cheng, Yaosi Hu, and Zhenzhong
  Chen","Predicate correlation learning for scene graph generation",,,"10.1109/TIP.2022.3181511",,"cs.CV","http://arxiv.org/licenses/nonexclusive-distrib/1.0/","  For a typical Scene Graph Generation (SGG) method, there is often a large gap
in the performance of the predicates' head classes and tail classes. This
phenomenon is mainly caused by the semantic overlap between different
predicates as well as the long-tailed data distribution. In this paper, a
Predicate Correlation Learning (PCL) method for SGG is proposed to address the
above two problems by taking the correlation between predicates into
consideration. To describe the semantic overlap between strong-correlated
predicate classes, a Predicate Correlation Matrix (PCM) is defined to quantify
the relationship between predicate pairs, which is dynamically updated to
remove the matrix's long-tailed bias. In addition, PCM is integrated into a
Predicate Correlation Loss function ($L_{PC}$) to reduce discouraging gradients
of unannotated classes. The proposed method is evaluated on Visual Genome
benchmark, where the performance of the tail classes is significantly improved
when built on the existing methods.
","[{""version"":""v1"",""created"":""Tue, 6 Jul 2021 16:24:33 GMT""}]","2022-07-13"
"2107.02714","Hsin-Yu Chen","Hsin-Yu Chen, Salvatore Vitale, Francois Foucart","The relative contribution to heavy metals production from binary neutron
  star mergers and neutron star-black hole mergers","Accepted version by The Astrophysical Journal Letters","The Astrophysical Journal Letters, 920, 1, L3, 2021","10.3847/2041-8213/ac26c6",,"astro-ph.HE gr-qc","http://creativecommons.org/publicdomain/zero/1.0/","  The origin of the heavy elements in the Universe is not fully determined.
Neutron star-black hole (NSBH) and {binary neutron star} (BNS) mergers may both
produce heavy elements via rapid neutron-capture (r-process). We use the recent
detection of gravitational waves from NSBHs, improved measurements of the
neutron star equation-of-state, and the most modern numerical simulations of
ejected material from binary collisions to measure the relative contribution of
NSBHs and BNSs to the production of heavy elements. As the amount of r-process
ejecta depends on the mass and spin distribution of the compact objects, as
well as on the equation-of-state of the neutron stars, we consider various
models for these quantities, informed by gravitational-wave and pulsar data. We
find that in most scenarios, BNSs have produced more r-process elements than
NSBHs over the past 2.5 billion years. If black holes have preferentially small
spins, BNSs can produce at least twice of the amount of r-process elements than
NSBHs. If black hole spins are small and there is a dearth of low mass
($<5M_{\odot}$) black holes within NSBH binaries, BNSs can account for the near
totality of the r-process elements from binaries. For NSBH to produce large
fraction of r-process elements, black holes in NSBHs must have small masses and
large aligned spins, which is disfavored by current data.
","[{""version"":""v1"",""created"":""Tue, 6 Jul 2021 16:29:10 GMT""},{""version"":""v2"",""created"":""Tue, 28 Sep 2021 15:31:38 GMT""}]","2021-11-17"
"2107.02715","Carlo Tiseo","Carlo Tiseo, Sydney Rebecca Charitos and Michael Mistry","Geometrical Postural Optimisation of 7-DoF Limb-Like Manipulators",,"2022, Eng. Res. Express","10.1088/2631-8695/ac59dd",,"cs.RO","http://arxiv.org/licenses/nonexclusive-distrib/1.0/","  Robots are moving towards applications in less structured environments, but
their model-based controllers are challenged by the tasks' complexity and
intrinsic environmental unpredictability. Studying biological motor control can
provide insights into overcoming these limitations due to the high dexterity
and stability observable in humans and animals. This work presents a
geometrical solution to the postural optimisation of 7-DoF limbs-like
mechanisms, which are robust to singularities and computationally efficient.
The theoretical formulation identified two separate decoupled optimisation
strategies. The shoulder and elbow strategy align the plane of motion with the
expected plane of motion and guarantee the reachability of the end-posture. The
wrist strategy ensures the end-effector orientation, which is essential to
retain manipulability when nearing a singular configuration. The numerical
results confirmed the theoretical observations and allowed us to identify the
effect of different grasp strategies on system manipulability. The geometrical
method was numerically tested in thousands of configurations proving to be both
robust and accurate. The tested scenarios include left and right arm postures,
singular configurations, and walking scenarios. The proposed geometrical
approach can find application in developing efficient and robust interaction
controllers that could be applied in computational neuroscience and robotics.
","[{""version"":""v1"",""created"":""Tue, 6 Jul 2021 16:29:38 GMT""},{""version"":""v2"",""created"":""Fri, 20 Aug 2021 14:56:45 GMT""}]","2022-03-04"
