"2107.06021","Amin Aboubrahim","Amin Aboubrahim, Michael Klasen, Pran Nath and Raza M. Syed","Future searches for SUSY at the LHC post Fermilab $(g-2)_\mu$","Contribution to Snowmass",,,,"hep-ph","http://creativecommons.org/licenses/by/4.0/","  We assess the future directions for the search for supersymmetry at the Large
Hadron Collider in view of the new precision results on the muon anomaly by the
Fermilab Collaboration. The existence of a deviation of size 4.1$\sigma$ from
the Standard Model prediction points to light sleptons and light weakinos in
the mass range of few hundred GeV while the observation of the Higgs boson mass
at $\sim 125$ GeV points to squark masses lying in the few TeV range. Thus a
split sparticle spectrum is indicated. We discuss the possibility of such a
split sparticle spectrum in the supergravity unified model and show that a
splitting of the sfermion spectrum into light sleptons and heavy squarks
naturally arises within radiative breaking of the electroweak symmetry driven
by heavy gluinos ($\tilde g$SUGRA). We discuss the possible avenues for the
discovery of supersymmetry at the LHC within this framework under the further
constraint of the recent muon anomaly result from the Fermilab Collaboration.
We show that the most likely candidates for early discovery of a sparticle at
the LHC are the chargino, the stau, the smuon and the selectron. We present a
set of benchmarks and discuss future directions for further work. Specifically,
we point to the most promising channels for SUSY discovery and estimate the
integrated luminosity needed for the discovery of these benchmarks at the High
Luminosity LHC and also at the High Energy LHC.
","[{""version"":""v1"",""created"":""Tue, 13 Jul 2021 12:15:34 GMT""},{""version"":""v2"",""created"":""Tue, 24 Aug 2021 13:13:38 GMT""}]","2021-08-25"
"2107.06022","Emmanuel Coffie","Emmanuel Coffie, Sindre Duedahl and Frank Proske","Sensitivity Analysis with respect to a Stock Price Model with Rough
  Volatility via a Bismut-Elworthy-Li Formula for Singular SDEs",,,,,"math.PR","http://arxiv.org/licenses/nonexclusive-distrib/1.0/","  In this paper, we show the existence of unique Malliavin differentiable
solutions to SDE`s driven by a fractional Brownian motion with Hurst parameter
H<1/2 and singular, unbounded drift vector fields, for which we also prove a
stability result. Further, using the latter results, we propose a stock price
model with rough and correlated volatility, which also allows for capturing
regime switching effects. Finally, we also derive a Bismut-Elworthy-Li formula
with respect to our stock price model for certain classes of vector fields.
","[{""version"":""v1"",""created"":""Tue, 13 Jul 2021 12:17:55 GMT""},{""version"":""v2"",""created"":""Wed, 14 Jul 2021 07:30:41 GMT""}]","2021-07-15"
"2107.06023","Ming Lu","Ming Lu, Weiqiang Wang","Braid group symmetries on quasi-split $\imath$quantum groups via
  $\imath$Hall algebras","53 pages, minor edits, to appear in Selecta Math","Selecta Math. (N.S.) 28 (2022), Paper No. 84, 64 pp",,,"math.QA math.RT","http://creativecommons.org/licenses/by-nc-sa/4.0/","  We establish automorphisms with closed formulas on quasi-split
$\imath$quantum groups of symmetric Kac-Moody type associated to restricted
Weyl groups. The proofs are carried out in the framework of $\imath$Hall
algebras and reflection functors, thanks to the $\imath$Hall algebra
realization of $\imath$quantum groups in our previous work. Several quantum
binomial identities arising along the way are established.
","[{""version"":""v1"",""created"":""Tue, 13 Jul 2021 12:19:24 GMT""},{""version"":""v2"",""created"":""Fri, 16 Sep 2022 00:15:45 GMT""}]","2022-11-23"
"2107.06024","Stefan Marksteiner","Stefan Marksteiner and Peter Priller","A Model-Driven Methodology for Automotive Cybersecurity Test Case
  Generation","7 pages, 6 figures, accepted for the joint SRCNAS/STRIVE workshop at
  the 6th IEEE European Symposium on Security and Privacy","2021 IEEE European Symposium on Security and Privacy Workshops
  (EuroS&PW) - Safety vs Security in the Air and on the Ground","10.1109/EuroSPW54576.2021.00021",,"cs.CR","http://arxiv.org/licenses/nonexclusive-distrib/1.0/","  Through international regulations (most prominently the latest UNECE
regulation) and standards, the already widely perceived higher need for
cybersecurity in automotive systems has been recognized and will mandate higher
efforts for cybersecurity engineering. T he UNECE also demands the
effectiveness of these engineering to be verified and validated through
testing. T his requires both a significantly higher rate and more
comprehensiveness of cybersecurity testing that is not effectively to cope with
using current, predominantly manual, automotive cybersecurity testing
techniques. To allow for comprehensive and efficient testing at all stages of
the automotive life cycle, including supply chain parts not at band, and to
facilitate efficient third party testing, as well as to test under real-world
conditions, also methodologies for testing the cybersecurity of vehicular
systems as a black box are necessary. T his paper therefore presents a model
and attack tree-based approach to (semi-)automate automotive cybersecurity
testing, as well as considerations for automatically black box-deriving models
for the use in attack modeling.
","[{""version"":""v1"",""created"":""Tue, 13 Jul 2021 12:23:18 GMT""}]","2021-09-07"
"2107.06025","Manh Hong Duong","Manh Hong Duong and The Anh Han","Statistics of the number of equilibria in random social dilemma
  evolutionary games with mutation","17 pages",,"10.1140/epjb/s10051-021-00181-0",,"q-bio.PE math.DS math.PR","http://arxiv.org/licenses/nonexclusive-distrib/1.0/","  In this paper, we study analytically the statistics of the number of
equilibria in pairwise social dilemma evolutionary games with mutation where a
game's payoff entries are random variables. Using the replicator-mutator
equations, we provide explicit formulas for the probability distributions of
the number of equilibria as well as other statistical quantities. This analysis
is highly relevant assuming that one might know the nature of a social dilemma
game at hand (e.g., cooperation vs coordination vs anti-coordination), but
measuring the exact values of its payoff entries is difficult. Our delicate
analysis shows clearly the influence of the mutation probability on these
probability distributions, providing insights into how varying this important
factor impacts the overall behavioural or biological diversity of the
underlying evolutionary systems.
","[{""version"":""v1"",""created"":""Tue, 13 Jul 2021 12:23:30 GMT""}]","2021-09-15"
"2107.06026","Richard Cole","Richard E Cole","A Sky Brightness Model for the Starlink 'Visorsat' Spacecraft","18 pages, 27 figures",,,,"astro-ph.IM","http://creativecommons.org/licenses/by/4.0/","  A model of the brightness of the visorsat Starlink spacecraft is presented
based on published information on the engineering design and from analysis of
131 observations of individual visorsats in late 2020. Comments are offered on
the implications of this model on the visibility of visorsat spacecraft across
the sky. This is an updated and expanded version of analysis published in
Research Notes of the AAS (2020). An additional section has been added in this
version to consider observations made in June 2021 which indicate brighter
visorsat magnitudes.
","[{""version"":""v1"",""created"":""Tue, 13 Jul 2021 12:26:24 GMT""}]","2021-07-14"
"2107.06027","Ritika Singhal","Ritika Singhal and N. Shravan Kumar","Weyl transform of vector-valued functions and vector measures on the
  phase space associated to a locally compact abelian group",,,,,"math.FA","http://creativecommons.org/licenses/by-nc-sa/4.0/","  In this paper, we introduce and study the Weyl transform of functions which
are integrable with respect to a vector measure on a phase space associated to
a locally compact abelian group. We also study the Weyl transform of vector
measures. Later, we also introduce and study the convolution of functions from
$L^p$-spaces associated to a vector measure. We also study the Weyl transform
of vector-valued functions and prove a vector-valued analogue of the
Hausdorff-Young inequality.
","[{""version"":""v1"",""created"":""Tue, 13 Jul 2021 12:26:39 GMT""}]","2021-07-14"
"2107.06028","Emanuel Laude","Hartmut Bauermeister and Emanuel Laude and Thomas M\""ollenhoff and
  Michael Moeller and Daniel Cremers","Lifting the Convex Conjugate in Lagrangian Relaxations: A Tractable
  Approach for Continuous Markov Random Fields",,,,,"math.OC cs.CV","http://creativecommons.org/licenses/by/4.0/","  Dual decomposition approaches in nonconvex optimization may suffer from a
duality gap. This poses a challenge when applying them directly to nonconvex
problems such as MAP-inference in a Markov random field (MRF) with continuous
state spaces. To eliminate such gaps, this paper considers a reformulation of
the original nonconvex task in the space of measures. This infinite-dimensional
reformulation is then approximated by a semi-infinite one, which is obtained
via a piecewise polynomial discretization in the dual. We provide a geometric
intuition behind the primal problem induced by the dual discretization and draw
connections to optimization over moment spaces. In contrast to existing
discretizations which suffer from a grid bias, we show that a piecewise
polynomial discretization better preserves the continuous nature of our
problem. Invoking results from optimal transport theory and convex algebraic
geometry we reduce the semi-infinite program to a finite one and provide a
practical implementation based on semidefinite programming. We show,
experimentally and in theory, that the approach successfully reduces the
duality gap. To showcase the scalability of our approach, we apply it to the
stereo matching problem between two images.
","[{""version"":""v1"",""created"":""Tue, 13 Jul 2021 12:31:06 GMT""},{""version"":""v2"",""created"":""Mon, 16 May 2022 10:41:07 GMT""}]","2022-05-17"
"2107.06029","Nikolaj Kn{\o}sgaard","Nikolaj R{\o}rb{\ae}k Kn{\o}sgaard, Kristian Sommer Thygesen","Representing individual electronic states for machine learning GW band
  structures of 2D materials",,"Nature Communications volume 13, Article number: 468 (2022)","10.1038/s41467-022-28122-0",,"physics.comp-ph","http://creativecommons.org/licenses/by/4.0/","  Choosing optimal representation methods of atomic and electronic structures
is essential when machine learning properties of materials. We address the
problem of representing quantum states of electrons in a solid for the purpose
of machine leaning state-specific electronic properties. Specifically, we
construct a fingerprint based on energy decomposed operator matrix elements
(ENDOME) and radially decomposed projected density of states (RAD-PDOS), which
are both obtainable from a standard density functional theory (DFT)
calculation. Using such fingerprints we train a gradient boosting model on a
set of 46k G$_0$W$_0$ quasiparticle energies. The resulting model predicts the
self-energy correction of states in materials not seen by the model with a mean
absolute error of 0.14 eV. By including the material's calculated dielectric
constant in the fingerprint the error can be further reduced by 30%, which we
find is due to an enhanced ability to learn the correlation/screening part of
the self-energy. Our work paves the way for accurate estimates of quasiparticle
band structures at the cost of a standard DFT calculation.
","[{""version"":""v1"",""created"":""Tue, 13 Jul 2021 12:32:06 GMT""},{""version"":""v2"",""created"":""Wed, 17 Nov 2021 19:18:50 GMT""},{""version"":""v3"",""created"":""Mon, 7 Feb 2022 14:04:58 GMT""}]","2022-02-08"
"2107.06030","Richard Brent","Richard P. Brent","Jonathan Michael Borwein 1951-2016: Life and Legacy","20 pages, 2 figures, title changed in v3, reference added in v4,
  fixed a citation in v5","Maple Transactions 1, 2 (2021), 14358.1-13","10.5206/mt.v1i2.14358",,"math.HO math.NT math.OC","http://arxiv.org/licenses/nonexclusive-distrib/1.0/","  Jonathan M. Borwein (1951-2016) was a prolific mathematician whose career
spanned several countries (UK, Canada, USA, Australia) and whose many interests
included analysis, optimisation, number theory, special functions, experimental
mathematics, mathematical finance, mathematical education, and visualisation.
We describe his life and legacy, and give an annotated bibliography of some of
his most significant books and papers.
","[{""version"":""v1"",""created"":""Tue, 13 Jul 2021 12:36:13 GMT""},{""version"":""v2"",""created"":""Sun, 18 Jul 2021 01:22:01 GMT""},{""version"":""v3"",""created"":""Sat, 21 Aug 2021 12:30:02 GMT""},{""version"":""v4"",""created"":""Wed, 15 Sep 2021 12:55:25 GMT""},{""version"":""v5"",""created"":""Fri, 29 Oct 2021 11:28:22 GMT""}]","2021-11-02"
"2107.06031","Alberto Barbado Gonzalez","Alberto Barbado, \'Oscar Corcho","Vehicle Fuel Optimization Under Real-World Driving Conditions: An
  Explainable Artificial Intelligence Approach","30 pages, 15 Figures",,,,"cs.AI","http://creativecommons.org/licenses/by-nc-nd/4.0/","  Fuel optimization of diesel and petrol vehicles within industrial fleets is
critical for mitigating costs and reducing emissions. This objective is
achievable by acting on fuel-related factors, such as the driving behaviour
style.
  In this study, we developed an Explainable Boosting Machine (EBM) model to
predict fuel consumption of different types of industrial vehicles, using
real-world data collected from 2020 to 2021. This Machine Learning model also
explains the relationship between the input factors and fuel consumption,
quantifying the individual contribution of each one of them. The explanations
provided by the model are compared with domain knowledge in order to see if
they are aligned. The results show that the 70% of the categories associated to
the fuel-factors are similar to the previous literature.
  With the EBM algorithm, we estimate that optimizing driving behaviour
decreases fuel consumption between 12% and 15% in a large fleet (more than 1000
vehicles).
","[{""version"":""v1"",""created"":""Tue, 13 Jul 2021 12:39:59 GMT""},{""version"":""v2"",""created"":""Thu, 15 Jul 2021 09:53:09 GMT""},{""version"":""v3"",""created"":""Thu, 22 Jul 2021 12:09:21 GMT""}]","2021-07-23"
"2107.06032","Jerome Petri","J. P\'etri & D. Mitra","Young radio-loud gamma-ray pulsar light-curve fitting","Recommended for publication in Astronomy & Astrophysics","A&A 654, A106 (2021)","10.1051/0004-6361/202141272",,"astro-ph.HE","http://arxiv.org/licenses/nonexclusive-distrib/1.0/","  Observing simultaneously pulsed radio and gamma-ray emission from these stars
helps to constrain the geometry and radiation mechanisms within their
magnetosphere and to localize the multiple photon production sites. In this
paper, we fit the time-aligned gamma-ray light-curves of young radio-loud
gamma-ray pulsars. We assume a dipole force-free magnetosphere where radio
photons emanate from high altitude above the polar caps and gamma-rays
originate from outside the light-cylinder, within the striped wind current
sheet. We compute a full atlas of radio and gamma-ray pulse profiles depending
on the magnetic axis obliquity and line of sight inclination with respect to
the neutron star rotation axis. By applying a $\rchi^2$ fitting technique, we
are able to pin down accurately the magnetosphere geometry. Further constrains
are obtained from radio polarization measurement following the rotating vector
model, including aberration and retardation effects. We found a good agreement
between our model and the time-aligned single or double peaked gamma-ray pulsar
observations. We deduce the magnetic inclination angle and the observer line of
sight with respect to the rotation axis within a small error bar. The
distinction between radio-loud or radio-quiet gamma-ray pulsars or only radio
pulsars can entirely be related to the geometry of the associated emitting
regions. The high altitude polar cap model combined with the striped wind
represents a minimalistic approach able to reproduce a wealth of gamma-ray
pulse profiles for young radio pulsars. Based on self-consistent force-free
simulations, it gives a full geometrical picture of the emission properties
without resorting to detailed knowledge of the individual particle dynamics and
energetics.
","[{""version"":""v1"",""created"":""Tue, 13 Jul 2021 12:40:21 GMT""}]","2021-10-20"
"2107.06033","Haesung Lee","Haesung Lee","Conservativeness and uniqueness of invariant measures related to
  non-symmetric divergence type operators","23 pages. typo corrected, some content added",,,,"math.PR","http://arxiv.org/licenses/nonexclusive-distrib/1.0/","  We present conservativeness criteria for sub-Markovian semigroups generated
by divergence type operators with specified infinitesimally invariant measures.
The conservativeness criteria in this article are derived by $L^1$-uniqueness
and imply that a given infinitesimally invariant measure becomes an invariant
measure. We explore further conditions on the coefficients of the partial
differential operators that ensure the uniqueness of the invariant measure
beyond the case where the corresponding semigroups are recurrent. A main
observation is that for conservativeness and uniqueness of invariant measures
in this article, no growth conditions are required for the partial derivatives
related to the anti-symmetric matrix of functions $C=(c_{ij})_{1 \leq i,j \leq
d}$ that determine a part of the drift coefficient. As stochastic counterparts,
our results can be applied to show not only the existence of a pathwise unique
and strong solution up to infinity to a corresponding It\^{o}-SDE, but also the
existence and uniqueness of invariant measures for the family of strong
solutions.
","[{""version"":""v1"",""created"":""Tue, 13 Jul 2021 12:41:39 GMT""},{""version"":""v2"",""created"":""Sat, 21 May 2022 15:28:49 GMT""},{""version"":""v3"",""created"":""Sun, 14 Aug 2022 07:10:43 GMT""}]","2022-08-16"
"2107.06034","Roberto A. Morales","Ernesto Arganda, Antonio Delgado, Roberto A. Morales, Mariano Quir\'os","Search strategy for gluinos at the LHC with a Higgs boson decaying into
  tau leptons","11 pages, 1 table, 3 figures",,"10.1140/epjc/s10052-022-10951-4","IFT-UAM/CSIC-21-79","hep-ph","http://creativecommons.org/licenses/by/4.0/","  The possibility in supersymmetric scenarios that the dark matter candidate is
a Higgsino-like neutralino means that its production can be associated with
Higgs bosons. Taking advantage of this fact, we propose a LHC search strategy
for gluinos with $\tau$ leptons in the final state, coming from the decay of a
Higgs boson. We consider the strong production of a pair of gluinos, one of
which decays into the Higgsino plus jets while the other decays into the bino
plus jets. In turn, this bino decays into the Higgsino plus a Higgs boson which
finally decays into a $\tau$-lepton pair. Therefore, the experimental signature
under study consists of 4 jets, 2 $\tau$ leptons, and a large amount of missing
transverse energy. Our cut-based search strategy allows us to reach, for a LHC
center-of-mass energy of 14 TeV and a total integrated luminosity of 1
ab$^{-1}$, significances of up to 2 standard deviations, considering systematic
uncertainties in the SM background of 30\%. The projections for 3 ab$^{-1}$ are
encouraging, with significances at the evidence level, which in more optimistic
experimental scenarios could exceed 4 standard deviations.
","[{""version"":""v1"",""created"":""Tue, 13 Jul 2021 12:41:51 GMT""}]","2022-11-23"
"2107.06035","Kyudong Choi","Kyudong Choi and In-Jee Jeong","Filamentation near Hill's vortex","32 pages, 1 figure, minor corrections",,,,"math.AP math-ph math.MP","http://arxiv.org/licenses/nonexclusive-distrib/1.0/","  For the axisymmetric incompressible Euler equations, we prove linear in time
filamentation near Hill's vortex: there exists an arbitrary small outward
perturbation growing linearly for all times. This is based on combining the
recent nonlinear orbital stability obtained in [13] with a dynamical
bootstrapping scheme for particle trajectories. These results rigorously
confirm numerical simulations by Pozrikidis [45] in 1986.
","[{""version"":""v1"",""created"":""Tue, 13 Jul 2021 12:42:29 GMT""},{""version"":""v2"",""created"":""Fri, 4 Feb 2022 01:48:57 GMT""}]","2022-02-07"
"2107.06036","Vojt\v{e}ch Kala","Vojt\v{e}ch Kala, Petr Marek and Radim Filip","Cubic nonlinear squeezing and its decoherence","17 pages, 10 figures",,,,"quant-ph","http://arxiv.org/licenses/nonexclusive-distrib/1.0/","  Squeezed states of the harmonic oscillator are a common resource in
applications of quantum technology. If the noise is suppressed in a nonlinear
combination of quadrature operators below threshold for all possible
up-to-quadratic Hamiltonians, the quantum states are non-Gaussian and we refer
to the noise reduction as nonlinear squeezing. Non-Gaussian aspects of quantum
states are often more vulnerable to decoherence due to imperfections appearing
in realistic experimental implementations. Therefore, a stability of nonlinear
squeezing is essential. We analyze the behavior of quantum states with cubic
nonlinear squeezing under loss and dephasing. The properties of nonlinear
squeezed states depend on their initial parameters which can be optimized and
adjusted to achieve the maximal robustness for the potential applications.
","[{""version"":""v1"",""created"":""Tue, 13 Jul 2021 12:43:19 GMT""},{""version"":""v2"",""created"":""Tue, 26 Apr 2022 09:43:41 GMT""}]","2022-04-27"
"2107.06037","Desheng Fu","Desheng Fu, Kensuke Fukusawa","Phase transition and exponential growth of the local polarization in
  CaxBa1-xNb2O6 ferroelectric","26 pages, 11 figure",,,,"cond-mat.mtrl-sci","http://creativecommons.org/licenses/by/4.0/","  CaxBa1-xNb2O6 (CBN) ferroelectric is isostructural with SrxBa1-xNb2O6 (SBN)
that is a prototypical ferroelectric of tetragonal tungsten bronze (TTB)
structure, but shows a much higher Curie temperature Tc than SBN, providing a
wider operation temperature for electro-optical devices. Here, we report the
phase diagram and phase transition of CBN solid solution that are still lack of
understanding. We show that CBN can be stably formed within a solid solution
range of 0.19 <= x <= 0.32. In sharp contrast to SBN that shows crossover from
ferroelectric to relaxor around x~ 0.5, CBN merely exhibits a well-defined
first-order phase transition in the whole solid solution range but shows
polarization precursor dynamics before transition into the ferroelectric phase.
We found that the local polarization exponentially grows with temperature from
the Burns temperature TB toward Tc. The local polarization was estimated to
grow up to several tens pC/cm-^2 before transition into the ferroelectric
phase. Moreover, we found that the substitution of Ca for Ba lowers Tc and TB
and there is a linear correlation between Tc and the length of polar c-axis,
which can be attributed to the chemical pressure effects. These findings may
provide a deep insight into the nature of phase transition in the TTB structure
oxides.
","[{""version"":""v1"",""created"":""Tue, 13 Jul 2021 12:43:29 GMT""}]","2021-07-14"
"2107.06038","Ilya Peshkov M.","Walter Boscheri and Simone Chiocchetti and Ilya Peshkov","A cell-centered implicit-explicit Lagrangian scheme for a unified model
  of nonlinear continuum mechanics on unstructured meshes",,,"10.1016/j.jcp.2021.110852",,"math.NA cs.NA physics.comp-ph physics.flu-dyn","http://creativecommons.org/licenses/by-nc-nd/4.0/","  A cell-centered implicit-explicit updated Lagrangian finite volume scheme on
unstructured grids is proposed for a unified first order hyperbolic formulation
of continuum fluid and solid mechanics. The scheme provably respects the stiff
relaxation limits of the continuous model at the fully discrete level, thus it
is asymptotic preserving. Furthermore, the GCL is satisfied by a compatible
discretization that makes use of a nodal solver to compute vertex-based fluxes
that are used both for the motion of the computational mesh as well as for the
time evolution of the governing PDEs. Second-order accuracy in space is
achieved using a TVD piecewise linear reconstruction, while an
implicit-explicit (IMEX) Runge-Kutta time discretization allows the scheme to
obtain higher accuracy also in time. Particular care is devoted to the design
of a stiff ODE solver, based on approximate analytical solutions of the
governing equations, that plays a crucial role when the visco-plastic limit of
the model is approached. We demonstrate the accuracy and robustness of the
scheme on a wide spectrum of material responses covered by the unified
continuum model that includes inviscid hydrodynamics, viscous heat conducting
fluids, elastic and elasto-plastic solids in multidimensional settings.
","[{""version"":""v1"",""created"":""Tue, 13 Jul 2021 12:43:49 GMT""}]","2022-01-26"
