"2107.05872","Seamus Anderson","Seamus Anderson, Eleanor Sansom, Patrick Shober, Benjamin Hartig,
  Hadrien Devillepoix, Martin Towner","The Proposed Silicate-Sulfuric Acid Process: Mineral Processing for In
  Situ Resource Utilization (ISRU)",,,"10.1016/j.actaastro.2021.07.016",,"astro-ph.EP astro-ph.IM physics.space-ph","http://arxiv.org/licenses/nonexclusive-distrib/1.0/","  Volatile elements and compounds found in extra-terrestrial environments are
often the target of In Situ Resource Utilization (ISRU) studies. Although water
and hydroxide are most commonly the focus of these studies as they can be used
for propellant and human consumption; we instead focus on the possible
exploitation of sulfur and how it could be utilized to produce building
materials on the Moon, Mars and Asteroids. We describe the physical and
chemical pathways for extracting sulfur from native sulfide minerals,
manufacturing sulfuric acid in situ, and using the produced acid to dissolve
native silicate minerals. The final products of this process, which we call the
Silicate-Sulfuric Acid Process (SSAP), include iron metal, silica, oxygen and
metal oxides, all of which are crucial in the scope of a sustainable,
space-based economy. Although our proposed methodology requires an initial
investment of water, oxygen, and carbon dioxide, we show that all of these
volatiles are recovered and reused in order to repeat the process. We calculate
the product yield from this process if it were enacted on the lunar highlands,
lunar mare, Mars, as well as an array of asteroid types.
","[{""version"":""v1"",""created"":""Tue, 13 Jul 2021 06:43:41 GMT""}]","2021-08-18"
"2107.05873","Zhi-Yuan Wei","Zhi-Yuan Wei, Daniel Malz, J. Ignacio Cirac","Sequential generation of projected entangled-pair states","5 pages, 4 figures, and supplementary materials","Physical Review Letters 128, 010607 (2022)","10.1103/PhysRevLett.128.010607",,"quant-ph","http://arxiv.org/licenses/nonexclusive-distrib/1.0/","  We introduce plaquette projected entangled-pair states, a class of states in
a lattice that can be generated by applying sequential unitaries acting on
plaquettes of overlapping regions. They satisfy area-law entanglement, possess
long-range correlations, and naturally generalize other relevant classes of
tensor network states. We identify a subclass that can be more efficiently
prepared in a radial fashion and that contains the family of isometric tensor
network states [M. P. Zaletel and F. Pollmann, Phys. Rev. Lett. 124, 037201
(2020)]. We also show how this subclass can be efficiently prepared using an
array of photon sources.
","[{""version"":""v1"",""created"":""Tue, 13 Jul 2021 06:45:44 GMT""},{""version"":""v2"",""created"":""Wed, 12 Jan 2022 00:37:21 GMT""}]","2022-01-13"
"2107.05874","G\""ok\c{c}en Dilaver","Selma Alt{\i}nok, G\""ok\c{c}en Dilaver","Minimum Generating Sets for Complete Graphs",,,,,"math.AC math.CO","http://arxiv.org/licenses/nonexclusive-distrib/1.0/","  Let $G$ be a graph whose edges are labeled by ideals of a commutative ring
$R$ with identity. Such a graph is called an edge-labeled graph over $R$. A
generalized spline is a vertex labeling so that the difference between the
labels of any two adjacent vertices lies in the ideal corresponding to the
edge. These generalized splines form a module over $R$. In this paper, we
consider complete graphs whose edges are labeled with proper ideals of
$\mathbb{Z} / m\mathbb{Z}$. We compute minimum generating sets of constant
flow-up classes for spline modules on edge-labeled complete graphs over
$\mathbb{Z} / m\mathbb{Z}$ and their rank under some restrictions.
","[{""version"":""v1"",""created"":""Tue, 13 Jul 2021 06:48:07 GMT""},{""version"":""v2"",""created"":""Thu, 20 Jan 2022 13:55:49 GMT""}]","2022-01-21"
"2107.05875","Richard Weiss","Richard M. Weiss and Bernhard M\""uhlherr","Veldkamp quadrangles and polar spaces","27 pages",,,,"math.CO math.GR","http://creativecommons.org/licenses/by/4.0/","  Veldkamp polygons are certain graphs $\Gamma=(V,E)$ such that for each $v\in
V$, $\Gamma_v$ is endowed with a symmetric anti-reflexive relation $\equiv_v$.
These relations are all trivial if and only if $\Gamma$ is a thick generalized
polygon. A Veldkamp polygon is called flat if no two vertices have the same set
of vertices that are opposite in a natural sense. We explore the connection
between Veldkamp quadrangles and polar spaces. Using this connection, we give
the complete classification of flat Veldkamp quadrangles in which some but not
all of the relations $\equiv_v$ are trivial.
","[{""version"":""v1"",""created"":""Tue, 13 Jul 2021 06:50:58 GMT""}]","2021-07-14"
"2107.05876","Long Zhou","Long Zhou, Jinyu Li, Eric Sun, Shujie Liu","A Configurable Multilingual Model is All You Need to Recognize All
  Languages",,,,,"eess.AS cs.CL cs.SD","http://arxiv.org/licenses/nonexclusive-distrib/1.0/","  Multilingual automatic speech recognition (ASR) models have shown great
promise in recent years because of the simplified model training and deployment
process. Conventional methods either train a universal multilingual model
without taking any language information or with a 1-hot language ID (LID)
vector to guide the recognition of the target language. In practice, the user
can be prompted to pre-select several languages he/she can speak. The
multilingual model without LID cannot well utilize the language information set
by the user while the multilingual model with LID can only handle one
pre-selected language. In this paper, we propose a novel configurable
multilingual model (CMM) which is trained only once but can be configured as
different models based on users' choices by extracting language-specific
modules together with a universal model from the trained CMM. Particularly, a
single CMM can be deployed to any user scenario where the users can pre-select
any combination of languages. Trained with 75K hours of transcribed anonymized
Microsoft multilingual data and evaluated with 10-language test sets, the
proposed CMM improves from the universal multilingual model by 26.0%, 16.9%,
and 10.4% relative word error reduction when the user selects 1, 2, or 3
languages, respectively. CMM also performs significantly better on
code-switching test sets.
","[{""version"":""v1"",""created"":""Tue, 13 Jul 2021 06:52:41 GMT""}]","2021-07-14"
"2107.05877","Frederic Lardeux","Fr\'ed\'eric Lardeux (LERIA), Eric Monfroy (LERIA)","GA and ILS for optimizing the size of NFA models",,"The 8th International Conference on Metaheuristics and Nature
  Inspired Computing (META), Oct 2021, Marrakech, Morocco",,,"cs.AI","http://arxiv.org/licenses/nonexclusive-distrib/1.0/","  Grammatical inference consists in learning a formal grammar (as a set of
rewrite rules or a finite state machine). We are concerned with learning
Nondeterministic Finite Automata (NFA) of a given size from samples of positive
and negative words. NFA can naturally be modeled in SAT. The standard model [1]
being enormous, we also try a model based on prefixes [2] which generates
smaller instances. We also propose a new model based on suffixes and a hybrid
model based on prefixes and suffixes. We then focus on optimizing the size of
generated SAT instances issued from the hybrid models. We present two
techniques to optimize this combination, one based on Iterated Local Search
(ILS), the second one based on Genetic Algorithm (GA). Optimizing the
combination significantly reduces the SAT instances and their solving time, but
at the cost of longer generation time. We, therefore, study the balance between
generation time and solving time thanks to some experimental comparisons, and
we analyze our various model improvements.
","[{""version"":""v1"",""created"":""Tue, 13 Jul 2021 06:52:41 GMT""}]","2021-07-14"
"2107.05878","Ian Manchester","Vera L. J. Somers and Ian R. Manchester","Minimizing the Risk of Spreading Processes via Surveillance Schedules
  and Sparse Control","Journal submission",,,,"eess.SY cs.SY math.OC","http://arxiv.org/licenses/nonexclusive-distrib/1.0/","  In this paper, we propose an optimization framework that combines
surveillance schedules and sparse control to bound the risk of spreading
processes such as epidemics and wildfires. Here, risk is considered the risk of
an undetected outbreak, i.e. the product of the probability of an outbreak and
the impact of that outbreak, and we can bound or minimize the risk by resource
allocation and persistent monitoring schedules. The presented framework
utilizes the properties of positive systems and convex optimization to provide
scalable algorithms for both surveillance and intervention purposes. We
demonstrate with different spreading process examples how the method can
incorporate different parameters and scenarios such as a vaccination strategy
for epidemics and the effect of vegetation, wind and outbreak rate on a
wildfire in persistent monitoring scenarios.
","[{""version"":""v1"",""created"":""Tue, 13 Jul 2021 07:01:49 GMT""}]","2021-07-14"
"2107.05879","Sergey Sazonov","M. Pavlinsky, S. Sazonov, R. Burenin, E. Filippova, R. Krivonos, V.
  Arefiev, M. Buntov, C.-T. Chen, S. Ehlert, I. Lapshov, V. Levin, A.
  Lutovinov, A. Lyapin, I. Mereminskiy, S. Molkov, B.D. Ramsey, A. Semena, N.
  Semena, A. Shtykovsky, R. Sunyaev, A. Tkachenko, D.A. Swartz, A. Vikhlinin","SRG/ART-XC all-sky X-ray survey: Catalog of sources detected during the
  first year","To appear on A&A, Special Issue: The Early Data Release of eROSITA
  and Mikhail Pavlinsky ART-XC on the SRG Mission; 40 pages, 10 figures, the
  catalog of sources is included","A&A 661, A38 (2022)","10.1051/0004-6361/202141770",,"astro-ph.HE","http://creativecommons.org/licenses/by/4.0/","  We present a first catalog of sources detected by the Mikhail Pavlinsky
ART-XC telescope on board the SRG observatory in the 4-12 keV energy band
during its ongoing all-sky survey. The catalog comprises 867 sources detected
on the combined map of the first two 6-month scans of the sky (December 2019 -
December 2020). The achieved sensitivity to point sources varies between
~4x10^-12 erg/s/cm2 near the ecliptic plane and ~8x10^-13 erg/s/cm2 (4-12 keV)
near the ecliptic poles, and the typical localization accuracy is ~15 arcsec.
Of the 750 sources of known or suspected origin in the catalog, 56% are
extragalactic (mostly active galactic nuclei, AGN; and clusters of galaxies)
and the rest are Galactic (mostly cataclysmic variables, CVs; and low- and
high-mass X-ray binaries). For 114 sources, ART-XC has detected X-rays for the
first time. Although the majority of these (~80) are expected to be spurious
(given the adopted detection threshold), there can be a significant number of
newly discovered astrophysical objects. We have started a program of optical
follow-up observations of the new and previously unidentified X-ray sources,
which has already led to the identification of several AGN and CVs. With the
SRG all-sky survey planned to continue for a total of four years, we can expect
the ART-XC survey in the 4-12 keV band to significantly surpass previous
surveys that were carried out in similar (medium X-ray) energy bands in terms
of the combination of angular resolution, sensitivity, and sky coverage.
","[{""version"":""v1"",""created"":""Tue, 13 Jul 2021 07:03:50 GMT""},{""version"":""v2"",""created"":""Thu, 30 Sep 2021 12:52:23 GMT""}]","2022-05-18"
"2107.05880","Andronikos Paliathanasis","Andronikos Paliathanasis","Dynamics in interacting scalar-torsion theory","19 pages, 4 figures, to appear in Universe, Special Issue: ""Probing
  the Dark Universe with Theory and Observations""","Universe 2021, 7(7), 244","10.3390/universe7070244",,"gr-qc math-ph math.MP","http://creativecommons.org/licenses/by/4.0/","  In a spatially flat \ Friedmann--Lema\^{\i}tre--Robertson--Walker background
space we consider a scalar-torsion gravitational model which has similar
properties with the dilaton theory. This teleparallel model is invariant under
a discrete transformation similar to the Gasperini-Veneziano duality
transformation. Moreover, in the gravitational Action integral we introduce the
Lagrangian function of a pressureless fluid source which is coupled to the
teleparallel dilaton field. This specific gravitational theory with interaction
in the dark sector of the universe is investigated by using methods of the
dynamical system analysis. We calculate that the theory provides various areas
of special interest for the evolution of the cosmological history. Inflationary
scaling solutions and the de Sitter universe is recovered. Furthermore, we
calculate that there exist an attractor which provides a stable solution where
the two fluid components, the scalar field and the pressureless matter,
contribute in the cosmological fluid. This solution is of special interest
because it can describe the present epoch. Finally, the qualitative evolution
of the cosmographic parameters is discussed.
","[{""version"":""v1"",""created"":""Tue, 13 Jul 2021 07:05:11 GMT""},{""version"":""v2"",""created"":""Fri, 16 Jul 2021 07:29:14 GMT""}]","2021-07-19"
"2107.05881","Apurba Nandi","Apurba Nandi, Chen Qu, Paul L. Houston, Riccardo Conte, and Joel M.
  Bowman","A CCSD(T)-based permutationally invariant polynomial 4-body potential
  for water",,"J. Phys. Chem. Lett. 2021, 12, 10318-10324","10.1021/acs.jpclett.1c03152",,"physics.chem-ph","http://creativecommons.org/publicdomain/zero/1.0/","  We report a permutationally invariant polynomial (PIP) potential energy
surface for the water 4-body interaction. This 12-atom PES is a fit to 2119,
symmetry-unique, CCSD(T)-F12a/haTZ (aug-cc-pVTZ basis for 'O' atom and cc-pVTZ
basis for 'H' atom) 4-b interaction energies. These come from low-level,
direct-dynamics calculations, tetramer fragments from an MD water simulation at
300 K, and from the water hexamer, heptamer, decamer, and 13-mer clusters. The
PIP basis is purified to ensure that the 4-b potential goes rigorously to zero
in monomer+trimer and dimer+dimer dissociations for all possible such
fragments. The 4-b energies of isomers of the hexamer calculated with the new
surface are shown to be in better agreement with benchmark CCSD(T) results than
those from the MB-pol potential. Other tests validate the high-fidelity of the
PES.
","[{""version"":""v1"",""created"":""Tue, 13 Jul 2021 07:10:45 GMT""}]","2021-10-27"
"2107.05882","Alberto Elduque","Cristina Draper and Alberto Elduque","Classification of real simple symplectic triple systems","45 pages","Anal. Math. Phys. 12 (2022), no. 3, Paper No. 69, 46 pp","10.1007/s13324-022-00677-7",,"math.RA","http://arxiv.org/licenses/nonexclusive-distrib/1.0/","  The simple symplectic triple systems over the real numbers are classified up
to isomorphism, and linear models of all of them are provided. Besides the
split cases, one for each complex simple Lie algebra, there are two kinds of
non-split real simple symplectic triple systems with classical enveloping
algebra, called unitarian and quaternionic types, and five non-split real
simple symplectic triple systems with exceptional enveloping algebra.
","[{""version"":""v1"",""created"":""Tue, 13 Jul 2021 07:14:20 GMT""}]","2022-05-16"
"2107.05883","Haicheng Zhang","Li Wang, Jiaqun Wei, Haicheng Zhang","Hall algebras of extriangulated categories","21 pages",,,,"math.RT math.CT math.QA math.RA","http://arxiv.org/licenses/nonexclusive-distrib/1.0/","  Recently, Nakaoka and Palu introduced a notion of extriangulated categories.
This is a unification of exact categories and triangulated categories. In this
paper, we generalize the definitions of Hall algebras of exact categories and
triangulated categories to extriangulated categories.
","[{""version"":""v1"",""created"":""Tue, 13 Jul 2021 07:14:27 GMT""},{""version"":""v2"",""created"":""Tue, 20 Jul 2021 09:34:12 GMT""},{""version"":""v3"",""created"":""Tue, 3 Aug 2021 13:16:34 GMT""}]","2021-08-04"
"2107.05884","Junkun Yuan","Junkun Yuan, Anpeng Wu, Kun Kuang, Bo Li, Runze Wu, Fei Wu, Lanfen Lin","Auto IV: Counterfactual Prediction via Automatic Instrumental Variable
  Decomposition","Accepted by ACM Transactions on Knowledge Discovery from Data (TKDD)
  2022",,"10.1145/3494568",,"cs.LG cs.AI","http://arxiv.org/licenses/nonexclusive-distrib/1.0/","  Instrumental variables (IVs), sources of treatment randomization that are
conditionally independent of the outcome, play an important role in causal
inference with unobserved confounders. However, the existing IV-based
counterfactual prediction methods need well-predefined IVs, while it is an art
rather than science to find valid IVs in many real-world scenes. Moreover, the
predefined hand-made IVs could be weak or erroneous by violating the conditions
of valid IVs. These thorny facts hinder the application of the IV-based
counterfactual prediction methods. In this paper, we propose a novel Automatic
Instrumental Variable decomposition (AutoIV) algorithm to automatically
generate representations serving the role of IVs from observed variables (IV
candidates). Specifically, we let the learned IV representations satisfy the
relevance condition with the treatment and exclusion condition with the outcome
via mutual information maximization and minimization constraints, respectively.
We also learn confounder representations by encouraging them to be relevant to
both the treatment and the outcome. The IV and confounder representations
compete for the information with their constraints in an adversarial game,
which allows us to get valid IV representations for IV-based counterfactual
prediction. Extensive experiments demonstrate that our method generates valid
IV representations for accurate IV-based counterfactual prediction.
","[{""version"":""v1"",""created"":""Tue, 13 Jul 2021 07:30:21 GMT""},{""version"":""v2"",""created"":""Thu, 13 Jan 2022 07:12:14 GMT""}]","2022-01-14"
"2107.05885","Chao Feng","Chao Feng, Shi-jie We","Exploiting Network Structures to Improve Semantic Representation for the
  Financial Domain","5 pages, 4 figures",,,,"cs.CL cs.LG","http://creativecommons.org/licenses/by-nc-sa/4.0/","  This paper presents the participation of the MiniTrue team in the FinSim-3
shared task on learning semantic similarities for the financial domain in
English language. Our approach combines contextual embeddings learned by
transformer-based language models with network structures embeddings extracted
on external knowledge sources, to create more meaningful representations of
financial domain entities and terms. For this, two BERT based language models
and a knowledge graph embedding model are used. Besides, we propose a voting
function to joint three basic models for the final inference. Experimental
results show that the model with the knowledge graph embeddings has achieved a
superior result than these models with only contextual embeddings.
Nevertheless, we also observe that our voting function brings an extra benefit
to the final system.
","[{""version"":""v1"",""created"":""Tue, 13 Jul 2021 07:32:18 GMT""}]","2021-07-14"
"2107.05886","Albert Atserias","Albert Atserias and V\'ictor Dalmau","Promise Constraint Satisfaction and Width",,,,,"cs.CC cs.DM","http://creativecommons.org/licenses/by/4.0/","  We study the power of the bounded-width consistency algorithm in the context
of the fixed-template Promise Constraint Satisfaction Problem (PCSP). Our main
technical finding is that the template of every PCSP that is solvable in
bounded width satisfies a certain structural condition implying that its
algebraic closure-properties include weak near unanimity polymorphisms of all
large arities. While this parallels the standard (non-promise) CSP theory, the
method of proof is quite different and applies even to the regime of sublinear
width. We also show that, in contrast with the CSP world, the presence of weak
near unanimity polymorphisms of all large arities does not guarantee
solvability in bounded width. The separating example is even solvable in the
second level of the Sherali-Adams (SA) hierarchy of linear programming
relaxations. This shows that, unlike for CSPs, linear programming can be
stronger than bounded width. A direct application of these methods also show
that the problem of $q$-coloring $p$-colorable graphs is not solvable in
bounded or even sublinear width, for any two constants $p$ and $q$ such that $3
\leq p \leq q$. Turning to algorithms, we note that Wigderson's algorithm for
$O(\sqrt{n})$-coloring $3$-colorable graphs with $n$ vertices is implementable
in width $4$. Indeed, by generalizing the method we see that, for any $\epsilon
> 0$ smaller than $1/2$, the optimal width for solving the problem of
$O(n^\epsilon)$-coloring $3$-colorable graphs with $n$ vertices lies between
$n^{1-3\epsilon}$ and $n^{1-2\epsilon}$. The upper bound gives a simple
$2^{\Theta(n^{1-2\epsilon}\log(n))}$-time algorithm that, asymptotically, beats
the straightforward $2^{\Theta(n^{1-\epsilon})}$ bound that follows from
partitioning the graph into $O(n^\epsilon)$ many independent parts each of size
$O(n^{1-\epsilon})$.
","[{""version"":""v1"",""created"":""Tue, 13 Jul 2021 07:36:09 GMT""}]","2021-07-14"
"2107.05887","Eslam Bakr Mohamed","Eslam Mohamed and Ahmad El-Sallab","ST-DETR: Spatio-Temporal Object Traces Attention Detection Transformer","arXiv admin note: substantial text overlap with arXiv:2106.11401",,,,"cs.CV","http://creativecommons.org/licenses/by-nc-nd/4.0/","  We propose ST-DETR, a Spatio-Temporal Transformer-based architecture for
object detection from a sequence of temporal frames. We treat the temporal
frames as sequences in both space and time and employ the full attention
mechanisms to take advantage of the features correlations over both dimensions.
This treatment enables us to deal with frames sequence as temporal object
features traces over every location in the space. We explore two possible
approaches; the early spatial features aggregation over the temporal dimension,
and the late temporal aggregation of object query spatial features. Moreover,
we propose a novel Temporal Positional Embedding technique to encode the time
sequence information. To evaluate our approach, we choose the Moving Object
Detection (MOD)task, since it is a perfect candidate to showcase the importance
of the temporal dimension. Results show a significant 5% mAP improvement on the
KITTI MOD dataset over the 1-step spatial baseline.
","[{""version"":""v1"",""created"":""Tue, 13 Jul 2021 07:38:08 GMT""},{""version"":""v2"",""created"":""Sat, 24 Jul 2021 19:47:14 GMT""}]","2021-07-27"
"2107.05888","Wei Xu","Wei Xu","Asymptotic Results for Rough Continuous-state Branching Processes","8 pages",,,,"math.PR","http://creativecommons.org/publicdomain/zero/1.0/","  In this paper we provide explicit representations of Laplace transforms of
extinction time and total progeny of rough continuous-state branching processes
introduced in [7]. Also, we show that their tail distributions are much fatter
than those of Feller branching diffusions.
","[{""version"":""v1"",""created"":""Tue, 13 Jul 2021 07:38:53 GMT""}]","2021-07-14"
"2107.05889","Lorenzo Cavallina","Lorenzo Cavallina, Giorgio Poggesi, Toshiaki Yachimura","Quantitative stability estimates for a two-phase Serrin-type
  overdetermined problem","23 pages, 5 figures",,,,"math.AP","http://creativecommons.org/licenses/by/4.0/","  In this paper, we deal with an overdetermined problem of Serrin-type with
respect to a two-phase elliptic operator in divergence form with piecewise
constant coefficients. In particular, we consider the case where the two-phase
overdetermined problem is close to the one-phase setting. First, we show
quantitative stability estimates for the two-phase problem via a one-phase
stability result. Furthermore, we prove non-existence for the corresponding
inner problem by the aforementioned two-phase stability result.
","[{""version"":""v1"",""created"":""Tue, 13 Jul 2021 07:39:47 GMT""}]","2021-07-14"
"2107.05890","Antonio Boccuto","Antonio Boccuto, Ivan Gerace, Valentina Giorgetti, Federico Greco","Gamma-matrices: a new class of simultaneously diagonalizable matrices",,,,,"math.NA cs.NA","http://arxiv.org/licenses/nonexclusive-distrib/1.0/","  In order to precondition Toeplitz systems, we present a new class of
simultaneously diagonalizable real matrices, the Gamma-matrices, which include
both symmetric circulant matrices and a subclass of the set of all reverse
circulant matrices. We define some algorithms for fast computation of the
product between a Gamma-matrix and a real vector and between two
Gamma-matrices. Moreover, we illustrate a technique of approximating a real
symmetric Toeplitz matrix by a Gamma-matrix, and we show that the eigenvalues
of the preconditioned matrix are clustered around zero with the exception of at
most a finite number of terms.
","[{""version"":""v1"",""created"":""Tue, 13 Jul 2021 07:40:03 GMT""}]","2021-07-14"
