"2107.05702","Monica Gallegos-Garcia","Monica Gallegos-Garcia, Christopher P L Berry, Pablo Marchant, Vicky
  Kalogera","Binary Black Hole Formation with Detailed Modeling: Stable Mass Transfer
  Leads to Lower Merger Rates","17 pages (13 main text), 5 figures, ApJ, in press",,"10.3847/1538-4357/ac2610",,"astro-ph.HE astro-ph.SR","http://arxiv.org/licenses/nonexclusive-distrib/1.0/","  Rapid binary population synthesis codes are often used to investigate the
evolution of compact-object binaries. They typically rely on analytical fits of
single-star evolutionary tracks and parameterized models for interactive phases
of evolution (e.g., mass-transfer on thermal timescale, determination of
dynamical instability, and common envelope) that are crucial to predict the
fate of binaries. These processes can be more carefully implemented in stellar
structure and evolution codes such as MESA. To assess the impact of such
improvements, we compare binary black hole mergers as predicted in models with
the rapid binary population synthesis code COSMIC to models ran with MESA
simulations through mass transfer and common-envelope treatment. We find that
results significantly differ in terms of formation paths, the orbital periods
and mass ratios of merging binary black holes, and consequently merger rates.
While common-envelope evolution is the dominant formation channel in COSMIC,
stable mass transfer dominates in our MESA models. Depending upon the black
hole donor mass, and mass-transfer and common-envelope physics, at sub-solar
metallicity COSMIC overproduces the number of binary black hole mergers by
factors of 2--35 with a significant fraction of them having merger times orders
of magnitude shorter than the binary black holes formed when using detailed
MESA models. Therefore we find that some binary black hole merger rate
predictions from rapid population syntheses of isolated binaries may be
overestimated by factors of ~5--500. We conclude that the interpretation of
gravitational-wave observations requires the use of detailed treatment of these
interactive binary phases.
","[{""version"":""v1"",""created"":""Mon, 12 Jul 2021 19:37:30 GMT""},{""version"":""v2"",""created"":""Thu, 21 Oct 2021 23:44:46 GMT""},{""version"":""v3"",""created"":""Fri, 5 Nov 2021 16:02:11 GMT""}]","2021-12-08"
"2107.05703","Edriss Titi","Claude W. Bardos and Edriss S. Titi","$C^{0,\alpha}$ boundary regularity for the pressure in weak solutions of
  the $2d$ Euler equations",,,"10.1098/rsta.2021.0073",,"math.AP","http://creativecommons.org/licenses/by/4.0/","  The purpose of this note is to give a complete proof of a $C^{0,\alpha}$
regularity result for the pressure for weak solutions of the two-dimensional
""incompressible Euler equations"" when the fluid velocity enjoys the same type
of regularity in a compact simply connected domain with $C^2$ boundary. To
accomplish our result we realize that it is compulsory to introduce a new weak
formulation for the boundary condition of the pressure which is consistent
with, and equivalent to, that of classical solutions.
","[{""version"":""v1"",""created"":""Mon, 12 Jul 2021 19:39:01 GMT""},{""version"":""v2"",""created"":""Tue, 23 Nov 2021 03:18:33 GMT""}]","2022-04-06"
"2107.05704","Reuben Binns Dr","Reuben Binns, Reuben Kirkham","How Could Equality and Data Protection Law Shape AI Fairness for People
  with Disabilities?",,,,,"cs.CY cs.HC","http://creativecommons.org/licenses/by/4.0/","  This article examines the concept of 'AI fairness' for people with
disabilities from the perspective of data protection and equality law. This
examination demonstrates that there is a need for a distinctive approach to AI
fairness that is fundamentally different to that used for other protected
characteristics, due to the different ways in which discrimination and data
protection law applies in respect of Disability. We articulate this new agenda
for AI fairness for people with disabilities, explaining how combining data
protection and equality law creates new opportunities for disabled people's
organisations and assistive technology researchers alike to shape the use of
AI, as well as to challenge potential harmful uses.
","[{""version"":""v1"",""created"":""Mon, 12 Jul 2021 19:41:01 GMT""}]","2021-07-14"
"2107.05705","Goutam Haldar","Goutam Haldar","Uniqueness of an entire function sharing two values jointly with its
  differential polynomials","17 pages",,,,"math.CV","http://creativecommons.org/licenses/by/4.0/","  In this paper, we continue to investigate the uniqueness problem when an
entire function $f$ and its linear differential polynomial $L(f)$ share two
distinct complex values CMW (counting multiplicities in the weak sense)
jointly. Also, We investigate the same problem when $f$ and its differential
monomial $M(f)$ share two distinct complex values CMW. Our results generalize
the recent result of Lahiri (Comput. Methods Funct. Theory,
https://doi.org/10.1007/s40315-020-00355-4).
","[{""version"":""v1"",""created"":""Mon, 12 Jul 2021 19:47:11 GMT""}]","2021-07-14"
"2107.05706","Barry Minemyer","Andrew Clickard and Barry Minemyer","Synthetic Geometry in Hyperbolic Simplices",,"Involve 15 (2022) 885-906","10.2140/involve.2022.15.885",,"math.DG math.GT math.MG","http://creativecommons.org/licenses/by-sa/4.0/","  Let $\tau$ be an $n$-simplex and let $g$ be a metric on $\tau$ with constant
curvature $\kappa$. The lengths that $g$ assigns to the edges of $\tau$, along
with the value of $\kappa$, uniquely determine all of the geometry of $(\tau,
g)$. In this paper we focus on hyperbolic simplices ($\kappa = -1$) and develop
geometric formulas which rely only on the edge lengths of $\tau$. Our main
results are distance and projection formulas in hyperbolic simplices, as well
as a projection formula in Euclidean simplices. We also provide analogous
formulas in simplices with arbitrary constant curvature $\kappa$.
","[{""version"":""v1"",""created"":""Mon, 12 Jul 2021 19:50:22 GMT""}]","2023-03-08"
"2107.05707","Xiao Xiao","Sumudu Herath, Xiao Xiao and Fehmi Cirak","Computational modelling and data-driven homogenisation of knitted
  membranes","24 pages, 14 figures","International Journal for Numerical Methods in Engineering 123
  (2022) 683-704","10.1002/nme.6871",,"math.NA cs.LG cs.NA","http://arxiv.org/licenses/nonexclusive-distrib/1.0/","  Knitting is an effective technique for producing complex three-dimensional
surfaces owing to the inherent flexibility of interlooped yarns and recent
advances in manufacturing providing better control of local stitch patterns.
Fully yarn-level modelling of large-scale knitted membranes is not feasible.
Therefore, we use a two-scale homogenisation approach and model the membrane as
a Kirchhoff-Love shell on the macroscale and as Euler-Bernoulli rods on the
microscale. The governing equations for both the shell and the rod are
discretised with cubic B-spline basis functions. For homogenisation we consider
only the in-plane response of the membrane. The solution of the nonlinear
microscale problem requires a significant amount of time due to the large
deformations and the enforcement of contact constraints, rendering conventional
online computational homogenisation approaches infeasible. To sidestep this
problem, we use a pre-trained statistical Gaussian Process Regression (GPR)
model to map the macroscale deformations to macroscale stresses. During the
offline learning phase, the GPR model is trained by solving the microscale
problem for a sufficiently rich set of deformation states obtained by either
uniform or Sobol sampling. The trained GPR model encodes the nonlinearities and
anisotropies present in the microscale and serves as a material model for the
membrane response of the macroscale shell. The bending response can be chosen
in dependence of the mesh size to penalise the fine out-of-plane wrinkling of
the membrane. After verifying and validating the different components of the
proposed approach, we introduce several examples involving membranes subjected
to tension and shear to demonstrate its versatility and good performance.
","[{""version"":""v1"",""created"":""Mon, 12 Jul 2021 19:51:02 GMT""},{""version"":""v2"",""created"":""Tue, 9 Nov 2021 22:15:06 GMT""}]","2022-06-20"
"2107.05708","Andrew Musser","Scott Renken, Raj Pandya, Kyriacos Georgiou, Rahul Jayaprakash, Lizhi
  Gai, Zhen Shen, David G. Lidzey, Akshay Rao, Andrew J Musser","Untargeted Effects in Organic Exciton-Polariton Transient Spectroscopy:
  A Cautionary Tale",,"J. Chem. Phys. 155, 154701 (2021)","10.1063/5.0063173",,"physics.chem-ph physics.optics","http://creativecommons.org/licenses/by/4.0/","  Strong light-matter coupling to form exciton- and vibropolaritons is
increasingly touted as a powerful tool to alter the fundamental properties of
organic materials. It is proposed that these states and their facile tunability
can be used to rewrite molecular potential energy landscapes and redirect
photophysical pathways, with applications from catalysis to electronic devices.
Crucial to their photophysical properties is the exchange of energy between
coherent, bright polaritons and incoherent dark states. One of the most potent
tools to explore this interplay is transient absorption/reflectance
spectroscopy. Previous studies have revealed unexpectedly long lifetimes of the
coherent polariton states, for which there is no theoretical explanation.
Applying these transient methods to a series of strong-coupled organic
microcavities, we recover similar long-lived spectral effects. Based on
transfer-matrix modelling of the transient experiment, we find that virtually
the entire photoresponse results from photoexcitation effects other than the
generation of polariton states. Our results suggest that the complex optical
properties of polaritonic systems make them especially prone to misleading
optical signatures, and that more challenging high-time-resolution measurements
on high-quality microcavities are necessary to uniquely distinguish the
coherent polariton dynamics.
","[{""version"":""v1"",""created"":""Mon, 12 Jul 2021 19:54:54 GMT""}]","2021-12-06"
"2107.05709","Guillermo Barrios Morales","Guillermo B. Morales and Miguel A. Mu\~noz","Optimal input representation in neural systems at the edge of chaos",,,,,"cond-mat.dis-nn cs.LG cs.NE q-bio.NC","http://creativecommons.org/licenses/by-nc-sa/4.0/","  Shedding light onto how biological systems represent, process and store
information in noisy environments is a key and challenging goal. A stimulating,
though controversial, hypothesis poses that operating in dynamical regimes near
the edge of a phase transition, i.e. at criticality or the ""edge of chaos"", can
provide information-processing living systems with important operational
advantages, creating, e.g., an optimal trade-off between robustness and
flexibility. Here, we elaborate on a recent theoretical result, which
establishes that the spectrum of covariance matrices of neural networks
representing complex inputs in a robust way needs to decay as a power-law of
the rank, with an exponent close to unity, a result that has been indeed
experimentally verified in neurons of the mouse visual cortex. Aimed at
understanding and mimicking these results, we construct an artificial neural
network and train it to classify images. Remarkably, we find that the best
performance in such a task is obtained when the network operates near the
critical point, at which the eigenspectrum of the covariance matrix follows the
very same statistics as actual neurons do. Thus, we conclude that operating
near criticality can also have -- besides the usually alleged virtues -- the
advantage of allowing for flexible, robust and efficient input representations.
","[{""version"":""v1"",""created"":""Mon, 12 Jul 2021 19:55:03 GMT""}]","2021-07-14"
"2107.05710","Rikard B{\o}gvad","Rikard B{\o}gvad, Christian H\""agg and Boris Shapiro","Rodrigues' descendants of a polynomial and Boutroux curves","54 pages, revised final version, to appear in Constructive
  Approximation",,,,"math.CA math.AG","http://creativecommons.org/licenses/by/4.0/","  Motivated by the classical Rodrigues' formula, we study the root asymptotic
of the polynomial sequence $$R_{[\alpha n],n,P}(z)=\frac{d^{[\alpha
n]}P^n(z)}{dz^{[\alpha n]}}, n= 0,1,\dots$$ where ${P(z)}$ is a fixed
univariate polynomial, $\alpha $ is a fixed positive number smaller than deg
$P$, and $[\alpha n]$ stands for the integer part of $\alpha n$.
  Our description of this asymptotic is expressed in terms of an explicit
harmonic function uniquely determined by the plane rational curve emerging from
the application of the saddle point method to the integral representation of
the latter polynomials using Cauchy's formula for higher derivatives. As a
consequence of our method, we conclude that this curve is birationally
equivalent to the zero locus of the bivariate algebraic equation satisfied by
the Cauchy transform of the asymptotic root-counting measure for the latter
polynomial sequence. We show that this harmonic function is also associated
with an abelian differential having only purely imaginary periods and the
latter plane curve belongs to the class of Boutroux curves initially introduced
by Bertola.
  As an additional relevant piece of information, we derive a linear ordinary
differential equation satisfied by $\{R_{[\alpha n],n,P}(z)\}$ as well as
higher derivatives of powers of more general functions.
","[{""version"":""v1"",""created"":""Mon, 12 Jul 2021 19:55:44 GMT""},{""version"":""v2"",""created"":""Tue, 23 May 2023 10:19:58 GMT""}]","2023-05-24"
"2107.05711","Gholamreza Rahimlou","Reza Ahmadi, Gholamreza Rahimlou and Vahid Sadri","Robustness of controlled fusion frames under erasures of subspaces and
  the approximation operator",,,,,"math.FA","http://arxiv.org/licenses/nonexclusive-distrib/1.0/","  Controlled frames which presented to improve the numerical output of
iterative algorithms for inverting the frame operator, have been introduced by
Balazs and et al. Also, these frames are used by Bogdanova and et al. for
spherical wavelets. In this note, we aim to study some new results about
controlled fusion frames and behavior of them under erasures. Finally, we will
introduce the approximation operator for these frames and a result of the
composition of the operators of two controlled fusion frames will be proved.
","[{""version"":""v1"",""created"":""Mon, 12 Jul 2021 19:56:14 GMT""}]","2021-07-14"
"2107.05712","Iryna Korshunova","Iryna Korshunova, David Stutz, Alexander A. Alemi, Olivia Wiles, Sven
  Gowal","A Closer Look at the Adversarial Robustness of Information Bottleneck
  Models",,,,,"cs.LG","http://arxiv.org/licenses/nonexclusive-distrib/1.0/","  We study the adversarial robustness of information bottleneck models for
classification. Previous works showed that the robustness of models trained
with information bottlenecks can improve upon adversarial training. Our
evaluation under a diverse range of white-box $l_{\infty}$ attacks suggests
that information bottlenecks alone are not a strong defense strategy, and that
previous results were likely influenced by gradient obfuscation.
","[{""version"":""v1"",""created"":""Mon, 12 Jul 2021 20:05:08 GMT""}]","2021-07-14"
"2107.05713","Zixuan Hu","Zixuan Hu and Sabre Kais","The quantum condition space","version 4 with minor improvements",,,,"quant-ph","http://arxiv.org/licenses/nonexclusive-distrib/1.0/","  In this work we first propose to exploit the fundamental properties of
quantum physics to evaluate the probability of events with projection
measurements. Next, to study what events can be specified by quantum methods,
we introduce the concept of the condition space, which is found to be the dual
space of the classical outcome space of bit strings. Just like the classical
outcome space generates the quantum state space, the condition space generates
the quantum condition space that is the central idea of this work. The quantum
condition space permits the existence of entangled conditions that have no
classical equivalent. In addition, the quantum condition space is related to
the quantum state space by a Fourier transform guaranteed by the Pontryagin
duality, and therefore an entropic uncertainty principle can be defined. The
quantum condition space offers a novel perspective of understanding quantum
states with the duality picture. In addition, the quantum conditions have
physical meanings and realizations of their own and thus may be studied for
purposes beyond the original motivation of characterizing events for
probability evaluation. Finally, the relation between the condition space and
quantum circuits provides insights into how quantum states are collectively
modified by quantum gates, which may lead to deeper understanding of the
complexity of quantum circuits.
","[{""version"":""v1"",""created"":""Mon, 12 Jul 2021 20:11:51 GMT""},{""version"":""v2"",""created"":""Wed, 14 Jul 2021 14:35:02 GMT""},{""version"":""v3"",""created"":""Thu, 22 Jul 2021 15:38:15 GMT""},{""version"":""v4"",""created"":""Wed, 17 Nov 2021 16:28:19 GMT""}]","2021-11-18"
"2107.05714","Costas Efthimiou","Costas J. Efthimiou","The Voronoi Diagram in Soccer: a theoretical study to measure dominance
  space","Section 1 (Introduction) has been rewritten and expanded",,,,"physics.soc-ph physics.pop-ph","http://arxiv.org/licenses/nonexclusive-distrib/1.0/","  In this article, I argue that the concept of the standard Voronoi diagram is
incorrect for the calculation of dominance area in soccer. The correct region
that should replace the polygonal Voronoi region controlled by a player emerges
naturally by studying the motion of the players. It turns out that the
widely-used standard Voronoi diagram is true only when all 22 players have the
same speed (with vanishing speed being a special case) and it should be
replaced by other diagrams whose regions have more complicated boundaries. The
unfortunate error happened when the mathematical concept of the Voronoi diagram
that has an implicit vanishing speed for its points was transferred to soccer
without looking at the kinematical issues involved in the game of soccer. For
this reason, as a byproduct of this work, I argue for the promotion of
""soccerdynamics"", model building for soccer by looking at the underlying
mechanisms and not just adopting mathematical ideas only for their appeal and
beauty.
","[{""version"":""v1"",""created"":""Mon, 12 Jul 2021 20:12:00 GMT""},{""version"":""v2"",""created"":""Tue, 1 Feb 2022 15:55:46 GMT""}]","2022-02-02"
"2107.05715","Igor Aleiner","I.L. Aleiner","Bethe Ansatz Solutions for Certain Periodic Quantum Circuits","44 pages, 6 figures",,,,"cond-mat.mes-hall quant-ph","http://creativecommons.org/licenses/by/4.0/","  I derived Bethe Ansatz equations for two model Periodic Quantum Circuits: 1)
XXZ model; 2) Chiral Hubbard Model. I obtained explicit expressions for the
spectra of the strings of any length. These analytic results may be useful for
calibration and error mitigations in modern engineered quantum platforms.
","[{""version"":""v1"",""created"":""Mon, 12 Jul 2021 20:12:11 GMT""}]","2021-07-14"
"2107.05716","Patrick Concha","Patrick Concha, Diego Pe\~nafiel, Lucrezia Ravera, Evelyn Rodr\'iguez","Three-dimensional Maxwellian Carroll gravity theory and the cosmological
  constant","18 pages","Phys. Lett. B 823 (2021), 136735","10.1016/j.physletb.2021.136735",,"hep-th gr-qc","http://arxiv.org/licenses/nonexclusive-distrib/1.0/","  In this work, we present the three-dimensional Maxwell Carroll gravity by
considering the ultra-relativistic limit of the Maxwell Chern-Simons gravity
theory defined in three spacetime dimensions. We show that an extension of the
Maxwellian Carroll symmetry is necessary in order for the invariant tensor of
the ultra-relativistic Maxwellian algebra to be non-degenerate. Consequently,
we discuss the origin of the aforementioned algebra and theory as a flat limit.
We show that the theoretical setup with cosmological constant yielding the
extended Maxwellian Carroll Chern-Simons gravity in the vanishing cosmological
constant limit is based on an enlarged extended version of the Carroll
symmetry. Indeed, the latter exhibits a non-degenerate invariant tensor
allowing the proper construction of a Chern-Simons gravity theory which
reproduces the extended Maxwellian Carroll gravity in the flat limit.
","[{""version"":""v1"",""created"":""Mon, 12 Jul 2021 20:13:03 GMT""}]","2021-11-03"
"2107.05717","Manuel C\'aceres","Manuel C\'aceres, Massimo Cairo, Brendan Mumey, Romeo Rizzi and
  Alexandru I. Tomescu","Sparsifying, Shrinking and Splicing for Minimum Path Cover in
  Parameterized Linear Time",,,,,"cs.DS","http://arxiv.org/licenses/nonexclusive-distrib/1.0/","  A minimum path cover (MPC) of a directed acyclic graph (DAG) $G = (V,E)$ is a
minimum-size set of paths that together cover all the vertices of the DAG.
Computing an MPC is a basic polynomial problem, dating back to Dilworth's and
Fulkerson's results in the 1950s. Since the size $k$ of an MPC (also known as
the width) can be small in practical applications, research has also studied
algorithms whose complexity is parameterized on $k$. We obtain two new MPC
parameterized algorithms for DAGs running in time $O(k^2|V|\log{|V|} + |E|)$
and $O(k^3|V| + |E|)$. We also obtain a parallel algorithm running in $O(k^2|V|
+ |E|)$ parallel steps and using $O(\log{|V|})$ processors (in the PRAM model).
Our latter two algorithms are the first solving the problem in parameterized
linear time. Finally, we present an algorithm running in time $O(k^2|V|)$ for
transforming any MPC to another MPC using less than $2|V|$ distinct edges,
which we prove to be asymptotically tight. As such, we also obtain edge
sparsification algorithms preserving the width of the DAG with the same running
time as our MPC algorithms. At the core of all our algorithms we interleave the
usage of three techniques: transitive sparsification, shrinking of a path
cover, and the splicing of a set of paths along a given path.
","[{""version"":""v1"",""created"":""Mon, 12 Jul 2021 20:13:30 GMT""}]","2021-07-14"
"2107.05718","Robert Allen","Robert Allen, Simon Lentner, Christoph Schweigert, Simon Wood","Duality structures for module categories of vertex operator algebras and
  the Feigin Fuchs boson","37 pages, fixed typos and updated references",,,,"math.QA hep-th math-ph math.CT math.MP math.RT","http://arxiv.org/licenses/nonexclusive-distrib/1.0/","  Huang, Lepowsky and Zhang have developed a module theory for vertex operator
algebras that endows suitably chosen module categories with the structure of
braided monoidal categories. Included in the theory is a functor which assigns
to discretely strongly graded modules a contragredient module, obtained as a
gradewise dual. In this paper, we show that this gradewise dual endows the
module category with the structure of a ribbon Grothendieck-Verdier category.
This duality structure is more general than that of a rigid monoidal category;
in contrast to rigidity, it naturally accommodates the fact that a vertex
operator algebra and its gradewise dual need not be isomorphic as modules and
that the tensor product of modules over vertex operator algebras need not be
exact.
  We develop criteria which allow the detection of ribbon Grothendieck-Verdier
equivalences and use them to explore ribbon Grothendieck-Verdier structures in
the example of the rank $n$ Heisenberg vertex operator algebra or chiral free
boson on a not necessarily full rank even lattice with arbitrary choice of
conformal vector. We show that these categories are equivalent, as ribbon
Grothendieck-Verdier categories, to certain categories of graded vector spaces
and categories of modules over a certain Hopf algebra.
","[{""version"":""v1"",""created"":""Mon, 12 Jul 2021 20:14:42 GMT""},{""version"":""v2"",""created"":""Tue, 7 Sep 2021 15:00:27 GMT""}]","2021-09-08"
"2107.05719","Shengjia Zhao","Shengjia Zhao, Michael P. Kim, Roshni Sahoo, Tengyu Ma, Stefano Ermon","Calibrating Predictions to Decisions: A Novel Approach to Multi-Class
  Calibration",,,,,"stat.ML cs.LG stat.ME","http://arxiv.org/licenses/nonexclusive-distrib/1.0/","  When facing uncertainty, decision-makers want predictions they can trust. A
machine learning provider can convey confidence to decision-makers by
guaranteeing their predictions are distribution calibrated -- amongst the
inputs that receive a predicted class probabilities vector $q$, the actual
distribution over classes is $q$. For multi-class prediction problems, however,
achieving distribution calibration tends to be infeasible, requiring sample
complexity exponential in the number of classes $C$. In this work, we introduce
a new notion -- \emph{decision calibration} -- that requires the predicted
distribution and true distribution to be ``indistinguishable'' to a set of
downstream decision-makers. When all possible decision makers are under
consideration, decision calibration is the same as distribution calibration.
However, when we only consider decision makers choosing between a bounded
number of actions (e.g. polynomial in $C$), our main result shows that
decisions calibration becomes feasible -- we design a recalibration algorithm
that requires sample complexity polynomial in the number of actions and the
number of classes. We validate our recalibration algorithm empirically:
compared to existing methods, decision calibration improves decision-making on
skin lesion and ImageNet classification with modern neural network predictors.
","[{""version"":""v1"",""created"":""Mon, 12 Jul 2021 20:17:28 GMT""}]","2021-07-14"
