"2107.06675","Florian Ziel","Florian Ziel","M5 Competition Uncertainty: Overdispersion, distributional forecasting,
  GAMLSS and beyond",,,"10.1016/j.ijforecast.2021.09.008",,"stat.ML cs.AI cs.LG stat.AP stat.ME","http://arxiv.org/licenses/nonexclusive-distrib/1.0/","  The M5 competition uncertainty track aims for probabilistic forecasting of
sales of thousands of Walmart retail goods. We show that the M5 competition
data faces strong overdispersion and sporadic demand, especially zero demand.
We discuss resulting modeling issues concerning adequate probabilistic
forecasting of such count data processes. Unfortunately, the majority of
popular prediction methods used in the M5 competition (e.g. lightgbm and
xgboost GBMs) fails to address the data characteristics due to the considered
objective functions. The distributional forecasting provides a suitable
modeling approach for to the overcome those problems. The GAMLSS framework
allows flexible probabilistic forecasting using low dimensional distributions.
We illustrate, how the GAMLSS approach can be applied for the M5 competition
data by modeling the location and scale parameter of various distributions,
e.g. the negative binomial distribution. Finally, we discuss software packages
for distributional modeling and their drawback, like the R package gamlss with
its package extensions, and (deep) distributional forecasting libraries such as
TensorFlow Probability.
","[{""version"":""v1"",""created"":""Wed, 14 Jul 2021 13:05:55 GMT""},{""version"":""v2"",""created"":""Wed, 10 Nov 2021 15:53:37 GMT""}]","2021-11-11"
"2107.06676","Steven W. D. Chien","Martin Svedin, Artur Podobas, Steven W. D. Chien, Stefano Markidis","Higgs Boson Classification: Brain-inspired BCPNN Learning with
  StreamBrain","Accepted for publication at The 2nd Workshop on Artificial
  Intelligence and Machine Learning for Scientific Applications (AI4S 2021)",,,,"cs.LG cs.CE cs.DC cs.NE","http://arxiv.org/licenses/nonexclusive-distrib/1.0/","  One of the most promising approaches for data analysis and exploration of
large data sets is Machine Learning techniques that are inspired by brain
models. Such methods use alternative learning rules potentially more
efficiently than established learning rules. In this work, we focus on the
potential of brain-inspired ML for exploiting High-Performance Computing (HPC)
resources to solve ML problems: we discuss the BCPNN and an HPC implementation,
called StreamBrain, its computational cost, suitability to HPC systems. As an
example, we use StreamBrain to analyze the Higgs Boson dataset from High Energy
Physics and discriminate between background and signal classes in collisions of
high-energy particle colliders. Overall, we reach up to 69.15% accuracy and
76.4% Area Under the Curve (AUC) performance.
","[{""version"":""v1"",""created"":""Wed, 14 Jul 2021 13:08:19 GMT""},{""version"":""v2"",""created"":""Tue, 17 Aug 2021 13:16:38 GMT""}]","2021-08-18"
"2107.06677","Miguel Angel Gutierrez Estevez","M. A. Gutierrez-Estevez, Martin Kasparick, Renato L. G. Cavalvante,
  S{\l}awomir Sta\'nczak","Hybrid Model and Data Driven Algorithm for Online Learning of Any-to-Any
  Path Loss Maps",,,,,"eess.SP cs.LG","http://creativecommons.org/licenses/by/4.0/","  Learning any-to-any (A2A) path loss maps, where the objective is the
reconstruction of path loss between any two given points in a map, might be a
key enabler for many applications that rely on device-to-device (D2D)
communication. Such applications include machine-type communications (MTC) or
vehicle-to-vehicle (V2V) communications. Current approaches for learning A2A
maps are either model-based methods, or pure data-driven methods. Model-based
methods have the advantage that they can generate reliable estimations with low
computational complexity, but they cannot exploit information coming from data.
Pure data-driven methods can achieve good performance without assuming any
physical model, but their complexity and their lack of robustness is not
acceptable for many applications. In this paper, we propose a novel hybrid
model and data-driven approach that fuses information obtained from datasets
and models in an online fashion. To that end, we leverage the framework of
stochastic learning to deal with the sequential arrival of samples and propose
an online algorithm that alternatively and sequentially minimizes the original
non-convex problem. A proof of convergence is presented, along with experiments
based firstly on synthetic data, and secondly on a more realistic dataset for
V2X, with both experiments showing promising results.
","[{""version"":""v1"",""created"":""Wed, 14 Jul 2021 13:08:25 GMT""}]","2021-07-15"
"2107.06678","Sepehr Rezvani","Sepehr Rezvani, Eduard A. Jorswieck, Roghayeh Joda, and Halim
  Yanikomeroglu","Optimal Power Allocation in Downlink Multicarrier NOMA Systems: Theory
  and Fast Algorithms","27 pages, 36 figures. (Conference Version: arXiv:2106.08636)","IEEE Journal on Selected Areas in Communications, 14 January 2022","10.1109/JSAC.2022.3143237",,"cs.IT eess.SP math.IT","http://arxiv.org/licenses/nonexclusive-distrib/1.0/","  In this work, we address the problem of finding globally optimal power
allocation strategies to maximize the users sum-rate (SR) as well as system
energy efficiency (EE) in the downlink of single-cell multicarrier
non-orthogonal multiple access (MC-NOMA) systems. Each NOMA cluster includes a
set of users in which the well-known superposition coding (SC) combined with
successive interference cancellation (SIC) technique is applied among them. By
obtaining the closed-form expression of intra-cluster power allocation, we show
that MC-NOMA can be equivalently transformed to a virtual orthogonal multiple
access (OMA) system, where the effective channel gain of these virtual OMA
users is obtained in closed-form. Then, the SR and EE maximization problems are
solved by using very fast water-filling and Dinkelbach algorithms,
respectively. The equivalent transformation of MC-NOMA to the virtual OMA
system brings new theoretical insights, which are discussed throughout the
paper. The extensions of our analysis to other scenarios, such as considering
users rate fairness, admission control, long-term performance, and a number of
future next-generation multiple access (NGMA) schemes enabling recent advanced
technologies, e.g., reconfigurable intelligent surfaces are discussed.
Extensive numerical results are provided to show the performance gaps between
single-carrier NOMA (SC-NOMA), OMA-NOMA, and OMA.
","[{""version"":""v1"",""created"":""Wed, 14 Jul 2021 13:09:52 GMT""},{""version"":""v2"",""created"":""Sun, 14 Nov 2021 19:37:02 GMT""}]","2022-01-19"
"2107.06679","Parham Boroumand","Parham Boroumand and Albert Guill\'en i F\`abregas","Mismatched Binary Hypothesis Testing: Error Exponent Sensitivity","arXiv admin note: text overlap with arXiv:2001.03917",,,,"cs.IT math.IT","http://arxiv.org/licenses/nonexclusive-distrib/1.0/","  We study the problem of mismatched binary hypothesis testing between i.i.d.
distributions. We analyze the tradeoff between the pairwise error probability
exponents when the actual distributions generating the observation are
different from the distributions used in the likelihood ratio test, sequential
probability ratio test, and Hoeffding's generalized likelihood ratio test in
the composite setting. When the real distributions are within a small
divergence ball of the test distributions, we find the deviation of the
worst-case error exponent of each test with respect to the matched error
exponent. In addition, we consider the case where an adversary tampers with the
observation, again within a divergence ball of the observation type. We show
that the tests are more sensitive to distribution mismatch than to adversarial
observation tampering.
","[{""version"":""v1"",""created"":""Wed, 14 Jul 2021 13:12:45 GMT""},{""version"":""v2"",""created"":""Wed, 27 Apr 2022 17:57:39 GMT""}]","2022-04-28"
"2107.06680","Thomas Bland","Thomas Bland, Elena Poli, Claudia Politi, Lauritz Klaus, Matthew A.
  Norcia, Francesca Ferlaino, Luis Santos, Russell N. Bisset","Two-Dimensional Supersolid Formation in Dipolar Condensates","11 pages, 7 figures","Phys. Rev. Lett. 128, 195302 (2022)","10.1103/PhysRevLett.128.195302",,"cond-mat.quant-gas","http://creativecommons.org/licenses/by/4.0/","  Dipolar condensates have recently been coaxed to form the long-sought
supersolid phase. While one-dimensional supersolids may be prepared by
triggering a roton instability, we find that such a procedure in two dimensions
(2D) leads to a loss of both global phase coherence and crystalline order.
Unlike in 1D, the 2D roton modes have little in common with the supersolid
configuration. We develop a finite-temperature stochastic Gross-Pitaevskii
theory that includes beyond-mean-field effects to explore the formation process
in 2D and find that evaporative cooling directly into the supersolid
phase--hence bypassing the first-order roton instability--can produce a robust
supersolid in a circular trap. Importantly, the resulting supersolid is stable
at the final nonzero temperature. We then experimentally produce a 2D
supersolid in a near-circular trap through such an evaporative procedure. Our
work provides insight into the process of supersolid formation in 2D and
defines a realistic path to the formation of large two-dimensional supersolid
arrays.
","[{""version"":""v1"",""created"":""Wed, 14 Jul 2021 13:15:11 GMT""},{""version"":""v2"",""created"":""Sun, 15 May 2022 12:57:27 GMT""}]","2022-05-17"
"2107.06681","Boyun Li","Boyun Li, Yijie Lin, Xiao Liu, Peng Hu, Jiancheng Lv and Xi Peng","Unsupervised Neural Rendering for Image Hazing",,,"10.1109/TIP.2022.3177321",,"cs.CV","http://arxiv.org/licenses/nonexclusive-distrib/1.0/","  Image hazing aims to render a hazy image from a given clean one, which could
be applied to a variety of practical applications such as gaming, filming,
photographic filtering, and image dehazing. To generate plausible haze, we
study two less-touched but challenging problems in hazy image rendering,
namely, i) how to estimate the transmission map from a single image without
auxiliary information, and ii) how to adaptively learn the airlight from
exemplars, i.e., unpaired real hazy images. To this end, we propose a neural
rendering method for image hazing, dubbed as HazeGEN. To be specific, HazeGEN
is a knowledge-driven neural network which estimates the transmission map by
leveraging a new prior, i.e., there exists the structure similarity (e.g.,
contour and luminance) between the transmission map and the input clean image.
To adaptively learn the airlight, we build a neural module based on another new
prior, i.e., the rendered hazy image and the exemplar are similar in the
airlight distribution. To the best of our knowledge, this could be the first
attempt to deeply rendering hazy images in an unsupervised fashion. Comparing
with existing haze generation methods, HazeGEN renders the hazy images in an
unsupervised, learnable, and controllable manner, thus avoiding the
labor-intensive efforts in paired data collection and the domain-shift issue in
haze generation. Extensive experiments show the promising performance of our
method comparing with some baselines in both qualitative and quantitative
comparisons. The code will be released on GitHub after acceptance.
","[{""version"":""v1"",""created"":""Wed, 14 Jul 2021 13:15:14 GMT""}]","2022-06-22"
"2107.06682","Mingfeng Wang Dr.","Mingfeng Wang, Yipeng Zhang, Wei Zhang","Bioinspired molecular qubits and nanoparticle ensembles that could be
  initialized, manipulated and readout under mild conditions",,,,,"quant-ph cond-mat.mtrl-sci","http://creativecommons.org/licenses/by/4.0/","  Quantum computation and quantum information processing are emerging
technologies that have potential to overcome the physical limitation of
traditional computation systems. Present quantum systems based on photons,
atoms and molecules, however, all face challenges such as short coherence time,
requirement of ultralow temperature and/or high vacuum, and lack of
scalability. We report a new type of molecular qubits and nanoparticle
ensembles based on thermally controllable transformation between J-aggregation
and monomeric states of molecular chromophores, using pyrrolopyrrole cyanine
tethered with polymeric chains such as polycaprolactones as an example. Such
supramolecular quantum systems, resembling some feature of light harvesting
complexes in photosynthesis, provide new opportunities for manipulating quantum
in-formation under mild conditions, which do not require complicated
ultra-cooling and/or high vacuum often involved in present superconducting
qubits or Rydberg atoms for quantum computation and information processing.
","[{""version"":""v1"",""created"":""Wed, 14 Jul 2021 13:18:01 GMT""}]","2021-07-15"
"2107.06683","Giuseppe Tomassetti","Tom\'a\v{s} Roub\'i\v{c}ek and Giuseppe Tomassetti","A convective model for poro-elastodynamics with damage and fluid flow
  towards Earth lithosphere modelling",,,"10.1007/s00161-021-01043-x",,"math.AP math-ph math.MP","http://arxiv.org/licenses/nonexclusive-distrib/1.0/","  Devised towards geophysical applications for various processes in the
lithosphere or the crust, a model of poro-elastodynamics with inelastic strains
and other internal variables like damage (aging) and porosity as well as with
diffusion of water is formulated fully in the Eulerian setting. Concepts of
gradient of the total strain rate as well as the additive splitting of the
total strain rate are used while eliminating the displacement from the
formulation. It relies on that the elastic strain is small while only the
inelastic and the total strains can be large. The energetics behind this model
is derived and used for analysis as far as the existence of global weak
energy-conserving solutions concerns. By this way, the model in [V. Lyakhovsky
et al., Pure Appl. Geophys., 171:3099-3123, 2014] and [V. Lyakhovsky et al.,
Izvestiya, Physics of the Solid Earth, 43:13-23, 2007] is completed to make it
mechanically consistent and amenable for analysis.
","[{""version"":""v1"",""created"":""Wed, 14 Jul 2021 13:18:50 GMT""}]","2021-09-01"
"2107.06684","Ja\v{s}a \v{C}alogovi\'c","Ja\v{s}a \v{C}alogovi\'c, Mateja Dumbovi\'c, Davor Sudar, Bojan
  Vr\v{s}nak, Karmen Martini\'c, Manuela Temmer and Astrid Veronig","Probabilistic Drag-Based Ensemble Model (DBEM) Evaluation for
  Heliospheric Propagation of CMEs",,"Solar Physics 2021","10.1007/s11207-021-01859-5",,"astro-ph.SR physics.space-ph","http://creativecommons.org/licenses/by/4.0/","  The Drag-based Model (DBM) is a 2D analytical model for heliospheric
propagation of Coronal Mass Ejections (CMEs) in ecliptic plane predicting the
CME arrival time and speed at Earth or any other given target in the solar
system. It is based on the equation of motion and depends on initial CME
parameters, background solar wind speed, $w$ and the drag parameter $\gamma$. A
very short computational time of DBM ($<$ 0.01s) allowed us to develop the
Drag-Based Ensemble Model (DBEM) that takes into account the variability of
model input parameters by making an ensemble of n different input parameters to
calculate the distribution and significance of the DBM results. Thus the DBEM
is able to calculate the most likely CME arrival times and speeds, quantify the
prediction uncertainties and determine the confidence intervals. A new DBEMv3
version is described in detail and evaluated for the first time determing the
DBEMv3 performance and errors by using various CME-ICME lists as well as it is
compared with previous DBEM versions. The analysis to find the optimal drag
parameter $\gamma$ and ambient solar wind speed $w$ showed that somewhat higher
values ($\gamma \approx 0.3 \times 10^{-7}$ km$^{-1}$, $w \approx$ 425
km\,s$^{-1}$) for both of these DBEM input parameters should be used for the
evaluation compared to the previously employed ones. Based on the evaluation
performed for 146 CME-ICME pairs, the DBEMv3 performance with mean error (ME)
of -11.3 h, mean absolute error (MAE) of 17.3 h was obtained. There is a clear
bias towards the negative prediction errors where the fast CMEs are predicted
to arrive too early, probably due to the model physical limitations and input
errors (e.g. CME launch speed).
","[{""version"":""v1"",""created"":""Wed, 14 Jul 2021 13:19:18 GMT""}]","2021-08-11"
"2107.06685","Chan-Kao Chang","Chan-Kao Chang, Ying-Tung Chen, Wesley C. Fraser, Fumi Yoshida,
  Matthew J. Lehner, Shiang-Yu Wang, JJ Kavelaars, Rosemary E. Pike, Mike
  Alexandersen, Takashi Ito, Young-Jun Choi, A. Paula Granados Contreras,
  Youngmin JeongAhn, Jianghui Ji, Myung-Jin Kim, Samantha M. Lawler, Jian Li,
  Zhong-Yi Lin, Patryk Sofia Lykawka, Hong-Kyu Moon, Surhud More, Marco
  Munoz-Gutierrez, Keiji Ohtsuki, Tsuyoshi Terai, Seitaro Urakawa, Hui Zhang,
  Hai-Bin Zhao, and Ji-Lin Zhou. The FOSSIL Collaboration","FOSSIL: I. The Spin Rate Limit of Jupiter Trojans","Accepted by PSJ on July 9th, 2021. 15 pages, 7 figures, and 3 tables",,,,"astro-ph.EP","http://creativecommons.org/licenses/by/4.0/","  Rotation periods of 53 small (diameters $2 < D < 40$ km) Jupiter Trojans
(JTs) were derived using the high-cadence light curves obtained by the FOSSIL
phase I survey, a Subaru/Hyper Suprime-Cam intensive program. These are the
first reported periods measured for JTs with $D < 10$ km. We found a lower
limit of the rotation period near 4 hr, instead of the previously published
result of 5 hr (Ryan et al. 2017; Szabo et al. 2017, 2020) found for larger
JTs. Assuming a rubble-pile structure for JTs, a bulk density of 0.9 gcm$^{-3}$
is required to withstand this spin rate limit, consistent with the value
$0.8-1.0$ gcm$^{-3}$ (Marchis et al. 2006; Mueller et al. 2010; Buie et al.
2015; Berthier et al. 2020) derived from the binary JT system, (617)
Patroclus-Menoetius system.
","[{""version"":""v1"",""created"":""Wed, 14 Jul 2021 13:21:22 GMT""}]","2021-07-15"
"2107.06686","Djordje Grbic","Djordje Grbic and Sebastian Risi","Safer Reinforcement Learning through Transferable Instinct Networks","The paper was accepted in the ALIFE 2021 conference",,,,"cs.LG cs.AI cs.NE","http://creativecommons.org/licenses/by/4.0/","  Random exploration is one of the main mechanisms through which reinforcement
learning (RL) finds well-performing policies. However, it can lead to
undesirable or catastrophic outcomes when learning online in safety-critical
environments. In fact, safe learning is one of the major obstacles towards
real-world agents that can learn during deployment. One way of ensuring that
agents respect hard limitations is to explicitly configure boundaries in which
they can operate. While this might work in some cases, we do not always have
clear a-priori information which states and actions can lead dangerously close
to hazardous states. Here, we present an approach where an additional policy
can override the main policy and offer a safer alternative action. In our
instinct-regulated RL (IR^2L) approach, an ""instinctual"" network is trained to
recognize undesirable situations, while guarding the learning policy against
entering them. The instinct network is pre-trained on a single task where it is
safe to make mistakes, and transferred to environments in which learning a new
task safely is critical. We demonstrate IR^2L in the OpenAI Safety gym domain,
in which it receives a significantly lower number of safety violations during
training than a baseline RL approach while reaching similar task performance.
","[{""version"":""v1"",""created"":""Wed, 14 Jul 2021 13:22:04 GMT""}]","2021-07-15"
"2107.06687","Yong Xia","Shiru Li, Yong Xia","A new Barzilai-Borwein steplength from the viewpoint of total least
  squares","5 pages, 0 figures",,,,"math.OC","http://creativecommons.org/licenses/by/4.0/","  Barzilai-Borwein (BB) steplength is a popular choice in gradient descent
method. By observing that the two existing BB steplengths correspond to the
ordinary and the data least squares, respectively, we employ the third kind of
least squares, the total least squares, to create a new BB steplength, which is
shown to lie between the two existing BB steplengths.
","[{""version"":""v1"",""created"":""Wed, 14 Jul 2021 13:22:26 GMT""}]","2021-07-15"
"2107.06688","Lei Wu","Jia Liu and Lei Wu","A fast-converging scheme for the Phonon Boltzmann equation with dual
  relaxation times","prepared for The 8th Asian Symposium on Computational Heat Transfer
  and Fluid Flow, Qingdao, Sep. 23-26, 2021",,"10.1016/j.jcp.2022.111436",,"physics.comp-ph physics.flu-dyn","http://creativecommons.org/licenses/by/4.0/","  Callaway's dual relaxation times model, which takes into account the normal
and resistive scatterings of phonon, is used to describe the heat conduction in
materials like graphene. For steady-state problems, the Callaway model is
usually solved by the conventional iterative scheme (CIS), which is efficient
in the ballistic regime, but inefficient in the diffusive/hydrodynamic regime.
In this paper, a general synthetic iterative scheme (GSIS) is proposed to
expedite the convergence to steady-state solutions. First, macroscopic
synthetic equations are designed to guide the evolution of equilibrium
distribution functions for normal and resistive scatterings, so that fast
convergence can be achieved even in the diffusive/hydrodynamic regime. Second,
the Fourier stability analysis is conducted to find the convergence rate for
both CIS and GSIS, which rigorously proves the efficiency of GSIS over CIS.
Finally, several numerical simulations are carried out to demonstrate the
accuracy and efficiency of GSIS, where up to three orders of magnitude of
convergence acceleration is achieved.
","[{""version"":""v1"",""created"":""Wed, 14 Jul 2021 13:22:35 GMT""}]","2022-07-27"
"2107.06689","Carlo Orsi","Carlo Orsi","New Developments on the Non-Central Chi-Squared and Beta Distributions","accepted for publication at Austrian Journal of Statistics on 06 May
  2021",,,,"math.ST stat.TH","http://arxiv.org/licenses/nonexclusive-distrib/1.0/","  New formulas for the moments about zero of the Non-central Chi-Squared and
the Non-central Beta distributions are achieved by means of novel approaches.
The mixture representation of the former model and a new expansion of the
ascending factorial of a binomial are the main ingredients of the first
approach, whereas the second one hinges on an interesting relationship of
conditional independence and a simple conditional density of the latter model.
Then, a simulation study is carried out in order to pursue a twofold purpose:
providing numerical validations of the derived moment formulas on one side and
discussing the advantages of the new formulas over the existing ones on the
other.
","[{""version"":""v1"",""created"":""Wed, 14 Jul 2021 13:25:32 GMT""}]","2021-07-15"
"2107.06690","Silvan Toet","S. E. B. Toet, H. K. Vedantham, J. R. Callingham, K. C. Veken, T. W.
  Shimwell, P. Zarka, H. J. A. R\""ottgering, A. Drabent","Coherent radio emission from a population of RS Canum Venaticorum
  systems","This article consists of 14 pages, 10 normal figures and 4 gifs. The
  gifs themselves each consist of 32 figures. This article is to be published
  in Astronomy and Astrophysics, section 8. 'Stellar Atmospheres'","A&A 654, A21 (2021)","10.1051/0004-6361/202141163",,"astro-ph.SR","http://creativecommons.org/licenses/by/4.0/","  Coherent radio emission from stars can be used to constrain fundamental
coronal plasma parameters, such as plasma density and magnetic field strength.
It is also a probe of chromospheric and magnetospheric acceleration mechanisms.
Close stellar binaries, such as RS Canum Venaticorum (RS CVn) systems, are
particularly interesting as their heightened level of chromospheric activity
and possible direct magnetic interaction make them a unique laboratory to study
coronal and magnetospheric acceleration mechanisms. RS CVn binaries are known
to be radio-bright but coherent radio emission has only conclusively been
detected previously in one system. Here, we present a population of 14 coherent
radio emitting RS CVn systems. We identified the population in the ongoing
LOFAR Two Metre Sky Survey as circularly polarised sources at 144MHz that are
astrometrically associated with known RS CVn binaries. We show that the
observed emission is powered by the electron cyclotron maser instability. We
use numerical calculations of the maser's beaming geometry to argue that the
commonly invoked 'loss-cone' maser cannot generate the necessary brightness
temperature in some of our detections and that a more efficient instability,
such as the shell or horseshoe maser, must be invoked. Such maser
configurations are known to operate in planetary magnetospheres. We also
outline two acceleration mechanisms that could produce coherent radio emission,
one where the acceleration occurs in the chromosphere and one where the
acceleration is due to an electrodynamic interaction between the stars. We
propose radio and optical monitoring observations that can differentiate
between these two mechanisms.
","[{""version"":""v1"",""created"":""Wed, 14 Jul 2021 13:26:47 GMT""}]","2021-10-04"
