"2107.06351","Andrei Costin","Tuomo Lahtinen, Hannu Turtiainen, Andrei Costin","BRIMA: low-overhead BRowser-only IMage Annotation tool (Preprint)",,,"10.1109/ICIP42928.2021.9506683",,"cs.CV cs.LG","http://arxiv.org/licenses/nonexclusive-distrib/1.0/","  Image annotation and large annotated datasets are crucial parts within the
Computer Vision and Artificial Intelligence fields.At the same time, it is
well-known and acknowledged by the research community that the image annotation
process is challenging, time-consuming and hard to scale. Therefore, the
researchers and practitioners are always seeking ways to perform the
annotations easier, faster, and at higher quality. Even though several widely
used tools exist and the tools' landscape evolved considerably, most of the
tools still require intricate technical setups and high levels of technical
savviness from its operators and crowdsource contributors.
  In order to address such challenges, we develop and present BRIMA -- a
flexible and open-source browser extension that allows BRowser-only IMage
Annotation at considerably lower overheads. Once added to the browser, it
instantly allows the user to annotate images easily and efficiently directly
from the browser without any installation or setup on the client-side. It also
features cross-browser and cross-platform functionality thus presenting itself
as a neat tool for researchers within the Computer Vision, Artificial
Intelligence, and privacy-related fields.
","[{""version"":""v1"",""created"":""Tue, 13 Jul 2021 19:23:13 GMT""}]","2021-08-27"
"2107.06352","Swagatam Nayak","Swagatam Nayak, Navketan Batra, Sanjeev Kumar","Pairing symmetries in the Zeeman-coupled extended attractive Hubbard
  model",,,,,"cond-mat.supr-con cond-mat.str-el","http://arxiv.org/licenses/nonexclusive-distrib/1.0/","  By introducing the possibility of equal- and opposite-spin pairings
concurrently, we show that the extended attractive Hubbard model (EAHM)
exhibits rich ground state phase diagrams with a variety of singlet, triplet,
and mixed parity superconducting orders. We study the competition between these
superconducting pairing symmetries invoking an unrestricted Hartree-Fock-
Bogoliubov-de Gennes (HFBdG) mean-field approach, and we use the d-vector
formalism to characterize the nature of the stabilized superconducting orders.
We discover that, while all other types of orders are suppressed, a non-unitary
triplet order dominates the phase space in the presence of an in-plane external
magnetic field. We also find a transition between a non-unitary to unitary
superconducting phase driven by the change in average electron density. Our
results serve as a reference for identifying and understanding the nature of
superconductivity based on the symmetries of the pairing correlations. The
results further highlight that EAHM is a suitable effective model for
describing most of the pairing symmetries discovered in different materials.
","[{""version"":""v1"",""created"":""Tue, 13 Jul 2021 19:24:01 GMT""}]","2021-07-15"
"2107.06353","Allen Z. Ren","Allen Z. Ren, Anirudha Majumdar","Distributionally Robust Policy Learning via Adversarial Environment
  Generation","IEEE Robotics and Automation Letters, 2022. Presented at ICRA 2022",,,,"cs.RO cs.LG","http://creativecommons.org/licenses/by/4.0/","  Our goal is to train control policies that generalize well to unseen
environments. Inspired by the Distributionally Robust Optimization (DRO)
framework, we propose DRAGEN - Distributionally Robust policy learning via
Adversarial Generation of ENvironments - for iteratively improving robustness
of policies to realistic distribution shifts by generating adversarial
environments. The key idea is to learn a generative model for environments
whose latent variables capture cost-predictive and realistic variations in
environments. We perform DRO with respect to a Wasserstein ball around the
empirical distribution of environments by generating realistic adversarial
environments via gradient ascent on the latent space. We demonstrate strong
Out-of-Distribution (OoD) generalization in simulation for (i) swinging up a
pendulum with onboard vision and (ii) grasping realistic 3D objects. Grasping
experiments on hardware demonstrate better sim2real performance compared to
domain randomization.
","[{""version"":""v1"",""created"":""Tue, 13 Jul 2021 19:26:34 GMT""},{""version"":""v2"",""created"":""Thu, 16 Sep 2021 20:17:04 GMT""},{""version"":""v3"",""created"":""Fri, 8 Oct 2021 00:50:07 GMT""},{""version"":""v4"",""created"":""Tue, 28 Dec 2021 20:37:45 GMT""},{""version"":""v5"",""created"":""Sat, 7 May 2022 19:53:05 GMT""},{""version"":""v6"",""created"":""Thu, 7 Jul 2022 06:33:53 GMT""}]","2022-07-08"
"2107.06354","Jin Chang","Jin Chang, Johannes W. N. Los, Ronan Gourgues, Stephan Steinhauer, S.
  N. Dorenbos, Silvania F. Pereira, H. Paul Urbach, Val Zwiller, and Iman
  Esmaeil Zadeh","Mid-infrared Single-photon Detection Using Superconducting NbTiN
  Nanowires with Sub-15 ps Time Resolution in a Gifford-McMahon Cryocooler",,,,,"physics.ins-det","http://creativecommons.org/licenses/by/4.0/","  Shortly after their inception, superconducting nanowire single-photon
detectors (SNSPDs) became the leading quantum light detection technology. With
the capability of detecting single-photons with near-unity efficiency, high
time resolution, low dark count rate, and fast recovery time, SNSPDs outperform
conventional single-photon detection techniques. However, detecting lower
energy single-photons (<0.8 eV) with high efficiency and low timing jitter has
remained a challenge. To achieve unity internal efficiency at mid-infrared
wavelengths, previous works used amorphous superconducting materials with low
energy gaps at the expense of reduced time resolution (close to a nanosecond),
and by operating them in complex mK dilution refrigerators. In this work, we
provide an alternative approach with SNSPDs fabricated from 5-9.5 nm thick
NbTiN superconducting films and devices operated in conventional
Gifford-McMahon (GM) cryocoolers. By optimizing the superconducting film
deposition process, film thickness and nanowire design, our fiber-coupled
devices achieved > 70% system detection efficiency (SDE) at 2 {\mu}m and sub-15
ps timing jitter. Furthermore, detectors from the same batch demonstrated unity
internal detection efficiency at 3 {\mu}m and 80% internal efficiency at 4
{\mu}m, paving the road for an efficient mid-infrared single-photon detection
technology with unparalleled time resolution and without mK cooling
requirements.
","[{""version"":""v1"",""created"":""Tue, 13 Jul 2021 19:31:35 GMT""}]","2021-07-15"
"2107.06355","Luiz Eduardo Czelusniak","Luiz Eduardo Czelusniak, Vin\'icius Pessoa Mapelli, Luben
  Cabezas-G\'omez and Alexander J. Wagner","Shaping the equation of state to improve numerical accuracy and
  stability of the pseudopotential lattice Boltzmann method","19 pages, 15 figures",,"10.1103/PhysRevE.105.015303",,"physics.flu-dyn","http://arxiv.org/licenses/nonexclusive-distrib/1.0/","  Recently it was discovered that altering the shape of the meta stable and
unstable branches of an equation of state (EOS) can greatly improve the
numerical accuracy of liquid and gas densities in the pseudopotential method.
Inspired by this approach we develop an improved approach that is benchmarked
for both equilibrium and non-equilibrium situations. We show here that the
original approach reduces the method stability in non-equilibrium situations.
Here we propose a new procedure to replace the metastable and unstable regions
of these EOS by alternative functions. Our approach does not affects the
coexistence densities or the speed of sound of the liquid phase while
maintaining continuity of the sound speed in the pressure-density curve. Using
this approach we were able to reduce the relative error of the planar interface
vapor density compared to the thermodynamic consistent value by increasing the
vapor phase sound speed. To allow for the benchmarking of dynamic results we
also developed a finite difference method (FD) that solves the same macroscopic
conservation equation as the pseudopotential lattice Boltzmann method (LBM).
With this FD scheme we are able to perform mesh refinement and obtain reference
solutions for the dynamic tests. We observed excellent agreement between the FD
solutions and our proposed scheme. We also performed a detailed study of the
stability of the methods using simulations of a droplet impacting on a liquid
film for reduced temperatures down to 0.35 with Reynolds number of 300. Our
approach remains stable for a density ratio up to $3.38\cdot10^{4}$.
","[{""version"":""v1"",""created"":""Tue, 13 Jul 2021 19:35:41 GMT""}]","2022-01-19"
"2107.06356","Anas Al Shaghouri Mr.","Anas Al Shaghouri, Rami Alkhatib, Samir Berjaoui","Real-Time Pothole Detection Using Deep Learning","10 pages, 16 figures",,,,"cs.CV cs.LG","http://arxiv.org/licenses/nonexclusive-distrib/1.0/","  Roads are connecting line between different places, and used daily. Roads'
periodic maintenance keeps them safe and functional. Detecting and reporting
the existence of potholes to responsible departments can help in eliminating
them. This study deployed and tested on different deep learning architecture to
detect potholes. The images used for training were collected by cellphone
mounted on the windshield of the car, in addition to many images downloaded
from the internet to increase the size and variability of the database. Second,
various object detection algorithms are employed and compared to detect
potholes in real-time like SDD-TensorFlow, YOLOv3Darknet53 and YOLOv4Darknet53.
YOLOv4 achieved the best performance with 81% recall, 85% precision and 85.39%
mean Average Precision (mAP). The speed of processing was 20 frame per second.
The system was able to detect potholes from a range on 100 meters away from the
camera. The system can increase the safety of drivers and improve the
performance of self-driving cars by detecting pothole time ahead.
","[{""version"":""v1"",""created"":""Tue, 13 Jul 2021 19:36:34 GMT""}]","2021-07-15"
"2107.06357","Jerome Wenger","Aleksandr Barulin, Prithu Roy, Jean-Beno\^it Claude, J\'er\^ome Wenger","Purcell radiative rate enhancement of label-free proteins with
  ultraviolet aluminum plasmonics",,,"10.1088/1361-6463/ac1627",,"physics.optics physics.bio-ph","http://arxiv.org/licenses/nonexclusive-distrib/1.0/","  The vast majority of proteins are intrinsically fluorescent in the
ultraviolet, thanks to the emission from their tryptophan and tyrosine
amino-acid constituents. However, the protein autofluorescence quantum yields
are generally very low due to the prevailing quenching mechanisms by other
amino acids inside the protein. This motivates the interest to enhance the
radiative emission rate of proteins using nanophotonic structures. Although
there have been numerous reports of Purcell effect and local density of optical
states (LDOS) control in the visible range using single dipole quantum
emitters, the question remains open to apply these concepts in the UV on real
proteins containing several tryptophan and tyrosine amino acids arranged in a
highly complex manner. Here, we report the first complete characterization of
the Purcell effect and radiative rate enhancement for the UV intrinsic
fluorescence of label-free \b{eta}-galactosidase and streptavidin proteins in
plasmonic aluminum nanoapertures. We find an excellent agreement with a
calibration performed using a high quantum yield UV fluorescent dye.
Demonstrating and intensifying the Purcell effect is essential for the
applications of UV plasmonics and the label-free detection of single proteins.
","[{""version"":""v1"",""created"":""Tue, 13 Jul 2021 19:41:27 GMT""}]","2021-09-01"
"2107.06358","Reimi Irokawa","Reimi Irokawa","Ramification loci of non-archimedean cubic rational functions","10 pages, 13 figures",,,,"math.AG","http://arxiv.org/licenses/nonexclusive-distrib/1.0/","  For a cubic rational function with coefficients in a non-archimedean field
$K$ whose residue characteristic is $0$ or greater than $3$, there are $2$
possibilities for the shape of its Berkovich ramification locus, considered as
an endomorphism of the Berkovich projective line: one is the connected hull of
all the critical points, and the other is consisting of $2$ disjoint segments.
In this paper, we list up all the possible forms of cubic rational functions
and calculate their ramification loci.
","[{""version"":""v1"",""created"":""Tue, 13 Jul 2021 19:52:26 GMT""}]","2021-07-15"
"2107.06359","Marika Ivanova","Marika Ivanova, Dag Haugland and B{\aa}rd Hennning Tvedt","Strong bounds and exact solutions to the minimum broadcast time problem",,,,,"math.OC","http://creativecommons.org/licenses/by/4.0/","  Given a graph and a subset of its nodes, referred to as source nodes, the
minimum broadcast problem asks for the minimum number of steps in which a
signal can be transmitted from the sources to all other nodes in the graph. In
each step, the sources and the nodes that already have received the signal can
forward it to at most one of their neighbour nodes. The problem has previously
been proved to be NP-hard. In the current work, we develop a compact integer
programming model for the problem. We also devise procedures for computing
lower bounds on the minimum number of steps required, along with methods for
constructing near-optimal solutions. Computational experiments demonstrate that
in a wide range of instances, in particular instances with sufficiently dense
graphs, the lower and upper bounds under study collapse. In instances where
this is not the case, the integer programming model proves strong capabilities
in closing the remaining gap, and proves to be considerably more efficient than
previously studied models.
","[{""version"":""v1"",""created"":""Tue, 13 Jul 2021 19:53:46 GMT""},{""version"":""v2"",""created"":""Tue, 12 Oct 2021 22:53:21 GMT""},{""version"":""v3"",""created"":""Wed, 8 Dec 2021 16:26:29 GMT""},{""version"":""v4"",""created"":""Mon, 9 Jan 2023 00:28:49 GMT""}]","2023-01-10"
"2107.06360","Stanislav Lukyanenko","Stanislav Lukyanenko, Won-Dong Jang, Donglai Wei, Robbert Struyven,
  Yoon Kim, Brian Leahy, Helen Yang, Alexander Rush, Dalit Ben-Yosef, Daniel
  Needleman and Hanspeter Pfister","Developmental Stage Classification of Embryos Using Two-Stream Neural
  Network with Linear-Chain Conditional Random Field","8.5 pages, to appear in MICCAI 2021",,,,"cs.CV","http://arxiv.org/licenses/nonexclusive-distrib/1.0/","  The developmental process of embryos follows a monotonic order. An embryo can
progressively cleave from one cell to multiple cells and finally transform to
morula and blastocyst. For time-lapse videos of embryos, most existing
developmental stage classification methods conduct per-frame predictions using
an image frame at each time step. However, classification using only images
suffers from overlapping between cells and imbalance between stages. Temporal
information can be valuable in addressing this problem by capturing movements
between neighboring frames. In this work, we propose a two-stream model for
developmental stage classification. Unlike previous methods, our two-stream
model accepts both temporal and image information. We develop a linear-chain
conditional random field (CRF) on top of neural network features extracted from
the temporal and image streams to make use of both modalities. The linear-chain
CRF formulation enables tractable training of global sequential models over
multiple frames while also making it possible to inject monotonic development
order constraints into the learning process explicitly. We demonstrate our
algorithm on two time-lapse embryo video datasets: i) mouse and ii) human
embryo datasets. Our method achieves 98.1 % and 80.6 % for mouse and human
embryo stage classification, respectively. Our approach will enable more
profound clinical and biological studies and suggests a new direction for
developmental stage classification by utilizing temporal information.
","[{""version"":""v1"",""created"":""Tue, 13 Jul 2021 19:56:01 GMT""}]","2021-07-15"
"2107.06361","Katharina Franke","Eva Liebhaber, Lisa M. R\""utten, Ga\""el Reecht, Jacob F. Steiner,
  Sebastian Rohlf, Kai Rossnagel, Felix von Oppen, Katharina J. Franke","Quantum spins and hybridization in artificially-constructed chains of
  magnetic adatoms on a superconductor",,,"10.1038/s41467-022-29879-0",,"cond-mat.mes-hall cond-mat.str-el cond-mat.supr-con","http://arxiv.org/licenses/nonexclusive-distrib/1.0/","  Magnetic adatom chains on surfaces constitute fascinating quantum spin
systems. Superconducting substrates suppress interactions with bulk electronic
excitations but couple the adatom spins to a chain of subgap Yu-Shiba-Rusinov
(YSR) quasiparticles. Using a scanning tunneling microscope, we investigate
such correlated spin-fermion systems by constructing Fe chains adatom by adatom
on superconducting NbSe$_2$. The adatoms couple entirely via the substrate,
retaining their quantum spin nature. In dimers, we observe that the deepest YSR
state undergoes a quantum phase transition due to Ruderman-Kittel-Kasuya-Yosida
interactions, a distinct signature of quantum spins. Chains exhibit coherent
hybridization and band formation of the YSR excitations, indicating
ferromagnetic coupling. Longer chains develop separate domains due to
coexisting charge-density-wave order of NbSe$_2$. Despite the
spin-orbit-coupled substrate, we find no signatures of Majoranas, possibly
because quantum spins reduce the parameter range for topological
superconductivity. We suggest that adatom chains are versatile systems for
investigating correlated-electron physics and its interplay with topological
superconductivity.
","[{""version"":""v1"",""created"":""Tue, 13 Jul 2021 19:57:40 GMT""},{""version"":""v2"",""created"":""Mon, 18 Apr 2022 19:20:20 GMT""}]","2022-05-04"
"2107.06362","Omri Ben-Eliezer","Omri Ben-Eliezer and Elchanan Mossel and Madhu Sudan","Information Spread with Error Correction",,,,,"cs.SI cs.GT cs.MA math.PR","http://arxiv.org/licenses/nonexclusive-distrib/1.0/","  We study the process of information dispersal in a network with communication
errors and local error-correction. Specifically we consider a simple model
where a single bit of information initially known to a single source is
dispersed through the network, and communication errors lead to differences in
the agents' opinions on this information.
  Naturally, such errors can very quickly make the communication completely
unreliable, and in this work we study to what extent this unreliability can be
mitigated by local error-correction, where nodes periodically correct their
opinion based on the opinion of (some subset of) their neighbors. We analyze
how the error spreads in the ""early stages"" of information dispersal by
monitoring the average opinion, i.e., the fraction of agents that have the
correct information among all nodes that hold an opinion at a given time. Our
main results show that even with significant effort in error-correction, tiny
amounts of noise can lead the average opinion to be nearly uncorrelated with
the truth in early stages. We also propose some local methods to help agents
gauge when the information they have has stabilized.
","[{""version"":""v1"",""created"":""Tue, 13 Jul 2021 19:58:18 GMT""}]","2021-07-15"
"2107.06363","Bjorn Poonen","Bjorn Poonen, Sergey Rybakov","Lattices in Tate modules","3 pages",,"10.1073/pnas.2113201118",,"math.AG math.NT","http://arxiv.org/licenses/nonexclusive-distrib/1.0/","  Refining a theorem of Zarhin, we prove that given a $g$-dimensional abelian
variety $X$ and an endomorphism $u$ of $X$, there exists a matrix $A \in
\operatorname{M}_{2g}(\mathbb{Z})$ such that each Tate module $T_\ell X$ has a
$\mathbb{Z}_\ell$-basis on which the action of $u$ is given by $A$.
","[{""version"":""v1"",""created"":""Tue, 13 Jul 2021 19:59:34 GMT""}]","2022-01-05"
"2107.06364","Louk Rademaker","Louk Rademaker","Scaling Theory of Few-Particle Delocalization","9 pages, 2 figures","Phys. Rev. B 104, 214204 (2021)","10.1103/PhysRevB.104.214204",,"cond-mat.dis-nn cond-mat.quant-gas cond-mat.str-el","http://creativecommons.org/licenses/by/4.0/","  We develop a scaling theory of interaction-induced delocalization of
few-particle states in disordered quantum systems. In the absence of
interactions, all single-particle states are localized in $d<3$, while in $d
\geq 3$ there is a critical disorder below which states are delocalized. We
hypothesize that such a delocalization transition occurs for $n$-particle bound
states in $d$ dimensions when $d+n\geq 4$. Exact calculations of
disorder-averaged $n$-particle Greens functions support our hypothesis. In
particular, we show that $3$-particle states in $d=1$ with nearest-neighbor
repulsion will delocalize with $W_c \approx 1.4t$ and with localization length
critical exponent $\nu = 1.5 \pm 0.3$. The delocalization transition can be
understood by means of a mapping onto a non-interacting problem with symplectic
symmetry. We discuss the importance of this result for many-body
delocalization, and how few-body delocalization can be probed in cold atom
experiments.
","[{""version"":""v1"",""created"":""Tue, 13 Jul 2021 20:00:30 GMT""}]","2021-12-10"
"2107.06365","Ezequiel Ferrero","Ezequiel E. Ferrero, Alejandro B. Kolton, Eduardo A. Jagla","The yielding of amorphous solids at finite temperatures","16 pages, 11 figures",,"10.1103/PhysRevMaterials.5.115602",,"cond-mat.dis-nn cond-mat.mtrl-sci cond-mat.soft","http://arxiv.org/licenses/nonexclusive-distrib/1.0/","  We analyze the effect of temperature on the yielding transition of amorphous
solids using different coarse-grained model approaches. On one hand we use an
elasto-plastic model, with temperature introduced in the form of an Arrhenius
activation law over energy barriers. On the other hand, we implement a
Hamiltonian model with a relaxational dynamics, where temperature is introduced
in the form of a Langevin stochastic force. In both cases, temperature
transforms the sharp transition of the athermal case in a smooth crossover. We
show that this thermally smoothed transition follows a simple scaling form that
can be fully explained using a one-particle system driven in a potential under
the combined action of a mechanical and a thermal noise, the
stochastically-driven Prandtl-Tomlinson model. Our work harmonizes the results
of simple models for amorphous solids with the phenomenological $\sim T^{2/3}$
law proposed by Johnson and Samwer [Phys. Rev. Lett. 95, 195501 (2005)] in the
framework of experimental metallic glasses yield observations, and extend it to
a generic case. Finally, our results strengthen the interpretation of the
yielding transition as an effective mean-field phenomenon.
","[{""version"":""v1"",""created"":""Tue, 13 Jul 2021 20:02:13 GMT""},{""version"":""v2"",""created"":""Wed, 28 Jul 2021 10:36:34 GMT""}]","2021-11-12"
"2107.06366","Arturo Omar Martinez","Arturo O. Martinez, Fabien R. Baron, John D. Monnier, Rachael M.
  Roettenbacher, J. Robert Parks","Dynamical Surface Imaging of lambda Andromedae","18 pages, 10 figures, accepted in ApJ",,"10.3847/1538-4357/ac06a5",,"astro-ph.SR","http://arxiv.org/licenses/nonexclusive-distrib/1.0/","  We present temperature maps of RS CVn star lambda Andromedae, reconstructed
from interferometric data acquired in 2010 and 2011 by the MIRC instrument at
the Center for High Angular Resolution Astronomy Array. To constrain the
stellar parameters required for this imaging task, we first modeled the star
using our GPU-accelerated code SIMTOI. The stellar surface was then imaged
using our open source interferometric imaging code ROTIR, in the process
further refining the estimation of stellar parameters. We report that the
measured angular diameter is 2.742 +/- 0.010 mas with a limb-darkening
coefficient of 0.231 +/- 0.024. While our images are consistent with those of
prior works, we provide updated physical parameters for lambda Andromedae
(R_star = 7.78 +/- 0.05 R_odot, M_star = 1.24 +/- 0.72 M_odot, log L/L_odot =
1.46 +/- 0.04).
","[{""version"":""v1"",""created"":""Tue, 13 Jul 2021 20:04:30 GMT""}]","2021-08-04"
"2107.06367","{\L}ukasz Dusanowski","{\L}ukasz Dusanowski, Cornelius Nawrath, Simone L. Portalupi, Michael
  Jetter, Tobias Huber, Sebastian Klembt, Peter Michler and Sven H\""ofling","Optical Charge Injection and Full Coherent Control of Spin-Qubit in the
  Telecom C-band Emitting Quantum Dot",,"Nature Communications 13, 748 (2022)","10.1038/s41467-022-28328-2",,"cond-mat.mes-hall quant-ph","http://creativecommons.org/licenses/by/4.0/","  Solid-state quantum emitters with manipulable spin-qubits are promising
platforms for quantum communication applications. Although such light-matter
interfaces could be realized in many systems only a few allow for light
emission in the telecom bands necessary for long-distance quantum networks.
Here, we propose and implement a new optically active solid-state spin-qubit
based on a hole confined in a single InAs/GaAs quantum dot grown on an InGaAs
metamorphic buffer layer emitting photons in the C-band. We lift the hole
spin-degeneracy using an external magnetic field and demonstrate hole
injection, initialization, read-out and complete coherent control using
picosecond optical pulses. These results showcase a new solid-state spin-qubit
platform compatible with preexisting optical fibre networks.
","[{""version"":""v1"",""created"":""Tue, 13 Jul 2021 20:04:33 GMT""}]","2022-04-08"
