"2107.06506","Peng-Jie Wong","Elchin Hasanalizade, Quanli Shen, Peng-Jie Wong","Counting zeros of the Riemann zeta function","Accepted by J. Number Theory",,,,"math.NT","http://arxiv.org/licenses/nonexclusive-distrib/1.0/","  In this article, we show that $$ \left| N (T) - \frac{T}{ 2 \pi} \log \left(
\frac{T}{2\pi e}\right) \right|
  \le 0.1038 \log T + 0.2573 \log\log T + 9.3675 $$ where $N(T)$ denotes the
number of non-trivial zeros $\rho$, with $0<\Im(\rho) \le T$, of the Riemann
zeta function. This improves the previous result of Trudgian for sufficiently
large $T$. The improvement comes from the use of various subconvexity bounds
and ideas from the work of Bennett $et$ $al.$ on counting zeros of Dirichlet
$L$-functions.
","[{""version"":""v1"",""created"":""Wed, 14 Jul 2021 06:30:04 GMT""}]","2021-07-15"
"2107.06507","Hang-Hyun Jo","Yohsuke Murase, Hang-Hyun Jo, J\'anos T\""or\""ok, J\'anos Kert\'esz,
  Kimmo Kaski","Deep learning based parameter search for an agent based social network
  model","12 pages, 4 figures, 3 tables, 1 pseudocode","Frontiers in Big Data 4, 739081 (2021)","10.3389/fdata.2021.739081",,"physics.soc-ph cs.SI","http://arxiv.org/licenses/nonexclusive-distrib/1.0/","  Interactions between humans give rise to complex social networks that are
characterized by heterogeneous degree distribution, weight-topology relation,
overlapping community structure, and dynamics of links. Understanding such
networks is a primary goal of science due to serving as the scaffold for many
emergent social phenomena from disease spreading to political movements. An
appropriate tool for studying them is agent-based modeling, in which nodes,
representing persons, make decisions about creating and deleting links, thus
yielding various macroscopic behavioral patterns. Here we focus on studying a
generalization of the weighted social network model, being one of the most
fundamental agent-based models for describing the formation of social ties and
social networks. This Generalized Weighted Social Network (GWSN) model
incorporates triadic closure, homophilic interactions, and various link
termination mechanisms, which have been studied separately in the previous
works. Accordingly, the GWSN model has an increased number of input parameters
and the model behavior gets excessively complex, making it challenging to
clarify the model behavior. We have executed massive simulations with a
supercomputer and using the results as the training data for deep neural
networks to conduct regression analysis for predicting the properties of the
generated networks from the input parameters. The obtained regression model was
also used for global sensitivity analysis to identify which parameters are
influential or insignificant. We believe that this methodology is applicable
for a large class of complex network models, thus opening the way for more
realistic quantitative agent-based modeling.
","[{""version"":""v1"",""created"":""Wed, 14 Jul 2021 06:30:17 GMT""}]","2021-11-16"
"2107.06508","Raghavendra Reddy Varimalla","Manik Kuila, Jose Renato Linares Mardegan, Akhil Tayal, Sonia
  Francoual and V.Raghavendra Reddy","Sublattice spin reversal and field induced $Fe^{3+}$ spin-canting across
  the magnetic compensation temperature in $Y_{1.5}Gd_{1.5}Fe_{5}O_{12}$
  rare-earth iron garnet","9 pages, 9 figures",,,,"cond-mat.mtrl-sci","http://creativecommons.org/licenses/by/4.0/","  In the present work $Fe^{3+}$ sublattice spin reversal and $Fe^{3+}$
spin-canting across the magnetic compensation temperature ($T_{Comp}$) are
demonstrated in polycrystalline $Y_{1.5}Gd_{1.5}Fe_{5}O_{12}$ (YGdIG) by means
of in-field $^{57}Fe$ M$\ddot{o}$ssbauer spectroscopy measurements.
Corroborating in-field $^{57}Fe$ M$\ddot{o}$ssbauer measurements, both
$Fe^{3+}$ & $Gd^{3+}$ sublattice spin reversal has also been manifested with
x-ray magnetic circular dichroism (XMCD) measurement in hard x-ray region.
Moreover from in-field $^{57}Fe$ M$\ddot{o}$ssbauer measurements, estimation
and analysis of effective internal hyperfine field ($H_{eff}$), relative
intensity of absorption lines in a sextet elucidated unambiguously the
signatures of $Fe^{3+}$ spin reversal, their continuous transition and field
induced spin-canting of $Fe^{3+}$ sublattices across $T_{Comp}$. Further, Fe K-
(Gd $L_{3}$-) edge XMCD signal is observed to consist of additional spectral
features, those are identified from $Gd^{3+}$ ($Fe^{3+}$) magnetic ordering,
enabling us the extraction of both the sublattices ($Fe^{3+}$ & $Gd^{3+}$)
information from a single edge analysis. The evolution of the magnetic moments
as a function of temperature for both magnetic sublattices extracted either at
the Fe K- or Gd $L_3$-edge agree quite well with values that are extracted from
bulk magnetization data of YGdIG and YIG ($Y_{3}Fe_{5}O_{12}$). These
measurements pave new avenues to investigate how the magnetic behavior of such
complex system acts across the compensation point.
","[{""version"":""v1"",""created"":""Wed, 14 Jul 2021 06:32:15 GMT""},{""version"":""v2"",""created"":""Thu, 15 Jul 2021 05:43:19 GMT""},{""version"":""v3"",""created"":""Mon, 13 Sep 2021 12:30:46 GMT""}]","2021-09-14"
"2107.06509","Thomas Hou","Thomas Y. Hou","The potentially singular behavior of the 3D Navier-Stokes equations","39 pages. This paper has been accepted by Foundation of Computational
  Mathematics. arXiv admin note: substantial text overlap with
  arXiv:2107.05870; text overlap with arXiv:2102.06663",,,,"physics.flu-dyn cs.NA math.AP math.NA","http://arxiv.org/licenses/nonexclusive-distrib/1.0/","  Whether the 3D incompressible Navier-Stokes equations can develop a finite
time singularity from smooth initial data is one of the most challenging
problems in nonlinear PDEs. In this paper, we present some new numerical
evidence that the incompressible axisymmetric Navier-Stokes equations with
smooth initial data of finite energy seem to develop potentially singular
behavior at the origin. This potentially singular behavior is induced by a
potential finite time singularity of the 3D Euler equations that we reported in
the companion paper (arXiv:2107.05870). We present numerical evidence that the
3D Navier--Stokes equations develop nearly self-similar singular scaling
properties with maximum vorticity increased by a factor of 10^7. We have
applied several blow-up criteria to study the potentially singular behavior of
the Navier--Stokes equations. The Beale-Kato-Majda blow-up criterion and the
blow-up criteria based on the growth of enstrophy and negative pressure seem to
imply that the Navier--Stokes equations using our initial data develop a
potential finite time singularity. We have also examined the
Ladyzhenskaya-Prodi-Serrin regularity criteria. Our numerical results for the
cases of (p,q) = (4,8), (6,4), (9,3) and (p,q)=(\infty,2) provide strong
evidence for the potentially singular behavior of the Navier--Stokes equations.
Our numerical study shows that while the global L^3 norm of the velocity grows
very slowly, the localized version of the L^3 norm of the velocity experiences
rapid dynamic growth relative to the localized L^3 norm of the initial
velocity. This provides further evidence for the potentially singular behavior
of the NavieStokes equations.
","[{""version"":""v1"",""created"":""Wed, 14 Jul 2021 06:36:22 GMT""},{""version"":""v2"",""created"":""Thu, 26 May 2022 21:51:31 GMT""}]","2022-05-30"
"2107.06510","Joshua Blackman Mr","J.W. Blackman, J.-P. Beaulieu, A.A. Cole, N. Koshimoto, A. Vandorou,
  A. Bhattacharya, J.-B. Marquette, D.P. Bennett","OGLE-2017-BLG-1434Lb: Confirmation of a Cold Super-Earth using Keck
  Adaptive Optics","7 pages, 4 figures","The Astronomical Journal 2021, Volume 161, Issue 6, id.279, 7p The
  Astronomical Journal, Volume 161, Issue 6, id.279, 7 pp","10.3847/1538-3881/abfda3",,"astro-ph.EP","http://creativecommons.org/licenses/by/4.0/","  The microlensing event OGLE-2017-BLG-1434 features a cold super-Earth planet
which is one of eleven microlensing planets with a planet-host star mass ratio
$q < 1 \times 10^{-4}$. We provide an additional mass-distance constraint on
the lens host using near-infrared adaptive optics photometry from Keck/NIRC2.
We are able to determine a flux excess of $K_L = 16.96 \pm 0.11$ which most
likely comes entirely from the lens star. Combining this with constraints from
the large Einstein ring radius, $\theta_E=1.40 \pm 0.09\;mas$ and OGLE parallax
we confirm this event as a super-Earth with mass $m_p = 4.43 \pm 0.25M_\odot$.
This system lies at a distance of $D_L = 0.86 \pm 0.05\,kpc$ from Earth and the
lens star has a mass of $M_L=0.234\pm0.012M_\odot$. We confirm that with a
star-planet mass ratio of $q=0.57 \times 10^{-4}$, OGLE-2017-BLG-1434 lies near
the inflexion point of the planet-host mass-ratio power law.
","[{""version"":""v1"",""created"":""Wed, 14 Jul 2021 07:12:31 GMT""}]","2021-07-15"
"2107.06511","Dingcheng Yang","Dingcheng Yang, Wenjian Yu, Yuanbo Guo, Wenjie Liang","CNN-Cap: Effective Convolutional Neural Network Based Capacitance Models
  for Full-Chip Parasitic Extraction","9 pages, 13 figures. Accepted at 2021 International Conference On
  Computer Aided Design (ICCAD)",,,,"cs.LG cs.AR","http://arxiv.org/licenses/nonexclusive-distrib/1.0/","  Accurate capacitance extraction is becoming more important for designing
integrated circuits under advanced process technology. The pattern matching
based full-chip extraction methodology delivers fast computational speed, but
suffers from large error, and tedious efforts on building capacitance models of
the increasing structure patterns. In this work, we propose an effective method
for building convolutional neural network (CNN) based capacitance models
(called CNN-Cap) for two-dimensional (2-D) structures in full-chip capacitance
extraction. With a novel grid-based data representation, the proposed method is
able to model the pattern with a variable number of conductors, so that largely
reduce the number of patterns. Based on the ability of ResNet architecture on
capturing spatial information and the proposed training skills, the obtained
CNN-Cap exhibits much better performance over the multilayer perception neural
network based capacitance model while being more versatile. Extensive
experiments on a 55nm and a 15nm process technologies have demonstrated that
the error of total capacitance produced with CNN-Cap is always within 1.3% and
the error of produced coupling capacitance is less than 10% in over 99.5%
probability. CNN-Cap runs more than 4000X faster than 2-D field solver on a GPU
server, while it consumes negligible memory compared to the look-up table based
capacitance model.
","[{""version"":""v1"",""created"":""Wed, 14 Jul 2021 07:14:35 GMT""}]","2021-07-15"
"2107.06512","Md Ashiqur Rahman","Md Ashiqur Rahman, Beichuan Zhang","On the Analysis of Adaptive-Rate Applications in Data-Centric Wireless
  Ad-Hoc Networks","Accepted at The 2021 IEEE 46th Conference on Local Computer Networks
  (LCN)",,,,"cs.NI","http://arxiv.org/licenses/nonexclusive-distrib/1.0/","  Adapting applications' data rates in multi-hop wireless ad-hoc networks is
inherently challenging. Packet collision, channel contention, and queue buildup
contribute to packet loss but are difficult to manage in conventional TCP/IP
architecture. This work explores a data-centric approach based on Name Data
Networking (NDN) architecture, which is considered more suitable for wireless
ad-hoc networks. We show that the default NDN transport offers better
performance in linear topologies but struggles in more extensive networks due
to high collision and contention caused by excessive Interests from
out-of-order data retrieval and redundant data transmission from improper
Interest lifetime setting as well as in-network caching. To fix these, we use
round-trip hop count to limit Interest rate and Dynamic Interest Lifetime to
minimize the negative effect of improper Interest lifetime. Finally, we analyze
the effect of in-network caching on transport performance and which scenarios
may benefit or suffer from it.
","[{""version"":""v1"",""created"":""Wed, 14 Jul 2021 07:16:52 GMT""}]","2021-07-15"
"2107.06513","Hedim Osmanovic","H. Osmanovi\'c, M. Had\v{z}imehmedovi\'c, R. Omerovi\'c, J. Stahov, V.
  Kashevarov, M. Ostrick, L. Tiator and A. \v{S}varc","Single-energy partial wave analysis for pion photoproduction with
  fixed-t analyticity","36 pages, 31 figures. arXiv admin note: substantial text overlap with
  arXiv:1908.05167","Phys. Rev. C 104, 034605 (2021)","10.1103/PhysRevC.104.034605",,"nucl-th","http://arxiv.org/licenses/nonexclusive-distrib/1.0/","  Experimental data for pion photoproduction including differential cross
sections and various polarization observables from four reaction channels,
$\gamma p \to \pi^0 p$, $\gamma p \to \pi^+n$, $\gamma n \to \pi^- p$ and
$\gamma n \to \pi^0 n$ from threshold up to $W=2.2$ GeV have been used in order
to perform a single-energy partial wave analysis with minimal model dependence
by imposing constraints from unitarity and fixed-$t$ analyticity in an
iterative procedure. Reaction models were only used as starting point in the
very first iteration. We demonstrate that with this procedure partial wave
amplitudes can be obtained which show only a minimal dependence on the initial
model assumptions.
  The analysis has been obtained in full isospin, and the Watson theorem is
enforced for energies below $W=1.3$ GeV but is even fulfilled up to $W\approx
1.6$ GeV in many partial waves. Electromagnetic multipoles $E_{\ell\pm}$ and
$M_{\ell\pm}$ are presented and discussed for $S,P,D$ and $F$-waves.
","[{""version"":""v1"",""created"":""Wed, 14 Jul 2021 07:18:52 GMT""}]","2021-09-15"
"2107.06514","Aiichi Iwazaki","Aiichi Iwazaki","Radiation Production by Axion in Space between Two Flat Conductors","8 pages no figures",,,"Nisho-2-2021","hep-ph","http://creativecommons.org/licenses/by/4.0/","  We have shown a new production mechanism of radiations produced by dark
matter axion $a(t)$ under strong magnetic field $B$. The axion generates
oscillating electric current in the surface of conductor. The current is
extremely enhanced such as $J_c=(m_a\delta_e)^{-2}J_a$ compared with vacuum
current $J_a\equiv g_{a\gamma\gamma}\partial_t a(t)B$; $\delta_e$ is skin depth
and axion mass $m_a$. We have shown that sufficiently strong radiation is
emitted by cylindrical super ( normal ) conductor to be easily detected. Then,
we naively expect that such strong radiation also arises in resonant cavity
experiment. But we show that the expectation is wrong. The radiation generated
in the cavity is just the one given in the standard estimation, even if we
consider the enhanced current in the conductor of the cavity. This is because
the radiation in the cavity is standing wave, while the radiation emitted from
the cylindrical conductor is outgoing wave. For simplicity we consider
radiation arising in the space between two parallel flat conductors.
","[{""version"":""v1"",""created"":""Wed, 14 Jul 2021 07:19:41 GMT""},{""version"":""v2"",""created"":""Thu, 15 Jul 2021 09:19:59 GMT""}]","2021-07-16"
"2107.06515","Jiahui Huang","Jiahui Huang, Wei Liu, Murat Can Sarihan, Xiang Cheng, Alessio
  Miranda, Benjamin Dwir, Alok Rudra, Eli Kapon, Chee Wei Wong","Exciton-photon complexes and dynamics in the concurrent strong-weak
  coupling regime of singular site-controlled cavity quantum electrodynamics",,"New J. Phys. 25 033015 (2023)","10.1088/1367-2630/acc26c",,"cond-mat.mes-hall quant-ph","http://arxiv.org/licenses/nonexclusive-distrib/1.0/","  We investigate the exciton complexes photoluminescence, dynamics and photon
statistics in the concurrent strong weak coupling regime in our unique site
controlled singular inverted pyramidal InGaAs/GaAs quantum dots photonic
crystal cavities platform. Different from a clear boundary between strong and
weak QD cavity coupling, we demonstrate the strong and weak coupling can
coexist dynamically, as a form of intermediate regime mediated by phonon
scattering. The detuning dependent microphotoluminescence spectrum reveals
concurrence of exciton cavity polariton mode avoided crossing, as a signature
of Rabi doublet of the strong coupled system, the blue shifting of coupled
exciton cavity mode energy near zero detuning ascribed to the formation of
collective states mediated by phonon assisted coupling, and their partial out
of synchronization linewidth narrowing linked to their mixed behavior. By
detailing the optical features of strongly confined exciton-photon complexes
and the quantum statistics of coupled cavity photons, we reveal the dynamics
and antibunching/bunching photon statistical signatures of the concurrent
strong weak intermediate coupled system at near zero-detuning. This study
suggests our device has potential for new and subtle cavity quantum
electrodynamical phenomena, cavity enhanced indistinguishable single photon
generation, and cluster state generation via the exciton-photon complexes for
quantum networks.
","[{""version"":""v1"",""created"":""Wed, 14 Jul 2021 07:21:57 GMT""}]","2023-04-24"
"2107.06516","Shengnan An","Chenyao Liu, Shengnan An, Zeqi Lin, Qian Liu, Bei Chen, Jian-Guang
  Lou, Lijie Wen, Nanning Zheng and Dongmei Zhang","Learning Algebraic Recombination for Compositional Generalization","ACL Findings 2021",,,,"cs.CL cs.AI","http://arxiv.org/licenses/nonexclusive-distrib/1.0/","  Neural sequence models exhibit limited compositional generalization ability
in semantic parsing tasks. Compositional generalization requires algebraic
recombination, i.e., dynamically recombining structured expressions in a
recursive manner. However, most previous studies mainly concentrate on
recombining lexical units, which is an important but not sufficient part of
algebraic recombination. In this paper, we propose LeAR, an end-to-end neural
model to learn algebraic recombination for compositional generalization. The
key insight is to model the semantic parsing task as a homomorphism between a
latent syntactic algebra and a semantic algebra, thus encouraging algebraic
recombination. Specifically, we learn two modules jointly: a Composer for
producing latent syntax, and an Interpreter for assigning semantic operations.
Experiments on two realistic and comprehensive compositional generalization
benchmarks demonstrate the effectiveness of our model. The source code is
publicly available at https://github.com/microsoft/ContextualSP.
","[{""version"":""v1"",""created"":""Wed, 14 Jul 2021 07:23:46 GMT""}]","2021-07-15"
"2107.06517","Motoharu Kitatani","Motoharu Kitatani, Shiro Sakai, Ryotaro Arita","Natural orbital impurity solver for real-frequency properties at finite
  temperature","6 pages, 5 figures",,,,"cond-mat.str-el","http://arxiv.org/licenses/nonexclusive-distrib/1.0/","  We extend the natural orbital impurity solver [PRB 90, 085102 (2014)] to
finite temperatures within the dynamical mean field theory and apply it to
calculate transport properties of correlated electrons. First, we benchmark our
method against the exact diagonalization result for small clusters, finding
that the natural orbital scheme works well not only for zero temperature but
for low finite temperatures. The method yields smooth and sufficiently accurate
spectra, which agree well with the results of the numerical renormalization
group. Using the smooth spectra, we calculate the electric conductivity and
Seebeck coefficient for the two-dimensional Hubbard model at low temperatures
which are in the scope of many experiments and practical applications. These
results demonstrate the usefulness of the natural orbital framework for
obtaining the real frequency information within the dynamical mean field
theory.
","[{""version"":""v1"",""created"":""Wed, 14 Jul 2021 07:24:40 GMT""}]","2021-07-15"
"2107.06518","Siddhartha Chakrabarty","Suryadeepto Nag, Siddhartha P. Chakrabarty, Sankarshan Basu","Single Event Transition Risk: A Measure for Long Term Carbon Exposure",,,,,"q-fin.RM","http://creativecommons.org/licenses/by/4.0/","  Although there is a growing consensus that a low-carbon transition will be
necessary to mitigate the accelerated climate change, the magnitude of
transition-risk for investors is difficult to measure exactly. Investors are
therefore constrained by the unavailability of suitable measures to quantify
the magnitude of the risk and are forced to use the likes of absolute emissions
data or ESG scores in order to manage their portfolios. In this article, we
define the Single Event Transition Risk (SETR) and illustrate how it can be
used to approximate the magnitude of the total exposure of the price of a share
to low-carbon transition. We also discuss potential applications of the single
event framework and the SETR as a risk measure and discuss future direction on
how this can be extended to a system with multiple transition events.
","[{""version"":""v1"",""created"":""Wed, 14 Jul 2021 07:27:38 GMT""},{""version"":""v2"",""created"":""Wed, 25 May 2022 10:55:38 GMT""}]","2022-05-26"
"2107.06519","Shota Ono","Shota Ono","Magic numbers for vibrational frequency of charged particles on a sphere","7 pages, 5 figures","Phys. Rev. B 104, 094105 (2021)","10.1103/PhysRevB.104.094105",,"cond-mat.mes-hall","http://creativecommons.org/licenses/by/4.0/","  Finding minimum energy distribution of $N$ charges on a sphere is known as
the Thomson problem. Here, we study the vibrational properties of the $N$
charges in the lowest energy state within the harmonic approximation for $10\le
N\le 200$ and for selected sizes up to $N=372$. The maximum frequency
$\omega_{\rm max}$ increases with $N^{3/4}$, which is rationalized by studying
the lattice dynamics of a two-dimensional triangular lattice. The
$N$-dependence of $\omega_{\rm max}$ identifies magic numbers of $N=12, 32, 72,
132, 192, 212, 272, 282$, and 372, reflecting both a strong degeneracy of
one-particle energies and an icosahedral structure that the $N$ charges form.
$N=122$ is not identified as a magic number for $\omega_{\rm max}$ because the
former condition is not satisfied. The magic number concept can hold even when
an average of high frequencies is considered. The maximum frequency mode at the
magic numbers has no anomalously large oscillation amplitude (i.e., not a
defect mode).
","[{""version"":""v1"",""created"":""Wed, 14 Jul 2021 07:29:11 GMT""},{""version"":""v2"",""created"":""Tue, 14 Sep 2021 23:27:52 GMT""}]","2021-09-22"
"2107.06520","A. Sherman","Alexei Sherman","Magnetic properties and superconductivity in the two-dimensional
  repulsive Hubbard model","10 pages, 11 figures","J. Phys. Soc. Jpn. 90, 104707 (2021)","10.7566/JPSJ.90.104707",,"cond-mat.str-el","http://arxiv.org/licenses/nonexclusive-distrib/1.0/","  A new method for estimating the parameter ensuring the fulfillment of the
Mermin-Wagner theorem in the strong coupling diagram technique (SCDT) for the
two-dimensional Hubbard model is suggested. With the precise parameter value,
calculated magnetic quantities are in good agreement with the results of
numeric and optical-lattice experiments. Obtained spin and charge vertices are
used for investigating superconductivity in the $t$-$U$ and $t$-$t'$-$t""$-$U$
Hubbard models in the regime of strong correlations. We found no
superconducting transition in the $t$-$U$ model. In the $t$-$t'$-$t""$-$U$
model, the transition occurs for the singlet $d_{x^2-y^2}$ pairing at
$T_c\approx0.016t$. The difference between the two models is in the
renormalized hopping describing electron motion in SCDT. In the $t$-$U$ model,
it vanishes for momenta $(\pi,0)$, $(0,\pi)$ of extrema of the $d$-wave order
parameter, while the hopping is finite in the $t$-$t'$-$t""$-$U$ model. In the
one-band model, there are optimal values of $t'$ and $t""$ ensuring the highest
$T_c$.
","[{""version"":""v1"",""created"":""Wed, 14 Jul 2021 07:34:32 GMT""}]","2021-09-17"
"2107.06521","Truong Xuan Pham","Pham Truong Xuan","Conformal scattering theory for the Dirac field on Kerr spacetime","39 pages, 2 figures. arXiv admin note: text overlap with
  arXiv:2106.04057",,,,"gr-qc math-ph math.AP math.DG math.MP","http://arxiv.org/licenses/nonexclusive-distrib/1.0/","  We investigate to construct a conformal scattering theory of the spin-$1/2$
massless Dirac equation on the Kerr spacetime by using the conformal geometric
method and under an assumption on the pointwise decay of the Dirac field. In
particular, our construction is valid in the exteriors of Schwarzschild and
very slowly Kerr black hole spacetimes, where the pointwise decay was
established.
","[{""version"":""v1"",""created"":""Wed, 14 Jul 2021 07:38:39 GMT""},{""version"":""v2"",""created"":""Thu, 15 Jul 2021 02:17:07 GMT""},{""version"":""v3"",""created"":""Sun, 18 Jul 2021 15:40:12 GMT""},{""version"":""v4"",""created"":""Sat, 31 Jul 2021 03:18:24 GMT""}]","2021-08-04"
