"2108.00185","Tommaso Buvoli","Tommaso Buvoli, Michael L. Minion","On the Stability of Exponential Integrators for Non-Diffusive Equations",,,,,"math.NA cs.NA","http://arxiv.org/licenses/nonexclusive-distrib/1.0/","  Exponential integrators are a well-known class of time integration methods
that have been the subject of many studies and developments in the past two
decades. Surprisingly, there have been limited efforts to analyze their
stability and efficiency on non-diffusive equations to date. In this paper we
apply linear stability analysis to showcase the poor stability properties of
exponential integrators on non-diffusive problems. We then propose a simple
repartitioning approach that stabilizes the integrators and enables the
efficient solution of stiff, non-diffusive equations. To validate the
effectiveness of our approach, we perform several numerical experiments that
compare partitioned exponential integrators to unmodified ones. We also compare
repartitioning to the well-known approach of adding hyperviscosity to the
equation right-hand-side. Overall, we find that the repartitioning restores
convergence at large timesteps and, unlike hyperviscosity, it does not require
the use of high-order spatial derivatives.
","[{""version"":""v1"",""created"":""Sat, 31 Jul 2021 09:05:43 GMT""}]","2021-08-03"
"2108.00186","Diego S\'anchez Fern\'andez","Diego S. Fern\'andez, \'Alvaro G. L\'opez, Jes\'us M. Seoane, and
  Miguel A. F. Sanju\'an","Ergodic decay laws in Newtonian and relativistic chaotic scattering","Manuscript accepted by Communications in Nonlinear Science and
  Numerical Simulation, 28 pages, 10 figures",,"10.1016/j.cnsns.2021.105987",,"nlin.CD","http://creativecommons.org/licenses/by/4.0/","  In open Hamiltonian systems, the escape from a bounded region of phase space
according to an exponential decay law is frequently associated with the
existence of hyperbolic dynamics in such a region. Furthermore, exponential
decay laws based on the ergodic hypothesis are used to describe escapes in
these systems. However, we uncover that the presence of the set that governs
the hyperbolic dynamics, commonly known as the chaotic saddle, invalidates the
assumption of ergodicity. For the paradigmatic H\'enon-Heiles system, we use
both theoretical and numerical arguments to show that the escaping dynamics is
non-ergodic independently of the existence of KAM tori, since the chaotic
saddle, in whose vicinity trajectories are more likely to spend a finite amount
of time evolving before escaping forever, is not utterly spread over the energy
shell. Taking this into consideration, we provide a clarifying discussion about
ergodicity in open Hamiltonian systems and explore the limitations of ergodic
decay laws when describing escapes in this kind of systems. Finally, we
generalize our claims by deriving a new decay law in the relativistic regime
for an inertial and a non-inertial reference frames under the assumption of
ergodicity, and suggest another approach to the description of escape laws in
open Hamiltonian systems.
","[{""version"":""v1"",""created"":""Sat, 31 Jul 2021 09:14:44 GMT""}]","2021-11-24"
"2108.00187","Jingxian Sun","Jingxian Sun, Lichao Zhang, Yufei Zha, Abel Gonzalez-Garcia, Peng
  Zhang, Wei Huang, and Yanning Zhang","Unsupervised Cross-Modal Distillation for Thermal Infrared Tracking","Accepted at ACM MM 2021. Code and models are available at
  https://github.com/zhanglichao/cmdTIRtracking",,"10.1145/3474085.3475387",,"cs.CV","http://arxiv.org/licenses/nonexclusive-distrib/1.0/","  The target representation learned by convolutional neural networks plays an
important role in Thermal Infrared (TIR) tracking. Currently, most of the
top-performing TIR trackers are still employing representations learned by the
model trained on the RGB data. However, this representation does not take into
account the information in the TIR modality itself, limiting the performance of
TIR tracking. To solve this problem, we propose to distill representations of
the TIR modality from the RGB modality with Cross-Modal Distillation (CMD) on a
large amount of unlabeled paired RGB-TIR data. We take advantage of the
two-branch architecture of the baseline tracker, i.e. DiMP, for cross-modal
distillation working on two components of the tracker. Specifically, we use one
branch as a teacher module to distill the representation learned by the model
into the other branch. Benefiting from the powerful model in the RGB modality,
the cross-modal distillation can learn the TIR-specific representation for
promoting TIR tracking. The proposed approach can be incorporated into
different baseline trackers conveniently as a generic and independent
component. Furthermore, the semantic coherence of paired RGB and TIR images is
utilized as a supervised signal in the distillation loss for cross-modal
knowledge transfer. In practice, three different approaches are explored to
generate paired RGB-TIR patches with the same semantics for training in an
unsupervised way. It is easy to extend to an even larger scale of unlabeled
training data. Extensive experiments on the LSOTB-TIR dataset and PTB-TIR
dataset demonstrate that our proposed cross-modal distillation method
effectively learns TIR-specific target representations transferred from the RGB
modality. Our tracker outperforms the baseline tracker by achieving absolute
gains of 2.3% Success, 2.7% Precision, and 2.5% Normalized Precision
respectively.
","[{""version"":""v1"",""created"":""Sat, 31 Jul 2021 09:19:59 GMT""}]","2021-08-03"
"2108.00188","Kazem Azizi","S. S. Agaev, K. Azizi, H. Sundu","Newly observed exotic doubly charmed meson $T^{+}_{cc}$","8 Pages, 2 Figure and 1 Table",,"10.1016/j.nuclphysb.2022.115650",,"hep-ph hep-ex hep-lat","http://creativecommons.org/licenses/by/4.0/","  In this work, we treat the newly observed doubly charmed four-quark state $
T_{cc}^{+}$ as an axial-vector tetraquark with content $cc\overline{u}
\overline{d}$, and calculate its spectroscopic parameters and width. The mass
and current coupling of the tetraquark $T_{cc}^{+}$ are found by means of the
QCD two-point sum rule method by taking into account quark, gluon and mixed
condensates up to dimension $10$. The width of the $T_{cc}^{+}$ is evaluated
using partial widths of decay processes $T_{cc}^{+} \to \widetilde{ T}\pi ^{0}$
and $T_{cc}^{+} \to T_{cc;\overline{u}\overline{u}}^{0}\pi ^{+}$ , where
$\widetilde{T}=cc\overline{u}\overline{d}$ and $T_{cc;\overline{u}
\overline{u}}^{0}$ are scalar tetraquarks. To compute the partial width of the
first process, we apply the QCD three-point sum rule approach and extract
numerical value of the strong coupling $g$ that corresponds to the vertex
$T_{cc}^{+}\widetilde{T}\pi ^{0}$. The width of the second decay is estimated
using isospin symmetry and the prediction obtained for the first channel. Our
results for the mass $m=(3868\pm 124)~\mathrm{MeV}$ and width $ \Gamma=(489\pm
92)~\mathrm{keV}$ of the tetraquark $T_{cc}^{+}$ are in a nice agreement with
recent measurements of the LHCb collaboration.
","[{""version"":""v1"",""created"":""Sat, 31 Jul 2021 09:20:39 GMT""},{""version"":""v2"",""created"":""Thu, 12 Aug 2021 12:04:51 GMT""},{""version"":""v3"",""created"":""Fri, 7 Jan 2022 18:03:43 GMT""}]","2022-02-09"
"2108.00189","Matteo Gorgone","Matteo Gorgone, Francesco Oliveri, Maria Paola Speciale","On the decoupling problem of general quasilinear first order systems in
  two independent variables","32 pages, no figures","J. Math. Anal. Appl. 446, 276--298 (2017)","10.1016/j.jmaa.2016.08.058",,"math-ph math.MP","http://arxiv.org/licenses/nonexclusive-distrib/1.0/","  The paper deals with the decoupling problem of general quasilinear first
order systems in two independent variables. We consider either the case of
homogeneous and autonomous systems or the one of nonhomogeneous and/or
nonautonomous systems. Necessary and sufficient conditions for the partial or
full decoupling of the systems at hand are provided. The conditions involve the
properties of eigenvalues and eigenvectors of the coefficient matrix, and
provide the differential constraints whose integration leads to the decoupling
transformation. Some applications of physical interest are also given.
","[{""version"":""v1"",""created"":""Sat, 31 Jul 2021 09:20:48 GMT""}]","2021-08-03"
"2108.00190","Huiyan Li","Huiyan Li, Haohong Lin, You Wang, Hengyang Wang, Ming Zhang, Han Gao,
  Qing Ai, Zhiyuan Luo, and Guang Li","Sequence-to-Sequence Voice Reconstruction for Silent Speech in a Tonal
  Language",,,,,"cs.SD cs.HC eess.AS","http://arxiv.org/licenses/nonexclusive-distrib/1.0/","  Silent Speech Decoding (SSD), based on articulatory neuromuscular activities,
has become a prevalent task of Brain-Computer Interface (BCI) in recent years.
Many works have been devoted to decoding surface electromyography (sEMG) from
articulatory neuromuscular activities. However, restoring silent speech in
tonal languages such as Mandarin Chinese is still difficult. This paper
proposes an optimized Sequence-to-Sequence (Seq2Seq) approach to synthesize
voice from the sEMG-based silent speech. We extract duration information to
regulate the sEMG-based silent speech using the audio length. Then, we provide
a deep-learning model with an encoder-decoder structure and a state-of-art
vocoder to generate the audio waveform. Experiments based on six Mandarin
Chinese speakers demonstrate that the proposed model can successfully decode
silent speech in Mandarin Chinese and achieve a character error rate (CER) of
6.41% on average with human evaluation.
","[{""version"":""v1"",""created"":""Sat, 31 Jul 2021 09:28:06 GMT""},{""version"":""v2"",""created"":""Mon, 28 Mar 2022 02:51:51 GMT""},{""version"":""v3"",""created"":""Wed, 1 Jun 2022 14:52:15 GMT""}]","2022-06-02"
"2108.00191","Bernhard Heim","Bernhard Heim and Markus Neuhauseer","Proof of the Bessenrodt--Ono inequality by Induction",,,,,"math.CO","http://creativecommons.org/licenses/by/4.0/","  In 2016 Bessenrodt--Ono discovered an inequality addressing additive and
multiplicative properties of the partition function. Generalization by several
authors have been given; on partitions with rank in a given residue class by
Hou--Jagadeesan and Males, on $k$-regular partitions by Beckwith--Bessenrodt,
on $k$-colored partitions by Chern, Fu, Tang, and Heim--Neuhauser on their
polynomization, and Dawsey--Masri on the Andrews ${\it spt}$-function. The
proofs depend on non-trivial asymptotic formulas related to the circle method
on one side, or a sophisticated combinatorial proof invented by
Alanazi--Gagola--Munagi. We offer in this paper a new proof of the
Bessenrodt--Ono inequality, which is built on a well-known recursion formula
for partition numbers. We extend the proof to the result of Chern--Fu--Tang and
its polynomization. Finally, we also obtain a new result.
","[{""version"":""v1"",""created"":""Sat, 31 Jul 2021 09:30:00 GMT""}]","2021-08-03"
"2108.00192","Xiong Zhou","Xiong Zhou, Xianming Liu, Chenyang Wang, Deming Zhai, Junjun Jiang,
  Xiangyang Ji","Learning with Noisy Labels via Sparse Regularization","ICCV 2021",,,,"cs.LG cs.CV stat.ML","http://creativecommons.org/licenses/by/4.0/","  Learning with noisy labels is an important and challenging task for training
accurate deep neural networks. Some commonly-used loss functions, such as Cross
Entropy (CE), suffer from severe overfitting to noisy labels. Robust loss
functions that satisfy the symmetric condition were tailored to remedy this
problem, which however encounter the underfitting effect. In this paper, we
theoretically prove that \textbf{any loss can be made robust to noisy labels}
by restricting the network output to the set of permutations over a fixed
vector. When the fixed vector is one-hot, we only need to constrain the output
to be one-hot, which however produces zero gradients almost everywhere and thus
makes gradient-based optimization difficult. In this work, we introduce the
sparse regularization strategy to approximate the one-hot constraint, which is
composed of network output sharpening operation that enforces the output
distribution of a network to be sharp and the $\ell_p$-norm ($p\le 1$)
regularization that promotes the network output to be sparse. This simple
approach guarantees the robustness of arbitrary loss functions while not
hindering the fitting ability. Experimental results demonstrate that our method
can significantly improve the performance of commonly-used loss functions in
the presence of noisy labels and class imbalance, and outperform the
state-of-the-art methods. The code is available at
https://github.com/hitcszx/lnl_sr.
","[{""version"":""v1"",""created"":""Sat, 31 Jul 2021 09:40:23 GMT""}]","2021-08-03"
"2108.00193","Faustino Palmero","Faustino Palmero, Mario I. Molina, Jes\'us Cuevas-Maraver, Panayotis
  G. Kevrekidis","Discrete embedded solitary waves and breathers in one-dimensional
  nonlinear lattices","9 pages, 16 figures",,"10.1016/j.physleta.2021.127880",,"nlin.PS math-ph math.MP","http://arxiv.org/licenses/nonexclusive-distrib/1.0/","  For a one-dimensional linear lattice, earlier work has shown how to
systematically construct a slowly-decaying linear potential bearing a localized
eigenmode embedded in the continuous spectrum. Here, we extend this idea in two
directions: The first one is in the realm of the discrete nonlinear Schrodinger
equation, where the linear operator of the Schrodinger type is considered in
the presence of a Kerr focusing or defocusing nonlinearity and the embedded
linear mode is continued into the nonlinear regime as a discrete solitary wave.
The second case is the Klein-Gordon setting, where the presence of a cubic
nonlinearity leads to the emergence of embedded-in-the-continuum discrete
breathers. In both settings, it is seen that the stability of the modes near
the linear limit turns into instability as nonlinearity is increased past a
critical value, leading to a dynamical delocalization of the solitary wave (or
breathing) state. Finally, we suggest a concrete experiment to observe these
embedded modes using a bi-inductive electrical lattice.
","[{""version"":""v1"",""created"":""Sat, 31 Jul 2021 09:40:53 GMT""},{""version"":""v2"",""created"":""Fri, 6 Aug 2021 11:02:19 GMT""}]","2022-01-05"
"2108.00194","Varsha Suresh","Varsha Suresh, Desmond C. Ong","Using Knowledge-Embedded Attention to Augment Pre-trained Language
  Models for Fine-Grained Emotion Recognition","Accepted at IEEE Affective Computing and Intelligent Interaction
  (ACII) 2021",,,,"cs.CL cs.AI","http://creativecommons.org/licenses/by-nc-nd/4.0/","  Modern emotion recognition systems are trained to recognize only a small set
of emotions, and hence fail to capture the broad spectrum of emotions people
experience and express in daily life. In order to engage in more empathetic
interactions, future AI has to perform \textit{fine-grained} emotion
recognition, distinguishing between many more varied emotions. Here, we focus
on improving fine-grained emotion recognition by introducing external knowledge
into a pre-trained self-attention model. We propose Knowledge-Embedded
Attention (KEA) to use knowledge from emotion lexicons to augment the
contextual representations from pre-trained ELECTRA and BERT models. Our
results and error analyses outperform previous models on several datasets, and
is better able to differentiate closely-confusable emotions, such as afraid and
terrified.
","[{""version"":""v1"",""created"":""Sat, 31 Jul 2021 09:41:44 GMT""}]","2021-08-03"
"2108.00195","Elisa Maria Todarello","Ariel Arza, Elisa Todarello","The axion dark matter echo: a detailed analysis","Matches published version",,"10.1103/PhysRevD.105.023023",,"hep-ph astro-ph.CO hep-ex","http://creativecommons.org/publicdomain/zero/1.0/","  It was recently shown that a powerful beam of radio/microwave radiation sent
out to space can produce detectable back-scattering via the stimulated decay of
ambient axion dark matter. This echo is a faint and narrow signal centered at
an angular frequency close to half the axion mass. In this article, we provide
a detailed analytical and numerical analysis of this signal, considering the
effects of the axion velocity distribution as well as the outgoing beam shape.
In agreement with the original proposal, we find that the divergence of the
outgoing beam does not affect the echo signal, which is only constrained by the
axion velocity distribution. Moreover, our findings are relevant for the
optimization of the experimental parameters in order to attain maximal signal
to noise or minimal energy consumption.
","[{""version"":""v1"",""created"":""Sat, 31 Jul 2021 09:42:17 GMT""},{""version"":""v2"",""created"":""Wed, 23 Feb 2022 09:56:25 GMT""}]","2022-02-24"
"2108.00196","Tobias Fischer","Tobias Fischer","QCD phase transition drives supernova explosion of a very massive star","13 pages, 7 figures, published in European Physical Journal A Topical
  Issue 'CompOSE: a repository for Neutron Star Equations of State and
  Transport Properties'",,"10.1140/epja/s10050-021-00571-z",,"astro-ph.HE","http://creativecommons.org/publicdomain/zero/1.0/","  The nature of core-collapse supernova (SN) explosions is yet incompletely
understood. The present article revisits the scenario in which the release of
latent heat due to a first-order phase transition, from normal nuclear matter
to the quark-gluon plasma, liberates the necessary energy to explain observed
SN explosions. Here, the role of the metallicity of the stellar progenitor is
investigated, comparing a solar metallicity and a low-metallicity case, both
having a zero-age main sequence (ZAMS) mass of 75 $M_\odot$. It is found that
low-metallicity models belong exclusively to the failed SN branch, featuring
the formation of black holes without explosions. It excludes this class of
massive star explosions as possible site for the nucleosynthesis of heavy
elements at extremely low metallicity, usually associated with the early
universe.
","[{""version"":""v1"",""created"":""Sat, 31 Jul 2021 09:44:23 GMT""},{""version"":""v2"",""created"":""Wed, 8 Sep 2021 17:15:43 GMT""}]","2021-09-09"
"2108.00197","Shubhamoy Nandan","Frank den Hollander and Shubhamoy Nandan","Spatially Inhomogeneous Populations with Seed-banks: II. Clustering
  Regime","Version 2, added intuitive explainations, remarks etc. The old
  assumption 2.9 on migration kernel is now weakened to Assumption 2.11",,"10.1016/j.spa.2022.04.010",,"math.PR","http://creativecommons.org/licenses/by-nc-nd/4.0/","  We consider a spatial version of the classical Moran model with seed-banks
where the constituent populations have finite sizes. Individuals live in
colonies labelled by $\mathbb{Z}^d$, $d\geq 1$, playing the role of a
geographic space, carry one of the two $types$: $\heartsuit$ or $\spadesuit$,
and change type via $resampling$ as long as they are $active$. Each colony
contains a seed-bank into which individuals can enter to become $dormant$,
suspending their resampling until they exit the seed-bank and become active
again. Individuals resample not only from their own colony, but also from other
colonies according to a symmetric random walk transition kernel. The latter is
referred to as $migration$. The sizes of the populations vary across colonies
and remain constant in time.
  It was shown in Hollander and Nandan (2021) that the system is well-defined,
admits a family of equilibria parametrized by the initial density of type
$\heartsuit$, and exhibits a dichotomy between $clustering$ (mono-type
equilibrium) and $coexistence$ (multi-type equilibrium). This dichotomy is
determined by a clustering criterion that is given in terms of a dual of the
system, which consists of a system of $interacting$ coalescing random walks. In
this paper we provide an alternative clustering criterion, given in terms of an
auxiliary dual that is simpler than the original dual, and identify a range of
parameters for which the criterion is met, which we refer to as the
$clustering$ $regime$. It turns out that if the sizes of the active populations
are non-clumping (i.e., do not take arbitrarily large values in finite regions
of the geographic space) and the relative strengths of the seed-banks (i.e.,
the ratio of the sizes of dormant and active population in each colony) are
bounded uniformly over the geographic space, then clustering prevails if and
only if the (symmetrised) migration kernel is recurrent.
","[{""version"":""v1"",""created"":""Sat, 31 Jul 2021 09:44:27 GMT""},{""version"":""v2"",""created"":""Mon, 20 Dec 2021 14:59:04 GMT""}]","2023-02-07"
"2108.00198","Torsten Ueckerdt","Torsten Ueckerdt and David R. Wood and Wendy Yi","An improved planar graph product structure theorem","arXiv admin note: text overlap with arXiv:1904.04791",,,,"math.CO cs.DM","http://arxiv.org/licenses/nonexclusive-distrib/1.0/","  Dujmovi\'c, Joret, Micek, Morin, Ueckerdt and Wood [J. ACM 2020] proved that
for every planar graph $G$ there is a graph $H$ with treewidth at most 8 and a
path $P$ such that $G\subseteq H\boxtimes P$. We improve this result by
replacing ""treewidth at most 8"" by ""simple treewidth at most 6"".
","[{""version"":""v1"",""created"":""Sat, 31 Jul 2021 09:52:07 GMT""}]","2021-08-21"
"2108.00199","Michela Zedda","Roberto Mossa, Michela Zedda","A Cartan-Hartogs version of the Polydisk Theorem","18 pages","Geometriae Dedicata (2022) 216:51","10.1007/s10711-022-00709-3",,"math.DG","http://arxiv.org/licenses/nonexclusive-distrib/1.0/","  We extend the Polydisk Theorem for symmetric bounded domains to
Cartan-Hartogs domains, and apply it to prove that a Cartan-Hartogs domain
inherits totally geodesic submanifolds from the bounded symmetric domain which
is based on, and to give a characterization of Cartan-Hartogs's geodesics with
linear support.
","[{""version"":""v1"",""created"":""Sat, 31 Jul 2021 09:53:51 GMT""},{""version"":""v2"",""created"":""Wed, 4 Aug 2021 07:28:09 GMT""}]","2022-07-26"
"2108.00200","Shuqi Xu","Shuqi Xu, Manuel S. Mariani, Linyuan L\""u, Lorenzo Napolitano,
  Emanuele Pugliese, Andrea Zaccaria","Citations or dollars? Early signals of a firm's research success","15 pages,7 figures",,,,"physics.soc-ph cs.CY","http://arxiv.org/licenses/nonexclusive-distrib/1.0/","  Scientific and technological progress is largely driven by firms in many
domains, including artificial intelligence and vaccine development. However, we
do not know yet whether the success of firms' research activities exhibits
dynamic regularities and some degree of predictability. By inspecting the
research lifecycles of 7,440 firms, we find that the economic value of a firm's
early patents is an accurate predictor of various dimensions of a firm's future
research success. At the same time, a smaller set of future top-performers do
not generate early patents of high economic value, but they are detectable via
the technological value of their early patents. Importantly, the observed
predictability cannot be explained by a cumulative advantage mechanism, and the
observed heterogeneity of the firms' temporal success patterns markedly differs
from patterns previously observed for individuals' research careers. Our
results uncover the dynamical regularities of the research success of firms,
and they could inform managerial strategies as well as policies to promote
entrepreneurship and accelerate human progress.
","[{""version"":""v1"",""created"":""Sat, 31 Jul 2021 10:01:08 GMT""}]","2021-08-03"
"2108.00201","Hui Men","Hui Men, Hanhe Lin, Mohsen Jenadeleh, Dietmar Saupe","Subjective Image Quality Assessment with Boosted Triplet Comparisons",,,,,"eess.IV cs.CV","http://creativecommons.org/publicdomain/zero/1.0/","  In subjective full-reference image quality assessment, differences between
perceptual image qualities of the reference image and its distorted versions
are evaluated, often using degradation category ratings (DCR). However, the DCR
has been criticized since differences between rating categories on this ordinal
scale might not be perceptually equidistant, and observers may have different
understandings of the categories. Pair comparisons (PC) of distorted images,
followed by Thurstonian reconstruction of scale values, overcome these
problems. In addition, PC is more sensitive than DCR, and it can provide scale
values in fractional, just noticeable difference (JND) units that express a
precise perceptional interpretation. Still, the comparison of images of nearly
the same quality can be difficult. We introduce boosting techniques embedded in
more general triplet comparisons (TC) that increase the sensitivity even more.
Boosting amplifies the artefacts of distorted images, enlarges their visual
representation by zooming, increases the visibility of the distortions by a
flickering effect, or combines some of the above. Experimental results show the
effectiveness of boosted TC for seven types of distortion. We crowdsourced over
1.7 million responses to triplet questions. A detailed analysis shows that
boosting increases the discriminatory power and allows to reduce the number of
subjective ratings without sacrificing the accuracy of the resulting relative
image quality values. Our technique paves the way to fine-grained image quality
datasets, allowing for more distortion levels, yet with high-quality subjective
annotations. We also provide the details for Thurstonian scale reconstruction
from TC and our annotated dataset, KonFiG-IQA, containing 10 source images,
processed using 7 distortion types at 12 or even 30 levels, uniformly spaced
over a span of 3 JND units.
","[{""version"":""v1"",""created"":""Sat, 31 Jul 2021 10:03:32 GMT""}]","2021-08-03"
