"2108.00024","Claus Seidel","Jan-Hendrik Budde, Nicolaas van der Voort, Suren Felekyan, Julian
  Folz, Ralf K\""uhnemuth, Paul Lauterjung, Markus K\""ohler, Andreas Sch\""onle,
  Julian Sindram, Marius Otten, Matthias Karg, Christian Herrmann, Anders Barth
  and Claus A. M. Seidel","FRET nanoscopy enables seamless imaging of molecular assemblies with
  sub-nanometer resolution","Main Text (34 pages, 6 figures) with Supporting Information (90
  pages, 29 figures, 20 tables)",,,,"physics.optics cond-mat.mes-hall cond-mat.soft q-bio.BM q-bio.QM","http://creativecommons.org/licenses/by/4.0/","  By circumventing the optical diffraction limit, super-resolved fluorescence
microscopies enable the study of larger cellular structures and molecular
assemblies. However, fluorescence nanoscopy currently lacks the spatiotemporal
resolution to resolve distances on the size of individual molecules and reveal
the conformational fine structure and dynamics of molecular complexes. Here we
establish FRET nanoscopy by combining colocalization STED microscopy with
multiparameter FRET spectroscopy. We simultaneously localize donor and acceptor
dyes of single FRET pairs with nanometer resolution and quantitatively measure
intramolecular distances with sub-nanometer precision over a large dynamic
range. While FRET provides isotropic 3D distance information, colocalization
measures the projected distance onto the image plane. The combined information
allows us to directly determine its 3D orientation using Pythagoras's theorem.
Studying two DNA model systems and the human guanylate binding protein hGBP1,
we demonstrate that FRET nanoscopy unravels the interplay between their spatial
organization and local molecular conformation in a complex environment.
","[{""version"":""v1"",""created"":""Fri, 30 Jul 2021 18:00:58 GMT""},{""version"":""v2"",""created"":""Fri, 21 Jan 2022 19:26:56 GMT""}]","2022-01-25"
"2108.00025","Bruno Ferreira","Ruth Nascimento Ferreira, Bruno Leonardo Macedo Ferreira, Henrique
  Guzzo Junior, Bruno Tadeu Costa","$*$-Lie-type maps on $C^*$-algebras","15. arXiv admin note: text overlap with arXiv:2005.11430",,,,"math.OA math.RA","http://creativecommons.org/licenses/by/4.0/","  Let $\mathfrak{A}$ and $\mathfrak{A}'$ be two $C^*$-algebras with identities
$I_{\mathfrak{A}}$ and $I_{\mathfrak{A}'}$, respectively, and $P_1$ and $P_2 =
I_{\mathfrak{A}} - P_1$ nontrivial symmetric projections in $\mathfrak{A}$. In
this paper we study the characterization of multiplicative $*$-Lie-type maps.
In particular, if $\mathcal{M}$ is a factor von Neumann algebra then every
complex scalar multiplication bijective unital multiplicative $*$-Lie-type map
is $*$-isomorphism.
","[{""version"":""v1"",""created"":""Fri, 30 Jul 2021 18:01:19 GMT""}]","2021-08-21"
"2108.00026","Ravi  Tandon","Sennur Ulukus, Salman Avestimehr, Michael Gastpar, Syed Jafar, Ravi
  Tandon, Chao Tian","Private Retrieval, Computing and Learning: Recent Progress and Future
  Challenges",,,,,"cs.CR cs.DC cs.IR cs.IT math.IT","http://creativecommons.org/licenses/by/4.0/","  Most of our lives are conducted in the cyberspace. The human notion of
privacy translates into a cyber notion of privacy on many functions that take
place in the cyberspace. This article focuses on three such functions: how to
privately retrieve information from cyberspace (privacy in information
retrieval), how to privately leverage large-scale distributed/parallel
processing (privacy in distributed computing), and how to learn/train machine
learning models from private data spread across multiple users (privacy in
distributed (federated) learning). The article motivates each privacy setting,
describes the problem formulation, summarizes breakthrough results in the
history of each problem, and gives recent results and discusses some of the
major ideas that emerged in each field. In addition, the cross-cutting
techniques and interconnections between the three topics are discussed along
with a set of open problems and challenges.
","[{""version"":""v1"",""created"":""Fri, 30 Jul 2021 18:01:59 GMT""}]","2021-08-03"
"2108.00027","Mukund Rangamani","Chi-Ming Chang, Sean Colin-Ellerin, Cheng Peng, Mukund Rangamani","A 3d disordered superconformal fixed point","58 pages, 4 figures. v2: minor improvements",,"10.1007/JHEP11(2021)211",,"hep-th","http://arxiv.org/licenses/nonexclusive-distrib/1.0/","  We initiate the study of a three dimensional disordered supersymmetric field
theory. Specifically, we consider a $\mathcal{N}=2$ large $N$ Wess-Zumino like
model with cubic superpotential involving couplings drawn from a Gaussian
random ensemble. Taking inspiration from analyses of lower dimensional SYK like
models we demonstrate that the theory flows to a strongly coupled
superconformal fixed point in the infra-red. In particular, we obtain leading
large $N$ spectral data and operator product coefficients at the critical
point. Moreover, the analytic control accorded by the model allows us to
compare our results against those derived in the conformal bootstrap program
and demonstrate consistency with general expectations.
","[{""version"":""v1"",""created"":""Fri, 30 Jul 2021 18:02:09 GMT""},{""version"":""v2"",""created"":""Mon, 4 Oct 2021 16:27:07 GMT""}]","2021-12-22"
"2108.00028","Kyle Miller","Kyle G. Miller, Joshua May, Frederico Fiuza and Warren B. Mori","Extended particle absorber for efficient modeling of intense laser-solid
  interactions","12 pages, 9 figures",,"10.1063/5.0065232",,"physics.plasm-ph physics.comp-ph","http://creativecommons.org/licenses/by/4.0/","  An extended thermal particle boundary condition is devised to more
efficiently and accurately model laser-plasma interactions in overdense
plasmas. Particle-in-cell simulations of such interactions require many
particles per cell, and a large region of background plasma is often necessary
to correctly mimic a semi-infinite plasma and avoid electron refluxing from a
truncated plasma. For long-pulse lasers of many picoseconds, such constraints
can become prohibitively expensive. Here, an extended particle boundary
condition (absorber) is designed that instantaneously stops and re-emits
energetic particles streaming toward the simulation boundary over a defined
region, allowing sufficient time and space for a suitably cool return current
to develop in the background plasma. Tunable parameters of the absorber are
explained, and simulations using the absorber with a 3-ps laser are shown to
accurately reproduce those of a causally separated boundary while requiring
only 20% the number of particles.
","[{""version"":""v1"",""created"":""Fri, 30 Jul 2021 18:02:44 GMT""}]","2021-11-24"
"2108.00029","Akshat Singhal PhD","Akshat Singhal, Varun Bhalerao, Ashish A. Mahabal, Kaustubh Vaghmare,
  Santosh Jagade, Sumeet Kulkarni, Ajay Vibhute, Ajit K. Kembhavi, Andrew J.
  Drake, S George Djorgovski, Matthew J. Graham, Ciro Donalek, Eric
  Christensen, Stephen Larson, Edward C. Beshore","Deep Co-Added Sky from Catalina Sky Survey Images","16 pages, 15 figures",,"10.1093/mnras/stab2246",,"astro-ph.IM","http://creativecommons.org/licenses/by/4.0/","  A number of synoptic sky surveys are underway or being planned. Typically
they are done with small telescopes and relatively short exposure times. A
search for transient or variable sources involves comparison with deeper
baseline images, ideally obtained through the same telescope and camera. With
that in mind we have stacked images from the 0.68~m Schmidt telescope on Mt.
Bigelow taken over ten years as part of the Catalina Sky Survey. In order to
generate deep reference images for the Catalina Real-time Transient Survey,
close to 0.8 million images over 8000 fields and covering over 27000~sq.~deg.
have gone into the deep stack that goes up to 3 magnitudes deeper than
individual images. CRTS system does not use a filter in imaging, hence there is
no standard passband in which the optical magnitude is measured. We estimate
depth by comparing these wide-band unfiltered co-added images with images in
the $g$-band and find that the image depth ranges from 22.0--24.2 across the
sky, with a 200-image stack attaining an equivalent AB magnitude sensitivity of
22.8. We compared various state-of-the-art software packages for co-adding
astronomical images and have used SWarp for the stacking. We describe here the
details of the process adopted. This methodology may be useful in other
panoramic imaging applications, and to other surveys as well. The stacked
images are available through a server at Inter-University Centre for Astronomy
and Astrophysics (IUCAA).
","[{""version"":""v1"",""created"":""Fri, 30 Jul 2021 18:07:55 GMT""}]","2022-09-29"
"2108.00030","Fei Li","Fei Li, Thamine N. Dalichaouch, Jacob R. Pierce, Xinlu Xu, Frank S.
  Tsung, Wei Lu, Chan Joshi, Warren B. Mori","Ultra-Bright Electron Bunch Injection in a Plasma Wakefield Driven by a
  Superluminal Flying Focus Electron Beam",,,"10.1103/PhysRevLett.128.174803",,"physics.plasm-ph physics.acc-ph","http://arxiv.org/licenses/nonexclusive-distrib/1.0/","  We propose a new method for self-injection of high-quality electron bunches
in the plasma wakefield structure in the blowout regime utilizing a ""flying
focus"" produced by a drive beam with an energy chirp. In a flying focus the
speed of the density centroid of the drive bunch can be superluminal or
subluminal by utilizing the chromatic dependence of the focusing optics. We
first derive the focal velocity and the characteristic length of the focal spot
in terms of the focal length and an energy chirp. We then demonstrate using
multidimensional particle-in-cell simulations that a wake driven by a
superluminally propagating flying focus of an electron beam can generate
GeV-level electron bunches with ultralow normalized slice emittance ($\sim$30
nm rad), high current ($\sim$ 17 kA), low slice energy-spread ($\sim$0.1%) and
therefore high normalized brightness ($>10^{19}$ A/rad$^2$/m$^2$) in a plasma
of density $\sim10^{19}$ cm$^{-3}$. The injection process is highly
controllable and tunable by changing the focal velocity and shaping the drive
beam current. Near-term experiments at FACET II where the capabilities to
generate tens of kA, <10 fs drivers are planned, could potentially produce
beams with brightness near $10^{20}$ A/rad$^2$/m$^2$.
","[{""version"":""v1"",""created"":""Fri, 30 Jul 2021 18:08:33 GMT""},{""version"":""v2"",""created"":""Sun, 24 Apr 2022 00:41:11 GMT""}]","2022-05-11"
"2108.00031","Thomas Barthel","Thomas Barthel, Jianfeng Lu, Gero Friesecke","On the closedness and geometry of tensor network state sets","23 pages, 10 figures; minor improvements, added references; published
  version; This article belongs to the themed collection ""Mathematical Physics
  and Numerical Simulation of Many-Particle Systems"", V. Bach and L. Delle Site
  (eds.), Letters in Mathematical Physics","Lett. Math. Phys. 112, 72 (2022)","10.1007/s11005-022-01552-z",,"quant-ph cond-mat.str-el math-ph math.MP","http://arxiv.org/licenses/nonexclusive-distrib/1.0/","  Tensor network states (TNS) are a powerful approach for the study of strongly
correlated quantum matter. The curse of dimensionality is addressed by
parametrizing the many-body state in terms of a network of partially contracted
tensors. These tensors form a substantially reduced set of effective degrees of
freedom. In practical algorithms, functionals like energy expectation values or
overlaps are optimized over certain sets of TNS. Concerning algorithmic
stability, it is important whether the considered sets are closed because,
otherwise, the algorithms may approach a boundary point that is outside the TNS
set and tensor elements diverge. We discuss the closedness and geometries of
TNS sets, and we propose regularizations for optimization problems on
non-closed TNS sets. We show that sets of matrix product states (MPS) with open
boundary conditions, tree tensor network states (TTNS), and the multiscale
entanglement renormalization ansatz (MERA) are always closed, whereas sets of
translation-invariant MPS with periodic boundary conditions (PBC),
heterogeneous MPS with PBC, and projected entangled-pair states (PEPS) are
generally not closed. The latter is done using explicit examples like the W
state, states that we call two-domain states, and fine-grained versions
thereof.
","[{""version"":""v1"",""created"":""Fri, 30 Jul 2021 18:09:28 GMT""},{""version"":""v2"",""created"":""Tue, 2 Aug 2022 04:23:09 GMT""}]","2022-08-03"
"2108.00032","Kumiko Kotera","Kumiko Kotera (on behalf of the GRAND Collaboration)","The Giant Radio Array for Neutrino Detection (GRAND) Project","Presented at the 37th International Cosmic Ray Conference (ICRC
  2021), 8 pages, 2 figures",,,"PoS(ICRC2021)1181","astro-ph.HE astro-ph.IM","http://creativecommons.org/licenses/by/4.0/","  The GRAND project aims to detect ultra-high-energy neutrinos, cosmic rays and
gamma rays, with an array of $200,000$ radio antennas over $200,000\,{\rm
km}^2$, split into $\sim 20$ sub-arrays of $\sim 10,000\,{\rm km}^2$ deployed
worldwide. The strategy of GRAND is to detect air showers above $10^{17}\,$eV
that are induced by the interaction of ultra-high-energy particles in the
atmosphere or in the Earth crust, through its associated coherent
radio-emission in the $50-200\,$MHz range. In its final configuration, GRAND
plans to reach a neutrino-sensitivity of $\sim 10^{-10}\,{\rm GeV}\,{\rm
cm}^{-2}\,{\rm s}^{-1}\,{\rm sr}^{-1}$ above $5\times 10^{17}\,$eV combined
with a sub-degree angular resolution. GRANDProto300, the 300-antenna pathfinder
array, is planned to start data-taking in 2021. It aims at demonstrating
autonomous radio detection of inclined air-showers, and study cosmic rays
around the transition between Galactic and extra-Galactic sources. We present
preliminary designs and simulation results, plans for the ongoing, staged
approach to construction, and the rich research program made possible by the
proposed sensitivity and angular resolution.
","[{""version"":""v1"",""created"":""Fri, 30 Jul 2021 18:15:01 GMT""}]","2021-08-03"
"2108.00033","Justus Bogner","Sebastian Kotstein, Justus Bogner","Which RESTful API Design Rules Are Important and How Do They Improve
  Software Quality? A Delphi Study with Industry Experts","Accepted at the 15th Symposium and Summer School On Service-Oriented
  Computing (SummerSoC'21)",,"10.1007/978-3-030-87568-8_10",,"cs.SE","http://arxiv.org/licenses/nonexclusive-distrib/1.0/","  Several studies analyzed existing Web APIs against the constraints of REST to
estimate the degree of REST compliance among state-of-the-art APIs. These
studies revealed that only a small number of Web APIs are truly RESTful.
Moreover, identified mismatches between theoretical REST concepts and practical
implementations lead us to believe that practitioners perceive many rules and
best practices aligned with these REST concepts differently in terms of their
importance and impact on software quality. We therefore conducted a Delphi
study in which we confronted eight Web API experts from industry with a catalog
of 82 REST API design rules. For each rule, we let them rate its importance and
software quality impact. As consensus, our experts rated 28 rules with high, 17
with medium, and 37 with low importance. Moreover, they perceived usability,
maintainability, and compatibility as the most impacted quality attributes. The
detailed analysis revealed that the experts saw rules for reaching Richardson
maturity level 2 as critical, while reaching level 3 was less important. As the
acquired consensus data may serve as valuable input for designing a
tool-supported approach for the automatic quality evaluation of RESTful APIs,
we briefly discuss requirements for such an approach and comment on the
applicability of the most important rules.
","[{""version"":""v1"",""created"":""Fri, 30 Jul 2021 18:18:17 GMT""}]","2021-09-30"
"2108.00034","Xiangbo Meng","Xiangbo Meng, Kang Gao, Bertrand M. Hochwald","A Training-Based Mutual Information Lower Bound for Large-Scale Systems","This work has been submitted to the IEEE for possible publication.
  arXiv admin note: substantial text overlap with arXiv:2012.00970",,,,"cs.IT math.IT","http://arxiv.org/licenses/nonexclusive-distrib/1.0/","  We provide a mutual information lower bound that can be used to analyze the
effect of training in models with unknown parameters. For large-scale systems,
we show that this bound can be calculated using the difference between two
derivatives of a conditional entropy function. The bound does not require
explicit estimation of the unknown parameters. We provide a step-by-step
process for computing the bound, and provide an example application. A
comparison with known classical mutual information bounds is provided.
","[{""version"":""v1"",""created"":""Fri, 30 Jul 2021 18:28:12 GMT""}]","2021-08-21"
"2108.00035","Jessica Sorrells","Leyda Almod\'ovar, Jo Ellis-Monaghan, Amanda Harsy, Cory Johnson,
  Jessica Sorrells","Computational complexity and pragmatic solutions for flexible tile based
  DNA self-assembly","41 pages, 30 figures",,,,"math.CO","http://arxiv.org/licenses/nonexclusive-distrib/1.0/","  Branched junction molecule assembly of DNA nanostructures, pioneered by
Seeman's laboratory in the 1980s, has become increasingly sophisticated, as
have the assembly targets. A critical design step is finding minimal sets of
branched junction molecules that will self-assemble into target structures
without unwanted substructures forming. We use graph theory, which is a natural
design tool for self-assembling DNA complexes, to address this problem. After
determining that finding optimal design strategies for this method is generally
NP-complete, we provide pragmatic solutions in the form of programs for special
settings and provably optimal solutions for natural assembly targets such as
platonic solids, regular lattices, and nanotubes. These examples also
illustrate the range of design challenges.
","[{""version"":""v1"",""created"":""Fri, 30 Jul 2021 18:35:03 GMT""}]","2021-08-03"
"2108.00036","Marino Romero","Marino Romero and Nolan Wallach","Stability theorems for multiplicities in graded $S_n$-modules",,,,,"math.RT math.CO","http://arxiv.org/licenses/nonexclusive-distrib/1.0/","  In this paper, we prove several stability theorems for multiplicities of
naturally defined representations of symmetric groups. The first such theorem
states that if we consider the diagonal action of the symmetric group $S_{m+r}$
on $k$ sets of $m+r$ variables, then the dimension of the invariants of degree
$m$ is the same as the dimension of the invariants of degree $m$ for $S_{m}$
acting on $k$ sets of $m$ variables. The second type of stability result is for
Weyl modules. We prove that the dimension of the $S_{n+r}$ invariants for a
Weyl module, ${}_{m+r}F^{\lambda}$ (the Schur-Weyl dual of the $S_{|\lambda|}$
module $V^{\lambda}$) with $\left\vert \lambda \right\vert \leq m$ is of the
same dimension as the space of $S_{m}$ invariants for ${}_{m}F^{\lambda}$.
Multigraded versions of the first type of result are given, as are multigraded
generalizations to non-trivial modules of symmetric groups. Two related
conjectures are given which if proved would give efficient calculations of
multiplicities in the stable range.
","[{""version"":""v1"",""created"":""Fri, 30 Jul 2021 18:35:52 GMT""}]","2021-08-03"
"2108.00037","Yu-Hong Yeung","Yu-Hong Yeung (1), David A. Barajas-Solano (1), Alexandre M.
  Tartakovsky (1 and 2) ((1) Physical and Computational Sciences Directorate,
  Pacific Northwest National Laboratory, (2) Department of Civil and
  Environmental Engineering, University of Illinois Urbana-Champaign)","Physics-Informed Machine Learning Method for Large-Scale Data
  Assimilation Problems","28 pages, 9 figures submitted to Water Resources Research",,"10.1029/2021WR031023",,"cs.LG math.AP physics.flu-dyn physics.geo-ph","http://arxiv.org/licenses/nonexclusive-distrib/1.0/","  We develop a physics-informed machine learning approach for large-scale data
assimilation and parameter estimation and apply it for estimating
transmissivity and hydraulic head in the two-dimensional steady-state
subsurface flow model of the Hanford Site given synthetic measurements of said
variables. In our approach, we extend the physics-informed conditional
Karhunen-Lo\'{e}ve expansion (PICKLE) method for modeling subsurface flow with
unknown flux (Neumann) and varying head (Dirichlet) boundary conditions. We
demonstrate that the PICKLE method is comparable in accuracy with the standard
maximum a posteriori (MAP) method, but is significantly faster than MAP for
large-scale problems. Both methods use a mesh to discretize the computational
domain. In MAP, the parameters and states are discretized on the mesh;
therefore, the size of the MAP parameter estimation problem directly depends on
the mesh size. In PICKLE, the mesh is used to evaluate the residuals of the
governing equation, while the parameters and states are approximated by the
truncated conditional Karhunen-Lo\'{e}ve expansions with the number of
parameters controlled by the smoothness of the parameter and state fields, and
not by the mesh size. For a considered example, we demonstrate that the
computational cost of PICKLE increases near linearly (as $N_{FV}^{1.15}$) with
the number of grid points $N_{FV}$, while that of MAP increases much faster as
$N_{FV}^{3.28}$. We demonstrated that once trained for one set of Dirichlet
boundary conditions (i.e., one river stage), the PICKLE method provides
accurate estimates of the hydraulic head for any value of the Dirichlet
boundary conditions (i.e., for any river stage).
","[{""version"":""v1"",""created"":""Fri, 30 Jul 2021 18:43:14 GMT""}]","2022-06-08"
"2108.00038","Elisa Davoli","Elisa Davoli, Carolin Kreisbeck","On static and evolutionary homogenization in crystal plasticity for
  stratified composites",,,,,"math.AP","http://arxiv.org/licenses/nonexclusive-distrib/1.0/","  The starting point for this work is a static macroscopic model for a
high-contrast layered material in single-slip finite crystal plasticity,
identified in [Christowiak & Kreisbeck, Calc. Var. PDE (2017)] as a
homogenization limit via {\Gamma}-convergence. First, we analyze the minimizers
of this limit model, addressing the question of uniqueness and deriving
necessary conditions. In particular, it turns out that at least one of the
defining quantities of an energetically optimal deformation, namely the
rotation and the shear variable, is uniquely determined, and we identify
conditions that give rise to a trivial material response in the sense of
rigid-body motions. The second part is concerned with extending the static
homogenization to an evolutionary {\Gamma}- convergence-type result for
rate-independent systems in specific scenarios, that is, under certain
assumptions on the slip systems and suitable regularizations of the energies,
where energetic and dissipative effects decouple in the limit. Interestingly,
when the slip direction is aligned with the layered microstructure, the
limiting system is purely energetic, which can be interpreted as a loss of
dissipation through homogenization.
","[{""version"":""v1"",""created"":""Fri, 30 Jul 2021 18:48:03 GMT""}]","2021-08-03"
"2108.00039","Tiberiu Harko","Rattanasak Hama, Tiberiu Harko, Sorin V. Sabau, Shahab Shahidi","Cosmological evolution and dark energy in osculating Barthel-Randers
  geometry","32 pages, 3 figures, accepted for publication in EPJC","Eur. Phys. J. C (2021) 81:742","10.1140/epjc/s10052-021-09517-7",,"gr-qc astro-ph.CO hep-th","http://arxiv.org/licenses/nonexclusive-distrib/1.0/","  We consider the cosmological evolution in an osculating point Barthel-Randers
type geometry, in which to each point of the space-time manifold an arbitrary
point vector field is associated. This Finsler type geometry is assumed to
describe the physical properties of the gravitational field, as well as the
cosmological dynamics. For the Barthel-Randers geometry the connection is given
by the Levi-Civita connection of the associated Riemann metric. The generalized
Friedmann equations in the Barthel-Randers geometry are obtained by considering
that the background Riemannian metric in the Randers line element is of
Friedmann-Lemaitre-Robertson-Walker type. The matter energy balance equation is
derived, and it is interpreted from the point of view of the thermodynamics of
irreversible processes in the presence of particle creation. The cosmological
properties of the model are investigated in detail, and it is shown that the
model admits a de Sitter type solution, and that an effective cosmological
constant can also be generated. Several exact cosmological solutions are also
obtained. A comparison of three specific models with the observational data and
with the standard $\Lambda$CDM model is also performed by fitting the observed
values of the Hubble parameter, with the models giving a satisfactory
description of the observations.
","[{""version"":""v1"",""created"":""Fri, 30 Jul 2021 18:55:44 GMT""},{""version"":""v2"",""created"":""Thu, 5 Aug 2021 15:27:08 GMT""},{""version"":""v3"",""created"":""Mon, 16 Aug 2021 06:28:03 GMT""}]","2021-08-23"
