"2108.00104","Peng Qian","Peng Qian, Tahira Naseem, Roger Levy, Ram\'on Fernandez Astudillo","Structural Guidance for Transformer Language Models","To be issued as paper revision for ACL 2021",,,,"cs.CL","http://arxiv.org/licenses/nonexclusive-distrib/1.0/","  Transformer-based language models pre-trained on large amounts of text data
have proven remarkably successful in learning generic transferable linguistic
representations. Here we study whether structural guidance leads to more
human-like systematic linguistic generalization in Transformer language models
without resorting to pre-training on very large amounts of data. We explore two
general ideas. The ""Generative Parsing"" idea jointly models the incremental
parse and word sequence as part of the same sequence modeling task. The
""Structural Scaffold"" idea guides the language model's representation via
additional structure loss that separately predicts the incremental constituency
parse. We train the proposed models along with a vanilla Transformer language
model baseline on a 14 million-token and a 46 million-token subset of the BLLIP
dataset, and evaluate models' syntactic generalization performances on SG Test
Suites and sized BLiMP. Experiment results across two benchmarks suggest
converging evidence that generative structural supervisions can induce more
robust and humanlike linguistic generalization in Transformer language models
without the need for data intensive pre-training.
","[{""version"":""v1"",""created"":""Fri, 30 Jul 2021 23:14:51 GMT""}]","2021-08-03"
"2108.00105","Armin Parchami","Mostafa Parchami, Saif Iftekar Sayed","Deep Feature Tracker: A Novel Application for Deep Convolutional Neural
  Networks",,,,,"cs.CV cs.LG cs.RO","http://creativecommons.org/licenses/by-sa/4.0/","  Feature tracking is the building block of many applications such as visual
odometry, augmented reality, and target tracking. Unfortunately, the
state-of-the-art vision-based tracking algorithms fail in surgical images due
to the challenges imposed by the nature of such environments. In this paper, we
proposed a novel and unified deep learning-based approach that can learn how to
track features reliably as well as learn how to detect such reliable features
for tracking purposes. The proposed network dubbed as Deep-PT, consists of a
tracker network which is a convolutional neural network simulating
cross-correlation in terms of deep learning and two fully connected networks
that operate on the output of intermediate layers of the tracker to detect
features and predict trackability of the detected points. The ability to detect
features based on the capabilities of the tracker distinguishes the proposed
method from previous algorithms used in this area and improves the robustness
of the algorithms against dynamics of the scene. The network is trained using
multiple datasets due to the lack of specialized dataset for feature tracking
datasets and extensive comparisons are conducted to compare the accuracy of
Deep-PT against recent pixel tracking algorithms. As the experiments suggest,
the proposed deep architecture deliberately learns what to track and how to
track and outperforms the state-of-the-art methods.
","[{""version"":""v1"",""created"":""Fri, 30 Jul 2021 23:24:29 GMT""}]","2021-08-03"
"2108.00106","Archit Karandikar","Archit Karandikar, Nicholas Cain, Dustin Tran, Balaji
  Lakshminarayanan, Jonathon Shlens, Michael C. Mozer, Becca Roelofs","Soft Calibration Objectives for Neural Networks","17 pages total, 10 page main paper, 5 page appendix, 10 figures
  total, 8 figures in main paper, 2 figures in appendix",,,,"cs.LG cs.AI","http://creativecommons.org/licenses/by-nc-nd/4.0/","  Optimal decision making requires that classifiers produce uncertainty
estimates consistent with their empirical accuracy. However, deep neural
networks are often under- or over-confident in their predictions. Consequently,
methods have been developed to improve the calibration of their predictive
uncertainty both during training and post-hoc. In this work, we propose
differentiable losses to improve calibration based on a soft (continuous)
version of the binning operation underlying popular calibration-error
estimators. When incorporated into training, these soft calibration losses
achieve state-of-the-art single-model ECE across multiple datasets with less
than 1% decrease in accuracy. For instance, we observe an 82% reduction in ECE
(70% relative to the post-hoc rescaled ECE) in exchange for a 0.7% relative
decrease in accuracy relative to the cross entropy baseline on CIFAR-100. When
incorporated post-training, the soft-binning-based calibration error objective
improves upon temperature scaling, a popular recalibration method. Overall,
experiments across losses and datasets demonstrate that using
calibration-sensitive procedures yield better uncertainty estimates under
dataset shift than the standard practice of using a cross entropy loss and
post-hoc recalibration methods.
","[{""version"":""v1"",""created"":""Fri, 30 Jul 2021 23:30:20 GMT""},{""version"":""v2"",""created"":""Tue, 7 Dec 2021 18:31:29 GMT""}]","2021-12-08"
"2108.00107","Leonard Elia van Dyck","Leonard E. van Dyck, Roland Kwitt, Sebastian J. Denzler, Walter R.
  Gruber","Comparing object recognition in humans and deep convolutional neural
  networks -- An eye tracking study","25 pages, 10 figures, 1 table",,,,"cs.CV","http://arxiv.org/licenses/nonexclusive-distrib/1.0/","  Deep convolutional neural networks (DCNNs) and the ventral visual pathway
share vast architectural and functional similarities in visual challenges such
as object recognition. Recent insights have demonstrated that both hierarchical
cascades can be compared in terms of both exerted behavior and underlying
activation. However, these approaches ignore key differences in spatial
priorities of information processing. In this proof-of-concept study, we
demonstrate a comparison of human observers (N = 45) and three feedforward
DCNNs through eye tracking and saliency maps. The results reveal fundamentally
different resolutions in both visualization methods that need to be considered
for an insightful comparison. Moreover, we provide evidence that a DCNN with
biologically plausible receptive field sizes called vNet reveals higher
agreement with human viewing behavior as contrasted with a standard ResNet
architecture. We find that image-specific factors such as category, animacy,
arousal, and valence have a direct link to the agreement of spatial object
recognition priorities in humans and DCNNs, while other measures such as
difficulty and general image properties do not. With this approach, we try to
open up new perspectives at the intersection of biological and computer vision
research.
","[{""version"":""v1"",""created"":""Fri, 30 Jul 2021 23:32:05 GMT""},{""version"":""v2"",""created"":""Tue, 21 Sep 2021 13:49:26 GMT""}]","2021-09-22"
"2108.00108","Won-Kyu Lee","Huidong Kim, Myoung-Sun Heo, Chang Yong Park, Dai-Hyuk Yu, and Won-Kyu
  Lee","Absolute frequency measurement of the 171Yb optical lattice clock at
  KRISS using TAI for over a year","accepted in Metrologia",,"10.1088/1681-7575/ac1950",,"physics.atom-ph","http://arxiv.org/licenses/nonexclusive-distrib/1.0/","  We report a measurement of the absolute frequency of the 1S0-3P0 transition
in the 171Yb optical lattice clock at KRISS (KRISS-Yb1) for 14 months, which
was referenced to the SI second by primary and secondary standards worldwide
via TAI (International Atomic Time). The determined absolute frequency is 518
295 836 590 863.75(14) Hz with the relative frequency uncertainty of
2.6x10^-16, which agrees well with other reports. This result is expected to
contribute to the future update of the CIPM recommendation frequency of the
secondary frequency standards.
","[{""version"":""v1"",""created"":""Fri, 30 Jul 2021 23:38:02 GMT""}]","2021-08-03"
"2108.00109","Tao Ge","Tao Ge, Maria Medrano, Rui Liao, David G. Politte, Jeffrey F.
  Williamson, Joseph A. O'Sullivan","A Machine-learning Based Initialization for Joint Statistical Iterative
  Dual-energy CT with Application to Proton Therapy",,,,,"eess.IV cs.LG physics.med-ph","http://creativecommons.org/licenses/by/4.0/","  Dual-energy CT (DECT) has been widely investigated to generate more
informative and more accurate images in the past decades. For example,
Dual-Energy Alternating Minimization (DEAM) algorithm achieves sub-percentage
uncertainty in estimating proton stopping-power mappings from experimental 3-mm
collimated phantom data. However, elapsed time of iterative DECT algorithms is
not clinically acceptable, due to their low convergence rate and the tremendous
geometry of modern helical CT scanners. A CNN-based initialization method is
introduced to reduce the computational time of iterative DECT algorithms. DEAM
is used as an example of iterative DECT algorithms in this work. The simulation
results show that our method generates denoised images with greatly improved
estimation accuracy for adipose, tonsils, and muscle tissue. Also, it reduces
elapsed time by approximately 5-fold for DEAM to reach the same objective
function value for both simulated and real data.
","[{""version"":""v1"",""created"":""Fri, 30 Jul 2021 23:49:22 GMT""}]","2021-08-03"
"2108.00110","David Moss","Yuning Zhang, Jiayang Wu, Yang Qu, Linnan Jia, Baohua Jia, and David
  J. Moss","Design of microring resonators integrated with 2D graphene oxide films
  for four-wave mixing","11 pages, 10 figures, 40 references","Journal of Lightwave Technology, Volume 39, Early Access (2021)","10.1109/JLT.2021.3101292",,"physics.optics physics.app-ph","http://creativecommons.org/licenses/by/4.0/","  We theoretically investigate and optimize the performance of four-wave mixing
(FWM) in microring resonators (MRRs) integrated with two-dimensional (2D)
layered graphene oxide (GO) films. Owing to the interaction between the MRRs
and the highly nonlinear GO films as well as to the resonant enhancement
effect, the FWM efficiency in GO-coated MRRs can be significantly improved.
Based on previous experiments, we perform detailed analysis for the influence
of the GO film parameters and MRR coupling strength on the FWM conversion
efficiency (CE) of the hybrid MRRs. By optimizing the device parameters to
balance the trade-off between the Kerr nonlinearity and loss, we achieve a high
CE enhancement of ~18.6 dB relative to the uncoated MRR, which is ~8.3 dB
higher than previous experimental results. The influence of photo-thermal
changes in the GO films as well as variations in the MRR parameters such as the
ring radius and waveguide dispersion on the FWM performance is also discussed.
These results highlight the significantly improved FWM performance that can be
achieved in MRRs incorporating GO films and provide a guide for optimizing
their FWM performance.
","[{""version"":""v1"",""created"":""Fri, 30 Jul 2021 23:56:58 GMT""}]","2021-08-03"
"2108.00111","Ira Che Lassen","Ira Ch\'e Lassen, Acacia Arielle-Evans, Laura R\'ios, H. J.
  Lewandowski, Dimitri Dounas-Frazer","Student ownership and understanding of multi-week final projects","6 pages; accepted for publication in 2021 Physics Education Research
  Conference (PERC) Proceedings",,"10.1119/perc.2021.pr.Lassen",,"physics.ed-ph","http://arxiv.org/licenses/nonexclusive-distrib/1.0/","  National calls to transform laboratory courses by making them more
discovery-based can be met by engaging students in multi-week final projects.
One plausible outcome of this approach is that students may feel ownership of
their projects. We define ownership as a dynamic relationship between students
and their projects characterized by three student-project interactions that
evolve over three project phases. Student-project interactions include
students' contributions to, emotional responses to, and new understanding of
the project. Phases include choosing the topic and team, carrying out the
research, and creating and presenting end-of-project deliverables. Drawing on
interviews with students collected as part of a multi-year, multi-institutional
study, this paper will elaborate on the evolution of students' own new
knowledge about the project across different project phases. Throughout our
work, we compare the type of ownership that manifests when students work on
projects in a lab course to the type of ownership gardeners feel when tending
to plots in a community garden. We end with recommendations for instructors
wishing to foster project ownership in their lab courses.
","[{""version"":""v1"",""created"":""Fri, 30 Jul 2021 23:57:35 GMT""}]","2021-10-12"
"2108.00112","Tom\'as Capistr\'an","T. Capistr\'an, K. L. Fan, J. T. Linnemann, I. Torres, P. M. Saz
  Parkinson, P. L. H. Yu (for the HAWC collaboration)","Use of Machine Learning for gamma/hadron separation with HAWC","Presented at the 37th International Cosmic Ray Conference (ICRC2021),
  Berlin, Germany - Online",,"10.22323/1.395.0745",,"astro-ph.HE astro-ph.IM","http://arxiv.org/licenses/nonexclusive-distrib/1.0/","  Background showers triggered by hadrons represent over 99.9% of all particles
arriving at ground-based gamma-ray observatories. An important stage in the
data analysis of these observatories, therefore, is the removal of
hadron-triggered showers. Currently, the High-Altitude Water Cherenkov (HAWC)
gamma-ray observatory employs an algorithm based on a single cut in two
variables, unlike other ground-based gamma-ray observatories (e.g. H.E.S.S.,
VERITAS), which employ a large number of variables to separate the primary
particles. In this work, we explore machine learning techniques (Boosted
Decision Trees and Neural Networks) to identify the primary particles detected
by HAWC. Our new gamma/hadron separation techniques were tested on data from
the Crab nebula, the standard reference in Very High Energy astronomy, showing
an improvement compared to the standard HAWC background rejection method.
","[{""version"":""v1"",""created"":""Sat, 31 Jul 2021 00:05:13 GMT""}]","2022-09-21"
"2108.00113","Tom\'as Capistr\'an","T. Capistr\'an, D. Avila Rojas, M. M. Gonz\'alez, N. Fraija, R. Alfaro
  (for the HAWC collaboration)","Monitoring the radio galaxy M87 with HAWC","Presented at the 37th International Cosmic Ray Conference (ICRC2021),
  Berlin, Germany - Online",,"10.22323/1.395.0839",,"astro-ph.HE","http://arxiv.org/licenses/nonexclusive-distrib/1.0/","  Studies of radio galaxies at TeV energies are fascinating because their jets
are misaligned concerning our sightline. Thus, it provides us with a unique
opportunity to study the structure of their jets, the radiative processes, and
the acceleration mechanisms involved in them. In addition, some radio galaxies
have presented variability in their emission, like the giant radio galaxy M87,
which has reported several activity periods. Due to its duty cycle >95% and
instantaneous field of view of 2 sr, HAWC provides daily monitoring of variable
sources visible from the Northern Hemisphere. In this work, we show the results
of monitoring M87 between January 2015 and December 2018. HAWC's observations
are consistent with the low activity state reported by other instruments (like
H.E.S.S and MAGIC). However, after September 2017 (~MJD 58000), the HAWC
measurements of M87 show hints of higher activity.
","[{""version"":""v1"",""created"":""Sat, 31 Jul 2021 00:07:04 GMT""}]","2022-09-21"
"2108.00114","Aerin Kim","Zeyad Emam, Andrew Kondrich, Sasha Harrison, Felix Lau, Yushi Wang,
  Aerin Kim, Elliot Branson","On The State of Data In Computer Vision: Human Annotations Remain
  Indispensable for Developing Deep Learning Models",,,,,"cs.CV cs.AI","http://creativecommons.org/licenses/by/4.0/","  High-quality labeled datasets play a crucial role in fueling the development
of machine learning (ML), and in particular the development of deep learning
(DL). However, since the emergence of the ImageNet dataset and the AlexNet
model in 2012, the size of new open-source labeled vision datasets has remained
roughly constant. Consequently, only a minority of publications in the computer
vision community tackle supervised learning on datasets that are orders of
magnitude larger than Imagenet. In this paper, we survey computer vision
research domains that study the effects of such large datasets on model
performance across different vision tasks. We summarize the community's current
understanding of those effects, and highlight some open questions related to
training with massive datasets. In particular, we tackle: (a) The largest
datasets currently used in computer vision research and the interesting
takeaways from training on such datasets; (b) The effectiveness of pre-training
on large datasets; (c) Recent advancements and hurdles facing synthetic
datasets; (d) An overview of double descent and sample non-monotonicity
phenomena; and finally, (e) A brief discussion of lifelong/continual learning
and how it fares compared to learning from huge labeled datasets in an offline
setting. Overall, our findings are that research on optimization for deep
learning focuses on perfecting the training routine and thus making DL models
less data hungry, while research on synthetic datasets aims to offset the cost
of data labeling. However, for the time being, acquiring non-synthetic labeled
data remains indispensable to boost performance.
","[{""version"":""v1"",""created"":""Sat, 31 Jul 2021 00:08:21 GMT""}]","2021-08-03"
"2108.00115","Javad Taghizadeh Firouzjaee","Mahta Moazzenzadeh, and Javad T. Firouzjaee","Searching for the hydrogen 21 cm line in cosmos","20 pages, draft for review",,,,"astro-ph.CO gr-qc","http://creativecommons.org/licenses/by/4.0/","  It is widely agreed that studying the 21 cm emission line from neutral
hydrogen may be our best hope for understanding the creation of the first
structures during the dark ages and the Epoch of Reionization (EoR). This
hyperfine transition occurs as a result of the spin-spin interaction between
the electron and the proton in hydrogen: The energy of the parallel spins
(triplet) state is greater than that of the anti-parallel spins (singlet). This
transition is strongly banned, with a transition probability of $2.6 \times
10^{-15} \mathrm{s}^{-1}$ being exceedingly low. Despite its low chance, the 21
cm hyperfine transition is one of the most important tools in observational
astronomy due to the abundance of hydrogen in the Universe. The relative
occupation number of the ground state and the occupation number of the excited
state determine the strength of the 21 cm emission or absorption. Collisions or
the so-called Wouthuysen-Field effect can both excite the 21 cm line. In this
article, we give a brief review of the basic physics of 21 cm emission and
highlight the current main worldwide 21 cm signal experiments. We also discuss
several related concepts in astronomy and cosmology with these observations.
","[{""version"":""v1"",""created"":""Sat, 31 Jul 2021 00:10:07 GMT""}]","2021-08-03"
"2108.00116","Stefaan Pomm\'e","Stefaan Pomm\'e, Krzysztof Pelczar","Role of ambient humidity underestimated in research on correlation
  between radioactive decay rates and space weather","6 pages, 1 figure",,,,"nucl-ex astro-ph.IM","http://creativecommons.org/licenses/by/4.0/","  In recent work, Milian-Sanchez et al. observed fluctuations in radioactive
decay rate measurement series, and after excluding environmental influences
(measured indoors) as root causes, they looked for possible correlations with
astrophysical variables. In spite of the authors efforts to investigate
possible influences of environmental parameters (such as ambient temperature,
pressure and humidity) on the detectors stability, it turns out that the
influence of ambient humidity on the instrumentation has been underestimated.
","[{""version"":""v1"",""created"":""Sat, 31 Jul 2021 00:10:14 GMT""}]","2021-08-03"
"2108.00117","Xiaoyuan Guo","Xiaoyuan Guo, Judy Wawira Gichoya, Saptarshi Purkayastha and Imon
  Banerjee","Margin-Aware Intra-Class Novelty Identification for Medical Images","35 pages, 8 figures","Journal of Medical Imaging 2022",,,"cs.CV","http://creativecommons.org/licenses/by-nc-sa/4.0/","  Traditional anomaly detection methods focus on detecting inter-class
variations while medical image novelty identification is inherently an
intra-class detection problem. For example, a machine learning model trained
with normal chest X-ray and common lung abnormalities, is expected to discover
and flag idiopathic pulmonary fibrosis which a rare lung disease and unseen by
the model during training. The nuances from intra-class variations and lack of
relevant training data in medical image analysis pose great challenges for
existing anomaly detection methods. To tackle the challenges, we propose a
hybrid model - Transformation-based Embedding learning for Novelty Detection
(TEND) which without any out-of-distribution training data, performs novelty
identification by combining both autoencoder-based and classifier-based method.
With a pre-trained autoencoder as image feature extractor, TEND learns to
discriminate the feature embeddings of in-distribution data from the
transformed counterparts as fake out-of-distribution inputs. To enhance the
separation, a distance objective is optimized to enforce a margin between the
two classes. Extensive experimental results on both natural image datasets and
medical image datasets are presented and our method out-performs
state-of-the-art approaches.
","[{""version"":""v1"",""created"":""Sat, 31 Jul 2021 00:10:26 GMT""},{""version"":""v2"",""created"":""Sat, 22 Jan 2022 16:57:49 GMT""}]","2022-01-25"
"2108.00118","Masakiyo Kitazawa","Atsushi Kiyohara, Masakiyo Kitazawa, Shinji Ejiri, Kazuyuki Kanaya","Finite-size scaling around the critical point in the heavy quark region
  of QCD","17 pages, 28 figures, version to appear in Physical Review D",,"10.1103/PhysRevD.104.114509","J-PARC-TH-0246,UTHEP-758","hep-lat hep-ph nucl-th","http://creativecommons.org/licenses/by/4.0/","  Finite-size scaling is investigated in detail around the critical point in
the heavy-quark region of nonzero temperature QCD. Numerical simulations are
performed with large spatial volumes up to the aspect ratio $N_s/N_t=12$ at a
fixed lattice spacing with $N_t=4$. We show that the Binder cumulant and the
distribution function of the Polyakov loop follow the finite-size scaling in
the $Z(2)$ universality class for large spatial volumes with $N_s/N_t \ge 9$,
while, for $N_s/N_t \le 8$, the Binder cumulant becomes inconsistent with the
$Z(2)$ scaling. To realize the large-volume simulations in the heavy-quark
region, we adopt the hopping parameter expansion for the quark determinant: We
generate gauge configurations using the leading order action including the
Polyakov loop term for $N_t=4$, and incorporate the next-to-leading order
effects in the measurements by the multipoint reweighting method. We find that
the use of the leading-order configurations is crucially effective in
suppressing the overlapping problem in the reweighting and thus reducing the
statistical errors.
","[{""version"":""v1"",""created"":""Sat, 31 Jul 2021 00:36:07 GMT""},{""version"":""v2"",""created"":""Thu, 16 Dec 2021 00:45:47 GMT""}]","2022-01-05"
"2108.00119","Babu Pokhrel","Babu R. Pokhrel","Measurement of Transverse Spin Dependent Azimuthal Correlations of
  Charged Pion(s) in $p^{\uparrow} p$ Collisions at $\sqrt s = 200$ GeV at STAR","6 pages, 3 figures, Submission to SciPost Proceedings-DIS2021","SciPost Phys. Proc. 8, 047 (2022)","10.21468/SciPostPhysProc.8.047",,"nucl-ex","http://creativecommons.org/licenses/by/4.0/","  At the leading twist, the transversity distribution function, $h^{q}_{1}(x)$,
where $x$ is the longitudinal momentum fraction of the proton carried by quark
$q$, encodes the transverse spin structure of the nucleon. Extraction of it is
difficult because of its chiral-odd nature. In transversely polarized
proton-proton collisions ($p^\uparrow p$), $h_{1}^{q}(x)$ can be coupled with
another chiral-odd partner, a spin-dependent fragmentation function (FF). The
resulting asymmetries in hadron(s) azimuthal correlations directly probe
$h_{1}^{q}(x)$. We report the measurement of correlation asymmetries for
charged pion(s) in $p^\uparrow p$, through the Collins and the Interference FF
channel.
","[{""version"":""v1"",""created"":""Sat, 31 Jul 2021 00:43:27 GMT""},{""version"":""v2"",""created"":""Tue, 15 Feb 2022 00:32:02 GMT""}]","2023-02-01"
"2108.00120","Eitan Tadmor","Eitan Tadmor, Changhui Tan","Critical threshold for global regularity of Euler-Monge-Amp\`ere system
  with radial symmetry",,,,,"math.AP math-ph math.MP","http://arxiv.org/licenses/nonexclusive-distrib/1.0/","  We study the global wellposedness of the Euler-Monge-Amp\`ere (EMA) system.
We obtain a sharp, explicit critical threshold in the space of initial
configurations which guarantees the global regularity of EMA system with
radially symmetric initial data. The result is obtained using two independent
approaches -- one using spectral dynamics of Liu & Tadmor [Comm. Math. Physics
228(3):435-466, 2002] and another based on the geometric approach of Brenier &
Loeper [Geom. Funct. Analysis 14(6):1182--1218, 2004]. The results are extended
to 2D radial EMA with swirl.
","[{""version"":""v1"",""created"":""Sat, 31 Jul 2021 00:45:27 GMT""},{""version"":""v2"",""created"":""Wed, 22 Dec 2021 04:34:18 GMT""}]","2021-12-23"
