"2102.01416","Barbara Perri","Barbara Perri, Allan Sacha Brun, Antoine Strugarek, and Victor
  R\'eville","Dynamical coupling of a mean-field dynamo and its wind: Feedback loop
  over a stellar activity cycle","30 pages, 19 figures, accepted in the Astrophysical Journal",,"10.3847/1538-4357/abe2ac",,"astro-ph.SR","http://creativecommons.org/licenses/by/4.0/","  We focus on the connection between the internal dynamo magnetic field and the
stellar wind. If the star has a cyclic dynamo, the modulations of the magnetic
field can affect the wind, which in turn can back-react on the boundary
conditions of the star, creating a feedback loop. We have developed a
2.5-dimensional numerical set-up to model this essential coupling. We have
implemented an alpha-Omega mean-field dynamo in the PLUTO code, and then
coupled it to a spherical polytropic wind model via an interface composed of
four grid layers with dedicated boundary conditions. We present here a dynamo
model close to a young Sun with cyclic magnetic activity. First we show how
this model allows to track the influence of the dynamo activity on the corona
by displaying the correlation between the activity cycle, the coronal structure
and the time evolution of integrated quantities. Then we add the feedback of
the wind on the dynamo and discuss the changes observed in the dynamo symmetry
and the wind variations. We explain these changes in terms of dynamo modes : in
this parameter regime, the feedback loop leads to a coupling between the dynamo
families via a preferred growth of the quadrupolar mode. We also study our
interface in terms of magnetic helicity, and show that it leads to a small
injection in the dynamo. This model confirms the importance of coupling
physically internal and external stellar layers, as it has a direct impact on
both the dynamo and the wind.
","[{""version"":""v1"",""created"":""Tue, 2 Feb 2021 10:27:12 GMT""}]","2021-03-31"
"2102.01417","Miguel Domingo","Miguel Domingo and Francisco Casacuberta","Two Demonstrations of the Machine Translation Applications to Historical
  Documents","Presented at the Demos session of ICPR 2020:
  https://www.micc.unifi.it/icpr2020/index.php/demos/",,,,"cs.CL","http://creativecommons.org/licenses/by-sa/4.0/","  We present our demonstration of two machine translation applications to
historical documents. The first task consists in generating a new version of a
historical document, written in the modern version of its original language.
The second application is limited to a document's orthography. It adapts the
document's spelling to modern standards in order to achieve an orthography
consistency and accounting for the lack of spelling conventions. We followed an
interactive, adaptive framework that allows the user to introduce corrections
to the system's hypothesis. The system reacts to these corrections by
generating a new hypothesis that takes them into account. Once the user is
satisfied with the system's hypothesis and validates it, the system adapts its
model following an online learning strategy. This system is implemented
following a client-server architecture. We developed a website which
communicates with the neural models. All code is open-source and publicly
available. The demonstration is hosted at http://demosmt.prhlt.upv.es/mthd/.
","[{""version"":""v1"",""created"":""Tue, 2 Feb 2021 10:28:31 GMT""}]","2021-02-03"
"2102.01418","Manil T Mohan","Manil T. Mohan","$\mathbb{L}^p$-solutions of deterministic and stochastic convective
  Brinkman-Forchheimer equations",,,,,"math.PR","http://arxiv.org/licenses/nonexclusive-distrib/1.0/","  In the first part of this work, we establish the existence and uniqueness of
a local mild solution to the deterministic convective Brinkman-Forchheimer
(CBF) equations defined on the whole space, by using properties of the heat
semigroup and fixed point arguments based on an iterative technique. The second
part is devoted for establishing the existence and uniqueness of a pathwise
mild solution upto a random time to the stochastic CBF equations perturbed by
L\'evy noise by exploiting the contraction mapping principle. We also discuss
the local solvability of the stochastic CBF equations subjected to fractional
Brownian noise.
","[{""version"":""v1"",""created"":""Tue, 2 Feb 2021 10:29:30 GMT""}]","2021-02-03"
"2102.01419","Pedro Abdalla Teixeira","Pedro Abdalla and Afonso S. Bandeira","Community Detection with a Subsampled Semidefinite Program","8 pages, 0 figures",,,,"math.OC math.PR stat.ML","http://arxiv.org/licenses/nonexclusive-distrib/1.0/","  Semidefinite programming is an important tool to tackle several problems in
data science and signal processing, including clustering and community
detection. However, semidefinite programs are often slow in practice, so speed
up techniques such as sketching are often considered. In the context of
community detection in the stochastic block model, Mixon and Xie
\cite{mixon2020sketching} have recently proposed a sketching framework in which
a semidefinite program is solved only on a subsampled subgraph of the network,
giving rise to significant computational savings. In this short paper, we
provide a positive answer to a conjecture of Mixon and Xie about the
statistical limits of this technique for the stochastic block model with two
balanced communities.
","[{""version"":""v1"",""created"":""Tue, 2 Feb 2021 10:31:57 GMT""},{""version"":""v2"",""created"":""Wed, 3 Feb 2021 16:53:16 GMT""},{""version"":""v3"",""created"":""Tue, 10 May 2022 09:43:47 GMT""}]","2022-05-11"
"2102.01420","Wei Jiang","Wei Jiang, Bin Han, Mohammad Asif Habibi, Hans Dieter Schotten","The Road Towards 6G: A Comprehensive Survey","30 Pages, 5 figures, IEEE open Journal","IEEE Open Journal of the Communications Society (OJCOMS), Vol. 2,
  2021, pp. 334 - 366","10.1109/OJCOMS.2021.3057679",,"eess.SP","http://arxiv.org/licenses/nonexclusive-distrib/1.0/","  As of today, the fifth generation (5G) mobile communication system has been
rolled out in many countries and the number of 5G subscribers already reaches a
very large scale. It is time for academia and industry to shift their attention
towards the next generation. At this crossroad, an overview of the current
state of the art and a vision of future communications are definitely of
interest. This article thus aims to provide a comprehensive survey to draw a
picture of the sixth generation (6G) system in terms of drivers, use cases,
usage scenarios, requirements, key performance indicators (KPIs), architecture,
and enabling technologies. First, we attempt to answer the question of ""Is
there any need for 6G?"" by shedding light on its key driving factors, in which
we predict the explosive growth of mobile traffic until 2030, and envision
potential use cases and usage scenarios. Second, the technical requirements of
6G are discussed and compared with those of 5G with respect to a set of KPIs in
a quantitative manner. Third, the state-of-the-art 6G research efforts and
activities from representative institutions and countries are summarized, and a
tentative roadmap of definition, specification, standardization, and regulation
is projected. Then, we identify a dozen of potential technologies and introduce
their principles, advantages, challenges, and open research issues. Finally,
the conclusions are drawn to paint a picture of ""What 6G may look like?"". This
survey is intended to serve as an enlightening guideline to spur interests and
further investigations for subsequent research and development of 6G
communications systems.
","[{""version"":""v1"",""created"":""Tue, 2 Feb 2021 10:32:35 GMT""}]","2021-03-11"
"2102.01421","Olivier Besson","Olivier Besson","A short overview of adaptive multichannel filters SNR loss analysis",,,,,"eess.SP","http://arxiv.org/licenses/nonexclusive-distrib/1.0/","  Many multichannel systems use a linear filter to retrieve a signal of
interest corrupted by noise whose statistics are partly unknown. The optimal
filter in Gaussian noise requires knowledge of the noise covariance matrix
$\Sigma$ and in practice the latter is estimated from a set of training
samples. An important issue concerns the characterization of the performance of
such adaptive filters. This is generally achieved using as figure of merit the
ratio of the signal to noise ratio (SNR) at the output of the adaptive filter
to the SNR obtained with the clairvoyant -- known $\Sigma$ -- filter. This
problem has been studied extensively since the seventies and this document
presents a concise overview of results published in the literature. We consider
various cases about the training samples covariance matrix and we investigate
fully adaptive, partially adaptive and regularized filters.
","[{""version"":""v1"",""created"":""Tue, 2 Feb 2021 10:33:52 GMT""},{""version"":""v2"",""created"":""Wed, 3 Mar 2021 09:33:20 GMT""},{""version"":""v3"",""created"":""Fri, 27 Aug 2021 07:07:39 GMT""}]","2021-08-30"
"2102.01422","Suresh C. Jaryal","Suresh C. Jaryal","Radiating-collapsing models satisfying Karmarkar condition","17 pages, 10 figures","Eur. Phys. J. C 80, 683 (2020)","10.1140/epjc/s10052-020-8257-3",,"gr-qc astro-ph.SR hep-th","http://creativecommons.org/licenses/by/4.0/","  This paper presents a class of exact spherical symmetric solutions of the
Einstein equations admitting heat-conducting anisotropic fluid as a collapsing
matter. The exterior spacetime is assumed to be the Vaidya metric. This class
of solutions is shown to satisfy all the energy conditions throughout the
interior of the star, and the luminosity is time independent, radiating
uniformly throughout the collapse.
","[{""version"":""v1"",""created"":""Tue, 2 Feb 2021 10:34:46 GMT""}]","2021-02-03"
"2102.01423","Yang Lyu Dr","Yang Lyu, Muqing Cao, Shenghai Yuan, and Lihua Xie","Vision Based Autonomous UAV Plane Estimation And Following for Building
  Inspection","12 pages, 12 figures, submitted to IEEE Transactions. for possible
  publication",,,,"cs.RO cs.SY eess.SY","http://creativecommons.org/licenses/by/4.0/","  Unmanned Aerial Vehicle (UAV) has already demonstrated its potential in many
civilian applications, and the fa\c{c}ade inspection is among the most
promising ones. In this paper, we focus on enabling the autonomous perception
and control of a small UAV for a fa\c{c}ade inspection task. Specifically, we
consider the perception as a planar object pose estimation problem by
simplifying the building structure as concatenation of planes, and the control
as an optimal reference tracking control problem. First, a vision based
adaptive observer is proposed which can realize stable plane pose estimation
under very mild observation conditions. Second, a model predictive controller
is designed to achieve stable tracking and smooth transition in a multi-plane
scenario, while the persistent excitation (PE) condition of the observer and
the maneuver constraints of the UAV are satisfied. The proposed autonomous
plane pose estimation and plane tracking methods are tested in both simulation
and practical building fas\c{c}ade inspection scenarios, which demonstrate
their effectiveness and practicability.
","[{""version"":""v1"",""created"":""Tue, 2 Feb 2021 10:37:09 GMT""}]","2021-02-03"
"2102.01424","Vladim\'ir Hol\'y","Ond\v{r}ej Sokol and Vladim\'ir Hol\'y","Clustering with Penalty for Joint Occurrence of Objects: Computational
  Aspects",,,,,"cs.AI cs.LG stat.ML","http://arxiv.org/licenses/nonexclusive-distrib/1.0/","  The method of Hol\'y, Sokol and \v{C}ern\'y (Applied Soft Computing, 2017,
Vol. 60, p. 752-762) clusters objects based on their incidence in a large
number of given sets. The idea is to minimize the occurrence of multiple
objects from the same cluster in the same set. In the current paper, we study
computational aspects of the method. First, we prove that the problem of
finding the optimal clustering is NP-hard. Second, to numerically find a
suitable clustering, we propose to use the genetic algorithm augmented by a
renumbering procedure, a fast task-specific local search heuristic and an
initial solution based on a simplified model. Third, in a simulation study, we
demonstrate that our improvements of the standard genetic algorithm
significantly enhance its computational performance.
","[{""version"":""v1"",""created"":""Tue, 2 Feb 2021 10:39:27 GMT""}]","2021-02-03"
"2102.01425","Van Hoang Nguyen","Anh Tuan Duong and Van Hoang Nguyen","The sharp second order Caffareli-Kohn-Nirenberg inequality and stability
  estimates for the sharp second order uncertainty principle","39 pages, comments are welcome. Corrected the proof of Theorem 1.5.
  Theorem 1.6 is removed",,,,"math.FA math.AP","http://creativecommons.org/licenses/by/4.0/","  In this paper we prove a class of second order Caffarelli-Kohn-Nirenberg
inequalities which contains the sharp second order uncertainty principle
recently established by Cazacu, Flynn and Lam \cite{CFL2020} as a special case.
We also show the sharpness of our inequalities for several classes of
parameters. Finally, we prove two stability versions of the sharp second order
uncertainty principle of Cazacu, Flynn and Lam by showing that the difference
of both sides of the inequality controls the distance to the set of extremal
functions in $L^2$ norm of gradient of functions.
","[{""version"":""v1"",""created"":""Tue, 2 Feb 2021 10:39:39 GMT""},{""version"":""v2"",""created"":""Wed, 23 Feb 2022 20:44:43 GMT""}]","2022-02-25"
"2102.01426","Luca Reggio","George Metcalfe and Luca Reggio","Model completions for universal classes of algebras: necessary and
  sufficient conditions","34 pages. v2: presentation improved. To appear in The Journal of
  Symbolic Logic",,,,"math.LO math.RA","http://creativecommons.org/licenses/by/4.0/","  Necessary and sufficient conditions are presented for the (first-order)
theory of a universal class of algebraic structures (algebras) to admit a model
completion, extending a characterization provided by Wheeler. For varieties of
algebras that have equationally definable principal congruences and the compact
intersection property, these conditions yield a more elegant characterization
obtained (in a slightly more restricted setting) by Ghilardi and Zawadowski.
Moreover, it is shown that under certain further assumptions on congruence
lattices, the existence of a model completion implies that the variety has
equationally definable principal congruences. This result is then used to
provide necessary and sufficient conditions for the existence of a model
completion for theories of Hamiltonian varieties of pointed residuated
lattices, a broad family of varieties that includes lattice-ordered abelian
groups and MV-algebras. Notably, if the theory of a Hamiltonian variety of
pointed residuated lattices admits a model completion, it must have
equationally definable principal congruences. In particular, the theories of
lattice-ordered abelian groups and MV-algebras do not have a model completion,
as first proved by Glass and Pierce, and Lacava, respectively. Finally, it is
shown that certain varieties of pointed residuated lattices generated by their
linearly ordered members, including lattice-ordered abelian groups and
MV-algebras, can be extended with a binary operation in order to obtain
theories that do have a model completion.
","[{""version"":""v1"",""created"":""Tue, 2 Feb 2021 10:40:17 GMT""},{""version"":""v2"",""created"":""Tue, 4 Jan 2022 16:55:53 GMT""}]","2022-01-05"
"2102.01427","Eugene Kogan","Eugene Kogan","Shock wave in series connected Josephson transmission line: Theoretical
  foundations and effects of resistive elements","LaTeX, 14 pages, 13 eps figures. As accepted for publication in
  Journal of Applied Physics","Journal of Applied Physics 130, 013903 (2021)","10.1063/5.0056886",,"cond-mat.supr-con nlin.PS physics.app-ph physics.class-ph","http://creativecommons.org/licenses/by/4.0/","  We analytically study shock wave in the Josephson transmission line (JTL) in
the presence of ohmic dissipation. When ohmic resistors shunt the Josephson
junctions (JJ) or are introduced in series with the ground capacitors the shock
is broadened. When ohmic resistors are in series with the JJ, the shock remains
sharp, same as it was in the absence of dissipation. In all the cases
considered, ohmic resistors don't influence the shock propagation velocity. We
study an alternative to the shock wave - an expansion fan - in the framework of
the simple wave approximation for the dissipationless JTL and formulate the
generalization of the approximation for the JTL with ohmic dissipation.
","[{""version"":""v1"",""created"":""Tue, 2 Feb 2021 10:51:38 GMT""},{""version"":""v10"",""created"":""Wed, 17 Mar 2021 14:49:32 GMT""},{""version"":""v11"",""created"":""Wed, 31 Mar 2021 16:18:28 GMT""},{""version"":""v12"",""created"":""Mon, 3 May 2021 10:12:15 GMT""},{""version"":""v13"",""created"":""Thu, 17 Jun 2021 16:49:19 GMT""},{""version"":""v2"",""created"":""Mon, 8 Feb 2021 16:53:01 GMT""},{""version"":""v3"",""created"":""Thu, 11 Feb 2021 17:18:26 GMT""},{""version"":""v4"",""created"":""Mon, 15 Feb 2021 06:19:02 GMT""},{""version"":""v5"",""created"":""Mon, 22 Feb 2021 12:24:36 GMT""},{""version"":""v6"",""created"":""Mon, 1 Mar 2021 17:04:10 GMT""},{""version"":""v7"",""created"":""Mon, 8 Mar 2021 18:09:59 GMT""},{""version"":""v8"",""created"":""Thu, 11 Mar 2021 13:46:13 GMT""},{""version"":""v9"",""created"":""Mon, 15 Mar 2021 16:42:03 GMT""}]","2022-02-22"
"2102.01428","Xue Liu","Xue Liu, Wei Wei, Xiangnan Feng, Xiaobo Cao, Dan Sun","Graph Classification Based on Skeleton and Component Features","25 pages, 7 figures, 2 tables",,,,"cs.LG cs.AI","http://creativecommons.org/licenses/by/4.0/","  Most existing popular methods for learning graph embedding only consider
fixed-order global structural features and lack structures hierarchical
representation. To address this weakness, we propose a novel graph embedding
algorithm named GraphCSC that realizes classification based on skeleton
information using fixed-order structures learned in anonymous random walks
manner, and component information using different size subgraphs. Two graphs
are similar if their skeletons and components are both similar, thus in our
model, we integrate both of them together into embeddings as graph homogeneity
characterization. We demonstrate our model on different datasets in comparison
with a comprehensive list of up-to-date state-of-the-art baselines, and
experiments show that our work is superior in real-world graph classification
tasks.
","[{""version"":""v1"",""created"":""Tue, 2 Feb 2021 10:52:17 GMT""}]","2021-02-03"
"2102.01429","Iuliana Marin","Iuliana Marin, Myssar Jabbar Hammood Al-Battbootti, Nicolae Goga","Drone Control based on Mental Commands and Facial Expressions",,"Electronics, Computers and Artificial Intelligence 2020
  INTERNATIONAL CONFERENCE","10.1109/ECAI50035.2020.9223246",,"cs.HC","http://arxiv.org/licenses/nonexclusive-distrib/1.0/","  When it is tried to control drones, there are many different ways through
various devices, using either motions like facial motion, special gloves with
sensors, red, green, blue cameras on the laptop or even using smartwatches by
performing gestures that are picked up by motion sensors. The paper proposes a
work on how drones could be controlled using brainwaves without any of those
devices. The drone control system of the current research was developed using
electroencephalogram signals took by an Emotiv Insight headset. The
electroencephalogram signals are collected from the users brain. The processed
signal is then sent to the computer via Bluetooth. The headset employs
Bluetooth Low Energy for wireless transmission. The brain of the user is
trained in order to use the generated electroencephalogram data. The final
signal is transmitted to Raspberry Pi zero via the MQTT messaging protocol. The
Raspberry Pi controls the movement of the drone through the incoming signal
from the headset. After years, brain control can replace many normal input
sources like keyboards, touch screens or other traditional ways, so it enhances
interactive experiences and provides new ways for disabled people to engage
with their surroundings.
","[{""version"":""v1"",""created"":""Tue, 2 Feb 2021 10:55:04 GMT""}]","2021-02-03"
"2102.01430","Johannes Fiedler","Johannes Fiedler, Michael Walter, Stefan Yoshi Buhmann","Effective screening of medium-assisted Van der Waals interactions
  between embedded particles",,,"10.1063/5.0037629",,"cond-mat.mes-hall quant-ph","http://creativecommons.org/licenses/by-nc-nd/4.0/","  The effect of an implicit medium on dispersive interactions of particle pairs
is discussed and simple expressions for the correction relative to vacuum are
derived. We show that a single point Gauss quadrature leads to the intuitive
result that the vacuum van der Waals $C_6$ coefficient is screened by the
permittivity squared of the environment evaluated near to the resonance
frequencies of the interacting particles. This approximation should be
particularly relevant if the medium is transparent at these frequencies. In the
manuscript, we provide simple models and sets of parameters for commonly used
solvents, atoms and small molecules.
","[{""version"":""v1"",""created"":""Tue, 2 Feb 2021 10:57:40 GMT""}]","2021-03-31"
"2102.01431","Florian Wirthm\""uller","Florian Wirthm\""uller, Marvin Klimke, Julian Schlechtriemen, Jochen
  Hipp and Manfred Reichert","Predicting the Time Until a Vehicle Changes the Lane Using LSTM-based
  Recurrent Neural Networks","the article has been accepted for publication in IEEE Robotics and
  Automation Letters (RA-L); the article has been submitted to RA-L with IEEE
  ICRA conference option; if the article will be presented during the
  conference will be decided independently; 8 pages, 5 figures, 6 tables",,"10.1109/LRA.2021.3058930",,"cs.LG cs.AI cs.NE cs.RO","http://arxiv.org/licenses/nonexclusive-distrib/1.0/","  To plan safe and comfortable trajectories for automated vehicles on highways,
accurate predictions of traffic situations are needed. So far, a lot of
research effort has been spent on detecting lane change maneuvers rather than
on estimating the point in time a lane change actually happens. In practice,
however, this temporal information might be even more useful. This paper deals
with the development of a system that accurately predicts the time to the next
lane change of surrounding vehicles on highways using long short-term
memory-based recurrent neural networks. An extensive evaluation based on a
large real-world data set shows that our approach is able to make reliable
predictions, even in the most challenging situations, with a root mean squared
error around 0.7 seconds. Already 3.5 seconds prior to lane changes the
predictions become highly accurate, showing a median error of less than 0.25
seconds. In summary, this article forms a fundamental step towards downstreamed
highly accurate position predictions.
","[{""version"":""v1"",""created"":""Tue, 2 Feb 2021 11:04:22 GMT""},{""version"":""v2"",""created"":""Wed, 3 Feb 2021 09:07:53 GMT""}]","2021-03-17"
"2102.01432","Aoxue Chen","Aoxue Chen, Guang Lin","Robust data-driven discovery of partial differential equations with
  time-dependent coefficients",,,,,"stat.ML cs.LG","http://arxiv.org/licenses/nonexclusive-distrib/1.0/","  In this work, we propose a robust Bayesian sparse learning algorithm based on
Bayesian group Lasso with spike and slab priors for the discovery of partial
differential equations with variable coefficients. Using the samples draw from
the posterior distribution with a Gibbs sampler, we are able to estimate the
values of coefficients, together with their standard errors and confidence
intervals. Apart from constructing the error bars, uncertainty quantification
can also be employed for designing new criteria of model selection and
threshold setting. This enables our method more adjustable and robust in
learning equations with time-dependent coefficients. Three criteria are
introduced for model selection and threshold setting to identify the correct
terms: the root mean square, total error bar, and group error bar. Moreover,
three noise filters are integrated with the robust Bayesian sparse learning
algorithm for better results with larger noise. Numerical results demonstrate
that our method is more robust than sequential grouped threshold ridge
regression and group Lasso in noisy situations through three examples.
","[{""version"":""v1"",""created"":""Tue, 2 Feb 2021 11:05:34 GMT""}]","2021-02-03"
