"2102.01247","Oliver Kosut","Oliver Kosut, Michelle Effros, Michael Langberg","Every Bit Counts: Second-Order Analysis of Cooperation in the
  Multiple-Access Channel","Full version of a paper submitted to ISIT 2021",,,,"cs.IT math.IT","http://arxiv.org/licenses/nonexclusive-distrib/1.0/","  The work at hand presents a finite-blocklength analysis of the multiple
access channel (MAC) sum-rate under the cooperation facilitator (CF) model. The
CF model, in which independent encoders coordinate through an intermediary
node, is known to show significant rate benefits, even when the rate of
cooperation is limited. We continue this line of study for cooperation rates
which are sub-linear in the blocklength $n$. Roughly speaking, our results show
that if the facilitator transmits $\log{K}$ bits, there is a sum-rate benefit
of order $\sqrt{\log{K}/n}$. This result extends across a wide range of $K$:
even a single bit of cooperation is shown to provide a sum-rate benefit of
order $1/\sqrt{n}$.
","[{""version"":""v1"",""created"":""Tue, 2 Feb 2021 01:22:12 GMT""}]","2021-02-03"
"2102.01248","Christopher Maul\'en","Chulkwang Kwak, Christopher Maul\'en","Ill-posedness issues on $(abcd)$-Boussinesq system","23 pages",,,,"math.AP","http://arxiv.org/licenses/nonexclusive-distrib/1.0/","  In this paper, we consider the Cauchy problem for $(abcd)$-Boussinesq system
posed on one- and two-dimensional Euclidean spaces. This model, initially
introduced by Bona, Chen, and Saut, describes a small-amplitude waves on the
surface of an inviscid fluid, and derived as a first-order approximation of
incompressible, irrotational Euler equations. We mainly establish the
ill-posedness of the system under various parameter regimes, which generalize
the result of the one-dimensional BBM-BBM case by Chen and Liu. Most of results
established here, we obtain the optimal result for two-dimensional BBM-BBM
system. The proof follows from an observation of the \emph{high to
low-frequency cascade} present in nonlinearity, motivated by Bejenaru and Tao.
","[{""version"":""v1"",""created"":""Tue, 2 Feb 2021 01:22:16 GMT""}]","2021-02-03"
"2102.01249","Runhua Xu","Runhua Xu, Chao Li, James Joshi","Blockchain-based Transparency Framework for Privacy Preserving
  Third-party Services","12 pages","IEEE TDSC 2022","10.1109/TDSC.2022.3179698",,"cs.CR cs.NI","http://creativecommons.org/licenses/by-nc-sa/4.0/","  Increasingly, information systems rely on computational, storage, and network
resources deployed in third-party facilities such as cloud centers and edge
nodes. Such an approach further exacerbates cybersecurity concerns constantly
raised by numerous incidents of security and privacy attacks resulting in data
leakage and identity theft, among others. These have, in turn, forced the
creation of stricter security and privacy-related regulations and have eroded
the trust in cyberspace. In particular, security-related services and
infrastructures, such as Certificate Authorities (CAs) that provide digital
certificate services and Third-Party Authorities (TPAs) that provide
cryptographic key services, are critical components for establishing trust in
crypto-based privacy-preserving applications and services. To address such
trust issues, various transparency frameworks and approaches have been recently
proposed in the literature. This paper proposes TAB framework that provides
transparency and trustworthiness of third-party authority and third-party
facilities using blockchain techniques for emerging crypto-based
privacy-preserving applications. TAB employs the Ethereum blockchain as the
underlying public ledger and also includes a novel smart contract to automate
accountability with an incentive mechanism that motivates users to participate
in auditing, and punishes unintentional or malicious behaviors. We implement
TAB and show through experimental evaluation in the Ethereum official test
network, Rinkeby, that the framework is efficient. We also formally show the
security guarantee provided by TAB, and analyze the privacy guarantee and
trustworthiness it provides.
","[{""version"":""v1"",""created"":""Tue, 2 Feb 2021 01:24:24 GMT""},{""version"":""v2"",""created"":""Thu, 4 Feb 2021 15:23:54 GMT""},{""version"":""v3"",""created"":""Sat, 4 Jun 2022 03:42:22 GMT""}]","2022-06-07"
"2102.01250","Nikolai Yampolsky","Petr M. Anisimov and Nikolai Yampolsky","Space charge fields in azimuthally symmetric beams: integrated Green's
  function approach",,,,,"physics.acc-ph physics.plasm-ph","http://arxiv.org/licenses/nonexclusive-distrib/1.0/","  Electromagnetic fields induced by the space charge in relativistic beams play
an important role in Accelerator Physics. They lead to emittance growth, slice
energy change, and the microbunching instability. Typically, these effects are
modeled numerically since simple description exists only in the limits of
large- or small-scale current variations. In this paper we consider an axially
symmetric charged beam inside a round pipe and find the solution of the space
charge problem that is valid in the full range of current variations. We
express the solution for the field components in terms of Green's functions,
which are fully determined by just a single function. We then find that this
function is an on-axis potential from a charged disk in a round pipe, with
transverse charge density $\rho_\perp(r)$, and it has a compact analytical
expression. We finally provide an integrated Green's function based approach
for efficient numerical evaluation in the case when the transverse charge
density stays the same along the beam.
","[{""version"":""v1"",""created"":""Tue, 2 Feb 2021 01:26:46 GMT""}]","2021-02-03"
"2102.01251","Bogdan Chlebus","Bogdan S. Chlebus and Dariusz R. Kowalski and Jan Olkowski and Jedrzej
  Olkowski","Consensus in Networks Prone to Link Failures",,,,,"cs.DC","http://arxiv.org/licenses/nonexclusive-distrib/1.0/","  We consider deterministic distributed algorithms solving Consensus in
synchronous networks of arbitrary topologies. Links are prone to failures.
Agreement is understood as holding in each connected component of a network
obtained by removing faulty links. We introduce the concept of stretch, which
is a function of the number of connected components of a network and their
respective diameters. Fast and early-stopping algorithms solving Consensus are
defined by referring to stretch resulting in removing faulty links. We develop
algorithms that rely only on nodes knowing their own names and the ability to
associate communication with local ports. A network has $n$ nodes and it starts
with $m$ functional links. We give a general algorithm operating in time $n$
that uses messages of $O(\log n)$ bits. If we additionally restrict executions
to be subject to a bound $\Lambda$ on stretch, then there is a fast algorithm
solving Consensus in time $O(\Lambda)$ using messages of $O(\log n)$ bits. Let
$\lambda$ be an unknown stretch occurring in an execution; we give an algorithm
working in time $(\lambda+2)^3$ and using messages of $O(n\log n)$ bits. We
show that Consensus can be solved in the optimal $O(\lambda)$ time, but at the
cost of increasing message size to $O(m\log n)$. We also demonstrate how to
solve Consensus by an algorithm that uses only $O(n)$ non-faulty links and
works in time $O(n m)$, while nodes start with their ports mapped to neighbors
and messages carry $O(m\log n)$ bits. We prove lower bounds on performance of
Consensus solutions that refer to parameters of evolving network topologies and
the knowledge available to nodes.
","[{""version"":""v1"",""created"":""Tue, 2 Feb 2021 01:30:06 GMT""}]","2021-02-03"
"2102.01252","Xichao Zhang","Jing Xia, Xichao Zhang, Kai-Yu Mak, Motohiko Ezawa, Oleg A. Tretiakov,
  Yan Zhou, Guoping Zhao, Xiaoxi Liu","Current-induced dynamics of skyrmion tubes in synthetic
  antiferromagnetic multilayers","8 pages, 6 figures","Phys. Rev. B 103, 174408 (2021)","10.1103/PhysRevB.103.174408",,"cond-mat.mes-hall","http://arxiv.org/licenses/nonexclusive-distrib/1.0/","  Topological spin textures can be found in both two-dimensional and
three-dimensional nanostructures, which are of great importance to advanced
spintronic applications. Here we report the current-induced skyrmion tube
dynamics in three-dimensional synthetic antiferromagnetic (SyAF) bilayer and
multilayer nanostructures. It is found that the SyAF skyrmion tube made of
thinner sublayer skyrmions is more stable during its motion, which ensures that
a higher speed of the skyrmion tube can be reached effectively at larger
driving current. In the SyAF multilayer with a given total thickness, the
current-induced deformation of the SyAF skyrmion tube decreases with an
increasing number of interfaces; namely, the rigidity of the SyAF skyrmion tube
with a given thickness increases with the number of ferromagnetic (FM) layers.
For the SyAF multilayer with an even number of FM layers, the skyrmion Hall
effect can be eliminated when the thicknesses of all FM layers are identical.
Larger damping parameter leads to smaller deformation and slower speed of the
SyAF skyrmion tube. Larger fieldlike torque leads to larger deformation and a
higher speed of the SyAF skyrmion tube. Our results are useful for
understanding the dynamic behaviors of three-dimensional topological spin
textures and may provide guidelines for building SyAF spintronic devices.
","[{""version"":""v1"",""created"":""Tue, 2 Feb 2021 01:38:33 GMT""},{""version"":""v2"",""created"":""Thu, 18 Feb 2021 02:15:39 GMT""},{""version"":""v3"",""created"":""Fri, 7 May 2021 23:44:29 GMT""}]","2021-05-11"
"2102.01253","Rong-Xin Miao","Ruiping Guo and Rong-Xin Miao","Enhancement of Anomalous Boundary Current by High Temperature","16 pages, 6 figures,references added, minor revision accepted for
  publication in EPJC",,"10.1140/epjc/s10052-021-09540-8",,"hep-th cond-mat.other","http://creativecommons.org/licenses/by/4.0/","  Recently it is found that Weyl anomaly leads to novel anomalous currents in
the spacetime with a boundary. However, the anomalous current is suppressed by
the mass of charge carriers and the distance to the boundary, which makes it
difficult to be measured. In this paper, we explore the possible mechanisms for
the enhancement of anomalous currents. Interestingly, we find that the
anomalous current can be significantly enhanced by the high temperature, which
makes easier the experimental detection. For free theories, the anomalous
current is proportional to the temperature in the high temperature limit. Note
that the currents can be enhanced by thermal effects only at high temperatures.
In general, this is not the case at low temperatures. For general temperatures,
the absolute value of the current of Neumann boundary condition first decreases
and then increases with the temperature, while the current of Dirichlet
boundary condition always increases with the temperature. It should be
mentioned that the enhancement does not have an anomalous nature. In fact, the
so-called anomalous current in this paper is not always related to Weyl
anomaly. Instead, it is an anomalous effect due to the boundary.
","[{""version"":""v1"",""created"":""Tue, 2 Feb 2021 01:44:50 GMT""},{""version"":""v2"",""created"":""Wed, 11 Aug 2021 12:15:28 GMT""}]","2021-09-15"
"2102.01254","Xinbiao Gan","Xinbiao Gan","Customizing Graph500 for Tianhe Pre-exacale system","Conflict of interest from unit",,,,"cs.DC","http://creativecommons.org/licenses/by-nc-nd/4.0/","  BFS (Breadth-First Search) is a typical graph algorithm used as a key
component of many graph applications. However, current distributed parallel BFS
implementations suffer from irregular data communication with large volumes of
transfers across nodes, leading to inefficiency in performance. In this paper,
we present a set of optimization techniques to improve the Graph500 performance
for Pre-exacale system, including BFS accelerating with SVE (Scalable Vector
extension) in matrix2000+, sorting with buffering for heavy vertices, and
group-based monitor communication based on proprietary interconnection built in
Tianhe Pre-exacale system. Performance evaluation on the customized Graph500
testing on the Tianhe Pre-exacale system achieves 2131.98 Giga TEPS on 512-node
with 96608 cores, which surpasses the ranking of Tianhe-2 with about 16X fewer
nodes in the June 2018 Graph500 list, and shows our customized Graph500 is 3.15
times faster on 512 nodes than the base version using the state-of-the-art
techniques.
","[{""version"":""v1"",""created"":""Tue, 2 Feb 2021 01:44:59 GMT""},{""version"":""v2"",""created"":""Sun, 21 Feb 2021 00:51:52 GMT""},{""version"":""v3"",""created"":""Mon, 16 Aug 2021 22:48:39 GMT""}]","2021-08-18"
"2102.01255","Stanislava Soro","Stanislava Soro","TinyML for Ubiquitous Edge AI",,,,,"cs.LG","http://creativecommons.org/licenses/by-nc-sa/4.0/","  TinyML is a fast-growing multidisciplinary field at the intersection of
machine learning, hardware, and software, that focuses on enabling deep
learning algorithms on embedded (microcontroller powered) devices operating at
extremely low power range (mW range and below). TinyML addresses the challenges
in designing power-efficient, compact deep neural network models, supporting
software framework, and embedded hardware that will enable a wide range of
customized, ubiquitous inference applications on battery-operated,
resource-constrained devices. In this report, we discuss the major challenges
and technological enablers that direct this field's expansion. TinyML will open
the door to the new types of edge services and applications that do not rely on
cloud processing but thrive on distributed edge inference and autonomous
reasoning.
","[{""version"":""v1"",""created"":""Tue, 2 Feb 2021 02:04:54 GMT""}]","2021-02-03"
"2102.01256","Yuan Liang","Yuan Liang, Weinan Song, Jiawei Yang, Liang Qiu, Kun Wang, Lei He","Atlas-aware ConvNetfor Accurate yet Robust Anatomical Segmentation",,,,,"cs.CV","http://creativecommons.org/licenses/by/4.0/","  Convolutional networks (ConvNets) have achieved promising accuracy for
various anatomical segmentation tasks. Despite the success, these methods can
be sensitive to data appearance variations. Considering the large variability
of scans caused by artifacts, pathologies, and scanning setups, robust ConvNets
are vital for clinical applications, while have not been fully explored. In
this paper, we propose to mitigate the challenge by enabling ConvNets'
awareness of the underlying anatomical invariances among imaging scans.
Specifically, we introduce a fully convolutional Constraint Adoption Module
(CAM) that incorporates probabilistic atlas priors as explicit constraints for
predictions over a locally connected Conditional Random Field (CFR), which
effectively reinforces the anatomical consistency of the labeling outputs. We
design the CAM to be flexible for boosting various ConvNet, and compact for
co-optimizing with ConvNets for fusion parameters that leads to the optimal
performance. We show the advantage of such atlas priors fusion is two-fold with
two brain parcellation tasks. First, our models achieve state-of-the-art
accuracy among ConvNet-based methods on both datasets, by significantly
reducing structural abnormalities of predictions. Second, we can largely boost
the robustness of existing ConvNets, proved by: (i) testing on scans with
synthetic pathologies, and (ii) training and evaluation on scans of different
scanning setups across datasets. Our method is proposing to be easily adopted
to existing ConvNets by fine-tuning with CAM plugged in for accuracy and
robustness boosts.
","[{""version"":""v1"",""created"":""Tue, 2 Feb 2021 02:06:06 GMT""}]","2021-02-03"
"2102.01257","Marcos Alexandrino","Marcos M. Alexandrino, Benigno Alves, Miguel Angel Javaloyes","On equifocal Finsler submanifolds and analytic maps",,,,,"math.DG","http://arxiv.org/licenses/nonexclusive-distrib/1.0/","  A relevant property of equifocal submanifolds is that their parallel sets are
still immersed submanifolds, which makes them a natural generalization of the
so-called isoparametric submanifolds. In this paper, we prove that the regular
fibers of an analytic map $\pi:M^{m+k}\to B^{k}$ are equifocal whenever
$M^{m+k}$ is endowed with a complete Finsler metric and there is a restriction
of $\pi$ which is a Finsler submersion for a certain Finsler metric on the
image. In addition, we prove that when the fibers provide a singular foliation
on $M^{m+k}$, then this foliation is Finsler.
","[{""version"":""v1"",""created"":""Tue, 2 Feb 2021 02:16:35 GMT""}]","2021-02-03"
"2102.01258","Shahab Asoodeh","Shahab Asoodeh, Maryam Aliakbarpour, and Flavio P. Calmon","Local Differential Privacy Is Equivalent to Contraction of
  $E_\gamma$-Divergence","arXiv admin note: text overlap with arXiv:2012.11035",,,,"cs.IT cs.LG math.IT stat.ML","http://creativecommons.org/licenses/by/4.0/","  We investigate the local differential privacy (LDP) guarantees of a
randomized privacy mechanism via its contraction properties. We first show that
LDP constraints can be equivalently cast in terms of the contraction
coefficient of the $E_\gamma$-divergence. We then use this equivalent formula
to express LDP guarantees of privacy mechanisms in terms of contraction
coefficients of arbitrary $f$-divergences. When combined with standard
estimation-theoretic tools (such as Le Cam's and Fano's converse methods), this
result allows us to study the trade-off between privacy and utility in several
testing and minimax and Bayesian estimation problems.
","[{""version"":""v1"",""created"":""Tue, 2 Feb 2021 02:18:12 GMT""}]","2023-02-12"
"2102.01259","Axel Osmond","Axel Osmond","The general construction of Spectra","61 pages",,,,"math.CT math.AG math.LO","http://creativecommons.org/licenses/by/4.0/","  We provide a synthesis of different topos-theoretical approaches of the
general construction of spectra, exploring jointly its purely categorical,
model theoretic and geometric aspects. We detail also the exact relation with
Diers notion of spectrum. Then we give a more detailed account of Cole's
original construction from bicategorical universal properties. We also provide
new formulas to compute the spectrum of arbitrary etale maps as pseudolimits,
as well as generalizations of results on fibered topos we then apply to compute
spectrum of a modelled topos.
","[{""version"":""v1"",""created"":""Tue, 2 Feb 2021 02:21:04 GMT""}]","2021-02-03"
"2102.01260","Xiong Liu","Xiong Liu, Craig E. Thomas, Christian C. Felder","The impact of external innovation on new drug approvals: A retrospective
  analysis",,"International Journal of Pharmaceutics, Volume 563, Pages 273-281,
  2019","10.1016/j.ijpharm.2018.12.093","PMID: 30664998","cs.CL cs.CY q-bio.QM","http://arxiv.org/licenses/nonexclusive-distrib/1.0/","  Pharmaceutical companies are relying more often on external sources of
innovation to boost their discovery research productivity. However, more
in-depth knowledge about how external innovation may translate to successful
product launches is still required in order to better understand how to best
leverage the innovation ecosystem. We analyzed the pre-approval publication
histories for FDA-approved new molecular entities (NMEs) and new biologic
entities (NBEs) launched by 13 top research pharma companies during the last
decade (2006-2016). We found that academic institutions contributed the
majority of pre-approval publications and that publication subject matter is
closely aligned with the strengths of the respective innovator. We found this
to also be true for candidate drugs terminated in Phase 3, but the volume of
literature on these molecules is substantially less than for approved drugs.
This may suggest that approved drugs are often associated with a more robust
dataset provided by a large number of institutes. Collectively, the results of
our analysis support the hypothesis that a collaborative research innovation
environment spanning across academia, industry and government is highly
conducive to successful drug approvals.
","[{""version"":""v1"",""created"":""Tue, 2 Feb 2021 02:21:34 GMT""}]","2021-02-03"
"2102.01261","Yajun Zhu","Yajun Zhu and Kun Xu","The first decade of unified gas kinetic scheme",,,,,"physics.comp-ph","http://arxiv.org/licenses/nonexclusive-distrib/1.0/","  In 2010, the unified gas kinetic scheme (UGKS) was proposed by Xu et al . (A
unified gas-kinetic scheme for continuum and rarefied flows, Journal of
Computational Physics, 2010). In the past decade, many numerical techniques
have been developed to improve the capability of the UGKS in the aspects of
efficiency increment, memory reduction, and physical modeling. The methodology
of the direct modeling of the UGKS on discretization scale provides a general
framework for construction of multiscale method for multiscale transport
processes. This paper reviews the development and extension of the UGKS in its
first decade.
","[{""version"":""v1"",""created"":""Tue, 2 Feb 2021 02:25:16 GMT""}]","2021-02-03"
"2102.01262","Elena Ostrovskaya","M. Pieczarka, E. Estrecho, S. Ghosh, M. Wurdack, M. Steger, D. W.
  Snoke, K. West, L. N. Pfeiffer, T .C. H. Liew, A. G. Truscott, and E. A.
  Ostrovskaya","Topological phase transition in an all-optical exciton-polariton lattice","7 pages, 4 figures",,,,"physics.optics cond-mat.mes-hall cond-mat.quant-gas","http://creativecommons.org/licenses/by/4.0/","  Topological insulators are a class of electronic materials exhibiting robust
edge states immune to perturbations and disorder. This concept has been
successfully adapted in photonics, where topologically nontrivial waveguides
and topological lasers were developed. However, the exploration of topological
properties in a given photonic system is limited to a fabricated sample,
without the flexibility to reconfigure the structure in-situ. Here, we
demonstrate an all-optical realization of the orbital Su-Schrieffer-Heeger
(SSH) model in a microcavity exciton-polariton system, whereby a cavity photon
is hybridized with an exciton in a GaAs quantum well. We induce a zigzag
potential for exciton polaritons all-optically, by shaping the nonresonant
laser excitation, and measure directly the eigenspectrum and topological edge
states of a polariton lattice in a nonlinear regime of bosonic condensation.
Furthermore, taking advantage of the tunability of the optically induced
lattice we modify the intersite tunneling to realize a topological phase
transition to a trivial state. Our results open the way to study topological
phase transitions on-demand in fully reconfigurable hybrid photonic systems
that do not require sophisticated sample engineering.
","[{""version"":""v1"",""created"":""Tue, 2 Feb 2021 02:28:34 GMT""},{""version"":""v2"",""created"":""Fri, 12 Feb 2021 07:13:43 GMT""}]","2021-02-15"
"2102.01263","Yao Dou","Yao Dou, Maxwell Forbes, Ari Holtzman, Yejin Choi","MultiTalk: A Highly-Branching Dialog Testbed for Diverse Conversations","7 pages, AAAI-21",,,,"cs.CL","http://creativecommons.org/licenses/by/4.0/","  We study conversational dialog in which there are many possible responses to
a given history. We present the MultiTalk Dataset, a corpus of over 320,000
sentences of written conversational dialog that balances a high branching
factor (10) with several conversation turns (6) through selective branch
continuation. We make multiple contributions to study dialog generation in the
highly branching setting. In order to evaluate a diverse set of generations, we
propose a simple scoring algorithm, based on bipartite graph matching, to
optimally incorporate a set of diverse references. We study multiple language
generation tasks at different levels of predictive conversation depth, using
textual attributes induced automatically from pretrained classifiers. Our
culminating task is a challenging theory of mind problem, a controllable
generation task which requires reasoning about the expected reaction of the
listener.
","[{""version"":""v1"",""created"":""Tue, 2 Feb 2021 02:29:40 GMT""}]","2021-02-03"
"2102.01264","Andrew Ross","Andrew Slavin Ross, Nina Chen, Elisa Zhao Hang, Elena L. Glassman,
  Finale Doshi-Velez","Evaluating the Interpretability of Generative Models by Interactive
  Reconstruction","CHI 2021 accepted paper",,,,"cs.LG cs.AI cs.HC","http://creativecommons.org/licenses/by/4.0/","  For machine learning models to be most useful in numerous sociotechnical
systems, many have argued that they must be human-interpretable. However,
despite increasing interest in interpretability, there remains no firm
consensus on how to measure it. This is especially true in representation
learning, where interpretability research has focused on ""disentanglement""
measures only applicable to synthetic datasets and not grounded in human
factors. We introduce a task to quantify the human-interpretability of
generative model representations, where users interactively modify
representations to reconstruct target instances. On synthetic datasets, we find
performance on this task much more reliably differentiates entangled and
disentangled models than baseline approaches. On a real dataset, we find it
differentiates between representation learning methods widely believed but
never shown to produce more or less interpretable models. In both cases, we ran
small-scale think-aloud studies and large-scale experiments on Amazon
Mechanical Turk to confirm that our qualitative and quantitative results
agreed.
","[{""version"":""v1"",""created"":""Tue, 2 Feb 2021 02:38:14 GMT""}]","2021-02-03"
