"2102.01093","Martin A. Guerrero","M. A. Guerrero, S. Cazzoli, J.S. Rechy-Garcia, G. Ramos-Larios, B.
  Montoro-Molina, V. M. A. Gomez-Gonzalez, J. A. Toala, X. Fang","Tomography of the unique on-going jet in the planetary nebula NGC 2392","12 pages, 9 figures, accepted for publication in The Astrophysical
  Journal",,"10.3847/1538-4357/abe2aa",,"astro-ph.SR astro-ph.GA astro-ph.IM","http://arxiv.org/licenses/nonexclusive-distrib/1.0/","  Jets (fast collimated outflows) are claimed to be the main shaping agent of
the most asymmetric planetary nebula (PNe) as they impinge on the circumstellar
material at late stages of the asymptotic giant branch (AGB) phase. The first
jet detected in a PN was that of NGC 2392, yet there is no available image
because its low surface brightness contrast with the bright nebular emission.
Here we take advantage from the tomographic capabilities of GTC MEGARA
high-dispersion integral field spectroscopic observations of the jet in NGC
2392 to gain unprecedented details of its morphology and kinematics. The jet of
NGC 2392 is found to emanate from the central star, break through the walls of
the inner shell of this iconic PN and extend outside the nebula's outermost
regions with an S-shaped morphology suggestive of precession. At odds with the
fossil jets found in mature PNe, the jet in NGC 2392 is currently being
collimated and launched. The high nebular excitation of NGC 2392, which implies
a He$^{++}$/He ionization fraction too high to be attributed to the known
effective temperature of the star, has been proposed in the past to hint at the
presence of a hot white dwarf companion. In conjunction with the hard X-ray
emission from the central star, the present-day jet collimation would support
the presence of such a double-degenerate system where one component undergoes
accretion from a remnant circumbinary disk of the common envelope phase.
","[{""version"":""v1"",""created"":""Mon, 1 Feb 2021 19:00:04 GMT""}]","2021-03-10"
"2102.01094","Teresa Symons","Teresa Symons, Michael Zemcov, James Bock, Yun-Ting Cheng, Brendan
  Crill, Christopher Hirata, and Stephanie Venuto","Superresolution Reconstruction of Severely Undersampled Point-spread
  Functions Using Point-source Stacking and Deconvolution","23 pages, 19 figures, 4 tables; accepted for publication in ApJS","ApJS 252:24 (2021)","10.3847/1538-4365/abcaa5",,"astro-ph.IM","http://arxiv.org/licenses/nonexclusive-distrib/1.0/","  Point-spread function (PSF) estimation in spatially undersampled images is
challenging because large pixels average fine-scale spatial information. This
is problematic when fine-resolution details are necessary, as in optimal
photometry where knowledge of the illumination pattern beyond the native
spatial resolution of the image may be required. Here, we introduce a method of
PSF reconstruction where point sources are artificially sampled beyond the
native resolution of an image and combined together via stacking to return a
finely sampled estimate of the PSF. This estimate is then deconvolved from the
pixel-gridding function to return a superresolution kernel that can be used for
optimally weighted photometry. We benchmark against the < 1% photometric error
requirement of the upcoming SPHEREx mission to assess performance in a concrete
example. We find that standard methods like Richardson--Lucy deconvolution are
not sufficient to achieve this stringent requirement. We investigate a more
advanced method with significant heritage in image analysis called iterative
back-projection (IBP) and demonstrate it using idealized Gaussian cases and
simulated SPHEREx images. In testing this method on real images recorded by the
LORRI instrument on New Horizons, we are able to identify systematic pointing
drift. Our IBP-derived PSF kernels allow photometric accuracy significantly
better than the requirement in individual SPHEREx exposures. This PSF
reconstruction method is broadly applicable to a variety of problems and
combines computationally simple techniques in a way that is robust to
complicating factors such as severe undersampling, spatially complex PSFs,
noise, crowded fields, or limited source numbers.
","[{""version"":""v1"",""created"":""Mon, 1 Feb 2021 19:00:04 GMT""}]","2021-02-03"
"2102.01095","Aurora Kesseli","Aurora Y. Kesseli and I.A.G. Snellen","Confirmation of Asymmetric Iron Absorption in WASP-76b with HARPS","7 page, 3 figures. Accepted to ApJL",,"10.3847/2041-8213/abe047",,"astro-ph.EP","http://creativecommons.org/licenses/by-nc-nd/4.0/","  Hot Jupiters are predicted to have hot, clear daysides and cooler, cloudy
nightsides. Recently, an asymmetric signature of iron absorption has been
resolved in the transmission spectrum of WASP-76b using ESPRESSO on ESO's Very
large Telescope. This feature is interpreted as being due to condensation of
iron on the nightside, resulting in a different absorption signature from the
evening than from the morning limb of the planet. It represents the first time
that a chemical gradient has been observed across the surface of a single
exoplanet. In this work, we confirm the presence of the asymmetric iron feature
using archival HARPS data of four transits. The detection shows that such
features can also be resolved by observing multiple transits on smaller
telescopes. By increasing the number of planets where these condensation
features are detected, we can make chemical comparisons between exoplanets and
map condensation across a range of parameters for the first time.
","[{""version"":""v1"",""created"":""Mon, 1 Feb 2021 19:00:05 GMT""}]","2021-02-24"
"2102.01096","Matteo Angelinelli","M. Angelinelli, S. Ettori, F. Vazza, T.W. Jones","Properties of clumps and filaments around galaxy clusters","Accepted to A&A; 19 pages, 25 figures","A&A 653, A171 (2021)","10.1051/0004-6361/202140471",,"astro-ph.CO","http://creativecommons.org/licenses/by-nc-nd/4.0/","  We report on the possibility of studying the proprieties of cosmic diffuse
baryons by studying self-gravitating clumps and filaments connected to galaxy
clusters. While filaments are challenging to detect with X-ray observations,
the higher density of clumps makes them visible and a viable tracer to study
the thermodynamical proprieties of baryons undergoing accretion along cosmic
web filaments onto galaxy clusters. We developed new algorithms to identify
these structures and applied them to a set of non-radiative cosmological
simulations of galaxy clusters at high resolution. We find that in those
simulated clusters, the density and temperature of clumps are independent of
the mass of the cluster where they reside. We detected a positive correlation
between the filament temperature and the host cluster mass. The density and
temperature of clumps and filaments also tended to correlate. Both the
temperature and density decrease moving outward. We observed that clumps are
hotter, more massive, and more luminous if identified closer to the cluster
center. Especially in the outermost cluster regions (~3*R500,c or beyond),
X-ray observations might already have the potential to locate cosmic filaments
based on the distribution of clumps and to allow one to study the
thermodynamics of diffuse baryons before they are processed by the intracluster
medium.
","[{""version"":""v1"",""created"":""Mon, 1 Feb 2021 19:00:08 GMT""},{""version"":""v2"",""created"":""Wed, 8 Sep 2021 11:19:33 GMT""}]","2021-10-04"
"2102.01097","Ranjan Modak","Ranjan Modak and Bhabani Prasad Mandal","Eigenstate entanglement entropy in $PT$ invariant non-Hermitian system","9 pages, 7 figures","Phys. Rev. A 103, 062416 (2021)","10.1103/PhysRevA.103.062416",,"cond-mat.stat-mech cond-mat.quant-gas hep-th quant-ph","http://creativecommons.org/publicdomain/zero/1.0/","  Much has been learned about universal properties of the eigenstate
entanglement entropy for one-dimensional lattice models, which is described by
a Hermitian Hamiltonian. While very less of it has been understood for
non-Hermitian systems. In the present work we study a non-Hermitian,
non-interacting model of fermions which is invariant under combined $PT$
transformation. Our models show a phase transition from $PT$ unbroken phase to
broken phase as we tune the hermiticity breaking parameter. Entanglement
entropy of such systems can be defined in two different ways, depending on
whether we consider only right (or equivalently only left) eigenstates or a
combination of both left and right eigenstates which form a complete set of
bi-orthonormal eigenstates. We demonstrate that the entanglement entropy of the
ground state and also of the typical excited states show some unique features
in both of these phases of the system. Most strikingly, entanglement entropy
obtained taking a combination of both left and right eigenstates shows an
exponential divergence with system size at the transition point. While in the
$PT$-unbroken phase, the entanglement entropy obtained from only the right (or
equivalently left) eigenstates shows identical behavior as of an equivalent
Hermitian system which is connected to the non-Hermitian system by a similarity
transformation.
","[{""version"":""v1"",""created"":""Mon, 1 Feb 2021 19:00:08 GMT""},{""version"":""v2"",""created"":""Thu, 24 Jun 2021 17:21:40 GMT""}]","2021-06-25"
"2102.01098","Freek Massee","L\'eonard Desvignes, Vasily S. Stolyarov, Marco Aprili and Freek
  Massee","Tunable high speed atomic rotor in Bi$_{2}$Se$_{3}$ revealed by current
  noise","Published in ACS Nano, this is the originally submitted manuscript
  prior to changes during the review process","ACS Nano 15, 1421-1425 (2021)","10.1021/acsnano.0c08718",,"cond-mat.str-el cond-mat.mes-hall cond-mat.mtrl-sci","http://arxiv.org/licenses/nonexclusive-distrib/1.0/","  The ability to manipulate individual atoms and molecules using a scanning
tunnelling microscope (STM) has been crucial for the development of a vast
array of atomic scale devices and structures ranging from nanoscale motors and
switches to quantum corrals. Molecular motors in particular have attracted
considerable attention in view of their potential for assembly into complex
nanoscale machines. Whereas the manipulated atoms or molecules are usually on
top of a substrate, motors embedded in a lattice can be very beneficial for
bottom-up construction, and may additionally be used to probe the in uence of
the lattice on the electronic properties of the host material. Here, we present
the discovery of controlled manipulation of a rotor in Fe doped
Bi$_{2}$Se$_{3}$. We find that the current into the rotor, which can be finely
tuned with the voltage, drives omni-directional switching between three
equivalent orientations, each of which can be frozen in at small bias voltage.
Using current fluctuation measurements at 1MHz and model simulations, we
estimate that switching rates of hundreds of kHz for sub-nA currents are
achieved.
","[{""version"":""v1"",""created"":""Mon, 1 Feb 2021 19:00:10 GMT""}]","2021-02-03"
"2102.01099","Bruce Normand","N. P. H\""anni, D. Sheptyakov, M. Mena, E. Hirtenlechner, L. Keller, U.
  Stuhr, L.-P. Regnault, M. Medarde, A. Cervellino, Ch. R\""uegg, B. Normand,
  and K. W. Kr\""amer","Magnetic order in the quasi-one-dimensional Ising system RbCoCl$_3$","23+3 pages, 10+2 figures, 6+4 tables","Phys. Rev. B 103, 094424 (2021)","10.1103/PhysRevB.103.094424",,"cond-mat.str-el","http://arxiv.org/licenses/nonexclusive-distrib/1.0/","  The dynamical properties of free and bound domain-wall excitations in
Ising-chain materials have recently become the focus of intense research
interest. New materials and spectrometers have made it possible to control the
environment of coupled Ising chains by both effective internal and applied
external fields, which can be both longitudinal and transverse, and thus to
demonstrate how the resulting magnetic phase transitions and the nature of the
associated excited states obey fundamental symmetry properties. In RbCoCl$_3$,
the weakly coupled Ising chains form a triangular lattice whose frustrated
geometry and magnetic ordering transitions at low temperature open new
possibilities for the Ising-chain environment. We have investigated the
structure and magnetism in RbCoCl$_3$ by high-resolution x-ray diffraction and
neutron scattering measurements on powder and single crystal samples between
1.5 K and 300 K. Upon cooling, the Co$^{2+}$ spins develop one-dimensional
antiferromagnetic correlations along the chain axis ($c$-axis) below 90 K.
Below the first N\'eel temperature, $T_{N1}$ = 28 K, a partial 3D magnetic
order sets in, with propagation vector ${\vec k}_1$ = (1/3,1/3,1), the moments
aligned along the $c$-axis and every third chain uncorrelated from its
neighbours. Only below a second magnetic phase transition at $T_{N2}$ = 13 K
does the system achieve a fully ordered state, with two additional propagation
vectors: ${\vec k}_2$ = (0,0,1) establishes a ""honeycomb"" $c$-axis order, in
which 1/3 of the chains are subject to a strong effective mean field due to
their neighbours whereas 2/3 experience no net field, while ${\vec k}_3$ =
(1/2,0,1) governs a small, staggered in-plane ordered moment. We conclude that
RbCoCl$_3$ is an excellent material to study the physics of Ising chains in a
wide variety of temperature-controlled environments.
","[{""version"":""v1"",""created"":""Mon, 1 Feb 2021 19:00:11 GMT""}]","2021-03-24"
"2102.01100","Ludovico Lami","Ludovico Lami","Quantum data hiding with continuous variable systems","25 pages; v2 has a generally improved presentation and is close to
  the published version","Phys. Rev. A 104, 052428 (2021)","10.1103/PhysRevA.104.052428",,"quant-ph math-ph math.MP","http://arxiv.org/licenses/nonexclusive-distrib/1.0/","  Suppose we want to benchmark a quantum device held by a remote party, e.g. by
testing its ability to carry out challenging quantum measurements outside of a
free set of measurements $\mathcal{M}$. A very simple way to do so is to set up
a binary state discrimination task that cannot be solved efficiently by means
of free measurements. If one can find pairs of orthogonal states that become
arbitrarily indistinguishable under measurements in $\mathcal{M}$, in the sense
that the error probability in discrimination approaches that of a random guess,
one says that there is data hiding against $\mathcal{M}$. Here we investigate
data hiding in the context of continuous variable quantum systems. First, we
look at the case where $\mathcal{M}=\mathrm{LOCC}$, the set of measurements
implementable with local operations and classical communication. While previous
studies have placed upper bounds on the maximum efficiency of data hiding in
terms of the local dimension and are thus not applicable to continuous variable
systems, we establish more general bounds that rely solely on the local mean
photon number of the states employed. Along the way, we perform a rigorous
quantitative analysis of the error introduced by the non-ideal
Braunstein-Kimble quantum teleportation protocol, determining how much
squeezing and local detection efficiency is needed in order to teleport an
arbitrary multi-mode local state of known mean energy with a prescribed
accuracy. Finally, following a seminal proposal by Sabapathy and Winter, we
look at data hiding against Gaussian operations assisted by feed-forward of
measurement outcomes, providing the first example of a relatively simple scheme
that works with a single mode only.
","[{""version"":""v1"",""created"":""Mon, 1 Feb 2021 19:00:14 GMT""},{""version"":""v2"",""created"":""Tue, 14 Dec 2021 22:57:48 GMT""}]","2021-12-16"
"2102.01101","Yong Zhao","Xiang Gao, Kyle Lee, Swagato Mukherjee, Charles Shugert and Yong Zhao","Origin and Resummation of Threshold Logarithms in the Lattice QCD
  Calculations of PDFs","15 pages, 7 figures","Phys. Rev. D 103, 094504 (2021)","10.1103/PhysRevD.103.094504",,"hep-ph hep-lat hep-th nucl-th","http://creativecommons.org/licenses/by-nc-sa/4.0/","  Many present lattice QCD approaches to calculate the parton distribution
functions (PDFs) rely on a factorization formula or effective theory expansion
of certain Euclidean matrix elements in boosted hadron states. In the quasi-
and pseudo-PDF methods, the matching coefficient in the factorization or
expansion formula includes large logarithms near the threshold, which arise
from the subtle interplay of collinear and soft divergences of an underlying 3D
momentum distribution. We use the standard prescription to resum such
logarithms in the Mellin-moment space at next-to-leading logarithmic accuracy,
which also accounts for the DGLAP evolution, and we show that it can suppress
the PDF at large $x$. Unlike the deep inelastic scattering and Drell-Yan cross
sections, the resummation formula is away from the Landau pole. We then apply
our formulation to reanalyze the recent lattice results for the pion valence
PDF, and find that within the current data sensitivity, the effect of threshold
resummation is marginal for the accessible moments and the PDF at large $x$.
","[{""version"":""v1"",""created"":""Mon, 1 Feb 2021 19:00:17 GMT""},{""version"":""v2"",""created"":""Thu, 27 May 2021 02:58:07 GMT""}]","2021-05-28"
"2102.01102","Dmytro Oriekhov","E. V. Gorbar, V. P. Gusynin and D. O. Oriekhov","Gap generation and flat band catalysis in dice model with local
  interaction","15 pages, 6 figures","Phys. Rev. B 103, 155155 (2021)","10.1103/PhysRevB.103.155155",,"cond-mat.str-el","http://arxiv.org/licenses/nonexclusive-distrib/1.0/","  The gap generation in the dice model with local four-fermion interaction is
studied. Due to the presence of two valleys with degenerate electron states,
there are two main types of gaps. The intra- and intervalley gap describes the
electron and hole pairing in the same and different valleys, respectively. We
found that while the generation of the intravalley gap takes place only in the
supercritical regime, the intervalley gap is generated for an arbitrary small
coupling. The physical reason for the absence of the critical coupling is the
catalysis of the intervalley gap generation by the flat band in the electron
spectrum of the dice model. The completely quenched kinetic energy in the flat
band when integrated over momentum in the gap equation leads to extremely large
intervalley gap proportional to the area of the Brillouin zone.
","[{""version"":""v1"",""created"":""Mon, 1 Feb 2021 19:02:02 GMT""},{""version"":""v2"",""created"":""Mon, 8 Feb 2021 21:07:25 GMT""},{""version"":""v3"",""created"":""Mon, 10 May 2021 09:02:23 GMT""}]","2021-05-11"
"2102.01103","Ke Liu","Nihal Rao, Ke Liu, Marc Machaczek, Lode Pollet","Machine-Learned Phase Diagrams of Generalized Kitaev Honeycomb Magnets","13 pages, 12 figures, 1 table; expanded discussions, added
  references; as published","Phys. Rev. Research 3, 033223 (2021)","10.1103/PhysRevResearch.3.033223",,"cond-mat.str-el cond-mat.mtrl-sci cs.LG","http://creativecommons.org/licenses/by/4.0/","  We use a recently developed interpretable and unsupervised machine-learning
method, the tensorial kernel support vector machine (TK-SVM), to investigate
the low-temperature classical phase diagram of a generalized
Heisenberg-Kitaev-$\Gamma$ ($J$-$K$-$\Gamma$) model on a honeycomb lattice.
Aside from reproducing phases reported by previous quantum and classical
studies, our machine finds a hitherto missed nested zigzag-stripy order and
establishes the robustness of a recently identified modulated $S_3 \times Z_3$
phase, which emerges through the competition between the Kitaev and $\Gamma$
spin liquids, against Heisenberg interactions. The results imply that, in the
restricted parameter space spanned by the three primary exchange interactions
-- $J$, $K$, and $\Gamma$, the representative Kitaev material $\alpha$-${\rm
RuCl}_3$ lies close to the boundaries of several phases, including a simple
ferromagnet, the unconventional $S_3 \times Z_3$ and nested zigzag-stripy
magnets. A zigzag order is stabilized by a finite $\Gamma^{\prime}$ and/or
$J_3$ term, whereas the four magnetic orders may compete in particular if
$\Gamma^{\prime}$ is anti-ferromagnetic.
","[{""version"":""v1"",""created"":""Mon, 1 Feb 2021 19:02:17 GMT""},{""version"":""v2"",""created"":""Sun, 12 Sep 2021 12:14:34 GMT""}]","2021-09-14"
"2102.01104","Philip Hackney","Philip Hackney and Martina Rovelli","Induced model structures for higher categories","15 pages, to appear in Proc. Amer. Math. Soc","Proc. Amer. Math. Soc. 150 (2022), 4629-4644","10.1090/proc/15982",,"math.CT math.AT","http://arxiv.org/licenses/nonexclusive-distrib/1.0/","  We give a new criterion guaranteeing existence of model structures
left-induced along a functor admitting both adjoints. This works under the
hypothesis that the functor induces idempotent adjunctions at the homotopy
category level. As an application, we construct new model structures on cubical
sets, prederivators, marked simplicial sets and simplicial spaces modeling
$\infty$-categories and $\infty$-groupoids.
","[{""version"":""v1"",""created"":""Mon, 1 Feb 2021 19:02:34 GMT""},{""version"":""v2"",""created"":""Fri, 14 Jan 2022 18:58:49 GMT""}]","2022-10-25"
"2102.01105","Jacopo Mazza","Jacopo Mazza, Edgardo Franzin, Stefano Liberati","A novel family of rotating black hole mimickers","20+ pages, lots of pictures; minor fixes, references added","JCAP 04 (2021) 082","10.1088/1475-7516/2021/04/082",,"gr-qc astro-ph.HE","http://arxiv.org/licenses/nonexclusive-distrib/1.0/","  The recent opening of gravitational wave astronomy has shifted the debate
about black hole mimickers from a purely theoretical arena to a
phenomenological one. In this respect, missing a definitive quantum gravity
theory, the possibility to have simple, meta-geometries describing in a compact
way alternative phenomenologically viable scenarios is potentially very
appealing. A recently proposed metric by Simpson and Visser is exactly an
example of such meta-geometry describing, for different values of a single
parameter, different non-rotating black hole mimickers. Here, we employ the
Newman--Janis procedure to construct a rotating generalisation of such
geometry. We obtain a stationary, axially symmetric metric that depends on
mass, spin and an additional real parameter $\ell$. According to the value of
such parameter, the metric may represent a rotating traversable wormhole, a
rotating regular black hole with one or two horizons, or three more limiting
cases. By studying the internal and external rich structure of such solutions,
we show that the obtained metric describes a family of interesting and simple
regular geometries providing viable Kerr black hole mimickers for future
phenomenological studies.
","[{""version"":""v1"",""created"":""Mon, 1 Feb 2021 19:03:20 GMT""},{""version"":""v2"",""created"":""Tue, 4 May 2021 19:56:17 GMT""}]","2021-05-06"
"2102.01106","Yunlong Jiao","Yunlong Jiao, Adam Gabrys, Georgi Tinchev, Bartosz Putrycz, Daniel
  Korzekwa, Viacheslav Klimkov","Universal Neural Vocoding with Parallel WaveNet","5 pages, 2 figures. Accepted to ICASSP 2021",,,,"eess.AS cs.CL cs.SD","http://arxiv.org/licenses/nonexclusive-distrib/1.0/","  We present a universal neural vocoder based on Parallel WaveNet, with an
additional conditioning network called Audio Encoder. Our universal vocoder
offers real-time high-quality speech synthesis on a wide range of use cases. We
tested it on 43 internal speakers of diverse age and gender, speaking 20
languages in 17 unique styles, of which 7 voices and 5 styles were not exposed
during training. We show that the proposed universal vocoder significantly
outperforms speaker-dependent vocoders overall. We also show that the proposed
vocoder outperforms several existing neural vocoder architectures in terms of
naturalness and universality. These findings are consistent when we further
test on more than 300 open-source voices.
","[{""version"":""v1"",""created"":""Mon, 1 Feb 2021 19:03:27 GMT""},{""version"":""v2"",""created"":""Mon, 15 Feb 2021 16:18:31 GMT""}]","2021-02-16"
"2102.01107","Timothy Hobbs","A. Accardi, T. J. Hobbs, X. Jing, P. M. Nadolsky","Deuterium scattering experiments in CTEQ global QCD analyses: a
  comparative investigation","28 pages, 13 multi-panel figures, 4 tables; updated to published
  version with comparisons to NNLO corrections and scale variations","Eur.Phys.J.C 81 (2021) 7, 603","10.1140/epjc/s10052-021-09318-y","SMU-HEP-20-08, JLAB-THY-21-3313","hep-ph hep-ex nucl-ex nucl-th","http://creativecommons.org/licenses/by/4.0/","  Experimental measurements in deep-inelastic scattering and lepton-pair
production on deuterium targets play an important role in the flavor separation
of $u$ and $d$ (anti)quarks in global QCD analyses of the parton distribution
functions (PDFs) of the nucleon. We investigate the impact of theoretical
corrections accounting for the light-nuclear structure of the deuteron upon the
fitted $u, d$-quark, gluon, and other PDFs in the CJ15 and CT18 families of
next-to-leading order CTEQ global analyses. The investigation is done using the
$L_2$ sensitivity statistical method, which provides a common metric to
quantify the strength of experimental constraints on various PDFs and ratios of
PDFs in the two distinct fitting frameworks. Using the $L_2$ sensitivity and
other approaches, we examine the compatibility of deuteron data sets with other
fitted experiments under varied implementations of the deuteron corrections. We
find that freely-fitted deuteron corrections modify the PDF uncertainty at
large momentum fractions and will be relevant for future PDFs affecting
electroweak precision measurements.
","[{""version"":""v1"",""created"":""Mon, 1 Feb 2021 19:06:13 GMT""},{""version"":""v2"",""created"":""Mon, 19 Jul 2021 20:36:11 GMT""}]","2021-07-21"
