"2104.00846","Tianyu Zhang","Tianyu Zhang and Noah Simon","A Sieve Stochastic Gradient Descent Estimator for Online Nonparametric
  Regression in Sobolev ellipsoids",,,,,"math.ST stat.ME stat.TH","http://creativecommons.org/licenses/by/4.0/","  The goal of regression is to recover an unknown underlying function that best
links a set of predictors to an outcome from noisy observations. In
nonparametric regression, one assumes that the regression function belongs to a
pre-specified infinite-dimensional function space (the hypothesis space). In
the online setting, when the observations come in a stream, it is
computationally-preferable to iteratively update an estimate rather than
refitting an entire model repeatedly. Inspired by nonparametric sieve
estimation and stochastic approximation methods, we propose a sieve stochastic
gradient descent estimator (Sieve-SGD) when the hypothesis space is a Sobolev
ellipsoid. We show that Sieve-SGD has rate-optimal mean squared error (MSE)
under a set of simple and direct conditions. The proposed estimator can be
constructed with a low computational (time and space) expense: We also formally
show that Sieve-SGD requires almost minimal memory usage among all
statistically rate-optimal estimators.
","[{""version"":""v1"",""created"":""Fri, 2 Apr 2021 01:52:47 GMT""},{""version"":""v2"",""created"":""Thu, 6 Jan 2022 22:11:15 GMT""}]","2022-01-10"
"2104.00847","Ye Xiong","YE Xiong","The topological vacuum in exceptional Brillouin zone","5 pages, 3 figures",,,,"cond-mat.mes-hall quant-ph","http://creativecommons.org/licenses/by/4.0/","  The vacuum of a band system, with respect to particles or holes, can become
topologically nontrivial when the exceptional points of the non-hermitian
Hamiltonian spread over the whole Brillouin zone. The coalescence of the
eigenstates eliminates the geometric multiplicity of the Hamiltonian and puts
the remaining bands on a topological background. We find several distinct
phenomena in these systems: a single band topological model, a two-band Chern
insulator in which the topological number of the low band does not compensate
to that of the up band, a topologically protected boundary state that is less
damping when stronger dissipative forces are subjected and topologically
protected in-gap extended states. Our results are presented by the vibrational
spectrum on a classical lattice. The active constrains are the key ingredient
to collapse the demanding Hilbert subspace.
","[{""version"":""v1"",""created"":""Fri, 2 Apr 2021 01:56:30 GMT""},{""version"":""v2"",""created"":""Tue, 13 Apr 2021 03:00:52 GMT""}]","2021-04-14"
"2104.00848","Kangfu Mei","Kangfu Mei, Shenglong Ye, Rui Huang","SDAN: Squared Deformable Alignment Network for Learning Misaligned
  Optical Zoom","ICME21. Code is available at https://github.com/MKFMIKU/SDAN",,,,"cs.CV","http://arxiv.org/licenses/nonexclusive-distrib/1.0/","  Deep Neural Network (DNN) based super-resolution algorithms have greatly
improved the quality of the generated images. However, these algorithms often
yield significant artifacts when dealing with real-world super-resolution
problems due to the difficulty in learning misaligned optical zoom. In this
paper, we introduce a Squared Deformable Alignment Network (SDAN) to address
this issue. Our network learns squared per-point offsets for convolutional
kernels, and then aligns features in corrected convolutional windows based on
the offsets. So the misalignment will be minimized by the extracted aligned
features. Different from the per-point offsets used in the vanilla Deformable
Convolutional Network (DCN), our proposed squared offsets not only accelerate
the offset learning but also improve the generation quality with fewer
parameters. Besides, we further propose an efficient cross packing attention
layer to boost the accuracy of the learned offsets. It leverages the packing
and unpacking operations to enlarge the receptive field of the offset learning
and to enhance the ability of extracting the spatial connection between the
low-resolution images and the referenced images. Comprehensive experiments show
the superiority of our method over other state-of-the-art methods in both
computational efficiency and realistic details.
","[{""version"":""v1"",""created"":""Fri, 2 Apr 2021 01:58:00 GMT""},{""version"":""v2"",""created"":""Thu, 25 Nov 2021 21:45:08 GMT""}]","2021-11-29"
"2104.00849","Peng Chen","Xiaokang Mao, Zhiguo Yu, Peng Che, Jing Zhou, Yuyin Li, Jianbo Feng,
  Zili Xie, Hong Zhao, Dunjun Chen, Xiangqian Xiu, Ke Wang, Yi Shi, Rong Zhang,
  Youdou Zheng","Localized surface plasmon enhanced InGaN-based light-emitting diodes
  with polygonal Au/Al nanoparticles","7 pages, 5 figures. This work has ever been successfully submitted to
  Crystals for possible publication in Feb. 2021, and the manuscript ID is
  crystals-1129650",,,,"physics.optics physics.app-ph","http://arxiv.org/licenses/nonexclusive-distrib/1.0/","  Localized surface plasmons (LSPs) have played a significant role in improving
the light emission efficiency of light emitting diodes (LEDs). In this report,
polygonal nanoholes have been fabricated in the p-GaN layer of InGaN-based LEDs
by using Ni nanoporous film as the etching mask, and then Au/Al metal
nanoparticles are embedded in the nanoholes to form the LSP structure. The
coupling between the LSP and the LED has been clearly observed. The results
show that the light output of the LEDs has been increased by 46% at higher
current injection condition, and together with a shift of the gain peak
position to the LSP peak resonance energy. As the coupling distance is
decreased from 60 nm to 30 nm, the maximum enhancement factor increases to
2.38. The above results indicate that the LSP from the polygonal metal
nanoparticles is a kind of very promising structure to enhance the lighting
performance of the InGaN-based LEDs.
","[{""version"":""v1"",""created"":""Fri, 2 Apr 2021 02:06:01 GMT""}]","2021-04-05"
"2104.00850","Loris Nanni","Alessandra Lumini, Loris Nanni and Gianluca Maguolo","Deep ensembles based on Stochastic Activation Selection for Polyp
  Segmentation",,,,,"cs.CV cs.AI","http://creativecommons.org/licenses/by/4.0/","  Semantic segmentation has a wide array of applications ranging from
medical-image analysis, scene understanding, autonomous driving and robotic
navigation. This work deals with medical image segmentation and in particular
with accurate polyp detection and segmentation during colonoscopy examinations.
Several convolutional neural network architectures have been proposed to
effectively deal with this task and with the problem of segmenting objects at
different scale input. The basic architecture in image segmentation consists of
an encoder and a decoder: the first uses convolutional filters to extract
features from the image, the second is responsible for generating the final
output. In this work, we compare some variant of the DeepLab architecture
obtained by varying the decoder backbone. We compare several decoder
architectures, including ResNet, Xception, EfficentNet, MobileNet and we
perturb their layers by substituting ReLU activation layers with other
functions. The resulting methods are used to create deep ensembles which are
shown to be very effective. Our experimental evaluations show that our best
ensemble produces good segmentation results by achieving high evaluation scores
with a dice coefficient of 0.884, and a mean Intersection over Union (mIoU) of
0.818 for the Kvasir-SEG dataset. To improve reproducibility and research
efficiency the MATLAB source code used for this research is available at
GitHub: https://github.com/LorisNanni.
","[{""version"":""v1"",""created"":""Fri, 2 Apr 2021 02:07:37 GMT""},{""version"":""v2"",""created"":""Wed, 7 Apr 2021 21:31:56 GMT""}]","2021-04-09"
"2104.00851","Yang Zhao","Yang Zhao and Hao Zhang","Estimating the Generalization in Deep Neural Networks via Sparsity",,,,,"cs.CV","http://creativecommons.org/licenses/by/4.0/","  Generalization is the key capability for deep neural networks (DNNs).
However, it is challenging to give a reliable measure of the generalization
ability of a DNN via only its nature. In this paper, we propose a novel method
for estimating the generalization gap based on network sparsity. In our method,
two key quantities are proposed first. They have close relationship with the
generalization ability and can be calculated directly from the training results
alone. Then a simple linear model involving two key quantities are constructed
to give accurate estimation of the generalization gap. By training DNNs with a
wide range of generalization gap on popular datasets, we show that our key
quantities and linear model could be efficient tools for estimating the
generalization gap of DNNs.
","[{""version"":""v1"",""created"":""Fri, 2 Apr 2021 02:10:32 GMT""},{""version"":""v2"",""created"":""Sun, 16 Jan 2022 15:00:02 GMT""}]","2022-01-19"
"2104.00852","Felipe Herrera","Felipe Herrera and Marina Litinskaya","Disordered ensembles of strongly coupled single-molecule plasmonic
  picocavities as nonlinear optical metamaterials","13 pages, 7 figs, 3 appendices","J. Chem. Phys 156, 114702, 2022","10.1063/5.0080063",,"cond-mat.mes-hall physics.chem-ph physics.optics quant-ph","http://arxiv.org/licenses/nonexclusive-distrib/1.0/","  We propose to use molecular picocavity ensembles as macroscopic coherent
nonlinear optical devices enabled by nanoscale strong coupling. For a generic
picocavity model that includes molecular and photonic disorder, we derive
theoretical performance bounds for coherent cross-phase modulation signals
using weak classical fields of different frequencies. We show that strong
coupling of the picocavity {\it vacua} with a specific vibronic sideband in the
molecular emission spectrum results in a significant variation of the effective
refractive index of the metamaterial relative to a molecule-free scenario, due
to a vacuum-induced Autler-Townes effect. For a realistic molecular disorder
model, we demonstrate that cross-phase modulation of optical fields as weak as
10 kW/cm$^2$ is feasible using dilute ensembles of molecular picocavities at
room temperature, provided that the confined vacuum is not resonantly driven by
the external probe field}. Our work paves the way for the development of
plasmonic metamaterials that exploit strong coupling for optical state
preparation and quantum control.
","[{""version"":""v1"",""created"":""Fri, 2 Apr 2021 02:12:36 GMT""},{""version"":""v2"",""created"":""Mon, 21 Feb 2022 00:54:25 GMT""}]","2022-03-18"
"2104.00853","Hao Peng","Hao Peng, Jianxin Li, Yangqiu Song, Renyu Yang, Rajiv Ranjan, Philip
  S. Yu, Lifang He","Streaming Social Event Detection and Evolution Discovery in
  Heterogeneous Information Networks","Accepted by TKDD 2021. arXiv admin note: text overlap with
  arXiv:1906.04580",,,,"cs.SI cs.AI cs.LG","http://arxiv.org/licenses/nonexclusive-distrib/1.0/","  Events are happening in real-world and real-time, which can be planned and
organized for occasions, such as social gatherings, festival celebrations,
influential meetings or sports activities. Social media platforms generate a
lot of real-time text information regarding public events with different
topics. However, mining social events is challenging because events typically
exhibit heterogeneous texture and metadata are often ambiguous. In this paper,
we first design a novel event-based meta-schema to characterize the semantic
relatedness of social events and then build an event-based heterogeneous
information network (HIN) integrating information from external knowledge base.
Second, we propose a novel Pairwise Popularity Graph Convolutional Network,
named as PP-GCN, based on weighted meta-path instance similarity and textual
semantic representation as inputs, to perform fine-grained social event
categorization and learn the optimal weights of meta-paths in different tasks.
Third, we propose a streaming social event detection and evolution discovery
framework for HINs based on meta-path similarity search, historical information
about meta-paths, and heterogeneous DBSCAN clustering method. Comprehensive
experiments on real-world streaming social text data are conducted to compare
various social event detection and evolution discovery algorithms. Experimental
results demonstrate that our proposed framework outperforms other alternative
social event detection and evolution discovery techniques.
","[{""version"":""v1"",""created"":""Fri, 2 Apr 2021 02:13:10 GMT""}]","2021-04-05"
"2104.00854","Chuanxia Zheng","Chuanxia Zheng, Tat-Jen Cham, Jianfei Cai","The Spatially-Correlative Loss for Various Image Translation Tasks","14 pages, 12 figures",,,,"cs.CV","http://creativecommons.org/licenses/by-nc-sa/4.0/","  We propose a novel spatially-correlative loss that is simple, efficient and
yet effective for preserving scene structure consistency while supporting large
appearance changes during unpaired image-to-image (I2I) translation. Previous
methods attempt this by using pixel-level cycle-consistency or feature-level
matching losses, but the domain-specific nature of these losses hinder
translation across large domain gaps. To address this, we exploit the spatial
patterns of self-similarity as a means of defining scene structure. Our
spatially-correlative loss is geared towards only capturing spatial
relationships within an image rather than domain appearance. We also introduce
a new self-supervised learning method to explicitly learn spatially-correlative
maps for each specific translation task. We show distinct improvement over
baseline models in all three modes of unpaired I2I translation: single-modal,
multi-modal, and even single-image translation. This new loss can easily be
integrated into existing network architectures and thus allows wide
applicability.
","[{""version"":""v1"",""created"":""Fri, 2 Apr 2021 02:13:30 GMT""}]","2021-04-05"
"2104.00855","Kaoru Mizuta","Kaoru Mizuta, Mikiya Fujii, Shigeki Fujii, Kazuhide Ichikawa, Yutaka
  Imamura, Yukihiro Okuno, and Yuya O. Nakagawa","Deep variational quantum eigensolver for excited states and its
  application to quantum chemistry calculation of periodic materials","18 pages, 5 figures","Phys. Rev. Research 3, 043121 (2021)","10.1103/PhysRevResearch.3.043121",,"quant-ph cond-mat.str-el","http://arxiv.org/licenses/nonexclusive-distrib/1.0/","  A programmable quantum device that has a large number of qubits without
fault-tolerance has emerged recently. Variational Quantum Eigensolver (VQE) is
one of the most promising ways to utilize the computational power of such
devices to solve problems in condensed matter physics and quantum chemistry. As
the size of the current quantum devices is still not large for rivaling
classical computers at solving practical problems, Fujii et al. proposed a
method called ""Deep VQE"" which can provide the ground state of a given quantum
system with the smaller number of qubits by combining the VQE and the technique
of coarse-graining [K. Fujii, et al, arXiv:2007.10917]. In this paper, we
extend the original proposal of Deep VQE to obtain the excited states and apply
it to quantum chemistry calculation of a periodic material, which is one of the
most impactful applications of the VQE. We first propose a modified scheme to
construct quantum states for coarse-graining in Deep VQE to obtain the excited
states. We also present a method to avoid a problem of meaningless eigenvalues
in the original Deep VQE without restricting variational quantum states.
Finally, we classically simulate our modified Deep VQE for quantum chemistry
calculation of a periodic hydrogen chain as a typical periodic material. Our
method reproduces the ground-state energy and the first-excited-state energy
with the errors up to O(1)% despite the decrease in the number of qubits
required for the calculation by two or four compared with the naive VQE. Our
result will serve as a beacon for tackling quantum chemistry problems with
classically-intractable sizes by smaller quantum devices in the near future.
","[{""version"":""v1"",""created"":""Fri, 2 Apr 2021 02:19:30 GMT""},{""version"":""v2"",""created"":""Fri, 27 Aug 2021 03:14:51 GMT""}]","2022-01-28"
"2104.00856","Yuqiu Fu","Yuqiu Fu, Larry Guth, Dominique Maldague","Decoupling inequalities for short generalized Dirichlet sequences","54 pages; added small-cap type decoupling; included a transference
  argument, which we learned from James Maynard, that implies corollaries on
  $L^p$ estimates for short generalized Dirichlet sequences from parabola
  decoupling",,,,"math.CA math.NT","http://arxiv.org/licenses/nonexclusive-distrib/1.0/","  We study decoupling theory for functions on $\mathbb{R}$ with Fourier
transform supported in a neighborhood of short Dirichlet sequences $\{\log
n\}_{n=N+1}^{N+N^{1/2}}$, as well as sequences with similar convexity
properties. We utilize the wave packet structure of functions with frequency
support near an arithmetic progression.
","[{""version"":""v1"",""created"":""Fri, 2 Apr 2021 02:24:36 GMT""},{""version"":""v2"",""created"":""Tue, 20 Jul 2021 21:54:24 GMT""}]","2021-07-22"
"2104.00857","Yosuke Goto","Naoto Nakamura, Yosuke Goto, and Yoshikazu Mizuguchi","Axis-dependent carrier polarity in polycrystalline NaSn$_2$As$_2$","to be published in Appl. Phys. Lett. 17 pages, 5 figures",,"10.1063/5.0047469",,"physics.app-ph cond-mat.mtrl-sci","http://creativecommons.org/licenses/by-nc-nd/4.0/","  Transverse thermoelectric devices consist of only one thermoelectric
material, unlike conventional longitudinal thermoelectric devices that require
two types of thermoelectric materials with p- and n-type polarities. However,
scalable synthesis of materials that demonstrate axis-dependent carrier
polarity, which is a prospective component to demonstrate the transverse
thermoelectric device, is challenging. This paper reports that polycrystalline
NaSn$_2$As$_2$, which was prepared by using uniaxial hot pressing, displayed
axis-dependent carrier polarity. The preferred orientation of the sample was
confirmed through X-ray diffraction measurements. Seebeck coefficient
measurements indicate that carrier polarity depends on the measurement
direction, which is consistent with recently reported results on single
crystals of NaSn$_2$As$_2$. Given that our sample preparation procedure is
readily scalable, the present work shows the possibility for preparing
transverse thermoelectric devices using polycrystalline NaSn$_2$As$_2$ with a
preferred orientation.
","[{""version"":""v1"",""created"":""Fri, 2 Apr 2021 02:29:59 GMT""}]","2021-11-24"
"2104.00858","Feng Liu","Feng Liu, Luan Tran, Xiaoming Liu","Fully Understanding Generic Objects: Modeling, Segmentation, and
  Reconstruction","To appear in CVPR 2021",,,,"cs.CV","http://creativecommons.org/licenses/by/4.0/","  Inferring 3D structure of a generic object from a 2D image is a long-standing
objective of computer vision. Conventional approaches either learn completely
from CAD-generated synthetic data, which have difficulty in inference from real
images, or generate 2.5D depth image via intrinsic decomposition, which is
limited compared to the full 3D reconstruction. One fundamental challenge lies
in how to leverage numerous real 2D images without any 3D ground truth. To
address this issue, we take an alternative approach with semi-supervised
learning. That is, for a 2D image of a generic object, we decompose it into
latent representations of category, shape and albedo, lighting and camera
projection matrix, decode the representations to segmented 3D shape and albedo
respectively, and fuse these components to render an image well approximating
the input image. Using a category-adaptive 3D joint occupancy field (JOF), we
show that the complete shape and albedo modeling enables us to leverage real 2D
images in both modeling and model fitting. The effectiveness of our approach is
demonstrated through superior 3D reconstruction from a single image, being
either synthetic or real, and shape segmentation.
","[{""version"":""v1"",""created"":""Fri, 2 Apr 2021 02:39:29 GMT""}]","2021-04-05"
"2104.00859","Hanna Kurniawati","Jimy Cai Huang and Hanna Kurniawati","An NCAP-like Safety Indicator for Self-Driving Cars",,,,,"cs.RO cs.AI","http://arxiv.org/licenses/nonexclusive-distrib/1.0/","  This paper proposes a mechanism to assess the safety of autonomous cars. It
assesses the car's safety in scenarios where the car must avoid collision with
an adversary. Core to this mechanism is a safety measure, called Safe-Kamikaze
Distance (SKD), which computes the average similarity between sets of safe
adversary's trajectories and kamikaze trajectories close to the safe
trajectories. The kamikaze trajectories are generated based on planning under
uncertainty techniques, namely the Partially Observable Markov Decision
Processes, to account for the partially observed car policy from the point of
view of the adversary. We found that SKD is inversely proportional to the upper
bound on the probability that a small deformation changes a collision-free
trajectory of the adversary into a colliding one. We perform systematic tests
on a scenario where the adversary is a pedestrian crossing a single-lane road
in front of the car being assessed --which is, one of the scenarios in the
Euro-NCAP's Vulnerable Road User (VRU) tests on Autonomous Emergency Braking.
Simulation results on assessing cars with basic controllers and a test on a
Machine-Learning controller using a high-fidelity simulator indicates promising
results for SKD to measure the safety of autonomous cars. Moreover, the time
taken for each simulation test is under 11 seconds, enabling a sufficient
statistics to compute SKD from simulation to be generated on a quad-core
desktop in less than 25 minutes.
","[{""version"":""v1"",""created"":""Fri, 2 Apr 2021 02:39:53 GMT""}]","2021-04-05"
"2104.00860","Yufei Feng","Yufei Feng, Binbin Hu, Yu Gong, Fei Sun, Qingwen Liu, Wenwu Ou","GRN: Generative Rerank Network for Context-wise Recommendation","Better read with arXiv:2102.12057. arXiv admin note: text overlap
  with arXiv:2102.12057",,,,"cs.IR","http://arxiv.org/licenses/nonexclusive-distrib/1.0/","  Reranking is attracting incremental attention in the recommender systems,
which rearranges the input ranking list into the final rank-ing list to better
meet user demands. Most existing methods greedily rerank candidates through the
rating scores from point-wise or list-wise models. Despite effectiveness,
neglecting the mutual influence between each item and its contexts in the final
ranking list often makes the greedy strategy based reranking methods
sub-optimal. In this work, we propose a new context-wise reranking framework
named Generative Rerank Network (GRN). Specifically, we first design the
evaluator, which applies Bi-LSTM and self-attention mechanism to model the
contextual information in the labeled final ranking list and predict the
interaction probability of each item more precisely. Afterwards, we elaborate
on the generator, equipped with GRU, attention mechanism and pointer network to
select the item from the input ranking list step by step. Finally, we apply
cross-entropy loss to train the evaluator and, subsequently, policy gradient to
optimize the generator under the guidance of the evaluator. Empirical results
show that GRN consistently and significantly outperforms state-of-the-art
point-wise and list-wise methods. Moreover, GRN has achieved a performance
improvement of 5.2% on PV and 6.1% on IPV metric after the successful
deployment in one popular recommendation scenario of Taobao application.
","[{""version"":""v1"",""created"":""Fri, 2 Apr 2021 02:40:23 GMT""},{""version"":""v2"",""created"":""Wed, 7 Apr 2021 01:48:53 GMT""}]","2021-04-08"
