"2104.00993","Giacomo Gradenigo","Giacomo Gradenigo, Matteo Paoluzzi","How non-equilibrium correlations in active matter reveal the topological
  crossover in glasses","8 pages, 1 figure",,"10.1016/j.chaos.2021.111500",,"cond-mat.stat-mech cond-mat.dis-nn cond-mat.soft","http://arxiv.org/licenses/nonexclusive-distrib/1.0/","  As shown by early studies on mean-field models of the glass transition, the
geometrical features of the energy landscape provide fundamental information on
the dynamical transition at the Mode-Coupling temperature $T_d$. We show that
active particles can serve as a useful tool for gaining insight into the
topological crossover in model glass-formers. In such systems the landmark of
the minima-to-saddle transition in the potential energy landscape, taking place
in the proximity of $T_d$, is the critical slowing down of dynamics.
Nevertheless, the critical slowing down is a bottleneck for numerical
simulations and the possibility to take advantage of the new smart algorithms
capable to thermalize down in the glass phase is attractive. Our proposal is to
consider configurations equilibrated below the threshold and study their
dynamics in the presence of a small amount of self-propulsion. As exemplified
here from the study of the p-spin model, the presence of self-propulsion gives
rise to critical off-equilibrium equal-time correlations at the
minima-to-saddles crossover, correlations which are not hindered by the
sluggish glassy dynamics.
","[{""version"":""v1"",""created"":""Fri, 2 Apr 2021 11:35:23 GMT""},{""version"":""v2"",""created"":""Fri, 2 Jul 2021 17:06:17 GMT""}]","2021-11-10"
"2104.00994","Siyuan Feng","Siyuan Feng and Piotr \.Zelasko and Laureano Moro-Vel\'azquez and
  Odette Scharenborg","Unsupervised Acoustic Unit Discovery by Leveraging a
  Language-Independent Subword Discriminative Feature Representation","Accepted for publication in INTERSPEECH 2021",,,,"eess.AS cs.CL cs.SD","http://arxiv.org/licenses/nonexclusive-distrib/1.0/","  This paper tackles automatically discovering phone-like acoustic units (AUD)
from unlabeled speech data. Past studies usually proposed single-step
approaches. We propose a two-stage approach: the first stage learns a
subword-discriminative feature representation and the second stage applies
clustering to the learned representation and obtains phone-like clusters as the
discovered acoustic units. In the first stage, a recently proposed method in
the task of unsupervised subword modeling is improved by replacing a
monolingual out-of-domain (OOD) ASR system with a multilingual one to create a
subword-discriminative representation that is more language-independent. In the
second stage, segment-level k-means is adopted, and two methods to represent
the variable-length speech segments as fixed-dimension feature vectors are
compared. Experiments on a very low-resource Mboshi language corpus show that
our approach outperforms state-of-the-art AUD in both normalized mutual
information (NMI) and F-score. The multilingual ASR improved upon the
monolingual ASR in providing OOD phone labels and in estimating the phone
boundaries. A comparison of our systems with and without knowing the
ground-truth phone boundaries showed a 16% NMI performance gap, suggesting that
the current approach can significantly benefit from improved phone boundary
estimation.
","[{""version"":""v1"",""created"":""Fri, 2 Apr 2021 11:43:07 GMT""},{""version"":""v2"",""created"":""Mon, 7 Jun 2021 11:21:59 GMT""}]","2021-06-08"
"2104.00995","Arkopal Dutt","Arkopal Dutt, Andrey Y. Lokhov, Marc Vuffray, Sidhant Misra","Exponential Reduction in Sample Complexity with Learning of Ising Model
  Dynamics","Accepted to ICML 2021","Proceedings of the 38th International Conference on Machine
  Learning, PMLR 139:2914-2925, 2021",,,"cs.LG cond-mat.stat-mech physics.data-an stat.ML","http://arxiv.org/licenses/nonexclusive-distrib/1.0/","  The usual setting for learning the structure and parameters of a graphical
model assumes the availability of independent samples produced from the
corresponding multivariate probability distribution. However, for many models
the mixing time of the respective Markov chain can be very large and i.i.d.
samples may not be obtained. We study the problem of reconstructing binary
graphical models from correlated samples produced by a dynamical process, which
is natural in many applications. We analyze the sample complexity of two
estimators that are based on the interaction screening objective and the
conditional likelihood loss. We observe that for samples coming from a
dynamical process far from equilibrium, the sample complexity reduces
exponentially compared to a dynamical process that mixes quickly.
","[{""version"":""v1"",""created"":""Fri, 2 Apr 2021 11:44:13 GMT""},{""version"":""v2"",""created"":""Mon, 14 Jun 2021 20:22:33 GMT""}]","2022-10-13"
"2104.00996","Jiaojiao Zhao","Jiaojiao Zhao, Cees G.M. Snoek","LiftPool: Bidirectional ConvNet Pooling","published on ICLR 2021",,,,"cs.CV","http://arxiv.org/licenses/nonexclusive-distrib/1.0/","  Pooling is a critical operation in convolutional neural networks for
increasing receptive fields and improving robustness to input variations. Most
existing pooling operations downsample the feature maps, which is a lossy
process. Moreover, they are not invertible: upsampling a downscaled feature map
can not recover the lost information in the downsampling. By adopting the
philosophy of the classical Lifting Scheme from signal processing, we propose
LiftPool for bidirectional pooling layers, including LiftDownPool and
LiftUpPool. LiftDownPool decomposes a feature map into various downsized
sub-bands, each of which contains information with different frequencies. As
the pooling function in LiftDownPool is perfectly invertible, by performing
LiftDownPool backward, a corresponding up-pooling layer LiftUpPool is able to
generate a refined upsampled feature map using the detail sub-bands, which is
useful for image-to-image translation challenges. Experiments show the proposed
methods achieve better results on image classification and semantic
segmentation, using various backbones. Moreover, LiftDownPool offers better
robustness to input corruptions and perturbations.
","[{""version"":""v1"",""created"":""Fri, 2 Apr 2021 11:46:35 GMT""}]","2021-04-05"
"2104.00997","Landan Zhang","Landan Zhang, Michael K. Pitt and Robert Kohn","Dynamic models using score copula innovations",,,,,"stat.ME","http://creativecommons.org/licenses/by/4.0/","  This paper introduces a new class of observation driven dynamic models. The
time evolving parameters are driven by innovations of copula form. The
resulting models can be made strictly stationary and the innovation term is
typically chosen to be Gaussian. The innovations are formed by applying a
copula approach for the conditional score function which has close connections
the existing literature on GAS models. This new method provides a unified
framework for observation-driven models allowing the likelihood to be
explicitly computed using the prediction decomposition. The approach may be
used for multiple lag structures and for multivariate models. Strict
stationarity can be easily imposed upon the models making the invariant
properties simple to ascertain. This property also has advantages for
specifying the initial conditions needed for maximum likelihood estimation. One
step and multi-period forecasting is straight-forward and the forecasting
density is either in closed form or a simple mixture over a univariate
component. The approach is very general and the illustrations focus on
volatility models and duration models. We illustrate the performance of the
modelling approach for both univariate and multivariate volatility models.
","[{""version"":""v1"",""created"":""Fri, 2 Apr 2021 11:47:24 GMT""}]","2021-04-05"
"2104.00998","Julyan Cartwright","Julyan H. E. Cartwright, Diego L. Gonz\'alez, Oreste Piro","Dynamical systems, celestial mechanics, and music: Pythagoras revisited",,"The Mathematical Intelligencer, 43(1), 25-39, 2021","10.1007/s00283-020-10025-x",,"math.HO nlin.CD physics.hist-ph","http://arxiv.org/licenses/nonexclusive-distrib/1.0/","  Gioseffo Zarlino reintroduced the Pythagorean paradigm into Renaissance
musical theory. In a similar fashion, Nicolaus Copernicus, Galileo Galilei,
Johannes Kepler, and Isaac Newton reinvigorated Pythagorean ideas in celestial
mechanics; Kepler and Newton explicitly invoked musical principles. Today, the
theory of dynamical systems allows us to describe very different applications
of physics, from the orbits of asteroids in the Solar System to the pitch of
complex sounds. Our aim in this text is to review the overarching aims of our
research in this field over the past quarter of a century. We demonstrate with
a combination of dynamical systems theory and music theory the thread running
from Pythagoras to Zarlino that allowed the latter to construct musical scales
using the ideas of proportion known to the former, and we discuss how the
modern theory of dynamical systems, with the study of resonances in nonlinear
systems, returns to Pythagorean ideas of a Musica Universalis.
","[{""version"":""v1"",""created"":""Fri, 2 Apr 2021 11:53:14 GMT""}]","2021-04-05"
"2104.00999","Adolfo del Campo","L\'eonce Dupays, David C. Spierings, Aephraim M. Steinberg, Adolfo del
  Campo","Exact Delta Kick Cooling, Time-Optimal Control of Scale-Invariant
  Dynamics, and Shortcuts to Adiabaticity Assisted by Kicks","14 pages, 11 figures","Phys. Rev. Research 3, 033261 (2021)","10.1103/PhysRevResearch.3.033261",,"quant-ph cond-mat.quant-gas physics.atom-ph","http://arxiv.org/licenses/nonexclusive-distrib/1.0/","  Delta kick cooling (DKC) is used to compress the momentum distribution of
ultracold quantum matter. It combines expansion dynamics with the use of kick
pulses, designed via classical methods, that bring the system to rest. We
introduce an exact approach to DKC for arbitrary scale-invariant dynamics of
quantum gases, lifting the original restrictions to free evolution and
noninteracting systems, to account for the control of atomic clouds in a
time-dependent harmonic trap that can be either repulsive (inverted) or
confining. We show that DKC assisted by a repulsive potential outperforms the
conventional scheme, and that sudden trap-frequency quenches combined with DKC
are equivalent to time-optimal bang-bang protocols. We further show that
reverse engineering of the scale-invariant dynamics under smooth trap-frequency
modulations can be combined with DKC to introduce a new class of shortcuts to
adiabaticity assisted by kicks.
","[{""version"":""v1"",""created"":""Fri, 2 Apr 2021 11:57:08 GMT""}]","2021-09-22"
"2104.01000","Zoe Guan","Zoe Guan","A Proper Scoring Rule for Validation of Competing Risks Models",,,,,"stat.ME","http://creativecommons.org/licenses/by/4.0/","  Scoring rules are used to evaluate the quality of predictions that take the
form of probability distributions. A scoring rule is strictly proper if its
expected value is uniquely minimized by the true probability distribution. One
of the most well-known and widely used strictly proper scoring rules is the
logarithmic scoring rule. We propose a version of the logarithmic scoring rule
for competing risks data and show that it remains strictly proper under
non-informative censoring.
","[{""version"":""v1"",""created"":""Fri, 2 Apr 2021 11:59:14 GMT""}]","2021-04-05"
"2104.01001","Monica Pragliola","Monica Pragliola, Luca Calatroni, Alessandro Lanza, Fiorella Sgallari","Residual whiteness principle for automatic parameter selection in
  $\ell_2$-$\ell_2$ image super-resolution problems",,,,,"math.NA cs.NA","http://arxiv.org/licenses/nonexclusive-distrib/1.0/","  We propose an automatic parameter selection strategy for variational image
super-resolution of blurred and down-sampled images corrupted by additive white
Gaussian noise (AWGN) with unknown standard deviation. By exploiting particular
properties of the operators describing the problem in the frequency domain, our
strategy selects the optimal parameter as the one optimising a suitable
residual whiteness measure. Numerical tests show the effectiveness of the
proposed strategy for generalised $\ell_2$-$\ell_2$ Tikhonov problems.
","[{""version"":""v1"",""created"":""Fri, 2 Apr 2021 12:01:08 GMT""}]","2021-04-05"
"2104.01003","Murat Koksal","M. K\""oksal","Model-independent study on the anomalous $\tau \bar{\tau}\gamma$
  couplings at the ILC","23 pages, 15 figures, 8 tables",,,,"hep-ph","http://creativecommons.org/licenses/by/4.0/","  The potential of the process $\gamma \gamma \rightarrow \tau
\bar{\tau}\gamma$ is examined in a model-independent way using the effective
Lagrangian approach for the ILC which is designed with standard configurations
of 0.25 TeV/2000 fb$^{-1}$, 0.35 TeV/200 fb$^{-1}$ and 0.5 TeV/4000 fb$^{-1}$.
The limits obtained for $\tilde{a}_{\tau}$ and $\tilde{{d}_{\tau}}$ parameters
defining the anomalous $\tau \bar{\tau}\gamma$ couplings at $95\%$ confidence
level and systematic uncertainties of $\delta_{sys}=0,5,10 \%$ are compared
with the experimental results. The best limits obtained without systematic
error on the anomalous couplings are $-0.00082<\tilde{a}_{\tau}<0.00050$ and
$|\tilde{{d}_{\tau}}|<3.5969 \times 10^{-18}$ $e\,cm$, respectively. Thus, our
results show that $\gamma \gamma$ collisions at the ILC lead to a remarkable
improvement in the existing experimental limits on the anomalous magnetic and
electric dipole moments of the tau lepton.
","[{""version"":""v1"",""created"":""Fri, 2 Apr 2021 12:04:43 GMT""}]","2021-04-05"
"2104.01004","J\'er\'emy Ahuir","J\'er\'emy Ahuir, Antoine Strugarek, Allan-Sacha Brun, St\'ephane
  Mathis","Magnetic and tidal migration of close-in planets. Influence of secular
  evolution on their population","28 pages, 24 figures, accepted for publication in A&A","A&A 650, A126 (2021)","10.1051/0004-6361/202040173",,"astro-ph.EP astro-ph.SR","http://creativecommons.org/licenses/by/4.0/","  Over the last two decades, a large population of close-in planets has been
detected around a wide variety of host stars. Such exoplanets are likely to
undergo planetary migration through magnetic and tidal interactions. We aim to
follow the orbital evolution of a planet along the structural and rotational
evolution of its host star by taking into account simultaneously tidal and
magnetic torques, in order to explain some properties of the distribution of
observed close-in planets. We rely on a numerical model of a coplanar circular
star-planet system taking into account stellar structural changes, wind braking
and star-planet interactions, called ESPEM. We browse the parameter space of
star-planet systems' configurations and assess the relative influence of
magnetic and tidal torques on secular evolution. We then synthesize star-planet
populations and confront their distribution in orbital and stellar rotation
periods to Kepler satellite data. First, we find that after the dissipation of
the protoplanetary disk, both types of interactions can dominate secular
evolution depending on the initial configuration of the system and the
evolutionary phase considered. Moreover, different populations of star-planet
systems emerge from the combined action of both kinds of interactions,
according to the evolutionary phase during which the planet migrates
significantly. This may affect significantly the detectability of star-planet
systems as well as the validity of gyrochonology. All in all, star-planet
interactions significantly impact the global distribution in orbital periods
during the main sequence, while the global distribution in stellar rotation
periods is marginally affected. More precisely, star-planet magnetic
interactions significantly affect the distribution of super-Earths around
slowly rotating stars, while tidal effects are found to shape the distribution
of giant planets.
","[{""version"":""v1"",""created"":""Fri, 2 Apr 2021 12:13:52 GMT""},{""version"":""v2"",""created"":""Fri, 16 Apr 2021 08:52:41 GMT""}]","2021-06-23"
"2104.01005","Hwanbeom Cho","Hwanbeom Cho, Stephen J. Blundell, Toni Shiroka, Kylie MacFarquharson,
  Dharmalingam Prabhakaran, and Radu Coldea","Studies on Novel Yb-based Candidate Triangular Quantum Antiferromagnets:
  Ba3YbB3O9 and Ba3YbB9O18","17 pages, 6 figures, 2 tables",,,,"cond-mat.str-el","http://arxiv.org/licenses/nonexclusive-distrib/1.0/","  Yb-based triangular magnets have recently attracted attention as promising
candidates to explore frustrated quantum magnetism. However, some candidates
have turned out to have significant amounts of site disorder, which
significantly affects the low-temperature magnetic behavior. To overcome this
issue, Yb-based frustrated systems without structural disorder are required. In
this paper, we report physical properties of two Yb-based triangular magnets
Ba3YbB3O9 and Ba3YbB9O18, without structural disorder. Via magnetic
susceptibility, magnetization, and muon spin rotation measurements, we verified
that both Ba3YbB3O9 and, particularly studied for the first time, Ba3YbB9O18 do
not show long range magnetic order or glass-like spin freezing down to 0.28 K,
but show typical paramagnetic behavior.
","[{""version"":""v1"",""created"":""Fri, 2 Apr 2021 12:18:56 GMT""}]","2021-04-05"
"2104.01006","Ion Victor Gosea","Ion Victor Gosea, Serkan Gugercin, Christopher Beattie","Data-driven balancing of linear dynamical systems","28 pages, 9 figures",,,,"math.NA cs.NA cs.SY eess.SY","http://arxiv.org/licenses/nonexclusive-distrib/1.0/","  We present a novel reformulation of balanced truncation, a classical model
reduction method. The principal innovation that we introduce comes through the
use of system response data that has been either measured or computed, without
reference to any prescribed realization of the original model. Data are
represented by sampled values of the transfer function {or the impulse
response} corresponding to the original model. We discuss parallels that our
approach bears with the Loewner framework, another popular data-driven model
reduction method. We illustrate our approach numerically in both
continuous-time and discrete-time cases.
","[{""version"":""v1"",""created"":""Fri, 2 Apr 2021 13:15:20 GMT""},{""version"":""v2"",""created"":""Sun, 24 Oct 2021 14:03:58 GMT""}]","2021-10-26"
"2104.01010","Hao Wu","Jingning He and Hao Wu","Global Well-posedness of a Navier-Stokes-Cahn-Hilliard System with
  Chemotaxis and Singular Potential in 2D","revised version, two remarks added",,,,"math.AP","http://arxiv.org/licenses/nonexclusive-distrib/1.0/","  We study a diffuse interface model that describes the dynamics of
incompressible two-phase flows with chemotaxis effects. This model also takes
into account some significant mechanisms such as active transport and nonlocal
interactions of Oono's type. The system under investigation couples the
Navier-Stokes equations for the fluid velocity, a convective Cahn-Hilliard
equation with physically relevant singular potential for the phase-field
variable and an advection-diffusion-reaction equation for the nutrient density.
For the initial boundary value problem in a smooth bounded domain
$\Omega\subset \mathbb{R}^2$, we first prove the existence and uniqueness of
global strong solutions that are strictly separated from the pure states $\pm
1$ over time. Then we prove the continuous dependence with respect to the
initial data and source term for the strong solution in energy norms. Finally,
we show the propagation of regularity for weak solutions.
","[{""version"":""v1"",""created"":""Fri, 2 Apr 2021 12:28:07 GMT""},{""version"":""v2"",""created"":""Sun, 11 Apr 2021 05:57:26 GMT""},{""version"":""v3"",""created"":""Fri, 11 Jun 2021 05:46:21 GMT""}]","2021-06-14"
"2104.01012","Du\v{s}an D. Repov\v{s}","M.K. Hamdani, N.T. Chung, D.D. Repov\v{s}","New class of sixth-order nonhomogeneous $p(x)$-Kirchhoff problems with
  sign-changing weight functions",,"Adv. Nonlinear Anal. 10:2 (2021), 1117-1131","10.1515/anona-2020-0172",,"math.AP","http://arxiv.org/licenses/nonexclusive-distrib/1.0/","  We prove the existence of multiple solutions for the following sixth-order
$p(x)$-Kirchhoff-type problem: $-M(\int_\Omega \frac{1}{p(x)}|\nabla \Delta
u|^{p(x)}dx)\Delta^3_{p(x)} u = \lambda f(x)|u|^{q(x)-2}u + g(x)|u|^{r(x)-2}u +
h(x) \ \ \mbox{on} \ \Omega$ and $ \ u=\Delta u=\Delta^2 u=0 \ \ \mbox{on} \
\partial\Omega,$ where $\Omega \subset \mathbb{R}^N$ is a smooth bounded
domain, $N > 3$, $\Delta_{p(x)}^3u = \operatorname{div}\Big(\Delta(|\nabla
\Delta u|^{p(x)-2}\nabla \Delta u)\Big)$ is the $p(x)$-triharmonic operator,
$p,q,r \in C(\overline\Omega)$, $1< p(x) < \frac N3$ for all $x\in
\overline\Omega$, $M(s) = a - bs^\gamma$, $a,b,\gamma>0$, $\lambda>0$, $g:
\Omega \times \mathbb{R} \to \mathbb{R}$ is a nonnegative continuous function
while $f,h : \Omega \times \mathbb{R} \to \mathbb{R}$ are sign-changing
continuous functions in $\Omega$. To the best of our knowledge, this paper is
one of the first contributions to the study of the sixth-order $p(x)$-Kirchhoff
type problems with sign changing Kirchhoff functions.
","[{""version"":""v1"",""created"":""Fri, 2 Apr 2021 12:29:22 GMT""}]","2021-04-05"
"2104.01015","Yaomin Dai","Xiaoxiang Zhou and Yongkai Li and Xinwei Fan and Jiahao Hao and Yaomin
  Dai and Zhiwei Wang and Yugui Yao and Hai-Hu Wen","Origin of the Charge Density Wave in the Kagome Metal CsV$_{3}$Sb$_{5}$
  as Revealed by Optical Spectroscopy","6 pages, 2 figures. Comments are welcome and appreciated","Phys. Rev. B 104, 041101 (2021)","10.1103/PhysRevB.104.L041101",,"cond-mat.supr-con cond-mat.str-el","http://arxiv.org/licenses/nonexclusive-distrib/1.0/","  We report on a detailed study of the optical properties of CsV$_{3}$Sb$_{5}$
at a large number of temperatures above and below the charge-density-wave (CDW)
transition. Above the CDW transition, the low-frequency optical conductivity
reveals two Drude components with distinct widths. An examination of the band
structure allows us to ascribe the narrow Drude to multiple light and Dirac
bands, and the broad Drude to the heavy bands near the $M$ points which form
saddle points near the Fermi level. Upon entering the CDW state, the opening of
the CDW gap is clearly observed. A large portion of the broad Drude is removed
by the gap, whereas the narrow Drude is not affected. Meanwhile, an absorption
peak associated with interband transitions near the saddle points shifts to
higher energy and grows in weight. These observations are consistent with the
scenario that the CDW in CsV$_{3}$Sb$_{5}$ is driven by nesting of Fermi
surfaces near the saddle points at $M$.
","[{""version"":""v1"",""created"":""Fri, 2 Apr 2021 12:35:14 GMT""},{""version"":""v2"",""created"":""Thu, 8 Jul 2021 06:15:19 GMT""}]","2021-07-14"
"2104.01017","Strohmaier Alexander","Yan-Long Fang and Alexander Strohmaier","Trace singularities in obstacle scattering and the Poisson relation for
  the relative trace","19 pages, 1 figure, second revised version",,,,"math.SP math-ph math.AP math.MP","http://arxiv.org/licenses/nonexclusive-distrib/1.0/","  We consider the case of scattering of several obstacles in $\mathbb{R}^d$ for
$d \geq 2$ for the Laplace operator $\Delta$ with Dirichlet boundary conditions
imposed on the obstacles. In the case of two obstacles, we have the Laplace
operators $\Delta_1$ and $\Delta_2$ obtained by imposing Dirichlet boundary
conditions only on one of the objects. The relative trace operator $g(\Delta) -
g(\Delta_1) - g(\Delta_2) + g(\Delta_0)$ was introduced in [18] and shown to be
trace-class for a large class of functions $g$, including certrain functions of
polynomial growth. When $g$ is sufficiently regular at zero and fast decaying
at infinity then, by the Birman-Krein formula, this trace can be computed from
the relative spectral shift function $\xi_{rel}(\lambda) = -\frac{1}{\pi}
\Im(\Xi(\lambda))$, where $\Xi(\lambda)$ is holomorphic in the upper half-plane
and fast decaying. In this paper we study the wave-trace contributions to the
singularities of the Fourier transform of $\xi_{rel}$. In particular we prove
that $\hat\xi_{rel}$ is real-analytic near zero and we relate the decay of
$\Xi(\lambda)$ along the imaginary axis to the first wave-trace invariant of
the shortest bounding ball orbit between the obstacles. The function
$\Xi(\lambda)$ is important in physics as it determines the Casimir
interactions between the objects.
","[{""version"":""v1"",""created"":""Fri, 2 Apr 2021 12:38:24 GMT""},{""version"":""v2"",""created"":""Sat, 31 Jul 2021 16:07:43 GMT""},{""version"":""v3"",""created"":""Wed, 27 Oct 2021 22:20:14 GMT""}]","2021-10-29"
