"2104.00713","Shi Cheng","Shi Cheng, Piotr Su{\l}kowski","Refined open topological strings revisited","57 pages, 30 figures",,"10.1103/PhysRevD.104.106012","Phys. Rev. D 104, 106012 (2021)","hep-th","http://creativecommons.org/licenses/by/4.0/","  In this work we verify consistency of refined topological string theory from
several perspectives. First, we advance the method of computing refined open
amplitudes by means of geometric transitions. Based on such computations we
show that refined open BPS invariants are non-negative integers for a large
class of toric Calabi-Yau threefolds: an infinite class of strip geometries,
closed topological vertex geometry, and some threefolds with compact
four-cycles. Furthermore, for an infinite class of toric geometries without
compact four-cycles we show that refined open string amplitudes take form of
quiver generating series. This generalizes the relation to quivers found
earlier in the unrefined case, implies that refined open BPS states are made of
a finite number of elementary BPS states, and asserts that all refined open BPS
invariants associated to a given brane are non-negative integers in consequence
of their relation to (integer and non-negative) motivic Donaldson-Thomas
invariants. Non-negativity of motivic Donaldson-Thomas invariants of a
symmetric quiver is therefore crucial in the context of refined open
topological strings. Furthermore, reinterpreting these results in terms of webs
of five-branes, we analyze Hanany-Witten transitions in novel configurations
involving lagrangian branes.
","[{""version"":""v1"",""created"":""Thu, 1 Apr 2021 18:37:50 GMT""}]","2021-12-01"
"2104.00714","Farruh Atamurotov","Gulmina Zaman Babar, Farruh Atamurotov, Shafqat Ul Islam, Sushant G.
  Ghosh","Particle acceleration around rotating Einstein-Born-Infeld black hole
  and plasma effect on gravitational lensing","22 pages, 14 figures","Phys. Rev. D 103, 084057 (2021)","10.1103/PhysRevD.103.084057",,"gr-qc","http://arxiv.org/licenses/nonexclusive-distrib/1.0/","  We consider a time-like geodesics in the background of rotating
Einstein-Born-Infeld (EBI) black hole to examine the horizon and ergosphere
structure. The effective potential that governs the particle's motion in the
spacetime and the innermost stable circular orbits (ISCO) is also studied. A
qualitative analysis is conducted to find the redshifted ultrahigh
centre-of-mass (CM) energy as a result of a two-particle collision specifically
near the horizon. The recent Event Horizon Telescope (EHT) triggered a surge of
interest in strong gravitational lensing by black holes, which provide a new
tool comparing the black hole lensing in general relativity and alternate
gravity theories. Motivated by this, we also discussed both strong and
weak-field gravitational lensing in the space-time discretely for a uniform
plasma and a singular isothermal sphere. We calculated the light deflection
coefficients $\bar{a}$ and $\bar{b}$ in the strong field limits, and their
variance with the rotational parameter $a$ for different plasma frequency as
well as in vacuum. For EBI black holes, we found that plasma's presence
increases the photon sphere radius, the deflection angle, the deflection
coefficients $\bar{a}$, $\bar{b}$, the angular positions and the angular
separation between the relativistic images. It is also shown that with
increasing spin the impact of plasma on a strong gravitational lensing becomes
smaller as the spin parameter grows in the prograde orbit ($a>0$). For extreme
black holes, the strong gravitational effects in the homogenous plasma are
similar to those of in a vacuum. We investigate strong gravitational lensing
effects by supermassive black holes Sgr A* and M87*...
","[{""version"":""v1"",""created"":""Thu, 1 Apr 2021 18:46:21 GMT""},{""version"":""v2"",""created"":""Mon, 2 Aug 2021 14:47:45 GMT""}]","2021-08-11"
"2104.00715","Dane Miyata","Jacob P. Matherne, Dane Miyata, Nicholas Proudfoot, Eric Ramos","Equivariant log concavity and representation stability",,,,,"math.CO math.RT","http://arxiv.org/licenses/nonexclusive-distrib/1.0/","  We expand upon the notion of equivariant log concavity, and make equivariant
log concavity conjectures for Orlik--Solomon algebras of matroids, Cordovil
algebras of oriented matroids, and Orlik--Terao algebras of hyperplane
arrangements. In the case of the Coxeter arrangement for the Lie algebra
$\mathfrak{sl}_n$, we exploit the theory of representation stability to give
computer assisted proofs of these conjectures in low degree.
","[{""version"":""v1"",""created"":""Thu, 1 Apr 2021 18:47:38 GMT""},{""version"":""v2"",""created"":""Fri, 29 Oct 2021 04:32:23 GMT""}]","2021-11-01"
"2104.00716","Carl Johan Casselgren","Carl Johan Casselgren, Per Johansson, Klas Markstr\""om","Avoiding and extending partial edge colorings of hypercubes",,,,,"math.CO","http://arxiv.org/licenses/nonexclusive-distrib/1.0/","  We consider the problem of extending and avoiding partial edge colorings of
hypercubes; that is, given a partial edge coloring $\varphi$ of the
$d$-dimensional hypercube $Q_d$, we are interested in whether there is a proper
$d$-edge coloring of $Q_d$ that agrees with the coloring $\varphi$ on every
edge that is colored under $\varphi$; or, similarly, if there is a proper
$d$-edge coloring that disagrees with $\varphi$ on every edge that is colored
under $\varphi$. In particular, we prove that for any $d\geq 1$, if $\varphi$
is a partial $d$-edge coloring of $Q_d$, then $\varphi$ is avoidable if every
color appears on at most $d/8$ edges and the coloring satisfies a relatively
mild structural condition, or $\varphi$ is proper and every color appears on at
most $d-2$ edges. We also show that the same conclusion holds if $d$ is
divisible by $3$ and every color class of $\varphi$ is an induced matching.
Moreover, for all $1 \leq k \leq d$, we characterize for which configurations
consisting of a partial coloring $\varphi$ of $d-k$ edges and a partial
coloring $\psi$ of $k$ edges, there is an extension of $\varphi$ that avoids
$\psi$.
","[{""version"":""v1"",""created"":""Thu, 1 Apr 2021 18:50:30 GMT""}]","2021-04-05"
"2104.00717","Yoonjae Lee","Yoonjae Lee, Efstathios Bakolas","Optimal Strategies for Guarding a Compact and Convex Target Set: A
  Differential Game Approach",,,"10.1109/CDC45484.2021.9683090",,"eess.SY cs.SY","http://arxiv.org/licenses/nonexclusive-distrib/1.0/","  We revisit the two-player planar target-defense game initially posed by
Isaacs where a pursuer (or defender) attempts to guard a target set from an
attack by an evader (or attacker). This paper builds on existing analytical
solutions to games of defending a simple shape of target area to develop a
generalized and extended solution to the same game with a compact convex target
set with smooth boundary. Isaacs' method is applied to address the game of kind
and games of degree. A geometric solution approach is used to find the barrier
surface that demarcates the winning sets of the players. A value function
coupled with a set of optimal state feedback strategies in each winning set is
derived and proven to correspond to the saddle point solution of the game. The
proposed solutions are illustrated by means of numerical simulations.
","[{""version"":""v1"",""created"":""Thu, 1 Apr 2021 18:52:16 GMT""},{""version"":""v2"",""created"":""Thu, 16 Sep 2021 02:06:08 GMT""}]","2022-04-04"
"2104.00718","Tom Edinburgh","Tom Edinburgh and Stephen J. Eglen and Ari Ercole","Causality indices for bivariate time series data: a comparative review
  of performance","AAM, accepted for publication in AIP Chaos on 01/06/2021 (DOI not yet
  available). 19 pages, 8 figures, 5 tables (including supplementary
  materials): updated with CODECHECK",,"10.1063/5.0053519",,"stat.ME math.DS","http://creativecommons.org/licenses/by/4.0/","  Inferring nonlinear and asymmetric causal relationships between multivariate
longitudinal data is a challenging task with wide-ranging application areas
including clinical medicine, mathematical biology, economics and environmental
research. A number of methods for inferring causal relationships within complex
dynamic and stochastic systems have been proposed but there is not a unified
consistent definition of causality in this context. We evaluate the performance
of ten prominent bivariate causality indices for time series data, across four
simulated model systems that have different coupling schemes and
characteristics. In further experiments, we show that these methods may not
always be invariant to real-world relevant transformations (data availability,
standardisation and scaling, rounding error, missing data and noisy data). We
recommend transfer entropy and nonlinear Granger causality as likely to be
particularly robust indices for estimating bivariate causal relationships in
real-world applications. Finally, we provide flexible open-access Python code
for computation of these methods and for the model simulations.
","[{""version"":""v1"",""created"":""Thu, 1 Apr 2021 18:53:48 GMT""},{""version"":""v2"",""created"":""Mon, 10 May 2021 15:22:05 GMT""},{""version"":""v3"",""created"":""Wed, 7 Jul 2021 15:06:02 GMT""},{""version"":""v4"",""created"":""Wed, 14 Jul 2021 17:51:38 GMT""}]","2021-08-25"
"2104.00719","Tien Cuong Nguyen","Nguyen Tien Cuong","First-principles study on controlling energy gap of graphene using
  hybrid armchair-zigzag nanostructures","9 pages, 8 figures",,,,"cond-mat.mtrl-sci","http://creativecommons.org/licenses/by/4.0/","  The electronic and transport properties of hybrid armchair zigzag
nanostructures including U-shaped graphene nanoribbons and patterned nanopores
structured graphene were studied using combination of density functional theory
and non-equilibrium Green function method. The density of state, electron
transmission spectra, and molecular orbitals were analyzed. The obtained
results show that GNRs junctions tend to open an energy gap when U-shaped
structures were formed due to the formation of quasi-bound states at zigzag
edges. The size of U shaped structures has enormous influences on the electron
transport of the system. We also considered the effect of corner form of the
U-shaped GNRs junctions on energy gap opening. It was found that as some carbon
atoms are add to the inner corner, the energy gap in U shaped GNRs
significantly changed. For patterned nanopores structured graphene, the
calculated results show that patterned nanopores enormous influence on
electronic and the transport properties though the GNRs junctions, depending on
the shape, size, and the number of nanopores. The study suggests that designed
tailored graphene systems based on hybrid armchair zigzag nanostructures can be
used to control the energy gap of graphene.
","[{""version"":""v1"",""created"":""Thu, 1 Apr 2021 18:56:39 GMT""}]","2021-04-05"
"2104.00720","Mason A. Porter","Michelle Feng, Abigail Hickok, and Mason A. Porter","Topological Data Analysis of Spatial Systems","draft of book chapter",,,,"cs.SI cs.CG math.AT nlin.AO physics.soc-ph","http://arxiv.org/licenses/nonexclusive-distrib/1.0/","  In this chapter, we discuss applications of topological data analysis (TDA)
to spatial systems. We briefly review the recently proposed level-set
construction of filtered simplicial complexes, and we then examine persistent
homology in two cases studies: street networks in Shanghai and hotspots of
COVID-19 infections. We then summarize our results and provide an outlook on
TDA in spatial systems.
","[{""version"":""v1"",""created"":""Thu, 1 Apr 2021 18:58:18 GMT""}]","2021-04-06"
"2104.00721","Zaharah A. Bukhsh","Zaharah A. Bukhsh, Aaqib Saeed, Remco M. Dijkman","ProcessTransformer: Predictive Business Process Monitoring with
  Transformer Network",,,,,"cs.LG cs.AI","http://creativecommons.org/licenses/by-nc-nd/4.0/","  Predictive business process monitoring focuses on predicting future
characteristics of a running process using event logs. The foresight into
process execution promises great potentials for efficient operations, better
resource management, and effective customer services. Deep learning-based
approaches have been widely adopted in process mining to address the
limitations of classical algorithms for solving multiple problems, especially
the next event and remaining-time prediction tasks. Nevertheless, designing a
deep neural architecture that performs competitively across various tasks is
challenging as existing methods fail to capture long-range dependencies in the
input sequences and perform poorly for lengthy process traces. In this paper,
we propose ProcessTransformer, an approach for learning high-level
representations from event logs with an attention-based network. Our model
incorporates long-range memory and relies on a self-attention mechanism to
establish dependencies between a multitude of event sequences and corresponding
outputs. We evaluate the applicability of our technique on nine real event
logs. We demonstrate that the transformer-based model outperforms several
baselines of prior techniques by obtaining on average above 80% accuracy for
the task of predicting the next activity. Our method also perform
competitively, compared to baselines, for the tasks of predicting event time
and remaining time of a running case
","[{""version"":""v1"",""created"":""Thu, 1 Apr 2021 18:58:46 GMT""}]","2021-04-05"
"2104.00722","Avoy Datta","Heejung W. Chung, Avoy Datta, Chris Waites","GABO: Graph Augmentations with Bi-level Optimization",,,,,"cs.LG cs.AI","http://creativecommons.org/licenses/by-nc-nd/4.0/","  Data augmentation refers to a wide range of techniques for improving model
generalization by augmenting training examples. Oftentimes such methods require
domain knowledge about the dataset at hand, spawning a plethora of recent
literature surrounding automated techniques for data augmentation. In this work
we apply one such method, bilevel optimization, to tackle the problem of graph
classification on the ogbg-molhiv dataset. Our best performing augmentation
achieved a test ROCAUC score of 77.77 % with a GIN+virtual classifier, which
makes it the most effective augmenter for this classifier on the leaderboard.
This framework combines a GIN layer augmentation generator with a bias
transformation and outperforms the same classifier augmented using the
state-of-the-art FLAG augmentation.
","[{""version"":""v1"",""created"":""Thu, 1 Apr 2021 19:00:17 GMT""}]","2021-04-05"
"2104.00723","Damon Carrad","Lukas Stampfer, Damon J. Carrad, Dags Olsteins, Christian E. N.
  Petersen, Sabbir A. Khan, Peter Krogstrup, Thomas S. Jespersen","Andreev interference in the surface accumulation layer of half-shell
  InAsSb/Al hybrid nanowires",,,,"NBI QDEV 2021","cond-mat.mes-hall","http://creativecommons.org/licenses/by/4.0/","  Understanding the spatial distribution of charge carriers in III-V nanowires
proximity coupled to superconductors is important for the design and
interpretation of experiments based on hybrid quantum devices. In this letter,
the gate-dependent surface accumulation layer of InAsSb/Al nanowires was
studied by means of Andreev interference in a parallel magnetic field. Both
uniform hybrid nanowires and devices featuring a short Josephson junction
fabricated by shadow lithography, exhibited periodic modulation of the
switching current. The period corresponds to a flux quantum through the
nanowire diameter and is consistent with Andreev bound states occupying a
cylindrical surface accumulation layer. The spatial distribution was tunable by
a gate potential as expected from electrostatic models.
","[{""version"":""v1"",""created"":""Thu, 1 Apr 2021 19:01:05 GMT""}]","2021-04-05"
"2104.00724","Reuben Wang","Reuben R.W. Wang and John L. Bohn","Anisotropic thermalization of dilute dipolar gases","11 pages, 9 figures","Phys. Rev. A 103, 063320 (2021)","10.1103/PhysRevA.103.063320",,"physics.atom-ph","http://creativecommons.org/licenses/by/4.0/","  We study collisional rethermalization in ultracold dipolar thermal gases,
made intricate by their anisotropic differential cross sections. Theoretical
methods are provided to derive the number of collisions per rethermalization,
which for dipolar gases, is highly dependent on the dipole alignment axis.
These methods are formulated to be easily applied in experimental contexts,
even reducing to analytic expressions if the route to thermal equilibrium is
governed by short-time dynamics. In the analytic case, collisional
rethermalization is fully characterized by the dipole magnitude and
orientation, scattering length, and thermalization geometry. These models
compare favorably to Monte Carlo simulations, and are shown to model well a
recent experimental result on the rethermalization of polar molecular samples.
","[{""version"":""v1"",""created"":""Thu, 1 Apr 2021 19:02:11 GMT""}]","2021-06-30"
"2104.00725","Mehran Meidani","Mehran Meidani, Maxime Lamothe, Shane McIntosh (University of
  Waterloo)","Assessing the Exposure of Software Changes: The DiPiDi Approach",,,,,"cs.SE","http://arxiv.org/licenses/nonexclusive-distrib/1.0/","  Context: Changing a software application with many build-time configuration
settings may introduce unexpected side-effects. For example, a change intended
to be specific to a platform (e.g., Windows) or product configuration (e.g.,
community editions) might impact other platforms or configurations. Moreover, a
change intended to apply to a set of platforms or configurations may be
unintentionally limited to a subset. Indeed, understanding the exposure of
source code changes is an important risk mitigation step in change-based
development approaches. Objective: In this experiment, we seek to evaluate
DiPiDi, a prototype implementation of our approach to assess the exposure of
source code changes by statically analyzing build specifications. We focus our
evaluation on the effectiveness and efficiency of developers when assessing the
exposure of source code changes. Method: We will measure the effectiveness and
efficiency of developers when performing five tasks in which they must identify
the deliverable(s) and conditions under which a change will propagate. We will
assign participants into three groups: without explicit tool support, supported
by existing impact analysis tools, and supported by DiPiDi.
","[{""version"":""v1"",""created"":""Thu, 1 Apr 2021 19:04:01 GMT""}]","2021-04-05"
"2104.00726","Marc Stephan","Srikanth B. Iyengar, Henrik R\""uping, and Marc Stephan","Automorphisms of the Koszul homology of a local ring","21 pages; minor revision. To appear in the Journal of Commutative
  Algebra",,,,"math.AC math.AT","http://arxiv.org/licenses/nonexclusive-distrib/1.0/","  This work concerns the Koszul complex $K$ of a commutative noetherian local
ring $R$, with its natural structure as differential graded $R$-algebra. It is
proved that under diverse conditions, involving the multiplicative structure of
$H(K)$, any dg $R$-algebra automorphism of $K$ induces the identity map on
$H(K)$. In such cases, it is possible to define an action of the automorphism
group of $R$ on $H(K)$. On the other hand, numerous rings are described for
which $K$ has automorphisms that do not induce the identity on $H(K)$. For any
$R$, it is shown that the group of automorphisms of $H(K)$ induced by
automorphisms of $K$ is abelian.
","[{""version"":""v1"",""created"":""Thu, 1 Apr 2021 19:04:33 GMT""},{""version"":""v2"",""created"":""Mon, 30 May 2022 20:17:29 GMT""}]","2022-06-01"
"2104.00727","Alejandro P. Riascos","Fernanda H. Gonz\'alez, Alejandro P. Riascos, Denis Boyer","Diffusive transport on networks with stochastic resetting to multiple
  nodes","17 pages, 6 figures","Phys. Rev. E 103, 062126 (2021)","10.1103/PhysRevE.103.062126",,"cond-mat.stat-mech","http://arxiv.org/licenses/nonexclusive-distrib/1.0/","  We study the diffusive transport of Markovian random walks on arbitrary
networks with stochastic resetting to multiple nodes. We deduce analytical
expressions for the stationary occupation probability and for the mean and
global first passage times. This general approach allows us to characterize the
effect of resetting on the capacity of random walk strategies to reach a
particular target or to explore the network. Our formalism holds for ergodic
random walks and can be implemented from the spectral properties of the random
walk without resetting, providing a tool to analyze the efficiency of search
strategies with resetting to multiple nodes. We apply the methods developed
here to the dynamics with two reset nodes and derive analytical results for
normal random walks and L\'evy flights on rings. We also explore the effect of
resetting to multiple nodes on a comb graph, L\'evy flights that visit specific
locations in a continuous space, and the Google random walk strategy on regular
networks.
","[{""version"":""v1"",""created"":""Thu, 1 Apr 2021 19:05:13 GMT""},{""version"":""v2"",""created"":""Tue, 15 Jun 2021 15:38:04 GMT""}]","2021-06-16"
"2104.00728","Efekan K\""okc\""u","Efekan K\""okc\""u, Thomas Steckmann, Yan Wang, J. K. Freericks, Eugene
  F. Dumitrescu, Alexander F. Kemper","Fixed Depth Hamiltonian Simulation via Cartan Decomposition",,,"10.1103/PhysRevLett.129.070501",,"quant-ph cond-mat.str-el","http://arxiv.org/licenses/nonexclusive-distrib/1.0/","  Simulating quantum dynamics on classical computers is challenging for large
systems due to the significant memory requirements. Simulation on quantum
computers is a promising alternative, but fully optimizing quantum circuits to
minimize limited quantum resources remains an open problem. We tackle this
problem presenting a constructive algorithm, based on Cartan decomposition of
the Lie algebra generated by the Hamiltonian, that generates quantum circuits
with time-independent depth. We highlight our algorithm for special classes of
models, including Anderson localization in one dimensional transverse field XY
model, where a O(n^2)-gate circuits naturally emerge. Compared to product
formulas with significantly larger gate counts, our algorithm drastically
improves simulation precision. In addition to providing exact circuits for a
broad set of spin and fermionic models, our algorithm provides broad analytic
and numerical insight into optimal Hamiltonian simulations.
","[{""version"":""v1"",""created"":""Thu, 1 Apr 2021 19:06:00 GMT""},{""version"":""v2"",""created"":""Tue, 13 Apr 2021 16:34:25 GMT""},{""version"":""v3"",""created"":""Mon, 3 May 2021 22:15:28 GMT""},{""version"":""v4"",""created"":""Wed, 29 Jun 2022 19:20:03 GMT""}]","2022-08-31"
"2104.00729","Kelvin Chow","Kelvin Chow, Genevieve Hayes, Jacqueline A Flewitt, Patricia Feuchter,
  Carmen Lydell, Andrew Howarth, Joseph J Pagano, Richard B Thompson, Peter
  Kellman, James A White","Improved Accuracy and Precision In Simultaneous Myocardial T1 and T2
  mapping with Multi-Parametric SASHA (mSASHA)","27 pages, 5 figures, submitted to Magnetic Resonance in Medicine",,,,"physics.med-ph","http://arxiv.org/licenses/nonexclusive-distrib/1.0/","  Purpose: To develop and validate a multi-parametric SAturation-recovery
single-SHot Acquisition (mSASHA) cardiac T1 and T2 mapping technique with high
accuracy and precision in a single breath-hold.
  Methods: The mSASHA acquisition consists of 9 images in an 11 heartbeat
breath-hold -- the first without preparation, 6 images with saturation recovery
preparation, and 2 images with both saturation recovery and T2-preparation. T1
and T2 values were calculated using a 3-parameter model. mSASHA was validated
in simulations and phantoms on a Siemens 3T Prisma scanner with comparison to a
joint T1-T2 technique with a 4-parameter model. mSASHA values were compared to
reference MOLLI, SASHA and T2p-bSSFP sequences in 10 healthy volunteers.
  Results: mSASHA had high accuracy compared to reference spin-echo
measurements, with an average of -0.7+/-0.4% T1 error and -1.3+/-1.3% T2 error.
mSASHA coefficient of variation (CoV) in phantoms for T1 was lower than MOLLI
(0.7+/-0.1% vs 0.9+/-0.2%, p<0.01) and similar to reference T2p-bSSFP for T2
(1.4+/-0.6% vs 1.5+/-0.5%, p>0.05). In simulations, 3-parameter mSASHA fitting
had higher precision than 4-parameter joint T1-T2 fitting for both T1 and T2.
In-vivo myocardial mSASHA T1 was similar to conventional SASHA (1523+/-18 ms vs
1520+/-18 ms, p>0.05) with similar CoV to both MOLLI and SASHA (3.3+/-0.6% vs
3.1+/-0.6% and 3.3+/-0.5% respectively, p>0.05 for both). Myocardial mSASHA T2
values were 37.1+/-1.1 ms with similar precision to T2p-bSSFP (6.7+/-1.7% vs
6.0+/-1.6%, p>0.05).
  Conclusion: mSASHA provides high accuracy cardiac T1 and T2 quantification in
a single breath-hold, with similar precision to reference MOLLI and linear
T2p-bSSFP reference techniques.
","[{""version"":""v1"",""created"":""Thu, 1 Apr 2021 19:06:18 GMT""}]","2021-04-05"
