"2103.10978","Akash Sengupta","Akash Sengupta, Ignas Budvytis, Roberto Cipolla","Probabilistic 3D Human Shape and Pose Estimation from Multiple
  Unconstrained Images in the Wild","Accepted at CVPR 2021, 16 pages, 8 figures",,,,"cs.CV","http://arxiv.org/licenses/nonexclusive-distrib/1.0/","  This paper addresses the problem of 3D human body shape and pose estimation
from RGB images. Recent progress in this field has focused on single images,
video or multi-view images as inputs. In contrast, we propose a new task: shape
and pose estimation from a group of multiple images of a human subject, without
constraints on subject pose, camera viewpoint or background conditions between
images in the group. Our solution to this task predicts distributions over SMPL
body shape and pose parameters conditioned on the input images in the group. We
probabilistically combine predicted body shape distributions from each image to
obtain a final multi-image shape prediction. We show that the additional body
shape information present in multi-image input groups improves 3D human shape
estimation metrics compared to single-image inputs on the SSP-3D dataset and a
private dataset of tape-measured humans. In addition, predicting distributions
over 3D bodies allows us to quantify pose prediction uncertainty, which is
useful when faced with challenging input images with significant occlusion. Our
method demonstrates meaningful pose uncertainty on the 3DPW dataset and is
competitive with the state-of-the-art in terms of pose estimation metrics.
","[{""version"":""v1"",""created"":""Fri, 19 Mar 2021 18:32:16 GMT""},{""version"":""v2"",""created"":""Tue, 30 Mar 2021 15:17:30 GMT""}]","2021-03-31"
"2103.10979","Julie Jiang","Julie Jiang, Xiang Ren, Emilio Ferrara","Social Media Polarization and Echo Chambers in the Context of COVID-19:
  Case Study","Published in JMIRx Med 2 (3), e29570, 2021","JMIRx Med 2021;2(3):e29570","10.2196/29570",,"cs.SI","http://creativecommons.org/licenses/by/4.0/","  Background: Social media chatter in 2020 has been largely dominated by the
COVID-19 pandemic. Existing research shows that COVID-19 discourse is highly
politicized, with political preferences linked to beliefs and disbeliefs about
the virus. As it happens with topics that become politicized, people may fall
into echo chambers, which is the idea that one is only presented with
information they already agree with, thereby reinforcing one's confirmation
bias. Understanding the relationship between information dissemination and
political preference is crucial for effective public health communication.
  Objective: We aimed to study the extent of polarization and examine the
structure of echo chambers related to COVID-19 discourse on Twitter in the
United States.
  Methods: First, we presented Retweet-BERT, a scalable and highly accurate
model for estimating user polarity by leveraging language features and network
structures. Then, by analyzing the user polarity predicted by Retweet-BERT, we
provided new insights into the characterization of partisan users.
  Results: We observed that right-leaning users were noticeably more vocal and
active in the production and consumption of COVID-19 information. We also found
that most of the highly influential users were partisan, which may contribute
to further polarization. Importantly, while echo chambers exist in both the
right- and left-leaning communities, the right-leaning community was by far
more densely connected within their echo chamber and isolated from the rest.
  Conclusions: We provided empirical evidence that political echo chambers are
prevalent, especially in the right-leaning community, which can exacerbate the
exposure to information in line with pre-existing users' views. Our findings
have broader implications in developing effective public health campaigns and
promoting the circulation of factual information online.
","[{""version"":""v1"",""created"":""Fri, 19 Mar 2021 18:34:57 GMT""},{""version"":""v2"",""created"":""Tue, 10 Aug 2021 18:21:26 GMT""}]","2021-09-01"
"2103.10980","Atanu Mondal","A. Deb Ray and Atanu Mondal","Real compactness via real maximal ideals of $B_1(X)$",,,,,"math.GN","http://creativecommons.org/publicdomain/zero/1.0/","  In this paper, constructing a class of ideals of $B_1(X)$ from proper ideals
of $C(X)$ a formula for real maximal ideals of $C(X)$ is established and
utilizing these ideals of $B_1(X)$, closed maximal ideals in $B_1(X)$ are
introduced. It is observed that the real maximal ideals of $B_1(X)$ is that
subfamily of closed maximal ideals whose contraction in $C(X)$ is contained in
a real maximal ideal of $C(X)$. A one-one correspondence between the class of
real maximal ideals of $C(X)$ and those of $B_1(X)$ is proved. Also, it is
observed that an injective map from the class of hyper-real maximal ideals of
$C(X)$ into the class of hyper-real maximal ideals of $B_1(X)$ exists. These
observations finally lead to the conclusion that within the class of
non-discrete perfectly normal $T_1$ spaces, cardinality of the collection
$\MMM(C(X))$, of all maximal ideals of $C(X)$, is strictly less than the
cardinality of the collection $\MMM(B_1(X))$, of all maximal ideals of
$B_1(X)$. Finally, it is proved that Tychonoff space is real compact if and
only if every real maximal ideal of $B_1(X)$ is fixed. As a consequence, within
the class of perfectly normal $T_1$ real compact spaces $B_1(X) = {B_1}^*(X)$
if and only if $X$ is finite.
","[{""version"":""v1"",""created"":""Fri, 19 Mar 2021 18:36:37 GMT""}]","2021-03-23"
"2103.10981","Shiang Yi Han","C. D. Yang, S. Y. Han","Invariant Eigen-Structure in Complex-Valued Quantum Mechanics",,"International Journal of Nonlinear Sciences and Numerical
  Simulation, 10(4), 407-423 (2009)","10.1515/IJNSNS.2009.10.4.407",,"quant-ph","http://creativecommons.org/licenses/by/4.0/","  The complex-valued quantum mechanics considers quantum motion on the complex
plane instead of on the real axis, and studies the variations of a particle
complex position, momentum and energy along a complex trajectory. On the basis
of quantum Hamilton-Jacobi formalism in the complex space, we point out that
having complex-valued motion is a universal property of quantum systems,
because every quantum system is actually accompanied with an intrinsic complex
Hamiltonian originating from the equation. It is revealed that the conventional
real-valued quantum mechanics is a special case of the complex-valued quantum
mechanics in that the eigen-structures of real and complex quantum systems,
such as their eigenvalues, eigenfunctions and eigen-trajectories, are invariant
under linear complex mapping. In other words, there is indeed no distinction
between Hermitian systems, PT-symmetric systems, and non PT-symmetric systems
when viewed from a complex domain. Their eigen-structures can be made
coincident through linear transformation of complex coordinates.
","[{""version"":""v1"",""created"":""Fri, 19 Mar 2021 18:37:39 GMT""}]","2021-03-23"
"2103.10982","Inchang Choi","Yitong Jiang, Inchang Choi, Jun Jiang, Jinwei Gu","HDR Video Reconstruction with Tri-Exposure Quad-Bayer Sensors",,,,,"eess.IV cs.CV","http://arxiv.org/licenses/nonexclusive-distrib/1.0/","  We propose a novel high dynamic range (HDR) video reconstruction method with
new tri-exposure quad-bayer sensors. Thanks to the larger number of exposure
sets and their spatially uniform deployment over a frame, they are more robust
to noise and spatial artifacts than previous spatially varying exposure (SVE)
HDR video methods. Nonetheless, the motion blur from longer exposures, the
noise from short exposures, and inherent spatial artifacts of the SVE methods
remain huge obstacles. Additionally, temporal coherence must be taken into
account for the stability of video reconstruction. To tackle these challenges,
we introduce a novel network architecture that divides-and-conquers these
problems. In order to better adapt the network to the large dynamic range, we
also propose LDR-reconstruction loss that takes equal contributions from both
the highlighted and the shaded pixels of HDR frames. Through a series of
comparisons and ablation studies, we show that the tri-exposure quad-bayer with
our solution is more optimal to capture than previous reconstruction methods,
particularly for the scenes with larger dynamic range and objects with motion.
","[{""version"":""v1"",""created"":""Fri, 19 Mar 2021 18:40:09 GMT""}]","2022-01-02"
"2103.10983","Kamal Hajian","Kamal Hajian, Hikmet \""Oz\c{s}ahin, Bayram Tekin","First law of black hole thermodynamics and Smarr formula with a
  cosmological constant","37 pages, no figures, published version","Phys. Rev. D 104, 044024 (2021)","10.1103/PhysRevD.104.044024",,"gr-qc hep-th","http://arxiv.org/licenses/nonexclusive-distrib/1.0/","  The first law of black hole thermodynamics in the presence of a cosmological
constant $\Lambda$ can be generalized by introducing a term containing the
variation $\delta\Lambda$. Similar to other terms in the first law, which are
variations of some conserved charges like mass, entropy, angular momentum,
electric charge etc., it has been shown [Classical Quantum Gravity 35, 125012
(2018)] that the new term has the same structure: $\Lambda$ is a conserved
charge associated with a gauge symmetry; and its role in the first law is quite
similar to an ``electric charge"" rather than to the pressure. Besides, its
conjugate chemical potential resembles an ``electric potential"" on the horizon,
in contrast with the volume enclosed by horizon. In this work, first we propose
and prove the generalized Smarr relation in this new paradigm. Then, we
reproduce systematically the ``effective volume"" of a black hole which has been
introduced before in the literature as the conjugate of pressure. Our
construction removes the ambiguity in the definition of volume. Finally, we
apply and investigate this formulation of ``$\Lambda$ as a charge"" on a number
of solutions to different models of gravity for different spacetime dimensions.
Especially, we investigate the applicability and validity of the analysis for
black branes, whose enclosed volume is not well defined in principle.
","[{""version"":""v1"",""created"":""Fri, 19 Mar 2021 18:40:25 GMT""},{""version"":""v2"",""created"":""Thu, 12 Aug 2021 17:17:49 GMT""}]","2022-03-25"
"2103.10984","Antonio Di Crescenzo","Selvamuthu Dharmaraja, Antonio Di Crescenzo, Virginia Giorno, Amelia
  G. Nobile","A continuous-time Ehrenfest model with catastrophes and its
  jump-diffusion approximation","21 pages, 10 figures","Journal of Statistical Physics 161 (2015), pp. 326-345","10.1007/s10955-015-1336-4",,"math.PR","http://arxiv.org/licenses/nonexclusive-distrib/1.0/","  We consider a continuous-time Ehrenfest model defined over the integers from
-N to N, and subject to catastrophes occurring at constant rate. The effect of
each catastrophe instantaneously resets the process to state 0. We investigate
both the transient and steady-state probabilities of the above model. Further,
the first passage time through state 0 is discussed. We perform a
jump-diffusion approximation of the above model, which leads to the
Ornstein-Uhlenbeck process with catastrophes. The underlying jump-diffusion
process is finally studied, with special attention to the symmetric case
arising when the Ehrenfest model has equal upward and downward transition
rates.
","[{""version"":""v1"",""created"":""Fri, 19 Mar 2021 18:46:46 GMT""}]","2021-03-23"
"2103.10987","Nizar Demni","Nizar Demni","Hartman-Watson distribution and hyperbolic-like Heat kernels","typos corrected",,,,"math.PR","http://arxiv.org/licenses/nonexclusive-distrib/1.0/","  We relate Gruet formula for the heat kernel on real hyperbolic spaces to the
commonly used one derived from Millson induction. The bridge between both
formulas is settled by Yor result on the joint distribution of a Brownian
motion and of its exponential functional at fixed time. This result allows
further to relate Gruet formula with real parameter to the heat kernel of the
hyperbolic Jacobi operator and to derive a new integral representation for the
heat kernel of the Maass Laplacian. When applied to harmonic AN groups, Yor
result yields also new a integral representation of their corresponding heat
kernels which does not distinguish the parity of the dimension of the center of
the Lie group N.
","[{""version"":""v1"",""created"":""Fri, 19 Mar 2021 18:54:22 GMT""},{""version"":""v2"",""created"":""Sat, 12 Jun 2021 11:47:54 GMT""}]","2021-06-15"
"2103.10988","Ibrahima N'Doye","Nouha Rouis and Ibrahima N'Doye and Taous-Meriem Laleg-Kirati","Model-free LQR based PID controller for trajectory tracking of 2-DoF
  helicopter: comparison and experimental results","11 pages",,,,"eess.SY cs.SY","http://arxiv.org/licenses/nonexclusive-distrib/1.0/","  This paper studies the performance of a model-free LQR based PID (i-LQR-PID)
controller designed for tracking control problem of a 2-DoF laboratory
helicopter. The control problem addressed in 2-DoF helicopter system aims to
track the desired pitch and yaw axes trajectories despite disturbed operating
conditions. In addition to the unpredictable variations, the 2-DoF helicopter
dynamic is highly nonlinear with having strong cross-couplings in their models
as well as being open loop unstable system. Thus, we propose a model-free LQR
based PID control strategy in order to achieve better trajectory tracking
control objectives. Robustness tests are performed experimentally to show the
effectiveness of the model-free control.
","[{""version"":""v1"",""created"":""Fri, 19 Mar 2021 18:56:45 GMT""}]","2021-03-23"
"2103.10989","Fouad Marri","Fouad Marri and Khouzeima Moutanabbir","Risk aggregation and capital allocation using a new generalized
  Archimedean copula",,,,,"q-fin.RM q-fin.CP q-fin.PM q-fin.PR q-fin.ST","http://creativecommons.org/licenses/by/4.0/","  In this paper, we address risk aggregation and capital allocation problems in
the presence of dependence between risks. The dependence structure is defined
by a mixed Bernstein copula which represents a generalization of the well-known
Archimedean copulas. Using this new copula, the probability density function
and the cumulative distribution function of the aggregate risk are obtained.
Then, closed-form expressions for basic risk measures, such as tail
value-at-risk(TVaR) and TVaR-based allocations, are derived.
","[{""version"":""v1"",""created"":""Fri, 19 Mar 2021 19:06:18 GMT""}]","2021-03-23"
"2103.10990","Andrzej Dorobisz","Andrzej Dorobisz and Jakub Kozik","Local Computation Algorithms for Coloring of Uniform Hypergraphs",,,,,"cs.DS","http://creativecommons.org/licenses/by/4.0/","  We present a progress on local computation algorithms for two coloring of
$k$-uniform hypergraphs. We focus on instances that satisfy strengthened
assumption of Local Lemma of the form $2^{1-\alpha k} (\Delta+1) e < 1$, where
$\Delta$ is the bound on the maximum edge degree of the hypergraph. We discuss
how previous works on the subject can be used to obtain an algorithm that works
in polylogarithmic time per query for $\alpha$ up to about $0.139$. Then, we
present a procedure that, within similar bounds on running time, solves wider
range of instances by allowing $\alpha$ at most about $0.227$.
","[{""version"":""v1"",""created"":""Fri, 19 Mar 2021 19:17:14 GMT""}]","2021-03-23"
"2103.10991","Dana Bartosova","Dana Barto\v{s}ov\'a","Universal minimal flows of extensions of and by compact groups","11 pages",,,,"math.DS","http://arxiv.org/licenses/nonexclusive-distrib/1.0/","  Every topological group $G$ has up to isomorphism a unique minimal $G$-flow
that maps onto every minimal $G$-flow, the universal minimal flow $M(G).$ We
show that if $G$ has a compact normal subgroup $K$ that acts freely on $M(G)$
and there exists a uniformly continuous cross section $G/K\to G,$ then the
phase space of $M(G)$ is homeomorphic to the product of the phase space of
$M(G/K)$ with $K$. Moreover, if either the left and right uniformities on $G$
coincide or $G\cong G/K\ltimes K$, we also recover the action, in the latter
case extending a result of Kechris and Soki\'c. As an application, we show that
the phase space of $M(G)$ for any totally disconnected locally compact Polish
group $G$ with a normal open compact subgroup is homeomorphic to a finite set,
Cantor set $2^{\mathbb{N}}$, $M(\mathbb{Z})$, or $M(\mathbb{Z})\times
2^{\mathbb{N}}.$
","[{""version"":""v1"",""created"":""Fri, 19 Mar 2021 19:18:26 GMT""}]","2021-03-23"
"2103.10992","John Vastola","John J. Vastola and Gennady Gorin and Lior Pachter and William R.
  Holmes","Analytic solution of chemical master equations involving gene switching.
  I: Representation theory and diagrammatic approach to exact solution","108 pages, 12 figures",,,,"q-bio.SC q-bio.MN q-bio.QM","http://creativecommons.org/licenses/by/4.0/","  The chemical master equation (CME), which describes the discrete and
stochastic molecule number dynamics associated with biological processes like
transcription, is difficult to solve analytically. It is particularly hard to
solve for models involving bursting/gene switching, a biological feature that
tends to produce heavy-tailed single cell RNA counts distributions. In this
paper, we present a novel method for computing exact and analytic solutions to
the CME in such cases, and use these results to explore approximate solutions
valid in different parameter regimes, and to compute observables of interest.
Our method leverages tools inspired by quantum mechanics, including ladder
operators and Feynman-like diagrams, and establishes close formal parallels
between the dynamics of bursty transcription, and the dynamics of bosons
interacting with a single fermion. We focus on two problems: (i) the chemical
birth-death process coupled to a switching gene/the telegraph model, and (ii) a
model of transcription and multistep splicing involving a switching gene and an
arbitrary number of downstream splicing steps. We work out many special cases,
and exhaustively explore the special functionology associated with these
problems. This is Part I in a two-part series of papers; in Part II, we explore
an alternative solution approach that is more useful for numerically solving
these problems, and apply it to parameter inference on simulated RNA counts
data.
","[{""version"":""v1"",""created"":""Fri, 19 Mar 2021 19:20:11 GMT""}]","2021-03-23"
"2103.10993","Huafeng Zhang","David Hernandez, Huafeng Zhang","Shifted Yangians and polynomial R-matrices","v1: 59 pages. v2: 57 pages, results of Subsection 7.2 strengthened
  with a simplified proof, final version accepted in PRIMS",,,,"math.QA math-ph math.MP math.RT","http://arxiv.org/licenses/nonexclusive-distrib/1.0/","  We study the category O of representations over a shifted Yangian. This
category has a tensor product structure and contains distinguished modules, the
positive prefundamental modules and the negative prefundamental modules.
Motivated by the representation theory of the Borel subalgebra of a quantum
affine algebra and by the relevance of quantum integrable systems in this
context, we prove that tensor products of prefundamental modules with
irreducible modules are either cyclic or co-cyclic. This implies the existence
and uniqueness of morphisms, the R-matrices, for such tensor products. We prove
the R-matrices are polynomial in the spectral parameter, and we establish
functional relations for the R-matrices. As applications, we prove the
Jordan--H\""older property in the category O. We also obtain a proof, uniform
for any finite type, that any irreducible module factorizes through a truncated
shifted Yangian.
","[{""version"":""v1"",""created"":""Fri, 19 Mar 2021 19:23:33 GMT""},{""version"":""v2"",""created"":""Tue, 15 Mar 2022 08:04:35 GMT""}]","2022-03-16"
"2103.10994","Elad Amrani","Elad Amrani, Leonid Karlinsky, Alex Bronstein","Self-Supervised Classification Network","ECCV 2022 camera-ready with supplementary",,,,"cs.CV","http://arxiv.org/licenses/nonexclusive-distrib/1.0/","  We present Self-Classifier -- a novel self-supervised end-to-end
classification learning approach. Self-Classifier learns labels and
representations simultaneously in a single-stage end-to-end manner by
optimizing for same-class prediction of two augmented views of the same sample.
To guarantee non-degenerate solutions (i.e., solutions where all labels are
assigned to the same class) we propose a mathematically motivated variant of
the cross-entropy loss that has a uniform prior asserted on the predicted
labels. In our theoretical analysis, we prove that degenerate solutions are not
in the set of optimal solutions of our approach. Self-Classifier is simple to
implement and scalable. Unlike other popular unsupervised classification and
contrastive representation learning approaches, it does not require any form of
pre-training, expectation-maximization, pseudo-labeling, external clustering, a
second network, stop-gradient operation, or negative pairs. Despite its
simplicity, our approach sets a new state of the art for unsupervised
classification of ImageNet; and even achieves comparable to state-of-the-art
results for unsupervised representation learning. Code is available at
https://github.com/elad-amrani/self-classifier.
","[{""version"":""v1"",""created"":""Fri, 19 Mar 2021 19:29:42 GMT""},{""version"":""v2"",""created"":""Thu, 9 Dec 2021 10:21:51 GMT""},{""version"":""v3"",""created"":""Tue, 12 Jul 2022 14:25:52 GMT""}]","2022-07-13"
"2103.10995","Peter Burton","Peter Burton","Statistical constructions in quantum information theory","Published version;
  https://link.springer.com/article/10.1007/s40509-022-00269-x",,,,"quant-ph math.FA math.PR","http://arxiv.org/licenses/nonexclusive-distrib/1.0/","  We introduce a notion of strategies based on averaging for nonlocal games in
quantum information theory. These so-called statistical strategies come in a
commuting type and a more specific spatial type, which are respectively special
cases of the quantum commuting and quantum spatial strategies commonly
considered in the field. We prove a theorem that the sets of statistical
commuting strategies and statistical spatial strategies are respectively equal
to the sets of quantum commuting strategies and quantum spatial strategies for
any nonlocal game. Thus we are able to use the recent negative solution of
Tsirelson's problem to obtain a statistical analog showing that there exists a
nonlocal game where the set of statistical commuting strategies properly
contains the closure of the set of statistical spatial strategies. The proof of
this theorem involves development of statistical replicas for numerous
constructions in quantum information theory, in particular for the Fourier-type
duality between observation structures and dynamical structures. The main point
of the argument is to apply the established theory of approximating unitary
representations of countable discrete groups by ergodic measure preserving
actions of such groups. We note that the relevant groups are nonamenable. We
also give an explicit description of a statistical strategy to win the CHSH
game from Aspect's experiment with a probability exceeding the maximum possible
value for a classical strategy.
","[{""version"":""v1"",""created"":""Fri, 19 Mar 2021 19:35:15 GMT""},{""version"":""v2"",""created"":""Mon, 13 Feb 2023 18:16:38 GMT""}]","2023-02-14"
"2103.10996","Silvia Ferrario Ravasio","Silvia Ferrario Ravasio, Tom\'a\v{s} Je\v{z}o","Non-resonant and offshell effects in top-pair observables","Top2020 (Durham). 7 pages, 4 figures",,,"IPPP/20/85, KA-TP-04-2021, P3H-21-018","hep-ph hep-ex","http://arxiv.org/licenses/nonexclusive-distrib/1.0/","  In these proceedings we investigate the impact of offshell and non-resonant
contributions to kinematic distributions in $t\bar{t}$ final states by
comparing several next-to-leading-order~(NLO) + parton shower (PS) generators
which differ in the way they model these effects. We focus on distributions
traditionally used for measurements of fundamental top-quark properties such as
its Yukawa coupling or its mass. Given the current experimental uncertainties,
we find that such effects can have relatively large impact on the shape of
these distributions and are thus mandatory for accurate measurements.
","[{""version"":""v1"",""created"":""Fri, 19 Mar 2021 19:36:06 GMT""}]","2021-03-23"
