"2103.11114","Zhenhong Zou","Zhenhong Zou, Xinyu Zhang, Huaping Liu, Zhiwei Li, Amir Hussain and
  Jun Li","A novel multimodal fusion network based on a joint coding model for lane
  line segmentation",,,,,"cs.CV","http://arxiv.org/licenses/nonexclusive-distrib/1.0/","  There has recently been growing interest in utilizing multimodal sensors to
achieve robust lane line segmentation. In this paper, we introduce a novel
multimodal fusion architecture from an information theory perspective, and
demonstrate its practical utility using Light Detection and Ranging (LiDAR)
camera fusion networks. In particular, we develop, for the first time, a
multimodal fusion network as a joint coding model, where each single node,
layer, and pipeline is represented as a channel. The forward propagation is
thus equal to the information transmission in the channels. Then, we can
qualitatively and quantitatively analyze the effect of different fusion
approaches. We argue the optimal fusion architecture is related to the
essential capacity and its allocation based on the source and channel. To test
this multimodal fusion hypothesis, we progressively determine a series of
multimodal models based on the proposed fusion methods and evaluate them on the
KITTI and the A2D2 datasets. Our optimal fusion network achieves 85%+ lane line
accuracy and 98.7%+ overall. The performance gap among the models will inform
continuing future research into development of optimal fusion algorithms for
the deep multimodal learning community.
","[{""version"":""v1"",""created"":""Sat, 20 Mar 2021 06:47:58 GMT""}]","2021-03-23"
"2103.11115","Martin Trulsson","Martin Trulsson","Directional shear-jamming","5 pages, 6 figures, 2 pages SI, 3 figures in SI",,,,"cond-mat.soft","http://creativecommons.org/licenses/by/4.0/","  In this work we, study shear reversals of dense non-Brownian suspensions
composed of cohesionless elliptical particles. By numerical simulations, we
show that a new fragility appears for frictionless ellipses in the flowing
states, where particles can flow indefinitely in one direction at applied shear
stresses but shear-jams in the other direction upon shear stress reversal. This
new fragility, absent in the isotropic particle case, is linked to the
directional order of the elongated particles at steady shear and its
reorientation at shear stress reversal, which forces the suspensions to pass
through a more disordered state with an increased number of contacts in which
it might get arrested.
","[{""version"":""v1"",""created"":""Sat, 20 Mar 2021 06:50:08 GMT""},{""version"":""v2"",""created"":""Wed, 19 May 2021 12:30:24 GMT""}]","2021-05-20"
"2103.11116","Amir Hossein Hadi Hosseinabadi","A. H. Hadi-Hosseinabadi and S. E. Salcudean","Multi-Axis Force Sensing in Robotic Minimally Invasive Surgery With No
  Instrument Modification","10 pages, 14 figures",,,,"cs.RO cs.SY eess.SY","http://arxiv.org/licenses/nonexclusive-distrib/1.0/","  This paper presents a novel multi-axis force-sensing approach in robotic
minimally invasive surgery with no modification to the surgical instrument.
Thus, it is adaptable to different surgical instruments. A novel 6-axis optical
force sensor, with local signal conditioning and digital electronics, was
mounted onto the proximal shaft of a da Vinci EndoWrist instrument. A new
cannula design comprising an inner tube and an outer tube was proposed. The
inner tube is attached to the cannula interface to the robot base through a
compliant leaf spring with adjustable stiffness. It allows bending of the
instrument shaft due to the tip forces. The outer tube mechanically filters out
the body forces from affecting the instrument bending behavior. A mathematical
model of the sensing principle was developed and used for model-based
calibration. A data-driven calibration based on a shallow neural network
architecture comprising a single 5-nodes hidden layer and a 5x1 output layer is
discussed. Extensive testing was conducted to validate that the sensor can
successfully measure the lateral forces and moments and the axial torque
applied to the instruments distal end within the desired resolution, accuracy,
and range requirements.
","[{""version"":""v1"",""created"":""Sat, 20 Mar 2021 06:52:35 GMT""}]","2021-03-23"
"2103.11117","Mengyu Cao","Mengyu Cao, Benjian Lv and Kaishun Wang","Non-trivial $t$-intersecting families for the distance-regular graphs of
  bilinear forms","25 pages",,,,"math.CO","http://arxiv.org/licenses/nonexclusive-distrib/1.0/","  Let $V$ be an $(n+\ell)$-dimensional vector space over a finite field, and
$W$ a fixed $\ell$-dimensional subspace of $V$. Write ${V\brack n,0}$ to be the
set of all $n$-dimensional subspaces $U$ of $V$ satisfying $\dim(U\cap W)=0$. A
family $\mathcal{F}\subseteq{V\brack n,0}$ is $t$-intersecting if $\dim(A\cap
B)\geq t$ for all $A,B\in\mathcal{F}$. A $t$-intersecting family
$\mathcal{F}\subseteq{V\brack n,0}$ is called non-trivial if
$\dim(\cap_{F\in\mathcal{F}}F)<t$. In this paper, we describe the structure of
non-trivial $t$-intersecting families of ${V\brack n,0}$ with large size. In
particular, we show the structure of the non-trivial $t$-intersecting families
with maximum size, which extends the Hilton-Milner Theorem for ${V\brack n,0}$.
","[{""version"":""v1"",""created"":""Sat, 20 Mar 2021 07:02:50 GMT""}]","2021-03-23"
"2103.11118","Fan Ge","Fan Ge and Li Kuang","Keywords Guided Method Name Generation","Research paper accepted at ICPC 2021 (29th IEEE/ACM International
  Conference on Program Comprehension)",,,,"cs.SE","http://arxiv.org/licenses/nonexclusive-distrib/1.0/","  High quality method names are descriptive and readable, which are helpful for
code development and maintenance. The majority of recent research suggest
method names based on the text summarization approach. They take the token
sequence and abstract syntax tree of the source code as input, and generate
method names through a powerful neural network based model. However, the tokens
composing the method name are closely related to the entity name within its
method implementation. Actually, high proportions of the tokens in method name
can be found in its corresponding method implementation, which makes it
possible for incorporating these common shared token information to improve the
performance of method naming task. Inspired by this key observation, we propose
a two-stage keywords guided method name generation approach to suggest method
names. Specifically, we decompose the method naming task into two subtasks,
including keywords extraction task and method name generation task. For the
keywords extraction task, we apply a graph neural network based model to
extract the keywords from source code. For the method name generation task, we
utilize the extracted keywords to guide the method name generation model. We
apply a dual selective gate in encoder to control the information flow, and a
dual attention mechanism in decoder to combine the semantics of input code
sequence and keywords. Experiment results on an open source dataset demonstrate
that keywords guidance can facilitate method naming task, which enables our
model to outperform the competitive state-of-the-art models by margins of
1.5\%-3.5\% in ROUGE metrics. Especially when programs share one common token
with method names, our approach improves the absolute ROUGE-1 score by 7.8\%.
","[{""version"":""v1"",""created"":""Sat, 20 Mar 2021 07:10:32 GMT""}]","2021-03-23"
"2103.11119","Yiwei Bao","Yiwei Bao, Yihua Cheng, Yunfei Liu and Feng Lu","Adaptive Feature Fusion Network for Gaze Tracking in Mobile Tablets","Accepted at International Conference on Pattern Recognition 2020
  (ICPR)",,,,"cs.CV","http://arxiv.org/licenses/nonexclusive-distrib/1.0/","  Recently, many multi-stream gaze estimation methods have been proposed. They
estimate gaze from eye and face appearances and achieve reasonable accuracy.
However, most of the methods simply concatenate the features extracted from eye
and face appearance. The feature fusion process has been ignored. In this
paper, we propose a novel Adaptive Feature Fusion Network (AFF-Net), which
performs gaze tracking task in mobile tablets. We stack two-eye feature maps
and utilize Squeeze-and-Excitation layers to adaptively fuse two-eye features
according to their similarity on appearance. Meanwhile, we also propose
Adaptive Group Normalization to recalibrate eye features with the guidance of
facial feature. Extensive experiments on both GazeCapture and MPIIFaceGaze
datasets demonstrate consistently superior performance of the proposed method.
","[{""version"":""v1"",""created"":""Sat, 20 Mar 2021 07:16:10 GMT""}]","2021-03-23"
"2103.11120","Dongzhe Li","Dongzhe Li, Jonas L. Bertelsen, Nick Papior, Alexander Smogunov, Mads
  Brandbyge","Surface states and related quantum interference in \textit{ab initio}
  electron transport","8 pages, 8 figures","Phys. Rev. Research 3, 033017 (2021)","10.1103/PhysRevResearch.3.033017",,"cond-mat.mes-hall","http://creativecommons.org/publicdomain/zero/1.0/","  Shockley surface states (SS) have attracted much attention due to their role
in various physical phenomena occurring at surfaces. It is also clear from
experiments that they can play an important role in electron transport.
However, accurate incorporation of surface states in $\textit{ab initio}$
quantum transport simulations remains still an unresolved problem. Here we go
beyond the state-of-the-art non-equilibrium Green's function formalism through
the evaluation of the self-energy in real-space, enabling electron transport
without using artificial periodic in-plane conditions. We demonstrate the
method on three representative examples based on Au(111): a clean surface, a
metallic nanocontact, and a single-molecule junction. We show that SS can
contribute more than 30\% of the electron transport near the Fermi energy. A
significant and robust transmission drop is observed at the SS band edge due to
quantum interference in both metallic and molecular junctions, in good
agreement with experimental measurements. The origin of this interference
phenomenon is attributed to the coupling between bulk and SS transport channels
and it is reproduced and understood by tight-binding model. Furthermore, our
method predicts much better quantized conductance for metallic nanocontacts.
","[{""version"":""v1"",""created"":""Sat, 20 Mar 2021 07:18:54 GMT""},{""version"":""v2"",""created"":""Sat, 3 Jul 2021 06:16:57 GMT""}]","2021-07-06"
"2103.11121","Lingyan Chen","LingYan Chen","Stability and superconductivity of K-Y-H hydrides under high pressure",,,"10.1016/j.physleta.2021.127750",,"cond-mat.supr-con","http://arxiv.org/licenses/nonexclusive-distrib/1.0/","  It has been a hot issue to search for hydrides at high pressure with high
superconducting transition temperature (Tc). In this work, ternary
hydrogen-rich compounds KYHn (n = 1-16) were studied and calculated using the
density function theory (DFT) method and he results showed that the KYH8
demonstrates good stability and superconductivity. And keep thermodynamically
stable in the pressure range of 50-300 GPa. The research found that the Tc of
KYH8-C2/m was predicted to be 111.3K, 122.0K, and 142.3K at 200, 250 and 300
GPa, respectively. Our current study provides a possibility for searching new
high-Tc superconductors in ternary hydrides.
","[{""version"":""v1"",""created"":""Sat, 20 Mar 2021 07:21:08 GMT""}]","2021-10-27"
"2103.11122","Jie Yang","Jie Yang, Shi Jin, Chao-Kai Wen, Jiajia Guo, Michail Matthaiou, Bo Gao","Model-based Learning Network for 3-D Localization in mmWave
  Communications","Paper accepted for publication in IEEE Transactions on Wireless
  Communications. arXiv admin note: text overlap with arXiv:1908.04142",,,,"cs.IT eess.SP math.IT","http://creativecommons.org/licenses/by/4.0/","  This study considers the joint location and velocity estimation of UE and
scatterers in a three-dimensional mmWave CRAN architecture. Several existing
works have achieved satisfactory results with neural networks (NNs) for
localization. However, the black box NN localization method has limited
performance and relies on a prohibitive amount of training data. Thus, we
propose a model-based learning network for localization by combining NNs with
geometric models. Specifically, we first develop an unbiased WLS estimator by
utilizing hybrid delay/angular measurements, which determine the location and
velocity of the UE in only one estimator, and can obtain the location and
velocity of scatterers further. The proposed estimator can achieve the CRLB and
outperforms state-of-the-art methods. Second, we establish a NN-assisted
localization method (NN-WLS) by replacing the linear approximations in the
proposed WLS localization model with NNs to learn higher-order error
components, thereby enhancing the performance of the estimator. The solution
possesses the powerful learning ability of the NN and the robustness of the
proposed geometric model. Moreover, the ensemble learning is applied to improve
the localization accuracy further. Comprehensive simulations show that the
proposed NN-WLS is superior to the benchmark methods in terms of localization
accuracy, robustness, and required time resources.
","[{""version"":""v1"",""created"":""Sat, 20 Mar 2021 07:33:39 GMT""}]","2021-03-23"
"2103.11123","Amir Hossein Hadi Hosseinabadi","A. H. Hadi Hosseinabadi and S. E. Salcudean","Force Sensing in Robot-assisted Keyhole Endoscopy: A Systematic Survey",,,,,"cs.RO cs.SY eess.SY","http://arxiv.org/licenses/nonexclusive-distrib/1.0/","  Instrument-tissue interaction forces in Minimally Invasive Surgery (MIS)
provide valuable information that can be used to provide haptic perception,
monitor tissue trauma, develop training guidelines, and evaluate the skill
level of novice and expert surgeons.Force and tactile sensing is lost in many
Robot-Assisted Surgery (RAS) systems. Therefore, many researchers have focused
on recovering this information through sensing systems and estimation
algorithms.
  This article provides a comprehensive systematic review of the current force
sensing research aimed at RAS and, more generally, keyhole endoscopy, in which
instruments enter the body through small incisions. Articles published between
January 2011 and May 2020 are considered, following the Preferred Reporting
Items for Systematic reviews and Meta-Analyses (PRISMA) guidelines. The
literature search resulted in 110 papers on different force estimation
algorithms and sensing technologies, sensor design specifications, and
fabrication techniques.
","[{""version"":""v1"",""created"":""Sat, 20 Mar 2021 07:34:06 GMT""}]","2021-03-23"
"2103.11124","Kateryna Pozharska","Kateryna Pozharska, Tino Ullrich","A note on sampling recovery of multivariate functions in the uniform
  norm",,,,,"math.NA cs.NA","http://arxiv.org/licenses/nonexclusive-distrib/1.0/","  We study the recovery of multivariate functions from reproducing kernel
Hilbert spaces in the uniform norm. Our main interest is to obtain
preasymptotic estimates for the corresponding sampling numbers. We obtain
results in terms of the decay of related singular numbers of the compact
embedding into $L_2(D,\varrho_D)$ multiplied with the supremum of the
Christoffel function of the subspace spanned by the first $m$ singular
functions. Here the measure $\varrho_D$ is at our disposal. As an application
we obtain near optimal upper bounds for the sampling numbers for periodic
Sobolev type spaces with general smoothness weight. Those can be bounded in
terms of the corresponding benchmark approximation number in the uniform norm,
which allows for preasymptotic bounds. By applying a recently introduced
sub-sampling technique related to Weaver's conjecture we mostly lose a
$\sqrt{\log n}$ and sometimes even less. Finally we point out a relation to the
corresponding Kolmogorov numbers.
","[{""version"":""v1"",""created"":""Sat, 20 Mar 2021 07:34:12 GMT""},{""version"":""v2"",""created"":""Fri, 2 Apr 2021 08:44:09 GMT""}]","2021-04-05"
"2103.11125","Caifa Zhou","Caifa Zhou, Zhi Li, Dandan Zeng, Yongliang Wang","Mining geometric constraints from crowd-sourced radio signals and its
  application to indoor positioning","20 pages, 11 figures, accepted to publish on IEEE Access",,,,"stat.AP","http://arxiv.org/licenses/nonexclusive-distrib/1.0/","  Crowd-sourcing has become a promising way to build} a feature-based indoor
positioning system that has lower labour and time costs. It can make full use
of the widely deployed infrastructure as well as built-in sensors on mobile
devices. One of the key challenges is to generate the reference feature map
(RFM), a database used for localization, by {aligning crowd-sourced
{trajectories according to associations embodied in the data. In order to
facilitate the data fusion using crowd-sourced inertial sensors and radio
signals, this paper proposes an approach to adaptively mining geometric
information. This is the essential for generating spatial associations between
trajectories when employing graph-based optimization methods. The core idea is
to estimate the functional relationship to map the similarity/dissimilarity
between radio signals to the physical space based on the relative positions
obtained from inertial sensors and their associated radio signals. Namely, it
is adaptable to different modalities of data and can be implemented in a
self-supervised way. We verify the generality of the proposed approach through
comprehensive experimental analysis: i) qualitatively comparing the estimation
of geometric mapping models and the alignment of crowd-sourced trajectories;
ii) quantitatively evaluating the positioning performance. The 68\% of the
positioning error is less than 4.7 $\mathrm{m}$ using crowd-sourced RFM, which
is on a par with manually collected RFM, in a multi-storey shopping mall, which
covers more than 10, 000 $ \mathrm{m}^2 $.
","[{""version"":""v1"",""created"":""Sat, 20 Mar 2021 07:42:00 GMT""}]","2021-03-23"
"2103.11126","Maciej Rybczynski","Maciej Rybczynski, Grzegorz Wilk and Zbigniew Wlodarczyk","Relaxation and correlation times of nonequilibrium multiparticle systems","Final version, accepted for publication in Physical Review D","Phys. Rev. D 103, 114026 (2021)","10.1103/PhysRevD.103.114026",,"hep-ph","http://creativecommons.org/licenses/by/4.0/","  Relaxation and correlation times are two parameters used frequently in
approximate descriptions of the time development of hadronizing system from
some initial state towards distributions observed experimentally. Chosen to
reproduce the experimental results they represent, in a sense, the history of
the hadronization process. The analysis of their changes with energy is the
subject of our work.
","[{""version"":""v1"",""created"":""Sat, 20 Mar 2021 07:50:12 GMT""},{""version"":""v2"",""created"":""Wed, 2 Jun 2021 20:44:21 GMT""}]","2021-07-07"
"2103.11127","Khanh Chau Le","Khanh Chau Le and Mohammed El Yaagoubi","Safe equilibrium and crack growth in inhomogeneous materials as a
  variational problem","22 pages, 8 figures",,,,"cond-mat.mtrl-sci","http://creativecommons.org/licenses/by/4.0/","  The variational principle of safe equilibrium for inhomogeneous elastic
cracked bodies is formulated. Using the standard calculus of variations, we
show that the crack remains in safe equilibrium as long as the maximum energy
reduction rate of the virtually growing crack is negative. The crack starts to
grow in the direction of the maximum energy reduction rate when the latter
becomes zero. This energetic criterion implies the criteria proposed by He and
Hutchinson (1989). As an application we use this criterion to predict the
growth direction of an interface crack in a bimaterial.
","[{""version"":""v1"",""created"":""Sat, 20 Mar 2021 07:52:36 GMT""},{""version"":""v2"",""created"":""Wed, 18 Aug 2021 20:06:01 GMT""}]","2021-08-20"
"2103.11128","Shanika Wickramasuriya","Shanika L Wickramasuriya","Probabilistic forecast reconciliation under the Gaussian framework",,,,,"stat.ME","http://arxiv.org/licenses/nonexclusive-distrib/1.0/","  Forecast reconciliation of multivariate time series is the process of mapping
a set of incoherent forecasts into coherent forecasts to satisfy a given set of
linear constraints. Commonly used projection matrix based approaches for point
forecast reconciliation are OLS (ordinary least squares), WLS (weighted least
squares), and MinT (minimum trace). Even though point forecast reconciliation
is a well-established field of research, the literature on generating
probabilistic forecasts subject to linear constraints is somewhat limited.
Available methods follow a two-step procedure. Firstly, it draws future sample
paths from the univariate models fitted to each series in the collection (which
are incoherent). Secondly, it uses a projection matrix based approach or
empirical copula based reordering approach to account for contemporaneous
correlations and linear constraints. The projection matrices are estimated
either by optimizing a scoring rule such as energy or variogram score, or
simply using a projection matrix derived for point forecast reconciliation.
  This paper proves that (a) if the incoherent predictive distribution is
Gaussian then MinT minimizes the logarithmic scoring rule; and (b) the
logarithmic score of MinT for each marginal predictive density is smaller than
that of OLS. We show these theoretical results using a set of simulation
studies. We also evaluate them using the Australian domestic tourism data set.
","[{""version"":""v1"",""created"":""Sat, 20 Mar 2021 07:57:25 GMT""}]","2021-03-23"
"2103.11129","Shanika Wickramasuriya","Shanika L Wickramasuriya","Properties of point forecast reconciliation approaches",,,,,"stat.ME","http://arxiv.org/licenses/nonexclusive-distrib/1.0/","  Point forecast reconciliation of collection of time series with linear
aggregation constraints has evolved substantially over the last decade. A few
commonly used methods are GLS (generalized least squares), OLS (ordinary least
squares), WLS (weighted least squares), and MinT (minimum trace). GLS and MinT
have similar mathematical expressions, but they differ by the covariance matrix
used. OLS and WLS can be considered as special cases of MinT where they differ
by the assumptions made about the structure of the covariance matrix. All these
methods ensure that the reconciled forecasts are unbiased, provided that the
base forecasts are unbiased. The ERM (empirical risk minimizer) approach was
proposed to relax the assumption of unbiasedness.
  This paper proves that (a) GLS and MinT reduce to the same solution; (b) on
average, a method similar to ERM (which we refer to as MinT-U) can produce
better forecasts than MinT (lowest total mean squared error) which is then
followed by OLS and then by base; and (c) the mean squared error of each series
in the structure for MinT-U is smaller than that for MinT which is then
followed by that for either OLS or base forecasts. We show these theoretical
results using a set of simulation studies. We also evaluate them using the
Australian domestic tourism data set.
","[{""version"":""v1"",""created"":""Sat, 20 Mar 2021 07:58:18 GMT""}]","2021-03-23"
"2103.11130","Ningyuan Wang","Ningyuan Wang, Daniel B. Forger","The Level Set Kalman Filter for State Estimation of Continuous-discrete
  Systems",,,"10.1109/TSP.2021.3133698",,"eess.SY cs.SY","http://arxiv.org/licenses/nonexclusive-distrib/1.0/","  We propose a new extension of Kalman filtering for continuous-discrete
systems with nonlinear state-space models that we name as the level set Kalman
filter (LSKF). The LSKF assumes the probability distribution can be
approximated as a Gaussian, and updates the Gaussian distribution through a
time-update step and a measurement-update step. The LSKF improves the
time-update step when compared to existing methods, such as the
continuous-discrete cubature Kalman filter (CD-CKF) by reformulating the
underlying Fokker-Planck equation as an ordinary differential equation for the
Gaussian, thereby avoiding expansion in time. Together with a carefully picked
measurement-update method, numerical experiments show that the LSKF has a
consistent performance improvement over CD-CKF for a range of parameters, while
also simplifies the implementation, as no user-defined timestep subdivision
between measurements is required, and the spatial derivatives of the drift
function are not explicitly needed.
","[{""version"":""v1"",""created"":""Sat, 20 Mar 2021 08:00:43 GMT""},{""version"":""v2"",""created"":""Sun, 5 Dec 2021 14:13:33 GMT""},{""version"":""v3"",""created"":""Mon, 13 Dec 2021 05:51:16 GMT""}]","2021-12-14"
