"2103.10874","Xiwang Cao","Liqin Qian, Xiwang Cao, Wei Lu, Patrick Sole","A new method for constructing linear codes with small hulls",,,,,"cs.IT math.IT","http://creativecommons.org/licenses/by/4.0/","  The hull of a linear code over finite fields is the intersection of the code
and its dual, which was introduced by Assmus and Key. In this paper, we develop
a method to construct linear codes with trivial hull ( LCD codes) and
one-dimensional hull by employing the positive characteristic analogues of
Gauss sums. These codes are quasi-abelian, and sometimes doubly circulant. Some
sufficient conditions for a linear code to be an LCD code (resp. a linear code
with one-dimensional hull) are presented. It is worth mentioning that we
present a lower bound on the minimum distances of the constructed linear codes.
As an application, using these conditions, we obtain some optimal or almost
optimal LCD codes (resp. linear codes with one-dimensional hull) with respect
to the online Database of Grassl.
","[{""version"":""v1"",""created"":""Fri, 19 Mar 2021 16:00:00 GMT""}]","2021-03-22"
"2103.10875","Timoth\'ee Stumpf-F\'etizon","Omiros Papaspiliopoulos, Timoth\'ee Stumpf-F\'etizon, Giacomo Zanella","Scalable computation for Bayesian hierarchical models",,,,,"stat.CO stat.ME","http://arxiv.org/licenses/nonexclusive-distrib/1.0/","  The article is about algorithms for learning Bayesian hierarchical models,
the computational complexity of which scales linearly with the number of
observations and the number of parameters in the model. It focuses on crossed
random effect and nested multilevel models, which are used ubiquitously in
applied sciences, and illustrates the methodology on two challenging real data
analyses on predicting electoral results and real estate prices respectively.
The posterior dependence in both classes is sparse: in crossed random effects
models it resembles a random graph, whereas in nested multilevel models it is
tree-structured. For each class we develop a framework for scalable
computation. We provide a number of negative (for crossed) and positive (for
nested) results for the scalability (or lack thereof) of methods based on
sparse linear algebra, which are relevant also to Laplace approximation methods
for such models. Our numerical experiments compare with off-the-shelf
variational approximations and Hamiltonian Monte Carlo. Our theoretical
results, although partial, are useful in suggesting interesting methodologies
and lead to conclusions that our numerics suggest to hold well beyond the scope
of the underlying assumptions.
","[{""version"":""v1"",""created"":""Fri, 19 Mar 2021 16:01:36 GMT""},{""version"":""v2"",""created"":""Sun, 29 Aug 2021 18:59:50 GMT""}]","2021-08-31"
"2103.10876","Francesco Grandi","Francesco Grandi and Martin Eckstein","Fluctuation control of non-thermal orbital order","12 pages, 8 figures","Phys. Rev. B 103, 245117 (2021)","10.1103/PhysRevB.103.245117",,"cond-mat.str-el","http://creativecommons.org/licenses/by/4.0/","  Orbitally ordered states exhibit unique features which make them a promising
platform for exploring the ultrafast dynamics of long-range order in solids:
Their free energy typically has multiple discrete minima, and electric laser
fields or selectively excited phonons can exert effective forces that may be
used to steer the order parameter through these free energy landscapes.
Moreover, their free energy strongly depends on fluctuations, and in some cases
restoring forces close to a minimum are exclusively of entropic origin
(order-by-disorder mechanisms). This can open pathways to control the dynamics
of the order parameter via non-thermal fluctuations. In this work, we study the
laser-induced non-equilibrium dynamics in a $120^\circ$ compass model, using
time-dependent Ginzburg-Landau theory. We analyze protocols to switch the order
parameter between equivalent configurations, with a focus on the interplay
between the external force due to the driving field, and the non-thermal
entropic forces. In particular, we find that remanent non-thermal fluctuations
after some excitation can stabilize the high-symmetry phase even when the
homogeneous potential has retrieved its low-temperature form, which facilitates
laser-induced switching.
","[{""version"":""v1"",""created"":""Fri, 19 Mar 2021 16:01:42 GMT""}]","2021-06-23"
"2103.10877","Jan Komenda","Yingying Liu, Jan Komenda, and Zhiwu Li","Supervisory Control of Multi-Agent Discrete-Event Systems with Partial
  Observation",,,,,"eess.SY cs.SY","http://creativecommons.org/publicdomain/zero/1.0/","  In this paper we investigate multi-agent discrete-event systems with partial
observation. The agents can be divided into several groups in each of which the
agents have similar (isomorphic) state transition structures, and thus can be
relabeled into the same template. Based on the template a scalable supervisor
whose state size and computational cost are independent of the number of agents
is designed for the case of partial observation. The scalable supervisor under
partial observation does not need to be recomputed regardless of how many
agents are added to or removed from the system. We generalize our earlier
results to partial observation by proposing sufficient conditions for safety
and maximal permissiveness of the scalable least restrictive supervisor on the
template level. An example is provided to illustrate the proposed scalable
supervisory synthesis.
","[{""version"":""v1"",""created"":""Fri, 19 Mar 2021 16:02:22 GMT""}]","2021-03-22"
"2103.10878","Simone Dall'Osso","Simone Dall'Osso and Luigi Stella","Millisecond Magnetars","31 pages, 3 figures, Preprint of a chapter of the book 'Millisecond
  Pulsars', of the Astrophysics and Space Science Library (ASSL) series edited
  by Sudip Bhattacharyya, Alessandro Papitto and Dipankar Bhattacharya",,"10.1007/978-3-030-85198-9_8",,"astro-ph.HE","http://arxiv.org/licenses/nonexclusive-distrib/1.0/","  Two classes of X-ray/$\gamma$-ray sources, the Soft Gamma Repeaters and the
Anomalous X-ray Pulsars have been identified with isolated, slowly spinning
magnetars, neutron stars whose emission draws energy from their extremely
strong magnetic field ($\sim 10^{15}-10^{16}$ G). Magnetars are believed to
form with millisecond spin period and to represent an important fraction of the
whole population of young neutron stars. Newborn magnetars can convert very
quickly their rotational energy into electromagnetic and/or gravitational
waves, by virtue of their strong magnetic fields and fast spins. This chapter
provides a brief summary of astrophysical problems and scenarios in which
millisecond magnetars are believed to play a key role: these include Gamma Ray
Bursts, Supernovae, Gravitational Wave events and Fast Radio Bursts.
","[{""version"":""v1"",""created"":""Fri, 19 Mar 2021 16:02:49 GMT""}]","2022-04-06"
"2103.10879","Gregory Taylor","Gregory Taylor","Asymptotic syzygies of secant varieties of curves","Accepted to Journal of Pure and Applied Algebra. This version
  incorporates changes suggested by the referee: mostly typos and
  clarifications in exposition",,,,"math.AG math.AC","http://creativecommons.org/licenses/by/4.0/","  We prove that the minimal free resolution of the secant variety of a curve is
asymptotically pure. As a corollary, we show that the Betti numbers of converge
to a normal distribution.
","[{""version"":""v1"",""created"":""Fri, 19 Mar 2021 16:03:46 GMT""},{""version"":""v2"",""created"":""Mon, 11 Apr 2022 16:42:48 GMT""}]","2022-04-12"
"2103.10880","Richard Mu\~niz PhD.","Richard Mu\~niz and Alberto Verjovsky","Uniformization of compact foliated spaces by surfaces of hyperbolic type","15 pages; Section 5 was rewritten to make more comprehensible the
  proof of Theorem 5.1.;submitted to Proc. Am. Math. Soc",,,,"math.DG","http://creativecommons.org/licenses/by/4.0/","  We give a new proof of the uniformization theorem of the leaves of a
lamination by surfaces of hyperbolic conformal type. We use a laminated version
of the Ricci flow to prove the existence of a laminated Riemannian metric
(smooth on the leaves, transversaly continuous) with leaves of constant
Gaussian curvature equal to -1, which is conformally equivalent to the original
metric.
","[{""version"":""v1"",""created"":""Fri, 19 Mar 2021 16:04:52 GMT""},{""version"":""v2"",""created"":""Mon, 22 Mar 2021 14:26:20 GMT""},{""version"":""v3"",""created"":""Tue, 3 Aug 2021 20:18:10 GMT""}]","2021-08-05"
"2103.10881","Marie Farrell","Marie Farrell, Rosemary Monahan, James F. Power","Building Specifications in the Event-B Institution",,,,,"cs.LO cs.FL","http://creativecommons.org/licenses/by/4.0/","  This paper describes a formal semantics for the Event-B specification
language using the theory of institutions. We define an institution for
Event-B, EVT, and prove that it meets the validity requirements for
satisfaction preservation and model amalgamation. We also present a series of
functions that show how the constructs of the Event-B specification language
can be mapped into our institution. Our semantics sheds new light on the
structure of the Event-B language, allowing us to clearly delineate three
constituent sub-languages: the superstructure, infrastructure and mathematical
languages. One of the principal goals of our semantics is to provide access to
the generic modularisation constructs available in institutions, including
specification-building operators for parameterisation and refinement. We
demonstrate how these features subsume and enhance the corresponding features
already present in Event-B through a detailed study of their use in a worked
example. We have implemented our approach via a parser and translator for
Event-B specifications, EBtoEVT, which also provides a gateway to the Hets
toolkit for heterogeneous specification.
","[{""version"":""v1"",""created"":""Fri, 19 Mar 2021 16:05:41 GMT""},{""version"":""v2"",""created"":""Thu, 22 Sep 2022 12:04:05 GMT""},{""version"":""v3"",""created"":""Sun, 25 Sep 2022 10:47:27 GMT""},{""version"":""v4"",""created"":""Wed, 28 Sep 2022 14:38:31 GMT""},{""version"":""v5"",""created"":""Thu, 29 Sep 2022 09:03:55 GMT""},{""version"":""v6"",""created"":""Tue, 8 Nov 2022 14:42:33 GMT""}]","2022-11-09"
"2103.10882","Christoph Rettinger","Lukas Werner, Christoph Rettinger, Ulrich R\""ude","Coupling fully resolved light particles with the Lattice Boltzmann
  method on adaptively refined grids",,,,,"physics.flu-dyn physics.comp-ph","http://creativecommons.org/licenses/by/4.0/","  The simulation of geometrically resolved rigid particles in a fluid relies on
coupling algorithms to transfer momentum both ways between the particles and
the fluid. In this article, the fluid flow is modeled with a parallel Lattice
Boltzmann method using adaptive grid refinement to improve numerical
efficiency. The coupling with the particles is realized with the momentum
exchange method. When implemented in plain form, instabilities may arise in the
coupling when the particles are lighter than the fluid. The algorithm can be
stabilized with a virtual mass correction specifically developed for the
Lattice Boltzmann method. The method is analyzed for a wide set of physically
relevant regimes, varying independently the body-to-fluid density ratio and the
relative magnitude of inertial and viscous effects. These studies of a single
rising particle exhibit periodic regimes of particle motion as well as chaotic
behavior, as previously reported in the literature. The new method is carefully
compared with available experimental and numerical results. This serves to
validate the presented new coupled Lattice Boltzmann method and additionally it
leads to new physical insight for some of the parameter settings.
","[{""version"":""v1"",""created"":""Fri, 19 Mar 2021 16:07:08 GMT""}]","2021-03-22"
"2103.10883","Yingdong Lu","Yingdong Lu","Local and Global Existence of A Nonlocal Equation with A Singular
  Integral Drift Term",,,,,"math.AP","http://arxiv.org/licenses/nonexclusive-distrib/1.0/","  We study an initial value problem with fractional Laplacian and a singular
drift term, and obtain local and global existence theorems similar to the
results in Jourdain et al.(2005).
","[{""version"":""v1"",""created"":""Fri, 19 Mar 2021 16:08:21 GMT""}]","2021-03-22"
"2103.10884","Stephan Rave","Martin J. Gander and Stephan Rave","Localized Reduced Basis Additive Schwarz Methods",,,,,"math.NA cs.NA","http://arxiv.org/licenses/nonexclusive-distrib/1.0/","  Reduced basis methods build low-rank approximation spaces for the solution
sets of parameterized PDEs by computing solutions of the given PDE for
appropriately selected snapshot parameters. Localized reduced basis methods
reduce the offline cost of computing these snapshot solutions by instead
constructing a global space from spatially localized less expensive problems.
In the case of online enrichment, these local problems are iteratively solved
in regions of high residual and correspond to subdomain solves in domain
decomposition methods. We show in this note that indeed there is a close
relationship between online-enriched localized reduced basis and domain
decomposition methods by introducing a Localized Reduced Basis Additive Schwarz
method (LRBAS), which can be interpreted as a locally adaptive
multi-preconditioning scheme for the CG method.
","[{""version"":""v1"",""created"":""Fri, 19 Mar 2021 16:09:30 GMT""},{""version"":""v2"",""created"":""Tue, 8 Jun 2021 07:32:19 GMT""}]","2021-06-09"
"2103.10885","Yangxinyu Xie","Yangxinyu Xie, David Kulpanowski, Joshua Ong, Evdokia Nikolova, Ngoc
  Mai Tran","Predicting Covid-19 EMS Incidents from Daily Hospitalization Trends",,,"10.1111/ijcp.14920",,"stat.AP","http://creativecommons.org/licenses/by/4.0/","  Introduction: The aim of our retrospective study was to quantify the impact
of Covid-19 on the temporal distribution of Emergency Medical Services (EMS)
demand in Travis County, Austin, Texas and propose a robust model to forecast
Covid-19 EMS incidents. Methods: We analyzed the temporal distribution of EMS
calls in the Austin-Travis County area between January 1st, 2019, and December
31st, 2020. Change point detection was performed to identify critical dates
marking changes in EMS call distributions, and time series regression was
applied for forecasting Covid-19 EMS incidents. Results: Two critical dates
marked the impact of Covid-19 on the distribution of EMS calls: March 17th,
when the daily number of non-pandemic EMS incidents dropped significantly, and
May 13th, by which the daily number of EMS calls climbed back to 75% of the
number in pre-Covid-19 time. The new daily count of the hospitalization of
Covid-19 patients alone proves a powerful predictor of the number of pandemic
EMS calls, with an r2 value equal to 0.85. In particular, for every 2.5 cases
where EMS takes a Covid-19 patient to a hospital, one person is admitted.
Conclusion: The mean daily number of non-pandemic EMS demand was significantly
less than the period before Covid-19 pandemic. The number of EMS calls for
Covid-19 symptoms can be predicted from the daily new hospitalization of
Covid-19 patients. These findings may be of interest to EMS departments as they
plan for future pandemics, including the ability to predict pandemic-related
calls in an effort to adjust a targeted response.
","[{""version"":""v1"",""created"":""Fri, 19 Mar 2021 16:09:38 GMT""},{""version"":""v2"",""created"":""Mon, 3 May 2021 16:34:39 GMT""},{""version"":""v3"",""created"":""Sun, 23 May 2021 23:42:41 GMT""},{""version"":""v4"",""created"":""Wed, 26 May 2021 18:15:33 GMT""},{""version"":""v5"",""created"":""Fri, 13 Aug 2021 23:01:55 GMT""},{""version"":""v6"",""created"":""Mon, 4 Oct 2021 13:20:42 GMT""}]","2021-10-05"
"2103.10886","XiangXiang Sun","Xiang-Xiang Sun and Shan-Gui Zhou","Rotating deformed halo nuclei and shape decoupling effects","7 pages, 5 figure, and 1 table","Sci. Bull. 66, 2072 (2021)","10.1016/j.scib.2021.07.005",,"nucl-th","http://creativecommons.org/licenses/by/4.0/","  We explore the rotational feature of deformed halos by performing the angular
momentum projection (AMP) on the ground state wave functions obtained from the
deformed relativistic Hartree-Bogoliubov theory (DRHBc) in continuum. The
DRHBc+AMP approach self-consistently describes the coupling between single
particle bound states and the continuum not only in the ground state but also
in rotational states. The rotational modes of deformed halos in $^{42}$Mg and
$^{44}$Mg are investigated by studying properties of rotational states such as
excitation energy, configuration, and density distribution. Our study
demonstrates that the deformed halo structure persists from the ground state in
the intrinsic frame to collective states. Especially, the typical behavior of
shape decoupling effects in rotating deformed halo nuclei is revealed.
","[{""version"":""v1"",""created"":""Fri, 19 Mar 2021 16:12:26 GMT""},{""version"":""v2"",""created"":""Tue, 23 Mar 2021 08:38:52 GMT""}]","2021-10-15"
"2103.10887","Zhihan Zhu","Ru-Yue Zhong, Zhi-Han Zhu, Hai-Jun Wu, Carmelo Rosales-Guzm\'an,
  Shu-Wei Song, and Bao-Sen Shi","Gouy-phase-mediated propagation variations and revivals of transverse
  structure in vectorially structured light",,"Phys. Rev. A 103, 053520 (2021)","10.1103/PhysRevA.103.053520",,"physics.optics","http://creativecommons.org/licenses/by/4.0/","  Exploring the physics and potential applications of vectorially structured
light with propagation-invariant transverse structures has benefited many areas
of modern optics and photonics. In this paper, we investigate the non-eigen
vector modes of paraxial light fields, focusing on the propagation variations
and revivals of their transverse structures, including both spatial and
polarization structures. We show that the physical mechanism behind the
variations and revivals of their transverse structure is linked to the
evolution of the intramodal phases between the constituting spatial modes. Such
evolution originates from fractional Gouy phases, or rather, Geometric-phase
difference between spatial modes with different orders under a same unitary
transformation. This underlying principle, provides a general guideline for
shaping vectorially structured light with custom propagation-evolution
properties, and may also inspire a wide variety of new applications based on
structured light.
","[{""version"":""v1"",""created"":""Fri, 19 Mar 2021 16:13:00 GMT""},{""version"":""v2"",""created"":""Sat, 8 May 2021 12:35:21 GMT""}]","2021-06-02"
"2103.10888","Murad Abu-Khalaf","Murad Abu-Khalaf, Sertac Karaman and Daniela Rus","Feedback from Pixels: Output Regulation via Learning-Based Scene View
  Synthesis","Submitted to L4DC on November-20-2020; Accepted on March-5-2021",,,,"eess.SY cs.SY","http://arxiv.org/licenses/nonexclusive-distrib/1.0/","  We propose a novel controller synthesis involving feedback from pixels,
whereby the measurement is a high dimensional signal representing a pixelated
image with Red-Green-Blue (RGB) values. The approach neither requires feature
extraction, nor object detection, nor visual correspondence. The control policy
does not involve the estimation of states or similar latent representations.
Instead, tracking is achieved directly in image space, with a model of the
reference signal embedded as required by the internal model principle. The
reference signal is generated by a neural network with learning-based scene
view synthesis capabilities. Our approach does not require an end-to-end
learning of a pixel-to-action control policy. The approach is applied to a
motion control problem, namely the longitudinal dynamics of a car-following
problem. We show how this approach lend itself to a tractable stability
analysis with associated bounds critical to establishing trustworthiness and
interpretability of the closed-loop dynamics.
","[{""version"":""v1"",""created"":""Fri, 19 Mar 2021 16:13:27 GMT""},{""version"":""v2"",""created"":""Wed, 7 Apr 2021 20:34:32 GMT""},{""version"":""v3"",""created"":""Fri, 23 Apr 2021 15:12:56 GMT""}]","2021-04-26"
"2103.10889","Tal Horesh","Antonin Guilloux and Tal Horesh","$p$-adic Directions of Primitive Vectors",,,,,"math.DS math.NT","http://creativecommons.org/licenses/by/4.0/","  Linnik type problems concern the distribution of projections of integral
points on the unit sphere as their norm increases, and different
generalizations of this phenomenon. Our work addresses a question of this type:
we prove the uniform distribution of the projections of primitive
$\mathbb{Z}^{2}$ points in the $p$-adic unit sphere, as their (real) norm tends
to infinity. The proof is via counting lattice points in semi-simple
$S$-arithmetic groups.
","[{""version"":""v1"",""created"":""Fri, 19 Mar 2021 16:20:17 GMT""}]","2021-03-22"
"2103.10890","Claudio Llinares","Claudio Llinares","Simulation techniques for modified gravity","37 pages. Published as part of the IJMPD special issue ""Modified
  Gravity: Progresses and Outlook of Theories, Numerical Techniques and
  Observational Tests"" edited by Baojiu Li and Kazuya Koyama. Submitted to
  arXiv after end of embargo period","International Journal of Modern Physics D, Volume 27, Issue 15,
  2018","10.1142/S0218271818480036",,"astro-ph.CO astro-ph.GA gr-qc physics.comp-ph","http://creativecommons.org/licenses/by/4.0/","  The standard paradigm of cosmology assumes General Relativity (GR) is a valid
theory for gravity at scales in which it has not been properly tested.
Developing novel tests of GR and its alternatives is crucial if we want to give
strength to the model or find departures from GR in the data. Since
alternatives to GR are usually defined through nonlinear equations, designing
new tests for these theories implies a jump in complexity and thus, a need for
refining the simulation techniques. We summarize existing techniques for
dealing with modified gravity (MG) in the context of cosmological simulations.
$N$-body codes for MG are usually based on standard gravity codes. We describe
the required extensions, classifying the models not according to their original
motivation, but by the numerical challenges that must be faced by numericists.
MG models usually give rise to elliptic equations, for which multigrid
techniques are well suited. Thus, we devote a large fraction of this review to
describing this particular technique. Contrary to other reviews on multigrid
methods, we focus on the specific techniques that are required to solve MG
equations and describe useful tricks. Finally, we describe extensions for going
beyond the static approximation and dealing with baryons.
","[{""version"":""v1"",""created"":""Fri, 19 Mar 2021 16:22:10 GMT""}]","2021-03-22"
"2103.10892","Long Xie","Long Xie, Laura E.M. Wisse, Jiancong Wang, Sadhana Ravikumar, Trevor
  Glenn, Anica Luther, Sydney Lim, David A. Wolk, and Paul A. Yushkevich","Deep Label Fusion: A 3D End-to-End Hybrid Multi-Atlas Segmentation and
  Deep Learning Pipeline","12 pages paper accepted by the international conference of
  Information Processing in Medical Imaging (IPMI) 2021",,,,"eess.IV cs.CV cs.LG","http://creativecommons.org/licenses/by-nc-sa/4.0/","  Deep learning (DL) is the state-of-the-art methodology in various medical
image segmentation tasks. However, it requires relatively large amounts of
manually labeled training data, which may be infeasible to generate in some
applications. In addition, DL methods have relatively poor generalizability to
out-of-sample data. Multi-atlas segmentation (MAS), on the other hand, has
promising performance using limited amounts of training data and good
generalizability. A hybrid method that integrates the high accuracy of DL and
good generalizability of MAS is highly desired and could play an important role
in segmentation problems where manually labeled data is hard to generate. Most
of the prior work focuses on improving single components of MAS using DL rather
than directly optimizing the final segmentation accuracy via an end-to-end
pipeline. Only one study explored this idea in binary segmentation of 2D
images, but it remains unknown whether it generalizes well to multi-class 3D
segmentation problems. In this study, we propose a 3D end-to-end hybrid
pipeline, named deep label fusion (DLF), that takes advantage of the strengths
of MAS and DL. Experimental results demonstrate that DLF yields significant
improvements over conventional label fusion methods and U-Net, a direct DL
approach, in the context of segmenting medial temporal lobe subregions using 3T
T1-weighted and T2-weighted MRI. Further, when applied to an unseen similar
dataset acquired in 7T, DLF maintains its superior performance, which
demonstrates its good generalizability.
","[{""version"":""v1"",""created"":""Fri, 19 Mar 2021 16:25:38 GMT""}]","2021-03-22"
"2103.10893","Ludwig Rahm","Ludwig Rahm","An operadic approach to substitution in Lie-Butcher series","24 pages",,,,"math.CO cs.NA math.NA math.RA","http://arxiv.org/licenses/nonexclusive-distrib/1.0/","  The paper follows an operadic approach to provide a bialgebraic description
of substitution for Lie-Butcher series. We first show how the well-known
bialgebraic description for substitution in Butcher's $B$-series can be
obtained from the pre-Lie operad. We then apply the same construction to the
post-Lie operad to arrive at a bialgebra $\mathcal{Q}$. By considering a module
over the post-Lie operad, we get a cointeraction between $\mathcal{Q}$ and the
Hopf algebra $\mathcal{H}_N$ that describes composition for Lie-Butcher series.
We use this coaction to describe substitution for Lie-Butcher series.
","[{""version"":""v1"",""created"":""Fri, 19 Mar 2021 16:26:27 GMT""}]","2021-03-22"
