"2111.04492","Anthony P. Jones","A. P. Jones and Nathalie Ysard","A derivation of nano-diamond optical constants: Here be nano-diamonds","17 pages, 8 figures, 4 tables","A&A 657, A128 (2022)","10.1051/0004-6361/202141793",,"astro-ph.GA","http://arxiv.org/licenses/nonexclusive-distrib/1.0/","  % context {Nano-diamonds are an enticing and enigmatic dust component yet
their origin is still unclear. They have been unequivocally detected in only a
few astronomical objects, yet they are the most abundant of the pre-solar
grains, both in terms of mass and number.} %aims {Our goal is to derive a
viable set of nano-diamond optical constants and optical properties to enable
their modelling in any type of astrophysical object where, primarily, the local
(inter)stellar radiation field is well-determined.} % methods {The complex
indices of refraction, $m(n,k)$, of nano-diamonds, constrained by available
laboratory measurements, were calculated as a function of size, surface
hydrogenation, and internal (dis)order, using the THEMIS a-C(:H) methodology
optEC$_{\rm (s)}$(a).} % results {To demonstrate the utility of the optical
properties (the efficiency factors $Q_{\rm ext}$, $Q_{\rm sca}$, and $Q_{\rm
abs}$), calculated using the derived $m(n,k)$ data, we show that nano-diamonds
could be abundant in the interstellar medium (ISM) and yet remain undetectable
there.} % conclusions {The derived optical constants provide a means to explore
the existence and viability of nano-diamonds in a wide range of astronomical
sources. Here we show that up to a few percent of the available carbon budget
could be hidden in the form of nano-diamonds in the diffuse ISM, in abundances
comparable to the pre-solar nano-diamond abundances in primitive meteorites.}
","[{""version"":""v1"",""created"":""Mon, 8 Nov 2021 13:32:24 GMT""}]","2022-01-26"
"2111.04493","Tae Moon Jeong","Tae Moon Jeong, Sergei V. Bulanov, Petr Valenta, Georg Korn, Timur Zh.
  Esirkepov, James K. Koga, Alexander S. Pirozhkov, Masaki Kando, Stepan S.
  Bulanov","Relativistic-flying laser focus by a laser-produced parabolic plasma
  mirror",,,"10.1103/PhysRevA.104.053533",,"physics.plasm-ph physics.optics","http://creativecommons.org/licenses/by/4.0/","  The question of electromagnetic field intensification towards the values
typical for strong field Quantum Electrodynamics is of fundamental importance.
One of the most promising intensification schemes is based on the
relativistic-flying mirror concept, which shows that the electromagnetic
radiation reflected by the mirror will be frequency up-shifted by a factor of 4
gamma^2 (gamma: the Lorentz factor of the mirror). In laser-plasma
interactions, such a mirror travels with relativistic velocities and typically
has a parabolic form, which is advantageous for light intensification. Thus, a
relativistic-flying parabolic mirror reflects the counter-propagating radiation
in a form of focused and flying electromagnetic wave with a high frequency. The
relativistic-flying motion of the laser focus makes the electric and magnetic
field distributions of the focus complicated, and the mathematical expressions
describing the field distributions of the focus is important. We present
analytical expressions describing the field distribution formed by an ideal
flying mirror having a perfect reflectance over the entire surface and
wavelength range. The peak field strength of an incident laser pulse with a
center wavelength of lambda_0 and an effective beam radius of w_e is enhanced
by a factor proportional to gamma^3 (w_e/lambda_0) in the relativistic limit.
Electron-positron pair production is investigated in the context of invariant
fields based on the enhanced electromagnetic field. The pair production rate
under the relativistic-flying laser focus is modified by the Lorentz
gamma-factor and the beam radius-wavelength ratio (w_e/lambda_0). We show that
the electron-positron pairs can be created by colliding two counter-propagating
relativistic-flying laser focuses in vacuum, each of which is formed when a 180
TW laser pulse is reflected by a relativistic-flying parabolic mirror with a
gamma = 12.2.
","[{""version"":""v1"",""created"":""Mon, 8 Nov 2021 13:32:31 GMT""}]","2021-12-15"
"2111.04495","Shin-Ichi Yasutomi","Takeo Noda and Shin-ichi Yasutomi","Billiards in a circle with trajectories circumscribing a triangle",,,,,"math.DS","http://arxiv.org/licenses/nonexclusive-distrib/1.0/","  We consider a bar billiards problem for a triangle in the unit circle. For
the point on the unit circle, we construct a line from it in a counterclockwise
direction tangent to the triangle, and examine a map corresponding to the point
of intersection with the circle. For the rotation number $\rho$ of this map,we
give $\frac{1}{3}\leq \rho< \frac{1}{2}$ and necessary and sufficient
conditions for $\rho=\frac{1}{3}$, which is related to an ellipse. We give an
application to elementary geometry.
","[{""version"":""v1"",""created"":""Mon, 8 Nov 2021 13:42:04 GMT""}]","2021-11-09"
"2111.04496","Zhe Cui","Zhe Cui, Xiang-Dong Li","A Study of Magnetized White Dwarf + Helium Star Binary Evolution to Type
  Ia Supernovae","25 pages, 15 figures",,"10.1088/1674-4527/ac3744",,"astro-ph.SR astro-ph.HE","http://creativecommons.org/licenses/by/4.0/","  The white dwarf (WD) + helium (He) star binary channel plays an important
role in the single degenerate scenario for the progenitors of type Ia
supernovae (SNe Ia). Previous studies on the WD + main sequence star evolution
have shown that the magnetic fields of WDs may significantly influence their
accretion and nuclear burning processes. In this work we focus on the evolution
of magnetized WD + He star binaries with detailed stellar evolution and binary
population synthesis (BPS) calculations. In the case of magnetized WDs, the
magnetic fields may disrupt the inner regions of the accretion disk, funnel the
accretion flow onto the polar caps, and even confine helium burning within the
caps.We find that, for WDs with sufficiently strong magnetic fields, the
parameter space of the potential SN Ia progenitor systems shrinks toward
shorter orbital periods and lower donor masses compared with that in the
non-magnetized WD case. The reason is that the magnetic confinement usually
works with relatively high mass transfer rates, which can trigger strong wind
mass loss from the WD, thus limiting the He-rich mass accumulation efficiency.
The surviving companion stars are likely of low-mass at the moment of the SN
explosions, which can be regarded as a possible explanation for the
non-detection of surviving companions after the SNe or inside the SN remnants.
However, the corresponding birthrate of Galactic SNe Ia in our high-magnetic
models is estimated to be ~(0.08-0.13) * 10^{-3} yr^{-1}( ~0.17-0.28 *
10^{-3}yr^{-1} for the non-magnetic models), significantly lower than the
observed Galactic SN Ia birthrate.
","[{""version"":""v1"",""created"":""Mon, 8 Nov 2021 13:43:39 GMT""}]","2022-02-16"
"2111.04497","Xinyi Ding","Xinyi Ding, Tao Han, Yili Fang, Eric Larson","An Approach for Combining Multimodal Fusion and Neural Architecture
  Search Applied to Knowledge Tracing",,,,,"cs.LG cs.CY","http://arxiv.org/licenses/nonexclusive-distrib/1.0/","  Knowledge Tracing is the process of tracking mastery level of different
skills of students for a given learning domain. It is one of the key components
for building adaptive learning systems and has been investigated for decades.
In parallel with the success of deep neural networks in other fields, we have
seen researchers take similar approaches in the learning science community.
However, most existing deep learning based knowledge tracing models either: (1)
only use the correct/incorrect response (ignoring useful information from other
modalities) or (2) design their network architectures through domain expertise
via trial and error. In this paper, we propose a sequential model based
optimization approach that combines multimodal fusion and neural architecture
search within one framework. The commonly used neural architecture search
technique could be considered as a special case of our proposed approach when
there is only one modality involved. We further propose to use a new metric
called time-weighted Area Under the Curve (weighted AUC) to measure how a
sequence model performs with time. We evaluate our methods on two public real
datasets showing the discovered model is able to achieve superior performance.
Unlike most existing works, we conduct McNemar's test on the model predictions
and the results are statistically significant.
","[{""version"":""v1"",""created"":""Mon, 8 Nov 2021 13:43:46 GMT""}]","2021-11-09"
"2111.04498","Robert Moore","R. E. Moore, C. Rosato and S. Maskell","Refining Epidemiological Forecasts with Simple Scoring Rules","14 pages, 2 figures, 3 tables",,"10.1098/rsta.2021.0305",,"stat.AP","http://arxiv.org/licenses/nonexclusive-distrib/1.0/","  Estimates from infectious disease models have constituted a significant part
of the scientific evidence used to inform the response to the COVID-19 pandemic
in the UK. These estimates can vary strikingly in their bias and variability.
Epidemiological forecasts should be consistent with the observations that
eventually materialise. We use simple scoring rules to refine the forecasts of
a novel statistical model for multisource COVID-19 surveillance data by tuning
its smoothness hyperparameter.
","[{""version"":""v1"",""created"":""Mon, 8 Nov 2021 13:44:48 GMT""},{""version"":""v2"",""created"":""Mon, 14 Mar 2022 11:36:53 GMT""}]","2022-10-12"
"2111.04499","Agnes Fienga Dr.","A. Fienga, L. Bigot, D. Mary, P. Deram, A. Di Ruscio, L. Bernus, M.
  Gastineau, J. Laskar","Evolution of INPOP planetary ephemerides and Bepi-Colombo simulations","Proceedings of the IAU Symposium 364 ""Multi-scale dynamics of space
  objects""",,"10.1017/S1743921321001277",,"astro-ph.EP astro-ph.SR gr-qc","http://arxiv.org/licenses/nonexclusive-distrib/1.0/","  We give here a detailed description of the latest INPOP planetary ephemerides
INPOP20a. We test the sensitivity of the Sun oblateness determination obtained
with INPOP to different models for the Sun core rotation. We also present new
evaluations of possible GRT violations with the PPN parameters $\beta$,$\gamma$
and $\dot{\mu}/\mu$. With a new method for selecting acceptable alternative
ephemerides we provide conservative limits of about $7.16 \times 10^{-5}$ and
$7.49 \times 10^{-5}$ for $\beta-1$ and $\gamma-1$ respectively using the
present day planetary data samples. We also present simulations of Bepi-Colombo
range tracking data and their impact on planetary ephemeris construction. We
show that the use of future BC range observations should improve these
estimates, in particular $\gamma$. Finally, interesting perspectives for the
detection of the Sun core rotation seem to be reachable thanks to the BC
mission and its accurate range measurements in the GRT frame.
","[{""version"":""v1"",""created"":""Mon, 8 Nov 2021 13:45:09 GMT""}]","2022-06-08"
"2111.04500","Christian Wuthrich","Vincent Lam and Christian W\""uthrich","Laws beyond spacetime","20 pages",,,,"physics.hist-ph gr-qc","http://creativecommons.org/licenses/by/4.0/","  Quantum gravity's suggestion that spacetime may be emergent and so only exist
contingently would force a radical reconception of extant analyses of laws of
nature. Humeanism presupposes a spatiotemporal mosaic of particular matters of
fact on which laws supervene; primitivism and dispositionalism conceive of the
action of primitive laws or of dispositions as a process of `nomic production'
unfolding over time. We show how the Humean supervenience basis of non-modal
facts and primitivist or dispositionalist accounts of nomic production can be
reconceived, avoiding a reliance on fundamental spacetime. However, it is
unclear that naturalistic forms of Humeanism can maintain their commitment to
there being no necessary connections among distinct entities. Furthermore,
non-temporal conceptions of production render this central concept more elusive
than before. In fact, the challenges run so deep that the survival of the
investigated analyses into the era of quantum gravity is questionable.
","[{""version"":""v1"",""created"":""Mon, 8 Nov 2021 13:45:17 GMT""}]","2021-11-09"
"2111.04501","Alessia Moretti","A. Moretti, M. Radovich, B. M. Poggianti, B. Vulcani, M. Gullieuszik,
  A. Werle, C. Bellhouse, C. Bacchini, J. Fritz, G. Soucail, J. Richard, A.
  Franchetto, N. Tomicic, A. Omizzolo","Observing ram pressure at work in intermediate redshift clusters with
  MUSE: the case of Abell 2744and Abell 370","Accepted for publication on ApJ",,"10.3847/1538-4357/ac36c7",,"astro-ph.GA","http://creativecommons.org/licenses/by-nc-nd/4.0/","  Ram pressure stripping has been proven to be effective in shaping galaxy
properties in dense environments at low redshift. The availability of MUSE
observations of a sample of distant (z$\sim 0.3-0.5$) clusters has allowed to
search for galaxies subject to this phenomenon at significant lookback times.
In this paper we describe how we discovered and characterized 13 ram-pressure
stripped galaxies in the central regions of two intermediate redshift
(z$\sim$0.3-0.4) clusters, A2744 and A370, using the MUSE spectrograph.
Emission line properties as well as stellar features have been analyzed to
infer the presence of this gas--only stripping mechanism, that produces
spectacular ionized gas tails (H$_{\alpha}$ and even more astonishing
[OII](3727,3729) departing from the main galaxy body. The inner regions of
these two clusters reveal the predominance of such galaxies among blue
star-forming cluster members, suggesting that ram-pressure stripping was even
more effective at intermediate redshift than in today's Universe.
Interestingly, the resolved [OII]/H$_{\alpha}$ line ratio in the stripped tails
is exceptionally high compared to that in the disks of these galaxies, (which
is comparable to that in normal low-z galaxies), suggesting lower gas densities
and/or an interaction with the hot surrounding ICM.
","[{""version"":""v1"",""created"":""Mon, 8 Nov 2021 13:46:41 GMT""}]","2022-02-02"
"2111.04507","Sergey Gorshkov","Sergey Gorshkov, Constantin Kondratiev, Roman Shebalov","Ontology-based question answering over corporate structured data",,,,,"cs.SE cs.CL","http://creativecommons.org/licenses/by/4.0/","  Ontology-based approach to the Natural Language Understanding (NLU)
processing allows to improve questions answering quality in dialogue systems.
We describe our NLU engine architecture and evaluate its implementation. The
engine transforms user input into the SPARQL SELECT, ASK or INSERT query to the
knowledge graph provided by the ontology-based data virtualization platform.
The transformation is based on the lexical level of the knowledge graph built
according to the Ontolex ontology. The described approach can be applied for
graph data population tasks and to the question answering systems
implementation, including chat bots. We describe the dialogue engine for a chat
bot which can keep the conversation context and ask clarifying questions,
simulating some aspects of the human logical thinking. Our approach uses
graph-based algorithms to avoid gathering datasets, required in the neural
nets-based approaches, and provide better explainability of our models. Using
question answering engine in conjunction with data virtualization layer over
the corporate data sources allows extracting facts from the structured data to
be used in conversation.
","[{""version"":""v1"",""created"":""Mon, 8 Nov 2021 13:49:15 GMT""}]","2021-11-09"
"2111.04509","Anthony P. Jones","A. P. Jones","Dust evolution, a global view: I. Nano-particles, nascence, nitrogen and
  natural selection . . . joining the dots","12 pages, 5 figures","RSOS published 2016",,,"astro-ph.GA","http://arxiv.org/licenses/nonexclusive-distrib/1.0/","  The role and importance of nano-particles for interstellar chemistry and
beyond is explored within the framework of The Heterogeneous dust Evolution
Model at the IaS (THEMIS), focussing on their active surface chemistry
(nascence), the effects of nitrogen doping and the natural selection of
interesting nano-particle sub-structures. Nano-particle driven chemistry, and
in particular the role of intrinsic epoxide-type structures could provide a
viable route to the observed gas phase OH in tenuous interstellar clouds en
route to becoming molecular clouds. The aromatic-rich moieties present in
asphaltenes likely provide a viable model for the structures present within
aromatic-rich interstellar carbonaceous grains. The observed doping of such
nano-particle structures with nitrogen, if also prevalent in interstellar dust,
is likely to have important and observable consequences for surface chemistry
and the formation of pre-cursor pre-biotic species.
","[{""version"":""v1"",""created"":""Mon, 8 Nov 2021 13:51:10 GMT""}]","2021-11-09"
"2111.04511","Takahiro Terada","Shuntaro Aoki and Takahiro Terada","Constrained Superfields in Dynamical Background","34 pages; published version","JHEP 02 (2022) 177","10.1007/JHEP02(2022)177","CTPU-PTC-21-38","hep-th astro-ph.CO hep-ph","http://arxiv.org/licenses/nonexclusive-distrib/1.0/","  We study the nonlinear realization of supersymmetry in a
dynamical/cosmological background in which derivative terms like kinetic terms
are finite. Starting from linearly realized theories, we integrate out heavy
modes without neglecting derivative terms to obtain algebraic constraints on
superfields. Thanks to the supersymmetry breaking contribution by the kinetic
energy, the validity of constrained superfields can be extended to cosmological
regimes and phenomena such as reheating after inflation, kinetic-energy
domination, and the kinetic and standard misalignment of axion.
","[{""version"":""v1"",""created"":""Mon, 8 Nov 2021 13:51:37 GMT""},{""version"":""v2"",""created"":""Mon, 21 Feb 2022 14:49:06 GMT""}]","2022-02-24"
"2111.04512","Anthony P. Jones","A. P. Jones","Dust evolution, a global view: II. Top-down branching, nano-particle
  fragmentation and the mystery of the diffuse interstellar band carriers","28 pages, 12 figures, 3 tables","RSOS publ;ished 2016",,,"astro-ph.GA physics.space-ph","http://arxiv.org/licenses/nonexclusive-distrib/1.0/","  The origin of the diffuse interstellar bands is one of the longest-standing
mysteries of the interstellar medium is explored within the framework of The
Heterogeneous dust Evolution Model at the IaS (THEMIS). The likely nature of
the diffuse interstellar band carriers and their evolution is here explored
within the framework of the structures and sub-structures inherent to doped
hydrogenated amorphous carbon grains in the interstellar medium. Based on the
natural aromatic-rich moieties (ashphaltenes) recovered from coal and oil the
likely structure of their interstellar analogues is investigated within the
context of the diffuse band problem. It is here proposed that the top- down
evolution of interstellar carbonaceous grains, and in particular a-C(:H)
nano-particles, is at the heart of the formation and evolution of the diffuse
interstellar band carriers and their associations with small molecules and
radicals such as C2, C3, CH and CN. It is most likely that the diffuse
interstellar bands are carried by dehydrogenated, ionised, hetero- cyclic,
aromatic rich moieties that form an integral part of the contiguous structure
of hetero-atom doped hydrogenated amorphous carbon nano-particles and their
daughter fragmentation products.
","[{""version"":""v1"",""created"":""Mon, 8 Nov 2021 13:54:31 GMT""}]","2021-11-09"
"2111.04513","Santtu Tikka","Santtu Tikka and Jouni Helske and Juha Karvanen","Clustering and Structural Robustness in Causal Diagrams",,,,,"stat.ML cs.LG stat.ME","http://creativecommons.org/licenses/by/4.0/","  Graphs are commonly used to represent and visualize causal relations. For a
small number of variables, this approach provides a succinct and clear view of
the scenario at hand. As the number of variables under study increases, the
graphical approach may become impractical, and the clarity of the
representation is lost. Clustering of variables is a natural way to reduce the
size of the causal diagram, but it may erroneously change the essential
properties of the causal relations if implemented arbitrarily. We define a
specific type of cluster, called transit cluster, that is guaranteed to
preserve the identifiability properties of causal effects under certain
conditions. We provide a sound and complete algorithm for finding all transit
clusters in a given graph and demonstrate how clustering can simplify the
identification of causal effects. We also study the inverse problem, where one
starts with a clustered graph and looks for extended graphs where the
identifiability properties of causal effects remain unchanged. We show that
this kind of structural robustness is closely related to transit clusters.
","[{""version"":""v1"",""created"":""Mon, 8 Nov 2021 13:56:22 GMT""},{""version"":""v2"",""created"":""Fri, 2 Sep 2022 12:56:49 GMT""}]","2022-09-05"
"2111.04514","Hua-Xing Chen","Hua-Xing Chen, Wei Chen and Shi-Lin Zhu","New hadron configuration: The double-gluon hybrid state","5 pages, 3 figures, 1 table, revised version to be published in PRD","Phys. Rev. D 105, L051501 (2022)","10.1103/PhysRevD.105.L051501",,"hep-ph hep-ex hep-lat nucl-ex nucl-th","http://creativecommons.org/licenses/by/4.0/","  This is the first study on the double-gluon hybrid, which consists of one
valence quark and one valence antiquark together with two valence gluons. We
concentrate on the one with the exotic quantum number $J^{PC} = 2^{+-}$ that
conventional $\bar q q$ mesons can not reach. We apply QCD sum rule method to
evaluate its mass to be $2.26^{+0.20}_{-0.25}$ GeV, and study its possible
decay patterns. Especially, its three-meson decay patterns are generally not
suppressed severely compared to two-meson decay patterns, so the $S$-wave
three-meson decay channels $f_1\omega\pi/f_1\rho\pi$ can be useful in
identifying its nature, which is of particular importance to the direct test of
QCD in the low energy sector.
","[{""version"":""v1"",""created"":""Mon, 8 Nov 2021 13:57:18 GMT""},{""version"":""v2"",""created"":""Thu, 11 Nov 2021 09:51:31 GMT""},{""version"":""v3"",""created"":""Fri, 4 Mar 2022 01:08:46 GMT""}]","2022-03-07"
"2111.04515","Marco Santimaria","M. Santimaria, V. Carassiti, G. Ciullo, P. Di Nezza, P. Lenisa, S.
  Mariani, L. L. Pappalardo, E. Steffens","The LHCspin project","Presented at the Low-$x$ Workshop, Elba Island, Italy, September
  27--October 1 2021",,,,"hep-ex","http://creativecommons.org/licenses/by/4.0/","  The goal of LHCspin is to develop, in the next few years, innovative
solutions and cutting-edge technologies to access spin physics in polarised
fixed-target collisions at high energy, exploring the unique kinematic regime
offered by LHC and exploiting new final states by means of the LHCb detector.
The forward geometry of the LHCb spectrometer is perfectly suited for the
reconstruction of particles produced in fixed-target collisions. This
configuration, with centre of mass energies ranging from
$\sqrt{s_{\rm{NN}}}=115~\rm{GeV}$ in $p-p$ interactions to
$\sqrt{s_{\rm{NN}}}=72~\rm{GeV}$ in heavy ion collisions, allows to cover a
wide backward rapidity region, including the poorly explored high$-x$ regime.
With the instrumentation of the proposed target system, LHCb will become the
first experiment simultaneously collecting unpolarised beam-beam collisions at
$\sqrt{s_{\rm{NN}}}=14~\rm{TeV}$ and both unpolarised and polarised beam-target
collisions. The status of the project is presented along with a selection of
physics opportunities.
","[{""version"":""v1"",""created"":""Mon, 8 Nov 2021 13:59:24 GMT""}]","2021-11-09"
"2111.04516","Anthony P. Jones","A. P. Jones","Dust evolution, a global view: III. Core/mantle grains, organic
  nano-globules, comets and surface chemistry","36 pages, 13 figures, 2 tables","RSOS published 2016",,,"astro-ph.GA","http://arxiv.org/licenses/nonexclusive-distrib/1.0/","  Within the framework of The Heterogeneous dust Evolution Model at the IaS
(THEMIS) this work investigates in detail the surface processes and chemistry
relating to core/mantle interstellar and cometary grain structures and its
influence on the nature of these fascinating particles. It appears that a
realistic consideration of the nature and chemical reactivity of interstellar
grain surfaces could self-consistently and within a coherent framework explain:
the anomalous oxygen depletion, the nature of the CO dark gas, the formation of
'polar ice' mantles, the red wing on the 3 um water ice band, the basis for the
O-rich chemistry observed in hot cores, the origin of organic nano-globules and
the \sim 3.2 um 'carbonyl' absorption band observed in comet reflectance
spectra. It is proposed that the reaction of gas phase species with
carbonaceous a- C(:H) grain surfaces in the interstellar medium, in particular
the incorporation of atomic oxygen into grain surfaces in epoxide functional
groups, is the key to explaining these observations. Thus, the chemistry of
cosmic dust is much more intimately related with that of the interstellar gas
than has previously been considered. The current models for interstellar gas
and dust chemistry will therefore most likely need to be fundamentally modified
to include these new grain surface processes.
","[{""version"":""v1"",""created"":""Mon, 8 Nov 2021 14:00:00 GMT""}]","2021-11-09"
