"2111.04235","Ying Li","Zhao-Wu Liu, Zhi-Tian Zou, Ying Li, Xin Liu, Jie Wang","Charmless $B_s\to V S$ Decays in PQCD Approach","18 Pages, 3 Figures",,"10.1140/epjc/s10052-022-10016-6",,"hep-ph","http://creativecommons.org/licenses/by/4.0/","  In this work, we investigate the $B_s\to V S$ decays in the perturbative QCD
approach, where $V$ and $S$ denote the vector meson and scalar meson
respectively. Based on the two-quark structure, considering two different
scenarios for describing the scalar mesons, we calculate the branching
fractions and the direct $CP$ asymmetries of all $B_s\to VS$ decays. Most
branching fractions are predicted to be at $10^{-7}$ to $10^{-5}$, which could
be measured in the LHCb and Belle-II experiments, especially for these
color-allowed $B_s\to \kappa(800)(K_0^*(1430))K^*$ decays. It is found that the
branching fractions of $B_s\to K_0^{*0}(1430)\bar{K}^{*0}$ and $B_s\to
K_0^{*+}(1430)\bar{K}^{*-}$ are very sensitive to the scenarios, which can be
used to determine whether $K_0^{*0}(1430)$ belongs to the ground state or the
first excited state, if the data were available. We also note that some decays
have large direct $CP$ asymmetries, some of which are also sensitive to the
scenarios, such as the $B_s \to a_0^+(1450)K^{*-}$ and the $B_s\to f_0(1500)
K^{*0}$ decays. Since the experimental measurements of $B_s\to VS$ decays are
on the way, combined with the available data in the future, we expect the
theoretical predictions will shed light on the structure of the scalar mesons.
","[{""version"":""v1"",""created"":""Mon, 8 Nov 2021 02:15:16 GMT""}]","2022-02-09"
"2111.04236","Hirotoshi Hirai PhD","Hirotoshi Hirai and Sho Koh","Non-adiabatic Quantum Wavepacket Dynamics Simulation Based on Electronic
  Structure Calculations using the Variational Quantum Eigensolver",,,"10.1016/j.chemphys.2022.111460",,"quant-ph","http://creativecommons.org/licenses/by/4.0/","  A non-adiabatic nuclear wavepacket dynamics simulation of the H$_2$O$^+$
de-excitation process is performed based on electronic structure calculations
using the variational quantum eigensolver. The adiabatic potential energy
surfaces and non-adiabatic coupling vectors are computed with algorithms for
noisy intermediate-scale quantum devices, and time propagation is simulated
with conventional methods for classical computers. The results of non-adiabatic
transition dynamics from the $\tilde{B}$ state to $\tilde{A}$ state reproduce
the trend reported in previous studies, which suggests that this
quantum-classical hybrid scheme may be a useful application for noisy
intermediate-scale quantum devices.
","[{""version"":""v1"",""created"":""Mon, 8 Nov 2021 02:16:27 GMT""}]","2022-03-02"
"2111.04237","Zhiyuan Yang","Jianfei Guo, Zhiyuan Yang, Xi Lin, Qingfu Zhang","Template NeRF: Towards Modeling Dense Shape Correspondences from
  Category-Specific Object Images","10 pages, 8 figures",,,,"cs.CV","http://creativecommons.org/licenses/by/4.0/","  We present neural radiance fields (NeRF) with templates, dubbed
Template-NeRF, for modeling appearance and geometry and generating dense shape
correspondences simultaneously among objects of the same category from only
multi-view posed images, without the need of either 3D supervision or
ground-truth correspondence knowledge. The learned dense correspondences can be
readily used for various image-based tasks such as keypoint detection, part
segmentation, and texture transfer that previously require specific model
designs. Our method can also accommodate annotation transfer in a one or
few-shot manner, given only one or a few instances of the category. Using
periodic activation and feature-wise linear modulation (FiLM) conditioning, we
introduce deep implicit templates on 3D data into the 3D-aware image synthesis
pipeline NeRF. By representing object instances within the same category as
shape and appearance variation of a shared NeRF template, our proposed method
can achieve dense shape correspondences reasoning on images for a wide range of
object classes. We demonstrate the results and applications on both synthetic
and real-world data with competitive results compared with other methods based
on 3D information.
","[{""version"":""v1"",""created"":""Mon, 8 Nov 2021 02:16:48 GMT""}]","2021-11-09"
"2111.04238","Gabriel Larotonda","Daniel Beltita, Gabriel Larotonda","Unitary group orbits versus groupoid orbits of normal operators","39 pages",,,,"math.FA math.DG math.OA","http://arxiv.org/licenses/nonexclusive-distrib/1.0/","  We study the unitary orbit of a normal operator $a\in \mathcal B(\mathcal
H)$, regarded as a homogeneous space for the action of unitary groups
associated with symmetrically normed ideals of compact operators. We show with
an unified treatment that the orbit is a submanifold of the differing ambient
spaces if and only if the spectrum of $a$ is finite, and in that case it is a
closed submanifold. For arithmetically mean closed ideals, we show that
nevertheless the orbit always has a natural manifold structure, modeled by the
kernel of a suitable conditional expectation. When the spectrum of $a$ is not
finite, we describe the closure of the orbits of $a$ for the different norm
topologies involved. We relate these results to the action of the groupoid of
the partial isometries via the moment map given by the range projection of
normal operators. We show that all these groupoid orbits also have
differentiable structures for which the target map is a smooth submersion. For
any normal operator $a$ we also describe the norm closure of its groupoid orbit
${\mathcal O}_a$, which leads to necessary and sufficient spectral conditions
on $a$ ensuring that ${\mathcal O}_a$ is norm closed and that ${\mathcal O}_a$
is a closed embedded submanifold of $\mathcal B(\mathcal H)$.
","[{""version"":""v1"",""created"":""Mon, 8 Nov 2021 02:20:38 GMT""}]","2021-11-09"
"2111.04239","Haoliang Sun","Haoliang Sun, Chenhui Guo, Qi Wei, Zhongyi Han, Yilong Yin","Learning to Rectify for Robust Learning with Noisy Labels",,,,,"cs.LG","http://arxiv.org/licenses/nonexclusive-distrib/1.0/","  Label noise significantly degrades the generalization ability of deep models
in applications. Effective strategies and approaches, \textit{e.g.}
re-weighting, or loss correction, are designed to alleviate the negative impact
of label noise when training a neural network. Those existing works usually
rely on the pre-specified architecture and manually tuning the additional
hyper-parameters. In this paper, we propose warped probabilistic inference
(WarPI) to achieve adaptively rectifying the training procedure for the
classification network within the meta-learning scenario. In contrast to the
deterministic models, WarPI is formulated as a hierarchical probabilistic model
by learning an amortization meta-network, which can resolve sample ambiguity
and be therefore more robust to serious label noise. Unlike the existing
approximated weighting function of directly generating weight values from
losses, our meta-network is learned to estimate a rectifying vector from the
input of the logits and labels, which has the capability of leveraging
sufficient information lying in them. This provides an effective way to rectify
the learning procedure for the classification network, demonstrating a
significant improvement of the generalization ability. Besides, modeling the
rectifying vector as a latent variable and learning the meta-network can be
seamlessly integrated into the SGD optimization of the classification network.
We evaluate WarPI on four benchmarks of robust learning with noisy labels and
achieve the new state-of-the-art under variant noise types. Extensive study and
analysis also demonstrate the effectiveness of our model.
","[{""version"":""v1"",""created"":""Mon, 8 Nov 2021 02:25:50 GMT""}]","2021-11-09"
"2111.04240","Shinichiro Akiyama","Shinichiro Akiyama, Yoshinobu Kuramashi, Yusuke Yoshimura","Quantum Field Theories with Tensor Renormalization Group","25 pages, 20 figures, Proceedings of the 38th International Symposium
  on Lattice Field Theory, LATTICE2021 26th-30th July 2021,
  Zoom/Gather@Massachusetts Institute of Technology",,"10.22323/1.396.0530","UTHEP-763, UTCCS-P-142","hep-lat cond-mat.stat-mech","http://creativecommons.org/licenses/by/4.0/","  We report recent progress on the application of the tensor renormalization
group (TRG) to quantum field theories pursued by the Tsukuba group. We explain
how to treat the scalar, fermion, and gauge theories with the TRG method
presenting the results for the phase transitions in the (3+1)-dimensional
((3+1)$d$) complex $\phi^4$ theory at finite density, (1+1)$d$ pure U(1)
lattice gauge theory with a $\theta$ term, (3+1)$d$ Nambu--Jona-Lasinio model
at finite density and (1+1)$d$ and (2+1)$d$ Hubbard models at an arbitrary
chemical potential. It is demonstrated that the TRG method is free from the
sign problem in practical calculations and applicable to the four-dimensional
models.
","[{""version"":""v1"",""created"":""Mon, 8 Nov 2021 02:34:05 GMT""}]","2022-09-21"
"2111.04241","Sh\=an Hu\'ang","Shan Huang (for the LUXE Collaboration)","LUXE: A new experiment to study non-perturbative QED in electron-laser
  and photon-laser collisions","Conference proceedings for PANIC 2021 parallel talk on 5 Sep 2021, to
  be published in the Proceedings of Science; minor wording changes and
  adjustments",,"10.22323/1.380.0429",,"hep-ph hep-ex physics.ins-det physics.optics","http://creativecommons.org/licenses/by-nc-nd/4.0/","  LUXE (Laser Und XFEL Experiment) is a new experiment in planning at DESY
Hamburg using the electron beam of the European XFEL. LUXE is intended to study
collisions between a high-intensity optical laser and 16.5 GeV electrons from
the XFEL electron beam, as well as collisions between the optical laser and
high-energy secondary photons. The physics objective of LUXE are processes of
quantum electrodynamics (QED) at the strong-field frontier, where the
electromagnetic field of the laser is above the Schwinger limit. In this
regime, QED is non-perturbative. This manifests itself in the creation of
physical electron-positron pairs from the QED vacuum, similar to Hawking
radiation from black holes. LUXE intends to measure the positron production
rate in an unprecedented laser intensity regime. An overview of the LUXE
experimental setup and its challenges will be given, followed by a discussion
of the expected physics reach in the context of testing QED in the
non-perturbative regime.
","[{""version"":""v1"",""created"":""Mon, 8 Nov 2021 02:34:48 GMT""},{""version"":""v2"",""created"":""Sun, 6 Mar 2022 19:54:24 GMT""}]","2022-03-16"
"2111.04242","Michael V. Klibanov","Michael V. Klibanov, Jingzhi Li, Wenlong Zhang","A globally convergent numerical method for a 3D coefficient inverse
  problem for a wave-like equation",,,,,"math.NA cs.NA","http://arxiv.org/licenses/nonexclusive-distrib/1.0/","  A version of the convexification globally convergent numerical method is
constructed for a coefficient inverse problem for a wave-like partial
differential equation. The presence of the Carleman Weight Function in the
corresponding Tikhonov-like cost functional ensures the global strict convexity
of this functional. Numerical results are presented to illustrate the
effectiveness and efficiency of the proposed method.
","[{""version"":""v1"",""created"":""Mon, 8 Nov 2021 02:40:14 GMT""}]","2021-11-09"
"2111.04243","Erhai Zhao","Eric Zou, Erik Long, and Erhai Zhao","Learning a compass spin model with neural network quantum states","published version","Journal of Physics: Condensed Matter 34, 125802 (2022)","10.1088/1361-648X/ac43ff",,"cond-mat.str-el cond-mat.dis-nn quant-ph","http://arxiv.org/licenses/nonexclusive-distrib/1.0/","  Neural network quantum states provide a novel representation of the many-body
states of interacting quantum systems and open up a promising route to solve
frustrated quantum spin models that evade other numerical approaches. Yet its
capacity to describe complex magnetic orders with large unit cells has not been
demonstrated, and its performance in a rugged energy landscape has been
questioned. Here we apply restricted Boltzmann machines and stochastic gradient
descent to seek the ground states of a compass spin model on the honeycomb
lattice, which unifies the Kitaev model, Ising model and the quantum
120$^\circ$ model with a single tuning parameter. We report calculation results
on the variational energy, order parameters and correlation functions. The
phase diagram obtained is in good agreement with the predictions of tensor
network ansatz, demonstrating the capacity of restricted Boltzmann machines in
learning the ground states of frustrated quantum spin Hamiltonians. The
limitations of the calculation are discussed. A few strategies are outlined to
address some of the challenges in machine learning frustrated quantum magnets.
","[{""version"":""v1"",""created"":""Mon, 8 Nov 2021 02:40:24 GMT""},{""version"":""v2"",""created"":""Tue, 18 Jan 2022 15:01:42 GMT""}]","2022-01-19"
"2111.04244","Reed Essick","Reed Essick","Selection Effects in Periodic X-ray Data from Maximizing Detection
  Statistics","10 pages, 5 figures",,"10.3847/1538-4357/ac517c",,"astro-ph.HE astro-ph.IM gr-qc","http://arxiv.org/licenses/nonexclusive-distrib/1.0/","  The Neutron Star Interior Composition Explorer (NICER) records data of
exceptional quality on the energy-dependent X-ray pulse profile of pulsars.
However, in searching for evidence of pulsations, Guillot et al. (2019)
introduce a procedure to select an ordered subset of the data that maximizes a
detection statistic (the H-test). I show that this procedure can degrade
subsequent analyses using an idealized model with a stationary expected count
rates from both noise and signal. Specifically, the data-selection procedure
biases the inferred mean count rate to be too low, biases the inferred
pulsation amplitude to be too high, and that the size of these biases scales
strongly with the amount of data that is rejected and the true signal
amplitude. The procedure also alters the null-distribution of the H-test
rendering nominal detection significance estimates overly optimistic. While the
idealized model does not capture all the complexities of real NICER data, it
suggests that these biases could be important for NICER's observations of
J0740+6620 and other faint pulsars (observations of J0030+0451 are likely less
affected). I estimate that these selection effects may introduce a bias of
$\mathcal{O}(10\%)$ on average in the inferred modulation depth of lightcurves
like J0740+6620's, and may be as large as $\mathcal{O}(50\%)$ for fainter
pulsars. However, the change for a single dataset like J0740+6620 is expected
to be a shift between $-5\%$ and $+20\%$. This could imply that the lower limit
on J0740+6620's radius is slightly larger than it should be, although
preliminary investigations suggest the change in the radius constraints are
$\mathcal{O}(1\%)$ with real J0740+6620 data.
","[{""version"":""v1"",""created"":""Mon, 8 Nov 2021 02:43:41 GMT""}]","2022-03-30"
"2111.04245","Kenta Ueyama","Ji-Wei He and Kenta Ueyama","Twisted Segre products","23 pages, v2: a few typos were fixed, v3: minor updates",,,,"math.RA math.RT","http://arxiv.org/licenses/nonexclusive-distrib/1.0/","  We introduce the notion of the twisted Segre product $A\circ_\psi B$ of
$\mathbb Z$-graded algebras $A$ and $B$ with respect to a twisting map $\psi$.
It is proved that if $A$ and $B$ are noetherian Koszul Artin-Schelter regular
algebras and $\psi$ is a twisting map such that the twisted Segre product
$A\circ_\psi B$ is noetherian, then $A\circ_\psi B$ is a noncommutative graded
isolated singularity. To prove this result, the notion of densely (bi-)graded
algebras is introduced. Moreover, we show that the twisted Segre product
$A\circ_\psi B$ of $A=k[u,v]$ and $B=k[x,y]$ with respect to a diagonal
twisting map $\psi$ is a noncommutative quadric surface (so in particular it is
noetherian), and we compute the stable category of graded maximal
Cohen-Macaulay modules over it.
","[{""version"":""v1"",""created"":""Mon, 8 Nov 2021 02:46:57 GMT""},{""version"":""v2"",""created"":""Tue, 16 Nov 2021 06:09:32 GMT""},{""version"":""v3"",""created"":""Thu, 4 Aug 2022 13:34:21 GMT""}]","2022-08-05"
"2111.04246","Vladislav Medvedev","Vladislav Medvedev and Evgeny Zhuzhoma","Smale regular and chaotic A-homeomorphisms and A-diffeomorphisms","arXiv admin note: substantial text overlap with arXiv:1811.07764",,,,"math.DS","http://arxiv.org/licenses/nonexclusive-distrib/1.0/","  We introduce Smale A-homeomorphisms that includes regular, semi-chaotic,
chaotic, and super chaotic homeomorphisms of topo\-lo\-gi\-cal $n$-manifold
$M^n$, $n\geq 2$. Smale A-homeo\-mor\-p\-hisms contain A-diffeomorphisms (in
particular, structurally stable diffeomorphisms) provided $M^n$ admits a smooth
structure. Regular A-homeomorphisms contain all Morse-Smale diffeomorphisms,
while semi-chaotic and chaotic A-homeomorphisms contain A-diffeo\-mor\-p\-hisms
with trivial and nontrivial basic sets. Super chaotic A-homeo\-mor\-p\-hisms
contain A-diffeomorphisms whose basic sets are nontrivial. We describe
invariant sets that determine completely dynamics of regular, semi-chaotic, and
chaotic Smale A-homeo\-mor\-p\-hisms. This allows us to get necessary and
sufficient conditions of conjugacy for these Smale A-homeomorp\-hisms. We apply
this necessary and sufficient conditions for structu\-ral\-ly stable surface
diffeomorphisms with arbitrary number of one-dimensional expanding attractors.
We also use this conditions to get the complete classification of Morse-Smale
diffeomorphisms on projective-like $n$-manifolds for $n=2,8,16$.
","[{""version"":""v1"",""created"":""Mon, 8 Nov 2021 02:55:17 GMT""}]","2021-11-09"
"2111.04247","Sheikh Ziauddin Ahmed","Sheikh Z. Ahmed, Yaohua Tan, Jiyuan Zheng, Joe C. Campbell and Avik W.
  Ghosh","Biaxial Strain Modulated Valence Band Engineering in III-V Digital
  Alloys",,,"10.1103/PhysRevB.106.035301",,"cond-mat.mtrl-sci","http://creativecommons.org/licenses/by-nc-nd/4.0/","  Some III-V digital alloy avalanche photodiodes exhibit low excess noise.
These alloys have low hole ionization coefficients due to presence of small
'minigaps', enhanced effective mass and large separation between light-hole and
split-off bands in the valence band. In this letter, an explanation for the
formation of the minigaps using a tight binding picture is provided.
Furthermore, we demonstrate that decreasing substrate lattice constant can
increase the minigap size and mass in the transport direction. This leads to
reduced quantum tunneling and phonon scattering of the holes. Finally, we
illustrate the band structure modification with substrate lattice constant for
other III-V digital alloys.
","[{""version"":""v1"",""created"":""Mon, 8 Nov 2021 03:00:22 GMT""}]","2022-07-20"
"2111.04248","Mingxi Cheng","Mingxi Cheng, Junyao Zhang, Shahin Nazarian, Jyotirmoy Deshmukh, Paul
  Bogdan","Trust-aware Control for Intelligent Transportation Systems",,"Cheng,M., Zhang, J., Nazarian, S., Deshmukh, J. & Bogdan, P.,
  Trust-aware Control for Intelligent Transportation Systemsin, in Proceedings
  of the 32th IEEE Intelligent Vehicle Symposium(2021)",,,"cs.AI cs.MA","http://creativecommons.org/licenses/by-nc-nd/4.0/","  Many intelligent transportation systems are multi-agent systems, i.e., both
the traffic participants and the subsystems within the transportation
infrastructure can be modeled as interacting agents. The use of AI-based
methods to achieve coordination among the different agents systems can provide
greater safety over transportation systems containing only human-operated
vehicles, and also improve the system efficiency in terms of traffic
throughput, sensing range, and enabling collaborative tasks. However, increased
autonomy makes the transportation infrastructure vulnerable to compromised
vehicular agents or infrastructure. This paper proposes a new framework by
embedding the trust authority into transportation infrastructure to
systematically quantify the trustworthiness of agents using an epistemic logic
known as subjective logic. In this paper, we make the following novel
contributions: (i) We propose a framework for using the quantified
trustworthiness of agents to enable trust-aware coordination and control. (ii)
We demonstrate how to synthesize trust-aware controllers using an approach
based on reinforcement learning. (iii) We comprehensively analyze an autonomous
intersection management (AIM) case study and develop a trust-aware version
called AIM-Trust that leads to lower accident rates in scenarios consisting of
a mixture of trusted and untrusted agents.
","[{""version"":""v1"",""created"":""Mon, 8 Nov 2021 03:02:25 GMT""}]","2021-11-09"
"2111.04249","Kazuo Hosomichi","Kazuo Hosomichi and Kohei Suzuki","Supersymmetric vortex loops in 3D gauge theories","58 pages; v2: a section added in the appendix, version to appear in
  JHEP",,"10.1007/JHEP04(2022)027",,"hep-th","http://arxiv.org/licenses/nonexclusive-distrib/1.0/","  We give a precise definition of BPS vortex loops in 3D non-abelian gauge
theories with ${\cal N}=2$ SUSY by the path integral over fields with a
prescribed singular behavior. We compute the expectation value of a BPS vortex
loop on an ellipsoid. Using the result we revisit the known equivalence between
Wilson and vortex loops in pure Chern-Simons theory. Naive computations of
expectation values in ${\cal N}=2$ theory leads to an unwanted shift of
parameters in the rule of correspondence. We resolve the problem by relating
the shift to the global anomaly of ${\cal N}=2$ SUSY quantum mechanics. For
theories with $U(N)$ gauge group we also develop an alternative description of
vortex loops in terms of 1D ${\cal N}=2$ SUSY quantum mechanics on their
worldline. For vortex loops in ${\cal N}=4$ theories, our construction
reproduces some of the quiver GLSMs of Assel and Gomis.
","[{""version"":""v1"",""created"":""Mon, 8 Nov 2021 03:06:19 GMT""},{""version"":""v2"",""created"":""Wed, 6 Apr 2022 01:05:34 GMT""}]","2022-04-27"
