"2111.04348","Raul St\""uhler","Raul St\""uhler, Andr\'e Kowalewski, Felix Reis, Dimitri Jungblut,
  Fernando Dominguez, Benedikt Scharf, Gang Li, J\""org Sch\""afer, Ewelina M.
  Hankiewicz, Ralph Claessen","Lifting topological protection in a quantum spin Hall insulator by edge
  coupling",,,,,"cond-mat.mes-hall","http://arxiv.org/licenses/nonexclusive-distrib/1.0/","  The scientific interest in two-dimensional topological insulators (2D TIs) is
currently shifting from a more fundamental perspective to the exploration and
design of novel functionalities. Key concepts for the use of 2D TIs in
spintronics are based on the topological protection and spin-momentum locking
of their helical edge states. In this study we present experimental evidence
that topological protection can be (partially) lifted by pairwise coupling of
2D TI edges in close proximity. Using direct wave function mapping via scanning
tunneling microscopy/spectroscopy (STM/STS) we compare isolated and coupled
topological edges in the 2D TI bismuthene. The latter situation is realized by
natural lattice line defects and reveals distinct quasi-particle interference
(QPI) patterns, identified as electronic Fabry-P\'erot resonator modes. In
contrast, free edges show no sign of any single-particle backscattering. These
results pave the way for novel device concepts based on active control of
topological protection through inter-edge hybridization for, e.g., electronic
Fabry-P\'erot interferometry.
","[{""version"":""v1"",""created"":""Mon, 8 Nov 2021 09:09:20 GMT""}]","2021-11-09"
"2111.04349","Anne-Laure Dalibard","Anne-Laure Dalibard (LJLL (UMR\_7598), DMA), Charlotte Perrin (I2M)","Local and global well-posedness of one-dimensional free-congested
  equations",,,,,"math.AP","http://arxiv.org/licenses/nonexclusive-distrib/1.0/","  This paper is dedicated to the study of a one-dimensional congestion model,
consisting of two different phases. In the congested phase, the pressure is
free and the dynamics is incompressible, whereas in the non-congested phase,
the fluid obeys a pressureless compressible dynamics. We investigate the Cauchy
problem for initial data which are small perturbations in the non-congested
zone of travelling wave profiles. We prove two different results. First, we
show that for arbitrarily large perturbations, the Cauchy problem is locally
well-posed in weighted Sobolev spaces. The solution we obtain takes the form
(vs, us)(t, x -- x(t)), where x < x(t) is the congested zone and x > x(t) is
the non-congested zone. The set {x = x(t)} is a free surface, whose evolution
is coupled with the one of the solution. Second, we prove that if the initial
perturbation is sufficiently small, then the solution is global. This stability
result relies on coercivity properties of the linearized operator around a
travelling wave, and on the introduction of a new unknown which satisfies
better estimates than the original one. In this case, we also prove that
travelling waves are asymptotically stable.
","[{""version"":""v1"",""created"":""Mon, 8 Nov 2021 09:11:59 GMT""}]","2021-11-09"
"2111.04350","Gabriel Koch","Joseph P. Davies and Gabriel S. Koch","Notions of solution and weak-strong uniqueness criteria for the
  Navier-Stokes equations in Lorentz spaces","21 pages",,,,"math.AP","http://arxiv.org/licenses/nonexclusive-distrib/1.0/","  For initial data $f\in L^{2}(\mathbb{R}^n)$ ($n\geq 2$), we prove that if
$p\in(n,\infty]$, any solution $u\in L_{t}^{\infty}L_{x}^{2}\cap
L_{t}^{2}H_{x}^{1}\cap L_{t}^{\frac{2p}{p-n}}L_{x}^{p,\infty}$ to the
Navier-Stokes equations satisfies the energy equality, and that such a solution
$u$ is unique among all solutions $v\in L_{t}^{\infty}L_{x}^{2}\cap
L_{t}^{2}H_{x}^{1}$ satisfying the energy inequality. This extends well-known
results due to G. Prodi (1959) and J. Serrin (1963), which treated the Lebesgue
space $L_{x}^{p}$ rather than the larger Lorentz (and `weak Lebesgue') space
$L_{x}^{p,\infty}$. In doing so, we also prove the equivalence of various
notions of solutions in $L_{x}^{p,\infty}$, generalizing in particular a result
proved for the Lebesgue setting in Fabes-Jones-Riviere (1972).
","[{""version"":""v1"",""created"":""Mon, 8 Nov 2021 09:12:23 GMT""},{""version"":""v2"",""created"":""Tue, 8 Feb 2022 11:43:21 GMT""}]","2022-02-09"
"2111.04351","Alastair Abbott","Marie Ioannou, Pavel Sekatski, Alastair A. Abbott, Denis Rosset,
  Jean-Daniel Bancal, and Nicolas Brunner","Receiver-Device-Independent Quantum Key Distribution Protocols","Updated to journal version. See also the companion paper where a
  proof-of-principle experiment is reported arXiv:2104.14574","New J. Phys. 24 063006 (2022)","10.1088/1367-2630/ac71bc",,"quant-ph","http://creativecommons.org/licenses/by/4.0/","  We discuss quantum key distribution protocols and their security analysis,
considering a receiver-device-independent (RDI) model. The sender's (Alice's)
device is partially characterized, in the sense that we assume bounds on the
overlaps of the prepared quantum states. The receiver's (Bob's) device requires
no characterisation and can be represented as a black-box. Our protocols are
therefore robust to any attack on Bob, such as blinding attacks. In particular,
we show that a secret key can be established even when the quantum channel has
arbitrarily low transmission by considering RDI protocols exploiting
sufficiently many states. Finally, we discuss how the hypothesis of bounded
overlaps can be naturally applied to practical devices.
","[{""version"":""v1"",""created"":""Mon, 8 Nov 2021 09:12:41 GMT""},{""version"":""v2"",""created"":""Fri, 8 Jul 2022 09:25:13 GMT""}]","2022-07-11"
"2111.04352","Lincon Souza","Lincon S. Souza, Naoya Sogi, Bernardo B. Gatto, Takumi Kobayashi and
  Kazuhiro Fukui","Grassmannian learning mutual subspace method for image set recognition",,,,,"cs.CV","http://arxiv.org/licenses/nonexclusive-distrib/1.0/","  This paper addresses the problem of object recognition given a set of images
as input (e.g., multiple camera sources and video frames). Convolutional neural
network (CNN)-based frameworks do not exploit these sets effectively,
processing a pattern as observed, not capturing the underlying feature
distribution as it does not consider the variance of images in the set. To
address this issue, we propose the Grassmannian learning mutual subspace method
(G-LMSM), a NN layer embedded on top of CNNs as a classifier, that can process
image sets more effectively and can be trained in an end-to-end manner. The
image set is represented by a low-dimensional input subspace; and this input
subspace is matched with reference subspaces by a similarity of their canonical
angles, an interpretable and easy to compute metric. The key idea of G-LMSM is
that the reference subspaces are learned as points on the Grassmann manifold,
optimized with Riemannian stochastic gradient descent. This learning is stable,
efficient and theoretically well-grounded. We demonstrate the effectiveness of
our proposed method on hand shape recognition, face identification, and facial
emotion recognition.
","[{""version"":""v1"",""created"":""Mon, 8 Nov 2021 09:16:36 GMT""}]","2021-11-09"
"2111.04353","Ezra Fielding","Ezra Fielding, Clement N. Nyirenda, Mattia Vaccari","A Comparison of Deep Learning Architectures for Optical Galaxy
  Morphology Classification",,,"10.1109/ICECET52533.2021.9698414",,"cs.LG astro-ph.GA astro-ph.IM","http://creativecommons.org/licenses/by/4.0/","  The classification of galaxy morphology plays a crucial role in understanding
galaxy formation and evolution. Traditionally, this process is done manually.
The emergence of deep learning techniques has given room for the automation of
this process. As such, this paper offers a comparison of deep learning
architectures to determine which is best suited for optical galaxy morphology
classification. Adapting the model training method proposed by Walmsley et al
in 2021, the Zoobot Python library is used to train models to predict Galaxy
Zoo DECaLS decision tree responses, made by volunteers, using EfficientNet B0,
DenseNet121 and ResNet50 as core model architectures. The predicted results are
then used to generate accuracy metrics per decision tree question to determine
architecture performance. DenseNet121 was found to produce the best results, in
terms of accuracy, with a reasonable training time. In future, further testing
with more deep learning architectures could prove beneficial.
","[{""version"":""v1"",""created"":""Mon, 8 Nov 2021 09:19:32 GMT""}]","2022-04-06"
"2111.04354","Thomas Gu\'erin","M. Mangeat, T. Gu\'erin, D.S. Dean","Effective diffusivity of Brownian particles in a two dimensional square
  lattice of hard disks",,"J. Chem. Phys. 152, 234109 (2020)","10.1063/5.0009095",,"cond-mat.stat-mech","http://creativecommons.org/licenses/by/4.0/","  We revisit the classic problem of the effective diffusion constant of a
Brownian particle in a square lattice of reflecting impenetrable hard disks.
This diffusion constant is also related to the effective conductivity of
non-conducting and infinitely conductive disks in the same geometry. We show
how a recently derived Green's function for the periodic lattice can be
exploited to derive a series expansion of the diffusion constant in terms of
the disk's volume fraction $\varphi$. Secondly we propose a variant of the
Fick-Jacobs approximation to study the large volume fraction limit. This
combination of analytical results is shown to describe the behavior of the
diffusion constant for all volume fractions.
","[{""version"":""v1"",""created"":""Mon, 8 Nov 2021 09:21:25 GMT""}]","2021-11-09"
"2111.04355","John Russo","John Russo, Flavio Romano, Lukas Kroc, Francesco Sciortino, Lorenzo
  Rovigatti, Petr Sulc","SAT-assembly: A new approach for designing self-assembling systems","12 pages, 4 figures",,"10.1088/1361-648X/ac5479",,"cond-mat.soft cond-mat.mtrl-sci","http://arxiv.org/licenses/nonexclusive-distrib/1.0/","  We propose a general framework for solving inverse self-assembly problems,
i.e. designing interactions between elementary units such that they assemble
spontaneously into a predetermined structure. Our approach uses patchy
particles as building blocks, where the different units bind at specific
interaction sites (the patches), and we exploit the possibility of having
mixtures with several components. The interaction rules between the patches is
determined by transforming the combinatorial problem into a Boolean
satisfiability problem (SAT) which searches for solutions where all bonds are
formed in the target structure. Additional conditions, such as the
non-satisfiability of competing structures (e.g. metastable states) can be
imposed, allowing to effectively design the assembly path in order to avoid
kinetic traps. We demonstrate this approach by designing and numerically
simulating a cubic diamond structure from four particle species that assembles
without competition from other polymorphs, including the hexagonal structure.
","[{""version"":""v1"",""created"":""Mon, 8 Nov 2021 09:26:48 GMT""},{""version"":""v2"",""created"":""Tue, 1 Feb 2022 18:46:38 GMT""}]","2022-07-13"
"2111.04356","Chennakesava Kadapa","Chennakesava Kadapa, Xinyu Wang, Yue Mei","A comprehensive assessment of accuracy of adaptive integration of cut
  cells for laminar fluid-structure interaction problems","37 pages",,,,"cs.CE cs.NA math.NA","http://creativecommons.org/licenses/by/4.0/","  Finite element methods based on cut-cells are becoming increasingly popular
because of their advantages over formulations based on body-fitted meshes for
problems with moving interfaces. In such methods, the cells (or elements) which
are cut by the interface between two different domains need to be integrated
using special techniques in order to obtain optimal convergence rates and
accurate fluxes across the interface. The adaptive integration technique in
which the cells are recursively subdivided is one of the popular techniques for
the numerical integration of cut-cells due to its advantages over tessellation,
particularly for problems involving complex geometries in three dimensions.
Although adaptive integration does not impose any limitations on the
representation of the geometry of immersed solids as it requires only point
location algorithms, it becomes computationally expensive for recovering
optimal convergence rates. This paper presents a comprehensive assessment of
the adaptive integration of cut-cells for applications in computational fluid
dynamics and fluid-structure interaction. We assess the effect of the accuracy
of integration of cut cells on convergence rates in velocity and pressure
fields, and then on forces and displacements for fluid-structure interaction
problems by studying several examples in two and three dimensions. By taking
the computational cost and the accuracy of forces and displacements into
account, we demonstrate that numerical results of acceptable accuracy for FSI
problems involving laminar flows can be obtained with only fewer levels of
refinement. In particular, we show that three levels of adaptive refinement are
sufficient for obtaining force and displacement values of acceptable accuracy
for laminar fluid-structure interaction problems.
","[{""version"":""v1"",""created"":""Mon, 8 Nov 2021 09:35:59 GMT""},{""version"":""v2"",""created"":""Thu, 14 Jul 2022 20:37:24 GMT""}]","2022-07-18"
"2111.04357","Inigo Val Slijepcevic","Inigo V. Slijepcevic, Anna M. M. Scaife","Can semi-supervised learning reduce the amount of manual labelling
  required for effective radio galaxy morphology classification?","Accepted in: Fourth Workshop on Machine Learning and the Physical
  Sciences (35th Conference on Neural Information Processing Systems;
  NeurIPS2021); final version",,,,"astro-ph.GA cs.LG","http://creativecommons.org/licenses/by/4.0/","  In this work, we examine the robustness of state-of-the-art semi-supervised
learning (SSL) algorithms when applied to morphological classification in
modern radio astronomy. We test whether SSL can achieve performance comparable
to the current supervised state of the art when using many fewer labelled data
points and if these results generalise to using truly unlabelled data. We find
that although SSL provides additional regularisation, its performance degrades
rapidly when using very few labels, and that using truly unlabelled data leads
to a significant drop in performance.
","[{""version"":""v1"",""created"":""Mon, 8 Nov 2021 09:36:48 GMT""},{""version"":""v2"",""created"":""Tue, 9 Nov 2021 16:49:05 GMT""},{""version"":""v3"",""created"":""Wed, 1 Dec 2021 10:13:09 GMT""},{""version"":""v4"",""created"":""Tue, 1 Feb 2022 12:22:23 GMT""}]","2022-02-02"
"2111.04358","Aljo\v{s}a Peperko","S. M. Manjegani, A. Peperko, H. Shokooh Saljooghi","Asymptotic formulae and inequalities for point spectrum in max algebra",,,,,"math.FA","http://arxiv.org/licenses/nonexclusive-distrib/1.0/","  We prove new explicit asymptotic formulae between (geometric) eigenvalues in
max-algebra and classical distinguished eigenvalues of nonnegative matrices,
which are useful tools for transferring results between both settings. We
establish new inequalities for both types of eigenvalues of Hadamard products
and Hadamard weighted geometric means of nonnegative matrices. Moreover, a
version of the spectral mapping theorem for the distinguished spectrum is
pointed out.
","[{""version"":""v1"",""created"":""Mon, 8 Nov 2021 09:41:36 GMT""}]","2021-11-09"
"2111.04359","Burhan Gulbahar","Burhan Gulbahar","K-sparse Pure State Tomography with Phase Estimation","19 pages, 5 figures, edited v2",,,,"quant-ph cs.CC physics.optics","http://creativecommons.org/licenses/by/4.0/","  Quantum state tomography (QST) for reconstructing pure states requires
exponentially increasing resources and measurements with the number of qubits
by using state-of-the-art quantum compressive sensing (CS) methods. In this
article, QST reconstruction for any pure state composed of the superposition of
$K$ different computational basis states of $n$ qubits in a specific
measurement set-up, i.e., denoted as $K$-sparse, is achieved without any
initial knowledge and with quantum polynomial-time complexity of resources
based on the assumption of the existence of polynomial size quantum circuits
for implementing exponentially large powers of a specially designed unitary
operator. The algorithm includes $\mathcal{O}(2 \, / \, \vert c_{k}\vert^2)$
repetitions of conventional phase estimation algorithm depending on the
probability $\vert c_{k}\vert^2$ of the least possible basis state in the
superposition and $\mathcal{O}(d \, K \,(log K)^c)$ measurement settings with
conventional quantum CS algorithms independent from the number of qubits while
dependent on $K$ for constant $c$ and $d$. Quantum phase estimation algorithm
is exploited based on the favorable eigenstructure of the designed operator to
represent any pure state as a superposition of eigenvectors. Linear optical
set-up is presented for realizing the special unitary operator which includes
beam splitters and phase shifters where propagation paths of single photon are
tracked with which-path-detectors. Quantum circuit implementation is provided
by using only CNOT, phase shifter and $- \pi \, / \, 2$ rotation gates around
X-axis in Bloch sphere, i.e., $R_{X}(- \pi \, / \, 2)$, allowing to be realized
in NISQ devices. Open problems are discussed regarding the existence of the
unitary operator and its practical circuit implementation.
","[{""version"":""v1"",""created"":""Mon, 8 Nov 2021 09:43:12 GMT""},{""version"":""v2"",""created"":""Mon, 15 Nov 2021 09:13:10 GMT""}]","2021-11-16"
"2111.04360","Du\v{s}an D. Repov\v{s}","K. Kefi, D.D. Repov\v{s}, K. Saoudi","On weak solutions for fourth-order problems involving the Leray-Lions
  type operators",,"Math. Meth. Appl. Sci. 44:17 (2021), 13060-13068","10.1002/mma.7606",,"math.AP math.FA","http://arxiv.org/licenses/nonexclusive-distrib/1.0/","  We investigate existence and multiplicity of weak solutions for fourth-order
problems involving the Leray-Lions type operators in variable exponent spaces
and improve a result of Bonanno and Chinn\`{i} (2011). We use variational
methods and apply a multiplicity theorem of Bonanno and Marano (2010).
","[{""version"":""v1"",""created"":""Mon, 8 Nov 2021 09:43:22 GMT""}]","2021-11-09"
"2111.04361","Cyrill Scheidegger","Cyrill Scheidegger, Julia H\""orrmann and Peter B\""uhlmann","The Weighted Generalised Covariance Measure",,,,,"stat.ME","http://arxiv.org/licenses/nonexclusive-distrib/1.0/","  We introduce a new test for conditional independence which is based on what
we call the weighted generalised covariance measure (WGCM). It is an extension
of the recently introduced generalised covariance measure (GCM). To test the
null hypothesis of X and Y being conditionally independent given Z, our test
statistic is a weighted form of the sample covariance between the residuals of
nonlinearly regressing X and Y on Z. We propose different variants of the test
for both univariate and multivariate X and Y . We give conditions under which
the tests yield the correct type I error rate. Finally, we compare our novel
tests to the original GCM using simulation and on real data sets. Typically,
our tests have power against a wider class of alternatives compared to the GCM.
This comes at the cost of having less power against alternatives for which the
GCM already works well. In the special case of binary or categorical X and Y ,
one of our tests has power against all alternatives.
","[{""version"":""v1"",""created"":""Mon, 8 Nov 2021 09:45:30 GMT""},{""version"":""v2"",""created"":""Mon, 16 May 2022 09:10:50 GMT""}]","2022-05-17"
"2111.04362","Klara Borowa","Klara Borowa, Robert Dwornik and Andrzej Zalewski","Is knowledge the key? An experiment on debiasing architectural
  decision-making -- a pilot study","PROFES 2021",,"10.1007/978-3-030-91452-3_14",,"cs.SE","http://arxiv.org/licenses/nonexclusive-distrib/1.0/","  The impact of cognitive biases on architectural decision-making has been
proven by previous research. In this work, we endeavour to create a debiasing
treatment that would minimise the impact of cognitive biases on architectural
decision-making. We conducted a pilot study on two groups of students, to
investigate whether a simple debiasing presentation reporting on the influences
of cognitive biases, can provide a debiasing effect. The preliminary results
show that this kind of treatment is ineffective. Through analysing our results,
we propose a set of modifications that could result in a better effect.
","[{""version"":""v1"",""created"":""Mon, 8 Nov 2021 09:53:16 GMT""},{""version"":""v2"",""created"":""Tue, 9 Nov 2021 09:36:47 GMT""}]","2021-11-25"
"2111.04363","Jun Yue","Zhipeng Gao, Changqing Xi, Jun Yue","The restrained double Roman domination and graph operations",,,,,"math.CO","http://creativecommons.org/licenses/by/4.0/","  Let $G=(V(G),E(G))$ be a simple graph. A restrained double Roman dominating
function (RDRD-function) of $G$ is a function $f: V(G) \rightarrow \{0,1,2,3\}$
satisfying the following properties: if $f(v)=0$, then the vertex $v$ has at
least two neighbours assigned 2 under $f$ or one neighbour $u$ with $f(u)=3$;
and if $f(v)=1$, then the vertex $v$ must have one neighbor $u$ with $f(u) \geq
2$; the induced graph by vertices assigned 0 under $f$ contains no isolated
vertex. The weight of a RDRD-function $f$ is the sum $f(V)=\sum_{v \in V(G)}
f(v)$, and the minimum weight of a RDRD-function on $G$ is the restrained
double Roman domination number (RDRD-number) of $G$, denoted by
$\gamma_{rdR}(G)$. In this paper, we first prove that the problem of computing
RDRD-number is NP-hard even for chordal graphs. And then we study the impact of
some graph operations, such as strong product, cardinal product and corona with
a graph, on restrained double Roman domination number.
","[{""version"":""v1"",""created"":""Mon, 8 Nov 2021 09:53:34 GMT""}]","2021-11-09"
"2111.04364","Dan Radu Grigore","D. R. Grigore","A New Formula for the Gauge Charge","13 pages. arXiv admin note: substantial text overlap with
  arXiv:2007.01115; text overlap with arXiv:1612.04998",,,,"hep-th","http://arxiv.org/licenses/nonexclusive-distrib/1.0/","  We present a new formula for the gauge charge in the causal formalism for the
QCD case.
","[{""version"":""v1"",""created"":""Mon, 8 Nov 2021 09:54:22 GMT""}]","2021-11-09"
"2111.04365","Nicolas Monod","Nicolas Monod, Sam Nariman","Bounded and unbounded cohomology of homeomorphism and diffeomorphism
  groups","v3: Major revision to include also diffeomorphisms and an answer to a
  question by Ghys. v4: Some statements from v3 about the case of R^n have been
  removed. v5: Expanded some of the preliminary lemmas; this version to appear
  in Inv. Math",,,,"math.GT math.AT math.GR","http://creativecommons.org/licenses/by/4.0/","  We determine the bounded cohomology of the group of homeomorphisms of certain
low-dimensional manifolds. In particular, for the group of
orientation-preserving homeomorphisms of the circle and of the closed 2-disc,
it is isomorphic to the polynomial ring generated by the bounded Euler class.
These seem to be the first examples of groups for which the entire bounded
cohomology can be described without being trivial.
  We further prove that, contrary to ordinary cohomology, the diffeomorphisms
groups of the circle and of the closed 2-disc have the same bounded cohomology
as their homeomorphism groups and that both differ from the ordinary
cohomology.
  Finally, we determine the low-dimensional bounded cohomology of homeo- and
diffeomorphism of the spheres $S^n$ and of certain 3-manifolds. In particular,
we answer a question of Ghys by showing that the Euler class in
$H^4(Homeo_\circ(S^3))$ is unbounded.
","[{""version"":""v1"",""created"":""Mon, 8 Nov 2021 09:55:47 GMT""},{""version"":""v2"",""created"":""Sat, 20 Nov 2021 20:17:56 GMT""},{""version"":""v3"",""created"":""Mon, 27 Dec 2021 10:26:11 GMT""},{""version"":""v4"",""created"":""Tue, 8 Mar 2022 15:04:17 GMT""},{""version"":""v5"",""created"":""Mon, 30 Jan 2023 06:33:24 GMT""}]","2023-01-31"
"2111.04366","Francesca Saviella Benanti","F. S. Benanti, A. Valenti","*-Graded Capelli Polynomials and their Asymptotic",,,,,"math.RA","http://creativecommons.org/licenses/by/4.0/","  Let $F\langle Y \cup Z, \ast \rangle$ be the free $\ast$-superalgebra over a
field $F$ of characteristic zero and let $ \Gamma^\ast_{M^{\pm}, L^{\pm}} $ be
the $T^\ast_{\mathbb{Z}_2}$-ideal generated by the set of the $\ast$-graded
Capelli polynomials
  $Cap^{(\mathbb{Z}_2, \ast)}_{M^+} [Y^+,X]$, $Cap^{(\mathbb{Z}_2, \ast)}_{M^-}
[Y^-,X]$, $Cap^{(\mathbb{Z}_2, \ast)}_{L^+} [Z^+,X]$, $Cap^{(\mathbb{Z}_2,
\ast)}_{L^-} [Z^-,X]$ alternating on $M^+$ symmetric variables of homogeneous
degree zero, on $M^-$ skew variables of homogeneous degree zero, on $L^+$
symmetric variables of homogeneous degree one and on $L^-$ skew variables of
homogeneous degree one, respectively.
  We study the asymptotic behavior of the sequence of $\ast$-graded
codimensions of $\Gamma^\ast_{M^{\pm}, L^{\pm}}.$ In particular we prove that
the $\ast$-graded codimensions of the finite dimensional simple
$\ast$-superalgebras are asymptotically equal to the $\ast$-graded codimensions
of $\Gamma^\ast_{M^{\pm}, L^{\pm}}$, for some fixed natural numbers $M^+, M^-,
L^+$ and $L^-$.
","[{""version"":""v1"",""created"":""Mon, 8 Nov 2021 10:03:09 GMT""}]","2021-11-09"
