"2109.00082","Jan Kopanski","Jan Kopanski and Krzysztof Rzadca","Plan-based Job Scheduling for Supercomputers with Shared Burst Buffers","27th International Conference on Parallel and Distributed Computing,
  Lisbon, Portugal, September 1-3, 2021, Proceedings; Corrected line 19 in
  Algorithm 2","Euro-Par 2021: Parallel Processing pp 120-135","10.1007/978-3-030-85665-6_8",,"cs.DC","http://arxiv.org/licenses/nonexclusive-distrib/1.0/","  The ever-increasing gap between compute and I/O performance in HPC platforms,
together with the development of novel NVMe storage devices (NVRAM), led to the
emergence of the burst buffer concept - an intermediate persistent storage
layer logically positioned between random-access main memory and a parallel
file system. Despite the development of real-world architectures as well as
research concepts, resource and job management systems, such as Slurm, provide
only marginal support for scheduling jobs with burst buffer requirements, in
particular ignoring burst buffers when backfilling. We investigate the impact
of burst buffer reservations on the overall efficiency of online job scheduling
for common algorithms: First-Come-First-Served (FCFS) and Shortest-Job-First
(SJF) EASY-backfilling. We evaluate the algorithms in a detailed simulation
with I/O side effects. Our results indicate that the lack of burst buffer
reservations in backfilling may significantly deteriorate scheduling. We also
show that these algorithms can be easily extended to support burst buffers.
Finally, we propose a burst-buffer-aware plan-based scheduling algorithm with
simulated annealing optimisation, which improves the mean waiting time by over
20% and mean bounded slowdown by 27% compared to the burst-buffer-aware
SJF-EASY-backfilling.
","[{""version"":""v1"",""created"":""Tue, 31 Aug 2021 21:16:47 GMT""},{""version"":""v2"",""created"":""Sat, 8 Jan 2022 17:51:18 GMT""}]","2022-01-11"
"2109.00083","Yasir Noori","Yasir J Noori, Shibin Thomas, Sami Ramadan, Victoria K. Greenacre,
  Nema M. Abdelazim, Yisong Han, Jiapei Zhang, Richard Beanland, Andrew L.
  Hector, Norbert Klein, Gillian Reid, Philip Bartlett, Cornelis H. de Groot","Electrodeposited WS$_2$ Monolayers on Fabricated Graphene Electrodes","9 pages, 5 figures",,,,"physics.app-ph cond-mat.mtrl-sci","http://creativecommons.org/licenses/by/4.0/","  The development of scalable techniques to make 2D material heterostructures
is a major obstacle that needs to be overcome before these materials can be
implemented in device technologies industrially. Electrodeposition is an
industrially compatible deposition technique that offers unique advantages in
scaling 2D heterostructures. In this work, we demonstrate the electrodeposition
of atomic layers of WS$_2$ over graphene electrodes using a single source
precursor. Using conventional microfabrication techniques, graphene was
patterned to create micro-electrodes where WS$_2$ was site-selectively
deposited to form 2D heterostructures. We used various characterisation
techniques, including atomic force microscopy, transmission electron
microscopy, Raman spectroscopy and x-ray photoelectron spectroscopy to show
that our electrodeposited WS$_2$ layers are highly uniform and can be grown
over graphene at a controllable deposition rate. This technique to selectively
deposit TMDCs over microfabricated graphene electrodes paves the way towards
wafer-scale production of 2D material heterostructures for nanodevice
applications.
","[{""version"":""v1"",""created"":""Tue, 31 Aug 2021 21:31:08 GMT""}]","2021-09-02"
"2109.00084","Alexey Svyatkovskiy","Alexey Svyatkovskiy, Sarah Fakhoury, Negar Ghorbani, Todd Mytkowicz,
  Elizabeth Dinella, Christian Bird, Jinu Jang, Neel Sundaresan, Shuvendu
  Lahiri","Program Merge Conflict Resolution via Neural Transformers","ESEC/FSE '22 camera ready version. 12 pages, 4 figures, online
  appendix",,"10.1145/3540250.3549163",,"cs.SE cs.CL","http://arxiv.org/licenses/nonexclusive-distrib/1.0/","  Collaborative software development is an integral part of the modern software
development life cycle, essential to the success of large-scale software
projects. When multiple developers make concurrent changes around the same
lines of code, a merge conflict may occur. Such conflicts stall pull requests
and continuous integration pipelines for hours to several days, seriously
hurting developer productivity. To address this problem, we introduce
MergeBERT, a novel neural program merge framework based on token-level
three-way differencing and a transformer encoder model. By exploiting the
restricted nature of merge conflict resolutions, we reformulate the task of
generating the resolution sequence as a classification task over a set of
primitive merge patterns extracted from real-world merge commit data. Our model
achieves 63-68% accuracy for merge resolution synthesis, yielding nearly a 3x
performance improvement over existing semi-structured, and 2x improvement over
neural program merge tools. Finally, we demonstrate that MergeBERT is
sufficiently flexible to work with source code files in Java, JavaScript,
TypeScript, and C# programming languages. To measure the practical use of
MergeBERT, we conduct a user study to evaluate MergeBERT suggestions with 25
developers from large OSS projects on 122 real-world conflicts they
encountered. Results suggest that in practice, MergeBERT resolutions would be
accepted at a higher rate than estimated by automatic metrics for precision and
accuracy. Additionally, we use participant feedback to identify future avenues
for improvement of MergeBERT.
","[{""version"":""v1"",""created"":""Tue, 31 Aug 2021 21:37:53 GMT""},{""version"":""v2"",""created"":""Wed, 8 Sep 2021 16:28:18 GMT""},{""version"":""v3"",""created"":""Wed, 21 Sep 2022 21:06:42 GMT""},{""version"":""v4"",""created"":""Tue, 29 Nov 2022 05:25:10 GMT""}]","2022-11-30"
"2109.00085","Michael Mackey","Michael Mackey and Pauline Mellon","The Bergmann-Shilov boundary of a bounded symmetric domain","Submitted","Mathematical Proceedings of the Royal Irish Academy, 121A (2021),
  33-49","10.3318/PRIA.2021.121.03",,"math.CV math.FA math.OA","http://creativecommons.org/licenses/by-nc-nd/4.0/","  We show that there are many sets in the boundary of a bounded symmetric
domain that determine the values and norm of holomorphic functions on the
domain having continuous extensions to the boundary. We provide an analogue of
the Bergmann-Shilov boundary for finite rank JB*-triples.
","[{""version"":""v1"",""created"":""Tue, 31 Aug 2021 21:42:11 GMT""},{""version"":""v2"",""created"":""Tue, 14 Dec 2021 13:56:25 GMT""}]","2022-07-27"
"2109.00086","Toshiaki Inada","Toshiaki Inada, Wonho Jang, Yutaro Iiyama, Koji Terashi, Ryu Sawada,
  Junichi Tanaka, Shoji Asai","Measurement-Free Ultrafast Quantum Error Correction by Using
  Multi-Controlled Gates in Higher-Dimensional State Space","6 pages, 4 figures, plus supplement, fixed inactive hyperrefs",,,,"quant-ph","http://arxiv.org/licenses/nonexclusive-distrib/1.0/","  Quantum error correction is a crucial step beyond the current
noisy-intermediate-scale quantum device towards fault-tolerant quantum
computing. However, most of the error corrections ever demonstrated rely on
post-selection of events or post-correction of states, based on measurement
results repeatedly recorded during circuit execution. On the other hand,
real-time error correction is supposed to be performed through classical
feedforward of the measurement results to data qubits. It provides unavoidable
latency from conditional electronics that would limit the scalability of the
next-generation quantum processors. Here we propose a new approach to real-time
error correction that is free from measurement and realized by using
multi-controlled gates based on higher-dimensional state space. Specifically,
we provide a series of novel decompositions of a Toffoli gate by using the
lowest three energy levels of a transmon that significantly reduce the number
of two-qubit gates and discuss their essential features, such as extendability
to an arbitrary number of control qubits, the necessity of exclusively
controlled NOT gates, and usefulness of their incomplete variants. Combined
with the recently demonstrated schemes of fast two-qubit gates and
all-microwave qubit reset, it would substantially shorten the time required for
error correction and resetting ancilla qubits compared to a measurement-based
approach and provide an error correction rate of $\gtrsim1$~MHz with high
accuracy for three-qubit bit- and phase-flip errors.
","[{""version"":""v1"",""created"":""Tue, 31 Aug 2021 21:44:14 GMT""},{""version"":""v2"",""created"":""Mon, 6 Sep 2021 11:27:15 GMT""}]","2021-09-07"
"2109.00087","Tuhin Chakrabarty Mr","Tuhin Chakrabarty, Yejin Choi, Vered Shwartz","It's not Rocket Science : Interpreting Figurative Language in Narratives","Accepted to TACL ( To be presented at ACL 2022, Dublin)",,,,"cs.CL cs.LG","http://creativecommons.org/licenses/by/4.0/","  Figurative language is ubiquitous in English. Yet, the vast majority of NLP
research focuses on literal language. Existing text representations by design
rely on compositionality, while figurative language is often non-compositional.
In this paper, we study the interpretation of two non-compositional figurative
languages (idioms and similes). We collected datasets of fictional narratives
containing a figurative expression along with crowd-sourced plausible and
implausible continuations relying on the correct interpretation of the
expression. We then trained models to choose or generate the plausible
continuation. Our experiments show that models based solely on pre-trained
language models perform substantially worse than humans on these tasks. We
additionally propose knowledge-enhanced models, adopting human strategies for
interpreting figurative language types : inferring meaning from the context and
relying on the constituent words' literal meanings. The knowledge-enhanced
models improve the performance on both the discriminative and generative tasks,
further bridging the gap from human performance.
","[{""version"":""v1"",""created"":""Tue, 31 Aug 2021 21:46:35 GMT""},{""version"":""v2"",""created"":""Wed, 23 Feb 2022 17:37:22 GMT""},{""version"":""v3"",""created"":""Tue, 1 Mar 2022 21:52:17 GMT""}]","2022-03-03"
"2109.00088","Katie Fasbender","Katie M. Fasbender and David L. Nidever","Exploring the Solar System with the NOIRLab Source Catalog I: Detecting
  Objects with CANFind","18 pages, 14 figures, 4 tables",,"10.3847/1538-3881/ac2230",,"astro-ph.IM astro-ph.EP","http://arxiv.org/licenses/nonexclusive-distrib/1.0/","  Despite extensive searches and the relative proximity of solar system objects
(SSOS) to Earth, many remain undiscovered and there is still much to learn
about their properties and interactions. This work is the first in a series
dedicated to detecting and analyzing SSOs in the all-sky NOIRLab Source Catalog
(NSC). We search the first data release of the NSC with CANFind, a
Computationally Automated NSC tracklet Finder. NSC DR1 contains 34 billion
measurements of 2.9 billion unique objects, which CANFind categorizes as
belonging to ""stationary"" (distant stars, galaxies) or moving (SSOs) objects
via an iterative clustering method. Detections of stationary bodies for proper
motion (mu) less than 2.5""/hr (0.017 degrees/day) are identified and analyzed
separately. Remaining detections belonging to hi-mu objects are clustered
together over single nights to form ""tracklets"". Each tracklet contains
detections of an individual moving object, and is validated based on spatial
linearity and motion through time. Proper motions are then calculated and used
to connect tracklets and other unassociated measurements over multiple nights
by predicting their locations at common times forming ""tracks"". This method
extracted 527,055 tracklets from NSC DR1 in an area covering 29,971 square
degrees of the sky. The data show distinct groups of objects with similar
observed mu in ecliptic coordinates, namely Main Belt Asteroids, Jupiter
Trojans, and Kuiper Belt Objects. Apparent magnitudes range from 10-25 mag in
the ugrizY and VR bands. Color-color diagrams show a bimodality of tracklets
between primarily carbonaceous and siliceous groups, supporting prior studies.
","[{""version"":""v1"",""created"":""Tue, 31 Aug 2021 21:49:17 GMT""}]","2021-11-24"
"2109.00089","Ralf Kircheis","Ralf Kircheis","Coagulapathies after vaccination against SARS-CoV-2 may be derived from
  a combination effect of SARS-CoV-2 spike protein and adenovirus
  vector-triggered signaling pathways",,,,,"q-bio.CB q-bio.BM q-bio.MN","http://creativecommons.org/licenses/by/4.0/","  The novel coronavirus SARS-CoV-2 has resulted in a global pandemic with
worldwide 6-digital infection rates and thousands death tolls daily. Enormeous
effords are undertaken to achieve high coverage of immunization in order to
reach herd immunity to stop spreading of SARS-CoV-2 infection. Several
SARS-CoV-2 vaccines, based either on mRNA, viral vectors, or inactivated
SARS-CoV-2 virus have been approved and are being applied worldwide. However,
recently increased numbers of normally very rare types of thromboses associated
with thrombocytopenia have been reported in particular in the context of the
adenoviral vector vaccine ChAdOx1 nCoV-19 from Astra Zeneca. While statistical
prevalence of these side effects seem to correlate with this particular vaccine
type, i.e. adenonoviral vector based vaccines, the exact molecular mechanisms
are still not clear. The present review summarizes current data and hypotheses
for molecular and cellular mechanisms into one integrated hypothesis indicating
that coagulopathies, including thromboses, thrombocytopenia and other related
side effects are correlated to an interplay of the two components in the
vaccine, i.e. the spike antigen and the adenoviral vector, with the innate and
immune system which under certain circumstances can imitate the picture of a
limited COVID-19 pathological picture.
","[{""version"":""v1"",""created"":""Tue, 31 Aug 2021 21:50:34 GMT""}]","2021-09-02"
"2109.00090","Sarouyeh Khoshkholgh","Sarouyeh Khoshkholgh, Ivanka Orozova-Bekkevold and Klaus Mosegaard","Evolution of the Stress and Strain field in the Tyra field during the
  Post-Chalk Deposition and Seismic Inversion of fault zone using
  Informed-Proposal Monte Carlo",,,,,"physics.geo-ph","http://arxiv.org/licenses/nonexclusive-distrib/1.0/","  When hydrocarbon reservoirs are used as a CO2 storage facility, an accurate
uncertainty analysis and risk assessment is essential. An integration of
information from geological knowledge, geological modelling, well log data, and
geophysical data provides the basis for this analysis. Modelling the time
development of stress/strain changes in the overburden provides prior knowledge
about fault and fracture probability in the reservoir, which in turn is used in
seismic inversion to constrain models of faulting and fracturing. One main
problem in solving large scale seismic inverse problems is high computational
cost and inefficiency. We use a newly introduced methodology --
Informed-proposal Monte Carlo (IPMC) -- to deal with this problem, and to carry
out a conceptual study based on real data from the Danish North Sea. The result
outlines a methodology for evaluating the risk of having subseismic faulting in
the overburden that potentially compromises the CO2 storage of the reservoir.
","[{""version"":""v1"",""created"":""Tue, 31 Aug 2021 21:51:12 GMT""}]","2021-09-02"
"2109.00091","Guenter Sigl","Guenter Sigl","Simulations of Fast Neutrino Flavor Conversions with Interactions in
  Inhomogeneous Media","20 pages, 10 figures consisting of 37 pdf files in total; additional
  references and small updates",,"10.1103/PhysRevD.105.043005",,"hep-ph astro-ph.HE","http://arxiv.org/licenses/nonexclusive-distrib/1.0/","  We investigate toy models for spatial and temporal instabilities in
collective neutrino oscillations induced by neutrino self-interactions, with
special emphasis on inhomogeneous systems with densities following a profile.
Simulations are based on a mathematica program that solves the Liouville
equation with or without vacuum terms, refractive terms from a background
medium, and neutrino-neutrino forward scattering, in one space dimension and in
time. A discrete number of momentum modes are characterized by the neutrino
velocity projection on the spatial direction. We also consider the effects of
charged current interaction source terms and neutral current scattering
contributions. We find that refractive effects from the medium, in particular
for density distributions with a profile, and neutral current non-forward
scattering off the background medium can strongly influence fast collective
flavor transformations. Specifically we find that if both are present, fast
flavor conversions can be strongly suppressed or at least delayed.
","[{""version"":""v1"",""created"":""Tue, 31 Aug 2021 21:53:12 GMT""},{""version"":""v2"",""created"":""Tue, 5 Oct 2021 16:14:41 GMT""}]","2022-02-23"
"2109.00092","Yeonjong Shin","Zhen Zhang, Yeonjong Shin, George Em Karniadakis","GFINNs: GENERIC Formalism Informed Neural Networks for Deterministic and
  Stochastic Dynamical Systems",,,"10.1098/rsta.2021.0207",,"math.DS cs.LG","http://creativecommons.org/licenses/by-nc-sa/4.0/","  We propose the GENERIC formalism informed neural networks (GFINNs) that obey
the symmetric degeneracy conditions of the GENERIC formalism. GFINNs comprise
two modules, each of which contains two components. We model each component
using a neural network whose architecture is designed to satisfy the required
conditions. The component-wise architecture design provides flexible ways of
leveraging available physics information into neural networks. We prove
theoretically that GFINNs are sufficiently expressive to learn the underlying
equations, hence establishing the universal approximation theorem. We
demonstrate the performance of GFINNs in three simulation problems: gas
containers exchanging heat and volume, thermoelastic double pendulum and the
Langevin dynamics. In all the examples, GFINNs outperform existing methods,
hence demonstrating good accuracy in predictions for both deterministic and
stochastic systems.
","[{""version"":""v1"",""created"":""Tue, 31 Aug 2021 22:01:33 GMT""}]","2022-07-13"
"2109.00093","Micha{\l} Grzybowski","M. J. Grzybowski, C. F. Schippers, O. Gomonay, K. Rubi, M. E. Bal, U.
  Zeitler, A. Kozio{\l}-Rachwa{\l}, M. Szpytma, W. Janus, B. Kurowska, S. Kret,
  M. Gryglas-Borysiewicz, B. Koopmans and H. J. M. Swagten","Antiferromagnetic Hysteresis above the Spin Flop Field",,,,,"cond-mat.mtrl-sci cond-mat.mes-hall","http://creativecommons.org/licenses/by/4.0/","  Magnetocrystalline anisotropy is essential in the physics of antiferromagnets
and commonly treated as a constant, not depending on an external magnetic
field. However, we demonstrate that in CoO the anisotropy should necessarily
depend on the magnetic field, which is shown by the spin Hall magnetoresistance
of the CoO $|$ Pt device. Below the N\'eel temperature CoO reveals a spin-flop
transition at 240 K at 7.0 T, above which a hysteresis in the angular
dependence of magnetoresistance unexpectedly persists up to 30 T. This behavior
is shown to agree with the presence of the unquenched orbital momentum, which
can play an important role in antiferromagnetic spintronics.
","[{""version"":""v1"",""created"":""Tue, 31 Aug 2021 22:05:35 GMT""},{""version"":""v2"",""created"":""Mon, 21 Nov 2022 08:38:13 GMT""}]","2022-11-22"
"2109.00094","Jeffrey Kuan","Jeffrey Kuan, Tadahiro Oh, and Sun\v{c}ica \v{C}ani\'c","Probabilistic global well-posedness for a viscous nonlinear wave
  equation modeling fluid-structure interaction","26 pages",,,,"math.AP","http://arxiv.org/licenses/nonexclusive-distrib/1.0/","  We prove probabilistic well-posedness for a 2D viscous nonlinear wave
equation modeling fluid-structure interaction between a 3D incompressible,
viscous Stokes flow and nonlinear elastodynamics of a 2D stretched membrane.
The focus is on (rough) data, often arising in real-life problems, for which it
is known that the deterministic problem is ill-posed. We show that random
perturbations of such data give rise almost surely to the existence of a unique
solution. More specifically, we prove almost sure global well-posedness for a
viscous nonlinear wave equation with the subcritical initial data in the
Sobolev space $\mathcal{H}^s (\mathbb{R}^2)$, $s > - \frac 15$, which are
randomly perturbed using Wiener randomization. This result shows ""robustness""
of nonlinear FSI problems/models, and provides confidence that even for the
""rough data"" (data in $\mathcal{H}^s$, $s > -\frac 1 5$) random perturbations
of such data (due to e.g., randomness in real-life data, numerical
discretization, etc.) will almost surely provide a unique solution which
depends continuously on the data in the $\mathcal{H}^s$ topology.
","[{""version"":""v1"",""created"":""Tue, 31 Aug 2021 22:06:31 GMT""},{""version"":""v2"",""created"":""Thu, 2 Jun 2022 19:41:23 GMT""},{""version"":""v3"",""created"":""Mon, 6 Jun 2022 13:59:34 GMT""}]","2022-06-07"
"2109.00095","Ido Ben-Yair","Ido Ben-Yair, Gil Ben Shalom, Moshe Eliasof, Eran Treister","Quantized Convolutional Neural Networks Through the Lens of Partial
  Differential Equations",,,,,"cs.LG","http://arxiv.org/licenses/nonexclusive-distrib/1.0/","  Quantization of Convolutional Neural Networks (CNNs) is a common approach to
ease the computational burden involved in the deployment of CNNs, especially on
low-resource edge devices. However, fixed-point arithmetic is not natural to
the type of computations involved in neural networks. In this work, we explore
ways to improve quantized CNNs using PDE-based perspective and analysis. First,
we harness the total variation (TV) approach to apply edge-aware smoothing to
the feature maps throughout the network. This aims to reduce outliers in the
distribution of values and promote piece-wise constant maps, which are more
suitable for quantization. Secondly, we consider symmetric and stable variants
of common CNNs for image classification, and Graph Convolutional Networks
(GCNs) for graph node-classification. We demonstrate through several
experiments that the property of forward stability preserves the action of a
network under different quantization rates. As a result, stable quantized
networks behave similarly to their non-quantized counterparts even though they
rely on fewer parameters. We also find that at times, stability even aids in
improving accuracy. These properties are of particular interest for sensitive,
resource-constrained, low-power or real-time applications like autonomous
driving.
","[{""version"":""v1"",""created"":""Tue, 31 Aug 2021 22:18:52 GMT""},{""version"":""v2"",""created"":""Wed, 3 Aug 2022 13:22:54 GMT""}]","2022-08-04"
"2109.00096","Eric Bahuaud","Eric Bahuaud, Christine Guenther, James Isenberg","Sectoriality of the Laplacian on Asymptotically Hyperbolic Spaces","This manuscript is no longer intended for publication and has been
  replaced by our new work at arXiv:2210.15886 which corrects and extends these
  results",,,,"math.AP math.DG","http://creativecommons.org/licenses/by/4.0/","  We prove that both the Laplacian on functions, and the Lichnerowicz Laplacian
on symmetric 2-tensors with respect to asymptotically hyperbolic metrics, are
sectorial maps in weighted H\""older spaces. As an application, the machinery of
analytic semigroups then applies to yield well-posedness results for parabolic
evolution equations in these spaces.
","[{""version"":""v1"",""created"":""Tue, 31 Aug 2021 22:20:41 GMT""},{""version"":""v2"",""created"":""Tue, 18 Apr 2023 22:08:45 GMT""}]","2023-04-20"
"2109.00097","Tobias Fischer","Tobias Fischer","Bio-inspired robot perception coupled with robot-modeled human
  perception","Paper accepted to the ""Robotics: Science and Systems Pioneers
  Workshop 2021""",,,,"cs.RO cs.CV","http://arxiv.org/licenses/nonexclusive-distrib/1.0/","  My overarching research goal is to provide robots with perceptional abilities
that allow interactions with humans in a human-like manner. To develop these
perceptional abilities, I believe that it is useful to study the principles of
the human visual system. I use these principles to develop new computer vision
algorithms and validate their effectiveness in intelligent robotic systems. I
am enthusiastic about this approach as it offers the dual benefit of uncovering
principles inherent in the human visual system, as well as applying these
principles to its artificial counterpart. Fig. 1 contains a depiction of my
research.
","[{""version"":""v1"",""created"":""Tue, 31 Aug 2021 22:22:55 GMT""}]","2021-09-02"
