"2109.00220","Li Xu","LHCb collaboration: R. Aaij, A.S.W. Abdelmotteleb, C. Abell\'an
  Beteta, T. Ackernley, B. Adeva, M. Adinolfi, H. Afsharnia, C. Agapopoulou,
  C.A. Aidala, S. Aiola, Z. Ajaltouni, S. Akar, J. Albrecht, F. Alessio, M.
  Alexander, A. Alfonso Albero, Z. Aliouche, G. Alkhazov, P. Alvarez Cartelle,
  S. Amato, J.L. Amey, Y. Amhis, L. An, L. Anderlini, A. Andreianov, M.
  Andreotti, F. Archilli, A. Artamonov, M. Artuso, K. Arzymatov, E. Aslanides,
  M. Atzeni, B. Audurier, S. Bachmann, M. Bachmayer, J.J. Back, P. Baladron
  Rodriguez, V. Balagura, W. Baldini, J. Baptista Leite, M. Barbetti, R.J.
  Barlow, S. Barsuk, W. Barter, M. Bartolini, F. Baryshnikov, J.M. Basels, S.
  Bashir, G. Bassi, B. Batsukh, A. Battig, A. Bay, A. Beck, M. Becker, F.
  Bedeschi, I. Bediaga, A. Beiter, V. Belavin, S. Belin, V. Bellee, K. Belous,
  I. Belov, I. Belyaev, G. Bencivenni, E. Ben-Haim, A. Berezhnoy, R. Bernet, D.
  Berninghoff, H.C. Bernstein, C. Bertella, A. Bertolin, C. Betancourt, F.
  Betti, Ia. Bezshyiko, S. Bhasin, J. Bhom, L. Bian, M.S. Bieker, S. Bifani, P.
  Billoir, M. Birch, F.C.R. Bishop, A. Bitadze, A. Bizzeti, M. Bj{\o}rn, M.P.
  Blago, T. Blake, F. Blanc, S. Blusk, D. Bobulska, J.A. Boelhauve, O. Boente
  Garcia, T. Boettcher, A. Boldyrev, A. Bondar, N. Bondar, S. Borghi, M.
  Borisyak, M. Borsato, J.T. Borsuk, S.A. Bouchiba, T.J.V. Bowcock, A. Boyer,
  C. Bozzi, M.J. Bradley, S. Braun, A. Brea Rodriguez, M. Brodski, J.
  Brodzicka, A. Brossa Gonzalo, D. Brundu, A. Buonaura, L. Buonincontri, A.T.
  Burke, C. Burr, A. Bursche, A. Butkevich, J.S. Butter, J. Buytaert, W.
  Byczynski, S. Cadeddu, H. Cai, R. Calabrese, L. Calefice, L. Calero Diaz, S.
  Cali, R. Calladine, M. Calvi, M. Calvo Gomez, P. Camargo Magalhaes, P.
  Campana, A.F. Campoverde Quezada, S. Capelli, L. Capriotti, A. Carbone, G.
  Carboni, R. Cardinale, A. Cardini, I. Carli, P. Carniti, L. Carus, K.
  Carvalho Akiba, A. Casais Vidal, G. Casse, M. Cattaneo, G. Cavallero, S.
  Celani, J. Cerasoli, D. Cervenkov, A.J. Chadwick, M.G. Chapman, M. Charles,
  Ph. Charpentier, G. Chatzikonstantinidis, C.A. Chavez Barajas, M.
  Chefdeville, C. Chen, S. Chen, A. Chernov, V. Chobanova, S. Cholak, M.
  Chrzaszcz, A. Chubykin, V. Chulikov, P. Ciambrone, M.F. Cicala, X. Cid Vidal,
  G. Ciezarek, P.E.L. Clarke, M. Clemencic, H.V. Cliff, J. Closier, J.L.
  Cobbledick, V. Coco, J.A.B. Coelho, J. Cogan, E. Cogneras, L. Cojocariu, P.
  Collins, T. Colombo, L. Congedo, A. Contu, N. Cooke, G. Coombs, I.
  Corredoira, G. Corti, C.M. Costa Sobral, B. Couturier, D.C. Craik, J.
  Crkovsk\'a, M. Cruz Torres, R. Currie, C.L. Da Silva, S. Dadabaev, L. Dai, E.
  Dall'Occo, J. Dalseno, C. D'Ambrosio, A. Danilina, P. d'Argent, J.E. Davies,
  A. Davis, O. De Aguiar Francisco, K. De Bruyn, S. De Capua, M. De Cian, J.M.
  De Miranda, L. De Paula, M. De Serio, D. De Simone, P. De Simone, J.A. de
  Vries, C.T. Dean, D. Decamp, V. Dedu, L. Del Buono, B. Delaney, H.-P.
  Dembinski, A. Dendek, V. Denysenko, D. Derkach, O. Deschamps, F. Desse, F.
  Dettori, B. Dey, A. Di Cicco, P. Di Nezza, S. Didenko, L. Dieste Maronas, H.
  Dijkstra, V. Dobishuk, C. Dong, A.M. Donohoe, F. Dordei, A.C. dos Reis, L.
  Douglas, A. Dovbnya, A.G. Downes, M.W. Dudek, L. Dufour, V. Duk, P. Durante,
  J.M. Durham, D. Dutta, A. Dziurda, A. Dzyuba, S. Easo, U. Egede, V.
  Egorychev, S. Eidelman, S. Eisenhardt, S. Ek-In, L. Eklund, S. Ely, A. Ene,
  E. Epple, S. Escher, J. Eschle, S. Esen, T. Evans, A. Falabella, J. Fan, Y.
  Fan, B. Fang, S. Farry, D. Fazzini, M. F\'eo, A. Fernandez Prieto, A.D.
  Fernez, F. Ferrari, L. Ferreira Lopes, F. Ferreira Rodrigues, S. Ferreres
  Sole, M. Ferrillo, M. Ferro-Luzzi, S. Filippov, R.A. Fini, M. Fiorini, M.
  Firlej, K.M. Fischer, D.S. Fitzgerald, C. Fitzpatrick, T. Fiutowski, A.
  Fkiaras, F. Fleuret, M. Fontana, F. Fontanelli, R. Forty, D. Foulds-Holt, V.
  Franco Lima, M. Franco Sevilla, M. Frank, E. Franzoso, G. Frau, C. Frei, D.A.
  Friday, J. Fu, Q. Fuehring, E. Gabriel, T. Gaintseva, A. Gallas Torreira, D.
  Galli, S. Gambetta, Y. Gan, M. Gandelman, P. Gandini, Y. Gao, M. Garau, L.M.
  Garcia Martin, P. Garcia Moreno, J. Garc\'ia Pardi\~nas, B. Garcia Plana,
  F.A. Garcia Rosales, L. Garrido, C. Gaspar, R.E. Geertsema, D. Gerick, L.L.
  Gerken, E. Gersabeck, M. Gersabeck, T. Gershon, D. Gerstel, Ph. Ghez, L.
  Giambastiani, V. Gibson, H.K. Giemza, A.L. Gilman, M. Giovannetti, A.
  Giovent\`u, P. Gironella Gironell, L. Giubega, C. Giugliano, K. Gizdov, E.L.
  Gkougkousis, V.V. Gligorov, C. G\""obel, E. Golobardes, D. Golubkov, A.
  Golutvin, A. Gomes, S. Gomez Fernandez, F. Goncalves Abrantes, M. Goncerz, G.
  Gong, P. Gorbounov, I.V. Gorelov, C. Gotti, E. Govorkova, J.P. Grabowski, T.
  Grammatico, L.A. Granado Cardoso, E. Graug\'es, E. Graverini, G. Graziani, A.
  Grecu, L.M. Greeven, N.A. Grieser, L. Grillo, S. Gromov, B.R. Gruberg Cazon,
  C. Gu, M. Guarise, P. A. G\""unther, E. Gushchin, A. Guth, Y. Guz, T. Gys, T.
  Hadavizadeh, G. Haefeli, C. Haen, J. Haimberger, T. Halewood-leagas, P.M.
  Hamilton, J.P. Hammerich, Q. Han, X. Han, T.H. Hancock, S. Hansmann-Menzemer,
  N. Harnew, T. Harrison, C. Hasse, M. Hatch, J. He, M. Hecker, K. Heijhoff, K.
  Heinicke, A.M. Hennequin, K. Hennessy, L. Henry, J. Heuel, A. Hicheur, D.
  Hill, M. Hilton, S.E. Hollitt, J. Hu, J. Hu, W. Hu, X. Hu, W. Huang, X.
  Huang, W. Hulsbergen, R.J. Hunter, M. Hushchyn, D. Hutchcroft, D. Hynds, P.
  Ibis, M. Idzik, D. Ilin, P. Ilten, A. Inglessi, A. Ishteev, K. Ivshin, R.
  Jacobsson, S. Jakobsen, E. Jans, B.K. Jashal, A. Jawahery, V. Jevtic, F.
  Jiang, M. John, D. Johnson, C.R. Jones, T.P. Jones, B. Jost, N. Jurik, S.H.
  Kalavan Kadavath, S. Kandybei, Y. Kang, M. Karacson, M. Karpov, F. Keizer, M.
  Kenzie, T. Ketel, B. Khanji, A. Kharisova, S. Kholodenko, T. Kirn, V.S.
  Kirsebom, O. Kitouni, S. Klaver, N. Kleijne, K. Klimaszewski, M.R. Kmiec, S.
  Koliiev, A. Kondybayeva, A. Konoplyannikov, P. Kopciewicz, R. Kopecna, P.
  Koppenburg, M. Korolev, I. Kostiuk, O. Kot, S. Kotriakhova, P. Kravchenko, L.
  Kravchuk, R.D. Krawczyk, M. Kreps, F. Kress, S. Kretzschmar, P. Krokovny, W.
  Krupa, W. Krzemien, W. Kucewicz, M. Kucharczyk, V. Kudryavtsev, H.S.
  Kuindersma, G.J. Kunde, T. Kvaratskheliya, D. Lacarrere, G. Lafferty, A. Lai,
  A. Lampis, D. Lancierini, J.J. Lane, R. Lane, G. Lanfranchi, C. Langenbruch,
  J. Langer, O. Lantwin, T. Latham, F. Lazzari, R. Le Gac, S.H. Lee, R.
  Lef\`evre, A. Leflat, S. Legotin, O. Leroy, T. Lesiak, B. Leverington, H. Li,
  P. Li, S. Li, Y. Li, Y. Li, Z. Li, X. Liang, T. Lin, R. Lindner, V.
  Lisovskyi, R. Litvinov, G. Liu, H. Liu, S. Liu, A. Lobo Salvia, A. Loi, J.
  Lomba Castro, I. Longstaff, J.H. Lopes, S. Lopez Solino, G.H. Lovell, Y. Lu,
  C. Lucarelli, D. Lucchesi, S. Luchuk, M. Lucio Martinez, V. Lukashenko, Y.
  Luo, A. Lupato, E. Luppi, O. Lupton, A. Lusiani, X. Lyu, L. Ma, R. Ma, S.
  Maccolini, F. Machefert, F. Maciuc, V. Macko, P. Mackowiak, S.
  Maddrell-Mander, O. Madejczyk, L.R. Madhan Mohan, O. Maev, A. Maevskiy, D.
  Maisuzenko, M.W. Majewski, J.J. Malczewski, S. Malde, B. Malecki, A. Malinin,
  T. Maltsev, H. Malygina, G. Manca, G. Mancinelli, D. Manuzzi, D. Marangotto,
  J. Maratas, J.F. Marchand, U. Marconi, S. Mariani, C. Marin Benito, M.
  Marinangeli, J. Marks, A.M. Marshall, P.J. Marshall, G. Martellotti, L.
  Martinazzoli, M. Martinelli, D. Martinez Santos, F. Martinez Vidal, A.
  Massafferri, M. Materok, R. Matev, A. Mathad, Z. Mathe, V. Matiunin, C.
  Matteuzzi, K.R. Mattioli, A. Mauri, E. Maurice, J. Mauricio, M. Mazurek, M.
  McCann, L. Mcconnell, T.H. Mcgrath, N.T. Mchugh, A. McNab, R. McNulty, J.V.
  Mead, B. Meadows, G. Meier, N. Meinert, D. Melnychuk, S. Meloni, M. Merk, A.
  Merli, L. Meyer Garcia, M. Mikhasenko, D.A. Milanes, E. Millard, M.
  Milovanovic, M.-N. Minard, A. Minotti, L. Minzoni, S.E. Mitchell, B.
  Mitreska, D.S. Mitzel, A. M\""odden, R.A. Mohammed, R.D. Moise, T.
  Momb\""acher, I.A. Monroy, S. Monteil, M. Morandin, G. Morello, M.J. Morello,
  J. Moron, A.B. Morris, A.G. Morris, R. Mountain, H. Mu, F. Muheim, M. Mulder,
  D. M\""uller, K. M\""uller, C.H. Murphy, D. Murray, P. Muzzetto, P. Naik, T.
  Nakada, R. Nandakumar, T. Nanut, I. Nasteva, M. Needham, I. Neri, N. Neri, S.
  Neubert, N. Neufeld, R. Newcombe, T.D. Nguyen, C. Nguyen-Mau, E.M. Niel, S.
  Nieswand, N. Nikitin, N.S. Nolte, C. Normand, C. Nunez, A. Oblakowska-Mucha,
  V. Obraztsov, T. Oeser, D.P. O'Hanlon, S. Okamura, R. Oldeman, M.E. Olivares,
  C.J.G. Onderwater, R.H. O'Neil, A. Ossowska, J.M. Otalora Goicochea, T.
  Ovsiannikova, P. Owen, A. Oyanguren, K.O. Padeken, B. Pagare, P.R. Pais, T.
  Pajero, A. Palano, M. Palutan, Y. Pan, G. Panshin, A. Papanestis, M.
  Pappagallo, L.L. Pappalardo, C. Pappenheimer, W. Parker, C. Parkes, B.
  Passalacqua, G. Passaleva, A. Pastore, M. Patel, C. Patrignani, C.J. Pawley,
  A. Pearce, A. Pellegrino, M. Pepe Altarelli, S. Perazzini, D. Pereima, A.
  Pereiro Castro, P. Perret, M. Petric, K. Petridis, A. Petrolini, A. Petrov,
  S. Petrucci, M. Petruzzo, T.T.H. Pham, A. Philippov, L. Pica, M. Piccini, B.
  Pietrzyk, G. Pietrzyk, M. Pili, D. Pinci, F. Pisani, M. Pizzichemi, Resmi
  P.K, V. Placinta, J. Plews, M. Plo Casasus, F. Polci, M. Poli Lener, M.
  Poliakova, A. Poluektov, N. Polukhina, I. Polyakov, E. Polycarpo, S. Ponce,
  D. Popov, S. Popov, S. Poslavskii, K. Prasanth, L. Promberger, C. Prouve, V.
  Pugatch, V. Puill, H. Pullen, G. Punzi, H. Qi, W. Qian, J. Qin, N. Qin, R.
  Quagliani, B. Quintana, N.V. Raab, R.I. Rabadan Trejo, B. Rachwal, J.H.
  Rademacker, M. Rama, M. Ramos Pernas, M.S. Rangel, F. Ratnikov, G. Raven, M.
  Reboud, F. Redi, F. Reiss, C. Remon Alepuz, Z. Ren, V. Renaudin, R. Ribatti,
  S. Ricciardi, K. Rinnert, P. Robbe, G. Robertson, A.B. Rodrigues, E.
  Rodrigues, J.A. Rodriguez Lopez, E.R.R. Rodriguez Rodriguez, A. Rollings, P.
  Roloff, V. Romanovskiy, M. Romero Lamas, A. Romero Vidal, J.D. Roth, M.
  Rotondo, M.S. Rudolph, T. Ruf, R.A. Ruiz Fernandez, J. Ruiz Vidal, A.
  Ryzhikov, J. Ryzka, J.J. Saborido Silva, N. Sagidova, N. Sahoo, B. Saitta, M.
  Salomoni, C. Sanchez Gras, R. Santacesaria, C. Santamarina Rios, M.
  Santimaria, E. Santovetti, D. Saranin, G. Sarpis, M. Sarpis, A. Sarti, C.
  Satriano, A. Satta, M. Saur, D. Savrina, H. Sazak, L.G. Scantlebury Smead, A.
  Scarabotto, S. Schael, S. Scherl, M. Schiller, H. Schindler, M. Schmelling,
  B. Schmidt, S. Schmitt, O. Schneider, A. Schopper, M. Schubiger, S. Schulte,
  M.H. Schune, R. Schwemmer, B. Sciascia, S. Sellam, A. Semennikov, M. Senghi
  Soares, A. Sergi, N. Serra, L. Sestini, A. Seuthe, Y. Shang, D.M. Shangase,
  M. Shapkin, I. Shchemerov, L. Shchutska, T. Shears, L. Shekhtman, Z. Shen, V.
  Shevchenko, E.B. Shields, Y. Shimizu, E. Shmanin, J.D. Shupperd, B.G. Siddi,
  R. Silva Coutinho, G. Simi, S. Simone, N. Skidmore, T. Skwarnicki, M.W.
  Slater, I. Slazyk, J.C. Smallwood, J.G. Smeaton, A. Smetkina, E. Smith, M.
  Smith, A. Snoch, M. Soares, L. Soares Lavra, M.D. Sokoloff, F.J.P. Soler, A.
  Solovev, I. Solovyev, F.L. Souza De Almeida, B. Souza De Paula, B. Spaan, E.
  Spadaro Norella, P. Spradlin, F. Stagni, M. Stahl, S. Stahl, S. Stanislaus,
  O. Steinkamp, O. Stenyakin, H. Stevens, S. Stone, M.E. Stramaglia, M.
  Straticiuc, D. Strekalina, F. Suljik, J. Sun, L. Sun, Y. Sun, P. Svihra, P.N.
  Swallow, K. Swientek, A. Szabelski, T. Szumlak, M. Szymanski, S. Taneja, A.R.
  Tanner, M.D. Tat, A. Terentev, F. Teubert, E. Thomas, D.J.D. Thompson, K.A.
  Thomson, V. Tisserand, S. T'Jampens, M. Tobin, L. Tomassetti, X. Tong, D.
  Torres Machado, D.Y. Tou, M.T. Tran, E. Trifonova, C. Trippl, G. Tuci, A.
  Tully, N. Tuning, A. Ukleja, D.J. Unverzagt, E. Ursov, A. Usachov, A.
  Ustyuzhanin, U. Uwer, A. Vagner, V. Vagnoni, A. Valassi, G. Valenti, N. Valls
  Canudas, M. van Beuzekom, M. Van Dijk, E. van Herwijnen, C.B. Van Hulse, M.
  van Veghel, R. Vazquez Gomez, P. Vazquez Regueiro, C. V\'azquez Sierra, S.
  Vecchi, J.J. Velthuis, M. Veltri, A. Venkateswaran, M. Veronesi, M.
  Vesterinen, D. Vieira, M. Vieites Diaz, H. Viemann, X. Vilasis-Cardona, E.
  Vilella Figueras, A. Villa, P. Vincent, F.C. Volle, D. Vom Bruch, A.
  Vorobyev, V. Vorobyev, N. Voropaev, K. Vos, R. Waldi, J. Walsh, C. Wang, J.
  Wang, J. Wang, J. Wang, J. Wang, M. Wang, R. Wang, Y. Wang, Z. Wang, Z. Wang,
  J.A. Ward, H.M. Wark, N.K. Watson, S.G. Weber, D. Websdale, C. Weisser,
  B.D.C. Westhenry, D.J. White, M. Whitehead, A.R. Wiederhold, D. Wiedner, G.
  Wilkinson, M. Wilkinson, I. Williams, M. Williams, M.R.J. Williams, F.F.
  Wilson, W. Wislicki, M. Witek, L. Witola, G. Wormser, S.A. Wotton, H. Wu, K.
  Wyllie, Z. Xiang, D. Xiao, Y. Xie, A. Xu, J. Xu, L. Xu, M. Xu, Q. Xu, Z. Xu,
  Z. Xu, D. Yang, S. Yang, Y. Yang, Z. Yang, Z. Yang, Y. Yao, L.E. Yeomans, H.
  Yin, J. Yu, X. Yuan, O. Yushchenko, E. Zaffaroni, M. Zavertyaev, M. Zdybal,
  O. Zenaiev, M. Zeng, D. Zhang, L. Zhang, S. Zhang, S. Zhang, Y. Zhang, Y.
  Zhang, A. Zharkova, A. Zhelezov, Y. Zheng, T. Zhou, X. Zhou, Y. Zhou, V.
  Zhovkovska, X. Zhu, Z. Zhu, V. Zhukov, J.B. Zonneveld, Q. Zou, S. Zucchelli,
  D. Zuliani, G. Zunica","Measurement of $J/\psi$ production cross-sections in $pp$ collisions at
  $\sqrt{s}=5$ TeV","All figures and tables, along with any supplementary material and
  additional information, are available at
  https://cern.ch/lhcbproject/Publications/p/LHCb-PAPER-2021-020.html (LHCb
  public pages)","JHEP 11 (2021) 181","10.1007/JHEP11(2021)181","LHCb-PAPER-2021-020,CERN-EP-2021-156","hep-ex","http://creativecommons.org/licenses/by/4.0/","  The production cross-sections of $J/\psi$ mesons in proton-proton collisions
at a centre-of-mass energy of $\sqrt{s}=5$ TeV are measured using a data sample
corresponding to an integrated luminosity of $9.13\pm0.18~\text{pb}^{-1}$,
collected by the LHCb experiment. The cross-sections are measured
differentially as a function of transverse momentum, $p_{\text{T}}$, and
rapidity, $y$, and separately for $J/\psi$ mesons produced promptly and from
beauty hadron decays (nonprompt). With the assumption of unpolarised $J/\psi$
mesons, the production cross-sections integrated over the kinematic range
$0<p_{\text{T}}<20~\text{GeV}/c$ and $2.0<y<4.5$ are
$8.154\pm0.010\pm0.283~\mu\text{b}$ for prompt $J/\psi$ mesons and
$0.820\pm0.003\pm0.034~\mu\text{b}$ for nonprompt $J/\psi$ mesons, where the
first uncertainties are statistical and the second systematic. These
cross-sections are compared with those at $\sqrt{s}=8$ TeV and $13$ TeV, and
are used to update the measurement of the nuclear modification factor in
proton-lead collisions for $J/\psi$ mesons at a centre-of-mass energy per
nucleon pair of $\sqrt{s_{\text{NN}}}=5$ TeV. The results are compared with
theoretical predictions.
","[{""version"":""v1"",""created"":""Wed, 1 Sep 2021 07:42:24 GMT""},{""version"":""v2"",""created"":""Wed, 1 Dec 2021 08:31:58 GMT""}]","2021-12-02"
"2109.00221","Naoki Kitazawa","Naoki Kitazawa","Smooth functions with simple structures on 3-dimensional closed
  manifolds with prescribed Reeb graphs and preimages","15 pages, 3 figures, the title changed, some expositions including
  precise arguments in proofs of Main Theorem and Corollary added, this is
  submitted to a refereed journal",,,,"math.GN math.GT","http://arxiv.org/licenses/nonexclusive-distrib/1.0/","  We give a new answer to so-called realization problems of graphs as Reeb
graphs of smooth functions with prescribed preimages of regular values having
nice structures. We present a best possible answer for functions on
3-dimensional closed manifolds.
  The Reeb space of a smooth function is the quotient space of the manifold of
the domain induced from the following equivalence relation; two points in the
manifold are equivalent if and only if they are points of a same connected
component of some preimage. They are in considerable cases graphs (Reeb
graphs).
  Reeb spaces with preimages represent the manifolds well and are important
tools in geometry. Recently they play important roles in applications of
mathematics such as visualizations. Realization problems ask us whether we can
construct smooth functions with prescribed Reeb graphs and preimages. Studies
on construction respecting preimages were essentially started by the author.
","[{""version"":""v1"",""created"":""Wed, 1 Sep 2021 07:44:00 GMT""},{""version"":""v2"",""created"":""Wed, 8 Sep 2021 16:21:02 GMT""},{""version"":""v3"",""created"":""Mon, 20 Dec 2021 07:47:16 GMT""},{""version"":""v4"",""created"":""Mon, 3 Jan 2022 09:08:26 GMT""}]","2022-01-04"
"2109.00222","Zhenqiang Li","Zhenqiang Li, Weimin Wang, Zuoyue Li, Yifei Huang, Yoichi Sato","Spatio-Temporal Perturbations for Video Attribution",,"IEEE Transactions on Circuits and Systems for Video Technology
  2021","10.1109/TCSVT.2021.3081761",,"cs.CV","http://creativecommons.org/licenses/by/4.0/","  The attribution method provides a direction for interpreting opaque neural
networks in a visual way by identifying and visualizing the input
regions/pixels that dominate the output of a network. Regarding the attribution
method for visually explaining video understanding networks, it is challenging
because of the unique spatiotemporal dependencies existing in video inputs and
the special 3D convolutional or recurrent structures of video understanding
networks. However, most existing attribution methods focus on explaining
networks taking a single image as input and a few works specifically devised
for video attribution come short of dealing with diversified structures of
video understanding networks. In this paper, we investigate a generic
perturbation-based attribution method that is compatible with diversified video
understanding networks. Besides, we propose a novel regularization term to
enhance the method by constraining the smoothness of its attribution results in
both spatial and temporal dimensions. In order to assess the effectiveness of
different video attribution methods without relying on manual judgement, we
introduce reliable objective metrics which are checked by a newly proposed
reliability measurement. We verified the effectiveness of our method by both
subjective and objective evaluation and comparison with multiple significant
attribution methods.
","[{""version"":""v1"",""created"":""Wed, 1 Sep 2021 07:44:16 GMT""}]","2021-09-02"
"2109.00223","Ilaria Marini","I. Marini, S. Borgani, A. Saro, G. L. Granato, C. Ragone-Figueroa, B.
  Sartoris, K. Dolag, G. Murante, A. Ragagnin, Y. Wang","Velocity dispersion of the brightest cluster galaxies in cosmological
  simulations","16 pages, 14 figures",,"10.1093/mnras/stab2518",,"astro-ph.GA astro-ph.CO","http://arxiv.org/licenses/nonexclusive-distrib/1.0/","  Using the DIANOGA hydrodynamical zoom-in simulation set of galaxy clusters,
we analyze the dynamics traced by stars belonging to the Brightest Cluster
Galaxies (BCGs) and their surrounding diffuse component, forming the
intracluster light (ICL), and compare it to the dynamics traced by dark matter
and galaxies identified in the simulations. We compute scaling relations
between the BCG and cluster velocity dispersions and their corresponding masses
(i.e. $M_\mathrm{BCG}^{\star}$- $\sigma_\mathrm{BCG}^{\star}$, $M_{200}$-
$\sigma_{200}$, $M_\mathrm{BCG}^{\star}$- $M_{200}$,
$\sigma_\mathrm{BCG}^{\star}$- $\sigma_{200}$), we find in general a good
agreement with observational results. Our simulations also predict
$\sigma_\mathrm{BCG}^{\star}$- $\sigma_{200}$ relation to not change
significantly up to redshift $z=1$, in line with a relatively slow accretion of
the BCG stellar mass at late times. We analyze the main features of the
velocity dispersion profiles, as traced by stars, dark matter, and galaxies. As
a result, we discuss that observed stellar velocity dispersion profiles in the
inner cluster regions are in excellent agreement with simulations. We also
report that the slopes of the BCG velocity dispersion profile from simulations
agree with what is measured in observations, confirming the existence of a
robust correlation between the stellar velocity dispersion slope and the
cluster velocity dispersion (thus, cluster mass) when the former is computed
within $0.1 R_{500}$. Our results demonstrate that simulations can correctly
describe the dynamics of BCGs and their surrounding stellar envelope, as
determined by the past star-formation and assembly histories of the most
massive galaxies of the Universe.
","[{""version"":""v1"",""created"":""Wed, 1 Sep 2021 07:46:11 GMT""}]","2021-09-06"
"2109.00224","AprilPyone MaungMaung","MaungMaung AprilPyone and Hitoshi Kiya","A Protection Method of Trained CNN Model Using Feature Maps Transformed
  With Secret Key From Unauthorized Access","To appear in APSIPA 2021. arXiv admin note: text overlap with
  arXiv:2105.14756",,,,"cs.CV","http://arxiv.org/licenses/nonexclusive-distrib/1.0/","  In this paper, we propose a model protection method for convolutional neural
networks (CNNs) with a secret key so that authorized users get a high
classification accuracy, and unauthorized users get a low classification
accuracy. The proposed method applies a block-wise transformation with a secret
key to feature maps in the network. Conventional key-based model protection
methods cannot maintain a high accuracy when a large key space is selected. In
contrast, the proposed method not only maintains almost the same accuracy as
non-protected accuracy, but also has a larger key space. Experiments were
carried out on the CIFAR-10 dataset, and results show that the proposed model
protection method outperformed the previous key-based model protection methods
in terms of classification accuracy, key space, and robustness against key
estimation attacks and fine-tuning attacks.
","[{""version"":""v1"",""created"":""Wed, 1 Sep 2021 07:47:05 GMT""}]","2021-09-02"
"2109.00225","Christian Budde","Christian Budde and Christian Seifert","Non-autonomous Desch-Schappacher perturbations","13 pages",,,,"math.FA","http://arxiv.org/licenses/nonexclusive-distrib/1.0/","  We consider time-dependent Desch-Schappacher perturbations of non-autonomous
abstract Cauchy problems and apply our result to non-autonomous uniformly
strongly elliptic differential operators on $\mathrm{L}^p$-spaces.
","[{""version"":""v1"",""created"":""Wed, 1 Sep 2021 07:48:07 GMT""},{""version"":""v2"",""created"":""Thu, 10 Mar 2022 18:38:49 GMT""},{""version"":""v3"",""created"":""Wed, 29 Jun 2022 09:20:39 GMT""}]","2022-06-30"
"2109.00226","Jorge Lillo-Box","J. Lillo-Box, J. P. Faria, A. Su\'arez Mascare\~no, P. Figueira, S.G.
  Sousa, H. Tabernero, C. Lovis, A.M. Silva, O.D.S. Demangeon, S. Benatti, N.C.
  Santos, A. Mehner, F.A. Pepe, A. Sozzetti, M.R. Zapatero Osorio, J.I.
  Gonz\'alez Hern\'andez, G. Micela, S. Hojjatpanah, R. Rebolo, S. Cristiani,
  V. Adibekyan, R. Allart, C. Allende Prieto, A. Cabral, M. Damasso, P. Di
  Marcantonio, G. Lo Curto, C.J.A.P. Martins, D. Megevand, P. Molaro, N.J.
  Nunes, E. Pall\'e, L. Pasquini, E. Poretti, S. Udry","HD22496b: the first ESPRESSO standalone planet discovery","Accepted for publication in A&A. 12 pages, 8 figures, 3 tables","A&A 654, A60 (2021)","10.1051/0004-6361/202141714",,"astro-ph.EP astro-ph.IM","http://creativecommons.org/licenses/by-nc-sa/4.0/","  The ESPRESSO spectrograph is a new powerful tool to detect and characterize
extrasolar planets. Its design allows unprecedented radial velocity precision
(down to a few tens of cm/s) and long-term thermo-mechanical stability. We
present the first standalone detection of an extrasolar planet by blind radial
velocity search using ESPRESSO and aim at showing the power of the instrument
in characterizing planetary signals at different periodicities in long time
spans. We use 41 ESPRESSO measurements of HD\,22496 within a time span of 895
days with a median photon noise of 18 cm/s. A radial velocity analysis is
performed to test the presence of planets in the system and to account for the
stellar activity of this K5-K7 main sequence star. For benchmarking and
comparison, we attempt the detection with 43 archive HARPS measurements and
compare the results yielded by the two datasets. We also use four TESS sectors
to search for transits. We find radial velocity variations compatible with a
close-in planet with an orbital period of $P=5.09071\pm0.00026$ days when
simultaneously accounting for the effects of stellar activity at longer time
scales ($P_{\rm rot}=34.99^{+0.58}_{-0.53}$ days). We characterize the physical
and orbital properties of the planet and find a minimum mass of
$5.57^{+0.73}_{-0.68}$ $\mathrm{M}_{\oplus}$, right in the dichotomic regime
between rocky and gaseous planets. Although not transiting according to TESS
data, if aligned with the stellar spin axis, the absolute mass of the planet
must be below 16 $\mathrm{M}_{\oplus}$. We find no significant evidence for
additional signals with semi-amplitudes above 56 cm/s at 95% confidence. With a
modest set of radial velocity measurements, ESPRESSO is capable of detecting
and characterizing low-mass planets and constrain the presence of planets in
the habitable zone of K-dwarfs down to the rocky-mass regime.
","[{""version"":""v1"",""created"":""Wed, 1 Sep 2021 08:04:50 GMT""}]","2021-10-13"
