"2109.00360","Hiroyuki Sekiya","K. Abe, C. Bronner, Y. Hayato, K. Hiraide, M. Ikeda, S. Imaizumi, J.
  Kameda, Y. Kanemura, Y. Kataoka, S. Miki, M. Miura, S. Moriyama, Y. Nagao, M.
  Nakahata, S. Nakayama, T. Okada, K. Okamoto, A. Orii, G. Pronost, H. Sekiya,
  M. Shiozawa, Y. Sonoda, Y. Suzuki, A. Takeda, Y. Takemoto, A. Takenaka, H.
  Tanaka, S. Watanabe, T. Yano, S. Han, T. Kajita, K. Okumura, T. Tashiro, J.
  Xia, G. D. Megias, D. Bravo-Berguno, L. Labarga, Ll. Marti, B. Zaldivar, B.
  W. Pointon, F. d. M. Blaszczyk, E. Kearns, J. L. Raaf, J. L. Stone, L. Wan,
  T. Wester, J. Bian, N. J. Griskevich, W. R. Kropp, S. Locke, S. Mine, M. B.
  Smy, H. W. Sobel, V. Takhistov, J. Hill, J. Y. Kim, I. T. Lim, R. G. Park, B.
  Bodur, K. Scholberg, C. W. Walter, L. Bernard, A. Coffani, O. Drapier, S. El
  Hedri, A. Giampaolo, M. Gonin, Th. A. Mueller, P. Paganini, B. Quilain, T.
  Ishizuka, T. Nakamura, J. S. Jang, J. G. Learned, L. H. V. Anthony, D.
  Martin, M. Scott, A. A. Sztuc, Y. Uchida, S. Cao, V. Berardi, M. G. Catanesi,
  E. Radicioni, N. F. Calabria, L. N. Machado, G. De Rosa, G. Collazuol, F.
  Iacob, M. Lamoureux, M. Mattiazzi, N. Ospina, L. Ludovici, Y. Maekawa, Y.
  Nishimura, M. Friend, T. Hasegawa, T. Ishida, T. Kobayashi, M. Jakkapu, T.
  Matsubara, T. Nakadaira, K. Nakamura, Y. Oyama, K. Sakashita, T. Sekiguchi,
  T. Tsukamoto, T. Boschi, J. Gao, F. Di Lodovico, J. Migenda, M. Taani, S.
  Zsoldos, Y. Kotsar, Y. Nakano, H. Ozaki, T. Shiozawa, A. T. Suzuki, Y.
  Takeuchi, S. Yamamoto, A. Ali, Y. Ashida, J. Feng, S. Hirota, T. Kikawa, M.
  Mori, T. Nakaya, R. A. Wendell, K. Yasutome, P. Fernandez, N. McCauley, P.
  Mehta, K. M. Tsui, Y. Fukuda, Y. Itow, H. Menjo, T. Niwa, K. Sato, M.
  Tsukada, J. Lagoda, S. M. Lakshmi, P. Mijakowski, J. Zalipska, J. Jiang, C.
  K. Jung, C. Vilela, M. J. Wilking, C. Yanagisawa, K. Hagiwara, M. Harada, T.
  Horai, H. Ishino, S. Ito, F. Kitagawa, Y. Koshio, W. Ma, N. Piplani, S.
  Sakai, G. Barr, D. Barrow, L. Cook, A. Goldsack, S. Samani, D. Wark, F. Nova,
  J. Y. Yang, S. J. Jenkins, M. Malek, J. M. McElwee, O. Stone, M. D. Thiesse,
  L. F. Thompson, H. Okazawa, S. B. Kim, J. W. Seo, I. Yu, A. K. Ichikawa, K.
  Nakamura, K. Nishijima, M. Koshiba, K. Iwamoto, Y. Nakajima, N. Ogawa, M.
  Yokoyama, K. Martens, M. R. Vagins, M. Kuze, S. Izumiyama, T. Yoshida, M.
  Inomoto, M. Ishitsuka, H. Ito, T. Kinoshita, R. Matsumoto, K. Ohta, M.
  Shinoki, T. Suganuma, J. F. Martin, H. A. Tanaka, T. Towstego, R. Akutsu, M.
  Hartz, A. Konaka, P. de Perio, N. W. Prouse, S. Chen, B. D. Xu, M.
  Posiadala-Zezula, D. Hadley, M. O'Flaherty, B. Richards, B. Jamieson, J.
  Walker, A. Minamino, K. Okamoto, G. Pintaudi, S. Sano, R. Sasaki (The
  Super-Kamiokande Collaboration)","First Gadolinium Loading to Super-Kamiokande","37 pages, 19 Figures, Accepted for publication in Nucl. Instrum.
  Meth. A","Nuclear Inst. and Methods in Physics Research, A 1027 (2022)
  166248","10.1016/j.nima.2021.166248",,"physics.ins-det astro-ph.IM","http://arxiv.org/licenses/nonexclusive-distrib/1.0/","  In order to improve Super-Kamiokande's neutron detection efficiency and to
thereby increase its sensitivity to the diffuse supernova neutrino background
flux, 13 tons of $\rm Gd_2(\rm SO_4)_3\cdot \rm 8H_2O$ (gadolinium sulfate
octahydrate) was dissolved into the detector's otherwise ultrapure water from
July 14 to August 17, 2020, marking the start of the SK-Gd phase of operations.
During the loading, water was continuously recirculated at a rate of 60
m$^3$/h, extracting water from the top of the detector and mixing it with
concentrated $\rm Gd_2(\rm SO_4)_3\cdot \rm 8H_2O$ solution to create a 0.02%
solution of the Gd compound before injecting it into the bottom of the
detector. A clear boundary between the Gd-loaded and pure water was maintained
through the loading, enabling monitoring of the loading itself and the spatial
uniformity of the Gd concentration over the 35 days it took to reach the top of
the detector. During the subsequent commissioning the recirculation rate was
increased to 120 m$^3$/h, resulting in a constant and uniform distribution of
Gd throughout the detector and water transparency equivalent to that of
previous pure-water operation periods. Using an Am-Be neutron calibration
source the mean neutron capture time was measured to be $115\pm1$ $\mu$s, which
corresponds to a Gd concentration of $111\pm2$ ppm, as expected for this level
of Gd loading. This paper describes changes made to the water circulation
system for this detector upgrade, the Gd loading procedure, detector
commissioning, and the first neutron calibration measurements in SK-Gd.
","[{""version"":""v1"",""created"":""Wed, 1 Sep 2021 12:47:49 GMT""},{""version"":""v2"",""created"":""Sat, 4 Sep 2021 07:49:32 GMT""},{""version"":""v3"",""created"":""Wed, 15 Dec 2021 15:50:39 GMT""}]","2022-01-27"
"2109.00361","Anindya Das","Arup Kumar Paul, Ayan Ghosh, Souvik Chakraborty, Ujjal Roy, Ranit
  Dutta, K. Watanabe, T. Taniguchi, Animesh Panda, Adhip Agarwala, Subroto
  Mukerjee, Sumilan Banerjee and Anindya Das","Interaction driven giant thermopower in magic-angle twisted bilayer
  graphene",,,"10.1038/s41567-022-01574-3",,"cond-mat.mes-hall cond-mat.str-el cond-mat.supr-con","http://creativecommons.org/licenses/by/4.0/","  Magic-angle twisted bilayer graphene (MtBLG) has proven to be an extremely
promising new platform to realize and study a host of emergent quantum phases
arising from the strong correlations in its narrow bandwidth flat band. In this
regard, thermal transport phenomena like thermopower, in addition to being
coveted technologically, is also sensitive to the particle-hole (PH) asymmetry,
making it a crucial tool to probe the underlying electronic structure of this
material. We have carried out thermopower measurements of MtBLG as a function
of carrier density, temperature and magnetic field, and report the observation
of an unusually large thermopower reaching up to a value as high as $\sim
\bf{100\mu V/K}$ at a low temperature of 1K. Surprisingly, our observed
thermopower exhibiting peak-like features in close correspondence to the
resistance peaks around the integer Moire fillings, including the Dirac Point,
violating the Mott formula. %Surprisingly, our observed thermopower exhibits
peak-like features in close correspondence to the resistance peaks around the
integer Moire fillings, including the Dirac Point, which completely violates
the Mott formula. We show that the large thermopower peaks and their
%non-monotonic dependence with temperature and magnetic field associated
behaviour arise from the emergent highly PH asymmetric electronic structure due
to the cascade of Dirac revivals. Furthermore, the thermopower shows an
anomalous peak around the superconducting transition on the hole side and
points towards the possible role of enhanced superconducting fluctuations in
MtBLG.
","[{""version"":""v1"",""created"":""Wed, 1 Sep 2021 12:52:05 GMT""},{""version"":""v2"",""created"":""Sat, 11 Sep 2021 03:38:31 GMT""}]","2022-06-29"
"2109.00362","J. K. Jain","Songyang Pu, G. J. Sreejith, J. K. Jain","Anderson localization in fractional quantum Hall effect","9 pages, 5 figures","Phys. Rev. Lett., vol. 128, 116801 (2022)","10.1103/PhysRevLett.128.116801",,"cond-mat.mes-hall cond-mat.str-el","http://creativecommons.org/licenses/by/4.0/","  The interplay between interaction and disorder-induced localization is of
fundamental interest. This article addresses localization physics in the
fractional quantum Hall state, where both interaction and disorder have
nonperturbative consequences. We provide compelling theoretical evidence that
the localization of a single quasiparticle of the fractional quantum Hall state
at filling factor $\nu=n/(2n+1)$ has a striking {\it quantitative}
correspondence to the localization of a single electron in the $(n+1)$th Landau
level. By analogy to the dramatic experimental manifestations of Anderson
localization in integer quantum Hall effect, this leads to predictions in the
fractional quantum Hall regime regarding the existence of extended states at a
critical energy, and the nature of the divergence of the localization length as
this energy is approached. Within a mean field approximation these results can
be extended to situations where a finite density of quasiparticles is present.
","[{""version"":""v1"",""created"":""Wed, 1 Sep 2021 12:52:29 GMT""}]","2022-03-17"
"2109.00363","Jiwei Li","Yuxian Meng, Xiang Ao, Qing He, Xiaofei Sun, Qinghong Han, Fei Wu,
  Chun fan and Jiwei Li","ConRPG: Paraphrase Generation using Contexts as Regularizer","To appear at EMNLP2021",,,,"cs.CL","http://creativecommons.org/licenses/by/4.0/","  A long-standing issue with paraphrase generation is how to obtain reliable
supervision signals. In this paper, we propose an unsupervised paradigm for
paraphrase generation based on the assumption that the probabilities of
generating two sentences with the same meaning given the same context should be
the same. Inspired by this fundamental idea, we propose a pipelined system
which consists of paraphrase candidate generation based on contextual language
models, candidate filtering using scoring functions, and paraphrase model
training based on the selected candidates. The proposed paradigm offers merits
over existing paraphrase generation methods: (1) using the context regularizer
on meanings, the model is able to generate massive amounts of high-quality
paraphrase pairs; and (2) using human-interpretable scoring functions to select
paraphrase pairs from candidates, the proposed framework provides a channel for
developers to intervene with the data generation process, leading to a more
controllable model. Experimental results across different tasks and datasets
demonstrate that the effectiveness of the proposed model in both supervised and
unsupervised setups.
","[{""version"":""v1"",""created"":""Wed, 1 Sep 2021 12:57:30 GMT""}]","2021-09-02"
"2109.00364","Florian Franke","Florian Franke, Sebatian Aland, Hans-Joachim B\""ohme, Anja
  Voss-B\""ohme, Steffen Lange","Is cell segregation like oil and water: asymptotic versus transitory
  regime","41 pages, 11+11 figures, 1+1 table","PLoS Computational Biology, September 2022","10.1371/journal.pcbi.1010460",,"q-bio.CB","http://creativecommons.org/licenses/by/4.0/","  Segregation of different cell types is a crucial process for the pattern
formation in tissues, in particular during embryogenesis. Since the involved
cell interactions are complex and difficult to measure individually in
experiments, mathematical modelling plays an increasingly important role to
unravel the mechanisms governing segregation. The analysis of these theoretical
models focuses mainly on the asymptotic behavior at large times, in a steady
regime and for large numbers of cells. Most famously, cell-segregation models
based on the minimization of the total surface energy, a mechanism also driving
the demixing of immiscible fluids, are known to exhibit asymptotically a
particular algebraic scaling behavior. However, it is not clear, whether the
asymptotic regime of the numerical models is relevant at the spatio-temporal
scales of actual biological processes and in-vitro experiments. By developing a
mapping between cell-based models and experimental settings, we are able to
directly compare previous experimental data to numerical simulations of cell
segregation quantitatively. We demonstrate that the experiments are reproduced
by the transitory regime of the models rather than the asymptotic one. Our work
puts a new perspective on previous model-driven conclusions on cell segregation
mechanisms.
","[{""version"":""v1"",""created"":""Wed, 1 Sep 2021 12:59:52 GMT""},{""version"":""v2"",""created"":""Thu, 28 Oct 2021 06:04:19 GMT""},{""version"":""v3"",""created"":""Wed, 13 Apr 2022 09:31:25 GMT""},{""version"":""v4"",""created"":""Fri, 22 Jul 2022 08:25:09 GMT""}]","2022-09-21"
"2109.00365","Sebastian Siol","Siarhei Zhuk, Andrey A. Kistanov, Simon C. Boehme, Noemie Ott, Fabio
  La Mattina, Michael Stiefel, Maksym V. Kovalenko, Sebastian Siol","Synthesis and Characterization of the Ternary Nitride Semiconductor
  Zn$_2$VN$_3$: Theoretical Prediction, Combinatorial Screening and Epitaxial
  Stabilization","The final version of the manuscript was published in Chemistry of
  Materials, November 2021. The final version of the manuscript as well as the
  SI documents are available at the publishers website",,"10.1021/acs.chemmater.1c03025",,"cond-mat.mtrl-sci","http://arxiv.org/licenses/nonexclusive-distrib/1.0/","  Computationally guided high-throughput synthesis is used to explore the
Zn-V-N phase space, resulting in the synthesis of a novel ternary nitride
Zn$_2$VN$_3$. Following a combinatorial PVD screening, we isolate the phase and
synthesize polycrystalline Zn$_2$VN$_3$ thin films with wurtzite structure on
conventional borosilicate glass substrates. In addition, we demonstrate that
cation-disordered, but phase-pure (002)-textured, Zn$_2$VN$_3$ thin films can
be grown using epitaxial stabilization on {\alpha}-Al2O3 (0001) substrates at
remarkably low growth temperatures well below 200 {\deg}C. The structural
properties and phase composition of the Zn$_2$VN$_3$ films are studied in
detail using XRD and (S)TEM techniques. The composition as well as chemical
state of the constituent elements are studied using RBS/ERDA as well as
XPS/HAXPES methods. These analyses reveal a stoichiometric material with no
oxygen contamination, besides a thin surface oxide. We find that Zn$_2$VN$_3$
is a weakly-doped p-type semiconductor demonstrating broadband room-temperature
photoluminescence spanning the range between 2 eV and 3 eV. In addition, the
electronic properties can be tuned over a wide range via isostructural alloying
on the cation site, making this a promising material for optoelectronic
applications.
","[{""version"":""v1"",""created"":""Wed, 1 Sep 2021 13:01:14 GMT""},{""version"":""v2"",""created"":""Thu, 25 Nov 2021 12:20:22 GMT""}]","2021-11-29"
"2109.00366","Hyoung Joon Choi","Han-gyu Kim and Hyoung Joon Choi","Quasiparticle band structures of bulk and few-layer PdSe2 from
  first-principles GW calculations","7 pages and 6 figures","Physical Review B 103, 165419 (2021)","10.1103/PhysRevB.103.165419",,"cond-mat.mtrl-sci","http://creativecommons.org/licenses/by/4.0/","  We performed first-principles density functional theory (DFT) and GW
calculations to investigate electronic structures of bulk and few-layer PdSe2.
We obtained the quasiparticle band structure of bulk PdSe2, and the obtained
energy gap agrees excellently with the reported experimental value. For
monolayer and bilayer PdSe2, we obtained quasiparticle band structures with
respect to the vacuum level. We analyzed DFT and GW band structures in detail,
finding k-space positions of valence band maxima and conduction band minima,
effective masses, the quasiparticle density of states, work functions,
ionization potentials, electron affinities, and k-space shapes of electron and
hole pockets. These results provide a foundation for development of basic
studies and device applications.
","[{""version"":""v1"",""created"":""Wed, 1 Sep 2021 13:03:37 GMT""}]","2021-09-02"
"2109.00367","Yu-Yang Songsheng","Yu-Yang Songsheng, Yi-Qian Qian, Yan-Rong Li, Pu Du, Jie-Wen Chen, Yan
  Wang, Soumya D. Mohanty and Jian-Min Wang","Search for Continuous Gravitational Wave Signals in Pulsar Timing
  Residuals: A New Scalable Approach with Diffusive Nested Sampling","20 pages, 10 figures, submitted to ApJ",,"10.3847/1538-4357/ac25fc",,"astro-ph.IM astro-ph.GA gr-qc","http://creativecommons.org/licenses/by/4.0/","  Detecting continuous nanohertz gravitational waves (GWs) generated by
individual close binaries of supermassive black holes (CB-SMBHs) is one of the
primary objectives of pulsar timing arrays (PTAs). The detection sensitivity is
slated to increase significantly as the number of well-timed millisecond
pulsars will increase by more than an order of magnitude with the advent of
next-generation radio telescopes. Currently, the Bayesian analysis pipeline
using parallel tempering Markov chain Monte Carlo has been applied in multiple
studies for CB-SMBH searches, but it may be challenged by the high
dimensionality of the parameter space for future large-scale PTAs. One solution
is to reduce the dimensionality by maximizing or marginalizing over
uninformative parameters semi-analytically, but it is not clear whether this
approach can be extended to more complex signal models without making overly
simplified assumptions. Recently, the method of diffusive nested (DNest)
sampling shown the capability of coping with high dimensionality and
multimodality effectively in Bayesian analysis. In this paper, we apply DNest
to search for continuous GWs in simulated pulsar timing residuals and find that
it performs well in terms of accuracy, robustness, and efficiency for a PTA
including $\mathcal{O}(10^2)$ pulsars. DNest also allows a simultaneous search
of multiple sources elegantly, which demonstrates its scalability and general
applicability. Our results show that it is convenient and also high beneficial
to include DNest in current toolboxes of PTA analysis.
","[{""version"":""v1"",""created"":""Wed, 1 Sep 2021 13:05:05 GMT""}]","2021-12-08"
"2109.00368","Ruihong Qiu","Ruihong Qiu, Zi Huang, Hongzhi Yin","Memory Augmented Multi-Instance Contrastive Predictive Coding for
  Sequential Recommendation",,,,,"cs.IR","http://arxiv.org/licenses/nonexclusive-distrib/1.0/","  The sequential recommendation aims to recommend items, such as products,
songs and places, to users based on the sequential patterns of their historical
records. Most existing sequential recommender models consider the next item
prediction task as the training signal. Unfortunately, there are two essential
challenges for these methods: (1) the long-term preference is difficult to
capture, and (2) the supervision signal is too sparse to effectively train a
model. In this paper, we propose a novel sequential recommendation framework to
overcome these challenges based on a memory augmented multi-instance
contrastive predictive coding scheme, denoted as MMInfoRec. The basic
contrastive predictive coding (CPC) serves as encoders of sequences and items.
The memory module is designed to augment the auto-regressive prediction in CPC
to enable a flexible and general representation of the encoded preference,
which can improve the ability to capture the long-term preference. For
effective training of the MMInfoRec model, a novel multi-instance noise
contrastive estimation (MINCE) loss is proposed, using multiple positive
samples, which offers effective exploitation of samples inside a mini-batch.
The proposed MMInfoRec framework falls into the contrastive learning style,
within which, however, a further finetuning step is not required given that its
contrastive training task is well aligned with the target recommendation task.
With extensive experiments on four benchmark datasets, MMInfoRec can outperform
the state-of-the-art baselines.
","[{""version"":""v1"",""created"":""Wed, 1 Sep 2021 13:08:18 GMT""},{""version"":""v2"",""created"":""Fri, 3 Sep 2021 01:37:13 GMT""},{""version"":""v3"",""created"":""Mon, 13 Sep 2021 11:54:38 GMT""}]","2021-09-14"
"2109.00369","Shadab Mahboob","Shadab Mahboob (1), Koushik Kar (1) and Jacob Chakareski (2) ((1)
  Rensselaer Polytechnic Institute, (2) New Jersey Institute of Technology)","Decentralized Collaborative Video Caching in 5G Small-Cell Base Station
  Cellular Networks","11 pages, 10 figures, WiOpt 2021",,,,"cs.NI","http://arxiv.org/licenses/nonexclusive-distrib/1.0/","  We consider the problem of video caching across a set of 5G small-cell base
stations (SBS) connected to each other over a high-capacity short-delay
back-haul link, and linked to a remote server over a long-delay connection.
Even though the problem of minimizing the overall video delivery delay is
NP-hard, the Collaborative Caching Algorithm (CCA) that we present can
efficiently compute a solution close to the optimal, where the degree of
sub-optimality depends on the worst case video-to-cache size ratio. The
algorithm is naturally amenable to distributed implementation that requires
zero explicit coordination between the SBSs, and runs in $O(N + K \log K)$
time, where $N$ is the number of SBSs (caches) and $K$ the maximum number of
videos. We extend CCA to an online setting where the video popularities are not
known a priori but are estimated over time through a limited amount of periodic
information sharing between SBSs. We demonstrate that our algorithm closely
approaches the optimal integral caching solution as the cache size increases.
Moreover, via simulations carried out on real video access traces, we show that
our algorithm effectively uses the SBS caches to reduce the video delivery
delay and conserve the remote server's bandwidth, and that it outperforms two
other reference caching methods adapted to our system setting.
","[{""version"":""v1"",""created"":""Wed, 1 Sep 2021 13:12:22 GMT""}]","2021-09-02"
"2109.00370","Ashish Pandey","Bhavna, Atul Kumar, Ashish Kumar Pandey","Transverse spectral instability in generalized Kadomtsev-Petviashvili
  equation",,,,,"math.AP math-ph math.MP","http://arxiv.org/licenses/nonexclusive-distrib/1.0/","  We study transverse stability and instability of one-dimensional
small-amplitude periodic traveling waves of a generalized
Kadomtsev-Petviashvili equation with respect to two-dimensional perturbations,
which are either periodic or square-integrable in the direction of the
propagation of the underlying one-dimensional wave and periodic in the
transverse direction. We obtain transverse instability results in KP-fKdV,
KP-ILW, and KP-Whitham equations. Moreover, assuming the spectral stability of
one-dimensional wave with respect to one-dimensional square-integrable periodic
perturbations, we obtain transverse stability results in aforementioned
equations.
","[{""version"":""v1"",""created"":""Wed, 1 Sep 2021 13:12:32 GMT""},{""version"":""v2"",""created"":""Thu, 31 Mar 2022 08:26:12 GMT""}]","2022-04-01"
"2109.00371","Mengyu Cheng","Mengyu Cheng and Zhenxin Liu","The second Bogolyubov theorem and global averaging principle for SPDEs
  with monotone coefficients","41 pages",,,,"math.DS math.PR","http://arxiv.org/licenses/nonexclusive-distrib/1.0/","  In this paper, we establish the second Bogolyubov theorem and global
averaging principle for stochastic partial differential equations (in short,
SPDEs) with monotone coefficients. Firstly, we prove that there exists a unique
$L^{2}$-bounded solution to SPDEs with monotone coefficients and this bounded
solution is globally asymptotically stable in square-mean sense. Then we show
that the $L^{2}$-bounded solution possesses the same recurrent properties (e.g.
periodic, quasi-periodic, almost periodic, almost automorphic, Birkhoff
recurrent, Levitan almost periodic, etc.) in distribution sense as the
coefficients. Thirdly, we prove that the recurrent solution of the original
equation converges to the stationary solution of averaged equation under the
compact-open topology as the time scale goes to zero--in other words, there
exists a unique recurrent solution to the original equation in a neighborhood
of the stationary solution of averaged equation when the time scale is small.
Finally, we establish the global averaging principle in weak sense, i.e. we
show that the attractor of original system tends to that of the averaged
equation in probability measure space as the time scale goes to zero. For
illustration of our results, we give two applications, including stochastic
reaction diffusion equations and stochastic generalized porous media equations.
","[{""version"":""v1"",""created"":""Wed, 1 Sep 2021 13:12:59 GMT""},{""version"":""v2"",""created"":""Tue, 9 Aug 2022 14:23:54 GMT""}]","2022-08-10"
"2109.00372","Masahiro Nozaki","Kanato Goto, Masahiro Nozaki, and Kotaro Tamaoka","Subregion Spectrum Form Factor via Pseudo Entropy","6 pages, 4 figures",,"10.1103/PhysRevD.104.L121902","RIKEN-iTHEMS-Report-21","hep-th cond-mat.stat-mech cond-mat.str-el quant-ph","http://arxiv.org/licenses/nonexclusive-distrib/1.0/","  We introduce a subsystem generalization of the spectral form factor via
pseudo entropy, the von-Neumann entropy for the reduced transition matrix. We
consider a transition matrix between the thermofield double state and its
time-evolved state in two-dimensional conformal field theories, and study the
time-dependence of the pseudo entropy for a single interval. We show that the
real part of the pseudo entropy behaves similarly to the spectral form factor;
it starts from the thermal entropy, initially drops to the minimum, then it
starts increasing, and finally approaches the vacuum entanglement entropy. We
also study the theory-dependence of its behavior by considering theories on a
compact space.
","[{""version"":""v1"",""created"":""Wed, 1 Sep 2021 13:17:19 GMT""}]","2021-12-22"
