"2109.04205","Guillaume Sartoretti","Yuhong Cao and Zhanhong Sun and Guillaume Sartoretti","DAN: Decentralized Attention-based Neural Network for the MinMax
  Multiple Traveling Salesman Problem","Submitted to the 16th International Symposium on Distributed
  Autonomous Robotic Systems (DARS 2022)",,,,"cs.RO cs.AI cs.MA","http://arxiv.org/licenses/nonexclusive-distrib/1.0/","  The multiple traveling salesman problem (mTSP) is a well-known NP-hard
problem with numerous real-world applications. In particular, this work
addresses MinMax mTSP, where the objective is to minimize the max tour length
among all agents. Many robotic deployments require recomputing potentially
large mTSP instances frequently, making the natural trade-off between computing
time and solution quality of great importance. However, exact and heuristic
algorithms become inefficient as the number of cities increases, due to their
computational complexity. Encouraged by the recent developments in deep
reinforcement learning (dRL), this work approaches the mTSP as a cooperative
task and introduces DAN, a decentralized attention-based neural method that
aims at tackling this key trade-off. In DAN, agents learn fully decentralized
policies to collaboratively construct a tour, by predicting each other's future
decisions. Our model relies on the Transformer architecture and is trained
using multi-agent RL with parameter sharing, providing natural scalability to
the numbers of agents and cities. Our experimental results on small- to
large-scale mTSP instances ($50$ to $1000$ cities and $5$ to $20$ agents) show
that DAN is able to match or outperform state-of-the-art solvers while keeping
planning times low. In particular, given the same computation time budget, DAN
outperforms all conventional and dRL-based baselines on larger-scale instances
(more than 100 cities, more than 5 agents), and exhibits enhanced agent
collaboration. A video explaining our approach and presenting our results is
available at \url{https://youtu.be/xi3cLsDsLvs}.
","[{""version"":""v1"",""created"":""Thu, 9 Sep 2021 12:26:04 GMT""},{""version"":""v2"",""created"":""Thu, 7 Jul 2022 16:10:20 GMT""}]","2022-07-08"
"2109.04206","Debajyoti Bera","Debajyoti Bera, Rameshwar Pratap, Bhisham Dev Verma, Biswadeep Sen,
  and Tanmoy Chakraborty","QUINT: Node embedding using network hashing","Accepted in IEEE TKDE",,"10.1109/TKDE.2021.3111997",,"cs.SI cs.IR cs.LG","http://creativecommons.org/licenses/by-nc-sa/4.0/","  Representation learning using network embedding has received tremendous
attention due to its efficacy to solve downstream tasks. Popular embedding
methods (such as deepwalk, node2vec, LINE) are based on a neural architecture,
thus unable to scale on large networks both in terms of time and space usage.
Recently, we proposed BinSketch, a sketching technique for compressing binary
vectors to binary vectors. In this paper, we show how to extend BinSketch and
use it for network hashing. Our proposal named QUINT is built upon BinSketch,
and it embeds nodes of a sparse network onto a low-dimensional space using
simple bi-wise operations. QUINT is the first of its kind that provides
tremendous gain in terms of speed and space usage without compromising much on
the accuracy of the downstream tasks. Extensive experiments are conducted to
compare QUINT with seven state-of-the-art network embedding methods for two end
tasks - link prediction and node classification. We observe huge performance
gain for QUINT in terms of speedup (up to 7000x) and space saving (up to 80x)
due to its bit-wise nature to obtain node embedding. Moreover, QUINT is a
consistent top-performer for both the tasks among the baselines across all the
datasets. Our empirical observations are backed by rigorous theoretical
analysis to justify the effectiveness of QUINT. In particular, we prove that
QUINT retains enough structural information which can be used further to
approximate many topological properties of networks with high confidence.
","[{""version"":""v1"",""created"":""Thu, 9 Sep 2021 12:26:44 GMT""},{""version"":""v2"",""created"":""Sat, 11 Sep 2021 01:42:13 GMT""}]","2021-09-23"
"2109.04207","Timilehin Ogundare","Timilehin Ogundare and Terence Van Zyl","Surrogate Parameters Optimization for Data and Model Fusion of COVID-19
  Time-series Data","7pages, 7figures, 2tables, 1 equation, conference paper to for a
  computational solution to COVID-19 pandemic",,,,"cs.CY cs.NE","http://creativecommons.org/licenses/by/4.0/","  Our research focuses on developing a computational framework to simulate the
transmission dynamics of COVID-19 pandemic. We examine the development of a
system named ADRIANA for the simulation using South Africa as a case study. The
design of the ADRIANA system interconnects three sub-models to establish a
computational technique to advise policy regarding lockdown measures to reduce
the transmission pattern of COVID-19 in South Africa. Additionally, the output
of the ADRIANA can be used by healthcare administration to predict peak demand
time for resources needed to treat infected individuals. ABM is suited for our
research experiment, but to prevent the computational constraints of using
ABM-based framework for this research, we develop an SEIR compartmental model,
a discrete event simulator, and an optimized surrogate model to form a system
named ADRIANA. We also ensure that the surrogate's findings are accurate enough
to provide optimal solutions. We use the Genetic Algorithm (GA) for the
optimization by estimating the optimal hyperparameter configuration for the
surrogate. We concluded this study by discussing the solutions presented by the
ADRIANA system, which aligns with the primary goal of our study to present an
optimal guide to lockdown policy by the government and resource management by
the hospital administrators.
","[{""version"":""v1"",""created"":""Thu, 9 Sep 2021 12:27:26 GMT""}]","2021-09-10"
"2109.04209","Lavinia Heisenberg","Fabio D'Ambrosio, Lavinia Heisenberg and Simon Kuhn","Revisiting Cosmologies in Teleparallelism","17 pages, no figures",,"10.1088/1361-6382/ac3f99",,"gr-qc astro-ph.CO hep-th","http://creativecommons.org/licenses/by/4.0/","  We discuss the most general field equations for cosmological spacetimes for
theories of gravity based on non-linear extensions of the non-metricity scalar
and the torsion scalar. Our approach is based on a systematic
symmetry-reduction of the metric-affine geometry which underlies these
theories. While for the simplest conceivable case the connection disappears
from the field equations and one obtains the Friedmann equations of General
Relativity, we show that in $f(\mathbb{Q})$ cosmology the connection
generically modifies the metric field equations and that some of the connection
components become dynamical. We show that $f(\mathbb{Q})$ cosmology contains
the exact General Relativity solutions and also exact solutions which go
beyond. In $f(\mathbb{T})$~cosmology, however, the connection is completely
fixed and not dynamical.
","[{""version"":""v1"",""created"":""Thu, 9 Sep 2021 12:29:29 GMT""},{""version"":""v2"",""created"":""Sun, 12 Sep 2021 06:11:26 GMT""}]","2022-01-05"
"2109.04210","Drew Hanover","Drew Hanover, Philipp Foehn, Sihao Sun, Elia Kaufmann, Davide
  Scaramuzza","Performance, Precision, and Payloads: Adaptive Nonlinear MPC for
  Quadrotors","8 Pages, 6 figures, Accepted RAL 2021","IEEE Robotics and Automation Letters 0, 2377-3766, 2021","10.1109/LRA.2021.3131690",,"cs.RO","http://arxiv.org/licenses/nonexclusive-distrib/1.0/","  Agile quadrotor flight in challenging environments has the potential to
revolutionize shipping, transportation, and search and rescue applications.
Nonlinear model predictive control (NMPC) has recently shown promising results
for agile quadrotor control, but relies on highly accurate models for maximum
performance. Hence, model uncertainties in the form of unmodeled complex
aerodynamic effects, varying payloads and parameter mismatch will degrade
overall system performance. In this paper, we propose L1-NMPC, a novel hybrid
adaptive NMPC to learn model uncertainties online and immediately compensate
for them, drastically improving performance over the non-adaptive baseline with
minimal computational overhead. Our proposed architecture generalizes to many
different environments from which we evaluate wind, unknown payloads, and
highly agile flight conditions. The proposed method demonstrates immense
flexibility and robustness, with more than 90% tracking error reduction over
non-adaptive NMPC under large unknown disturbances and without any gain tuning.
In addition, the same controller with identical gains can accurately fly highly
agile racing trajectories exhibiting top speeds of 70 km/h, offering tracking
performance improvements of around 50% relative to the non-adaptive NMPC
baseline.
","[{""version"":""v1"",""created"":""Thu, 9 Sep 2021 12:30:08 GMT""},{""version"":""v2"",""created"":""Fri, 3 Dec 2021 14:48:18 GMT""}]","2021-12-06"
"2109.04211","Haim Diamant","Chen Bar-Haim and Haim Diamant","Structured viscoelastic substrates as linear foundations","8 pages","Phys. Rev. E 105, 025005 (2022)","10.1103/PhysRevE.105.025005",,"cond-mat.soft","http://arxiv.org/licenses/nonexclusive-distrib/1.0/","  The linear (Winkler) foundation is a simple model widely used for decades to
account for the surface response of elastic bodies. It models the response as
purely local, linear, and perpendicular to the surface. We extend this model to
the case where the foundation is made of a structured material such as a
polymer network, which has characteristic scales of length and time. We use the
two-fluid model of viscoelastic structured materials to treat a film of finite
thickness, supported on a rigid solid and subjected to a concentrated normal
force at its free surface. We obtain the foundation modulus (Winkler constant)
as a function of the film's thickness, intrinsic correlation length, and
viscoelastic moduli, for three choices of boundary conditions. The results can
be used to readily extend earlier applications of the Winkler model to more
complex, microstructured substrates. They also provide a way to extract the
intrinsic properties of such complex materials from mechanical surface
measurements.
","[{""version"":""v1"",""created"":""Thu, 9 Sep 2021 12:32:27 GMT""},{""version"":""v2"",""created"":""Sun, 27 Feb 2022 11:50:37 GMT""}]","2022-03-01"
"2109.04212","Junxian He","Junxian He, Graham Neubig, Taylor Berg-Kirkpatrick","Efficient Nearest Neighbor Language Models","EMNLP 2021. Update to fix typos. Code is at
  https://github.com/jxhe/efficient-knnlm",,,,"cs.CL","http://arxiv.org/licenses/nonexclusive-distrib/1.0/","  Non-parametric neural language models (NLMs) learn predictive distributions
of text utilizing an external datastore, which allows them to learn through
explicitly memorizing the training datapoints. While effective, these models
often require retrieval from a large datastore at test time, significantly
increasing the inference overhead and thus limiting the deployment of
non-parametric NLMs in practical applications. In this paper, we take the
recently proposed $k$-nearest neighbors language model (Khandelwal et al.,
2020) as an example, exploring methods to improve its efficiency along various
dimensions. Experiments on the standard WikiText-103 benchmark and
domain-adaptation datasets show that our methods are able to achieve up to a 6x
speed-up in inference speed while retaining comparable performance. The
empirical analysis we present may provide guidelines for future research
seeking to develop or deploy more efficient non-parametric NLMs.
","[{""version"":""v1"",""created"":""Thu, 9 Sep 2021 12:32:28 GMT""},{""version"":""v2"",""created"":""Fri, 12 Nov 2021 18:31:12 GMT""},{""version"":""v3"",""created"":""Mon, 15 Nov 2021 01:38:46 GMT""}]","2021-11-16"
"2109.04219","Wissam Saidi","Timothy T. Yang, Rituja B. Patil, James R. McKone, and Wissam A. Saidi","Revisiting Trends in the Exchange Current for Hydrogen Evolution","Accepted in Catalysis Science and Technology",,,,"cond-mat.mtrl-sci","http://creativecommons.org/licenses/by/4.0/","  N{\o}rskov and collaborators proposed a simple kinetic model to explain the
volcano relation for the hydrogen evolution reaction on transition metal
surfaces in such that $ j_0= k_0 f({\Delta}G_H)$ where j_0 is the exchange
current density, $f({\Delta}G_H)$ is a function of the hydrogen adsorption free
energy ${\Delta}G_H$ as computed from density functional theory, and $k_0$ is a
universal rate constant. Herein, focusing on the hydrogen evolution reaction in
acidic medium, we revisit the original experimental data and find that the
fidelity of this kinetic model can be significantly improved by invoking
metal-dependence on $k_0$ such that the logarithm of $k_0$ linearly depends on
the absolute value of ${\Delta}G_H$. We further confirm this relationship using
additional experimental data points obtained from a critical review of the
available literature. Our analyses show that the new model decreases the
discrepancy between calculated and experimental exchange current density values
by up to four orders of magnitude. Furthermore, we show the model can be
further improved using machine learning and statistical inference methods that
integrate additional material properties
","[{""version"":""v1"",""created"":""Thu, 9 Sep 2021 12:35:45 GMT""}]","2021-09-10"
"2109.04221","Lei Li","Ziyi Liu, Lei Li, Mengxuan Zhang, Wen Hua, Xiaofang Zhou","Multi-Constraint Shortest Path using Forest Hop Labeling",,,,,"cs.DS","http://arxiv.org/licenses/nonexclusive-distrib/1.0/","  The \textit{Multi-Constraint Shortest Path (MCSP)} problem aims to find the
shortest path between two nodes in a network subject to a given constraint set.
It is typically processed as a \textit{skyline path} problem. However, the
number of intermediate skyline paths becomes larger as the network size
increases and the constraint number grows, which brings about the dramatical
growth of computational cost and further makes the existing index-based methods
hardly capable of obtaining the complete exact results. In this paper, we
propose a novel high-dimensional skyline path concatenation method to avoid the
expensive skyline path search, which then supports the efficient construction
of hop labeling index for \textit{MCSP} queries. Specifically, a set of
insightful observations and techniques are proposed to improve the efficiency
of concatenating two skyline path set, a \textit{n-Cube} technique is designed
to prune the concatenation space among multiple hops, and a \textit{constraint
pruning} method is used to avoid the unnecessary computation. Furthermore, to
scale up to larger networks, we propose a novel \textit{forest hop labeling}
which enables the parallel label construction from different network
partitions. Our approach is the first method that can achieve both accuracy and
efficiency for \textit{MCSP} query answering. Extensive experiments on
real-life road networks demonstrate the superiority of our method over the
state-of-the-art solutions.
","[{""version"":""v1"",""created"":""Thu, 9 Sep 2021 12:36:47 GMT""}]","2021-09-10"
"2109.04222","Meng Guo","An T. Le, Meng Guo, Niels van Duijkeren, Leonel Rozo, Robert Krug,
  Andras G. Kupcsik, Mathias Buerger","Learning Forceful Manipulation Skills from Multi-modal Human
  Demonstrations",,,,,"cs.RO","http://creativecommons.org/licenses/by-nc-nd/4.0/","  Learning from Demonstration (LfD) provides an intuitive and fast approach to
program robotic manipulators. Task parameterized representations allow easy
adaptation to new scenes and online observations. However, this approach has
been limited to pose-only demonstrations and thus only skills with spatial and
temporal features. In this work, we extend the LfD framework to address
forceful manipulation skills, which are of great importance for industrial
processes such as assembly. For such skills, multi-modal demonstrations
including robot end-effector poses, force and torque readings, and operation
scene are essential. Our objective is to reproduce such skills reliably
according to the demonstrated pose and force profiles within different scenes.
The proposed method combines our previous work on task-parameterized
optimization and attractor-based impedance control. The learned skill model
consists of (i) the attractor model that unifies the pose and force features,
and (ii) the stiffness model that optimizes the stiffness for different stages
of the skill. Furthermore, an online execution algorithm is proposed to adapt
the skill execution to real-time observations of robot poses, measured forces,
and changed scenes. We validate this method rigorously on a 7-DoF robot arm
over several steps of an E-bike motor assembly process, which require different
types of forceful interaction such as insertion, sliding and twisting.
","[{""version"":""v1"",""created"":""Thu, 9 Sep 2021 12:37:47 GMT""}]","2021-09-10"
"2109.04223","Haonan Lu","Yinquan Lu, Haonan Lu, Guirong Fu, Qun Liu","KELM: Knowledge Enhanced Pre-Trained Language Representations with
  Message Passing on Hierarchical Relational Graphs","ICLR 2022 on DLG4NLP","ICLR 2022 Workshop on Deep Learning on Graphs for Natural Language
  Processing,2022",,,"cs.CL cs.AI","http://arxiv.org/licenses/nonexclusive-distrib/1.0/","  Incorporating factual knowledge into pre-trained language models (PLM) such
as BERT is an emerging trend in recent NLP studies. However, most of the
existing methods combine the external knowledge integration module with a
modified pre-training loss and re-implement the pre-training process on the
large-scale corpus. Re-pretraining these models is usually resource-consuming,
and difficult to adapt to another domain with a different knowledge graph (KG).
Besides, those works either cannot embed knowledge context dynamically
according to textual context or struggle with the knowledge ambiguity issue. In
this paper, we propose a novel knowledge-aware language model framework based
on fine-tuning process, which equips PLM with a unified knowledge-enhanced text
graph that contains both text and multi-relational sub-graphs extracted from
KG. We design a hierarchical relational-graph-based message passing mechanism,
which can allow the representations of injected KG and text to mutually update
each other and can dynamically select ambiguous mentioned entities that share
the same text. Our empirical results show that our model can efficiently
incorporate world knowledge from KGs into existing language models such as
BERT, and achieve significant improvement on the machine reading comprehension
(MRC) task compared with other knowledge-enhanced models.
","[{""version"":""v1"",""created"":""Thu, 9 Sep 2021 12:39:17 GMT""},{""version"":""v2"",""created"":""Thu, 5 May 2022 11:48:50 GMT""}]","2022-05-06"
"2109.04224","Fridolin Spitzer","Fridolin Spitzer, Christoph Burkhardt, Jonas Pape, Thorsten Kleine","Collisional mixing between inner and outer solar system planetesimals
  inferred from the Nedagolla iron meteorite","Accepted for publication in Meteoritics & Planetary Science",,"10.1111/maps.13744",,"astro-ph.EP physics.geo-ph","http://creativecommons.org/licenses/by-nc-sa/4.0/","  The ungrouped iron meteorite Nedagolla is the first meteorite with bulk Mo,
Ru, and Ni isotopic compositions that are intermediate between those of the
non-carbonaceous (NC) and carbonaceous (CC) meteorite reservoirs. The Hf-W
chronology of Nedagolla indicates that this mixed NC-CC isotopic composition
was established relatively late, more than 7 million years after Solar System
formation. The mixed NC-CC isotopic composition is consistent with the chemical
composition of Nedagolla, which combines signatures of metal segregation under
more oxidizing conditions (relative depletions in Mo and W), characteristic for
CC bodies, and more reducing conditions (high Si and Cr contents),
characteristic for some NC bodies, in a single sample. These data combined
suggest that Nedagolla formed as the result of collisional mixing of NC and CC
core material, which partially re-equilibrated with silicate mantle material
that predominantly derives from the NC body. These mixing processes might have
occurred during a hit-and-run collision between two differentiated bodies,
which also provides a possible pathway for Nedagolla's extreme volatile element
depletion. As such, Nedagolla provides the first isotopic evidence for early
collisional mixing of NC and CC bodies that is expected as a result of
Jupiter's growth.
","[{""version"":""v1"",""created"":""Thu, 9 Sep 2021 12:40:44 GMT""}]","2022-02-23"
"2109.04225","Andrew Allan","Andrew L. Allan, Chong Liu and David J. Pr\""omel","A C\`adl\`ag Rough Path Foundation for Robust Finance","35 pages",,,,"math.PR q-fin.MF","http://arxiv.org/licenses/nonexclusive-distrib/1.0/","  Using rough path theory, we provide a pathwise foundation for stochastic
It\^o integration, which covers most commonly applied trading strategies and
mathematical models of financial markets, including those under Knightian
uncertainty. To this end, we introduce the so-called Property (RIE) for
c\`adl\`ag paths, which is shown to imply the existence of a c\`adl\`ag rough
path and of quadratic variation in the sense of F\""ollmer. We prove that the
corresponding rough integrals exist as limits of left-point Riemann sums along
a suitable sequence of partitions. This allows one to treat integrands of
non-gradient type, and gives access to the powerful stability estimates of
rough path theory. Additionally, we verify that (path-dependent) functionally
generated trading strategies and Cover's universal portfolio are admissible
integrands, and that Property (RIE) is satisfied by both (Young)
semimartingales and typical price paths.
","[{""version"":""v1"",""created"":""Thu, 9 Sep 2021 12:40:46 GMT""},{""version"":""v2"",""created"":""Fri, 9 Sep 2022 13:29:36 GMT""},{""version"":""v3"",""created"":""Tue, 2 May 2023 09:56:24 GMT""}]","2023-05-03"
"2109.04226","Jing Dong","Jing Dong, Shuai Li, Baoxiang Wang","Incentivizing an Unknown Crowd",,,,,"cs.LG","http://creativecommons.org/licenses/by/4.0/","  Motivated by the common strategic activities in crowdsourcing labeling, we
study the problem of sequential eliciting information without verification
(EIWV) for workers with a heterogeneous and unknown crowd. We propose a
reinforcement learning-based approach that is effective against a wide range of
settings including potential irrationality and collusion among workers. With
the aid of a costly oracle and the inference method, our approach dynamically
decides the oracle calls and gains robustness even under the presence of
frequent collusion activities. Extensive experiments show the advantage of our
approach. Our results also present the first comprehensive experiments of EIWV
on large-scale real datasets and the first thorough study of the effects of
environmental variables.
","[{""version"":""v1"",""created"":""Thu, 9 Sep 2021 12:42:26 GMT""}]","2021-09-10"
"2109.04227","Seema Sangari","Seema Sangari and Herman E. Ray","Evaluation of imputation techniques with varying percentage of missing
  data","16 pages, 21 figures, 3 tables","CSP2022 Section, JSM Proceedings, 2022, pp. 640-654",,,"stat.ME stat.OT","http://creativecommons.org/licenses/by/4.0/","  Missing data is a common problem which has consistently plagued statisticians
and applied analytical researchers. While replacement methods like mean-based
or hot deck imputation have been well researched, emerging imputation
techniques enabled through improved computational resources have had limited
formal assessment. This study formally considers five more recently developed
imputation methods: Amelia, Mice, mi, Hmisc and missForest - compares their
performances using RMSE against actual values and against the well-established
mean-based replacement approach. The RMSE measure was consolidated by method
using a ranking approach. Our results indicate that the missForest algorithm
performed best and the mi algorithm performed worst.
","[{""version"":""v1"",""created"":""Thu, 9 Sep 2021 12:43:22 GMT""}]","2022-12-27"
