"2109.04049","Siqi Zheng","Siqi Zheng, Shiliang Zhang, Weilong Huang, Qian Chen, Hongbin Suo,
  Ming Lei, Jinwei Feng, Zhijie Yan","BeamTransformer: Microphone Array-based Overlapping Speech Detection",,,,,"cs.SD cs.AI eess.AS","http://creativecommons.org/licenses/by/4.0/","  We propose BeamTransformer, an efficient architecture to leverage
beamformer's edge in spatial filtering and transformer's capability in context
sequence modeling. BeamTransformer seeks to optimize modeling of sequential
relationship among signals from different spatial direction. Overlapping speech
detection is one of the tasks where such optimization is favorable. In this
paper we effectively apply BeamTransformer to detect overlapping segments.
Comparing to single-channel approach, BeamTransformer exceeds in learning to
identify the relationship among different beam sequences and hence able to make
predictions not only from the acoustic signals but also the localization of the
source. The results indicate that a successful incorporation of microphone
array signals can lead to remarkable gains. Moreover, BeamTransformer takes one
step further, as speech from overlapped speakers have been internally separated
into different beams.
","[{""version"":""v1"",""created"":""Thu, 9 Sep 2021 06:10:48 GMT""}]","2021-09-10"
"2109.04050","Venkata Suryanarayana Mummidi","V. Suryanarayana Mummidi, Ketan M. Patel","Leptogenesis and fermion mass fit in a renormalizable $SO(10)$ model","26 pages, 4 captioned figures, 2 tables; a reference and a few
  explanatory sentences are added;Published version","JHEP 12 (2021) 042","10.1007/JHEP12(2021)042",,"hep-ph","http://creativecommons.org/licenses/by/4.0/","  A non-supersymmetric renormalizable $SO(10)$ model is investigated for its
viability in explaining the observed fermion masses and mixing parameters along
with the baryon asymmetry produced via thermal leptogenesis. The Yukawa sector
of the model consists of complex $10_H$ and $\overline{126}_H$ scalars with a
Peccei-Quinn like symmetry and it leads to strong correlations among the Yukawa
couplings of all the standard model fermions including the couplings and masses
of the right-handed (RH) neutrinos. The latter implies the necessity to include
the second lightest RH neutrino and flavor effects for the precision
computation of leptogenesis. We use the most general density matrix equations
to calculate the temperature evolution of flavoured leptonic asymmetry. A
simplified analytical solution of these equations, applicable to the RH
neutrino spectrum predicted in the model, is also obtained which allows one to
fit the observed baryon to photon ratio along with the other fermion mass
observables in a numerically efficient way. The analytical and numerical
solutions are found to be in agreement within a factor of ${\cal O}(1)$. We
find that the successful leptogenesis in this model does not prefer any
particular value for leptonic Dirac and Majorana CP phases and the entire range
of values of these observables is found to be consistent. The model
specifically predicts (a) the lightest neutrino mass $m_{\nu_1}$ between 2-8
meV, (b) the effective mass of neutrinoless double beta decay $m_{\beta \beta}$
between 4-10 meV, and (c) a particular correlation between the Dirac and one of
the Majorana CP phases.
","[{""version"":""v1"",""created"":""Thu, 9 Sep 2021 06:11:35 GMT""},{""version"":""v2"",""created"":""Thu, 9 Dec 2021 04:15:57 GMT""}]","2021-12-10"
"2109.04051","Daiki Saito","Daiki Saito, Chul-Moon Yoo","False Vacuum Decay in Rotating BTZ Spacetimes","23 pages, 15 figures, added the detailed information of the
  reference, accepted version for publication",,"10.1103/PhysRevD.104.124037",,"gr-qc hep-th","http://arxiv.org/licenses/nonexclusive-distrib/1.0/","  We analyse vacuum decay in rotating BTZ black hole spacetimes with the thin
wall approximation. Possible parameter regions for the vacuum decay are
clarified. We find that the nucleation rate is dominated by the bounce solution
with the static shell configuration. The nucleation rate of the static shell
decreases with the mass of the initial black hole. For a larger/smaller value
of the initial black hole, the nucleation rate can be smaller/larger than that
of the Coleman De Luccia vacuum decay in the pure AdS spacetime. Through the
vacuum decay, the black hole gains its mass and loses the horizon area. We also
find that the nucleation rate increases with increasing the angular momentum of
the spacetime.
","[{""version"":""v1"",""created"":""Thu, 9 Sep 2021 06:12:36 GMT""},{""version"":""v2"",""created"":""Tue, 21 Sep 2021 09:52:26 GMT""},{""version"":""v3"",""created"":""Mon, 29 Nov 2021 01:15:41 GMT""},{""version"":""v4"",""created"":""Tue, 30 Nov 2021 02:13:36 GMT""}]","2021-12-22"
"2109.04052","Tomio Umeda","Karl Michael Schmidt, Tomio Umeda","Continuum limits for discrete Dirac operators on 2D square lattices","29 pages","Analysis and Mathematical Physics volume 13, Article number: 46
  (2023)","10.1007/s13324-023-00809-7",,"math-ph cs.NA math.FA math.MP math.NA math.SP","http://creativecommons.org/licenses/by/4.0/","  We discuss the continuum limit of discrete Dirac operators on the square
lattice in $\mathbb R^2$ as the mesh size tends to zero. To this end, we
propose the most natural and simplest embedding of $\ell^2(\mathbb Z_h^d)$ into
$L^2(\mathbb R^d)$, which enables us to compare the discrete Dirac operators
with the continuum Dirac operators in the same Hilbert space $L^2(\mathbb
R^2)^2$. In particular, we prove that the discrete Dirac operators converge to
the continuum Dirac operators in the strong resolvent sense. Potentials are
assumed to be bounded and uniformly continuous functions on $\mathbb R^2$ and
allowed to be complex matrix-valued. We also prove that the discrete Dirac
operators do not converge to the continuum Dirac operators in the norm
resolvent sense. This is closely related to the observation that the Liouville
theorem does not hold in discrete complex analysis.
","[{""version"":""v1"",""created"":""Thu, 9 Sep 2021 06:17:42 GMT""},{""version"":""v2"",""created"":""Sun, 4 Dec 2022 08:55:28 GMT""},{""version"":""v3"",""created"":""Fri, 19 May 2023 01:50:48 GMT""}]","2023-05-22"
"2109.04053","Fei Wang","Fei Wang, Kexuan Sun, Jay Pujara, Pedro Szekely, Muhao Chen","Table-based Fact Verification with Salience-aware Learning","EMNLP 2021 (Findings)",,,,"cs.CL cs.AI cs.LG","http://creativecommons.org/licenses/by-nc-nd/4.0/","  Tables provide valuable knowledge that can be used to verify textual
statements. While a number of works have considered table-based fact
verification, direct alignments of tabular data with tokens in textual
statements are rarely available. Moreover, training a generalized fact
verification model requires abundant labeled training data. In this paper, we
propose a novel system to address these problems. Inspired by counterfactual
causality, our system identifies token-level salience in the statement with
probing-based salience estimation. Salience estimation allows enhanced learning
of fact verification from two perspectives. From one perspective, our system
conducts masked salient token prediction to enhance the model for alignment and
reasoning between the table and the statement. From the other perspective, our
system applies salience-aware data augmentation to generate a more diverse set
of training instances by replacing non-salient terms. Experimental results on
TabFact show the effective improvement by the proposed salience-aware learning
techniques, leading to the new SOTA performance on the benchmark. Our code is
publicly available at https://github.com/luka-group/Salience-aware-Learning .
","[{""version"":""v1"",""created"":""Thu, 9 Sep 2021 06:18:46 GMT""}]","2021-09-10"
"2109.04054","Jaker Hossain","Shaikh Khaled Mostaque, Bipanko Kumar Mondal and Jaker Hossain","Theoretical insight into the enhancement of longer-wavelength light
  absorption in silicon solar cell with multilevel impurities","30 pages, 11 figures, 1 table",,,,"physics.app-ph physics.optics","http://arxiv.org/licenses/nonexclusive-distrib/1.0/","  In this article, we theoretically demonstrate multilevel impurity
photovoltaic effect in an efficient silicon dual-homojunction solar cell that
ensures an extended absorption of longer wavelength light. Along with suitable
contact work functions (Ni and Ta as anode and cathode, respectively), three
impurity energy levels from acceptor type impurities (One from Tl and two from
Zn) have been introduced in the energy gap of the absorber layer in the solar
cell. The pristine Si solar cell shows a PCE of 25.4% with JSC= 37.99 mA/cm2,
VOC=0.780V and FF=85.76%, respectively. The incorporation of Tl impurity level
alone provides a PCE of 33.4%, with JSC= 51.56 mA/cm2, VOC=0.789 V and
FF=82.03%, respectively. The PCE of the solar cell further enhances to 35.4%
with a further enhancement of the short circuit current by 3.76 mA/cm2 due to
the inclusion of Zn impurity into the optimized structure. This enhancement of
the JSC and hence PCE is resulted from the longer wavelength light absorption
due to impurity-assisted two-step photon upconversion in the solar cell.
","[{""version"":""v1"",""created"":""Thu, 9 Sep 2021 06:27:59 GMT""}]","2021-09-10"
"2109.04055","Nikolay Bazhenov","Nikolay Bazhenov, Keng Meng Ng, Luca San Mauro, Andrea Sorbi","Punctual equivalence relations and their (punctual) complexity","37 pages",,,,"math.LO","http://arxiv.org/licenses/nonexclusive-distrib/1.0/","  The complexity of equivalence relations has received much attention in the
recent literature. The main tool for such endeavour is the following
reducibility: given equivalence relations $R$ and $S$ on natural numbers, $R$
is computably reducible to $S$ if there is a computable function $f \colon
\omega \to \omega$ that induces an injective map from $R$-equivalence classes
to $S$-equivalence classes. In order to compare the complexity of equivalence
relations which are computable, researchers considered also feasible variants
of computable reducibility, such as the polynomial-time reducibility. In this
work, we explore $\mathbf{Peq}$, the degree structure generated by primitive
recursive reducibility on punctual equivalence relations (i.e., primitive
recursive equivalence relations with domain $\omega$). In contrast with all
other known degree structures on equivalence relations, we show that
$\mathbf{Peq}$ has much more structure: e.g., we show that it is a dense
distributive lattice. On the other hand, we also offer evidence of the
intricacy of $\mathbf{Peq}$, proving, e.g., that the structure is neither rigid
nor homogeneous.
","[{""version"":""v1"",""created"":""Thu, 9 Sep 2021 06:28:04 GMT""}]","2021-09-10"
"2109.04056","Michael Edmund Tobar","Michael E Tobar, Ben T McAllister, Maxim Goryachev","Poynting vector controversy in axion modified electrodynamics","Published version in Phys. Rev. D. has errors in equations: (28),
  (43), (52), (A8), (A10), and (B10). This version corrects these errors,
  however, the corrections lead to no change in the conclusions","Phys. Rev. D 105, 045009, 2022","10.1103/PhysRevD.105.045009","Erratum: Phys. Rev. D 106, 109903(E) (2022)","hep-ph astro-ph.IM gr-qc hep-ex","http://arxiv.org/licenses/nonexclusive-distrib/1.0/","  The most sensitive haloscopes that search for axion dark matter through the
two photon electromagnetic anomaly, convert axions into photons through the
mixing of axions with a large DC magnetic field. In this work we apply Poynting
theorem to the resulting axion modified electrodynamics and identify two
possible Poynting vectors, one similar to the Abraham Poynting vector and the
other to the Minkowski Poynting vector in electrodynamics. The latter picks up
the extra non-conservative terms while the former does not. To understand the
source of energy conversion and power flow in the detection systems, we apply
the two Poynting theorems to axion modified electrodynamics, for both the
resonant cavity and broadband low-mass axion detectors. We show that both
Poynting theorems give the same sensitivity for a resonant cavity axion
haloscope, but predict markedly different sensitivity for a low-mass broadband
capacitive haloscope. Hence we ask the question, can understanding which one is
the correct one for axion dark matter detection, be considered under the
framework of the Abraham-Minkowski controversy? In reality, this should be
confirmed by experiment when the axion is detected. However, many
electrodynamic experiments have ruled in favour of the Minkowski Poynting
vector when considering the canonical momentum in dielectric media. In light of
this, we show that the axion modified Minkowski Poynting vector should indeed
be taken seriously for sensitivity calculation for low-mass axion haloscope
detectors in the quasi static limit, and predict orders of magnitude better
sensitivity than the Abraham Poynting vector equivalent.
","[{""version"":""v1"",""created"":""Thu, 9 Sep 2021 06:30:40 GMT""},{""version"":""v2"",""created"":""Sun, 24 Oct 2021 04:53:35 GMT""},{""version"":""v3"",""created"":""Sun, 30 Jan 2022 01:56:08 GMT""},{""version"":""v4"",""created"":""Thu, 10 Feb 2022 22:41:45 GMT""},{""version"":""v5"",""created"":""Thu, 10 Nov 2022 05:43:16 GMT""}]","2022-12-02"
"2109.04057","Sheagan John Mr","Sheagan A. K. A. John","Generalizations of the Coincidence Value Property","36 pages",,,,"math.GN math.AT","http://arxiv.org/licenses/nonexclusive-distrib/1.0/","  For $f,g:X\longrightarrow X$ continuous and commuting maps of a Hausdorff
space, we investigate various conditions on $X$ and on the pair $(f,g)$ which
provide existence of a coincidence value. We introduce generalized notions of
the coincidence value property and use this added flexibility to determine how
various coincidence properties of $X$ are related to group actions on $X$ and
to coincidence properties of associated fibre bundles and adjunction spaces. We
also present a sheaf theoretical approach to obtaining information concerning
coincidence values through construction of an ""almost constant"" presheaf. In
particular, we prove several partial results concerning the special cases where
$X$ is either a low dimensional dimensional sphere or the closed unit disk.
","[{""version"":""v1"",""created"":""Thu, 9 Sep 2021 06:47:16 GMT""}]","2021-09-10"
"2109.04058","Benjamin Avanzi","Benjamin Avanzi, Gregory Clive Taylor, and Melantha Wang","SPLICE: A Synthetic Paid Loss and Incurred Cost Experience Simulator",,,"10.1017/S1748499522000057",,"q-fin.RM stat.AP","http://arxiv.org/licenses/nonexclusive-distrib/1.0/","  In this paper, we first introduce a simulator of cases estimates of incurred
losses, called `SPLICE` (Synthetic Paid Loss and Incurred Cost Experience). In
three modules, case estimates are simulated in continuous time, and a record is
output for each individual claim. Revisions for the case estimates are also
simulated as a sequence over the lifetime of the claim, in a number of
different situations. Furthermore, some dependencies in relation to case
estimates of incurred losses are incorporated, particularly recognizing certain
properties of case estimates that are found in practice. For example, the
magnitude of revisions depends on ultimate claim size, as does the distribution
of the revisions over time. Some of these revisions occur in response to
occurrence of claim payments, and so `SPLICE` requires input of simulated
per-claim payment histories. The claim data can be summarized by accident and
payment ""periods"" whose duration is an arbitrary choice (e.g. month, quarter,
etc.) available to the user.
  `SPLICE` is a fully documented R package that is publicly available and open
source (on CRAN). It is built on an existing simulator of individual claim
experience called `SynthETIC` (Avanzi et al., 2021a,b), which offers flexible
modelling of occurrence, notification, as well as the timing and magnitude of
individual partial payments. This is in contrast with the incurred losses,
which constitute the additional contribution of `SPLICE`. The inclusion of
incurred loss estimates provides a facility that almost no other simulators do.
","[{""version"":""v1"",""created"":""Thu, 9 Sep 2021 06:47:24 GMT""},{""version"":""v2"",""created"":""Tue, 14 Sep 2021 06:18:16 GMT""},{""version"":""v3"",""created"":""Fri, 22 Oct 2021 02:37:52 GMT""},{""version"":""v4"",""created"":""Mon, 28 Mar 2022 10:17:10 GMT""}]","2022-08-09"
"2109.04059","Sven Buder","Sven Buder, Karin Lind, Melissa K. Ness, Diane K. Feuillet, Danny
  Horta, Stephanie Monty, Tobias Buck, Thomas Nordlander, Joss Bland-Hawthorn,
  Andrew R. Casey, Gayandhi M. De Silva, Valentina D'Orazi, Ken C. Freeman,
  Michael R. Hayden, Janez Kos, Sarah L. Martell, Geraint F. Lewis, Jane Lin,
  Katharine. J. Schlesinger, Sanjib Sharma, Jeffrey D. Simpson, Dennis Stello,
  Daniel B. Zucker, Tomaz Zwitter, Ioana Ciuca, Jonathan Horner, Chiaki
  Kobayashi, Yuan-Sen Ting, Rosemary F. G. Wyse, and The GALAH Collaboration","The GALAH Survey: Chemical tagging and chrono-chemodynamics of accreted
  halo stars with GALAH+ DR3 and $Gaia$ eDR3","29 pages, 18 figures, 6 tables; publicshed in MNRAS; all code to
  recreate results (based on public data described in arXiv:2011.02505) and
  figures available at https://github.com/svenbuder/Accreted-stars-in-GALAH-DR3","MNRAS, 510, 2407 (2022)","10.1093/mnras/stab3504",,"astro-ph.GA astro-ph.SR","http://creativecommons.org/licenses/by/4.0/","  Since the advent of $Gaia$ astrometry, it is possible to identify massive
accreted systems within the Galaxy through their unique dynamical signatures.
One such system, $Gaia$-Sausage-Enceladus (GSE), appears to be an early
""building block"" given its virial mass $> 10^{10}\,\mathrm{M_\odot}$ at infall
($z\sim1-3$). In order to separate the progenitor population from the
background stars, we investigate its chemical properties with up to 30 element
abundances from the GALAH+ Survey Data Release 3 (DR3). To inform our choice of
elements for purely chemically selecting accreted stars, we analyse 4164 stars
with low-$\alpha$ abundances and halo kinematics. These are most different to
the Milky Way stars for abundances of Mg, Si, Na, Al, Mn, Fe, Ni, and Cu. Based
on the significance of abundance differences and detection rates, we apply
Gaussian mixture models to various element abundance combinations. We find the
most populated and least contaminated component, which we confirm to represent
GSE, contains 1049 stars selected via [Na/Fe] vs. [Mg/Mn] in GALAH+ DR3. We
provide tables of our selections and report the chrono-chemodynamical
properties (age, chemistry, and dynamics). Through a previously reported clean
dynamical selection of GSE stars, including $30 <
\sqrt{J_R~/~\mathrm{kpc\,km\,s^{-1}}} < 55$, we can characterise an
unprecedented 24 abundances of this structure with GALAH+ DR3. Our chemical
selection allows us to prevent circular reasoning and characterise the
dynamical properties of the GSE, for example mean
$\sqrt{J_R~/~\mathrm{kpc\,km\,s^{-1}}} = 26_{-14}^{+9}$. We find only
$(29\pm1)\%$ of the GSE stars within the clean dynamical selection region. Our
methodology will improve future studies of accreted structures and their
importance for the formation of the Milky Way.
","[{""version"":""v1"",""created"":""Thu, 9 Sep 2021 06:50:18 GMT""},{""version"":""v2"",""created"":""Thu, 6 Jan 2022 00:20:15 GMT""}]","2022-01-07"
"2109.04060","Mahmood Karimi","Mahmood Karimi (School of Electrical and Computer Engineering, Shiraz
  University, Iran)","Stochastic Maximum-Likelihood DOA Estimation and Source Enumeration in
  the Presence of Nonuniform Noise","11 pages, 6 figures",,,,"eess.SP","http://creativecommons.org/licenses/by-nc-nd/4.0/","  In this paper, the problem of determining the number of signal sources
impinging on an array of sensors and estimating their directions-of-arrival
(DOAs) in the presence of spatially white nonuniform noise is considered. It is
known that, in the case of nonuniform noise, the stochastic likelihood function
cannot be concentrated with respect to the diagonal elements of noise
covariance matrix. Therefore, the stochastic maximum-likelihood (SML) DOA
estimation and source enumeration in the presence of nonuniform noise requires
multidimensional search with very high computational complexity. Recently, two
algorithms for estimating noise covariance matrix in the presence of nonuniform
noise have been proposed in the literature. Using these new estimates of noise
covariance matrix, an approach for obtaining the SML estimate of signal DOAs is
proposed. In addition, new approaches are proposed for SML source enumeration
with information criteria in the presence of nonuniform noise. The important
feature of the proposed SML approaches for DOA estimation and source
enumeration is that they have admissible computational complexity. In addition,
some of them are robust against correlation between source signals. The
performance of the proposed DOA estimation and source enumeration approaches
are investigated using computer simulations.
","[{""version"":""v1"",""created"":""Thu, 9 Sep 2021 06:52:19 GMT""}]","2021-09-10"
"2109.04061","Ben Whale","Susan M. Scott and Ben E. Whale","What actually happens when you approach a gravitational singularity?","This essay received an Honorable Mention in the 2021 Essay
  Competition of the Gravity Research Foundation (see
  https://static1.squarespace.com/static/5852e579be659442a01f27b8/t/609d66c823a9a352bc3b24c3/1620928201758/2021-GRF-Abstracts.pdf).
  Keywords: Singularity, completion, boundary, endpoint theorem, coordinates,
  singularity theorem, curvature, Kerr, Boyer-Lindquist, black hole","International Journal of Modern Physics D (2021), 2142007","10.1142/S0218271821420074",,"gr-qc","http://arxiv.org/licenses/nonexclusive-distrib/1.0/","  Roger Penrose's 2020 Nobel Prize in Physics recognises that his
identification of the concepts of ""gravitational singularity"" and an
""incomplete, inextendible, null geodesic"" is physically very important. The
existence of an incomplete, inextendible, null geodesic doesn't say much,
however, if anything, about curvature divergence, nor is it a helpful
definition for performing actual calculations. Physicists have long sought for
a coordinate independent method of defining where a singularity is located,
given an incomplete, inextendible, null geodesic, that also allows for standard
analytic techniques to be implemented. In this essay we present a solution to
this issue. It is now possible to give a concrete relationship between an
incomplete, inextendible, null geodesic and a gravitational singularity, and to
study any possible curvature divergence using standard techniques.
","[{""version"":""v1"",""created"":""Thu, 9 Sep 2021 06:57:37 GMT""}]","2021-09-10"
"2109.04062","A. R. Usha Devi","K R Parthasarathy","Computation of sandwiched relative alpha-entropy of two n-mode gaussian
  states","11 pages, no figures",,,,"quant-ph","http://creativecommons.org/licenses/by/4.0/","  A formula for the sandwiched relative $\alpha$-entropy
$\widetilde{D}_\alpha(\rho\vert\vert\sigma)=\frac{1}{\alpha-1}\, \ln\,{\rm
Tr}\,
\left(\sigma^{\frac{1-\alpha}{2\alpha}}\,\rho\,\sigma^{\frac{1-\alpha}{2\alpha}}\right)^\alpha$
for $0 < \alpha < 1$, of two $n$ mode gaussian states $\rho$, $\sigma$ in the
boson Fock space $\Gamma(\mathbb{C}^n)$ is presented. This computation
extensively employs the $\mathcal{E}_2$-parametrization of gaussian states in
$\Gamma(\mathbb{C}^n)$ introduced in J. Math. Phys. {\bf 62} (2021), 022102.
","[{""version"":""v1"",""created"":""Thu, 9 Sep 2021 07:00:30 GMT""},{""version"":""v2"",""created"":""Fri, 12 Nov 2021 04:01:08 GMT""}]","2021-11-15"
"2109.04063","Kenta Kiuchi","Reetika Dudi, Ananya Adhikari, Bernd Br\""ugmann, Tim Dietrich, Kota
  Hayashi, Kyohei Kawaguchi, Kenta Kiuchi, Koutarou Kyutoku, Masaru Shibata,
  Wolfgang Tichy","Investigating GW190425 with numerical-relativity simulations","10 pages, 7 figures",,,,"astro-ph.HE gr-qc","http://creativecommons.org/licenses/by/4.0/","  The third observing run of the LIGO-Virgo collaboration has resulted in about
hundred gravitational-wave triggers including the binary neutron star merger
GW190425. However, none of these events have been accompanied with an
electromagnetic transient found during extensive follow-up searches. In this
article, we perform new numerical-relativity simulations of binary neutron star
and black hole - neutron star systems that have a chirp mass consistent with
GW190425. Assuming that the GW190425's sky location was covered with sufficient
accuracy during the electromagnetic follow-up searches, we investigate whether
the non-detection of the kilonova is compatible with the source parameters
estimated through the gravitational-wave analysis and how one can use this
information to place constraints on the properties of the system. Our
simulations suggest that GW190425 is incompatible with an unequal mass binary
neutron star merger with a mass ratio $q<0.8$ when considering stiff or
moderately stiff equations of state if the binary was face-on and covered by
the observation. Our analysis shows that a detailed observational result for
kilonovae will be useful to constrain the mass ratio of binary neutron stars in
future events.
","[{""version"":""v1"",""created"":""Thu, 9 Sep 2021 07:00:50 GMT""},{""version"":""v2"",""created"":""Fri, 17 Sep 2021 07:49:50 GMT""}]","2021-09-20"
