"2105.00115","James Diffenderfer","James Diffenderfer, Daniel Osei-Kuffuor, Harshitha Menon","QDOT: Quantized Dot Product Kernel for Approximate High-Performance
  Computing",,,,,"math.NA cs.MS cs.NA","http://creativecommons.org/licenses/by/4.0/","  Approximate computing techniques have been successful in reducing computation
and power costs in several domains. However, error sensitive applications in
high-performance computing are unable to benefit from existing approximate
computing strategies that are not developed with guaranteed error bounds. While
approximate computing techniques can be developed for individual
high-performance computing applications by domain specialists, this often
requires additional theoretical analysis and potentially extensive software
modification. Hence, the development of low-level error-bounded approximate
computing strategies that can be introduced into any high-performance computing
application without requiring additional analysis or significant software
alterations is desirable. In this paper, we provide a contribution in this
direction by proposing a general framework for designing error-bounded
approximate computing strategies and apply it to the dot product kernel to
develop qdot -- an error-bounded approximate dot product kernel. Following the
introduction of qdot, we perform a theoretical analysis that yields a
deterministic bound on the relative approximation error introduced by qdot.
Empirical tests are performed to illustrate the tightness of the derived error
bound and to demonstrate the effectiveness of qdot on a synthetic dataset, as
well as two scientific benchmarks -- Conjugate Gradient (CG) and the Power
method. In particular, using qdot for the dot products in CG can result in a
majority of components being perforated or quantized to half precision without
increasing the iteration count required for convergence to the same solution as
CG using a double precision dot product.
","[{""version"":""v1"",""created"":""Fri, 30 Apr 2021 22:41:17 GMT""}]","2021-05-04"
"2105.00116","Erik Mainellis","Erik Mainellis","Nonabelian Extensions and Factor Systems for the Algebras of Loday","22 pages",,,,"math.RA","http://arxiv.org/licenses/nonexclusive-distrib/1.0/","  Factor systems are a tool for working on the extension problem of algebraic
structures such as groups, Lie algebras, and associative algebras. Their
applications are numerous and well-known in these common settings. We construct
$\mathscr{P}$ algebra analogues to a series of results from W. R. Scott's
$\textit{Group Theory}$, which gives an explicit theory of factor systems for
the group case. Here $\mathscr{P}$ ranges over Leibniz, Zinbiel, diassociative,
and dendriform algebras, which we dub ""the algebras of Loday,"" as well as over
Lie, associative, and commutative algebras. Fixing a pair of $\mathscr{P}$
algebras, we develop a correspondence between factor systems and extensions.
This correspondence is strengthened by the fact that equivalence classes of
factor systems correspond to those of extensions. Under this correspondence,
central extensions give rise to 2-cocycles while split extensions give rise to
(nonabelian) 2-coboundaries.
","[{""version"":""v1"",""created"":""Fri, 30 Apr 2021 22:51:38 GMT""}]","2021-05-04"
"2105.00117","Fatemeh Ganji","Rabin Yu Acharya, Fatemeh Ganji, Domenic Forte","InfoNEAT: Information Theory-based NeuroEvolution of Augmenting
  Topologies for Side-channel Analysis",,,,,"cs.CR","http://creativecommons.org/licenses/by-nc-nd/4.0/","  Profiled side-channel analysis (SCA) leverages leakage from cryptographic
implementations to extract the secret key. When combined with advanced methods
in neural networks (NNs), profiled SCA can successfully attack even those
crypto-cores assumed to be protected against SCA. Despite the rise in the
number of studies devoted to NN-based SCA, a range of questions has remained
unanswered, namely: how to choose an NN with an adequate configuration, how to
tune the NN's hyperparameters, when to stop the training, etc. Our proposed
approach, ``InfoNEAT,'' tackles these issues in a natural way. InfoNEAT relies
on the concept of neural structure search, enhanced by information-theoretic
metrics to guide the evolution, halt it with novel stopping criteria, and
improve time-complexity and memory footprint. The performance of InfoNEAT is
evaluated by applying it to publicly available datasets composed of real
side-channel measurements. In addition to the considerable advantages regarding
the automated configuration of NNs, InfoNEAT demonstrates significant
improvements over other approaches for effective key recovery in terms of the
number of epochs (e.g.,x6 faster) and the number of attack traces compared to
both MLPs and CNNs (e.g., up to 1000s fewer traces to break a device) as well
as a reduction in the number of trainable parameters compared to MLPs (e.g., by
the factor of up to 32). Furthermore, through experiments, it is demonstrated
that InfoNEAT's models are robust against noise and desynchronization in
traces.
","[{""version"":""v1"",""created"":""Fri, 30 Apr 2021 23:01:50 GMT""},{""version"":""v2"",""created"":""Fri, 7 May 2021 03:46:25 GMT""},{""version"":""v3"",""created"":""Thu, 1 Sep 2022 15:30:33 GMT""},{""version"":""v4"",""created"":""Fri, 14 Oct 2022 21:38:32 GMT""}]","2022-10-18"
"2105.00118","J\'ulia Mota","J. A. Mota, D. J. G. Maldonado, J. V. Val\'erio, T. G. Ritto","Complete modeling of hydrodynamic bearings with a boundary
  parameterization approach","45 pages, 29 figures, preprint",,,,"physics.flu-dyn","http://creativecommons.org/licenses/by/4.0/","  The present work aims to revisit the simplifications made in the
Navier-Stokes equations for the flow between two cylinders with a small
thickness of lubricating oil film. Through a dimensionless analysis, the terms
of these equations are mapped and ordered by importance for the hydrodynamic
bearing application. An effective parameterization of the geometry is proposed,
enabling a more detailed description of the problem and its adaptation to other
contexts. At the end, an elliptical partial differential equation is reached
and solved by the centered finite difference method, whose solution is the
pressure field between the cylinders. To illustrate the effectiveness of the
proposed approach, the model is applied to hydrodynamic bearings, where the
pressure field and some parameters resulting from it, such as stiffness and
damping coefficients, are computed. Based on the facilities offered by the
parameterization of the geometry, two different configurations are presented:
(1) elliptical and (2) worn bearings. Their responses are evaluated and a
comparative analysis is performed. The modeling exposed in this text, as well
as all its simulations were developed to integrate Ross-Rotordynamics, an open
library in Python, available on the GitHub platform.
","[{""version"":""v1"",""created"":""Fri, 30 Apr 2021 23:02:30 GMT""},{""version"":""v2"",""created"":""Mon, 31 May 2021 12:35:21 GMT""},{""version"":""v3"",""created"":""Thu, 30 Sep 2021 13:53:00 GMT""}]","2021-10-01"
"2105.00119","Nicolas Loizeau","Nicolas Loizeau and Glennys R. Farrar","Galaxy rotation curves disfavor traditional and self-interacting dark
  matter halos, preferring a disk component or Einasto function","We fixed a typo in eq A3, added fig 6 and updated fig 1 and fig 8
  with two galaxy subsets of high and low inclinations",,"10.3847/2041-8213/ac1bb7",,"astro-ph.GA","http://creativecommons.org/licenses/by-nc-nd/4.0/","  We use the galaxy rotation curves in the SPARC database to compare 9
different dark matter and modified gravity models on an equal footing, paying
special attention to the stellar mass-to-light ratios. We compare three
non-interacting dark matter models, a self interacting DM (SIDM) model, two
hadronically interacting DM (HIDM) models, and three modified Newtonian
dynamics type models: MOND, Radial Acceleration Relation (RAR) and a
maximal-disk model. The models with DM-gas interactions generate a disky
component in the dark matter, which significantly improves the fits to the
rotation curves compared to all other models except an Einasto halo; the
MOND-type models give significantly worse fits.
","[{""version"":""v1"",""created"":""Fri, 30 Apr 2021 23:07:11 GMT""},{""version"":""v2"",""created"":""Mon, 28 Jun 2021 18:10:13 GMT""},{""version"":""v3"",""created"":""Mon, 22 Nov 2021 22:24:46 GMT""}]","2021-11-24"
"2105.00120","Susan Clark","S. E. Clark, Chang-Goo Kim, J. Colin Hill, Brandon S. Hensley","The Origin of Parity Violation in Polarized Dust Emission and
  Implications for Cosmic Birefringence","17 pages, 9 figures, submitted to ApJ",,"10.3847/1538-4357/ac0e35",,"astro-ph.GA astro-ph.CO","http://arxiv.org/licenses/nonexclusive-distrib/1.0/","  Recent measurements of Galactic polarized dust emission have found a nonzero
$TB$ signal, a correlation between the total intensity and the $B$-mode
polarization component. We present evidence that this parity-odd signal is
driven by the relative geometry of the magnetic field and the filamentary
interstellar medium in projection. Using neutral hydrogen morphology and Planck
polarization data, we find that the angle between intensity structures and the
plane-of-sky magnetic field orientation is predictive of the signs of Galactic
$TB$ and $EB$. Our results suggest that magnetically misaligned filamentary
dust structures introduce nonzero $TB$ and $EB$ correlations in the dust
polarization, and that the intrinsic dust $EB$ can be predicted from
measurements of dust $TB$ and $TE$ over the same sky mask. We predict
correlations between $TE$, $TB$, $EB$, and $EE/BB$, and confirm our predictions
using synthetic dust polarization maps from magnetohydrodynamic simulations. We
introduce and measure a scale-dependent effective magnetic misalignment angle,
$\psi_\ell^{dust} \sim 5^\circ$ for $100 \lesssim \ell \lesssim 500$, and
predict a positive intrinsic dust $EB$ with amplitude $\left<D_\ell^{EB}\right>
\lesssim 2.5~\mu\mathrm{K^2_{CMB}}$ for the same multipole range at 353 GHz
over our sky mask. Both the sign and amplitude of the Galactic $EB$ signal can
change with the sky area considered. Our results imply that searches for parity
violation in the cosmic microwave background must account for the nonzero
Galactic $EB$ and $TB$ signals, necessitating revision of existing analyses of
the evidence for cosmic birefringence.
","[{""version"":""v1"",""created"":""Fri, 30 Apr 2021 23:10:19 GMT""}]","2021-09-29"
"2105.00121","Doris Jung-Lin Lee","Doris Jung-Lin Lee, Dixin Tang, Kunal Agarwal, Thyne Boonmark, Caitlyn
  Chen, Jake Kang, Ujjaini Mukhopadhyay, Jerry Song, Micah Yong, Marti A.
  Hearst, Aditya G. Parameswaran","Lux: Always-on Visualization Recommendations for Exploratory Dataframe
  Workflows",,,,,"cs.DB cs.HC","http://creativecommons.org/licenses/by/4.0/","  Exploratory data science largely happens in computational notebooks with
dataframe APIs, such as pandas, that support flexible means to transform,
clean, and analyze data. Yet, visually exploring data in dataframes remains
tedious, requiring substantial programming effort for visualization and mental
effort to determine what analysis to perform next. We propose Lux, an always-on
framework for accelerating visual insight discovery in dataframe workflows.
When users print a dataframe in their notebooks, Lux recommends visualizations
to provide a quick overview of the patterns and trends and suggests promising
analysis directions. Lux features a high level language for generating
visualizations on demand to encourage rapid visual experimentation with data.
We demonstrate that through the use of a careful design and three system
optimizations, Lux adds no more than two seconds of overhead on top of pandas
for over 98% of datasets in the UCI repository. We evaluate Lux in terms of
usability via a controlled first-use study and interviews with early adopters,
finding that Lux helps fulfill the needs of data scientists for visualization
support within their dataframe workflows. Lux has already been embraced by data
science practitioners, with over 3.1k stars on Github.
","[{""version"":""v1"",""created"":""Fri, 30 Apr 2021 23:28:03 GMT""},{""version"":""v2"",""created"":""Wed, 22 Dec 2021 18:02:00 GMT""}]","2021-12-23"
"2105.00122","Cosmin Pohoata","Cosmin Pohoata, Dmitriy Zakharov","On the trifference problem for linear codes",,,,,"cs.IT math.CO math.IT","http://creativecommons.org/licenses/by/4.0/","  We prove that perfect $3$-hash linear codes in $\mathbb{F}_{3}^{n}$ must have
dimension at most $ \left(\frac{1}{4}-\epsilon\right)n$ for some absolute
constant $\epsilon > 0$.
","[{""version"":""v1"",""created"":""Fri, 30 Apr 2021 23:34:59 GMT""},{""version"":""v2"",""created"":""Thu, 20 May 2021 17:08:29 GMT""}]","2021-05-21"
"2105.00123","Daniel Appel\""o","Daniel Appelo and Kiera van der Sande and Nathan Albin","Fourier Continuation Discontinuous Galerkin Methods for Linear
  Hyperbolic Problems",,,,,"math.NA cs.NA","http://arxiv.org/licenses/nonexclusive-distrib/1.0/","  Fourier continuation is an approach used to create periodic extensions of
non-periodic functions in order to obtain highly-accurate Fourier expansions.
These methods have been used in PDE-solvers and have demonstrated high-order
convergence and spectrally accurate dispersion relations in numerical
experiments. Discontinuous Galerkin (DG) methods are increasingly used for
solving PDEs and, as all Galerkin formulations, come with a strong framework
for proving stability and convergence. Here we propose the use of Fourier
continuation in forming a new basis for the DG framework.
","[{""version"":""v1"",""created"":""Fri, 30 Apr 2021 23:47:00 GMT""}]","2021-05-04"
"2105.00124","Maha Riad","Maha Riad and Fatemeh Golpayegani","Run-time Norms Synthesis in Multi-Objective Multi-Agent Systems","15 pages, 5 figures, COINE, AAMAS",,,,"cs.MA","http://creativecommons.org/licenses/by-nc-sa/4.0/","  Norms represent behavioural aspects that are encouraged by a social group of
agents or the majority of agents in a system. Normative systems enable
coordinating synthesised norms of heterogeneous agents in complex multi-agent
systems autonomously. In real applications, agents have multiple objectives
that may contradict each other or contradict the synthesised norms. Therefore,
agents need a mechanism to understand the impact of a suggested norm on their
objectives and decide whether or not to adopt it. To address these challenges,
a utility based norm synthesis (UNS) model is proposed which allows the agents
to coordinate their behaviour while achieving their conflicting objectives. UNS
proposes a utility-based case-based reasoning technique, using case-based
reasoning for run-time norm synthesising in a centralised approach, and a
utility function derived from the objectives of the system and its operating
agents to decide whether or not to adopt a norm. The model is evaluated using a
two intersecting roads scenario and the results show its efficacy to optimise
multiple objectives while adopting synthesised norms.
","[{""version"":""v1"",""created"":""Sat, 1 May 2021 00:04:40 GMT""}]","2021-05-04"
"2105.00125","Bo Liu","Bo Liu, Mandar Dixit, Roland Kwitt, Gang Hua, Nuno Vasconcelos","Sparse Pose Trajectory Completion",,,,,"cs.CV","http://creativecommons.org/licenses/by/4.0/","  We propose a method to learn, even using a dataset where objects appear only
in sparsely sampled views (e.g. Pix3D), the ability to synthesize a pose
trajectory for an arbitrary reference image. This is achieved with a
cross-modal pose trajectory transfer mechanism. First, a domain transfer
function is trained to predict, from an RGB image of the object, its 2D depth
map. Then, a set of image views is generated by learning to simulate object
rotation in the depth space. Finally, the generated poses are mapped from this
latent space into a set of corresponding RGB images using a learned identity
preserving transform. This results in a dense pose trajectory of the object in
image space. For each object type (e.g., a specific Ikea chair model), a 3D CAD
model is used to render a full pose trajectory of 2D depth maps. In the absence
of dense pose sampling in image space, these latent space trajectories provide
cross-modal guidance for learning. The learned pose trajectories can be
transferred to unseen examples, effectively synthesizing all object views in
image space. Our method is evaluated on the Pix3D and ShapeNet datasets, in the
setting of novel view synthesis under sparse pose supervision, demonstrating
substantial improvements over recent art.
","[{""version"":""v1"",""created"":""Sat, 1 May 2021 00:07:21 GMT""}]","2021-05-04"
"2105.00126","Juan Diego S\'anchez Torres Dr.","Jos\'e Eduardo Carvajal-Rubio, Juan Diego S\'anchez-Torres, Michael
  Defoort, Mohamed Djemai, and Alexander G. Loukianov","On the Efficient Implementation of an Implicit Discrete-Time
  Differentiator","5 pages, 1 figure, 3 tables",,,,"eess.SY cs.NA cs.SY math.NA","http://creativecommons.org/licenses/by/4.0/","  New methodologies are designed to reduce the time complexity of an implicit
discrete-time differentiator and the simulation time to implement it. They rely
on Horner's method and the Shaw-Traub algorithm. The algorithms are compared
for differentiators of orders 3, 7, and 10. The Half-Horner and Full-Horner
methods showed the best performance and time complexity.
","[{""version"":""v1"",""created"":""Sat, 1 May 2021 00:09:04 GMT""}]","2021-05-04"
"2105.00127","Bo Liu","Bo Liu, Haoxiang Li, Hao Kang, Gang Hua, Nuno Vasconcelos","Breadcrumbs: Adversarial Class-Balanced Sampling for Long-tailed
  Recognition",,,,,"cs.CV","http://creativecommons.org/licenses/by/4.0/","  The problem of long-tailed recognition, where the number of examples per
class is highly unbalanced, is considered. While training with class-balanced
sampling has been shown effective for this problem, it is known to over-fit to
few-shot classes. It is hypothesized that this is due to the repeated sampling
of examples and can be addressed by feature space augmentation. A new feature
augmentation strategy, EMANATE, based on back-tracking of features across
epochs during training, is proposed. It is shown that, unlike class-balanced
sampling, this is an adversarial augmentation strategy. A new sampling
procedure, Breadcrumb, is then introduced to implement adversarial
class-balanced sampling without extra computation. Experiments on three popular
long-tailed recognition datasets show that Breadcrumb training produces
classifiers that outperform existing solutions to the problem.
","[{""version"":""v1"",""created"":""Sat, 1 May 2021 00:21:26 GMT""}]","2021-05-04"
"2105.00128","Amanda Steinhebel","Amanda Steinhebel, Jim Brau, Chris Potter","H$\rightarrow$invisible at the ILC with SiD","Talk presented at the International Workshop on Future Linear
  Colliders (LCWS2021), 15-18 March 2021. C21-03-15.1 v2 corrects normalization
  strategy, impacting yields as compared to v1",,,,"hep-ex","http://arxiv.org/licenses/nonexclusive-distrib/1.0/","  The Standard Model (SM) predicts a branching ratio of the Higgs boson
decaying to invisible particles of $\mathcal{O}$(0.001), though current
measurements have only set upper limits on this value. The small SM-allowed
rate can be enhanced if the Higgs boson decays into new particles such as dark
matter. Upper limits have been placed on BR(H$\rightarrow$inv.) by ATLAS and
CMS at $\mathcal{O}$(0.1), but the hadron environment limits precision. The ILC
`Higgs factory' will provide unprecedented precision of this electroweak
measurement. Studies of the search for H$\rightarrow$invisible processes in
simulation are presented with SiD, a detector concept designed for the ILC.
Preliminary results for expected sensitivity are provided, as well as studies
considering potential systematics limitations.
","[{""version"":""v1"",""created"":""Sat, 1 May 2021 00:34:04 GMT""},{""version"":""v2"",""created"":""Mon, 30 Aug 2021 19:36:12 GMT""}]","2021-09-01"
"2105.00129","Rafael Ferreira da Silva","Tain\~a Coleman, Henri Casanova, Rafael Ferreira da Silva","WfChef: Automated Generation of Accurate Scientific Workflow Generators",,,,,"cs.DC cs.SE","http://creativecommons.org/licenses/by/4.0/","  Scientific workflow applications have become mainstream and their automated
and efficient execution on large-scale compute platforms is the object of
extensive research and development. For these efforts to be successful, a solid
experimental methodology is needed to evaluate workflow algorithms and systems.
A foundation for this methodology is the availability of realistic workflow
instances. Dozens of workflow instances for a few scientific applications are
available in public repositories. While these are invaluable, they are limited:
workflow instances are not available for all application scales of interest. To
address this limitation, previous work has developed generators of synthetic,
but representative, workflow instances of arbitrary scales. These generators
are popular, but implementing them is a manual, labor-intensive process that
requires expert application knowledge. As a result, these generators only
target a handful of applications, even though hundreds of applications use
workflows in production.
  In this work, we present WfChef, a framework that fully automates the process
of constructing a synthetic workflow generator for any scientific application.
Based on an input set of workflow instances, WfChef automatically produces a
synthetic workflow generator. We define and evaluate several metrics for
quantifying the realism of the generated workflows. Using these metrics, we
compare the realism of the workflows generated by WfChef generators to that of
the workflows generated by the previously available, hand-crafted generators.
We find that the WfChef generators not only require zero development effort
(because it is automatically produced), but also generate workflows that are
more realistic than those generated by hand-crafted generators.
","[{""version"":""v1"",""created"":""Sat, 1 May 2021 00:34:55 GMT""}]","2021-05-04"
"2105.00130","Frederik vom Scheidt","Frederik vom Scheidt, Jingyi Qu, Philipp Staudt, Dharik S.
  Mallapragada, Christof Weinhardt","Integrating Hydrogen in Single-Price Electricity Systems: The Effects of
  Spatial Economic Signals",,,,,"econ.GN q-fin.EC","http://creativecommons.org/licenses/by-nc-nd/4.0/","  Hydrogen can contribute substantially to the reduction of carbon emissions in
industry and transportation. However, the production of hydrogen through
electrolysis creates interdependencies between hydrogen supply chains and
electricity systems. Therefore, as governments worldwide are planning
considerable financial subsidies and new regulation to promote hydrogen
infrastructure investments in the next years, energy policy research is needed
to guide such policies with holistic analyses. In this study, we link a
electrolytic hydrogen supply chain model with an electricity system dispatch
model, for a cross-sectoral case study of Germany in 2030. We find that
hydrogen infrastructure investments and their effects on the electricity system
are strongly influenced by electricity prices. Given current uniform prices,
hydrogen production increases congestion costs in the electricity grid by 17%.
In contrast, passing spatially resolved electricity price signals leads to
electrolyzers being placed at low-cost grid nodes and further away from
consumption centers. This causes lower end-use costs for hydrogen. Moreover,
congestion management costs decrease substantially, by up to 20% compared to
the benchmark case without hydrogen. These savings could be transferred into
according subsidies for hydrogen production. Thus, our study demonstrates the
benefits of differentiating economic signals for hydrogen production based on
spatial criteria.
","[{""version"":""v1"",""created"":""Sat, 1 May 2021 00:36:44 GMT""},{""version"":""v2"",""created"":""Wed, 10 Nov 2021 09:34:58 GMT""}]","2021-11-11"
"2105.00131","Bo Liu","Bo Liu, Haoxiang Li, Hao Kang, Gang Hua, Nuno Vasconcelos","GistNet: a Geometric Structure Transfer Network for Long-Tailed
  Recognition",,,,,"cs.CV","http://creativecommons.org/licenses/by/4.0/","  The problem of long-tailed recognition, where the number of examples per
class is highly unbalanced, is considered. It is hypothesized that the well
known tendency of standard classifier training to overfit to popular classes
can be exploited for effective transfer learning. Rather than eliminating this
overfitting, e.g. by adopting popular class-balanced sampling methods, the
learning algorithm should instead leverage this overfitting to transfer
geometric information from popular to low-shot classes. A new classifier
architecture, GistNet, is proposed to support this goal, using constellations
of classifier parameters to encode the class geometry. A new learning algorithm
is then proposed for GeometrIc Structure Transfer (GIST), with resort to a
combination of loss functions that combine class-balanced and random sampling
to guarantee that, while overfitting to the popular classes is restricted to
geometric parameters, it is leveraged to transfer class geometry from popular
to few-shot classes. This enables better generalization for few-shot classes
without the need for the manual specification of class weights, or even the
explicit grouping of classes into different types. Experiments on two popular
long-tailed recognition datasets show that GistNet outperforms existing
solutions to this problem.
","[{""version"":""v1"",""created"":""Sat, 1 May 2021 00:37:42 GMT""}]","2021-05-04"
