"2105.00035","Nurbolat Kenbaev","N. S. Kirsanov, N. R. Kenbaev, A. B. Sagingalieva, D. A. Kronberg, V.
  M. Vinokur, G. B. Lesovik","Long-distance quantum key distribution based on the physical loss
  control",,,,,"quant-ph","http://creativecommons.org/licenses/by/4.0/","  Existing quantum cryptography is resistant against secrecy-breaking quantum
computers but suffers fast decay of the signal at long distances. The various
types of repeaters of propagating quantum states have been developed to meet
the challenge, but the problem is far from being solved. We step in the breach
and put forth long-distance high secrecy optical cryptography, creating the
fast quantum key distribution over distances up to 40,000 kilometers. The key
element of the proposed protocol is the physical control over the transmission
line.
","[{""version"":""v1"",""created"":""Fri, 30 Apr 2021 18:28:46 GMT""}]","2021-05-04"
"2105.00036","Lewis Whitehouse","L. J. Whitehouse, J. Farihi, I. D. Howarth, S. Mancino, N. Walters, A.
  Swan, T. G. Wilson, J. Guo","Carbon-enhanced stars with short orbital and spin periods","16 pages, 7 figures, Accepted to MNRAS",,"10.1093/mnras/stab1913",,"astro-ph.SR","http://arxiv.org/licenses/nonexclusive-distrib/1.0/","  Many characteristics of dwarf carbon stars are broadly consistent with a
binary origin, including mass transfer from an evolved companion. While the
population overall appears to have old-disc or halo kinematics, roughly
2$\,$per cent of these stars exhibit H$\alpha$ emission, which in low-mass
main-sequence stars is generally associated with rotation and relative youth.
Its presence in an older population therefore suggests either irradiation or
spin-up. This study presents time-series analyses of photometric and
radial-velocity data for seven dwarf carbon stars with H$\alpha$ emission. All
are shown to have photometric periods in the range 0.2--5.2$\,$d, and orbital
periods of similar length, consistent with tidal synchronisation. It is
hypothesised that dwarf carbon stars with emission lines are the result of
close-binary evolution, indicating that low-mass, metal-weak or metal-poor
stars can accrete substantial material prior to entering a common-envelope
phase.
","[{""version"":""v1"",""created"":""Fri, 30 Apr 2021 18:29:47 GMT""},{""version"":""v2"",""created"":""Thu, 1 Jul 2021 10:02:48 GMT""},{""version"":""v3"",""created"":""Tue, 3 Aug 2021 14:45:17 GMT""}]","2021-08-04"
"2105.00037","Benjamin Roulston","Benjamin R. Roulston, Paul J. Green, Silvia Toonen, J. J. Hermes","Unexpected Short-Period Variability in Dwarf Carbon Stars from the
  Zwicky Transient Facility","23 pages, 5 figures, 5 tables, accepted to ApJ",,"10.3847/1538-4357/ac157c",,"astro-ph.SR","http://arxiv.org/licenses/nonexclusive-distrib/1.0/","  Dwarf carbon (dC) stars, main sequence stars showing carbon molecular bands,
are enriched by mass transfer from a previous asymptotic-giant-branch (AGB)
companion, which has since evolved to a white dwarf. While previous studies
have found radial-velocity variations for large samples of dCs, there are still
relatively few dC orbital periods in the literature and no dC eclipsing
binaries have yet been found. Here, we analyze photometric light curves from
DR5 of the Zwicky Transient Facility for a sample of 944 dC stars. From these
light curves, we identify 34 periodically variable dC stars. Remarkably, of the
periodic dCs, 82\% have periods less than two days. We also provide
spectroscopic follow-up for four of these periodic systems, measuring radial
velocity variations in three of them. Short-period dCs are almost certainly
post-common-envelope binary systems, since the periodicity is most likely
related to the orbital period, with tidally locked rotation and photometric
modulation on the dC either from spots or from ellipsoidal variations. We
discuss evolutionary scenarios that these binaries may have taken to accrete
sufficient C-rich material while avoiding truncation of the thermally pulsing
AGB phase needed to provide such material in the first place. We compare these
dCs to common-envelope models to show that dC stars probably cannot accrete
enough C-rich material during the common-envelope phase, suggesting another
mechanism like wind-Roche lobe overflow is necessary. The periodic dCs in this
paper represent a prime sample for spectroscopic follow-up and for comparison
to future models of wind-Roche lobe overflow mass transfer.
","[{""version"":""v1"",""created"":""Fri, 30 Apr 2021 18:30:01 GMT""},{""version"":""v2"",""created"":""Mon, 19 Jul 2021 16:07:11 GMT""}]","2021-11-24"
"2105.00038","Norbert Henze","Nicolas Chenavier, Norbert Henze, Moritz Otto","Limit laws for large kth-nearest neighbor balls","11 pages",,,,"math.PR","http://creativecommons.org/licenses/by-nc-sa/4.0/","  Let $X_1,\ldots,X_n$ be a sequence of independent random points in
$\mathbb{R}^d$ with common Lebesgue density $f$. Under some conditions on $f$,
we obtain a Poisson limit theorem, as $n \to \infty$, for the number of large
probability $k$th-nearest neighbor balls of $X_1,\ldots,X_n$. Our result
generalizes Theorem 2. of [10], which refers to the special case $k=1$. Our
proof is completely different since it employs the Chen-Stein method instead of
the method of moments. Moreover, we obtain a rate of convergence for the
Poisson approximation.
","[{""version"":""v1"",""created"":""Fri, 30 Apr 2021 18:34:05 GMT""}]","2021-05-04"
"2105.00039","Ahmad Hesam","Ahmad Hesam, Lukas Breitwieser, Fons Rademakers, Zaid Al-Ars","GPU Acceleration of 3D Agent-Based Biological Simulations","8 pages, 12 figures",,"10.1109/IPDPSW52791.2021.00040",,"cs.DC cs.PF","http://creativecommons.org/licenses/by/4.0/","  Researchers in biology are faced with the tough challenge of developing
high-performance computer simulations of their increasingly complex agent-based
models. BioDynaMo is an open-source agent-based simulation platform that aims
to alleviate researchers from the intricacies that go into the development of
high-performance computing. Through a high-level interface, researchers can
implement their models on top of BioDynaMo's multi-threaded core execution
engine to rapidly develop simulations that effectively utilize parallel
computing hardware. In biological agent-based modeling, the type of operations
that are typically the most compute-intensive are those that involve agents
interacting with their local neighborhood. In this work, we investigate the
currently implemented method of handling neighborhood interactions of cellular
agents in BioDynaMo, and ways to improve the performance to enable large-scale
and complex simulations. We propose to replace the kd-tree implementation to
find and iterate over the neighborhood of each agent with a uniform grid method
that allows us to take advantage of the massively parallel architecture of
graphics processing units (GPUs). We implement the uniform grid method in both
CUDA and OpenCL to address GPUs from all major vendors and evaluate several
techniques to further improve the performance. Furthermore, we analyze the
performance of our implementations for models with a varying density of
neighboring agents. As a result, the performance of the mechanical interactions
method improved by up to two orders of magnitude in comparison to the
multithreaded baseline version. The implementations are open-source and
publicly available on Github.
","[{""version"":""v1"",""created"":""Fri, 30 Apr 2021 18:37:51 GMT""}]","2021-06-29"
"2105.00040","Dazhi Xu","Dan Wang, Dazhi Xu","Nonadiabatic evolution and thermodynamics of a time-dependent open
  quantum system","11 pages, 7 figures","Phys. Rev. A 104, 032201 (2021)","10.1103/PhysRevA.104.032201",,"quant-ph","http://creativecommons.org/licenses/by/4.0/","  We investigate the dynamic evolution and thermodynamic process of a driven
quantum system immersed in a finite-temperature heat bath. A Born-Markovian
quantum master equation is formally derived for the time-dependent system with
discrete energy levels. This quantum master equation can be applied to
situations with a broad range of driving speeds and bath temperatures and thus
be used to study the finite-time quantum thermodynamics even when nonadiabatic
transition and dissipation coexist. The dissipative Landau-Zener model is
analyzed as an example. The population evolution and transition probability of
the model reveal the importance of the competition between driving and
dissipation beyond the adiabatic regime. Moreover, local maximums of
irreversible entropy production occur at intermediate sweep velocity and finite
temperature, which the low-dissipation model cannot describe.
","[{""version"":""v1"",""created"":""Fri, 30 Apr 2021 18:38:47 GMT""},{""version"":""v2"",""created"":""Wed, 12 May 2021 06:48:41 GMT""}]","2021-09-08"
"2105.00041","Ramy Shahin","Ramy Shahin, Sahar Kokaly, Marsha Chechik","Towards Certified Analysis of Software Product Line Safety Cases","Safecomp'21 pre-print",,,,"cs.SE","http://arxiv.org/licenses/nonexclusive-distrib/1.0/","  Safety-critical software systems are in many cases designed and implemented
as families of products, usually referred to as Software Product Lines (SPLs).
Products within an SPL vary from each other in terms of which features they
include. Applying existing analysis techniques to SPLs and their safety cases
is usually challenging because of the potentially exponential number of
products with respect to the number of supported features. In this paper, we
present a methodology and infrastructure for certified \emph{lifting} of
existing single-product safety analyses to product lines. To ensure certified
safety of our infrastructure, we implement it in an interactive theorem prover,
including formal definitions, lemmas, correctness criteria theorems, and
proofs. We apply this infrastructure to formalize and lift a Change Impact
Assessment (CIA) algorithm. We present a formal definition of the lifted
algorithm, outline its correctness proof (with the full machine-checked proof
available online), and discuss its implementation within a model management
framework.
","[{""version"":""v1"",""created"":""Fri, 30 Apr 2021 18:51:46 GMT""}]","2021-05-04"
"2105.00042","Tomas James","Tomas A. James, Serena Viti, Farhad Yusef-Zadeh, Marc Royster and Mark
  Wardle","Revealing the Physical Conditions around Sgr A* using Bayesian Inference
  -- I. Observations and Radiative Transfer","Accepted by ApJ",,"10.3847/1538-4357/abfd99",,"astro-ph.GA","http://creativecommons.org/licenses/by/4.0/","  We report sub-arcsecond ALMA observations between 272 - 375 GHz towards Sgr
A*'s Circumnuclear disk (CND). Our data comprises 8 individual pointings, with
significant SiO (8(7) - 7(6)) and SO (7 - 6) emission detected towards 98
positions within these pointings. Additionally, we identify H2CS (9(1,9) -
8(1,8)), OCS (25 - 24) and CH3OH (2(1,1) - 2(0,2)) towards a smaller subset of
positions. By using the observed peak line flux density together with a
Bayesian Inference technique informed by radiative transfer models, we
systematically recover the physical gas conditions towards each of these
positions. We estimate that the bulk of the surveyed gas has temperature T <
500 K and density n $\lessapprox 10^{6}$ cm$^{-3}$, consistent with previous
studies of similar positions as traced by HCN clumps. However, we identify an
uncharacteristically hot (T $\approx 600$ K) and dense (n $\approx 10^{6}$
cm$^{-3}$) source in the Northeastern Arm. This position is found to be
approximately consistent with a gravitationally bound region dominated by
turbulence. We also identify a nearby cold (T $\approx 60$ K) and extremely
dense (n $\approx 10^{7}$ cm$^{-3}$) position that is again potentially bound
and dominated by turbulence. We also determine that the total gas mass
contained within the CND is M $\approx 4 \times 10^{4}$ $M_{\odot}$.
Furthermore, we qualitatively note that the observed chemical enrichment across
large scales within the CND is consistent with bulk grain processing, though
multiple desorption mechanisms are plausibly responsible. Further chemical
modelling is required to identify the physical origin of the grain-processing,
as well as the localised H2CS and OCS emission.
","[{""version"":""v1"",""created"":""Fri, 30 Apr 2021 18:52:57 GMT""},{""version"":""v2"",""created"":""Wed, 5 May 2021 09:08:57 GMT""}]","2021-08-03"
"2105.00043","Suraj Kothawade","Suraj Kothawade, Vishal Kaushal, Ganesh Ramakrishnan, Jeff Bilmes,
  Rishabh Iyer","Submodular Mutual Information for Targeted Data Subset Selection","Accepted to ICLR 2021 S2D-OLAD Workshop; https://s2d-olad.github.io/.
  arXiv admin note: substantial text overlap with arXiv:2103.00128",,,,"cs.LG cs.CV","http://arxiv.org/licenses/nonexclusive-distrib/1.0/","  With the rapid growth of data, it is becoming increasingly difficult to train
or improve deep learning models with the right subset of data. We show that
this problem can be effectively solved at an additional labeling cost by
targeted data subset selection(TSS) where a subset of unlabeled data points
similar to an auxiliary set are added to the training data. We do so by using a
rich class of Submodular Mutual Information (SMI) functions and demonstrate its
effectiveness for image classification on CIFAR-10 and MNIST datasets. Lastly,
we compare the performance of SMI functions for TSS with other state-of-the-art
methods for closely related problems like active learning. Using SMI functions,
we observe ~20-30% gain over the model's performance before re-training with
added targeted subset; ~12% more than other methods.
","[{""version"":""v1"",""created"":""Fri, 30 Apr 2021 18:53:09 GMT""}]","2021-05-04"
"2105.00044","Miguel Tecpa-Galv\'an","Hortensia Galeana-S\'anchez and Miguel Tecpa-Galv\'an","On $(k,l,H)$-kernels by walks and the H-class digraph",,,,,"math.CO","http://creativecommons.org/licenses/by/4.0/","  Let $H$ be a digraph possibly with loops and $D$ a digraph without loops
whose arcs are colored with the vertices of $H$ ($D$ is said to be an
$H-$colored digraph). If $W=(x_{0},\ldots,x_{n})$ is an open walk in $D$ and
$i\in \{1,\ldots,n-1\}$, we say that there is an obstruction on $x_{i}$ if
$(color(x_{i-1},x_{i}),color(x_{i},x_{i+1}))\notin A(H)$. If $S\subseteq V(D)$,
we say that $S$ is a $(k,l,H)$-kernel by walks if for every pair of different
vertices in $S$, every walk between them has at least $k-1$ obstructions, and
for every $x\in V(D)\setminus S$ there exists an $xS$-walk with at most $l-1$
obstructions. If $D$ is an $H$-colored digraph, an $H$-class partition is a
partition $\mathscr{F}$ of $A(D)$ such that, for every
$\{(u,v),(v,w)\}\subseteq A(D)$, $(color(u,v),color(v,w))\in A(H)$ iff there
exists $F$ in $\mathscr{F}$ such that $\{(u,v),(v,w)\}\subseteq F$. The
$H$-class digraph relative to $\mathscr{F}$, denoted by $C_{\mathscr{F}}(D)$,
is the digraph such that $V(C_{\mathscr{F}}(D))=\mathscr{F}$, and $(F,G)\in
A(C_{\mathscr{F}}(D))$ if and only if there exist $(u,v)\in F$ and $(v,w)\in G$
with $\{u,v,w\}\subseteq V(D)$. We will show sufficient conditions on
$\mathscr{F}$ and $C_{\mathscr{F}}(D)$ to guarantee the existence of
$(k,l,H)$-kernels by walks in $H$-colored digraphs, and we will show that some
conditions are tight. For instance, we will show that if an $H$-colored digraph
$D$ has an $H$-class partition in which every class induces a strongly
connected digraph, and has an obstruction-free vertex, then for every $k\geq
2$, $D$ has a $(k,k-1,H)$-kernel by walks. Despite the fact that finding
$(k,l)$-kernels in arbitrary $H$-colored digraphs is an NP-complete problem,
some hypothesis presented in this paper can be verified in polynomial time.
","[{""version"":""v1"",""created"":""Fri, 30 Apr 2021 19:00:48 GMT""},{""version"":""v2"",""created"":""Thu, 22 Dec 2022 17:27:59 GMT""}]","2022-12-23"
"2105.00045","Xiaoli Gao","Xiaoli Gao","Estimation and Selection Properties of the LAD Fused Lasso Signal
  Approximator",,,,,"stat.ME","http://creativecommons.org/licenses/by/4.0/","  The fused lasso is an important method for signal processing when the hidden
signals are sparse and blocky. It is often used in combination with the squared
loss function. However, the squared loss is not suitable for heavy tail error
distributions nor is robust against outliers which arise often in practice. The
least absolute deviations (LAD) loss provides a robust alternative to the
squared loss. In this paper, we study the asymptotic properties of the fused
lasso estimator with the LAD loss for signal approximation. We refer to this
estimator as the LAD fused lasso signal approximator, or LAD-FLSA. We
investigate the estimation consistency properties of the LAD-FLSA and provide
sufficient conditions under which the LAD-FLSA is sign consistent. We also
construct an unbiased estimator for the degrees of freedom of the LAD-FLSA for
any given tuning parameters. Both simulation studies and real data analysis are
conducted to illustrate the performance of the LAD-FLSA and the effect of the
unbiased estimator of the degrees of freedom.
","[{""version"":""v1"",""created"":""Fri, 30 Apr 2021 19:03:39 GMT""}]","2021-05-04"
"2105.00046","Riccarda Rossi","Gianni Dal Maso, Riccarda Rossi, Giuseppe Savar\'e, Rodica Toader","Visco-energetic solutions for a model of crack growth in brittle
  materials",,,,,"math.AP","http://arxiv.org/licenses/nonexclusive-distrib/1.0/","  Visco-energetic solutions have been recently advanced as a new solution
concept for rate-independent systems, alternative to energetic
solutions/quasistatic evolutions and balanced viscosity solutions. In the
spirit of this novel concept, we revisit the analysis of the variational model
proposed by Francfort and Marigo for the quasi-static crack growth in brittle
materials, in the case of antiplane shear. In this context, visco-energetic
solutions can be constructed by perturbing the time incremental scheme for
quasistatic evolutions by means of a viscous correction inspired by the term
introduced by Almgren, Taylor, and Wang in the study of mean curvature flows.
With our main result we prove the existence of a visco-energetic solution with
a given initial crack. We also show that, if the cracks have a finite number of
tips evolving smoothly on a given time interval, visco-energetic solutions
comply with Griffith's criterion.
","[{""version"":""v1"",""created"":""Fri, 30 Apr 2021 19:05:51 GMT""},{""version"":""v2"",""created"":""Tue, 17 May 2022 14:01:20 GMT""}]","2022-05-18"
"2105.00047","Jian Zeng","Jian Zeng, Ka Man Chung, Sarath Reddy Adapa, Tianshi Feng, Renkun Chen","In-situ Thermal Transport Measurement of Flowing Fluid using Modulated
  Photothermal Radiometry","1Department of Mechanical and Aerospace Engineering, University of
  California, San Diego, La Jolla, California 92093, United States 2Program of
  Material Science and Engineering, University of California, San Diego, La
  Jolla, California 92093, United States *These authors contributed equally.
  #Corresponding author: rkchen@ucsd.edu",,,,"physics.flu-dyn physics.app-ph","http://arxiv.org/licenses/nonexclusive-distrib/1.0/","  In situ thermal transport measurement of flowing fluid could be useful for
the characterization and diagnosis of practical thermal systems such as fluid
heat exchangers and thermal energy storage systems. Despite abundant reports on
the ex-situ thermal conductivity measurement of stagnant fluids, a suitable
technique for the thermal conductivity measurement of flowing fluid has been
rarely reported. This paper presents the thermal conductivity measurement of
flowing fluid within a pipe using a non-contact modulated photothermal
radiometry (MPR) technique, where the surface of the pipe is heated by an
intensity-modulated laser and the heat diffuses into the fluid with suitable
modulation frequency. We design a tube section with small wall thickness
suitable for the MPR measurements to maximize the sensitivity of the thermal
response to the fluid properties while minimizing the lateral heat spreading
effect. Intrinsic thermal conductivity of different fluids was obtained within
a proper range of frequency and flow velocity where the forced convection
effect is negligible. The forced convection effect became prominent at high
flowing velocity and at low modulation frequency, leading to overestimated
thermal conductivity of fluid. It is found that the intrinsic thermal
conductivity could be obtained when the flow velocity is less than 100 mm/sec
and ReD1/2Pr1/3 < 100 for DI water and Xceltherm oil under the specified
experimental conditions, where Re_D is the Reynolds number and Pr is the
Prandtl number.
","[{""version"":""v1"",""created"":""Fri, 30 Apr 2021 19:08:08 GMT""}]","2021-05-04"
"2105.00048","Roman O. Grigoriev","Daniel R. Gurevich, Patrick A. K. Reinbold, Roman O. Grigoriev","Learning fluid physics from highly turbulent data using sparse
  physics-informed discovery of empirical relations (SPIDER)",,,,,"physics.flu-dyn nlin.CD physics.data-an","http://arxiv.org/licenses/nonexclusive-distrib/1.0/","  We show how a complete mathematical description of a complicated physical
phenomenon can be learned from observational data via a hybrid approach
combining three simple and general ingredients: physical assumptions of
smoothness, locality, and symmetry, a weak formulation of differential
equations, and sparse regression. To illustrate this, we extract a system of
governing equations describing flows of incompressible Newtonian fluids -- the
Navier-Stokes equation, the continuity equation, and the boundary conditions --
from numerical data describing a highly turbulent channel flow in three
dimensions. These relations have the familiar form of partial differential
equations, which are easily interpretable and readily provide information about
the relative importance of different physical effects as well as insight into
the quality of the data, serving as a useful diagnostic tool. The approach
described here is remarkably robust, yielding accurate results for very high
noise levels, and should thus be well-suited to experimental data.
","[{""version"":""v1"",""created"":""Fri, 30 Apr 2021 19:10:38 GMT""},{""version"":""v2"",""created"":""Tue, 24 May 2022 14:58:30 GMT""}]","2022-05-25"
"2105.00049","Shayan Hundrieser","Shayan Hundrieser, Marcel Klatt, Axel Munk","Limit Distributions and Sensitivity Analysis for Empirical Entropic
  Optimal Transport on Countable Spaces","68 pages",,,,"math.PR math.ST stat.TH","http://arxiv.org/licenses/nonexclusive-distrib/1.0/","  For probability measures on countable spaces we derive distributional limits
for empirical entropic optimal transport quantities. More precisely, we show
that the empirical optimal transport plan weakly converges to a centered
Gaussian process and that the empirical entropic optimal transport value is
asymptotically normal. The results are valid for a large class of cost
functions and generalize distributional limits for empirical entropic optimal
transport quantities on finite spaces. Our proofs are based on a sensitivity
analysis with respect to norms induced by suitable function classes, which
arise from novel quantitative bounds for primal and dual optimizers, that are
related to the exponential penalty term in the dual formulation. The
distributional limits then follow from the functional delta method together
with weak convergence of the empirical process in that respective norm, for
which we provide sharp conditions on the underlying measures. As a byproduct of
our proof technique, consistency of the bootstrap for statistical applications
is shown.
","[{""version"":""v1"",""created"":""Fri, 30 Apr 2021 19:15:39 GMT""},{""version"":""v2"",""created"":""Sun, 25 Dec 2022 12:11:13 GMT""}]","2022-12-27"
"2105.00050","Paul Chen","Paul Z. Chen, Aaron J. Clasky, Frank X. Gu","Framework elucidating the supersaturation dynamics of nanocrystal growth","10 pages (main), 5 figures, 12 pages (supplement)",,,,"cond-mat.mtrl-sci physics.chem-ph","http://creativecommons.org/licenses/by-nc-sa/4.0/","  Supersaturation is the fundamental parameter driving crystal formation, yet
its dynamics during the growth of colloidal nanocrystals (NCs) are poorly
understood. Experimental characterization of supersaturation in colloidal
syntheses has been difficult, limiting insight into the phenomena underlying NC
growth. Hence, despite significant interest in the topic, how many types of NCs
grow remain unclear. Here, we develop a framework to quantitatively
characterize supersaturation in situ throughout NC growth. Using this approach,
we investigate the seed-mediated synthesis of colloidal Au nanocubes, revealing
a triphasic sequence for the supersaturation dynamics: rapid monomer
consumption, sustained supersaturation, and then gradual monomer depletion.
These NCs undergo different shape evolutions in different phases of the
supersaturation dynamics. As shown with the Au nanocubes, we can use the
supersaturation profile to theoretically predict the growth profile of NCs. We
then apply these insights to rationally modulate shape evolutions, decreasing
the yield of impurity NCs. Our findings demonstrate that the supersaturation
dynamics of NC growth can be more complex than previously understood. While
this study focuses experimentally on Au NCs, our framework is facile and
applicable to a broad range of NCs undergoing classical growth. Thus, our
methodology facilitates deeper understanding of the phenomena governing
nanoscale crystal growth and provides insight towards the rational design of
NCs.
","[{""version"":""v1"",""created"":""Fri, 30 Apr 2021 19:15:57 GMT""},{""version"":""v2"",""created"":""Sun, 9 May 2021 17:22:13 GMT""},{""version"":""v3"",""created"":""Wed, 18 Aug 2021 19:44:15 GMT""},{""version"":""v4"",""created"":""Fri, 10 Sep 2021 19:14:04 GMT""}]","2021-09-14"
