"2105.00202","Stavros Ntalampiras","Michelangelo Acconcjaioco and Stavros Ntalampiras","One-shot learning for acoustic identification of bird species in
  non-stationary environments",,,,,"cs.LG cs.AI cs.SD eess.AS","http://creativecommons.org/licenses/by/4.0/","  This work introduces the one-shot learning paradigm in the computational
bioacoustics domain. Even though, most of the related literature assumes
availability of data characterizing the entire class dictionary of the problem
at hand, that is rarely true as a habitat's species composition is only known
up to a certain extent. Thus, the problem needs to be addressed by
methodologies able to cope with non-stationarity. To this end, we propose a
framework able to detect changes in the class dictionary and incorporate new
classes on the fly. We design an one-shot learning architecture composed of a
Siamese Neural Network operating in the logMel spectrogram space. We
extensively examine the proposed approach on two datasets of various bird
species using suitable figures of merit. Interestingly, such a learning scheme
exhibits state of the art performance, while taking into account extreme
non-stationarity cases.
","[{""version"":""v1"",""created"":""Sat, 1 May 2021 09:43:20 GMT""}]","2021-05-04"
"2105.00203","Ahmed Aldahdooh","Ahmed Aldahdooh, Wassim Hamidouche, Sid Ahmed Fezza, Olivier Deforges","Adversarial Example Detection for DNN Models: A Review and Experimental
  Comparison","Accepted and published in Artificial Intelligence Review journal",,"10.1007/s10462-021-10125-w",,"cs.CV cs.CR","http://creativecommons.org/licenses/by/4.0/","  Deep learning (DL) has shown great success in many human-related tasks, which
has led to its adoption in many computer vision based applications, such as
security surveillance systems, autonomous vehicles and healthcare. Such
safety-critical applications have to draw their path to success deployment once
they have the capability to overcome safety-critical challenges. Among these
challenges are the defense against or/and the detection of the adversarial
examples (AEs). Adversaries can carefully craft small, often imperceptible,
noise called perturbations to be added to the clean image to generate the AE.
The aim of AE is to fool the DL model which makes it a potential risk for DL
applications. Many test-time evasion attacks and countermeasures,i.e., defense
or detection methods, are proposed in the literature. Moreover, few reviews and
surveys were published and theoretically showed the taxonomy of the threats and
the countermeasure methods with little focus in AE detection methods. In this
paper, we focus on image classification task and attempt to provide a survey
for detection methods of test-time evasion attacks on neural network
classifiers. A detailed discussion for such methods is provided with
experimental results for eight state-of-the-art detectors under different
scenarios on four datasets. We also provide potential challenges and future
perspectives for this research direction.
","[{""version"":""v1"",""created"":""Sat, 1 May 2021 09:55:17 GMT""},{""version"":""v2"",""created"":""Tue, 21 Sep 2021 07:37:26 GMT""},{""version"":""v3"",""created"":""Mon, 6 Dec 2021 10:15:48 GMT""},{""version"":""v4"",""created"":""Fri, 7 Jan 2022 14:52:45 GMT""}]","2022-01-10"
"2105.00204","Mikhail Freer","Ahrash Dianat and Mikhail Freer","Credibility in Second-Price Auctions: An Experimental Test",,,,,"econ.GN q-fin.EC","http://creativecommons.org/licenses/by/4.0/","  We provide the first direct test of how the credibility of an auction format
affects bidding behavior and final outcomes. To do so, we conduct a series of
laboratory experiments where the role of the seller is played by a human
subject who receives the revenue from the auction and who (depending on the
treatment) has agency to determine the outcome of the auction. Contrary to
theoretical predictions, we find that the non-credible second-price auction
fails to converge to the first-price auction. We provide a behavioral
explanation for our results based on sellers' aversion to rule-breaking, which
is confirmed by an additional experiment.
","[{""version"":""v1"",""created"":""Sat, 1 May 2021 09:55:58 GMT""},{""version"":""v2"",""created"":""Sun, 1 Jan 2023 17:55:17 GMT""}]","2023-01-03"
"2105.00205","Zikuan Wang","Zikuan Wang and Wenjian Liu","iOI: an Iterative Orbital Interaction Approach for Solving the
  Self-Consistent Field Problem","45 pages, 6 figures",,,,"physics.chem-ph","http://creativecommons.org/licenses/by/4.0/","  An iterative orbital interaction (iOI) approach is proposed to solve, in a
bottom-up fashion, the self-consistent field problem in quantum chemistry.
While it belongs grossly to the family of fragment-based quantum chemical
methods, iOI is distinctive in that (1) it divides and conquers not only the
energy but also the wave function, and that (2) the subsystems sizes are
automatically determined by successively merging neighboring small subsystems
until they are just enough for converging the wave function to a given
accuracy. Orthonormal occupied and virtual localized molecular orbitals are
obtained in a natural manner, which can be used for all post-SCF purposes.
","[{""version"":""v1"",""created"":""Sat, 1 May 2021 09:59:17 GMT""}]","2021-05-04"
"2105.00206","Hamza Si Kaddour","Maurice Pouzet, Hamza Si Kaddour, Bhalchandra D. Thatte","On the Boolean dimension of a graph and other related parameters","13 pages, 2 figures",,,,"math.CO","http://arxiv.org/licenses/nonexclusive-distrib/1.0/","  We present the Boolean dimension of a graph, we relate it with the notions of
inner, geometric and symplectic dimensions, and with the rank and minrank of a
graph. We obtain an exact formula for the Boolean dimension of a tree in terms
of a certain star decomposition. We relate the Boolean dimension with the
inversion index of a tournament.
","[{""version"":""v1"",""created"":""Sat, 1 May 2021 10:02:24 GMT""},{""version"":""v2"",""created"":""Thu, 31 Mar 2022 10:33:47 GMT""},{""version"":""v3"",""created"":""Mon, 29 Aug 2022 12:12:13 GMT""},{""version"":""v4"",""created"":""Tue, 6 Sep 2022 10:31:31 GMT""}]","2022-09-07"
"2105.00207","Olga Vais","M. G. Lobok, I. A. Andriyash, O. E. Vais, V. Malka, V. Yu. Bychenkov","Bright synchrotron radiation from relativistic self-trapping of a short
  laser pulse in near-critical density plasma",,,"10.1103/PhysRevE.104.L053201",,"physics.plasm-ph","http://arxiv.org/licenses/nonexclusive-distrib/1.0/","  In a dense gas plasma a short laser pulse propagates in relativistic
self-trapping mode, which enables effective conversion of laser energy to the
accelerated electrons. This regime sustains effective loading which maximizes
the total charge of the accelerating electrons, that provides a large amount of
betatron radiation. The 3D particle-in-cell simulations demonstrate how such
regime triggers X-ray generation with 0.1-1 MeV photon energies, low
divergence, and high brightness. It is shown that a 135 TW laser can be used to
produce $3\times 10^{10}$ photons of $>10$ keV energy and a 1.2 PW laser makes
it possible generating about $10^{12}$ photons in the same energy range. The
laser-to-gammas energy conversion efficiency is up to $10^{-4}$ for the
high-energy photons, $\sim 100$ keV, while the conversion efficiency to the
entire keV-range x-rays is estimated to be a few tenths of a percent.
","[{""version"":""v1"",""created"":""Sat, 1 May 2021 10:07:16 GMT""}]","2021-12-15"
"2105.00208","Erwan Mahe","Erwan Mahe, Christophe Gaston, Pascale Le Gall","A structural operational semantics for interactions with a look at loops","14 pages of contents, 9 additional pages with 1 for references and 8
  for appendices, 5 figures",,,,"cs.FL cs.LO","http://arxiv.org/licenses/nonexclusive-distrib/1.0/","  Message Sequence Charts & Sequence Diagrams are graphical models that
represent the behavior of distributed and concurrent systems via the scheduling
of discrete and local emission and reception events. We propose an Interaction
Language (IL) to formalize such models, defined as a term algebra which
includes strict and weak sequencing, alternative and parallel composition and
four kinds of loops. This IL is equipped with a denotational-style semantics
associating a set of traces (sequences of observed events) to each interaction.
We then define a structural operational semantics in the style of process
algebras and formally prove the equivalence of both semantics.
","[{""version"":""v1"",""created"":""Sat, 1 May 2021 10:15:29 GMT""}]","2021-05-04"
"2105.00209","Mohammad Alidoust","Mohammad Alidoust, David Kleiven, and Jaakko Akola","Density functional simulations of pressurized Mg-Zn and Al-Zn alloys","14 page, 10 figures, 3 tables","Phys. Rev. Materials 4, 045002 (2020)","10.1103/PhysRevMaterials.4.045002",,"cond-mat.mtrl-sci cond-mat.mes-hall cond-mat.stat-mech","http://creativecommons.org/licenses/by/4.0/","  The Mg-Zn and Al-Zn binary alloys have been investigated theoretically under
static isotropic pressure. The stable phases of these binaries on both
initially hexagonal-close-packed (HCP) and face-centered-cubic (FCC) lattices
have been determined by utilizing an iterative approach that uses a
configurational cluster expansion method, Monte Carlo search algorithm, and
density functional theory (DFT) calculations. Based on 64-atom models, it is
shown that the most stable phases of the Mg-Zn binary alloy under ambient
condition are $\rm MgZn_3$, $\rm Mg_{19}Zn_{45}$, $\rm MgZn$, and $\rm
Mg_{34}Zn_{30}$ for the HCP, and $\rm MgZn_3$ and $\rm MgZn$ for the FCC
lattice, whereas the Al-Zn binary is energetically unfavorable throughout the
entire composition range for both the HCP and FCC lattices under all
conditions. By applying an isotropic pressure in the HCP lattice, $\rm
Mg_{19}Zn_{45}$ turns into an unstable phase at P$\approx$$10$~GPa, a new
stable phase $\rm Mg_{3}Zn$ appears at P$\gtrsim$$20$~GPa, and $\rm
Mg_{34}Zn_{30}$ becomes unstable for P$\gtrsim$$30$~GPa. For FCC lattice, the
$\rm Mg_{3}Zn$ phase weakly touches the convex hull at P$\gtrsim$$20$~GPa while
the other stable phases remain intact up to $\approx$$120$~GPa. Furthermore,
making use of the obtained DFT results, bulk modulus has been computed for
several compositions up to pressure values of the order of $\approx$$120$~GPa.
The findings suggest that one can switch between $\rm Mg$-rich and $\rm
Zn$-rich early-stage clusters simply by applying external pressure. $\rm
Zn$-rich alloys and precipitates are more favorable in terms of stiffness and
stability against external deformation.
","[{""version"":""v1"",""created"":""Sat, 1 May 2021 10:16:17 GMT""}]","2021-05-06"
"2105.00210","Avi Mohan","Mohammani Zaki, Avi Mohan, Aditya Gopalan, Shie Mannor","Better than the Best: Gradient-based Improper Reinforcement Learning for
  Network Scheduling","4 pages, 5 figures, RLNQ workshop at the SIGMETRICS 2021",,,,"cs.LG","http://creativecommons.org/licenses/by/4.0/","  We consider the problem of scheduling in constrained queueing networks with a
view to minimizing packet delay. Modern communication systems are becoming
increasingly complex, and are required to handle multiple types of traffic with
widely varying characteristics such as arrival rates and service times. This,
coupled with the need for rapid network deployment, render a bottom up approach
of first characterizing the traffic and then devising an appropriate scheduling
protocol infeasible.
  In contrast, we formulate a top down approach to scheduling where, given an
unknown network and a set of scheduling policies, we use a policy gradient
based reinforcement learning algorithm that produces a scheduler that performs
better than the available atomic policies. We derive convergence results and
analyze finite time performance of the algorithm. Simulation results show that
the algorithm performs well even when the arrival rates are nonstationary and
can stabilize the system even when the constituent policies are unstable.
","[{""version"":""v1"",""created"":""Sat, 1 May 2021 10:18:34 GMT""}]","2021-05-04"
"2105.00211","Emmanuel Ramasso","Pablo Juesas, Emmanuel Ramasso, S\'ebastien Drujont, Vincent Placet","Autoregressive Hidden Markov Models with partial knowledge on latent
  space applied to aero-engines prognostics",,"European Conference of the PHM Society 2016, selected for extended
  version in IJPHM","10.36001/phme.2016.v3i1.1642","hal-02131233","stat.ML cs.LG stat.AP stat.ME","http://creativecommons.org/licenses/by/4.0/","  [This paper was initially published in PHME conference in 2016, selected for
further publication in International Journal of Prognostics and Health
Management.]
  This paper describes an Autoregressive Partially-hidden Markov model (ARPHMM)
for fault detection and prognostics of equipments based on sensors' data. It is
a particular dynamic Bayesian network that allows to represent the dynamics of
a system by means of a Hidden Markov Model (HMM) and an autoregressive (AR)
process. The Markov chain assumes that the system is switching back and forth
between internal states while the AR process ensures a temporal coherence on
sensor measurements. A sound learning procedure of standard ARHMM based on
maximum likelihood allows to iteratively estimate all parameters
simultaneously. This paper suggests a modification of the learning procedure
considering that one may have prior knowledge about the structure which becomes
partially hidden. The integration of the prior is based on the Theory of
Weighted Distributions which is compatible with the Expectation-Maximization
algorithm in the sense that the convergence properties are still satisfied. We
show how to apply this model to estimate the remaining useful life based on
health indicators. The autoregressive parameters can indeed be used for
prediction while the latent structure can be used to get information about the
degradation level. The interest of the proposed method for prognostics and
health assessment is demonstrated on CMAPSS datasets.
","[{""version"":""v1"",""created"":""Sat, 1 May 2021 10:23:22 GMT""}]","2021-05-04"
"2105.00212","Serge Kas Hanna","Serge Kas Hanna and Rawad Bitar","Detecting Deletions and Insertions in Concatenated Strings with Optimal
  Redundancy","Shorter version accepted in ISIT 2021",,,,"cs.IT math.IT","http://arxiv.org/licenses/nonexclusive-distrib/1.0/","  We study codes that can detect the exact number of deletions and insertions
in concatenated binary strings. We construct optimal codes for the case of
detecting up to $\del$ deletions. We prove the optimality of these codes by
deriving a converse result which shows that the redundancy of our codes is
asymptotically optimal in $\del$ among all families of deletion detecting
codes, and particularly optimal among all block-by-block decodable codes. For
the case of insertions, we construct codes that can detect up to $2$ insertions
in each concatenated binary string.
","[{""version"":""v1"",""created"":""Sat, 1 May 2021 10:26:09 GMT""}]","2021-05-04"
"2105.00213","Christophe Galland","Valeria Vento and Santiago Tarrago Velez and Anna Pogrebna and
  Christophe Galland","Measurement-Induced Collective Vibrational Quantum Coherence under
  Spontaneous Raman Scattering in a Liquid",,,,,"quant-ph physics.optics","http://creativecommons.org/licenses/by-nc-sa/4.0/","  Spontaneous vibrational Raman scattering is a ubiquitous form of light-matter
interaction whose description necessitates quantization of the electromagnetic
field. It is usually considered as an incoherent process because the scattered
field lacks any predictable phase relationship with the incoming field. When
probing an ensemble of molecules, the question therefore arises: What quantum
state should be used to describe the molecular ensemble following spontaneous
Stokes scattering? We experimentally address this question by measuring
time-resolved Stokes--anti-Stokes two-photon coincidences on a molecular liquid
consisting of several sub-ensembles with slightly different vibrational
frequencies. When spontaneously scattered Stokes photons and subsequent
anti-Stokes photons are detected into a single spatiotemporal mode, the
observed dynamics is inconsistent with a statistical mixture of individually
excited molecules. Instead, we show that the data are reproduced if
Stokes--anti-Stokes correlations are mediated by a collective vibrational
quantum, i.e. a coherent superposition of all molecules interacting with light.
Our results demonstrate that the degree of coherence in the vibrational state
of the liquid is not an intrinsic property of the material system, but rather
depends on the optical excitation and detection geometry.
","[{""version"":""v1"",""created"":""Sat, 1 May 2021 10:30:32 GMT""},{""version"":""v2"",""created"":""Sun, 15 May 2022 14:21:35 GMT""},{""version"":""v3"",""created"":""Sat, 1 Oct 2022 20:31:19 GMT""}]","2022-10-04"
"2105.00214","Yuping Chen","Xiongshuo Yan, Yi'an Liu, Jiangwei Wu, Yuping Chen, and Xianfeng Chen","Integrated spiral waveguide amplifiers on erbium-doped thin-film lithium
  niobate",,,,,"physics.optics physics.app-ph","http://creativecommons.org/licenses/by-nc-nd/4.0/","  Integrated optical amplifiers and light sources are of great significance for
photonic integrated circuits (PICs) and have attracted many research interests.
Doping rare-earth ions in materials as a solution to realize efficient optical
amplifiers and lasing has been investigated a lot. We investigate the
erbium-doped lithium niobate on insulator (LNOI). Here, spiral waveguide
amplifiers were fabricated on a 1-mol\% erbium-doped LNOI by CMOS-compatible
technique. We demonstrated a maximum internal net gain of 8.3 dB at 1530 nm
indicating a net gain per unit length of 15.6 dB/cm with a compact spiral
waveguide of 5.3 mm length and $ \sim $0.06 mm$ ^{2} $ footprint. The
erbium-doped integrated lithium niobate spiral waveguide amplifiers would pave
the way in the PICs of the lithium niobate platform, especially in achieving
efficient integration of active and passive devices on a lithium niobate thin
film, which will make full use of its excellent physical properties such as
remarkable photoacoustic, electro-optic, and piezoelectric characteristics.
","[{""version"":""v1"",""created"":""Sat, 1 May 2021 10:57:40 GMT""}]","2022-01-02"
"2105.00215","Pinar Uluer","Pinar Uluer, Hatice Kose, Agnieszka Landowska, Tatjana Zorcec, Ben
  Robins and Duygun Erol Barkana","Child-Robot Interaction Studies During COVID-19 Pandemic","Presented in Child-Robot Interaction: Present and Future
  Relationships Workshop at International Conference on Social Robotics (ICSR)
  on 16 November 2020",,,,"cs.HC","http://arxiv.org/licenses/nonexclusive-distrib/1.0/","  The coronavirus disease (COVID-19) pandemic affected our lives deeply, just
like everyone else, the children also suffered from the restrictions due to
COVID-19 affecting their education and social interactions with others, being
restricted from play areas and schools for a long time. Although social robots
provide a promising solution to support children in their education, healthcare
and social interaction with others, the precautions due to COVID-19 also
introduced new constraints in the social robotics research. In this paper, we
will discuss the benefits and challenges encountered in child-robot interaction
due to COVID-19 based on two user studies. The first study involves children
with hearing disabilities, and Pepper humanoid robot to support their
audiometry tests. The second study includes the child-sized humanoid robot
Kaspar and interaction games with children with autism spectrum disorder (ASD).
","[{""version"":""v1"",""created"":""Sat, 1 May 2021 11:05:47 GMT""}]","2021-05-04"
"2105.00216","Davide Grossi","Davide Grossi","Lecture Notes on Voting Theory",,,,,"cs.MA econ.TH","http://creativecommons.org/licenses/by/4.0/","  These lecture notes have been developed for the course Computational Social
Choice of the Artificial Intelligence MSc programme at the University of
Groningen. They cover mathematical and algorithmic aspects of voting theory.
","[{""version"":""v1"",""created"":""Sat, 1 May 2021 11:19:44 GMT""}]","2021-05-04"
"2105.00217","Jens Erler","Jens Erler","Global Vision of Precision Measurements","6 pages, 10 figures, contributions to Les Rencontres de Physique de
  la Vall\'ee d'Aoste (La Thuile 2021), March 9--11, 2021; and to the 2021 EW
  session of the 55th Rencontres de Moriond, March 21--27, 2021",,,"MITP/21-022","hep-ph hep-ex nucl-ex","http://arxiv.org/licenses/nonexclusive-distrib/1.0/","  I summarize recent developments in electroweak precision physics and global
fits. Expectations for future measurements, both at lower energies and the
energy frontier, are also discussed.
","[{""version"":""v1"",""created"":""Sat, 1 May 2021 11:21:29 GMT""}]","2021-05-05"
"2105.00218","Chen Lan","Chen Lan and Yan-Gang Miao","Entropy and Topology of Regular Black Holes","revtex4-2, 10 pages",,,,"gr-qc","http://creativecommons.org/licenses/by/4.0/","  We calculate the entropy of spherically symmetric regular black holes by the
path integral and Noether-charge method. Both methods provide an evidence that
the entropy of regular black holes should be proportional to quarter of area,
and there is no violation of entropy/area law at all.
","[{""version"":""v1"",""created"":""Sat, 1 May 2021 11:31:28 GMT""}]","2021-05-04"
"2105.00219","Ramachandran Suresh","C. Ramya, R. Gopal, R. Suresh, and V. K. Chandrasekar","Dynamics of coupled modified Rossler oscillators: the role of
  nonisochronicity parameter","11 pages, 13 figures. Accepted for publication in Chaos",,"10.1063/5.0043161",,"nlin.CD","http://creativecommons.org/licenses/by/4.0/","  The amplitude-dependent frequency of the oscillations, termed
\emph{nonisochronicity}, is one of the essential characteristics of nonlinear
oscillators. In this paper, the dynamics of the Rossler oscillator in the
presence of nonisochronicity is examined. In particular, we explore the
appearance of a new fixed point and the emergence of a coexisting limit-cycle
and quasiperiodic attractors. We also describe the sequence of bifurcations
leading to synchronized, desynchronized attractors and oscillation death states
in the coupled Rossler oscillators as a function of the strength of
nonisochronicity and coupling parameters. Further, we characterize the
multistability of the coexisting attractors by plotting the basins of
attraction. Our results open up the possibilities of understanding the
emergence of coexisting attractors, and into a qualitative change of the
collective states in coupled nonlinear oscillators in the presence of
nonisochronicity.
","[{""version"":""v1"",""created"":""Sat, 1 May 2021 11:31:35 GMT""}]","2021-06-02"
"2105.00220","Kensuke Nakamura","Kensuke Nakamura and Simon Korman and Byung-Woo Hong","Generative Adversarial Networks via a Composite Annealing of Noise and
  Diffusion",,,,,"cs.LG cs.CV","http://creativecommons.org/licenses/by/4.0/","  Generative adversarial network (GAN) is a framework for generating fake data
using a set of real examples. However, GAN is unstable in the training stage.
In order to stabilize GANs, the noise injection has been used to enlarge the
overlap of the real and fake distributions at the cost of increasing variance.
The diffusion (or smoothing) may reduce the intrinsic underlying dimensionality
of data but it suppresses the capability of GANs to learn high-frequency
information in the training procedure. Based on these observations, we propose
a data representation for the GAN training, called noisy scale-space (NSS),
that recursively applies the smoothing with a balanced noise to data in order
to replace the high-frequency information by random data, leading to a
coarse-to-fine training of GANs. We experiment with NSS using DCGAN and
StyleGAN2 based on benchmark datasets in which the NSS-based GANs outperforms
the state-of-the-arts in most cases.
","[{""version"":""v1"",""created"":""Sat, 1 May 2021 11:32:16 GMT""},{""version"":""v2"",""created"":""Tue, 4 May 2021 01:12:19 GMT""},{""version"":""v3"",""created"":""Mon, 1 Aug 2022 02:44:33 GMT""}]","2022-08-02"
