"2104.15080","Rainer Sinn","Rainer Sinn and Hannah Sj\""oberg","Do alcoved lattice polytopes have unimodal h*-vector?",,,,,"math.CO","http://arxiv.org/licenses/nonexclusive-distrib/1.0/","  We show that h*-vectors of alcoved polytopes P in R^n (of Lie type A) are
unimodal if they contain interior lattice points and their facets have lattice
distance 1 to the set of interior lattice points. The maximal possible such
distance for general alcoved polytopes is shown to be dim(P)-1. A secondary
purpose of the paper is to serve as a guide to previous work surrounding
unimodality of h*-vectors of alcoved polytopes and related questions.
","[{""version"":""v1"",""created"":""Fri, 30 Apr 2021 16:01:21 GMT""}]","2021-05-03"
"2104.15081","Esen Yel","Esen Yel, Nicola Bezzo","A Meta-Learning-based Trajectory Tracking Framework for UAVs under
  Degraded Conditions","2021 IEEE/RSJ International Conference on Intelligent Robots and
  Systems (IROS) (to appear) 2021 copyright IEEE",,"10.1109/IROS51168.2021.9635918",,"cs.RO","http://arxiv.org/licenses/nonexclusive-distrib/1.0/","  Due to changes in model dynamics or unexpected disturbances, an autonomous
robotic system may experience unforeseen challenges during real-world
operations which may affect its safety and intended behavior: in particular
actuator and system failures and external disturbances are among the most
common causes of degraded mode of operation. To deal with this problem, in this
work, we present a meta-learning-based approach to improve the trajectory
tracking performance of an unmanned aerial vehicle (UAV) under actuator faults
and disturbances which have not been previously experienced. Our approach
leverages meta-learning to train a model that is easily adaptable at runtime to
make accurate predictions about the system's future state. A runtime monitoring
and validation technique is proposed to decide when the system needs to adapt
its model by considering a data pruning procedure for efficient learning.
Finally, the reference trajectory is adapted based on future predictions by
borrowing feedback control logic to make the system track the original and
desired path without needing to access the system's controller. The proposed
framework is applied and validated in both simulations and experiments on a
faulty UAV navigation case study demonstrating a drastic increase in tracking
performance.
","[{""version"":""v1"",""created"":""Fri, 30 Apr 2021 16:04:16 GMT""},{""version"":""v2"",""created"":""Wed, 4 Aug 2021 21:06:12 GMT""}]","2023-05-31"
"2104.15082","Ruowei Jiang","Zeqi Li, Ruowei Jiang and Parham Aarabi","Semantic Relation Preserving Knowledge Distillation for Image-to-Image
  Translation","Accepted to ECCV 2020",,,,"cs.CV","http://arxiv.org/licenses/nonexclusive-distrib/1.0/","  Generative adversarial networks (GANs) have shown significant potential in
modeling high dimensional distributions of image data, especially on
image-to-image translation tasks. However, due to the complexity of these
tasks, state-of-the-art models often contain a tremendous amount of parameters,
which results in large model size and long inference time. In this work, we
propose a novel method to address this problem by applying knowledge
distillation together with distillation of a semantic relation preserving
matrix. This matrix, derived from the teacher's feature encoding, helps the
student model learn better semantic relations. In contrast to existing
compression methods designed for classification tasks, our proposed method
adapts well to the image-to-image translation task on GANs. Experiments
conducted on 5 different datasets and 3 different pairs of teacher and student
models provide strong evidence that our methods achieve impressive results both
qualitatively and quantitatively.
","[{""version"":""v1"",""created"":""Fri, 30 Apr 2021 16:04:19 GMT""},{""version"":""v2"",""created"":""Wed, 19 May 2021 01:44:41 GMT""}]","2021-05-20"
"2104.15083","Rajarshi Roy","Jean-Rapha\""el Gaglione, Daniel Neider, Rajarshi Roy, Ufuk Topcu and
  Zhe Xu","Learning Linear Temporal Properties from Noisy Data: A MaxSAT Approach",,,,,"cs.LG cs.AI cs.FL","http://arxiv.org/licenses/nonexclusive-distrib/1.0/","  We address the problem of inferring descriptions of system behavior using
Linear Temporal Logic (LTL) from a finite set of positive and negative
examples. Most of the existing approaches for solving such a task rely on
predefined templates for guiding the structure of the inferred formula. The
approaches that can infer arbitrary LTL formulas, on the other hand, are not
robust to noise in the data. To alleviate such limitations, we devise two
algorithms for inferring concise LTL formulas even in the presence of noise.
Our first algorithm infers minimal LTL formulas by reducing the inference
problem to a problem in maximum satisfiability and then using off-the-shelf
MaxSAT solvers to find a solution. To the best of our knowledge, we are the
first to incorporate the usage of MaxSAT solvers for inferring formulas in LTL.
Our second learning algorithm relies on the first algorithm to derive a
decision tree over LTL formulas based on a decision tree learning algorithm. We
have implemented both our algorithms and verified that our algorithms are
efficient in extracting concise LTL descriptions even in the presence of noise.
","[{""version"":""v1"",""created"":""Fri, 30 Apr 2021 16:06:03 GMT""},{""version"":""v2"",""created"":""Thu, 24 Jun 2021 19:56:55 GMT""}]","2021-06-28"
"2104.15084","Changchen Chen","Changchen Chen, Jeffrey H. Shapiro, and Franco N.C. Wong","Experimental demonstration of conjugate-Franson interferometry",,"Phys. Rev. Lett. 127, 093603 (2021)","10.1103/PhysRevLett.127.093603",,"quant-ph","http://arxiv.org/licenses/nonexclusive-distrib/1.0/","  Franson interferometry is a well-known quantum measurement technique for
probing photon-pair frequency correlations that is often used to certify
time-energy entanglement. We demonstrate the complementary technique in the
time basis, called conjugate-Franson interferometry, that measures photon-pair
arrival-time correlations, thus providing a valuable addition to the quantum
toolbox. We obtain a conjugate-Franson interference visibility of $96\pm 1$%
without background subtraction for entangled photon pairs generated by
spontaneous parametric down-conversion. Our measured result surpasses the
quantum-classical threshold by 25 standard deviations and validates the
conjugate-Franson interferometer (CFI) as an alternative method for certifying
time-energy entanglement. Moreover, the CFI visibility is a function of the
biphoton's joint temporal intensity and is therefore sensitive to that state's
spectral phase variation, something which is not the case for Franson
interferometry or Hong-Ou-Mandel interferometry. We highlight the CFI's utility
by measuring its visibilities for two different biphoton states, one without
and the other with spectral phase variation, and observing a 21% reduction in
the CFI visibility for the latter. The CFI is potentially useful for
applications in areas of photonic entanglement, quantum communications, and
quantum networking.
","[{""version"":""v1"",""created"":""Fri, 30 Apr 2021 16:07:30 GMT""}]","2021-09-01"
"2104.15085","Yu Tian","Tianhao Li, Yu Tian, Shuai Yuan, Naijin Liu","Mean Field MARL Based Bandwidth Negotiation Method for Massive Devices
  Spectrum Sharing",,,,,"eess.SP","http://arxiv.org/licenses/nonexclusive-distrib/1.0/","  In this paper, a novel bandwidth negotiation mechanism is proposed for
massive devices wireless spectrum sharing, in which individual device locally
negotiates bandwidth usage with neighbor devices and globally optimal spectrum
utilization is achieved through distributed decision-making. Since only sparse
feedback is needed, the proposed mechanism can greatly reduce the signaling
overhead. In order to solve the distributed optimization problem when massive
devices coexist, mean field multi-agent reinforcement learning (MF-MARL) based
bandwidth decision algorithm is proposed, which allow device make globally
optimal decision leveraging only neighborhood observation. In simulation,
distributed bandwidth negotiation between 1000 devices is demonstrated and the
spectrum utilization rate is above 95%. The proposed method is beneficial to
reduce spectrum conflicts, increase spectrum utilization for massive devices
spectrum sharing.
","[{""version"":""v1"",""created"":""Fri, 30 Apr 2021 16:07:39 GMT""}]","2021-05-03"
"2104.15086","Helen Barnett","Helen Barnett, Oliver Boix, Dimintris Kontos and Thomas Jaki","Dose Finding Studies for Therapies with Late-Onset Toxicities: A
  Comparison Study of Designs","34 Pages, 5 Figures, 6 Tables",,,,"stat.AP","http://arxiv.org/licenses/nonexclusive-distrib/1.0/","  An objective of phase I dose-finding trials is to find the maximum tolerated
dose; the dose with a particular risk of toxicity. Frequently, this risk is
assessed across the first cycle of therapy. However, in oncology, a course of
treatment frequently consists of multiple cycles of therapy. In many cases, the
overall risk of toxicity for a given treatment is not fully encapsulated by
observations from the first cycle, and hence it is advantageous to include
toxicity outcomes from later cycles in phase I trials. Extending the follow up
period in a trial naturally extends the total length of the trial which is
undesirable. We present a comparison of eight methods that incorporate late
onset toxicities whilst not extensively extending the trial length. We conduct
simulation studies over a number of scenarios and in two settings; the first
setting with minimal stopping rules and the second setting with a full set of
standard stopping rules expected in such a dose finding study. We find that the
model-based approaches in general outperform the model-assisted approaches,
with an Interval Censored approach and a modified version of the Time-to-Event
Continual Reassessment Method giving the most promising overall performance in
terms of correct selections and trial length. Further recommendations are made
for the implementation of such methods.
","[{""version"":""v1"",""created"":""Fri, 30 Apr 2021 16:07:57 GMT""}]","2021-05-03"
"2104.15087","Wanrudee Skulpakdee","Wanrudee Skulpakdee and Mongkol Hunkrajok","Models Based on Exponential Interarrival Times for Single-Unusual-Event
  Count Data","22 pages, 5 figures",,,,"stat.AP","http://creativecommons.org/licenses/by/4.0/","  At least one unusual event appears in some count datasets. It will lead to a
more concentrated (or dispersed) distribution than the Poisson, the gamma, the
Weibull, and the Conway-Maxwell-Poisson (CMP) can accommodate. These well-known
count models are based on the equal rates of interarrival times between
successive events. Under the assumption of unequal rates (one unusual event)
and independent exponential interarrival times, a new class of parametric
models for single-unusual-event (SUE) count data is proposed. These two models
are applied to two empirical applications, the number of births and the number
of bids, and yield considerably better results to the above well-known count
models.
","[{""version"":""v1"",""created"":""Fri, 30 Apr 2021 16:11:39 GMT""},{""version"":""v2"",""created"":""Thu, 6 May 2021 02:52:28 GMT""}]","2021-05-07"
"2104.15088","Eleni Zavrakli","Eleni Zavrakli, Andrew Parnell, David Malone, Ken Duffy, Subhrakanti
  Dey","Optimal age-specific vaccination control for COVID-19: an Irish case
  study",,,,,"math.OC q-bio.PE","http://creativecommons.org/licenses/by/4.0/","  The outbreak of a novel coronavirus causing severe acute respiratory syndrome
in December 2019 has escalated into a worldwide pandemic. In this work, we
propose a compartmental model to describe the dynamics of transmission of
infection and use it to obtain the optimal vaccination control. The model
accounts for the various stages of the vaccination and the optimisation is
focused on minimising the infections to protect the population and relieve the
healthcare system. As a case study we selected the Republic of Ireland. We use
data provided by Ireland's COVID-19 Data-Hub and simulate the evolution of the
pandemic with and without the vaccination in place for two different scenarios,
one representative of a national lockdown situation and the other indicating
looser restrictions in place. One of the main findings of our work is that the
optimal approach would involve a vaccination programme where the older
population is vaccinated in larger numbers earlier while simultaneously part of
the younger population also gets vaccinated to lower the risk of transmission
between groups. We compare our simulated results with that of the vaccination
policy taken by the Irish government to explore the advantages of our
optimisation method. Our comparison suggests that a similar reduction in cases
may have been possible even with a reduced set of vaccinations being available
for use.
","[{""version"":""v1"",""created"":""Fri, 30 Apr 2021 16:13:50 GMT""},{""version"":""v2"",""created"":""Tue, 8 Jun 2021 15:29:58 GMT""},{""version"":""v3"",""created"":""Thu, 9 Jun 2022 20:36:30 GMT""},{""version"":""v4"",""created"":""Mon, 24 Oct 2022 17:41:24 GMT""}]","2022-10-25"
"2104.15089","Timo Eichmann","Timo Eichmann, James R. Anglin","An atomic bright vector soliton as an active particle",,,"10.1103/PhysRevA.104.043317",,"nlin.PS","http://creativecommons.org/licenses/by/4.0/","  Solitons in general are configurations of extended fields which move like
isolated particles. Vector bright solitons can occur in a two-component
self-attractive Bose-Einstein condensate. If the components of the condensate
have different chemical potentials, the total spin of the soliton can serve as
an internal energy depot that makes the soliton into an \emph{active} particle,
able to move against an external force using energy carried within the particle
-- if there is a dynamical mechanism for steadily transferring energy from
soliton spin into soliton motion. Here we present such a dynamical mechanism,
embed it in an experimentally feasible way within the larger system of a spinor
condensate mean field, and show how the mechanism works to realize a solitonic
active particle. In what can be considered a toy model for the project of going
beyond toy models for active particles, we test the robustness of the activity
mechanism by exploring a range of deformations to the simplest model for
embedding the nonlinear mechanism in the condensate system.
","[{""version"":""v1"",""created"":""Fri, 30 Apr 2021 16:14:21 GMT""}]","2021-11-03"
"2104.15090","Sebastian H\""onel","Sebastian H\""onel","Technical Reports Compilation: Detecting the Fire Drill Anti-pattern
  Using Source Code and Issue-Tracking Data","338 pages, 105 figures, 67 tables",,,,"cs.SE stat.CO stat.ML","http://creativecommons.org/licenses/by-nc-sa/4.0/","  Detecting the presence of project management anti-patterns (AP) currently
requires experts on the matter and is an expensive endeavor. Worse, experts may
introduce their individual subjectivity or bias. Using the Fire Drill AP, we
first introduce a novel way to translate descriptions into detectable AP that
are comprised of arbitrary metrics and events such as logged time or
maintenance activities, which are mined from the underlying source code or
issue-tracking data, thus making the description objective as it becomes
data-based. Secondly, we demonstrate a novel method to quantify and score the
deviations of real-world projects to data-based AP descriptions. Using fifteen
real-world projects that exhibit a Fire Drill to some degree, we show how to
further enhance the translated AP. The ground truth in these projects was
extracted from two individual experts and consensus was found between them. We
introduce a novel method called automatic calibration, that optimizes a pattern
such that only necessary and important scores remain that suffice to
confidently detect the degree to which the AP is present. Without automatic
calibration, the proposed patterns show only weak potential for detecting the
presence. Enriching the AP with data from real-world projects significantly
improves the potential. We also introduce a no-pattern approach that exploits
the ground truth for establishing a new, quantitative understanding of the
phenomenon, as well as for finding gray-/black-box predictive models. We
conclude that the presence detection and severity assessment of the Fire Drill
anti-pattern, as well as some of its related and similar patterns, is certainly
possible using some of the presented approaches.
","[{""version"":""v1"",""created"":""Fri, 30 Apr 2021 16:16:32 GMT""},{""version"":""v2"",""created"":""Mon, 3 May 2021 14:52:43 GMT""},{""version"":""v3"",""created"":""Thu, 24 Jun 2021 12:25:41 GMT""},{""version"":""v4"",""created"":""Tue, 29 Jun 2021 16:22:47 GMT""},{""version"":""v5"",""created"":""Fri, 3 Dec 2021 21:16:46 GMT""},{""version"":""v6"",""created"":""Mon, 7 Feb 2022 10:47:07 GMT""},{""version"":""v7"",""created"":""Fri, 22 Jul 2022 14:30:14 GMT""},{""version"":""v8"",""created"":""Mon, 30 Jan 2023 13:51:19 GMT""}]","2023-01-31"
"2104.15091","Sveva Castello","Sveva Castello, St\'ephane Ili\'c, Martin Kunz","An updated dark energy view of inflation","9 pages, 3 figures; updated to match published version","Phys. Rev. D 104, 023522 (2021)","10.1103/PhysRevD.104.023522",,"astro-ph.CO hep-ph","http://arxiv.org/licenses/nonexclusive-distrib/1.0/","  The present epoch of accelerated cosmic expansion is supposed to be driven by
an unknown constituent called dark energy, which in the standard model takes
the form of a cosmological constant, characterized by a constant equation of
state w=-1. An interesting perspective over the role and nature of dark energy
can be achieved by drawing a parallel with a previous epoch of accelerated
expansion, inflation, which we assume to be driven by a single scalar field,
the inflaton. Since the Planck satellite has constrained the value of $n_s$
away from 1, the inflaton cannot be identified with a pure cosmological
constant, as is also suggested by the fact that inflation ended. Thus, it is
interesting to verify whether a hypothetical observer would have been able to
measure the deviation of the w of the inflaton from -1. To do so, we consider a
class of single-field slow-roll inflationary models dubbed HSR{i}, where the
hierarchy of Hubble slow-roll parameters is truncated at the i-th order. The
models are tested through a MCMC analysis based on combinations of the latest
Planck and BICEP2/Keck data sets, and the resulting chains are converted into
sets of allowed evolution histories of w. HSR{1} is excluded observationally
since it would predict that $n_s=1$, in contrast with the recent Planck
constraints, while we find that HSR{2} would prefer w>-1, but is disfavoured by
the addition of the BICEP2/Keck data. The overall best description for the data
is provided by HSR{3}, which yields a 68% upper bound of 1+w<0.0014. Therefore,
if the current era of accelerated expansion happens to have the same equation
of state as inflation during the observable epoch, then current and upcoming
cosmological observations will not be able to detect that w$\neq$-1. This
provides a cautionary tale for drawing conclusions about the nature of dark
energy on the basis of the non-observation of a deviation from w=-1.
","[{""version"":""v1"",""created"":""Fri, 30 Apr 2021 16:18:49 GMT""},{""version"":""v2"",""created"":""Fri, 27 Aug 2021 15:04:56 GMT""}]","2021-08-30"
"2104.15092","Youjiang Xu","Youjiang Xu, Linchao Zhu, Lu Jiang, Yi Yang","Faster Meta Update Strategy for Noise-Robust Deep Learning","Accepted to CVPR 2021",,,,"cs.LG cs.CV","http://arxiv.org/licenses/nonexclusive-distrib/1.0/","  It has been shown that deep neural networks are prone to overfitting on
biased training data. Towards addressing this issue, meta-learning employs a
meta model for correcting the training bias. Despite the promising
performances, super slow training is currently the bottleneck in the meta
learning approaches. In this paper, we introduce a novel Faster Meta Update
Strategy (FaMUS) to replace the most expensive step in the meta gradient
computation with a faster layer-wise approximation. We empirically find that
FaMUS yields not only a reasonably accurate but also a low-variance
approximation of the meta gradient. We conduct extensive experiments to verify
the proposed method on two tasks. We show our method is able to save two-thirds
of the training time while still maintaining the comparable or achieving even
better generalization performance. In particular, our method achieves the
state-of-the-art performance on both synthetic and realistic noisy labels, and
obtains promising performance on long-tailed recognition on standard
benchmarks.
","[{""version"":""v1"",""created"":""Fri, 30 Apr 2021 16:19:07 GMT""}]","2021-05-03"
"2104.15093","Sudip Sinha","Debabrata Mondal, Sudip Sinha, and Subhasis Sinha","Dynamical route to ergodicity and quantum scarring in kicked coupled top",,"Phys. Rev. E 104, 024217 (2021)","10.1103/PhysRevE.104.024217",,"cond-mat.stat-mech cond-mat.quant-gas nlin.CD quant-ph","http://creativecommons.org/licenses/by/4.0/","  Unlike classical system, understanding ergodicity from phase space mixing
remains unclear for interacting quantum systems due to the absence of phase
space trajectories. By considering an interacting spin model known as kicked
coupled top, we elucidate the manifestation of phase space dynamics on local
ergodic behavior of its quantum counterpart and quantum scarring phenomena. A
transition to chaos occurs by increasing the kicking strength, and in the mixed
phase space, the islands of regular motions within the chaotic sea clearly
exhibit deviation from ergodicity, which we quantify from entanglement entropy
and survival probability. Interestingly, the reminiscence of unstable orbits
and fixed points can be identified as scars in quantum states, exhibiting
athermal behavior and violation of Berry's conjecture for ergodic states. We
also discuss the detection of quantum scars by a newly developed method of
'out-of-time-order correlators', which has experimental relevance.
","[{""version"":""v1"",""created"":""Fri, 30 Apr 2021 16:19:26 GMT""}]","2021-09-01"
"2104.15094","Nathaniel Hudson","Nathaniel Hudson, Hana Khamfroush, Daniel E. Lucani","QoS-Aware Placement of Deep Learning Services on the Edge with Multiple
  Service Implementations","Accepted for publication through the 30th International Conference on
  Computer Communications and Networks (ICCCN 2021). This manuscript contains a
  complete proof of a theorem referenced in the ICCCN manuscript",,,,"cs.NI","http://creativecommons.org/licenses/by/4.0/","  Mobile edge computing pushes computationally-intensive services closer to the
user to provide reduced delay due to physical proximity. This has led many to
consider deploying deep learning models on the edge -- commonly known as edge
intelligence (EI). EI services can have many model implementations that provide
different QoS. For instance, one model can perform inference faster than
another (thus reducing latency) while achieving less accuracy when evaluated.
In this paper, we study joint service placement and model scheduling of EI
services with the goal to maximize Quality-of-Servcice (QoS) for end users
where EI services have multiple implementations to serve user requests, each
with varying costs and QoS benefits. We cast the problem as an integer linear
program and prove that it is NP-hard. We then prove the objective is equivalent
to maximizing a monotone increasing, submodular set function and thus can be
solved greedily while maintaining a (1-1/e)-approximation guarantee. We then
propose two greedy algorithms: one that theoretically guarantees this
approximation and another that empirically matches its performance with greater
efficiency. Finally, we thoroughly evaluate the proposed algorithm for making
placement and scheduling decisions in both synthetic and real-world scenarios
against the optimal solution and some baselines. In the real-world case, we
consider real machine learning models using the ImageNet 2012 data-set for
requests. Our numerical experiments empirically show that our more efficient
greedy algorithm is able to approximate the optimal solution with a 0.904
approximation on average, while the next closest baseline achieves a 0.607
approximation on average.
","[{""version"":""v1"",""created"":""Fri, 30 Apr 2021 16:20:27 GMT""}]","2021-05-03"
