"2105.12497","Ali Raza","Ali Raza, Kim Phuc Tran, Ludovic Koehl and Shujun Li","Designing ECG Monitoring Healthcare System with Federated Transfer
  Learning and Explainable AI",,"Knowledge-Based Systems, Volume 236, 5 January 2022,107763","10.1016/j.knosys.2021.107763","j.knosys.2021.107763","cs.LG cs.AI eess.SP","http://arxiv.org/licenses/nonexclusive-distrib/1.0/","  Deep learning play a vital role in classifying different arrhythmias using
the electrocardiography (ECG) data. Nevertheless, training deep learning models
normally requires a large amount of data and it can lead to privacy concerns.
Unfortunately, a large amount of healthcare data cannot be easily collected
from a single silo. Additionally, deep learning models are like black-box, with
no explainability of the predicted results, which is often required in clinical
healthcare. This limits the application of deep learning in real-world health
systems. In this paper, we design a new explainable artificial intelligence
(XAI) based deep learning framework in a federated setting for ECG-based
healthcare applications. The federated setting is used to solve issues such as
data availability and privacy concerns. Furthermore, the proposed framework
setting effectively classifies arrhythmia's using an autoencoder and a
classifier, both based on a convolutional neural network (CNN). Additionally,
we propose an XAI-based module on top of the proposed classifier to explain the
classification results, which help clinical practitioners make quick and
reliable decisions. The proposed framework was trained and tested using the
MIT-BIH Arrhythmia database. The classifier achieved accuracy up to 94% and 98%
for arrhythmia detection using noisy and clean data, respectively, with
five-fold cross-validation.
","[{""version"":""v1"",""created"":""Wed, 26 May 2021 11:59:44 GMT""},{""version"":""v2"",""created"":""Mon, 10 Jan 2022 20:51:24 GMT""}]","2022-01-12"
"2105.12498","Zoran Ognjanovi\'c","Zoran Ognjanovi\'c and Angelina Ili\'c Stepi\'c and Aleksandar
  Perovi\'c","A Probabilistic Temporal Epistemic Logic",,,,,"math.LO","http://creativecommons.org/licenses/by-nc-nd/4.0/","  We introduce an expressive probabilistic temporal epistemic logic PTEL
suitable to reason about uncertain knowledge of a non-rigid set of agents that
can be changed during time. We define semantics for PTEL as Kripke models with
epistemic accessibility relations for agents' knowledge, linear temporal
relations describing possible runs of the system, and probability functions
defined on sets of runs. We give an axiomatization of PTEL and sketch the proof
of strong completeness.
","[{""version"":""v1"",""created"":""Wed, 26 May 2021 12:01:29 GMT""}]","2021-05-27"
"2105.12499","Thomas Williams","Thomas Williams, Robert W. Walsh, Stephane Regnier, Craig D. Johnston","Multi-Stranded Coronal Loops: Quantifying Strand Number and Heating
  Frequency from Simulated Solar Dynamics Observatory (SDO) Atmospheric Imaging
  Assembly (AIA) Observations",,,"10.1007/s11207-021-01848-8",,"astro-ph.SR","http://arxiv.org/licenses/nonexclusive-distrib/1.0/","  Coronal loops form the basic building blocks of the magnetically closed solar
corona yet much is still to be determined concerning their possible fine-scale
structuring and the rate of heat deposition within them. Using an improved
multi-stranded loop model to better approximate the numerically challenging
transition region, this paper examines synthetic NASA Solar Dynamics
Observatory's (SDO) Atmospheric Imaging Assembly (AIA) emission simulated in
response to a series of prescribed spatially and temporally random, impulsive
and localised heating events across numerous sub-loop elements with a strong
weighting towards the base of the structure; the nanoflare heating scenario.
The total number of strands and nanoflare repetition times are varied
systematically in such a way that the total energy content remains
approximately constant across all the cases analysed. Repeated time lag
detection during an emission time series provides a good approximation for the
nanoflare repetition time for low-frequency heating. Furthermore, using a
combination of AIA 171/193 and 193/211 channel ratios in combination with
spectroscopic determination of the standard deviation of the loop apex
temperature over several hours alongside simulations from the outlined
multi-stranded loop model, it is demonstrated that both the imposed heating
rate and number of strands can be realised.
","[{""version"":""v1"",""created"":""Wed, 26 May 2021 12:02:15 GMT""}]","2021-07-07"
"2105.12500","Noam Hazon","David Zar, Noam Hazon, Amos Azaria","Explaining Ridesharing: Selection of Explanations for Increasing User
  Satisfaction","19 pages, 4 figures",,,,"cs.AI cs.MA","http://creativecommons.org/licenses/by-nc-nd/4.0/","  Transportation services play a crucial part in the development of modern
smart cities. In particular, on-demand ridesharing services, which group
together passengers with similar itineraries, are already operating in several
metropolitan areas. These services can be of significant social and
environmental benefit, by reducing travel costs, road congestion and CO2
emissions.
  Unfortunately, despite their advantages, not many people opt to use these
ridesharing services. We believe that increasing the user satisfaction from the
service will cause more people to utilize it, which, in turn, will improve the
quality of the service, such as the waiting time, cost, travel time, and
service availability. One possible way for increasing user satisfaction is by
providing appropriate explanations comparing the alternative modes of
transportation, such as a private taxi ride and public transportation. For
example, a passenger may be more satisfied from a shared-ride if she is told
that a private taxi ride would have cost her 50% more. Therefore, the problem
is to develop an agent that provides explanations that will increase the user
satisfaction.
  We model our environment as a signaling game and show that a rational agent,
which follows the perfect Bayesian equilibrium, must reveal all of the
information regarding the possible alternatives to the passenger. In addition,
we develop a machine learning based agent that, when given a shared-ride along
with its possible alternatives, selects the explanations that are most likely
to increase user satisfaction. Using feedback from humans we show that our
machine learning based agent outperforms the rational agent and an agent that
randomly chooses explanations, in terms of user satisfaction.
","[{""version"":""v1"",""created"":""Wed, 26 May 2021 12:03:09 GMT""}]","2021-05-27"
"2105.12501","Maximilian Paleschke","Maximilian Paleschke, Cheng-Tien Chiang, Liane Brandt, Niklas Liebing,
  Georg Woltersdorf and Wolf Widdra","Plasmonic Spin-Hall Effect of propagating Surface Plasmon Polaritons in
  Ni$_{80}$Fe$_{20}$ microstructures","13 pages, 5 figures, to be published in New Journal of Physics",,"10.1088/1367-2630/ac1c83",,"physics.optics cond-mat.mes-hall","http://arxiv.org/licenses/nonexclusive-distrib/1.0/","  Photoexcitation and shaping of a propagating surface plasmon polariton (SPP)
on silver and gold microstructures are well established and lead to the
discovery of the plasmonic spin-Hall effect recently. Whereas silver is often
the material of choice due to its exceptional low plasma frequency and weak
damping, similar observations have not been reported for ferromagnetic metals.
In this work, we report on propagating SPPs on Ni$_{80}$Fe$_{20}$
microstructures imaged by photoemission electron microscopy (PEEM) in
combination with a tunable femtosecond laser system at MHz repetition rate.
Circular dichroic (CD) images in threshold PEEM show clear edge-induced SPPs
with sub-micrometer wavelength and propagation length of about 3.5 $\mu$m.
Analysis of the interference patterns as well as the coupling of the optical
spin angular momentum to the observed fringe fields reveal propagation
characteristics exclusive to evanescent waves and the presence of the plasmonic
spin-Hall effect. Our work provides direct evidence that many materials with a
high plasma frequency allow for excitation and observation of propagating SPPs
at the dielectric/metal interface via CD PEEM imaging, enabling
magnetoplasmonic investigation of common ferromagnets on nanometer length and
femtosecond time scales.
","[{""version"":""v1"",""created"":""Wed, 26 May 2021 12:03:19 GMT""},{""version"":""v2"",""created"":""Fri, 4 Jun 2021 13:48:08 GMT""}]","2021-09-22"
"2105.12502","Franz Anders","Franz Anders, Ammie K. Kalan, Hjalmar S. K\""uhl, Mirco Fuchs","Compensating class imbalance for acoustic chimpanzee detection with
  convolutional recurrent neural networks",,,,,"cs.SD eess.AS","http://creativecommons.org/licenses/by-nc-nd/4.0/","  Automatic detection systems are important in passive acoustic monitoring
(PAM) systems, as these record large amounts of audio data which are infeasible
for humans to evaluate manually. In this paper we evaluated methods for
compensating class imbalance for deep-learning based automatic detection of
acoustic chimpanzee calls. The prevalence of chimpanzee calls in natural
habitats is very rare, i.e. databases feature a heavy imbalance between
background and target calls. Such imbalances can have negative effects on
classifier performances. We employed a state-of-the-art detection approach
based on convolutional recurrent neural networks (CRNNs). We extended the
detection pipeline through various stages for compensating class imbalance.
These included (1) spectrogram denoising, (2) alternative loss functions, and
(3) resampling. Our key findings are: (1) spectrogram denoising operations
significantly improved performance for both target classes, (2) standard binary
cross entropy reached the highest performance, and (3) manipulating relative
class imbalance through resampling either decreased or maintained performance
depending on the target class. Finally, we reached detection performances of
33% for drumming and 5% for vocalization, which is a >7 fold increase compared
to previously published results. We conclude that supporting the network to
learn decoupling noise conditions from foreground classes is of primary
importance for increasing performance.
","[{""version"":""v1"",""created"":""Wed, 26 May 2021 12:03:26 GMT""}]","2021-05-27"
"2105.12503","Freddie Illingworth Mr","Freddie Illingworth","A note on induced Tur\'{a}n numbers","2 pages",,,,"math.CO","http://arxiv.org/licenses/nonexclusive-distrib/1.0/","  Loh, Tait, Timmons and Zhou introduced the notion of induced Tur\'{a}n
numbers, defining $\operatorname{ex}(n, \{H, F\text{-ind}\})$ to be the
greatest number of edges in an $n$-vertex graph with no copy of $H$ and no
induced copy of $F$. Their and subsequent work has focussed on $F$ being a
complete bipartite graph. In this short note, we complement this focus by
asymptotically determining the induced Tur\'{a}n number whenever $H$ is not
bipartite and $F$ is not an independent set nor a complete bipartite graph.
","[{""version"":""v1"",""created"":""Wed, 26 May 2021 12:04:55 GMT""}]","2021-05-27"
"2105.12504","Revathi Vijayaraghavan","Ritu Gala, Eshita Shukla, Nidhee Kamble, Revathi Vijayaraghavan,
  Dhiren Patel","Blockchain-Based Approach to Foster Student Engagement on Campus","13 pages, 6 figures","International Conference of Education (CONEDU 2021) May 22~23,
  2021, Zurich, Switzerland. Volume 11, Number 06, pp 53-65","10.5121/csit.2021.110605",,"cs.CY","http://creativecommons.org/licenses/by/4.0/","  On-campus activities like positions of responsibility in campus amenities and
participation in research, benefit the students as well as the university,
while also making students financially self-sufficient to a certain extent.
However, this student participation is stymied by lack of awareness and
motivation. Significant impetus to innovation and student participation can be
provided by incentivization of these activities. In this paper, we propose a
system to create a blockchain-based economy, to incentivize students with
empirical benefits or monetary awards calculated using objective algorithms.
The incentivization algorithms have been designed for three promising use
cases: research work, positions of responsibility in universities, and
crowdfunding. The demonstrated implementation of this system utilises VJTI
Chain, an already established Proof of Authority blockchain in VJTI Mumbai,
India. This creates a circular economy within the university which encourages
students to earn more rewards by reinforcing positive feedback.
","[{""version"":""v1"",""created"":""Wed, 26 May 2021 12:06:07 GMT""}]","2021-05-27"
"2105.12505","Abhaya Seetaram Hegde","Abhaya S. Hegde, K.P. Athulya, Vijay Pathak, Jyrki Piilo, Anil Shaji","Open quantum dynamics with singularities: Master equations and degree of
  non-Markovianity","This is the published version. This paper has 14 pages and 5 figures","Phys. Rev. A 104, 062403 (2021)","10.1103/PhysRevA.104.062403",,"quant-ph","http://arxiv.org/licenses/nonexclusive-distrib/1.0/","  Master equations describing open quantum dynamics are typically first order
differential equations. When such dynamics brings the trajectories in state
space of more than one initial state to the same point at finite instants in
time, the generator of the corresponding master equation becomes singular. The
first-order, time-local, homogeneous master equations then fail to describe the
dynamics beyond the singular point. Retaining time-locality in the master
equation necessitates a reformulation in terms of higher-order differential
equations. We formulate a method to eliminate the divergent behavior of the
generator by using a combination of higher-order derivatives of the generator
with suitable weights and illustrate it with several examples. We also present
a detailed study of the central spin model and we propose the average rate of
information inflow in non-Markovian processes as a quantity that captures a
different aspect of non-Markovian dynamics.
","[{""version"":""v1"",""created"":""Wed, 26 May 2021 12:06:34 GMT""},{""version"":""v2"",""created"":""Thu, 2 Dec 2021 07:41:05 GMT""}]","2021-12-03"
"2105.12506","Esteban Roulet","Esteban Roulet","On the relation between the astrophysical neutrino fluxes and the cosmic
  ray fluxes","matches published version","JCAP08(2021)009","10.1088/1475-7516/2021/08/009",,"astro-ph.HE","http://creativecommons.org/licenses/by-sa/4.0/","  Some generalizations of the relation between high-energy astrophysical
neutrino and cosmic ray fluxes are obtained, taking into account present
results on the cosmic ray spectrum and composition as well as a more realistic
modeling of the Galactic and extragalactic cosmic ray components down to PeV
energies. It is found that the level of neutrino fluxes measured by IceCube can
be consistent with sources that are thin to escaping protons. This could also
make it easier for heavier nuclei to be emitted from the sources without
suffering excessive disintegration processes.
","[{""version"":""v1"",""created"":""Wed, 26 May 2021 12:09:41 GMT""},{""version"":""v2"",""created"":""Thu, 5 Aug 2021 12:06:38 GMT""}]","2021-08-06"
"2105.12507","Anastasios Gounaris","Anna-Valentini Michailidou, Anastasios Gounaris and Konstantinos
  Tsichlas","Cost models for geo-distributed massively parallel streaming analytics",,,,,"cs.DB","http://creativecommons.org/licenses/by/4.0/","  This report is part of the DataflowOpt project on optimization of modern
dataflows and aims to introduce a data quality-aware cost model that covers the
following aspects in combination: (1) heterogeneity in compute nodes, (2)
geo-distribution, (3) massive parallelism, (4) complex DAGs and (5) streaming
applications. Such a cost model can be then leveraged to devise cost-based
optimization solutions that deal with task placement and operator
configuration.
","[{""version"":""v1"",""created"":""Wed, 26 May 2021 12:18:32 GMT""}]","2021-05-27"
"2105.12508","Francesco Croce","Francesco Croce, Matthias Hein","Adversarial Robustness against Multiple and Single $l_p$-Threat Models
  via Quick Fine-Tuning of Robust Classifiers","ICML 2022",,,,"cs.LG cs.CR cs.CV","http://arxiv.org/licenses/nonexclusive-distrib/1.0/","  A major drawback of adversarially robust models, in particular for large
scale datasets like ImageNet, is the extremely long training time compared to
standard ones. Moreover, models should be robust not only to one $l_p$-threat
model but ideally to all of them. In this paper we propose Extreme norm
Adversarial Training (E-AT) for multiple-norm robustness which is based on
geometric properties of $l_p$-balls. E-AT costs up to three times less than
other adversarial training methods for multiple-norm robustness. Using E-AT we
show that for ImageNet a single epoch and for CIFAR-10 three epochs are
sufficient to turn any $l_p$-robust model into a multiple-norm robust model. In
this way we get the first multiple-norm robust model for ImageNet and boost the
state-of-the-art for multiple-norm robustness to more than $51\%$ on CIFAR-10.
Finally, we study the general transfer via fine-tuning of adversarial
robustness between different individual $l_p$-threat models and improve the
previous SOTA $l_1$-robustness on both CIFAR-10 and ImageNet. Extensive
experiments show that our scheme works across datasets and architectures
including vision transformers.
","[{""version"":""v1"",""created"":""Wed, 26 May 2021 12:20:47 GMT""},{""version"":""v2"",""created"":""Sun, 7 Aug 2022 21:58:14 GMT""}]","2022-08-09"
"2105.12509","Christopher Hojny","Gennadiy Averkov, Christopher Hojny, Matthias Schymura","Computational Aspects of Relaxation Complexity: Possibilities and
  Limitations",,,,,"math.OC math.CO","http://arxiv.org/licenses/nonexclusive-distrib/1.0/","  The relaxation complexity $\mathrm{rc}(X)$ of the set of integer points $X$
contained in a polyhedron is the smallest number of facets of any polyhedron
$P$ such that the integer points in $P$ coincide with $X$. It is a useful tool
to investigate the existence of compact linear descriptions of $X$. In this
article, we derive tight and computable upper bounds on
$\mathrm{rc}_{\mathbb{Q}}(X)$, a variant of $\mathrm{rc}(X)$ in which the
polyhedra $P$ are required to be rational, and we show that $\mathrm{rc}(X)$
can be computed in polynomial time if $X$ is 2-dimensional. Further, we
investigate computable lower bounds on $\mathrm{rc}(X)$ with the particular
focus on the existence of a finite set $Y \subseteq \mathbb{Z}^d$ such that
separating $X$ and $Y \setminus X$ allows us to deduce $\mathrm{rc}(X) \geq k$.
In particular, we show for some choices of $X$ that no such finite set $Y$
exists to certify the value of $\mathrm{rc}(X)$, providing a negative answer to
a question by Weltge (2015). We also obtain an explicit formula for
$\mathrm{rc}(X)$ for specific classes of sets $X$ and present the first
practically applicable approach to compute $\mathrm{rc}(X)$ for sets $X$ that
admit a finite certificate.
","[{""version"":""v1"",""created"":""Wed, 26 May 2021 12:22:41 GMT""}]","2021-05-27"
"2105.12510","Yehyun Kwon","Gunwoo Cho, Jimyeong Kim, Seongyeon Kim, Yehyun Kwon and Ihyeok Seo","Quantum revivals and fractality for the Schr\""odinger equation","14pages",,,,"math.AP","http://creativecommons.org/licenses/by/4.0/","  We investigate the behavior of the Schr\""odinger equation under the influence
of potentials, focusing on its relationship to quantum revivals and fractality.
Our findings reveal that the solution displays fractal behavior at irrational
times, while exhibiting regularity similar to the initial data at rational
times. These extend the results of Oskolkov \cite{O} and Rodnianski \cite{R2}
on the free Schr\""odinger evolution to the general case regarding potentials.
","[{""version"":""v1"",""created"":""Wed, 26 May 2021 12:27:53 GMT""},{""version"":""v2"",""created"":""Tue, 14 Sep 2021 01:22:23 GMT""},{""version"":""v3"",""created"":""Wed, 5 Apr 2023 10:38:48 GMT""},{""version"":""v4"",""created"":""Thu, 6 Apr 2023 05:21:34 GMT""}]","2023-04-07"
"2105.12511","Denis Anuprienko","Denis Anuprienko","Comparison of nonlinear solvers within continuation method for
  steady-state variably saturated groundwater flow modeling",,,,,"math.NA cs.NA","http://creativecommons.org/licenses/by/4.0/","  Nonlinearity continuation method, applied to boundary value problems for
steady-state Richards equation, gradually approaches the solution through a
series of intermediate problems. Originally, the Newton method with simple line
search algorithm was used to solve the intermediate problems. In this paper,
other solvers such as Picard and mixed Picard-Newton methods are considered,
combined with slightly modified line search approach. Numerical experiments are
performed with advanced finite volume discretizations on model and real-life
problems.
","[{""version"":""v1"",""created"":""Wed, 26 May 2021 12:28:09 GMT""}]","2021-05-27"
"2105.12512","Ping Li","Jun-Sheng Huang, Ping Li, Xiao-Xiong Ren, Zhi-Xin Guo","Promising Properties of Sub-5 nm Monolayer MoSi2N4 Transistor","22 pages, 6 figures","Physical Review APPLIED 16, 044022 (2021)","10.1103/PhysRevApplied.16.044022",,"cond-mat.mes-hall","http://creativecommons.org/licenses/by/4.0/","  Two-dimensional (2D) semiconductors have attracted tremendous interests as
natural passivation and atomically thin channels that could facilitate
continued transistor scaling. However, air-stable 2D semiconductors with high
performance were quite elusive. Recently, extremely air-stable MoSi2N4
monolayer had been successfully fabricated [Hong et al., Science 369, 670
(2020)]. To further reveal its potential applications in the sub-5 nm MOSFETs,
there is an urgent need to develop integrated circuits. Here we report
first-principles quantum transport simulations on the performance limits of n-
and p-type sub-5 nm monolayer (ML) MoSi2N4 metal-oxide-semiconductor FETs
(MOSFETs). We find that the on-state current in the MoSi2N4 MOSFETs can be
effectively manipulated by the length of gate and underlap (UL), as well as the
doping concentration. Very strikingly, we also find that the n-type devices the
optimized on-state current can reach up to 1390 and 1025 uA/um for the high
performance (HP) and low power (LP) applications, respectively, both of which
satisfy the International Technology Roadmap for Semiconductors (ITRS)
requirements. Whereas, the optimized on-state current can meet the LP
application (348 uA/um) for the p-type devices. Finally, we find that the
MoSi2N4 MOSFETs have ultra-low subthreshold swing and power delay product,
which have potential to realize the high speed and low power consumption
devices. Our results show that MoSi2N4 is an ideal 2D channel material for
future competitive ultrascaled devices.
","[{""version"":""v1"",""created"":""Wed, 26 May 2021 12:29:33 GMT""},{""version"":""v2"",""created"":""Fri, 26 Nov 2021 07:19:17 GMT""}]","2021-11-29"
"2105.12513","No\'emie Ehstand","No\'emie Ehstand, Reik V. Donner, Crist\'obal L\'opez, Emilio
  Hern\'andez-Garc\'ia","Characteristic signatures of Northern Hemisphere blocking events in a
  Lagrangian flow network representation of the atmospheric circulation",,"Chaos 31, 093128 (2021)","10.1063/5.0057409",,"physics.ao-ph nlin.CD physics.flu-dyn","http://creativecommons.org/licenses/by/4.0/","  In the past decades, boreal summers have been characterized by an increasing
number of extreme weather events in the Northern Hemisphere extratropics,
including persistent heat waves, droughts and heavy rainfall events with
significant social, economic and environmental impacts. Many of these events
have been associated with the presence of anomalous large-scale atmospheric
circulation patterns, in particular persistent blocking situations, i.e.,
nearly stationary spatial patterns of air pressure. To contribute to a better
understanding of the emergence and dynamical properties of such situations, we
construct complex networks representing the atmospheric circulation based on
Lagrangian trajectory data of passive tracers advected within the atmospheric
flow. For these Lagrangian flow networks, we study the spatial patterns of
selected node properties prior to, during and after different atmospheric
blocking events in Northern Hemisphere summer. We highlight the specific
network characteristics associated with the sequence of strong blocking
episodes over Europe during summer 2010 as an illustrative example. Our results
demonstrate the ability of the node degree, entropy and harmonic closeness
centrality based on outgoing links to trace important spatio-temporal
characteristics of atmospheric blocking events. In particular, all three
measures capture the effective separation of the stationary pressure cell
forming the blocking high from the normal westerly flow and the deviation of
the main atmospheric currents around it. Our results suggest the utility of
further exploiting the Lagrangian flow network approach to atmospheric
circulation in future targeted diagnostic and prognostic studies.
","[{""version"":""v1"",""created"":""Wed, 26 May 2021 12:32:29 GMT""},{""version"":""v2"",""created"":""Mon, 13 Sep 2021 14:11:47 GMT""}]","2021-09-27"
