"2105.12173","Olugbenga Anubi","Satish Vedula, Mehrzad Mohammadi Bijaieh, Ellis Oti Boateng and
  Olugbenga Moses Anubi","Degradation Aware Predictive Energy Management Strategy for Ship Power
  Systems","5 pages",,,,"math.OC cs.SY eess.SY","http://creativecommons.org/licenses/by-sa/4.0/","  Integration of modern defence weapons into ship power systems poses a
challenge in terms of meeting the high ramp rate requirements of those loads.
It might be demanding for the generators to meet the ramp rates of these loads.
Failure to meet so, might lead to stability issues. This is addressed by
conglomeration of generators and energy storage elements to handle the required
power demand posed by loads. This paper proposes an energy management strategy
based on model predictive control that incorporates the uncertainty in the load
prediction. The proposed controller optimally coordinates the power split
between the generators and energy storage elements to guarantee that the power
demand is met taking into considerations the ramp rate limitations and the load
uncertainty. A low bandwidth model consisting of a single generator and a
single energy storage element is used to validate the results of the proposed
energy management strategy. The results demonstrate the robustness of the
controller under load prediction uncertainty and demonstrate the effect of load
uncertainty on battery capacity loss.
","[{""version"":""v1"",""created"":""Tue, 25 May 2021 19:06:18 GMT""}]","2021-05-27"
"2105.12175","Quanhua Xu","Quanhua Xu","Holomorphic functional calculus and vector-valued Littlewood-Paley-Stein
  theory for semigroups",,,,,"math.FA math.CA math.OA","http://creativecommons.org/licenses/by/4.0/","  We study vector-valued Littlewood-Paley-Stein theory for semigroups of
regular contractions $\{T_t\}_{t>0}$ on $L_p(\Omega)$ for a fixed $1<p<\infty$.
We prove that if a Banach space $X$ is of martingale cotype $q$, then there is
a constant $C$ such that
  $$
  \left\|\left(\int_0^\infty\big\|t\frac{\partial}{\partial t}P_t
(f)\big\|_X^q\,\frac{dt}t\right)^{\frac1q}\right\|_{L_p(\Omega)}\le C\,
\big\|f\big\|_{L_p(\Omega; X)}\,,
  \quad\forall\, f\in L_p(\Omega; X),$$ where $\{P_t\}_{t>0}$ is the Poisson
semigroup subordinated to $\{T_t\}_{t>0}$. Let $\mathsf{L}^P_{c, q, p}(X)$ be
the least constant $C$, and let $\mathsf{M}_{c, q}(X)$ be the martingale cotype
$q$ constant of $X$. We show
  $$\mathsf{L}^{P}_{c,q, p}(X)\lesssim \max\big(p^{\frac1{q}},\, p'\big)
\mathsf{M}_{c,q}(X).$$ Moreover, the order $\max\big(p^{\frac1{q}},\, p'\big)$
is optimal as $p\to1$ and $p\to\infty$. If $X$ is of martingale type $q$, the
reverse inequality holds. If additionally $\{T_t\}_{t>0}$ is analytic on
$L_p(\Omega; X)$, the semigroup $\{P_t\}_{t>0}$ in these results can be
replaced by $\{T_t\}_{t>0}$ itself.
  Our new approach is built on holomorphic functional calculus. Compared with
all the previous, the new one is more powerful in several aspects: a) it
permits us to go much further beyond the setting of symmetric submarkovian
semigroups; b) it yields the optimal orders of growth on $p$ for most of the
relevant constants; c) it gives new insights into the scalar case for which our
orders of the best constants in the classical Littlewood-Paley-Stein
inequalities for symmetric submarkovian semigroups are better than the previous
by Stein.
  In particular, we resolve a problem of Naor and Young on the optimal order of
the best constant in the above inequality when $X$ is of martingale cotype $q$
and $\{P_t\}_{t>0}$ is the classical Poisson and heat semigroups on
$\mathbb{R}^d$.
","[{""version"":""v1"",""created"":""Tue, 25 May 2021 19:06:47 GMT""},{""version"":""v2"",""created"":""Wed, 2 Jun 2021 19:35:09 GMT""}]","2021-06-04"
"2105.12177","Andres Collinucci","Andr\'es Collinucci, Mario De Marco, Andrea Sangiovanni and Roberto
  Valandro","Higgs branches of 5d rank-zero theories from geometry","34 pages",,,,"hep-th","http://arxiv.org/licenses/nonexclusive-distrib/1.0/","  We study the Higgs branches of five-dimensional N=1 rank-zero theories
obtained from M-theory on two classes non-toric non-compact Calabi-Yau
threefolds: Reid's pagodas, and Laufer's examples. Our approach consists in
reducing to IIA with D6-branes and O6-planes, and computing the open-string
spectra giving rise to hypermultiplets. Starting with the seven-dimensional
worldvolume theories, we switch on T-brane backgrounds to give rise to bound
states with angles. We observe that the resulting partially Higgsed 5d theories
have discrete gauge groups, from which we readily deduce the geometry of the
Higgs branches as orbifolds of quaternionic varieties.
","[{""version"":""v1"",""created"":""Tue, 25 May 2021 19:08:04 GMT""}]","2021-05-27"
"2105.12178","Evgenii Vashukevich","E.A. Vashukevich, T.Yu. Golubeva, Yu.M. Golubev","High-fidelity quantum gates for OAM qudits on quantum memory",,,"10.1088/1612-202X/ac45b2",,"quant-ph","http://creativecommons.org/licenses/by/4.0/","  The application of high-dimensional quantum systems (qudits) in quantum
computing and communications seems to be a promising avenue due to the
possibility of increasing the amount of information encoded in one physical
carrier. In this work, we propose a method for implementing single-qudit gates
for qudits based on light modes with orbital angular momentum. Method for
logical qudits encoding, which ensures the quasi-cyclicity of operations, is
introduced. Based on the protocol for converting the orbital angular momentum
of light in the Raman quantum memory scheme [Vashukevich E.A. et. al. PRA, 101,
033830 (2020)], we show that the considered gates provide an extremely high
level of fidelity of single-qudit transformations. We also compare quantum
gates' properties for systems of different dimensions and find the optimal
conditions for carrying out transformations in the protocol under
consideration.
","[{""version"":""v1"",""created"":""Tue, 25 May 2021 19:13:27 GMT""}]","2022-01-26"
"2105.12179","Pawel Kurzynski","Andrzej Grudka, Pawel Kurzynski, Antoni Wojcik","On Quantum Semipermeable Barriers: Investigating Maxwell's Demon Toolbox","11 pages, 3 figures, comments welcome",,"10.1103/PhysRevE.104.064114",,"quant-ph","http://arxiv.org/licenses/nonexclusive-distrib/1.0/","  We study quantum Maxwell's demon in a discrete space-time setup. We consider
a collection of particles hopping on a one-dimensional chain and a
semipermeable barrier that allows the particles to hop in only one direction.
Our main result is a formulation of a local unitary dynamics describing the
action of this barrier. Such dynamics utilises an auxiliary system
$\mathcal{A}$ and we study how properties of $\mathcal{A}$ influence the
behaviour of particles. An immediate consequence of unitarity is the fact that
particles cannot be trapped on one side of the barrier forever, unless
$\mathcal{A}$ is infinite. In addition, coherent superpositions and quantum
correlations are affected once particles enter the confinement region. Finally,
we show that initial superposition of $\mathcal{A}$ allows the barrier to act
as a beam splitter.
","[{""version"":""v1"",""created"":""Tue, 25 May 2021 19:14:05 GMT""}]","2021-12-22"
"2105.12180","Caroline Martin","Caroline Martin, Brian Leahy, Vinothan Manoharan","Improving holographic particle characterization by modeling spherical
  aberration",,,,,"physics.optics","http://arxiv.org/licenses/nonexclusive-distrib/1.0/","  Holographic microscopy combined with forward modeling and inference allows
colloidal particles to be characterized and tracked in three dimensions with
high precision. However, current models ignore the effects of optical
aberrations on hologram formation. We investigate the effects of spherical
aberration on the structure of single-particle holograms and on the accuracy of
particle characterization. We find that in a typical experimental setup,
spherical aberration can result in systematic shifts of about 2% in the
inferred refractive index and radius. We show that fitting with a model that
accounts for spherical aberration decreases this aberration-dependent error by
a factor of two or more, even when the level of spherical aberration in the
optical train is unknown. With the new generative model, the inferred
parameters are consistent across different levels of aberration, making
particle characterization more robust.
","[{""version"":""v1"",""created"":""Tue, 25 May 2021 19:20:30 GMT""}]","2021-05-27"
"2105.12181","Leonid Korneev","Leonid A. Korneev, Dmitri E. Kharzeev, Alexander G. Abanov","Chiral propulsion: the method of effective boundary conditions","18 pages, 6 figures",,"10.1063/5.0058581",,"physics.flu-dyn nucl-th","http://creativecommons.org/licenses/by/4.0/","  We propose to apply an ""effective boundary condition"" method to the problem
of chiral propulsion. For the case of a rotating helix moving through a fluid
at a low Reynolds number, the method amounts to replacing the original helix
(in the limit of small pitch) by a cylinder, but with a special kind of partial
slip boundary conditions replacing the non-slip boundary conditions on the
original helix. These boundary conditions are constructed to reproduce
far-field velocities of the original problem, and are defined by a few
parameters (slipping lengths) that can be extracted from a problem in planar
rather than cylindrical geometry. We derive the chiral propulsion coefficients
for spirals, helicoids, helically modulated cylinders, and some of their
generalizations using the introduced method. In the case of spirals, we compare
our results with the ones derived by Lighthill and find a very good agreement.
The proposed method is general and can be applied to any helical shape in the
limit of a small pitch. We have established that for a broad class of helical
surfaces the dependence of the chiral propulsion on the helical angle $\theta$
is universal, $\chi\sim \cos\theta\sin 2\theta$ with the maximal propulsion
achieved at the universal angle $\theta_m = \tan^{-1}(1/\sqrt{2})\approx
35.26^\circ$.
","[{""version"":""v1"",""created"":""Tue, 25 May 2021 19:25:16 GMT""}]","2021-09-01"
"2105.12182","Wei-Kang Tseng","Wei-Kang Tseng, Angela P. Schoellig, Timothy D. Barfoot","Self-Calibration of the Offset Between GPS and Semantic Map Frames for
  Robust Localization","Accepted for publication in CRV 2021; corrected reference 4",,,,"cs.RO","http://arxiv.org/licenses/nonexclusive-distrib/1.0/","  In self-driving, standalone GPS is generally considered to have insufficient
positioning accuracy to stay in lane. Instead, many turn to LIDAR localization,
but this comes at the expense of building LIDAR maps that can be costly to
maintain. Another possibility is to use semantic cues such as lane lines and
traffic lights to achieve localization, but these are usually not continuously
visible. This issue can be remedied by combining semantic cues with GPS to fill
in the gaps. However, due to elapsed time between mapping and localization, the
live GPS frame can be offset from the semantic map frame, requiring
calibration. In this paper, we propose a robust semantic localization algorithm
that self-calibrates for the offset between the live GPS and semantic map
frames by exploiting common semantic cues, including traffic lights and lane
markings. We formulate the problem using a modified Iterated Extended Kalman
Filter, which incorporates GPS and camera images for semantic cue detection via
Convolutional Neural Networks. Experimental results show that our proposed
algorithm achieves decimetre-level accuracy comparable to typical LIDAR
localization performance and is robust against sparse semantic features and
frequent GPS dropouts.
","[{""version"":""v1"",""created"":""Tue, 25 May 2021 19:26:51 GMT""},{""version"":""v2"",""created"":""Wed, 30 Jun 2021 22:40:54 GMT""}]","2021-07-02"
"2105.12183","Finn Buldt","Pascal Bass\`ene, Finn Buldt, Nazifa Rumman, Tianhong Wang, Phillip
  Heitert, and Moussa N'Gom","Nonlinear Conversion of Orbital Angular Momentum States of Light","8 pages, 7 figures, submitted to Optics Express",,,,"physics.optics","http://creativecommons.org/licenses/by/4.0/","  We investigate the second harmonic generation of light field carrying orbital
angular momentum in bulk $\chi^{(2)}$ material. We show that due to
conservation of energy and momentum, the frequency doubled beam light has a
modified spatial distribution and mode characteristics. Through rigorous phase
matching conditions, we demonstrate efficient mode and frequency conversion
based on three wave nonlinear optical mixing.
","[{""version"":""v1"",""created"":""Tue, 25 May 2021 19:30:45 GMT""}]","2021-05-27"
"2105.12184","Jan Hubi\v{c}ka","Martin Balko, David Chodounsk\'y, Jan Hubi\v{c}ka, Mat\v{e}j
  Kone\v{c}n\'y, Jaroslav Ne\v{s}et\v{r}il, and Llu\'is Vena","Big Ramsey degrees and forbidden cycles","6 pages, extended abstract accepted to EUROCOMB 2021",,,,"math.CO cs.DM math.LO","http://arxiv.org/licenses/nonexclusive-distrib/1.0/","  Using the Carlson-Simpson theorem, we give a new general condition for a
structure in a finite binary relational language to have finite big Ramsey
degrees
","[{""version"":""v1"",""created"":""Tue, 25 May 2021 19:37:53 GMT""}]","2021-05-27"
"2105.12185","Deacon Linkhorn","Deacon Linkhorn","The Pseudofinite Monadic Second Order Theory of Linear Order",,,,,"math.LO cs.FL cs.LO","http://arxiv.org/licenses/nonexclusive-distrib/1.0/","  Monadic second order logic is the expansion of first order logic by
quantifiers ranging over unary relations. We study the shared monadic second
order theory of finite linear orders, i.e. the pseudofinite monadic second
order theory of linear order, using a first order setup . We give explicit (and
recursive) axioms and characterise the completions in terms of residue
sequences. A connection with profinite algebra, in particular with the free
profinite monoid on one generator, is established via extended Stone duality.
","[{""version"":""v1"",""created"":""Tue, 25 May 2021 19:39:18 GMT""}]","2021-05-27"
"2105.12186","Chenran Zhang","Zhongzhen Luo, Fengjia Zhang, Guoyi Fu, Jiajie Xu","Self-Guided Instance-Aware Network for Depth Completion and Enhancement","Accepted by ICRA 2021",,,,"cs.CV cs.RO","http://creativecommons.org/licenses/by/4.0/","  Depth completion aims at inferring a dense depth image from sparse depth
measurement since glossy, transparent or distant surface cannot be scanned
properly by the sensor. Most of existing methods directly interpolate the
missing depth measurements based on pixel-wise image content and the
corresponding neighboring depth values. Consequently, this leads to blurred
boundaries or inaccurate structure of object. To address these problems, we
propose a novel self-guided instance-aware network (SG-IANet) that: (1) utilize
self-guided mechanism to extract instance-level features that is needed for
depth restoration, (2) exploit the geometric and context information into
network learning to conform to the underlying constraints for edge clarity and
structure consistency, (3) regularize the depth estimation and mitigate the
impact of noise by instance-aware learning, and (4) train with synthetic data
only by domain randomization to bridge the reality gap. Extensive experiments
on synthetic and real world dataset demonstrate that our proposed method
outperforms previous works. Further ablation studies give more insights into
the proposed method and demonstrate the generalization capability of our model.
","[{""version"":""v1"",""created"":""Tue, 25 May 2021 19:41:38 GMT""},{""version"":""v2"",""created"":""Thu, 27 May 2021 19:25:16 GMT""}]","2021-05-31"
"2105.12187","Theodore J. Allen","Theodore J. Allen","Spin in Schr\""odinger-quantized Pseudoclassical Systems","7 pages. Published version","J. Math. Phys. 62, 102101 (2021)","10.1063/5.0058176",,"quant-ph hep-th","http://arxiv.org/licenses/nonexclusive-distrib/1.0/","  We examine the construction of the spin angular momentum in systems with
pseudoclassical Grassmann variables. In constrained systems there are many
different algebraic forms for the dynamical variables that will all agree on
the constraint surface. For the angular momentum, a particular form of the
generators is preferred, which yields superselection sectors of irreducible
spin^c(n) representations rather than reducible so(n) representations when
quantized in the Schr\""odinger realization.
","[{""version"":""v1"",""created"":""Tue, 25 May 2021 19:47:16 GMT""},{""version"":""v2"",""created"":""Thu, 5 Aug 2021 18:50:48 GMT""},{""version"":""v3"",""created"":""Sun, 10 Oct 2021 17:51:39 GMT""}]","2021-10-12"
"2105.12188","Anna Luiza Trindade Falcao","Anna Trindade Falc\~ao, S. B. Kraemer, T. C. Fischer, D. M. Crenshaw,
  M. Revalski, H. R. Schmitt, W. P. Maksym, M. Vestergaard, M. Elvis, C. M.
  Gaskell, F. Hamann, L. C. Ho, J. Hutchings, R. Mushotzky, H. Netzer, T.
  Storchi-Bergmann, T. J. Turner, M. J. Ward","Hubble Space Telescope [O III] Emission-Line Kinematics in Two Nearby
  QSO2s: A Case for X-ray Feedback",,,"10.1093/mnras/stab1549",,"astro-ph.GA","http://arxiv.org/licenses/nonexclusive-distrib/1.0/","  We present a dynamical study of the narrow-line regions in two nearby QSO2s.
We construct dynamical models based on detailed photoionization models of the
emission-line gas, including the effects of internal dust, to apply to
observations of large-scale outflows from these AGNs. We use Mrk 477 and Mrk 34
in order to test our models against recent HST STIS observations of [O III]
emission-line kinematics since these AGNs possess more energetic outflows than
found in Seyfert galaxies. We find that the outflows within 500 pc are
consistent with radiative acceleration of dusty gas, however, the outflows in
Mrk 34 are significantly more extended and may not be directly accelerated by
radiation. We characterize the properties of X-ray winds found from the
expansion of [O III]-emitting gas close to the black hole. We show that such
winds possess the kinetic energy density to disturb [O III] gas at 1.8 kpc, and
have sufficient energy to entrain the [O III] clouds at 1.2 kpc. Assuming that
the X-ray wind possesses the same radial mass distribution as the [O III] gas,
we find that the peak kinetic luminosity for this wind is 2% of Mrk 34's
bolometric luminosity, which is in the 0.5% - 5% range required by some models
for efficient feedback. Our work shows that, although the kinetic luminosity as
measured from [O III]-emitting gas is frequently low, X-ray winds may provide
more than one order of magnitude higher kinetic power.
","[{""version"":""v1"",""created"":""Tue, 25 May 2021 19:48:31 GMT""}]","2021-07-07"
"2105.12189","Michael Lutter","Michael Lutter and Shie Mannor and Jan Peters and Dieter Fox and
  Animesh Garg","Robust Value Iteration for Continuous Control Tasks","Accepted Paper at Robotics: Science and Systems",,,,"cs.LG cs.RO cs.SY eess.SY","http://arxiv.org/licenses/nonexclusive-distrib/1.0/","  When transferring a control policy from simulation to a physical system, the
policy needs to be robust to variations in the dynamics to perform well.
Commonly, the optimal policy overfits to the approximate model and the
corresponding state-distribution, often resulting in failure to trasnfer
underlying distributional shifts. In this paper, we present Robust Fitted Value
Iteration, which uses dynamic programming to compute the optimal value function
on the compact state domain and incorporates adversarial perturbations of the
system dynamics. The adversarial perturbations encourage a optimal policy that
is robust to changes in the dynamics. Utilizing the continuous-time perspective
of reinforcement learning, we derive the optimal perturbations for the states,
actions, observations and model parameters in closed-form. Notably, the
resulting algorithm does not require discretization of states or actions.
Therefore, the optimal adversarial perturbations can be efficiently
incorporated in the min-max value function update. We apply the resulting
algorithm to the physical Furuta pendulum and cartpole. By changing the masses
of the systems we evaluate the quantitative and qualitative performance across
different model parameters. We show that robust value iteration is more robust
compared to deep reinforcement learning algorithm and the non-robust version of
the algorithm. Videos of the experiments are shown at
https://sites.google.com/view/rfvi
","[{""version"":""v1"",""created"":""Tue, 25 May 2021 19:48:35 GMT""}]","2021-05-27"
"2105.12190","Lukasz Golab","Mohammad S. Parsa, Lukasz Golab, Srinivasan Keshav","Climate Action During COVID-19 Recovery and Beyond: A Twitter Text
  Mining Study",,,,,"cs.SI cs.IR","http://creativecommons.org/licenses/by-nc-nd/4.0/","  The Coronavirus pandemic created a global crisis that prompted immediate
large-scale action, including economic shutdowns and mobility restrictions.
These actions have had devastating effects on the economy, but some positive
effects on the environment. As the world recovers from the pandemic, we ask the
following question: What is the public attitude towards climate action during
COVID-19 recovery and beyond? We answer this question by analyzing discussions
on the Twitter social media platform. We find that most discussions support
climate action and point out lessons learned during pandemic response that can
shape future climate policy, although skeptics continue to have a presence.
Additionally, concerns arise in the context of climate action during the
pandemic, such as mitigating the risk of COVID-19 transmission on public
transit.
","[{""version"":""v1"",""created"":""Tue, 25 May 2021 19:57:41 GMT""}]","2021-05-27"
"2105.12191","Isak Wold","Isak G. B. Wold, Sangeeta Malhotra, James Rhoads, Junxian Wang, Weida
  Hu, Lucia A. Perez, Zhen-Ya Zheng, Ali Ahmad Khostovan, Alistair R. Walker,
  L. Felipe Barrientos, Jorge Gonz\'alez-L\'opez, Santosh Harish, Leopoldo
  Infante, Chunyan Jiang, John Pharo, Crist\'obal Moya-Sierralta, Franz E.
  Bauer, Gaspar Galaz, Francisco Valdes, Huan Yang","LAGER Ly$\alpha$ Luminosity Function at $z\sim7$, Implications for
  Reionization","19 pages, 11 figures; accepted by ApJ",,"10.3847/1538-4357/ac4997",,"astro-ph.GA","http://creativecommons.org/licenses/by/4.0/","  We present a new measurement of the Ly$\alpha$ luminosity function at
redshift $z=6.9$, finding moderate evolution from $z=5.7$ that is consistent
with a fully or largely ionized $z\sim7$ intergalactic medium. Our result is
based on four fields of the LAGER (Lyman Alpha Galaxies in the Epoch of
Reionization) project. Our survey volume of $6.1\times10^{6}$ Mpc$^{3}$ is
double that of the next largest $z\sim 7$ survey. We combine two new LAGER
fields (WIDE12 and GAMA15A) with two previously reported LAGER fields (COSMOS
and CDFS). In the new fields, we identify $N=95$ new $z=6.9$ Ly$\alpha$
emitters (LAEs); characterize our survey's completeness and reliability; and
compute Ly$\alpha$ luminosity functions. The best-fit Schechter luminosity
function parameters for all four LAGER fields are in good general agreement.
Two fields (COSMOS and WIDE12) show evidence for a bright-end excess above the
Schechter function fit. We find that the Ly$\alpha$ luminosity density declines
at the same rate as the UV continuum LF from $z=5.7$ to $z=6.9$. This is
consistent with an intergalactic medium that was fully ionized as early as
redshift $z\sim 7$, or with a volume-averaged neutral hydrogen fraction of
$x_{HI} < 0.33$ at $1\sigma$.
","[{""version"":""v1"",""created"":""Tue, 25 May 2021 20:00:57 GMT""},{""version"":""v2"",""created"":""Thu, 20 Jan 2022 20:09:58 GMT""}]","2022-03-14"
"2105.12192","Lee Burke","Lee Burke, Karl Pazdernik, Daniel Fortin, Benjamin Wilson, Rustam
  Goychayev, and John Mattingly","NukeLM: Pre-Trained and Fine-Tuned Language Models for the Nuclear and
  Energy Domains","11 pages, 2 figures",,,,"cs.CL","http://arxiv.org/licenses/nonexclusive-distrib/1.0/","  Natural language processing (NLP) tasks (text classification, named entity
recognition, etc.) have seen revolutionary improvements over the last few
years. This is due to language models such as BERT that achieve deep knowledge
transfer by using a large pre-trained model, then fine-tuning the model on
specific tasks. The BERT architecture has shown even better performance on
domain-specific tasks when the model is pre-trained using domain-relevant
texts. Inspired by these recent advancements, we have developed NukeLM, a
nuclear-domain language model pre-trained on 1.5 million abstracts from the
U.S. Department of Energy Office of Scientific and Technical Information (OSTI)
database. This NukeLM model is then fine-tuned for the classification of
research articles into either binary classes (related to the nuclear fuel cycle
[NFC] or not) or multiple categories related to the subject of the article. We
show that continued pre-training of a BERT-style architecture prior to
fine-tuning yields greater performance on both article classification tasks.
This information is critical for properly triaging manuscripts, a necessary
task for better understanding citation networks that publish in the nuclear
space, and for uncovering new areas of research in the nuclear (or
nuclear-relevant) domains.
","[{""version"":""v1"",""created"":""Tue, 25 May 2021 20:00:59 GMT""}]","2021-05-27"
