"2105.12326","Sebastian Junges","Steven Holtzen, Sebastian Junges, Marcell Vazquez-Chanlatte, Todd
  Millstein, Sanjit A. Seshia, Guy Van Den Broeck","Model Checking Finite-Horizon Markov Chains with Probabilistic Inference","Technical Report. Accepted at CAV 2021",,,,"cs.LO","http://creativecommons.org/licenses/by/4.0/","  We revisit the symbolic verification of Markov chains with respect to finite
horizon reachability properties. The prevalent approach iteratively computes
step-bounded state reachability probabilities. By contrast, recent advances in
probabilistic inference suggest symbolically representing all horizon-length
paths through the Markov chain. We ask whether this perspective advances the
state-of-the-art in probabilistic model checking. First, we formally describe
both approaches in order to highlight their key differences. Then, using these
insights we develop Rubicon, a tool that transpiles Prism models to the
probabilistic inference tool Dice. Finally, we demonstrate better scalability
compared to probabilistic model checkers on selected benchmarks. All together,
our results suggest that probabilistic inference is a valuable addition to the
probabilistic model checking portfolio -- with Rubicon as a first step towards
integrating both perspectives.
","[{""version"":""v1"",""created"":""Wed, 26 May 2021 04:54:31 GMT""},{""version"":""v2"",""created"":""Wed, 30 Jun 2021 04:23:28 GMT""}]","2021-07-01"
"2105.12327","Anthony Thomas Prof","Anthony W Thomas","Role of Quarks in Nuclear Structure",,"Oxford Encyclopedia of Science July 2020","10.1093/acrefore/9780190871994.013.1","ADP-21-7/T1154","nucl-th","http://arxiv.org/licenses/nonexclusive-distrib/1.0/","  The strong force that binds atomic nuclei is governed by the rules of Quantum
Chromodynamics. Here we consider the suggestion the internal quark structure of
a nucleon will adjust self-consistently to the local mean scalar field in a
nuclear medium and that this may play a profound role in nuclear structure. We
show that one can derive an energy density functional based on this idea, which
successfully describes the properties of atomic nuclei across the periodic
table in terms of a small number of physically motivated parameters. Because
this approach amounts to a new paradigm for nuclear theory, it is vital to find
ways to test it experimentally and we review a number of the most promising
possibilities.
","[{""version"":""v1"",""created"":""Wed, 26 May 2021 04:55:37 GMT""}]","2021-05-27"
"2105.12328","Huale Li","Huale Li, Xuan Wang, Zengyue Guo, Jiajia Zhang, Shuhan Qi","D2CFR: Minimize Counterfactual Regret with Deep Dueling Neural Network",,,,,"cs.AI","http://arxiv.org/licenses/nonexclusive-distrib/1.0/","  Counterfactual Regret Minimization (CFR)} is the popular method for finding
approximate Nash equilibrium in two-player zero-sum games with imperfect
information. CFR solves games by travsersing the full game tree iteratively,
which limits its scalability in larger games. When applying CFR to solve
large-scale games in previously, large-scale games are abstracted into
small-scale games firstly. Secondly, CFR is used to solve the abstract game.
And finally, the solution strategy is mapped back to the original large-scale
game. However, this process requires considerable expert knowledge, and the
accuracy of abstraction is closely related to expert knowledge. In addition,
the abstraction also loses certain information, which will eventually affect
the accuracy of the solution strategy. Towards this problem, a recent method,
\textit{Deep CFR} alleviates the need for abstraction and expert knowledge by
applying deep neural networks directly to CFR in full games. In this paper, we
introduces \textit{Neural Network Counterfactual Regret Minimization (NNCFR)},
an improved variant of \textit{Deep CFR} that has a faster convergence by
constructing a dueling netwok as the value network. Moreover, an evaluation
module is designed by combining the value network and Monte Carlo, which
reduces the approximation error of the value network. In addition, a new loss
function is designed in the procedure of training policy network in the
proposed \textit{NNCFR}, which can be good to make the policy network more
stable. The extensive experimental tests are conducted to show that the
\textit{NNCFR} converges faster and performs more stable than \textit{Deep
CFR}, and outperforms \textit{Deep CFR} with respect to exploitability and
head-to-head performance on test games.
","[{""version"":""v1"",""created"":""Wed, 26 May 2021 04:58:36 GMT""},{""version"":""v2"",""created"":""Mon, 3 Jan 2022 08:43:22 GMT""}]","2022-01-04"
"2105.12329","Kuo Hai","Ming Zheng, Yifan Wang, Kuo Hai","The memristive property of PbS nanowire devices",,,,,"physics.app-ph cond-mat.mtrl-sci","http://creativecommons.org/licenses/by/4.0/","  We synthesized lead sulfide (PbS) nanowires with high crystallinity by
solvothermal method and successfully fabricated devices based on single PbS
nanowires. The devices exhibited memristive property which depends on the
applied voltage and the power density of light. In summary, these results
indicated that PbS nanowires prepared by solvothermal method have potential
applications in the fields of electronics and optoelectronics.
","[{""version"":""v1"",""created"":""Wed, 26 May 2021 05:02:38 GMT""}]","2021-05-27"
"2105.12330","Michael Taylor","Michael A. Taylor and Warwick P. Bowen","A computational tool to characterize particle tracking measurements in
  optical tweezers",,"Journal of Optics 15 085701 (2013)","10.1088/2040-8978/15/8/085701",,"physics.ins-det physics.optics","http://arxiv.org/licenses/nonexclusive-distrib/1.0/","  Here we present a computational tool for optical tweezers which calculates
the particle tracking signal measured with a quadrant detector and the
shot-noise limit to position resolution. The tool is a piece of Matlab code
which functions within the freely available Optical Tweezers Toolbox. It allows
the measurements performed in most optical tweezers experiments to be
theoretically characterized in a fast and easy manner. The code supports
particles with arbitrary size, any optical fields and any combination of
objective and condenser, and performs a full vector calculation of the relevant
fields. Example calculations are presented which show the tracking signals for
different particles, and the shot noise limit to position sensitivity as a
function of the effective condenser NA.
","[{""version"":""v1"",""created"":""Wed, 26 May 2021 05:04:15 GMT""}]","2021-05-27"
"2105.12331","Yogesh Singh","Anzar Ali, Kanika Pasrija, Gyaneshwar Sharma, Sanjeev Kumar, and
  Yogesh Singh","Rare-earth tuned magnetism and magnetocaloric effects in double
  perovskites $R_2$NiMnO$_6$","9 pages, 7 figures, 2 Tables",,"10.1088/1361-648X/ac3e9e",,"cond-mat.str-el cond-mat.mtrl-sci","http://creativecommons.org/licenses/by/4.0/","  We present a comprehensive experimental study of magnetization and
magnetocaloric effect (MCE) in double perovskite (DP) materials $R_2$NiMnO$_6$
with $R =$ Pr, Nd, Sm, Gd, Tb, and Dy. While a paramagnetic to ferromagnetic
transition, with T$_{\rm C}$ in the range $\sim 100 - 200~$K, is a common
feature that can be attributed to the ordering of Mn$^{4+}$ and Ni$^{2+}$
magnetic moments, qualitatively distinct behavior depending on the choice of
$R$ is observed at low temperatures. These low-temperature anomalies in
magnetization are also manifest in the change in magnetic entropy, $-\Delta
S_{M}$, whose sign depends on the choice of $R$. In order to understand these
results, we present theoretical analysis based on mean-field approximation and
Monte Carlo simulations on a minimal spin model. The model correctly captures
the key features of the experimental observations.
","[{""version"":""v1"",""created"":""Wed, 26 May 2021 05:11:14 GMT""}]","2021-12-30"
"2105.12332","Peter Ondruska","Luca Bergamini, Yawei Ye, Oliver Scheel, Long Chen, Chih Hu, Luca Del
  Pero, Blazej Osinski, Hugo Grimmett, Peter Ondruska","SimNet: Learning Reactive Self-driving Simulations from Real-world
  Observations","Published at 2021 International Conference on Robotics and Automation
  (ICRA2021)",,,,"cs.RO cs.CV cs.LG","http://creativecommons.org/licenses/by/4.0/","  In this work, we present a simple end-to-end trainable machine learning
system capable of realistically simulating driving experiences. This can be
used for the verification of self-driving system performance without relying on
expensive and time-consuming road testing. In particular, we frame the
simulation problem as a Markov Process, leveraging deep neural networks to
model both state distribution and transition function. These are trainable
directly from the existing raw observations without the need for any
handcrafting in the form of plant or kinematic models. All that is needed is a
dataset of historical traffic episodes. Our formulation allows the system to
construct never seen scenes that unfold realistically reacting to the
self-driving car's behaviour. We train our system directly from 1,000 hours of
driving logs and measure both realism, reactivity of the simulation as the two
key properties of the simulation. At the same time, we apply the method to
evaluate the performance of a recently proposed state-of-the-art ML planning
system trained from human driving logs. We discover this planning system is
prone to previously unreported causal confusion issues that are difficult to
test by non-reactive simulation. To the best of our knowledge, this is the
first work that directly merges highly realistic data-driven simulations with a
closed-loop evaluation for self-driving vehicles. We make the data, code, and
pre-trained models publicly available to further stimulate simulation
development.
","[{""version"":""v1"",""created"":""Wed, 26 May 2021 05:14:23 GMT""}]","2021-05-27"
"2105.12333","Xiaoping Yuan","Xiaolong He and Jia Shi and Xiaoping Yuan","A note on stability of Eliasson-Kuksin's KAM tori for the nonlinear
  Schr\""{o}dinger equation",,,,,"math.AP math.DS","http://creativecommons.org/licenses/by/4.0/","  Eliasson and Kuksin developed a KAM approach to study the persistence of the
invariant tori for nonlinear Schr\""{o}dinger equation on $\mathbb{T}^{d}$. In
this note, we improve Eliasson and Kuksin's KAM theorem by using Kolmogorov's
iterative scheme and obtain a local normal form for the transformed
Hamiltonian. As a consequence, we are able to derive the time $\delta^{-1}$
stability of the obtained KAM tori.
","[{""version"":""v1"",""created"":""Wed, 26 May 2021 05:21:17 GMT""}]","2021-05-27"
"2105.12334","Ingo Hoffmann","Christoph J. B\""orner, Ingo Hoffmann, Jonas Krettek, Lars M.
  K\""urzinger, Tim Schmitz","On the Return Distributions of a Basket of Cryptocurrencies and
  Subsequent Implications","33 pages, 3 Figures, 11 Tables JEL Classification: C12, C13, C43, E22",,,,"q-fin.RM","http://arxiv.org/licenses/nonexclusive-distrib/1.0/","  This paper evaluates and assesses the risk associated with capital allocation
in cryptocurrencies (CCs). In this regard, we take a basket of 27 CCs and the
CC index EWCI$^-$ into account. After considering a series of statistical tests
we find the stable distribution (SDI) to be the most appropriate to model the
body of CCs returns. However, as we find the SDI to possess less favorable
properties in the tail area for high quantiles, the generalized Pareto
distribution is adapted for a more precise risk assessment. We use a
combination of both distributions to calculate the Value at Risk and the
Conditional Value at Risk, indicating two subgroups of CCs with differing risk
characteristics.
","[{""version"":""v1"",""created"":""Wed, 26 May 2021 05:27:24 GMT""}]","2021-05-27"
"2105.12335","Apostolos Vourdas","A. Vourdas","Multipartite quantum systems: an approach based on Markov matrices and
  the Gini index",,"Journal of Physics A54, 185201 (2021)",,,"quant-ph math-ph math.MP","http://arxiv.org/licenses/nonexclusive-distrib/1.0/","  An expansion of row Markov matrices in terms of matrices related to
permutations with repetitions, is introduced.It generalises the Birkhoff-von
Neumann expansion of doubly stochastic matrices in terms of permutation
matrices (without repetitions).An interpretation of the formalism in terms of
sequences of integers that open random safes described by the Markov matrices,
is presented. Various quantities that describe probabilities and correlations
in this context, are discussed. The Gini index is used to quantify the sparsity
(certainty) of various probability vectors. The formalism is used in the
context of multipartite quantum systems with finite dimensional Hilbert space,
which can be viewed as quantum permutations with repetitions or as quantum
safes. The scalar product of row Markov matrices, the various Gini indices,
etc, are novel probabilistic quantities that describe the statistics of
multipartite quantum systems. Local and global Fourier transforms are used to
define locally dual and also globally dual statistical quantities. The latter
depend on off-diagonal elements that entangle (in general) the various
components of the system. Examples which demonstrate these ideas are also
presented.
","[{""version"":""v1"",""created"":""Wed, 26 May 2021 05:28:42 GMT""}]","2021-05-27"
"2105.12336","Ingo Hoffmann","Christoph J. B\""orner, Ingo Hoffmann, Jonas Krettek, Lars M.
  K\""urzinger, Tim Schmitz","Bitcoin: Like a Satellite or Always Hardcore? A Core-Satellite
  Identification in the Cryptocurrency Market","16 Pages, 2 Figures, 3 Tables, JEL Classification: C14, C46, C55,
  E22, G10",,"10.1057/s41260-022-00267-z",,"q-fin.PM","http://arxiv.org/licenses/nonexclusive-distrib/1.0/","  Cryptocurrencies (CCs) become more interesting for institutional investors'
strategic asset allocation and will be a fixed component of professional
portfolios in future. This asset class differs from established assets
especially in terms of the severe manifestation of statistical parameters. The
question arises whether CCs with similar statistical key figures exist. On this
basis, a core market incorporating CCs with comparable properties enables the
implementation of a tracking error approach. A prerequisite for this is the
segmentation of the CC market into a core and a satellite, the latter
comprising the accumulation of the residual CCs remaining in the complement.
Using a concrete example, we segment the CC market into these components, based
on modern methods from image / pattern recognition.
","[{""version"":""v1"",""created"":""Wed, 26 May 2021 05:36:29 GMT""}]","2022-05-25"
"2105.12337","Peter Ondruska","Long Chen, Lukas Platinsky, Stefanie Speichert, Blazej Osinski, Oliver
  Scheel, Yawei Ye, Hugo Grimmett, Luca del Pero, Peter Ondruska","What data do we need for training an AV motion planner?","Published at 2021 International Conference on Robotics and Automation
  (ICRA2021)",,,,"cs.RO cs.CV cs.LG","http://creativecommons.org/licenses/by/4.0/","  We investigate what grade of sensor data is required for training an
imitation-learning-based AV planner on human expert demonstration.
Machine-learned planners are very hungry for training data, which is usually
collected using vehicles equipped with the same sensors used for autonomous
operation. This is costly and non-scalable. If cheaper sensors could be used
for collection instead, data availability would go up, which is crucial in a
field where data volume requirements are large and availability is small. We
present experiments using up to 1000 hours worth of expert demonstration and
find that training with 10x lower-quality data outperforms 1x AV-grade data in
terms of planner performance. The important implication of this is that cheaper
sensors can indeed be used. This serves to improve data access and democratize
the field of imitation-based motion planning. Alongside this, we perform a
sensitivity analysis of planner performance as a function of perception range,
field-of-view, accuracy, and data volume, and the reason why lower-quality data
still provide good planning results.
","[{""version"":""v1"",""created"":""Wed, 26 May 2021 05:37:12 GMT""}]","2021-05-27"
"2105.12338","Liang Zhang","L. Zhang, D. Altamirano, P. Uttley, F. Garcia, M. Mendez, J. Homan, J.
  F. Steiner, K. Alabarta, D. J. K. Buisson, R. A. Remillard, K. C. Gendreau,
  Z. Arzoumanian, C. Markwardt, T. E. Strohmayer, J. Neilsen and A. Basak","NICER uncovers the transient nature of the type-B quasi-periodic
  oscillation in the black hole candidate MAXI J1348-630","23 pages, 12 figures, accepted for publication in MNRAS",,"10.1093/mnras/stab1553",,"astro-ph.HE","http://arxiv.org/licenses/nonexclusive-distrib/1.0/","  We present a systematic spectral-timing analysis of a fast
appearance/disappearance of a type-B quasi-periodic oscillation (QPO), observed
in four NICER observations of MAXI J1348-630. By comparing the spectra of the
period with and without the type-B QPO, we found that the main difference
appears at energy bands above ~2 keV, suggesting that the QPO emission is
dominated by the hard Comptonised component. During the transition, a change in
the relative contribution of the disk and Comptonised emission was observed.
The disk flux decreased while the Comptonised flux increased from non-QPO to
type-B QPO. However, the total flux did not change too much in the NICER band.
Our results reveal that the type-B QPO is associated with a redistribution of
accretion power between the disk and Comptonised emission. When the type-B QPO
appears, more accretion power is dissipated into the Comptonised region than in
the disk. Our spectral fits give a hint that the increased Comptonised emission
may come from an additional component that is related to the base of the jet.
","[{""version"":""v1"",""created"":""Wed, 26 May 2021 05:38:36 GMT""}]","2021-06-30"
"2105.12339","Kanji Nishii","Kanji Nishii, Daisuke Yoshida","String Excitation by Initial Singularity of Inflation","22 pages,3 figures, published version","Journal of High Energy Physics 2021,25 (2021)","10.1007/JHEP10(2021)025","KOBE-COSMO-21-09","hep-th gr-qc","http://arxiv.org/licenses/nonexclusive-distrib/1.0/","  We discuss excitation of string oscillation modes by an initial singularity
of inflation. The initial singularity of inflation is known to occur with a
finite Hubble parameter, which is generally lower than the string scale, and
hence it is not clear that stringy effects become significant around it. With
the help of Penrose limit, we find that infinitely heavy oscillation modes get
excited when a singularity is strong in the sense of Krolak's classification.
We demonstrate that the initial singularities of Starobinsky and hill top
inflation, assuming the slow roll inflation to the past infinity, are strong.
Hence stringy corrections are inevitable in the very early stage of these
inflation models. We also find that the initial singularity of the hill top
inflation could be weak for non-slow roll case.
","[{""version"":""v1"",""created"":""Wed, 26 May 2021 05:56:45 GMT""},{""version"":""v2"",""created"":""Fri, 29 Oct 2021 08:35:25 GMT""}]","2021-11-01"
"2105.12340","Hamidreza Simchi","Seyed Sajad Sadeghi and Hamidreza Simchi","Raman spectra and infrared intensities of graphene-like clusters in
  compared to epitaxial graphene on Si",,,"10.1007/s12648-021-02138-6",,"cond-mat.mes-hall","http://creativecommons.org/licenses/by/4.0/","  There are several growing methods for graphene. In this study, the growth of
graphene-like clusters on the SiC wafers is done by annealing the wafers in a
vacuum evaporation system equipped with a heating source accessory. For
evaluating the quality of the growth method, the Raman spectra and infrared
intensities of graphene-like clusters are studied theoretically and
experimentally. For doing the theoretical study, three types of graphene
clusters are considered and their Raman spectrum and infrared intensities are
found using the Hartree-Fock method. The results show that the geometry of the
cluster, and in consequence the geometry-dependent high (low) non-uniformity of
charge distribution on the cluster surfaces causes the high (low) infrared
intensities. The experimental spectrums are measured and compared with the
theoretical ones. An agreement was seen between the experimental and
theoretical Raman spectrum when the wave number is less than 1700 Cm-1. It is
shown that more accurate temperature control and higher vacuum level of the
chamber are essential for using the physical evaporation method for growing the
single-layer graphene on the SiC substrate.
","[{""version"":""v1"",""created"":""Wed, 26 May 2021 05:58:17 GMT""}]","2021-05-31"
"2105.12341","Ivan Supic","Ivan \v{S}upi\'c, Jean-Daniel Bancal, Yu Cai, Nicolas Brunner","Genuine network quantum nonlocality and self-testing","5 pages, 3 figures, comments are welcome","Phys. Rev. A 105, 022206 (2022)","10.1103/PhysRevA.105.022206",,"quant-ph","http://creativecommons.org/licenses/by/4.0/","  The network structure offers in principle the possibility for novel forms of
quantum nonlocal correlations, that are proper to networks and cannot be traced
back to standard quantum Bell nonlocality. Here we define a notion of genuine
network quantum nonlocality. Our approach is operational and views standard
quantum nonlocality as a resource for producing correlations in networks. We
show several examples of correlations that are genuine network nonlocal,
considering the so-called bilocality network of entanglement swapping. In
particular, we present an example of quantum self-testing which relies on the
network structure; the considered correlations are non-bilocal, but are local
according to the usual definition of Bell locality.
","[{""version"":""v1"",""created"":""Wed, 26 May 2021 06:05:22 GMT""}]","2022-08-24"
"2105.12342","Andrew Lim","Jun-ya Gotoh, Michael Jong Kim, Andrew E.B. Lim","A data-driven approach to beating SAA out-of-sample","20 pages, 2 Figures, 2 page Appendix",,,,"math.OC cs.LG cs.SY econ.EM eess.SY stat.ML","http://creativecommons.org/licenses/by/4.0/","  While solutions of Distributionally Robust Optimization (DRO) problems can
sometimes have a higher out-of-sample expected reward than the Sample Average
Approximation (SAA), there is no guarantee. In this paper, we introduce the
class of Distributionally Optimistic Optimization (DOO) models, and show that
it is always possible to ""beat"" SAA out-of-sample if we consider not just
worst-case (DRO) models but also best-case (DOO) ones. We also show, however,
that this comes at a cost: Optimistic solutions are more sensitive to model
error than either worst-case or SAA optimizers, and hence are less robust.
","[{""version"":""v1"",""created"":""Wed, 26 May 2021 06:10:12 GMT""},{""version"":""v2"",""created"":""Fri, 23 Jul 2021 11:49:24 GMT""}]","2021-07-26"
"2105.12343","Yao Shen","Yao Shen, Chi-Chun Zhou, Wu-sheng Dai and Mi Xie","A group method solving many-body systems in intermediate statistical
  representation","11 pages, 0 figures",,"10.1209/0295-5075/ac29f1",,"quant-ph cond-mat.stat-mech","http://arxiv.org/licenses/nonexclusive-distrib/1.0/","  The exact solution of the interacting many-body system is important and is
difficult to solve. In this paper, we introduce a group method to solve the
interacting many-body problem using the relation between the permutation group
and the unitary group. We prove a group theorem first, then using the theorem,
we represent the Hamiltonian of the interacting many-body system by the Casimir
operators of unitary group. The eigenvalues of Casimir operators could give the
exact values of energy and thus solve those problems exactly. This method maps
the interacting many-body system onto an intermediate statistical
representation. We give the relation between the conjugacy-class operator of
permutation group and the Casimir operator of unitary group in the intermediate
statistical representation, called the Gentile representation. Bose and Fermi
cases are two limitations of the Gentile representation. We also discuss the
representation space of symmetric and unitary group in the Gentile
representation and give an example of the Heisenberg model to demonstrate this
method. It is shown that this method is effective to solve interacting
many-body problems.
","[{""version"":""v1"",""created"":""Wed, 26 May 2021 06:11:22 GMT""}]","2021-11-17"
