"2106.10689","Peng Wang","Peng Wang, Lingjie Liu, Yuan Liu, Christian Theobalt, Taku Komura,
  Wenping Wang","NeuS: Learning Neural Implicit Surfaces by Volume Rendering for
  Multi-view Reconstruction","23 pages",,,,"cs.CV cs.GR","http://creativecommons.org/licenses/by/4.0/","  We present a novel neural surface reconstruction method, called NeuS, for
reconstructing objects and scenes with high fidelity from 2D image inputs.
Existing neural surface reconstruction approaches, such as DVR and IDR, require
foreground mask as supervision, easily get trapped in local minima, and
therefore struggle with the reconstruction of objects with severe
self-occlusion or thin structures. Meanwhile, recent neural methods for novel
view synthesis, such as NeRF and its variants, use volume rendering to produce
a neural scene representation with robustness of optimization, even for highly
complex objects. However, extracting high-quality surfaces from this learned
implicit representation is difficult because there are not sufficient surface
constraints in the representation. In NeuS, we propose to represent a surface
as the zero-level set of a signed distance function (SDF) and develop a new
volume rendering method to train a neural SDF representation. We observe that
the conventional volume rendering method causes inherent geometric errors (i.e.
bias) for surface reconstruction, and therefore propose a new formulation that
is free of bias in the first order of approximation, thus leading to more
accurate surface reconstruction even without the mask supervision. Experiments
on the DTU dataset and the BlendedMVS dataset show that NeuS outperforms the
state-of-the-arts in high-quality surface reconstruction, especially for
objects and scenes with complex structures and self-occlusion.
","[{""version"":""v1"",""created"":""Sun, 20 Jun 2021 12:59:42 GMT""},{""version"":""v2"",""created"":""Thu, 16 Dec 2021 11:19:23 GMT""},{""version"":""v3"",""created"":""Wed, 1 Feb 2023 06:00:21 GMT""}]","2023-02-02"
"2106.10690","Chonfai Kam","Chon-Fai Kam and Yang Chen","Genuine tripartite entanglement as a probe of quantum phase transitions
  in a spin-1 Heisenberg chain with single-ion anisotropy",,,"10.1002/andp.202100342",,"quant-ph cond-mat.other","http://creativecommons.org/licenses/by/4.0/","  We study the quantum phase transitions of spin-1 Heisenberg chains with an
easy-axis anisotropy $\Delta$ and a uniaxial single-ion anisotropy $D$ using a
multipartite entanglement approach. The genuine tripartite entanglement between
the spin blocks, measured by the tripartite qutrit hyperdeterminant, is
calculated within the quantum renormalization group method. Using this
approach, the phase boundaries between the topological Haldane, large-D and
anti-ferromagnetic N\'eel phases are determined in the half $\Delta-D$ plane
with $\Delta>0$. When the size of the spin blocks increases, the genuine
tripartite entanglement between the blocks exhibits a nonzero plateau in the
topological Haldane phase, and experiences abrupt drops at both the phase
boundaries between the Haldane--large-D and Haldane--N\'eel phases, which
justifies the usage of genuine multipartite entanglement as a probe of
topological phases in spin systems.
","[{""version"":""v1"",""created"":""Sun, 20 Jun 2021 13:04:24 GMT""}]","2022-04-20"
"2106.10691","Nicholas  Aidoo","Nicholas Aidoo","On the Catlin multitype of sums of squares domains","40 pages",,,,"math.CV","http://arxiv.org/licenses/nonexclusive-distrib/1.0/","  For a sum of squares domain of finite D'Angelo 1-type at the origin, we show
that the polynomial model obtained from the computation of the Catlin multitype
at the origin of such a domain is likewise a sum of squares domain. We also
prove, under the same finite type assumption, that the multitype is an
invariant of the ideal of holomorphic functions defining the domain. Both
results are proven using Martin Kolar's algorithm for the computation of the
multitype introduced in [13]. Given a sum of squares domain, we rewrite the
Kolar algorithm in terms of ideals of holomorphic functions and also introduce
an approach that explicitly constructs the homogeneous polynomial
transformations used in the algorithm.
","[{""version"":""v1"",""created"":""Sun, 20 Jun 2021 13:08:36 GMT""}]","2021-06-22"
"2106.10692","Toni Mancini","T. Mancini, F. Mari, I. Melatti, I. Salvo, E. Tronci, J.K. Gruber, B.
  Hayes, M. Prodanovic, L. Elmegaard","Parallel Statistical Model Checking for Safety Verification in Smart
  Grids","6 pages, 1 figure. In SmartGridComm 2018. IEEE, 2018",,"10.1109/SmartGridComm.2018.8587416",,"eess.SY cs.DC cs.SY","http://creativecommons.org/licenses/by-nc-nd/4.0/","  By using small computing devices deployed at user premises, Autonomous Demand
Response (ADR) adapts users electricity consumption to given time-dependent
electricity tariffs. This allows end-users to save on their electricity bill
and Distribution System Operators to optimise (through suitable time-dependent
tariffs) management of the electric grid by avoiding demand peaks.
Unfortunately, even with ADR, users power consumption may deviate from the
expected (minimum cost) one, e.g., because ADR devices fail to correctly
forecast energy needs at user premises. As a result, the aggregated power
demand may present undesirable peaks. In this paper we address such a problem
by presenting methods and a software tool (APD-Analyser) implementing them,
enabling Distribution System Operators to effectively verify that a given
time-dependent electricity tariff achieves the desired goals even when
end-users deviate from their expected behaviour. We show feasibility of the
proposed approach through a realistic scenario from a medium voltage Danish
distribution network.
","[{""version"":""v1"",""created"":""Sun, 20 Jun 2021 13:11:10 GMT""}]","2021-06-22"
"2106.10693","Ling Zhang","Ling Zhang, Jack Juang, Zurab Kiguradze, Bo Pu, Shuai Jin, Songping
  Wu, Zhiping Yang, Chulsoon Hwang","Fast PDN Impedance Prediction Using Deep Learning",,,,,"cs.LG cs.AI","http://arxiv.org/licenses/nonexclusive-distrib/1.0/","  Modeling and simulating a power distribution network (PDN) for printed
circuit boards (PCBs) with irregular board shapes and multi-layer stackup is
computationally inefficient using full-wave simulations. This paper presents a
new concept of using deep learning for PDN impedance prediction. A boundary
element method (BEM) is applied to efficiently calculate the impedance for
arbitrary board shape and stackup. Then over one million boards with different
shapes, stackup, IC location, and decap placement are randomly generated to
train a deep neural network (DNN). The trained DNN can predict the impedance
accurately for new board configurations that have not been used for training.
The consumed time using the trained DNN is only 0.1 seconds, which is over 100
times faster than the BEM method and 5000 times faster than full-wave
simulations.
","[{""version"":""v1"",""created"":""Sun, 20 Jun 2021 13:12:43 GMT""}]","2021-06-22"
"2106.10694","Xiaolei Chu","Xiaolei Chu, Hung Nguyen Sinh, Wei Cui, Lin Zhao, Yaojun Ge","Life-cycle assessment for flutter probability of a long-span suspension
  bridge based on field monitoring data",,,,,"stat.CO stat.AP","http://creativecommons.org/licenses/by-nc-nd/4.0/","  Assessment of structural safety status is of paramount importance for
existing bridges, where accurate evaluation of flutter probability is essential
for long-span bridges. In current engineering practice, at the design stage,
flutter critical wind speed is usually estimated by the wind tunnel test, which
is sensitive to modal frequencies and damping ratios. After construction,
structural properties of existing structures will change with time due to
various factors, such as structural deteriorations and periodic environments.
The structural dynamic properties, such as modal frequencies and damping
ratios, cannot be considered as the same values as the initial ones, and the
deteriorations should be included when estimating the life-cycle flutter
probability. This paper proposes an evaluation framework to assess the
life-cycle flutter probability of long-span bridges considering the
deteriorations of structural properties, based on field monitoring data. The
Bayesian approach is employed for modal identification of a suspension bridge
with the main span of 1650 m, and the field monitoring data during 2010-2015 is
analyzed to determine the deterioration functions of modal frequencies and
damping ratios, as well as their inter-seasonal fluctuations. According to the
historical trend, the long-term structural properties can be predicted, and the
probability distributions of flutter critical wind speed for each year in the
long term are calculated. Consequently, the life-cycle flutter probability is
estimated, based on the predicted modal frequencies and damping ratios.
","[{""version"":""v1"",""created"":""Sun, 20 Jun 2021 13:35:00 GMT""}]","2021-06-22"
"2106.10695","Haruki Watanabe","Yankang Liu, Yohei Fuji, Haruki Watanabe","Bloch oscillations in the spin-1/2 XXZ chain","8 pages, 7 figures","Phys. Rev. B 104, 205115 (2021)","10.1103/PhysRevB.104.205115",,"cond-mat.str-el cond-mat.mes-hall cond-mat.other cond-mat.stat-mech quant-ph","http://creativecommons.org/licenses/by/4.0/","  Under a perfect periodic potential, the electric current density induced by a
constant electric field may exhibit nontrivial oscillations, so-called Bloch
oscillations, with an amplitude that remains nonzero in the large system size
limit. Such oscillations have been well studied for nearly noninteracting
particles and observed in experiments. In this work, we revisit Bloch
oscillations in strongly interacting systems. By analyzing the spin-1/2 XXZ
chain, which can be mapped to a model of spinless electrons, we demonstrate
that the current density at special values of the anisotropy parameter
$\Delta=-\cos(\pi/p)$ ($p=3,4,5,\cdots$) in the ferromagnetic gapless regime
behaves qualitatively the same as in the noninteracting case ($\Delta=0$) even
in the weak electric field limit. When $\Delta$ deviates from these values, the
amplitude of the oscillation under a weak electric field is suppressed by a
factor of the system size. We estimate the strength of the electric field
required to observe such a behavior using the Landau--Zener formula.
","[{""version"":""v1"",""created"":""Sun, 20 Jun 2021 13:51:38 GMT""}]","2022-01-04"
"2106.10696","Ashkan Esmaeili","Ashkan Esmaeili","Generative Model Adversarial Training for Deep Compressed Sensing",,,,,"eess.IV cs.LG","http://creativecommons.org/licenses/by/4.0/","  Deep compressed sensing assumes the data has sparse representation in a
latent space, i.e., it is intrinsically of low-dimension. The original data is
assumed to be mapped from a low-dimensional space through a
low-to-high-dimensional generator. In this work, we propound how to design such
a low-to-high dimensional deep learning-based generator suiting for compressed
sensing, while satisfying robustness to universal adversarial perturbations in
the latent domain. We also justify why the noise is considered in the latent
space. The work is also buttressed with theoretical analysis on the robustness
of the trained generator to adversarial perturbations. Experiments on
real-world datasets are provided to substantiate the efficacy of the proposed
\emph{generative model adversarial training for deep compressed sensing.}
","[{""version"":""v1"",""created"":""Sun, 20 Jun 2021 13:53:38 GMT""}]","2021-06-22"
"2106.10697","Feng Xiao","Xin Cai, Feng Xiao, Bo Wei","Distributed strategy-updating rules for aggregative games of
  multi-integrator systems with coupled constraints","9 pages, 4 figures",,"10.1016/j.sysconle.2022.105401",,"math.OC cs.SY eess.SY","http://arxiv.org/licenses/nonexclusive-distrib/1.0/","  In this paper, we explore aggregative games over networks of multi-integrator
agents with coupled constraints. To reach the general Nash equilibrium of an
aggregative game, a distributed strategy-updating rule is proposed by a
combination of the coordination of Lagrange multipliers and the estimation of
the aggregator. Each player has only access to partial-decision information and
communicates with his neighbors in a weight-balanced digraph which
characterizes players' preferences as to the values of information received
from neighbors. We first consider networks of double-integrator agents and then
focus on multi-integrator agents. The effectiveness of the proposed
strategy-updating rules is demonstrated by analyzing the convergence of
corresponding dynamical systems via the Lyapunov stability theory, singular
perturbation theory and passive theory. Numerical examples are given to
illustrate our results.
","[{""version"":""v1"",""created"":""Sun, 20 Jun 2021 14:05:49 GMT""}]","2023-02-27"
"2106.10698","Pranesh Kulkarni","Pranesh Kulkarni, Atharva Karwande, Tejas Kolhe, Soham Kamble, Akshay
  Joshi, Medha Wyawahare","Plant Disease Detection Using Image Processing and Machine Learning",,,,,"cs.CV cs.AI cs.LG","http://creativecommons.org/licenses/by-nc-nd/4.0/","  One of the important and tedious task in agricultural practices is the
detection of the disease on crops. It requires huge time as well as skilled
labor. This paper proposes a smart and efficient technique for detection of
crop disease which uses computer vision and machine learning techniques. The
proposed system is able to detect 20 different diseases of 5 common plants with
93% accuracy.
","[{""version"":""v1"",""created"":""Sun, 20 Jun 2021 14:11:24 GMT""},{""version"":""v2"",""created"":""Wed, 8 Sep 2021 16:35:47 GMT""},{""version"":""v3"",""created"":""Mon, 22 Nov 2021 17:31:05 GMT""}]","2021-11-23"
"2106.10699","Eli Glasner","Eli Glasner","A family of distal functions and multipliers for strict ergodicity",,,,,"math.DS","http://creativecommons.org/licenses/by-nc-nd/4.0/","  We give two proofs to an old result of E. Salehi, showing that the Weyl
subalgebra $\mathcal{W}$ of $\ell^\infty(\mathbb{Z})$ is a proper subalgebra of
$\mathcal{D}$, the algebra of distal functions. We also show that the family
$\mathcal{S}^d$ of strictly ergodic functions in $\mathcal{D}$ does not form an
algebra and hence in particular does not coincide with $\mathcal{W}$. We then
use similar constructions to show that a function which is a multiplier for
strict ergodicity, either within $\mathcal{D}$ or in general, is necessarily a
constant. An example of a metric, strictly ergodic, distal flow is constructed
which admits a non-strictly ergodic $2$-fold minimal self-joining. It then
follows that the enveloping group of this flow is not strictly ergodic (as a
$T$-flow). Finally we show that the distal, strictly ergodic Heisenberg
nil-flow is relatively disjoint over its largest equicontinuous factor from
$|\mathcal{W}|$.
","[{""version"":""v1"",""created"":""Sun, 20 Jun 2021 14:15:22 GMT""},{""version"":""v2"",""created"":""Tue, 22 Jun 2021 13:24:43 GMT""},{""version"":""v3"",""created"":""Wed, 30 Jun 2021 07:52:08 GMT""},{""version"":""v4"",""created"":""Sat, 3 Jul 2021 13:12:29 GMT""}]","2021-07-06"
"2106.10700","Diego Amancio","Jorge A. V. Tohalino and Diego R. Amancio","On predicting research grants productivity",,"Journal of Informetrics 16(2), 101260, 2022","10.1016/j.joi.2022.101260",,"cs.DL cs.LG","http://arxiv.org/licenses/nonexclusive-distrib/1.0/","  Understanding the reasons associated with successful proposals is of
paramount importance to improve evaluation processes. In this context, we
analyzed whether bibliometric features are able to predict the success of
research grants. We extracted features aiming at characterizing the academic
history of Brazilian researchers, including research topics, affiliations,
number of publications and visibility. The extracted features were then used to
predict grants productivity via machine learning in three major research areas,
namely Medicine, Dentistry and Veterinary Medicine. We found that research
subject and publication history play a role in predicting productivity. In
addition, institution-based features turned out to be relevant when combined
with other features. While the best results outperformed text-based attributes,
the evaluated features were not highly discriminative. Our findings indicate
that predicting grants success, at least with the considered set of
bibliometric features, is not a trivial task.
","[{""version"":""v1"",""created"":""Sun, 20 Jun 2021 14:21:46 GMT""}]","2022-02-23"
"2106.10701","Zhengrui Huang","Zhengrui Huang","Fusion of Complex Networks-based Global and Local Features for Texture
  Classification","6 pages",,,,"eess.IV","http://arxiv.org/licenses/nonexclusive-distrib/1.0/","  To realize accurate texture classification, this article proposes a complex
networks (CN)-based multi-feature fusion method to recognize texture images.
Specifically, we propose two feature extractors to detect the global and local
features of texture images respectively. To capture the global features, we
first map a texture image as an undirected graph based on pixel location and
intensity, and three feature measurements are designed to further decipher the
image features, which retains the image information as much as possible. Then,
given the original band images (BI) and the generated feature images, we encode
them based on the local binary patterns (LBP). Therefore, the global feature
vector is obtained by concatenating four spatial histograms. To decipher the
local features, we jointly transfer and fine-tune the pre-trained VGGNet-16
model. Next, we fuse and connect the middle outputs of max-pooling layers (MP),
and generate the local feature vector by a global average pooling layer (GAP).
Finally, the global and local feature vectors are concatenated to form the
final feature representation of texture images. Experiment results show that
the proposed method outperforms the state-of-the-art statistical descriptors
and the deep convolutional neural networks (CNN) models.
","[{""version"":""v1"",""created"":""Sun, 20 Jun 2021 14:25:26 GMT""}]","2021-06-22"
"2106.10702","Majid Eghbali","Majid Eghbali","On the equality of de Rham depth and formal grade in characteristic zero","3 pages, any comment is welcome",,,,"math.AC math.AG","http://arxiv.org/licenses/nonexclusive-distrib/1.0/","  Let $Y \subset \mathbb{P}^n_k$ be a non-singular proper closed subset of
projective $n$-space over a field $k$ of characteristic zero and let $I \subset
R=k[x_0, \ldots, x_n]$ be the homogeneous defining ideal of $Y$. We show that
in this case, the de Rham depth of $Y$ is the same as the so-called formal
grade of $I$ in $R$.
","[{""version"":""v1"",""created"":""Sun, 20 Jun 2021 14:31:52 GMT""}]","2021-06-22"
"2106.10703","Ryohei Kobayashi","Ryohei Kobayashi","Lattice construction of exotic invertible topological phases","30 pages, 7 figures, typos corrected, minor revision made in appendix
  A, references added","Phys. Rev. B 105, 035153 (2022)","10.1103/PhysRevB.105.035153",,"cond-mat.str-el hep-th","http://creativecommons.org/licenses/by/4.0/","  In this paper, we provide state sum path integral definitions of exotic
invertible topological phases proposed in the recent paper by Hsin, Ji, and
Jian. The exotic phase has time reversal ($T$) symmetry, and depends on a
choice of the spacetime structure called the Wu structure. The exotic phase
cannot be captured by the classification of any bosonic or fermionic
topological phases, and thus gives a novel class of invertible topological
phases. When the $T$ symmetry defect admits a spin structure, our construction
reduces to a sort of the decorated domain wall construction, in terms of a
bosonic theory with $T$ symmetry defects decorated with a fermionic phase that
depends on a spin structure of the $T$ symmetry defect. By utilizing our path
integral, we propose a lattice construction for the exotic phase that generates
the $\mathbb{Z}_8$ classification of the (3+1)d invertible phase based on the
Wu structure. This generalizes the $\mathbb{Z}_8$ classification of the
$T$-symmetric (1+1)d topological superconductor proposed by Fidkowski and
Kitaev. On oriented spacetime, this (3+1)d invertible phase with a specific
choice of Wu structure reduces to a bosonic Crane-Yetter TQFT which has a
topological ordered state with a semion on its boundary. Moreover, we propose a
subclass of $G$-SPT phases based on the Wu structure labeled by a pair of
cohomological data in generic spacetime dimensions. This generalizes the Gu-Wen
subclass of fermionic SPT phases.
","[{""version"":""v1"",""created"":""Sun, 20 Jun 2021 14:37:48 GMT""},{""version"":""v2"",""created"":""Fri, 2 Jul 2021 04:29:36 GMT""}]","2022-02-04"
"2106.10704","Tiffany Vlaar","Benedict Leimkuhler, Tiffany Vlaar, Timoth\'ee Pouchon and Amos
  Storkey","Better Training using Weight-Constrained Stochastic Dynamics","ICML 2021 camera-ready. arXiv admin note: substantial text overlap
  with arXiv:2006.10114","Proceedings of the 38th International Conference on Machine
  Learning, PMLR 139, 2021",,,"cs.LG stat.ML","http://arxiv.org/licenses/nonexclusive-distrib/1.0/","  We employ constraints to control the parameter space of deep neural networks
throughout training. The use of customized, appropriately designed constraints
can reduce the vanishing/exploding gradients problem, improve smoothness of
classification boundaries, control weight magnitudes and stabilize deep neural
networks, and thus enhance the robustness of training algorithms and the
generalization capabilities of neural networks. We provide a general approach
to efficiently incorporate constraints into a stochastic gradient Langevin
framework, allowing enhanced exploration of the loss landscape. We also present
specific examples of constrained training methods motivated by orthogonality
preservation for weight matrices and explicit weight normalizations.
Discretization schemes are provided both for the overdamped formulation of
Langevin dynamics and the underdamped form, in which momenta further improve
sampling efficiency. These optimization schemes can be used directly, without
needing to adapt neural network architecture design choices or to modify the
objective with regularization terms, and see performance improvements in
classification tasks.
","[{""version"":""v1"",""created"":""Sun, 20 Jun 2021 14:41:06 GMT""}]","2021-06-22"
"2106.10705","Ping Liu","Ping Liu, Yuewei Lin, Yang He, Yunchao Wei, Liangli Zhen, Joey Tianyi
  Zhou, Rick Siow Mong Goh, Jingen Liu","Automated Deepfake Detection",,,,,"cs.CV","http://arxiv.org/licenses/nonexclusive-distrib/1.0/","  In this paper, we propose to utilize Automated Machine Learning to adaptively
search a neural architecture for deepfake detection. This is the first time to
employ automated machine learning for deepfake detection. Based on our explored
search space, our proposed method achieves competitive prediction accuracy
compared to previous methods. To improve the generalizability of our method,
especially when training data and testing data are manipulated by different
methods, we propose a simple yet effective strategy in our network learning
process: making it to estimate potential manipulation regions besides
predicting the real/fake labels. Unlike previous works manually design neural
networks, our method can relieve us from the high labor cost in network
construction. More than that, compared to previous works, our method depends
much less on prior knowledge, e.g., which manipulation method is utilized or
where exactly the fake image is manipulated. Extensive experimental results on
two benchmark datasets demonstrate the effectiveness of our proposed method for
deepfake detection.
","[{""version"":""v1"",""created"":""Sun, 20 Jun 2021 14:48:50 GMT""},{""version"":""v2"",""created"":""Sat, 7 Aug 2021 12:21:21 GMT""},{""version"":""v3"",""created"":""Thu, 12 Aug 2021 13:21:30 GMT""}]","2021-08-13"
"2106.10706","Utsav Sadana","Utsav Sadana, Puduru Viswanadha Reddy, Georges Zaccour","Feedback Nash Equilibria in Differential Games with Impulse Control",,,,,"math.OC cs.SY eess.SY","http://arxiv.org/licenses/nonexclusive-distrib/1.0/","  We study a class of deterministic finite-horizon two-player nonzero-sum
differential games where players are endowed with different kinds of controls.
We assume that Player 1 uses piecewise-continuous controls, while Player 2 uses
impulse controls. For this class of games, we seek to derive conditions for the
existence of feedback Nash equilibrium strategies for the players. More
specifically, we provide a verification theorem for identifying such
equilibrium strategies, using the Hamilton-Jacobi-Bellman (HJB) equations for
Player 1 and the quasi-variational inequalities (QVIs) for Player 2. Further,
we show that the equilibrium number of interventions by Player 2 is upper
bounded. Furthermore, we specialize the obtained results to a scalar two-player
linear-quadratic differential game. In this game, Player 1's objective is to
drive the state variable towards a specific target value, and Player 2 has a
similar objective with a different target value. We provide, for the first
time, an analytical characterization of the feedback Nash equilibrium in a
linear-quadratic differential game with impulse control. We illustrate our
results using numerical experiments.
","[{""version"":""v1"",""created"":""Sun, 20 Jun 2021 14:49:51 GMT""}]","2021-06-22"
