"2106.10621","Dong Li","Dong Li and Ruoming Jin and Jing Gao and Zhi Liu","On Sampling Top-K Recommendation Evaluation",,,"10.1145/3394486.3403262",,"cs.IR stat.AP","http://creativecommons.org/licenses/by-nc-sa/4.0/","  Recently, Rendle has warned that the use of sampling-based top-$k$ metrics
might not suffice. This throws a number of recent studies on deep
learning-based recommendation algorithms, and classic non-deep-learning
algorithms using such a metric, into jeopardy. In this work, we thoroughly
investigate the relationship between the sampling and global top-$K$ Hit-Ratio
(HR, or Recall), originally proposed by Koren[2] and extensively used by
others. By formulating the problem of aligning sampling top-$k$ ($SHR@k$) and
global top-$K$ ($HR@K$) Hit-Ratios through a mapping function $f$, so that
$SHR@k\approx HR@f(k)$, we demonstrate both theoretically and experimentally
that the sampling top-$k$ Hit-Ratio provides an accurate approximation of its
global (exact) counterpart, and can consistently predict the correct winners
(the same as indicate by their corresponding global Hit-Ratios).
","[{""version"":""v1"",""created"":""Sun, 20 Jun 2021 04:48:13 GMT""}]","2021-06-22"
"2106.10622","Prasanna Parthasarathi","Prasanna Parthasarathi, Joelle Pineau, Sarath Chandar","Do Encoder Representations of Generative Dialogue Models Encode
  Sufficient Information about the Task ?","Accepted at SIGDial 2021. arXiv admin note: substantial text overlap
  with arXiv:2008.10427",,,,"cs.CL","http://creativecommons.org/licenses/by/4.0/","  Predicting the next utterance in dialogue is contingent on encoding of users'
input text to generate appropriate and relevant response in data-driven
approaches. Although the semantic and syntactic quality of the language
generated is evaluated, more often than not, the encoded representation of
input is not evaluated. As the representation of the encoder is essential for
predicting the appropriate response, evaluation of encoder representation is a
challenging yet important problem. In this work, we showcase evaluating the
text generated through human or automatic metrics is not sufficient to
appropriately evaluate soundness of the language understanding of dialogue
models and, to that end, propose a set of probe tasks to evaluate encoder
representation of different language encoders commonly used in dialogue models.
From experiments, we observe that some of the probe tasks are easier and some
are harder for even sophisticated model architectures to learn. And, through
experiments we observe that RNN based architectures have lower performance on
automatic metrics on text generation than transformer model but perform better
than the transformer model on the probe tasks indicating that RNNs might
preserve task information better than the Transformers.
","[{""version"":""v1"",""created"":""Sun, 20 Jun 2021 04:52:37 GMT""}]","2021-06-22"
"2106.10623","Xu Li","Xu Li, Wenyao Zhai, Morris Repeta, Hua Cai, Tyler Ross, Kimia Ansari,
  Sam Tiller, Hari Krishna Pothula, Dong Liang, Fan Yang, Yibo Lyu, Songlin
  Shuai, Guangjian Wang, Wen Tong","A Scalable 256-Elements E-Band Phased-Array Transceiver for Broadband
  Communication",,,,,"eess.SP","http://arxiv.org/licenses/nonexclusive-distrib/1.0/","  For E-band wireless communications, a high gain steerable antenna with
sub-arrays is desired to reduce the implementation complexity. This paper
presents an E-band communication link with 256-elements antennas based on
8-elements sub-arrays and four beam-forming chips in silicon germanium (SiGe)
bipolar complementary metal-oxide-semiconductor (BiCMOS), which is packaged on
a 19-layer low temperature co-fired ceramic (LTCC) substrate. After the design
and manufacture of the 256-elements antenna, a fast near-field calibration
method is proposed for calibration, where a single near-field measurement is
required. Then near-field to far-field (NFFF) transform and far-field to
near-field (FFNF) transform are used for the bore-sight calibration. The
comparison with high frequency structure simulator (HFSS) is utilized for the
non-bore-sight calibration. Verified on the 256-elements antenna, the
beam-forming performance measured in the chamber is in good agreement with the
simulations. The communication in the office environment is also realized using
a fifth generation (5G) new radio (NR) system, whose bandwidth is 400 megahertz
(MHz) and waveform format is orthogonal frequency division multiplexing (OFDM)
with 120 kilohertz (kHz) sub-carrier spacing.
","[{""version"":""v1"",""created"":""Sun, 20 Jun 2021 05:02:04 GMT""}]","2021-06-22"
"2106.10624","Zheng Chen","Jingjing Lyu, Yawen Hou, Zheng Chen","Combined tests based on restricted mean time lost for competing risks
  data","26 pages, 3 figures","Statistics in Biopharmaceutical Research, 2021","10.1080/19466315.2021.1994456",,"stat.AP stat.ME","http://arxiv.org/licenses/nonexclusive-distrib/1.0/","  Competing risks data are common in medical studies, and the sub-distribution
hazard (SDH) ratio is considered an appropriate measure. However, because the
limitations of hazard itself are not easy to interpret clinically and because
the SDH ratio is valid only under the proportional SDH assumption, this article
introduced an alternative index under competing risks, named restricted mean
time lost (RMTL). Several test procedures were also constructed based on RMTL.
First, we introduced the definition and estimation of RMTL based on
Aalen-Johansen cumulative incidence functions. Then, we considered several
combined tests based on the SDH and the RMTL difference (RMTLd). The
statistical properties of the methods are evaluated using simulations and are
applied to two examples. The type I errors of combined tests are close to the
nominal level. All combined tests show acceptable power in all situations. In
conclusion, RMTL can meaningfully summarize treatment effects for clinical
decision making, and three combined tests have robust power under various
conditions, which can be considered for statistical inference in real data
analysis.
","[{""version"":""v1"",""created"":""Sun, 20 Jun 2021 05:06:12 GMT""},{""version"":""v2"",""created"":""Sat, 16 Oct 2021 09:01:23 GMT""}]","2021-10-19"
"2106.10625","Zheng Chen","Zijing Yang, Hongji Wu, Yawen Hou, Hao Yuan, Zheng Chen","Dynamic prediction and analysis based on restricted mean survival time
  in survival analysis with nonproportional hazards","25 pages, 5 figures","Computer Methods and Programs in Biomedicine. 2021, 207: 106155","10.1016/j.cmpb.2021.106155","207:106155","stat.AP stat.ME","http://arxiv.org/licenses/nonexclusive-distrib/1.0/","  In the process of clinical diagnosis and treatment, the restricted mean
survival time (RMST), which reflects the life expectancy of patients up to a
specified time, can be used as an appropriate outcome measure. However, the
RMST only calculates the mean survival time of patients within a period of time
after the start of follow-up and may not accurately portray the change in a
patient's life expectancy over time. The life expectancy can be adjusted for
the time the patient has already survived and defined as the conditional
restricted mean survival time (cRMST). A dynamic RMST model based on the cRMST
can be established by incorporating time-dependent covariates and covariates
with time-varying effects. We analysed data from a study of primary biliary
cirrhosis (PBC) to illustrate the use of the dynamic RMST model. The predictive
performance was evaluated using the C-index and the prediction error. The
proposed dynamic RMST model, which can explore the dynamic effects of
prognostic factors on survival time, has better predictive performance than the
RMST model. Three PBC patient examples were used to illustrate how the
predicted cRMST changed at different prediction times during follow-up. The use
of the dynamic RMST model based on the cRMST allows for optimization of
evidence-based decision-making by updating personalized dynamic life expectancy
for patients.
","[{""version"":""v1"",""created"":""Sun, 20 Jun 2021 05:07:29 GMT""}]","2021-06-22"
"2106.10626","Fayyazuddin Fayyazuddin","Fayyazuddin","W exchange contributions in hadronic decays of charmed baryons","8 pages, No Figure",,,,"hep-ph","http://arxiv.org/licenses/nonexclusive-distrib/1.0/","  The nonleptonic decays of $\Xi_c^0$ and $\Lambda_c^+$ that are dominated by
$W$-exchange are studied. In particular, we anlayse the decay modes $\Xi_c^0
\rightarrow \Xi^{*-} \pi^+, \Sigma^{*+}K^-, \Omega^-K^+$ and
$\Lambda_c^+\rightarrow \Sigma^0\pi^+, \Xi^0 K^+$, $\Xi^0_c\rightarrow
\Sigma^+K^-$.
","[{""version"":""v1"",""created"":""Sun, 20 Jun 2021 05:14:21 GMT""}]","2021-06-22"
"2106.10627","Gerald Pao","Gerald M Pao, Cameron Smith, Joseph Park, Keichi Takahashi, Wassapon
  Watanakeesuntorn, Hiroaki Natsukawa, Sreekanth H Chalasani, Tom Lorimer,
  Ryousei Takano, Nuttida Rungratsameetaweemana, George Sugihara","Experimentally testable whole brain manifolds that recapitulate behavior","20 pages, 15 figures; corresponding author: Gerald Pao
  geraldpao@gmail.com",,,,"q-bio.NC math.DS","http://creativecommons.org/licenses/by-nc-sa/4.0/","  We propose an algorithm grounded in dynamical systems theory that generalizes
manifold learning from a global state representation, to a network of local
interacting manifolds termed a Generative Manifold Network (GMN). Manifolds are
discovered using the convergent cross mapping (CCM) causal inference algorithm
which are then compressed into a reduced redundancy network. The representation
is a network of manifolds embedded from observational data where each
orthogonal axis of a local manifold is an embedding of a individually
identifiable neuron or brain area that has exact correspondence in the real
world. As such these can be experimentally manipulated to test hypotheses
derived from theory and data analysis. Here we demonstrate that this
representation preserves the essential features of the brain of flies,larval
zebrafish and humans. In addition to accurate near-term prediction, the GMN
model can be used to synthesize realistic time series of whole brain neuronal
activity and locomotion viewed over the long term. Thus, as a final validation
of how well GMN captures essential dynamic information, we show that the
artificially generated time series can be used as a training set to predict
out-of-sample observed fly locomotion, as well as brain activity in out of
sample withheld data not used in model building. Remarkably, the artificially
generated time series show realistic novel behaviors that do not exist in the
training data, but that do exist in the out-of-sample observational data. This
suggests that GMN captures inherently emergent properties of the network. We
suggest our approach may be a generic recipe for mapping time series
observations of any complex nonlinear network into a model that is able to
generate naturalistic system behaviors that identifies variables that have real
world correspondence and can be experimentally manipulated.
","[{""version"":""v1"",""created"":""Sun, 20 Jun 2021 05:17:05 GMT""}]","2021-06-22"
"2106.10628","C. Q. Geng","C.Q. Geng and Chia-Wei Liu","Searching for possible evidences of new physics in $B\to V_1 V_2$","20 pages, 1 figure, revised version accepted by PLB",,"10.1016/j.physletb.2022.136883",,"hep-ph hep-ex","http://creativecommons.org/licenses/by/4.0/","  We explore the decays of $B\to V_1V_2$ ($V_{1,2}= (\rho, \omega,K^*, \phi)$
and $B= (B^0, B^+,B_s)$) with transverse polarizations. We explicitly evaluate
the eigenstates of T-odd scalar operators involving spins for the first time,
which offer physical insight among the T violating observables. Based on the
helicity suppression of tree operators for transverse polarizations in the
standard model (SM), we deduce that $\Delta \phi _p= \Delta \phi_\parallel -
\Delta \phi_\perp=0$ with $\Delta\phi_{\perp,\parallel}$ the weak phases of the
transverse amplitudes. In contrast, the experiments show that $\Delta \phi _p
(B^0 \to K^{*0} \omega)= -0.84\pm 0.54$, which could be a signal of new
physics. There is also a discrepancy between our result in the SM and the
experimental data for the transverse polarized branching ratio in $B^0 \to
K^{*0} \omega$. In addition, by counting the helicity flips, we argue that
$\sin(\phi_\parallel - \phi_\perp ) \approx 0$, which meets well with most of
the experiments except for the ones with $B^0\to K^{*0}\omega$, where
$\phi_{\parallel,\perp}$ are the strong phases in the transverse amplitudes.
","[{""version"":""v1"",""created"":""Sun, 20 Jun 2021 05:26:30 GMT""},{""version"":""v2"",""created"":""Wed, 5 Jan 2022 06:49:04 GMT""}]","2022-01-12"
"2106.10629","Sota Nakajima","H. Itoyama, Yuichi Koga, Sota Nakajima","Gauge Symmetry Enhancement by Wilson Lines in Twisted Compactification",,,,"NITEP 100, OCU-PHYS 538","hep-th hep-ph","http://arxiv.org/licenses/nonexclusive-distrib/1.0/","  We point out a simple realization of gauge symmetry enhancement by Wilson
lines in QFT with twisted compactification in extra dimensions. We illustrate
this in the field contents taken from heterotic supergravity in arbitrary
dimensions toroidally compactified.
","[{""version"":""v1"",""created"":""Sun, 20 Jun 2021 05:34:15 GMT""}]","2021-06-22"
"2106.10630","Tin Nguyen Khac","Nguyen Khac Tin","On the hit problem for the Steenrod algebra in some generic degrees and
  applications","12 pages. arXiv admin note: text overlap with arXiv:2103.04393",,,,"math.AT","http://creativecommons.org/licenses/by/4.0/","  Let $\mathcal P_{n}:=H^{*}((\mathbb{R}P^{\infty})^{n}) \cong \mathbb
F_2[x_{1},x_{2},\ldots,x_{n}]$ be the polynomial algebra over the prime field
of two elements, $\mathbb F_2.$ We investigate the Peterson hit problem for the
polynomial algebra $\mathcal P_{n},$ viewed as a graded left module over the
mod-$2$ Steenrod algebra, $\mathcal{A}.$ For $n>4,$ this problem is still
unsolved, even in the case of $n=5$ with the help of computers.
  The purpose of this paper is to continue our study of the hit problem by
developing a result in \cite{ph31} for $\mathcal P_n$ in the generic degree
$r(2^s-1)+m.2^s$ where $r=n=5,\ m=13,$ and $s$ is an arbitrary non-negative
integer. Note that for $s=0,$ and $s=1,$ this problem has been studied by Phuc
\cite{ph20ta}, and \cite{ph31}, respectively.
  As an application of these results, we get the dimension result for the
polynomial algebra in the generic degree $d=(n-1).(2^{n+u-1}-1)+\ell.2^{n+u-1}$
where $u$ is an arbitrary non-negative integer, $\ell \in \{23, 67 \},$ and
$n=6.$
  One of the major applications of hit problem is in surveying a homomorphism
introduced by Singer, which is a homomorphism $$Tr_n :\text{Tor}^{\mathcal
A}_{n, n+d} (\mathbb F_2,\mathbb F_2) \longrightarrow
(\mathbb{F}_{2}{\otimes}_{\mathcal{A}}\mathcal P_{n})_d^{GL(n; \mathbb F_2)}$$
from the homology of the Steenrod algebra to the subspace of
$(\mathbb{F}_{2}{\otimes}_{\mathcal{A}}\mathcal P_{n})_d$ consisting of all the
$GL(n; \mathbb F_2)$-invariant classes. It is a useful tool in describing the
homology groups of the Steenrod algebra, $\text{Tor}^{\mathcal A}_{n,
n+d}(\mathbb F_2,\mathbb F_2).$ The behavior of the fifth Singer algebraic
transfer in degree $5(2^s-1)+13.2^s$ was also discussed at the end of this
paper.
","[{""version"":""v1"",""created"":""Sun, 20 Jun 2021 05:41:32 GMT""},{""version"":""v2"",""created"":""Tue, 26 Oct 2021 16:08:16 GMT""},{""version"":""v3"",""created"":""Thu, 18 Nov 2021 11:14:59 GMT""}]","2021-11-19"
"2106.10631","Leonardo Novelli","Leonardo Novelli, Adeel Razi","A mathematical perspective on edge-centric brain functional connectivity",,"Nat Commun 13, 2693 (2022)","10.1038/s41467-022-29775-7",,"q-bio.NC physics.data-an","http://creativecommons.org/licenses/by-nc-nd/4.0/","  Edge time series are increasingly used in brain functional imaging to study
the node functional connectivity (nFC) dynamics at the finest temporal
resolution while avoiding sliding windows. Here, we lay the mathematical
foundations for the edge-centric analysis of neuroimaging time series,
explaining why a few high-amplitude cofluctuations drive the nFC across
datasets. Our exposition also constitutes a critique of the existing
edge-centric studies, showing that their main findings can be derived from the
nFC under a static null hypothesis that disregards temporal correlations.
Testing the analytic predictions on functional MRI data from the Human
Connectome Project confirms that the nFC can explain most variation in the edge
FC matrix, the edge communities, the large cofluctuations, and the
corresponding spatial patterns. We encourage the use of dynamic measures in
future research, which exploit the temporal structure of the edge time series
and cannot be replicated by static null models.
","[{""version"":""v1"",""created"":""Sun, 20 Jun 2021 05:53:12 GMT""},{""version"":""v2"",""created"":""Thu, 14 Jul 2022 11:51:57 GMT""}]","2022-07-15"
"2106.10632","Santu Dey","Sumanjit Sarkar and Santu Dey","$*$-Conformal $\eta$-Ricci soliton within the framework of Kenmotsu
  manifolds",,,,,"math.DG","http://creativecommons.org/licenses/by/4.0/","  The goal of our present paper is to deliberate $*$-conformal $\eta$-Ricci
soliton within the framework of Kenmotsu manifolds. Here we have shown that a
Kenmotsu metric as a $*$-conformal $\eta$-Ricci soliton is Einstein metric if
the soliton vector field is contact. Further, we have evolved the
characterization of the Kenmotsu manifold or the nature of the potential vector
field when the manifold satisfies gradient almost $*$-conformal $\eta$-Ricci
soliton. Next, we have contrived $*$-conformal $\eta$-Ricci soliton admitting
$(\kappa,\mu)^\prime$-almost Kenmotsu manifold and proved that the manifold is
Ricci flat and is locally isometric to
$\mathbb{H}^{n+1}(-4)\times\mathbb{R}^n$. Finally we have constructed some
examples to illustrate the existence of $*$-conformal $\eta$-Ricci soliton,
gradient almost $*$-conformal $\eta$-Ricci soliton on Kenmotsu manifold and
$(\kappa,\mu)^\prime$-almost Kenmotsu manifolds.
","[{""version"":""v1"",""created"":""Sun, 20 Jun 2021 05:57:11 GMT""}]","2021-06-22"
"2106.10633","Michela Carlotta Massi","Michela C. Massi, Francesca Ieva","Learning Signal Representations for EEG Cross-Subject Channel Selection
  and Trial Classification",,,,,"eess.SP cs.LG","http://arxiv.org/licenses/nonexclusive-distrib/1.0/","  EEG technology finds applications in several domains. Currently, most EEG
systems require subjects to wear several electrodes on the scalp to be
effective. However, several channels might include noisy information, redundant
signals, induce longer preparation times and increase computational times of
any automated system for EEG decoding. One way to reduce the signal-to-noise
ratio and improve classification accuracy is to combine channel selection with
feature extraction, but EEG signals are known to present high inter-subject
variability. In this work we introduce a novel algorithm for
subject-independent channel selection of EEG recordings. Considering
multi-channel trial recordings as statistical units and the EEG decoding task
as the class of reference, the algorithm (i) exploits channel-specific
1D-Convolutional Neural Networks (1D-CNNs) as feature extractors in a
supervised fashion to maximize class separability; (ii) it reduces a high
dimensional multi-channel trial representation into a unique trial vector by
concatenating the channels' embeddings and (iii) recovers the complex
inter-channel relationships during channel selection, by exploiting an ensemble
of AutoEncoders (AE) to identify from these vectors the most relevant channels
to perform classification. After training, the algorithm can be exploited by
transferring only the parametrized subgroup of selected channel-specific
1D-CNNs to new signals from new subjects and obtain low-dimensional and highly
informative trial vectors to be fed to any classifier.
","[{""version"":""v1"",""created"":""Sun, 20 Jun 2021 06:22:16 GMT""}]","2021-06-22"
"2106.10634","Chaolei Tan","Chaolei Tan, Zihang Lin, Jian-Fang Hu, Xiang Li, Wei-Shi Zheng","Augmented 2D-TAN: A Two-stage Approach for Human-centric Spatio-Temporal
  Video Grounding","Best Paper Award at the 3rd Person in Context (PIC) Challenge CVPR
  Workshop 2021",,,,"cs.CV","http://arxiv.org/licenses/nonexclusive-distrib/1.0/","  We propose an effective two-stage approach to tackle the problem of
language-based Human-centric Spatio-Temporal Video Grounding (HC-STVG) task. In
the first stage, we propose an Augmented 2D Temporal Adjacent Network
(Augmented 2D-TAN) to temporally ground the target moment corresponding to the
given description. Primarily, we improve the original 2D-TAN from two aspects:
First, a temporal context-aware Bi-LSTM Aggregation Module is developed to
aggregate clip-level representations, replacing the original max-pooling.
Second, we propose to employ Random Concatenation Augmentation (RCA) mechanism
during the training phase. In the second stage, we use pretrained MDETR model
to generate per-frame bounding boxes via language query, and design a set of
hand-crafted rules to select the best matching bounding box outputted by MDETR
for each frame within the grounded moment.
","[{""version"":""v1"",""created"":""Sun, 20 Jun 2021 06:35:40 GMT""},{""version"":""v2"",""created"":""Thu, 5 May 2022 07:32:13 GMT""}]","2022-05-06"
"2106.10635","Yijie Wu","Yijie Wu and Fan Xue","FloorPP-Net: Reconstructing Floor Plans using Point Pillars for
  Scan-to-BIM",,,,,"cs.CV","http://arxiv.org/licenses/nonexclusive-distrib/1.0/","  This paper presents a deep learning-based point cloud processing method named
FloorPP-Net for the task of Scan-to-BIM (building information model).
FloorPP-Net first converts the input point cloud of a building story into point
pillars (PP), then predicts the corners and edges to output the floor plan.
Altogether, FloorPP-Net establishes an end-to-end supervised learning framework
for the Scan-to-Floor-Plan (Scan2FP) task. In the 1st International Scan-to-BIM
Challenge held in conjunction with CVPR 2021, FloorPP-Net was ranked the second
runner-up in the floor plan reconstruction track. Future work includes general
edge proposals, 2D plan regularization, and 3D BIM reconstruction.
","[{""version"":""v1"",""created"":""Sun, 20 Jun 2021 06:45:52 GMT""}]","2021-06-22"
"2106.10636","Boris Klain","A. Yu. Kurazhkovskii, N. A. Kurazhkovskaya, B.I. Klain","Cycles of paleomagnetic activity in the phanerozoic","16 pages, 5 figures",,,,"physics.geo-ph","http://creativecommons.org/licenses/by/4.0/","  Quasi-periodic changes of the paleointensity and geomagnetic polarity in the
intervals of 170 Ma to the present time and of 550 Ma to the present time were
studied, respectively. It is revealed that the spectrum of the basic variations
in the paleointensity and of the duration of the polar intervals is discrete
and includes quasi-periodic oscillations with characteristic times of 15 Ma, 8
Ma, 5 Ma, and 3 Ma. The characteristic time of these quasi-periodic changes of
the geomagnetic field at the beginning and at the end of the Phanerozoic
differed by no more than 10%. The spectral density of quasi-periodic variations
of the geomagnetic field changed cyclically over geological time. The relation
between the behaviors of the amplitude of paleointensity variations, the
duration of the polar intervals, and their spectral density was shown.
Quasi-periodic variations of the paleointensity (geomagnetic activity) had a
relatively high spectral density in the interval of (150 - 40) Ma (in the
Cretaceous - Early Paleogene). In this interval, both the amplitude of
paleointensity variations and the duration of polar intervals increased. In the
intervals of (170 - 150) Ma and of 30 Ma to the present, a quasi-periodic
variation in the paleointensity practically did not detect against the
background of its noise variations. At the same time, the amplitude of the
paleointensity variations and duration of polar intervals decreased. An
alternation of time intervals in which the paleointensity variations acquired
either a quasi-periodic or noise character took place during the geomagnetic
history.
","[{""version"":""v1"",""created"":""Sun, 20 Jun 2021 06:49:56 GMT""}]","2021-06-22"
