"2106.10275","Edelberto Franco Silva","Edelberto Franco Silva and Bruno Jos\'e Dembogurski and Gustavo Silva
  Semaan","A Systematic Review of Computational Thinking in Early Ages","a systematic review submitted to Elsevier",,"10.1080/09669760.2022.2107491",,"cs.HC","http://creativecommons.org/licenses/by/4.0/","  Nowadays, technology has become dominant in the daily lives of most people
around the world. From children to older people, technology is present, helping
in the most diverse daily tasks and allowing accessibility. However, many times
these people are just end-users, without any incentive to the development of
computational thinking (CT). With advances in technologies, the abstraction of
coding, programming languages, and the hardware resources involved will become
a reality. However, while we have not progressed to this stage, it is necessary
to encourage the development of CT teaching from an early age. This work will
present state of the art concerning teaching initiatives and tools on
programming (e.g., ScratchJr), robotics (e.g., KIBO), and other playful tools
(e.g., Happy Maps) for the development of CT in the early ages, specifically
filling the gap of CT at the kindergarten level. This survey presents a
systematic review of the literature, emphasizing computational and robotic
tools used in preschool classes to develop the CT. The systematic review
evaluated more than 60 papers from 2010 to December 2020, electing 31 papers
and adding three papers from the qualitative stage. The paper's amount was
classified in taxonomy to show CT's principal tools and initiates applied to
children early. To conclude this survey, an extensive discussion about the
terms and authors related to this research area is present.
","[{""version"":""v1"",""created"":""Sat, 19 Jun 2021 19:00:10 GMT""}]","2022-08-09"
"2106.10525","Maike Santos","M. A. F. dos Santos, E. H. Colombo and C. Anteneodo","Random diffusivity scenarios behind anomalous non-Gaussian diffusion","20 pages, 3 figures",,"10.1016/j.chaos.2021.111422",,"cond-mat.stat-mech math-ph math.MP math.PR","http://creativecommons.org/licenses/by/4.0/","  The standard diffusive spreading, characterized by a Gaussian distribution
with mean square displacement that grows linearly with time, can break down,
for instance, under the presence of correlations and heterogeneity. In this
work, we consider the spread of a population of fractional (long-time
correlated) Brownian walkers, with time-dependent and heterogeneous
diffusivity. We aim to obtain the possible scenarios related to these
individual-level features from the observation of the temporal evolution of the
population spatial distribution. We develop and discuss the possibility and
limitations of this connection for the broad class of self-similar diffusion
processes. Our results are presented in terms of a general framework, which is
then used to address well-known processes, such as Laplace diffusion, nonlinear
diffusion, and their extensions.
","[{""version"":""v1"",""created"":""Sat, 19 Jun 2021 16:11:35 GMT""},{""version"":""v2"",""created"":""Sun, 5 Sep 2021 17:34:44 GMT""}]","2021-10-27"
"2106.10526","Zhan Gao","Zhan Gao, Elvin Isufi and Alejandro Ribeiro","Stability of Graph Convolutional Neural Networks to Stochastic
  Perturbations",,,,,"cs.LG eess.SP","http://arxiv.org/licenses/nonexclusive-distrib/1.0/","  Graph convolutional neural networks (GCNNs) are nonlinear processing tools to
learn representations from network data. A key property of GCNNs is their
stability to graph perturbations. Current analysis considers deterministic
perturbations but fails to provide relevant insights when topological changes
are random. This paper investigates the stability of GCNNs to stochastic graph
perturbations induced by link losses. In particular, it proves the expected
output difference between the GCNN over random perturbed graphs and the GCNN
over the nominal graph is upper bounded by a factor that is linear in the link
loss probability. We perform the stability analysis in the graph spectral
domain such that the result holds uniformly for any graph. This result also
shows the role of the nonlinearity and the architecture width and depth, and
allows identifying handle to improve the GCNN robustness. Numerical simulations
on source localization and robot swarm control corroborate our theoretical
findings.
","[{""version"":""v1"",""created"":""Sat, 19 Jun 2021 16:25:28 GMT""}]","2021-06-22"
"2106.10527","Andre Ran","G.J. Groenewald, D.B. Janse van Rensburg, A.C.M. Ran, F. Theron and M.
  van Straaten","Polar decompositions of quaternion matrices in indefinite inner product
  spaces",,,,,"math.FA","http://arxiv.org/licenses/nonexclusive-distrib/1.0/","  Polar decompositions of quaternion matrices with respect to a given
indefinite inner product are studied. Necessary and sufficient conditions for
the existence of an $H$-polar decomposition are found. In the process an
equivalent to Witt's theorem on extending $H$-isometries to $H$-unitary
matrices is given for quaternion matrices.
","[{""version"":""v1"",""created"":""Sat, 19 Jun 2021 16:25:33 GMT""}]","2021-06-22"
"2106.10528","Tianrui Liu","Tianrui Liu, Qingjie Meng, Jun-Jie Huang, Athanasios Vlontzos, Daniel
  Rueckert, Bernhard Kainz","Video Summarization through Reinforcement Learning with a 3D
  Spatio-Temporal U-Net",,,"10.1109/TIP.2022.3143699",,"cs.CV","http://arxiv.org/licenses/nonexclusive-distrib/1.0/","  Intelligent video summarization algorithms allow to quickly convey the most
relevant information in videos through the identification of the most essential
and explanatory content while removing redundant video frames. In this paper,
we introduce the 3DST-UNet-RL framework for video summarization. A 3D
spatio-temporal U-Net is used to efficiently encode spatio-temporal information
of the input videos for downstream reinforcement learning (RL). An RL agent
learns from spatio-temporal latent scores and predicts actions for keeping or
rejecting a video frame in a video summary. We investigate if real/inflated 3D
spatio-temporal CNN features are better suited to learn representations from
videos than commonly used 2D image features. Our framework can operate in both,
a fully unsupervised mode and a supervised training mode. We analyse the impact
of prescribed summary lengths and show experimental evidence for the
effectiveness of 3DST-UNet-RL on two commonly used general video summarization
benchmarks. We also applied our method on a medical video summarization task.
The proposed video summarization method has the potential to save storage costs
of ultrasound screening videos as well as to increase efficiency when browsing
patient video data during retrospective analysis or audit without loosing
essential information
","[{""version"":""v1"",""created"":""Sat, 19 Jun 2021 16:27:19 GMT""}]","2022-02-16"
"2106.10529","Shaohui Liu","Shaohui Liu, Chengyang Wu, Hao Zhu","Graph Neural Networks for Learning Real-Time Prices in Electricity
  Market",,,,,"cs.LG cs.SY eess.SY math.OC","http://arxiv.org/licenses/nonexclusive-distrib/1.0/","  Solving the optimal power flow (OPF) problem in real-time electricity market
improves the efficiency and reliability in the integration of low-carbon energy
resources into the power grids. To address the scalability and adaptivity
issues of existing end-to-end OPF learning solutions, we propose a new graph
neural network (GNN) framework for predicting the electricity market prices
from solving OPFs. The proposed GNN-for-OPF framework innovatively exploits the
locality property of prices and introduces physics-aware regularization, while
attaining reduced model complexity and fast adaptivity to varying grid
topology. Numerical tests have validated the learning efficiency and adaptivity
improvements of our proposed method over existing approaches.
","[{""version"":""v1"",""created"":""Sat, 19 Jun 2021 16:34:56 GMT""}]","2021-06-22"
"2106.10530","Jin Zhao","Jin Zhao, Li-Zheng Yin, Feng-Yuan Han, Yi-Dong Wang, Tie-Jun Huang,
  Chao-Hai Du, and Pu-Kun Liu","Terahertz non-label subwavelength imaging with composite
  photonics-plasmonics structured illumination",,,"10.1364/OE.437544",,"physics.optics physics.plasm-ph","http://arxiv.org/licenses/nonexclusive-distrib/1.0/","  Inspired by the capability of structured illumination microscopy in
subwavelength imaging, many researchers devoted themselves to investigating
this methodology. However, due to the free propagating feature of the
traditional structured illumination fields, the resolution can be only improved
up to double times compared with the diffractied limited microscopy. Besides,
most of the previous studies, relying on incoherent illumination sources, are
restricted to fluorescent samples. In this work, a subwavelength nonfluorescent
imaging method is proposed based on the terahertz traveling wave and plasmonics
illumination. Excited along with a metal grating, the spoof surface plasmons
are employed as the plasmonics illumination. When the scattering waves with the
SSPs illumination are captured, the high order spatial frequency components of
the sample are already encoded into the obtainable low order ones. Then, an
algorithm is summarized to shift the modulated SF components to their actual
positions in the Fourier domain. In this manner, high order SF components
carrying the fine information are introduced to reconstruct the desired
imaging, leading to an improvement of the resolution up to 0.12 lambda.
Encouragingly, the resolution can be further enhanced by tuning the working
frequency of the SSPs. This method holds promise for some important
applications in terahertz nonfluorescent microscopy and sample detection with
weak scattering.
","[{""version"":""v1"",""created"":""Sat, 19 Jun 2021 16:35:55 GMT""}]","2022-02-09"
"2106.10531","Kassandra Groux","Kassandra Groux, Anna Verschueren, C\'eline Nanteau, Marilou
  Cl\'emen\c{c}on, Mathias Fink, Jos\'e-Alain Sahel, Claude Boccara, Michel
  Paques, Sacha Reichman and Kate Grieve","Non invasive live imaging of a novel retinal pigment epithelium stress
  model with Dynamic Full-Field Optical Coherence Tomography",,,,,"physics.bio-ph","http://creativecommons.org/licenses/by-nc-nd/4.0/","  Retinal degenerative diseases lead to the blindness of millions of people
around the world. In case of age-related macular degeneration (AMD), the
atrophy of retinal pigment epithelium (RPE) precedes neural dystrophy. But as
crucial as understanding both healthy and pathological RPE cell physiology is
for those diseases, no current technique allows subcellular in vivo or in vitro
live observation of this critical cell layer. To fill this gap, we propose
dynamic full-field OCT (D-FFOCT) as a candidate for live observation of in
vitro RPE phenotype. In this way, we monitored primary porcine and human stem
cell-derived RPE cells in stress model conditions by performing scratch assays.
In this study, we quantified wound healing parameters on the stressed RPE, and
observed different cell phenotypes, displayed by the D-FFOCT signal. In order
to decipher the subcellular contributions to these dynamic profiles, we
performed immunohistochemistry to identify which organelles generate the signal
and found mitochondria to be the main contributor to D-FFOCT contrast.
Altogether, D-FFOCT appears to be an innovative method to follow degenerative
disease evolution and could be an appreciated method in the future for live
patient diagnostics and to direct treatment choice.
","[{""version"":""v1"",""created"":""Sat, 19 Jun 2021 16:50:48 GMT""}]","2021-06-22"
"2106.10532","Amit Verma Dr.","Amit Verma and Mark Lewis","QUBO transformation using Eigenvalue Decomposition","Preprint submitted to Springer",,,,"math.OC cs.AI cs.ET","http://creativecommons.org/licenses/by/4.0/","  Quadratic Unconstrained Binary Optimization (QUBO) is a general-purpose
modeling framework for combinatorial optimization problems and is a requirement
for quantum annealers. This paper utilizes the eigenvalue decomposition of the
underlying Q matrix to alter and improve the search process by extracting the
information from dominant eigenvalues and eigenvectors to implicitly guide the
search towards promising areas of the solution landscape. Computational results
on benchmark datasets illustrate the efficacy of our routine demonstrating
significant performance improvements on problems with dominant eigenvalues.
","[{""version"":""v1"",""created"":""Sat, 19 Jun 2021 16:58:15 GMT""}]","2021-06-22"
"2106.10533","Franck Djeumou","Franck Djeumou and Ufuk Topcu","Learning to Reach, Swim, Walk and Fly in One Trial: Data-Driven Control
  with Scarce Data and Side Information","Initial submission to L4DC",,,,"eess.SY cs.LG cs.RO cs.SY math.OC","http://creativecommons.org/publicdomain/zero/1.0/","  We develop a learning-based control algorithm for unknown dynamical systems
under very severe data limitations. Specifically, the algorithm has access to
streaming and noisy data only from a single and ongoing trial. It accomplishes
such performance by effectively leveraging various forms of side information on
the dynamics to reduce the sample complexity. Such side information typically
comes from elementary laws of physics and qualitative properties of the system.
More precisely, the algorithm approximately solves an optimal control problem
encoding the system's desired behavior. To this end, it constructs and
iteratively refines a data-driven differential inclusion that contains the
unknown vector field of the dynamics. The differential inclusion, used in an
interval Taylor-based method, enables to over-approximate the set of states the
system may reach. Theoretically, we establish a bound on the suboptimality of
the approximate solution with respect to the optimal control with known
dynamics. We show that the longer the trial or the more side information is
available, the tighter the bound. Empirically, experiments in a high-fidelity
F-16 aircraft simulator and MuJoCo's environments illustrate that, despite the
scarcity of data, the algorithm can provide performance comparable to
reinforcement learning algorithms trained over millions of environment
interactions. Besides, we show that the algorithm outperforms existing
techniques combining system identification and model predictive control.
","[{""version"":""v1"",""created"":""Sat, 19 Jun 2021 17:10:27 GMT""},{""version"":""v2"",""created"":""Tue, 14 Sep 2021 18:46:54 GMT""},{""version"":""v3"",""created"":""Tue, 21 Dec 2021 19:35:48 GMT""},{""version"":""v4"",""created"":""Tue, 28 Dec 2021 15:55:45 GMT""}]","2021-12-30"
"2106.10534","Art Owen","Zexin Pan and Art B. Owen","The nonzero gain coefficients of Sobol's sequences are always powers of
  two",,,,,"math.NA cs.NA stat.CO","http://creativecommons.org/licenses/by/4.0/","  When a plain Monte Carlo estimate on $n$ samples has variance $\sigma^2/n$,
then scrambled digital nets attain a variance that is $o(1/n)$ as $n\to\infty$.
For finite $n$ and an adversarially selected integrand, the variance of a
scrambled $(t,m,s)$-net can be at most $\Gamma\sigma^2/n$ for a maximal gain
coefficient $\Gamma<\infty$. The most widely used digital nets and sequences
are those of Sobol'. It was previously known that $\Gamma\leqslant 2^t3^s$ for
Sobol' points as well as Niederreiter-Xing points. In this paper we study nets
in base $2$. We show that $\Gamma \leqslant2^{t+s-1}$ for nets. This bound is a
simple, but apparently unnoticed, consequence of a microstructure analysis in
Niederreiter and Pirsic (2001). We obtain a sharper bound that is smaller than
this for some digital nets. We also show that all nonzero gain coefficients
must be powers of two. A consequence of this latter fact is a simplified
algorithm for computing gain coefficients of nets in base $2$.
","[{""version"":""v1"",""created"":""Sat, 19 Jun 2021 17:11:02 GMT""}]","2021-06-22"
"2106.10535","Kulin Shah","Kulin Shah, Amit Deshpande, Navin Goyal","Learning and Generalization in Overparameterized Normalizing Flows","75 pages, Accepted in AISTATS 2022",,,,"cs.LG cs.AI","http://creativecommons.org/licenses/by-nc-sa/4.0/","  In supervised learning, it is known that overparameterized neural networks
with one hidden layer provably and efficiently learn and generalize, when
trained using stochastic gradient descent with a sufficiently small learning
rate and suitable initialization. In contrast, the benefit of
overparameterization in unsupervised learning is not well understood.
Normalizing flows (NFs) constitute an important class of models in unsupervised
learning for sampling and density estimation. In this paper, we theoretically
and empirically analyze these models when the underlying neural network is a
one-hidden-layer overparametrized network. Our main contributions are two-fold:
(1) On the one hand, we provide theoretical and empirical evidence that for
constrained NFs (this class of NFs underlies many NF constructions) with the
one-hidden-layer network, overparametrization hurts training. (2) On the other
hand, we prove that unconstrained NFs, a recently introduced model, can
efficiently learn any reasonable data distribution under minimal assumptions
when the underlying network is overparametrized and has one hidden-layer.
","[{""version"":""v1"",""created"":""Sat, 19 Jun 2021 17:11:42 GMT""},{""version"":""v2"",""created"":""Wed, 23 Mar 2022 05:07:24 GMT""}]","2022-03-24"
"2106.10536","Shintaro Nishikawa","Pierre Julg and Shintaro Nishikawa","Slow exponential growth representations of Sp(n, 1) at the edge of
  Cowling's strip","minor changes",,,,"math.RT math.FA","http://creativecommons.org/licenses/by/4.0/","  We obtain a slow exponential growth estimate for the spherical principal
series representation rho_s of Lie group Sp(n, 1) at the edge (Re(s)=1) of
Cowling's strip (|Re(s)|<1) on the Sobolev space H^alpha(G/P) when alpha is the
critical value Q/2=2n+1. As a corollary, we obtain a slow exponential growth
estimate for the homotopy rho_s (s in [0, 1]) of the spherical principal series
which is required for the first author's program for proving the Baum--Connes
conjecture with coefficients for Sp(n,1).
","[{""version"":""v1"",""created"":""Sat, 19 Jun 2021 17:14:55 GMT""},{""version"":""v2"",""created"":""Wed, 12 Oct 2022 14:49:22 GMT""}]","2022-10-13"
"2106.10537","B{\l}a\.zej Ku\'zma","B. Ku\'zma, K. Murawski, and S. Poedts","3D numerical simulations of propagating two-fluid, torsional Alfv\'en
  waves and heating of a partially-ionized solar chromosphere","10 pages, 7 figures",,"10.1093/mnras/stab1780",,"astro-ph.SR","http://creativecommons.org/licenses/by/4.0/","  We present a new insight into the propagation, attenuation and dissipation of
two-fluid, torsional Alfv\'en waves in the context of heating of the lower
solar atmosphere. By means of numerical simulations of the partially-ionized
plasma, we solve the set of two-fluid equations for ion plus electron and
neutral fluids in three-dimensional (3D) Cartesian geometry. We implement
initially a current-free magnetic field configuration, corresponding to a
magnetic flux-tube that is rooted in the solar photosphere and expands into the
chromosphere and corona. We put the lower boundary of our simulation region in
the low chromosphere, where ions and neutrals begin to decouple, and implement
there a monochromatic driver that directly generates Alfv\'en waves with a wave
period of 30 s. As the ion-neutral drift increases with height, the two-fluid
effects become more significant and the energy carried by both Alfv\'en and
magneto-acoustic waves can be thermalized in the process of ion-neutral
collisions there. In fact, we observe a significant increase in plasma
temperature along the magnetic flux-tube. In conclusion, the two-fluid
torsional Alfv\'en waves can potentially play a role in the heating of the
solar chromosphere.
","[{""version"":""v1"",""created"":""Sat, 19 Jun 2021 17:21:46 GMT""}]","2022-11-23"
"2106.10538","Sergey Zelik V.","Anna Kostianko, Chunyou Sun and Sergey Zelik","Inertial manifolds for 3D complex Ginzburg-Landau equations with
  periodic boundary conditions",,,,,"math.AP","http://arxiv.org/licenses/nonexclusive-distrib/1.0/","  We prove the existence of an Inertial Manifold for 3D complex Ginzburg-Landau
equation with periodic boundary conditions as well as for more general
cross-diffusion system assuming that the dispersive exponent is not vanishing.
The result is obtained under the assumption that the parameters of the equation
is chosen in such a way that the finite-time blow up of smooth solutions does
not take place. For the proof of this result we utilize the recently suggested
method of spatio-temporal averaging.
","[{""version"":""v1"",""created"":""Sat, 19 Jun 2021 17:28:21 GMT""}]","2021-06-22"
"2106.10539","Elan Ness-Cohn","Connor Puritz, Elan Ness-Cohn and Rosemary Braun","fasano.franceschini.test: An Implementation of a Multidimensional KS
  Test in R","12 pages, 5 figures",,,,"stat.ME astro-ph.IM physics.data-an q-bio.QM stat.CO","http://creativecommons.org/licenses/by-nc-sa/4.0/","  The Kolmogorov-Smirnov (KS) test is a nonparametric statistical test used to
test for differences between univariate probability distributions. The
versatility of the KS test has made it a cornerstone of statistical analysis
across many scientific disciplines. However, the test proposed by Kolmogorov
and Smirnov does not easily extend to multidimensional distributions. Here we
present the fasano.franceschini.test package, an R implementation of a
multidimensional two-sample KS test described by Fasano and Franceschini
(1987). The fasano.franceschini.test package provides a test that is
computationally efficient, applicable to data of any dimension and type
(continuous, discrete, or mixed), and that performs competitively with similar
R packages.
","[{""version"":""v1"",""created"":""Sat, 19 Jun 2021 17:28:52 GMT""},{""version"":""v2"",""created"":""Thu, 2 Sep 2021 17:17:29 GMT""},{""version"":""v3"",""created"":""Fri, 18 Nov 2022 17:44:22 GMT""}]","2022-11-21"
"2106.10540","Mohammad Hajidavalloo","Mohammad R. Hajidavalloo, Joel Cosner, Zhaojian Li, Wei-Che Tai, Ziyou
  Song","Simultaneous Suspension Control and Energy Harvesting through Novel
  Design and Control of a New Nonlinear Energy Harvesting Shock Absorber","Accepted for publication in IEEE Transactions on Vehicular Technology",,"10.1109/TVT.2022.3159734",,"eess.SY cs.SY","http://arxiv.org/licenses/nonexclusive-distrib/1.0/","  Simultaneous vibration control and energy harvesting of vehicle suspensions
have attracted significant research attention over the past decades. However,
existing energy harvesting shock absorbers (EHSAs) are mainly designed based on
the principle of linear resonance, thereby compromising suspension performance
for high-efficiency energy harvesting and being only responsive to narrow
bandwidth vibrations. In this paper, we propose a new EHSA design -- inerter
pendulum vibration absorber (IPVA) -- that integrates an electromagnetic rotary
EHSA with a nonlinear pendulum vibration absorber. We show that this design
simultaneously improves ride comfort and energy harvesting efficiency by
exploiting the nonlinear effects of pendulum inertia. To further improve the
performance, we develop a novel stochastic linearization model predictive
control (SL-MPC) approach in which we employ stochastic linearization to
approximate the nonlinear dynamics of EHSA that has superior accuracy compared
to standard linearization. In particular, we develop a new stochastic
linearization method with guaranteed stabilizability, which is a prerequisite
for control designs. This leads to an MPC problem that is much more
computationally efficient than the nonlinear MPC counterpart with no major
performance degradation. Extensive simulations are performed to show the
superiority of the proposed new nonlinear EHSA and to demonstrate the efficacy
of the proposed SL-MPC.
","[{""version"":""v1"",""created"":""Sat, 19 Jun 2021 17:34:25 GMT""},{""version"":""v2"",""created"":""Fri, 10 Jun 2022 04:51:22 GMT""}]","2022-06-13"
"2106.10541","Marie-Pierre B\'eal","Marie-Pierre B\'eal and Maxime Crochemore","Checking whether a word is Hamming-isometric in linear time",,,,,"cs.DS cs.FL","http://arxiv.org/licenses/nonexclusive-distrib/1.0/","  A finite word $f$ is Hamming-isometric if for any two word $u$ and $v$ of
same length avoiding $f$, $u$ can be transformed into $v$ by changing one by
one all the letters on which $u$ differs from $v$, in such a way that all of
the new words obtained in this process also avoid~$f$. Words which are not
Hamming-isometric have been characterized as words having a border with two
mismatches. We derive from this characterization a linear-time algorithm to
check whether a word is Hamming-isometric. It is based on pattern matching
algorithms with $k$ mismatches. Lee-isometric words over a four-letter alphabet
have been characterized as words having a border with two Lee-errors. We derive
from this characterization a linear-time algorithm to check whether a word over
an alphabet of size four is Lee-isometric.
","[{""version"":""v1"",""created"":""Sat, 19 Jun 2021 17:41:30 GMT""},{""version"":""v2"",""created"":""Fri, 23 Jul 2021 09:36:31 GMT""},{""version"":""v3"",""created"":""Tue, 8 Mar 2022 10:28:05 GMT""},{""version"":""v4"",""created"":""Mon, 8 Aug 2022 09:36:28 GMT""}]","2022-08-09"
