"2106.10574","Emre Cerci","Emre Cerci, Adem Cicek, Enver Cavus, Ebrahim Bedeer, Halim
  Yanikomeroglu","Coded Faster-than-Nyquist Signaling for Short Packet Communications","6 pages, 5 figures, accepted for publication in IEEE International
  Symposium on Personal, Indoor and Mobile Radio Communications (IEEE PIMRC
  2021)",,,,"cs.IT eess.SP math.IT","http://arxiv.org/licenses/nonexclusive-distrib/1.0/","  Ultra-reliable low-latency communication (URLLC) requires short packets of
data transmission. It is known that when the packet length becomes short, the
achievable rate is subject to a penalty when compared to the channel capacity.
In this paper, we propose to use faster-than-Nyquist (FTN) signaling to
compensate for the achievable rate loss of short packet communications. We
investigate the performance of a combination of a low complexity detector of
FTN signaling used with nonbinary low-density parity-check (NB-LDPC) codes that
is suitable for low-latency and short block length requirements of URLLC
systems. Our investigation shows that such combination of low-complexity FTN
signaling detection and NB-LDPC codes outperforms the use of close-to-optimal
FTN signaling detectors with LDPC codes in terms of error rate performance and
also has a considerably lower computational complexity.
","[{""version"":""v1"",""created"":""Sat, 19 Jun 2021 21:51:02 GMT""}]","2021-06-22"
"2106.10575","Ondrej Bohdal","Ondrej Bohdal, Yongxin Yang, Timothy Hospedales","EvoGrad: Efficient Gradient-Based Meta-Learning and Hyperparameter
  Optimization","Accepted at NeurIPS 2021",,,,"cs.LG cs.NE stat.ML","http://arxiv.org/licenses/nonexclusive-distrib/1.0/","  Gradient-based meta-learning and hyperparameter optimization have seen
significant progress recently, enabling practical end-to-end training of neural
networks together with many hyperparameters. Nevertheless, existing approaches
are relatively expensive as they need to compute second-order derivatives and
store a longer computational graph. This cost prevents scaling them to larger
network architectures. We present EvoGrad, a new approach to meta-learning that
draws upon evolutionary techniques to more efficiently compute hypergradients.
EvoGrad estimates hypergradient with respect to hyperparameters without
calculating second-order gradients, or storing a longer computational graph,
leading to significant improvements in efficiency. We evaluate EvoGrad on three
substantial recent meta-learning applications, namely cross-domain few-shot
learning with feature-wise transformations, noisy label learning with
Meta-Weight-Net and low-resource cross-lingual learning with meta
representation transformation. The results show that EvoGrad significantly
improves efficiency and enables scaling meta-learning to bigger architectures
such as from ResNet10 to ResNet34.
","[{""version"":""v1"",""created"":""Sat, 19 Jun 2021 21:51:39 GMT""},{""version"":""v2"",""created"":""Wed, 27 Oct 2021 16:16:00 GMT""}]","2021-10-28"
"2106.10576","Surjeet Rajendran","David E. Kaplan and Surjeet Rajendran","A Causal Framework for Non-Linear Quantum Mechanics","22 pages, 0 figures, Journal Version","Phys Rev D 105 055002 (2022)","10.1103/PhysRevD.105.055002",,"hep-th gr-qc hep-ph quant-ph","http://arxiv.org/licenses/nonexclusive-distrib/1.0/","  We add non-linear and state-dependent terms to quantum field theory. We show
that the resulting low-energy theory, non-linear quantum mechanics, is causal,
preserves probability and permits a consistent description of the process of
measurement. We explore the consequences of such terms and show that non-linear
quantum effects can be observed in macroscopic systems even in the presence of
de-coherence. We find that current experimental bounds on these non-linearities
are weak and propose several experimental methods to significantly probe these
effects. The locally exploitable effects of these non-linearities have enormous
technological implications. For example, they would allow large scale
parallelization of computing (in fact, any other effort) and enable quantum
sensing beyond the standard quantum limit. We also expose a fundamental
vulnerability of any non-linear modification of quantum mechanics - these
modifications are highly sensitive to cosmic history and their locally
exploitable effects can dynamically disappear if the observed universe has a
tiny overlap with the overall quantum state of the universe, as is predicted in
conventional inflationary cosmology. We identify observables that persist in
this case and discuss opportunities to detect them in cosmic ray experiments,
tests of strong field general relativity and current probes of the equation of
state of the universe. Non-linear quantum mechanics also enables novel
gravitational phenomena and may open new directions to solve the black hole
information problem and uncover the theory underlying quantum field theory and
gravitation.
","[{""version"":""v1"",""created"":""Sat, 19 Jun 2021 21:52:27 GMT""},{""version"":""v2"",""created"":""Wed, 9 Mar 2022 13:50:55 GMT""}]","2022-03-10"
"2106.10577","Noah Greifer","Noah Greifer, Elizabeth A. Stuart","Choosing the Estimand When Matching or Weighting in Observational
  Studies",,,,,"stat.ME","http://creativecommons.org/licenses/by-nc-nd/4.0/","  Matching and weighting methods for observational studies require the choice
of an estimand, the causal effect with reference to a specific target
population. Commonly used estimands include the average treatment effect in the
treated (ATT), the average treatment effect in the untreated (ATU), the average
treatment effect in the population (ATE), and the average treatment effect in
the overlap (i.e., equipoise population; ATO). Each estimand has its own
assumptions, interpretation, and statistical methods that can be used to
estimate it. This article provides guidance on selecting and interpreting an
estimand to help medical researchers correctly implement statistical methods
used to estimate causal effects in observational studies and to help audiences
correctly interpret the results and limitations of these studies. The
interpretations of the estimands resulting from regression and instrumental
variable analyses are also discussed. Choosing an estimand carefully is
essential for making valid inferences from the analysis of observational data
and ensuring results are replicable and useful for practitioners.
","[{""version"":""v1"",""created"":""Sat, 19 Jun 2021 22:00:05 GMT""}]","2021-06-22"
"2106.10578","Fouad Yacef","Maria-Sara-Nour Sadoun and Fouad Yacef","Optimal adaptive control of a knee joint exoskeleton for lower limb
  functional rehabilitation",,,,,"eess.SY cs.SY","http://creativecommons.org/licenses/by/4.0/","  Lower limb exoskeleton robots hold great potential for rehabilitation,
movement assistance, and strength augmentation. Design control to guarantee
optimal needed assistance is still a challenge considering the pathological
variances between patients. In this paper, we proposed an optimal adaptive
control scheme based on Particle Swarm Optimization (PSO) Algorithm. The
proposed controller is based on a well-known dynamic model of the knee joint
exoskeleton, and the optimization algorithm is used to minimize a square error
fitness function, which quantifies tracking performances. Control parameters
are tuned respecting some nonlinear constraints for step response of the system
and boundaries constraints. Numerical simulation results are presented to show
the validity and the high performances of the proposed approach.
","[{""version"":""v1"",""created"":""Sat, 19 Jun 2021 22:20:52 GMT""},{""version"":""v2"",""created"":""Fri, 15 Oct 2021 21:30:21 GMT""}]","2021-10-19"
"2106.10579","Andrey Afanasyev","Andrey N. Afanasyev, Maria D. Kazachenko, Yuhong Fan, George H.
  Fisher, Benoit Tremblay","Validation of the PDFI_SS method for electric field inversions using a
  magnetic flux emergence simulation","Accepted for publication in ApJ",,"10.3847/1538-4357/ac0d01",,"astro-ph.SR","http://creativecommons.org/licenses/by/4.0/","  Knowledge of electric fields in the photosphere is required to calculate the
electromagnetic energy flux through the photosphere and set up boundary
conditions for data-driven magnetohydrodynamic (MHD) simulations of solar
eruptions. Recently, the PDFI_SS method for inversions of electric fields from
a sequence of vector magnetograms and Doppler velocity measurements was
improved to incorporate spherical geometry and a staggered-grid description of
variables. The method was previously validated using synthetic data from
anelastic MHD (ANMHD) simulations. In this paper, we further validate the
PDFI_SS method, using approximately one-hour long MHD simulation data of
magnetic flux emergence from the upper convection zone into the solar
atmosphere. We reconstruct photospheric electric fields and calculate the
Poynting flux, and compare those to the actual values from the simulations. We
find that the accuracy of the PDFI_SS reconstruction is quite good during the
emergence phase of the simulated ephemeral active region evolution and
decreases during the shearing phase. Analysing our results, we conclude that
the more complex nature of the evolution (compared to the previously studied
ANMHD case) that includes the shearing evolution phase is responsible for the
obtained accuracy decrease.
","[{""version"":""v1"",""created"":""Sat, 19 Jun 2021 22:21:20 GMT""}]","2021-09-22"
"2106.10580","Okan Atalar","Okan Atalar, Rapha\""el Van Laer, Amir H. Safavi-Naeini, Amin Arbabian","Longitudinal piezoelectric resonant photoelastic modulator for efficient
  intensity modulation at megahertz frequencies","23 pages, 11 figures",,"10.1038/s41467-022-29204-9",,"physics.optics physics.app-ph","http://arxiv.org/licenses/nonexclusive-distrib/1.0/","  Intensity modulators are an essential component in optics for controlling
free-space beams. Many applications require the intensity of a free-space beam
to be modulated at a single frequency, including wide-field lock-in detection
for sensitive measurements, mode-locking in lasers, and phase-shift
time-of-flight imaging (LiDAR). Here, we report a new type of single frequency
intensity modulator that we refer to as a longitudinal piezoelectric resonant
photoelastic modulator. The modulator consists of a thin lithium niobate wafer
coated with transparent surface electrodes. One of the fundamental acoustic
modes of the modulator is excited through the surface electrodes, confining an
acoustic standing wave to the electrode region. The modulator is placed between
optical polarizers; light propagating through the modulator and polarizers is
intensity modulated with a wide acceptance angle and record breaking modulation
efficiency in the megahertz frequency regime. As an illustration of the
potential of our approach, we show that the proposed modulator can be
integrated with a standard image sensor to effectively convert it into a
time-of-flight imaging system.
","[{""version"":""v1"",""created"":""Sat, 19 Jun 2021 22:23:58 GMT""}]","2022-04-06"
"2106.10581","Fouad Yacef","Faiza Mekhalfa and Fouad Yacef","Supervised learning for crop/weed classification based on color and
  texture features",,,,,"cs.CV","http://creativecommons.org/licenses/by/4.0/","  Computer vision techniques have attracted a great interest in precision
agriculture, recently. The common goal of all computer vision-based precision
agriculture tasks is to detect the objects of interest (e.g., crop, weed) and
discriminating them from the background. The Weeds are unwanted plants growing
among crops competing for nutrients, water, and sunlight, causing losses to
crop yields. Weed detection and mapping is critical for site-specific weed
management to reduce the cost of labor and impact of herbicides. This paper
investigates the use of color and texture features for discrimination of
Soybean crops and weeds. Feature extraction methods including two color spaces
(RGB, HSV), gray level Co-occurrence matrix (GLCM), and Local Binary Pattern
(LBP) are used to train the Support Vector Machine (SVM) classifier. The
experiment was carried out on image dataset of soybean crop, obtained from an
unmanned aerial vehicle (UAV), which is publicly available. The results from
the experiment showed that the highest accuracy (above 96%) was obtained from
the combination of color and LBP features.
","[{""version"":""v1"",""created"":""Sat, 19 Jun 2021 22:31:54 GMT""}]","2021-06-22"
"2106.10582","Javier Rubio","Grigoris Panotopoulos, Javier Rubio, Il\'idio Lopes","On the impact of non-local gravity on compact stars","19 pages, 4 figures, matches the version published in International
  Journal of Modern Physics D",,"10.1142/S0218271822501395",,"gr-qc astro-ph.HE astro-ph.SR hep-th","http://arxiv.org/licenses/nonexclusive-distrib/1.0/","  We study the impact of non-local modifications of General Relativity on
stellar structure. In particular, assuming an analytic distortion function and
specific equations of state, we made use of remnant stars to put qualitative
constraints on a parameter not directly restricted by solar system tests. Using
current data sets available for white dwarfs and strange quark stars candidates
we find that the most stringent bounds come from the objects displaying the
highest core densities, namely strange quark stars. Specifically, the
constraints obtained from this class of stars are three to four orders of
magnitude tighter than those obtained using white dwarfs.
","[{""version"":""v1"",""created"":""Sat, 19 Jun 2021 22:48:03 GMT""},{""version"":""v2"",""created"":""Thu, 19 Jan 2023 21:52:33 GMT""}]","2023-01-23"
"2106.10583","Pang Du","Yunnan Xu, Pang Du, John Robertson and Ryan Senger","Sparse logistic regression on functional data",,,,,"stat.ME","http://creativecommons.org/licenses/by-nc-nd/4.0/","  Motivated by a hemodialysis monitoring study, we propose a logistic model
with a functional predictor, called the Sparse Functional Logistic Regression
(SFLR), where the corresponding coefficient function is {\it locally sparse},
that is, it is completely zero on some subregions of its domain. The
coefficient function, together with the intercept parameter, are estimated
through a doubly-penalized likelihood approach with a B-splines expansion. One
penalty is for controlling the roughness of the coefficient function estimate
and the other penalty, in the form of the $L_1$ norm, enforces the local
sparsity. A Newton-Raphson procedure is designed for the optimization of the
penalized likelihood. Our simulations show that SFLR is capable of generating a
smooth and reasonably good estimate of the coefficient function on the non-null
region(s) while recognizing the null region(s). Application of the method to
the Raman spectral data generated from the heomdialysis study pinpoint the
wavenumber regions for identifying key chemicals contributing to the dialysis
progress.
","[{""version"":""v1"",""created"":""Sat, 19 Jun 2021 22:50:00 GMT""}]","2021-06-22"
"2106.10584","Chinmay Khandekar Dr.","Chinmay Khandekar, Siddharth Buddhiraju, Paul R. Wilkinson, James K.
  Gimzewski, Alejandro W. Rodriguez, Charles Chase, Shanhui Fan","Nonequilibrium Casimir effects of nonreciprocal surface waves",,,,,"quant-ph cond-mat.mes-hall physics.optics","http://arxiv.org/licenses/nonexclusive-distrib/1.0/","  We show that an isotropic dipolar particle in the vicinity of a substrate
made of nonreciprocal plasmonic materials can experience a lateral Casimir
force and torque when the particle's temperature differs from that of the slab
and the environment. We connect the existence of the lateral force to the
asymmetric dispersion of nonreciprocal surface polaritons and the existence of
the lateral torque to the spin-momentum locking of such surface waves. Using
the formalism of fluctuational electrodynamics, we show that the features of
lateral force and torque should be experimentally observable using a substrate
of doped Indium Antimonide (InSb) placed in an external magnetic field, and for
a variety of dielectric particles. Interestingly, we also find that the
directions of the lateral force and the torque depend on the constituent
materials of the particles, which suggests a sorting mechanism based on lateral
nonequilibrium Casimir physics.
","[{""version"":""v1"",""created"":""Sat, 19 Jun 2021 23:10:04 GMT""}]","2021-06-22"
"2106.10585","Michael R. Pilla","Michael R. Pilla","One Parameter Semigroups in Two Complex Variables",,,,,"math.CV","http://creativecommons.org/licenses/by/4.0/","  For self maps of the disk, it can be shown that under the right conditions
one can embed a discrete iteration of the map into a continuous semigroup. In
this article we extend these results to two complex variables for maps of the
unit ball into itself under some restricted conditions.
","[{""version"":""v1"",""created"":""Sat, 19 Jun 2021 23:39:31 GMT""}]","2021-06-22"
"2106.10586","Hyun Jong Kim","Hyun Jong Kim, Sun Woo Park","Global $\mathbb{A}^1$ degrees of covering maps between modular curves","39 pages. Modified the exposition of modular curves with level
  structures in section 4 to correct the proof of what is now Proposition 4.7;
  the previous proof of the proposition was only applicable to modular curves
  as Riemann surface. Added discussions of comparisons between notions of Euler
  A1 degrees and global A1 degrees. Minor changes and corrections were made in
  various parts of the draft",,,,"math.AG math.NT","http://arxiv.org/licenses/nonexclusive-distrib/1.0/","  Given a projective smooth curve $X$ over any field $k$, we discuss two
notions of global $\mathbb{A}^1$ degree of a finite morphism of smooth curves
$f: X \to \mathbb{P}^1_k$ satisfying certain conditions. One originates from
computing the Euler number of the pullback of the line bundle
$\mathscr{O}_{\mathbb{P}^1}(1)$ as a generalization of Kass and Wickelgren's
construction of Euler numbers. The other originates from the construction of
global $\mathbb{A}^1$ degree of morphisms of projective curves by Kass, Levine,
Solomon, and Wickelgren as a generalization of Morel's construction of
$\mathbb{A}^1$-Brouwer degree of a morphism $f: \mathbb{P}^1_k \to
\mathbb{P}^1_k$. We prove that under certain conditions on $N$, both notions of
global $\mathbb{A}^1$ degrees of covering maps between modular curves $X_0(N)
\to X(1)$, $X_1(N) \to X(1)$, and $X(N) \to X(1)$ agree to be equal to sums of
hyperbolic elements $\langle 1 \rangle + \langle -1 \rangle$ in the
Grothendieck-Witt ring $\mathrm{GW}(k)$ for any field $k$ whose characteristic
is coprime to $N$ and the pullback of $\mathscr{O}_{\mathbb{P}^1}(1)$ is
relatively orientable.
","[{""version"":""v1"",""created"":""Sat, 19 Jun 2021 23:50:56 GMT""},{""version"":""v2"",""created"":""Sun, 24 Oct 2021 00:32:05 GMT""},{""version"":""v3"",""created"":""Fri, 17 Feb 2023 17:50:07 GMT""}]","2023-02-20"
"2106.10587","Kerem Turgutlu","Marcos V. Conde and Kerem Turgutlu","Exploring Vision Transformers for Fine-grained Classification","4 pages, 5 figures, 4 tables. Published in IEEE Computer Society
  Conference on Computer Vision and Pattern Recognition Workshops (CVPRW) 2021
  - FGVC8. For code see https://github.com/mv-lab/ViT-FGVC8 and for other
  workshop papers see https://sites.google.com/view/fgvc8/papers",,,,"cs.CV cs.LG","http://creativecommons.org/licenses/by/4.0/","  Existing computer vision research in categorization struggles with
fine-grained attributes recognition due to the inherently high intra-class
variances and low inter-class variances. SOTA methods tackle this challenge by
locating the most informative image regions and rely on them to classify the
complete image. The most recent work, Vision Transformer (ViT), shows its
strong performance in both traditional and fine-grained classification tasks.
In this work, we propose a multi-stage ViT framework for fine-grained image
classification tasks, which localizes the informative image regions without
requiring architectural changes using the inherent multi-head self-attention
mechanism. We also introduce attention-guided augmentations for improving the
model's capabilities. We demonstrate the value of our approach by experimenting
with four popular fine-grained benchmarks: CUB-200-2011, Stanford Cars,
Stanford Dogs, and FGVC7 Plant Pathology. We also prove our model's
interpretability via qualitative results.
","[{""version"":""v1"",""created"":""Sat, 19 Jun 2021 23:57:31 GMT""},{""version"":""v2"",""created"":""Wed, 30 Jun 2021 01:04:12 GMT""}]","2021-07-01"
"2106.10588","Abhinav Goel","Abhinav Goel, Caleb Tung, Xiao Hu, Haobo Wang, James C. Davis, George
  K. Thiruvathukal, Yung-Hsiang Lu","Low-Power Multi-Camera Object Re-Identification using Hierarchical
  Neural Networks","Accepted to ISLPED 2021",,,,"cs.CV eess.IV","http://creativecommons.org/licenses/by/4.0/","  Low-power computer vision on embedded devices has many applications. This
paper describes a low-power technique for the object re-identification (reID)
problem: matching a query image against a gallery of previously seen images.
State-of-the-art techniques rely on large, computationally-intensive Deep
Neural Networks (DNNs). We propose a novel hierarchical DNN architecture that
uses attribute labels in the training dataset to perform efficient object reID.
At each node in the hierarchy, a small DNN identifies a different attribute of
the query image. The small DNN at each leaf node is specialized to re-identify
a subset of the gallery: only the images with the attributes identified along
the path from the root to a leaf. Thus, a query image is re-identified
accurately after processing with a few small DNNs. We compare our method with
state-of-the-art object reID techniques. With a 4% loss in accuracy, our
approach realizes significant resource savings: 74% less memory, 72% fewer
operations, and 67% lower query latency, yielding 65% less energy consumption.
","[{""version"":""v1"",""created"":""Sat, 19 Jun 2021 23:59:26 GMT""}]","2021-06-22"
"2106.10589","Kai-Xing Lu","Kai-Xing Lu, Jian-Guo Wang, Zhi-Xiang Zhang, Ying-Ke Huang, Liang Xu,
  Yu-Xin Xin, Xiao-Guang Yu, Xu Ding, De-Qing Wang, Hai-Cheng Feng","Reverberation Mapping Measurements of Black Hole Masses and Broad-Line
  Region Kinematics in Mrk 817 and NGC 7469","19 pages, 11 figures, accepted for publication in ApJ",,"10.3847/1538-4357/ac0c78",,"astro-ph.GA","http://creativecommons.org/licenses/by/4.0/","  We present the results from a spectroscopic monitoring campaign to obtain
reverberation-mapping measurements and investigate the broad-line region
kinematics for active galactic nuclei (AGN) of Mrk~817 and NGC~7469. This
campaign was undertaken with the Lijiang 2.4-meter telescope, the median
spectroscopic sampling is 2.0 days for Mrk~817 and 1.0 days for NGC~7469. We
detect time lags of the broad emission lines including H$\beta$, H$\gamma$,
He~{\sc ii} and He~{\sc i} for both AGNs, and including Fe~{\sc ii} for Mrk~817
with respect to the varying AGN continuum at 5100~\AA. Investigating the
relationship between line widths and time lags of the broad emission lines, we
find that the BLR dynamics of Mrk~817 and NGC~7469 are consistent with the
virial prediction. We estimate the masses of central supermassive black hole
(SMBH) and the accretion rates of both AGNs. Using the data of this campaign,
we construct the velocity-resolved lag profiles of the broad H$\gamma$,
H$\beta$, and He~{\sc i} lines for Mrk~817, which show almost the same
kinematic signatures that the time lags in the red wing are slightly larger
than the time lags in the blue wing. For NGC~7469, we only clearly construct
the velocity-resolved lag profiles of the broad H$\gamma$ and H$\beta$, which
show very similar kinematic signatures to the BLR of Mrk~817. These signatures
indicate that the BLR of Keplerian motion in both AGNs seemingly has outflowing
components during the monitoring period. We discuss the kinematics of the BLR
and the measurements including SMBH mass and accretion rates.
","[{""version"":""v1"",""created"":""Sun, 20 Jun 2021 00:18:40 GMT""}]","2021-09-29"
"2106.10590","Nihad S. Abd El Motelp","M. Radwan and Nihad S. Abdel-Motelp","Location and stability of the triangular points in the triaxial elliptic
  restricted three-body problem","17 pages, 12 figure, accepted paper",,"10.22201/ia.01851101p.2021.57.02.05",,"math.DS","http://arxiv.org/licenses/nonexclusive-distrib/1.0/","  The main goal of the present paper is to evaluate the perturbed locations and
investigate the linear stability of the triangular points. We studied the
problem in the elliptic restricted three body problem frame of work. The
problem is generalized in the sense that the two primaries are considered as
triaxial bodies. It is found that the locations of these points are affected by
the triaxiality coefficients of the primaries and the eccentricity of orbits.
Also it is observed that the stability regions depend on the involved
perturbations. In addition to this we studied the periodic orbits in the
vicinity of the triangular points.
","[{""version"":""v1"",""created"":""Sun, 20 Jun 2021 00:20:19 GMT""}]","2021-09-29"
