"2106.13989","C. J. A. P. Martins","M. Deal, C. J. A. P. Martins","Primordial nucleosynthesis with varying fundamental constants: Solutions
  to the Lithium problem and the Deuterium discrepancy","13 pages, 7 figures, Astronomy & Astrophysics (in press)","A&A 653, A48 (2021)","10.1051/0004-6361/202140725",,"astro-ph.CO hep-ph","http://arxiv.org/licenses/nonexclusive-distrib/1.0/","  The success of primordial nucleosynthesis has been limited by the
long-standing Lithium problem. We use a self-consistent perturbative analysis
of the effects of relevant theoretical parameters on primordial
nucleosynthesis, including variations of nature's fundamental constants, to
explore the problem and its possible solutions, in the context of the latest
observations and theoretical modeling. We quantify the amount of depletion
needed to solve the Lithium problem, and show that transport processes of
chemical elements in stars are able to account for it. Specifically, the
combination of atomic diffusion, rotation and penetrative convection allows us
to reproduce the lithium surface abundances of Population II stars, starting
from the primordial Lithium abundance. We also show that even with this
depletion factor there is a preference for a value of the fine-structure
constant at this epoch that is larger than the current laboratory one by a few
parts per million of relative variation, at the two to three standard
deviations level of statistical significance. This preference is driven by the
recently noticed discrepancy between the best-fit values for the
baryon-to-photon ratio (or equivalently the Deuterium abundance) inferred from
cosmic microwave background and primordial nucleosynthesis analyses, and is
largely insensitive to the Helium-4 abundance. We thus conclude that the
Lithium problem most likely has an astrophysical solution, while the Deuterium
discrepancy provides a possible hint of new physics.
","[{""version"":""v1"",""created"":""Sat, 26 Jun 2021 09:53:56 GMT""}]","2021-09-08"
"2106.13990","Daniel Plaumann","Huu Phuoc Le, Dimitri Manevich, Daniel Plaumann","Computing totally real hyperplane sections and linear series on
  algebraic curves",,,,,"math.AG","http://arxiv.org/licenses/nonexclusive-distrib/1.0/","  Given a real algebraic curve, embedded in projective space, we study the
computational problem of deciding whether there exists a hyperplane meeting the
curve in real points only. More generally, given any divisor on such a curve,
we may ask whether the corresponding linear series contains an effective
divisor with totally real support. This translates into a particular type of
parametrized real root counting problem that we wish to solve exactly. On the
other hand, it is known that for a given genus and number of real connected
components, any linear series of sufficiently large degree contains a totally
real effective divisor. Using the algorithms described in this paper, we solve
a number of examples, which we can compare to the best known bounds for the
required degree.
","[{""version"":""v1"",""created"":""Sat, 26 Jun 2021 09:59:50 GMT""}]","2021-06-29"
"2106.13991","Ying-Ming Xie","Ying-Ming Xie, Cheng-Ping Zhang, Jin-Xin Hu, Kin Fai Mak, K. T. Law","Valley-Polarized Quantum Anomalous Hall State in Moir\'e
  MoTe$_2$/WSe$_2$ Heterobilayers","5 pages, 3 figures, plus supplementary material. Comments are welcome","Phys. Rev. Lett. 128, 026402 (2022)","10.1103/PhysRevLett.128.026402",,"cond-mat.mes-hall cond-mat.mtrl-sci cond-mat.str-el","http://arxiv.org/licenses/nonexclusive-distrib/1.0/","  Moir\'e heterobilayer transition metal dichalcogenides (TMDs) emerge as an
ideal system for simulating the single-band Hubbard model and interesting
correlated phases have been observed in these systems. Nevertheless, the
moir\'e bands in heterobilayer TMDs were believed to be topologically trivial.
Recently, it was reported that both a quantum valley Hall insulating state at
filling $\nu=2$ (two holes per moir\'e unit cell) and a valley-polarized
quantum anomalous Hall state at filling $\nu=1$ were observed in AB stacked
moir\'e MoTe$_2$/WSe$_2$ heterobilayers. However, how the topologically
nontrivial states emerge is not known. In this work, we propose that the
pseudo-magnetic fields induced by lattice relaxation in moir\'e
MoTe$_2$/WSe$_2$ heterobilayers could naturally give rise to moir\'e bands with
finite Chern numbers. We show that a time-reversal invariant quantum valley
Hall insulator is formed at full-filing $\nu=2$, when two moir\'e bands with
opposite Chern numbers are filled. At half-filling $\nu=1$, Coulomb interaction
lifts the valley degeneracy and results in a valley-polarized quantum anomalous
Hall state, as observed in the experiment. Our theory identifies a new way to
achieve topologically non-trivial states in heterobilayer TMD materials.
","[{""version"":""v1"",""created"":""Sat, 26 Jun 2021 10:03:10 GMT""},{""version"":""v2"",""created"":""Thu, 15 Jul 2021 13:24:57 GMT""},{""version"":""v3"",""created"":""Fri, 14 Jan 2022 14:45:47 GMT""}]","2022-01-19"
"2106.13992","Chaabane Djeraba","Chaabane Djeraba, J\'er\^ome Riedi","Mining atmospheric data","5 pages, 1 figure",,,,"cs.CV","http://creativecommons.org/licenses/by/4.0/","  This paper overviews two interdependent issues important for mining remote
sensing data (e.g. images) obtained from atmospheric monitoring missions. The
first issue relates the building new public datasets and benchmarks, which are
hot priority of the remote sensing community. The second issue is the
investigation of deep learning methodologies for atmospheric data
classification based on vast amount of data without annotations and with
localized annotated data provided by sparse observing networks at the surface.
The targeted application is air quality assessment and prediction. Air quality
is defined as the pollution level linked with several atmospheric constituents
such as gases and aerosols. There are dependency relationships between the bad
air quality, caused by air pollution, and the public health. The target
application is the development of a fast prediction model for local and
regional air quality assessment and tracking. The results of mining data will
have significant implication for citizen and decision makers by providing a
fast prediction and reliable air quality monitoring system able to cover the
local and regional scale through intelligent extrapolation of sparse
ground-based in situ measurement networks.
","[{""version"":""v1"",""created"":""Sat, 26 Jun 2021 10:04:35 GMT""}]","2021-06-29"
"2106.13993","Ashkan Nikseresht","Ashkan Nikseresht","Gorenstein and Cohen-Macaulay Matching Complexes","10 pages, 3 figures",,,,"math.AC math.CO","http://arxiv.org/licenses/nonexclusive-distrib/1.0/","  Let $H$ be a simple undirected graph. The family of all matchings of $H$
forms a simplicial complex called the matching complex of $H$. Here , we give a
classification of all graphs with a Gorenstein matching complex. Also we study
when the matching complex of $H$ is Cohen-Macaulay and, in certain classes of
graphs, we fully characterize those graphs which have a Cohen-Macaulay matching
complex. In particular, we characterize when the matching complex of a graph
with girth at least 5 or a complete graph is Cohen-Macaulay.
","[{""version"":""v1"",""created"":""Sat, 26 Jun 2021 10:07:44 GMT""},{""version"":""v2"",""created"":""Sun, 18 Jul 2021 12:42:08 GMT""}]","2021-07-20"
"2106.13994","Liang Li","Liang Li, Ruipeng Shen","Energy distribution of solutions to defocusing semi-linear wave equation
  in higher dimensional space","15 pages. arXiv admin note: text overlap with arXiv:2104.13041",,,,"math.AP","http://creativecommons.org/licenses/by/4.0/","  The topic of this paper is a semi-linear, defocusing wave equation $u_{t
t}-\Delta u=-|u|^{p-1} u$ in sub-conformal case in the higher dimensional space
whose initial data are radical and come with a finite energy. We prove some
decay estimates of the the solutions if initial data decay at a certain rate as
the spatial variable tends to infinity. A combination of this property with a
method of characteristic lines give a scattering result if the initial data
satisfy $$E_{\kappa}\left(u_{0},
u_{1}\right)=\int_{\mathbb{R}^{d}}\left(|x|^{\kappa}+1\right)\left(\frac{1}{2}\left|\nabla
u_{0}(x)\right|^{2}+\frac{1}{2}\left|u_{1}(x)\right|^{2}+\frac{1}{p+1}\left|u_{0}(x)\right|^{p+1}\right)
d x<+\infty.$$ Here $\kappa=\frac{(2-d)p+(d+2)}{p+1}$.
","[{""version"":""v1"",""created"":""Sat, 26 Jun 2021 10:26:56 GMT""}]","2021-06-29"
"2106.13995","Alexandru Paler","Oumarou Oumarou, Alexandru Paler, Robert Basmadjian","Fast quantum circuit simulation using hardware accelerated general
  purpose libraries","accepted at 2nd International Workshop on Quantum Computing: Circuits
  Systems Automation and Applications (QC-CSAA) in conjuction with the ISVLSI
  2021",,,,"quant-ph cs.ET","http://arxiv.org/licenses/nonexclusive-distrib/1.0/","  Quantum circuit simulators have a long tradition of exploiting massive
hardware parallelism. Most of the times, parallelism has been supported by
special purpose libraries tailored specifically for the quantum circuits.
Quantum circuit simulators are integral part of quantum software stacks, which
are mostly written in Python. Our focus has been on ease of use, implementation
and maintainability within the Python ecosystem. We report the performance
gains we obtained by using CuPy, a general purpose library (linear algebra)
developed specifically for CUDA-based GPUs, to simulate quantum circuits. For
supremacy circuits the speedup is around 2x, and for quantum multipliers almost
22x compared to state-of-the-art C++-based simulators.
","[{""version"":""v1"",""created"":""Sat, 26 Jun 2021 10:41:43 GMT""}]","2021-06-29"
"2106.13996","Konstantinos F. Panagiotou Dr.","Constantinos F. Panagiotou and Davide Cerizza and Tamer A. Zaki and
  Yosuke Hasegawa","Optimization of a Moving Sensor Trajectory for Observing a Point Scalar
  Source in Turbulent Flow",,,,,"cs.CE","http://creativecommons.org/licenses/by/4.0/","  We propose a strategy for optimizing a sensor trajectory in order to estimate
the time dependence of a localized scalar source in turbulent channel flow. The
approach leverages the view of the adjoint scalar field as the sensitivity of
measurement to a possible source. A cost functional is constructed so that the
optimal sensor trajectory maintains a high sensitivity and low temporal
variation in the measured signal, for a given source location. This naturally
leads to the adjoint-of-adjoint equation based on which the sensor trajectory
is iteratively optimized. It is shown that the estimation performance based on
the measurement obtained by a sensor moving along the optimal trajectory is
drastically improved from that achieved with a stationary sensor. It is also
shown that the ratio of the fluctuation and the mean of the sensitivity for a
given sensor trajectory can be used as a diagnostic tool to evaluate the
resultant performance. Based on this finding, we propose a new cost functional
which only includes the ratio without any adjustable parameters, and
demonstrate its effectiveness in predicting the time dependence of scalar
release from the source.
","[{""version"":""v1"",""created"":""Sat, 26 Jun 2021 10:43:32 GMT""},{""version"":""v2"",""created"":""Fri, 18 Feb 2022 08:17:38 GMT""}]","2022-02-21"
"2106.13997","Ivan Tyukin","Ivan Y. Tyukin, Desmond J. Higham, Alexander Bastounis, Eliyas
  Woldegeorgis, Alexander N. Gorban","The Feasibility and Inevitability of Stealth Attacks",,,,,"cs.CR cs.AI cs.LG","http://creativecommons.org/licenses/by/4.0/","  We develop and study new adversarial perturbations that enable an attacker to
gain control over decisions in generic Artificial Intelligence (AI) systems
including deep learning neural networks. In contrast to adversarial data
modification, the attack mechanism we consider here involves alterations to the
AI system itself. Such a stealth attack could be conducted by a mischievous,
corrupt or disgruntled member of a software development team. It could also be
made by those wishing to exploit a ``democratization of AI'' agenda, where
network architectures and trained parameter sets are shared publicly. We
develop a range of new implementable attack strategies with accompanying
analysis, showing that with high probability a stealth attack can be made
transparent, in the sense that system performance is unchanged on a fixed
validation set which is unknown to the attacker, while evoking any desired
output on a trigger input of interest. The attacker only needs to have
estimates of the size of the validation set and the spread of the AI's relevant
latent space. In the case of deep learning neural networks, we show that a one
neuron attack is possible - a modification to the weights and bias associated
with a single neuron - revealing a vulnerability arising from
over-parameterization. We illustrate these concepts using state of the art
architectures on two standard image data sets. Guided by the theory and
computational results, we also propose strategies to guard against stealth
attacks.
","[{""version"":""v1"",""created"":""Sat, 26 Jun 2021 10:50:07 GMT""},{""version"":""v2"",""created"":""Tue, 5 Oct 2021 13:36:56 GMT""},{""version"":""v3"",""created"":""Wed, 28 Dec 2022 20:03:41 GMT""},{""version"":""v4"",""created"":""Wed, 4 Jan 2023 11:07:05 GMT""}]","2023-01-05"
"2106.13998","Alexandru Paler","Evan E. Dobbs, Robert Basmadjian, Alexandru Paler, Joseph S. Friedman","Fast Swapping in a Quantum Multiplier Modelled as a Queuing Network","accepted at 13th International Conference on Reversible Computation
  (RC) July 7 - July 8, 2021, Nagoya, Japan",,,,"quant-ph","http://arxiv.org/licenses/nonexclusive-distrib/1.0/","  Predicting the optimum SWAP depth of a quantum circuit is useful because it
informs the compiler about the amount of necessary optimization. Fast
prediction methods will prove essential to the compilation of practical quantum
circuits. In this paper, we propose that quantum circuits can be modeled as
queuing networks, enabling efficient extraction of the parallelism and duration
of SWAP circuits. To provide preliminary substantiation of this approach, we
compile a quantum multiplier circuit and use a queuing network model to
accurately determine the quantum circuit parallelism and duration. Our method
is scalable and has the potential speed and precision necessary for large scale
quantum circuit compilation.
","[{""version"":""v1"",""created"":""Sat, 26 Jun 2021 10:55:52 GMT""}]","2021-06-29"
"2106.13999","Jens Kr\""oger","Jens Kr\""oger","Performance Studies of the ATLASpix HV-MAPS Prototype for Different
  Substrate Resistivities","Proceedings for TIPP2021, 5 pages, 8 figures",,"10.1088/1742-6596/2374/1/012176",,"physics.ins-det hep-ex","http://creativecommons.org/licenses/by/4.0/","  The ATLASpix high-voltage monolithic active pixel sensor (HV-MAPS) was
designed as a technology demonstrator for the ATLAS ITk Upgrade and the CLIC
tracking detector. In this contribution new results from laboratory-based
energy calibration measurements using fluorescence X-rays are presented for the
ATLASpix Simple matrix. These findings are complemented by new results from
test-beam studies with inclined tracks, in which the active charge collection
depth is determined.
","[{""version"":""v1"",""created"":""Sat, 26 Jun 2021 10:59:40 GMT""},{""version"":""v2"",""created"":""Wed, 11 May 2022 15:50:38 GMT""}]","2022-12-21"
"2106.14000","Alexander Zass","Alexander Zass","Gibbs point processes on path space: existence, cluster expansion and
  uniqueness","Added a missing term when proving the form of the interaction range.
  34 pages, 6 figures","Markov Process. Relat. Fields 28, pp. 329-364 (2022)",,,"math.PR","http://creativecommons.org/licenses/by/4.0/","  We present general existence and uniqueness results for marked models with
pair interactions, exemplified through Gibbs point processes on path space.
More precisely, we study a class of infinite-dimensional diffusions under
Gibbsian interactions, in the context of marked point configurations: the
starting points belong to $\mathbb{R}^d$, and the marks are the paths of
Langevin diffusions. We use the entropy method to prove existence of an
infinite-volume Gibbs point process and use cluster expansion tools to provide
an explicit activity domain in which uniqueness holds.
","[{""version"":""v1"",""created"":""Sat, 26 Jun 2021 11:15:55 GMT""},{""version"":""v2"",""created"":""Mon, 9 May 2022 08:30:10 GMT""},{""version"":""v3"",""created"":""Thu, 21 Jul 2022 10:36:16 GMT""}]","2022-07-22"
"2106.14001","William Chen","J. Beck, W.W.L. Chen, and Y. Yang","New Kronecker-Weyl type equidistribution results and diophantine
  approximation","70 pages, 27 figures",,,,"math.DS","http://creativecommons.org/licenses/by/4.0/","  An interesting result of Veech more than 50 years ago is a parity, or mod
$2$, version of the Kronecker--Weyl equidistribution theorem concerning the
irrational rotation sequence $\{q\alpha\}$, $q=0,1,2,3,\ldots.$ If $\alpha$ is
badly approximable and $b\in(0,1)$ satisfies $b\ne\{m\alpha\}$ for any
$m\in\mathbb{Z}$, then the parity of cardinalities of the sets $\{1\le q\le
N:\{q\alpha\}\in[0,b)\}$ as $N\to\infty$ is evenly distributed.
  We first answer a question of Veech and establish a stronger form of the mod
$n$ analog of his result (Theorem 3.1). Furthermore, for irrational $\alpha$
and $b=\{m\alpha\}$ for some $m\in\mathbb{N}$, we give a simple yet precise
characterization of those cases that give rise to even distribution (Theorem
2.1). We also obtain time-quantitative description of some very striking
violations of uniformity -- this part is particularly number theoretic in
nature, and involves Ostrowski representations of positive integers and
$\alpha$-expansions of real numbers (Theorem 3.4).
  The Veech discrete $2$-circle problem can also be visualized as a problem
that concerns $1$-direction geodesic flow on a surface obtained by modifying
the surface comprising two side-by-side squares by the inclusion of symmetric
barriers and gates on the vertical edges, with appropriate modification of the
vertical edge identifications. We establish a far-reaching generalization of
this case to ones that concern $1$-direction geodesic flow on surfaces obtained
by modifying a finite square tiled translation surface in analogous but not
necessarily symmetric ways (Theorem 3.2).
","[{""version"":""v1"",""created"":""Sat, 26 Jun 2021 11:24:20 GMT""},{""version"":""v2"",""created"":""Tue, 26 Oct 2021 01:04:19 GMT""}]","2021-10-27"
"2106.14002","Shuxun Tian","S. X. Tian and Zong-Hong Zhu","Cosmological consequences of a scalar field with oscillating equation of
  state. III. Unifying inflation with dark energy and small tensor-to-scalar
  ratio","8 pages, 3 figures, published in Phys. Rev. D","Phys. Rev. D 103, 123545 (2021)","10.1103/PhysRevD.103.123545",,"astro-ph.CO gr-qc","http://creativecommons.org/licenses/by/4.0/","  We investigate the inflationary consequences of the oscillating dark energy
model proposed by Ti\'an
[\href{https://doi.org/10.1103/PhysRevD.101.063531}{Phys. Rev. D {\bf 101},
063531 (2020)}], which aims to solve the cosmological coincidence problem with
multi-accelerating Universe (MAU). We point out that the inflationary dynamics
belong to slow-roll inflation. The spectral index of scalar perturbations and
the tensor-to-scalar ratio $r$ are shown to be consistent with current
\textit{Planck} measurements. Especially, this model predicts $r\sim10^{-7}$,
which is far below the observation limits. This result motivates us to explore
the smallness of $r$ in the general MAU. We propose a quintessential
generalization of the original model and prove $r<0.01$ in general. The null
detection to date of primordial gravitational waves provides a circumstantial
evidence for the MAU. After the end of inflation, the scalar field rolls toward
infinity instead of a local minimum, and meanwhile its equation of state is
oscillating with an average value larger than $1/3$. In this framework, we show
that gravitational particle creation at the end of inflation is capable of
reheating the Universe.
","[{""version"":""v1"",""created"":""Sat, 26 Jun 2021 11:36:25 GMT""}]","2021-06-29"
"2106.14003","Alexandros Filotheou","Alexandros Filotheou","Correspondenceless scan-to-map-scan matching of homoriented 2D scans for
  mobile robot localisation","19 pages, 19 figures",,,,"cs.RO","http://creativecommons.org/licenses/by/4.0/","  The objective of this study is improving the location estimate of a mobile
robot capable of motion on a plane and mounted with a conventional 2D LIDAR
sensor, given an initial guess for its location on a 2D map of its
surroundings. Documented herein is the theoretical reasoning behind solving a
matching problem between two homoriented 2D scans, one derived from the robot's
physical sensor and one derived by simulating its operation within the map, in
a manner that does not require the establishing of correspondences between
their constituting rays. Two results are proved and subsequently shown through
experiments. The first is that the true position of the sensor can be recovered
with arbitrary precision when the physical sensor reports faultless
measurements and there is no discrepancy between the environment the robot
operates in and its perception of it by the robot. The second is that when
either is affected by disturbance, the location estimate is bound in a
neighbourhood of the true location whose radius is proportional to the
affecting disturbance.
","[{""version"":""v1"",""created"":""Sat, 26 Jun 2021 11:41:19 GMT""}]","2021-06-29"
"2106.14004","Ezgi Canay","Maxim Eingorn, Ezgi Canay, Jacob M. Metcalf, Maksym Brilenkov and
  Alexander Zhuk","Effect of the cubic torus topology on cosmological perturbations","14 pages, 4 figures and 2 tables","Universe 7, 469 (2021)","10.3390/universe7120469",,"gr-qc astro-ph.CO","http://creativecommons.org/licenses/by/4.0/","  We study the effect of the cubic torus topology of the Universe on scalar
cosmological perturbations which define the gravitational potential. We obtain
three alternative forms of the solution for both the gravitational potential
produced by point-like masses, and the corresponding force. The first solution
includes the expansion of delta-functions into Fourier series, exploiting
periodic boundary conditions. The second one is composed of summed solutions of
the Helmholtz equation for the original mass and its images. Each of these
summed solutions is the Yukawa potential. In the third formula, we express the
Yukawa potentials via Ewald sums. We show that for the present Universe, both
the bare summation of Yukawa potentials and the Yukawa-Ewald sums require
smaller numbers of terms to yield the numerical values of the potential and the
force up to desired accuracy. Nevertheless, the Yukawa formula is yet
preferable owing to its much simpler structure.
","[{""version"":""v1"",""created"":""Sat, 26 Jun 2021 11:54:19 GMT""},{""version"":""v2"",""created"":""Mon, 20 Dec 2021 10:26:04 GMT""}]","2021-12-21"
"2106.14005","Angelos Alexopoulos Dr","Angelos Alexopoulos, Petros Dellaportas, Stanley Gyoshev, Christos
  Kotsogiannis, Sofia C. Olhede, Trifon Pavkov","Detecting anomalies in heterogeneous population-scale VAT networks","14 pages, 5 figures, 3 tables",,,,"physics.soc-ph stat.AP","http://creativecommons.org/licenses/by/4.0/","  Anomaly detection in network science is the method to determine aberrant
edges, nodes, subgraphs or other network events. Heterogeneous networks
typically contain information going beyond the observed network itself. Value
Added Tax (VAT, a tax on goods and services) networks, defined from pairwise
interactions of VAT registered taxpayers, are analysed at a population-scale
requiring scalable algorithms. By adopting a quantitative understanding of the
nature of VAT-anomalies, we define a method that identifies them utilising
information from micro-scale, meso-scale and global-scale patterns that can be
interpreted, and efficiently implemented, as population-scale network analysis.
The proposed method is automatable, and implementable in real time, enabling
revenue authorities to prevent large losses of tax revenues through performing
early identification of fraud within the VAT system.
","[{""version"":""v1"",""created"":""Sat, 26 Jun 2021 11:54:51 GMT""}]","2021-06-29"
