"2106.13807","Masafusa Onoue","Masafusa Onoue, Yoshiki Matsuoka, Nobunari Kashikawa, Michael A.
  Strauss, Kazushi Iwasawa, Takuma Izumi, Tohru Nagao, Naoko Asami, Seiji
  Fujimoto, Yuichi Harikane, Takuya Hashimoto, Masatoshi Imanishi, Chien-Hsiu
  Lee, Takatoshi, Shibuya, and Yoshiki Toba","Subaru High-z Exploration of Low-Luminosity Quasars (SHELLQs). XIV. A
  Candidate Type-II Quasar at z=6.1292","15 pages, 8 figures, accepted for publication in the Astrophysical
  Journal",,"10.3847/1538-4357/ac0f07",,"astro-ph.GA","http://arxiv.org/licenses/nonexclusive-distrib/1.0/","  We present deep Keck/MOSFIRE near-infrared spectroscopy of a strong Lyman
alpha emitting source at z=6.1292, HSC J142331.71-001809.1, which was
discovered by the SHELLQS program from imaging data of the Subaru Hyper
Suprime-Cam (HSC) survey. This source is one of five objects that show
unresolved (<230 km s-1) and prominent (>10^44 erg s-1) Lyman alpha emission
lines at absolute 1450 angstrom continuum magnitudes of M1450~-22 mag. Its
rest-frame Lyman alpha equivalent width (EW) is 370+/-30 angstrom. In the 2
hour Keck/MOSFIRE spectrum in Y band, the high-ionization CIV 1548,1550 doublet
emission line was clearly detected with FWHM =120+/-20 km s-1 and a total
rest-frame EW of 37-5+6 angstrom. We also report the detection of weak
continuum emission, and the tentative detection of OIII] 1661,1666 in the 4
hour J band spectrum. Judging from the UV magnitude, line widths, luminosities,
and EWs of Lyman alpha and CIV, we suggest that this source is a
reionization-era analog of classical type-II AGNs, although there is a
possibility that it represents a new population of AGN/galaxy composite objects
in the early universe. We compare the properties of J1423-0018 to
intermediate-redshift type-II AGNs and CIV emitters seen in z=6-7 galaxy
samples. Further observations of other metal emission lines in the rest-frame
UV or optical, and X-ray follow-up observations of the z=6-7 narrow-line
quasars are needed for more robust diagnostics and to determine their nature.
","[{""version"":""v1"",""created"":""Fri, 25 Jun 2021 17:59:59 GMT""}]","2021-10-04"
"2106.13809","Connor Stone","Connor Stone, Nikhil Arora, St\'ephane Courteau, Jean-Charles
  Cuillandre","AutoProf -- I. An automated non-parametric light profile pipeline for
  modern galaxy surveys","18 pages, 20 figures, 1 table, published in MNRAS, latest version
  includes an expanded section on Fourier perturbed ellipses and complies with
  MNRAS editorial updates",,"10.1093/mnras/stab2709",,"astro-ph.GA astro-ph.IM","http://creativecommons.org/licenses/by/4.0/","  We present an automated non-parametric light profile extraction pipeline
called AutoProf. All steps for extracting surface brightness (SB) profiles are
included in AutoProf, allowing streamlined analyses of galaxy images. AutoProf
improves upon previous non-parametric ellipse fitting implementations with
fit-stabilization procedures adapted from machine learning techniques.
Additional advanced analysis methods are included in the flexible pipeline for
the extraction of alternative brightness profiles (along radial or axial
slices), smooth axisymmetric models, and the implementation of decision trees
for arbitrarily complex pipelines. Detailed comparisons with widely used
photometry algorithms (photutils, XVISTA, and GALFIT) are presented. These
comparisons rely on a large collection of late-type galaxy images from the
PROBES survey. The direct comparison of SB profiles shows that AutoProf can
reliably extract fainter isophotes than other methods on the same images,
typically by >2 mag/arcsec^2. Contrasting non-parametric elliptical isophote
fitting with simple parametric models also shows that two-component fits (e.g.,
S\'ersic plus exponential) are insufficient to describe late-type galaxies with
high fidelity. It is established that elliptical isophote fitting, and in
particular AutoProf, is ideally suited for a broad range of automated isophotal
analysis tasks. AutoProf is freely available to the community at:
https://github.com/ConnorStoneAstro/AutoProf
","[{""version"":""v1"",""created"":""Fri, 25 Jun 2021 18:00:00 GMT""},{""version"":""v2"",""created"":""Thu, 7 Oct 2021 18:00:00 GMT""}]","2021-10-11"
"2106.13810","Jessie Hirtenstein","Jessie Hirtenstein, Tucker Jones, Ryan L. Sanders, Crystal L. Martin,
  M. C. Cooper, Gabriel Brammer, Tommaso Treu, Kasper Schmidt, Alice Shapley","Disentangling the physical origin of emission line ratio offsets at high
  redshift with spatially resolved spectroscopy","27 pages, 26 figures. Accepted to ApJ",,"10.3847/1538-4357/ac1d52",,"astro-ph.GA","http://arxiv.org/licenses/nonexclusive-distrib/1.0/","  We present spatially resolved Hubble Space Telescope grism spectroscopy of 15
galaxies at $z\sim0.8$ drawn from the DEEP2 survey. We analyze H$\alpha$+[N
II], [S II] and [S III] emission on kpc scales to explore which mechanisms are
powering emission lines at high redshifts, testing which processes may be
responsible for the well-known offset of high redshift galaxies from the
$z\sim0$ locus in the [O III]/H$\beta$ versus [N II]/H$\alpha$ BPT
(Baldwin-Phillips-Terlevich) excitation diagram. We study spatially resolved
emission line maps to examine evidence for active galactic nuclei (AGN),
shocks, diffuse ionized gas (DIG), or escaping ionizing radiation, all of which
may contribute to the BPT offsets observed in our sample. We do not find
significant evidence of AGN in our sample and quantify that, on average, AGN
would need to contribute $\sim$25% of the H$\alpha$ flux in the central
resolution element in order to cause the observed BPT offsets. We find weak
($2\sigma$) evidence of DIG emission at low surface brightnesses, yielding an
implied total DIG emission fraction of $\sim$20%, which is not significant
enough to be the dominant emission line driver in our sample. In general we
find that the observed emission is dominated by star forming H II regions. We
discuss trends with demographic properties and the possible role of
$\alpha$-enhanced abundance patterns in the emission spectra of high redshift
galaxies. Our results indicate that photo-ionization modeling with stellar
population synthesis inputs is a valid tool to explore the specific star
formation properties which may cause BPT offsets, to be explored in future
work.
","[{""version"":""v1"",""created"":""Fri, 25 Jun 2021 18:00:01 GMT""},{""version"":""v2"",""created"":""Tue, 17 Aug 2021 21:23:06 GMT""}]","2021-11-24"
"2106.13811","Georgios K. Karananas Dr.","Georgios K. Karananas, Mikhail Shaposhnikov, Andrey Shkerin, Sebastian
  Zell","Matter matters in Einstein-Cartan gravity","Journal version---discussion extended, typos corrected, references
  added","Phys. Rev. D 104, 064036 (2021)","10.1103/PhysRevD.104.064036","LMU-ASC 18/21, FTPI-MINN-21-10, UMN-TH-4017/21","hep-th gr-qc hep-ph","http://arxiv.org/licenses/nonexclusive-distrib/1.0/","  We study scalar, fermionic and gauge fields coupled nonminimally to gravity
in the Einstein-Cartan formulation. We construct a wide class of models with
nondynamical torsion whose gravitational spectra comprise only the massless
graviton. Eliminating non-propagating degrees of freedom, we derive an
equivalent theory in the metric formulation of gravity. It features contact
interactions of a certain form between and among the matter and gauge currents.
We also discuss briefly the inclusion of curvature-squared terms.
","[{""version"":""v1"",""created"":""Fri, 25 Jun 2021 18:00:01 GMT""},{""version"":""v2"",""created"":""Tue, 21 Sep 2021 16:21:04 GMT""}]","2021-09-22"
"2106.13812","Thomas Sedgwick","Thomas M. Sedgwick, Ivan K. Baldry, Philip A. James, Sugata Kaviraj
  and Garreth Martin","The Star Formation Rates of Elliptical Galaxies from Core-Collapse
  Supernovae","15 pages, 9 figures, submitted to MNRAS",,,,"astro-ph.GA","http://arxiv.org/licenses/nonexclusive-distrib/1.0/","  The level of star formation in elliptical galaxies is poorly constrained, due
to difficulties in quantifying the contamination of flux-based estimates of
star formation from unrelated phenomena, such as AGN and old stellar
populations. We here utilise core-collapse supernovae (CCSNe) as unambiguous
tracers of recent star formation in ellipticals within a cosmic volume. We
firstly isolate a sample of 421 z < 0.2, r < 21.8 mag CCSNe from the SDSS-II
Supernova Survey. We then introduce a Bayesian method of identifying
ellipticals via their colours and morphologies in a manner unbiased by redshift
and yet consistent with manual classification from Galaxy Zoo 1. We find ~ 25 %
of z < 0.2 r < 20 mag galaxies in the Stripe 82 region are ellipticals (~ 28000
galaxies). In total, 36 CCSNe are found to reside in ellipticals. We
demonstrate that such early-types contribute a non-negligible fraction of star
formation to the present-day cosmic budget, at 11.2 $\pm$ 3.1 (stat)
$^{+3.0}_{-4.2}$ (sys) %. Coupling this result with the galaxy stellar mass
function of ellipticals, the mean specific star formation rate (SSFR;
$\overline{S}$) of these systems is derived. The best-fit slope is given by log
($\overline{S}(M)$/yr) = - (0.80 $\pm$ 0.59) log ($M/10^{10.5}\rm{M}_{\odot}$)
- 10.83 $\pm$ 0.18. The mean SSFR for all log ($M/\rm{M}_{\odot}$) > 10.0
ellipticals is found to be $\overline{S} = 9.2 \pm 2.4$ (stat) $^{+2.7}_{-2.3}$
(sys) $\times 10^{-12}$ yr$^{-1}$, which is consistent with recent estimates
via SED-fitting, and is 11.8 $\pm$ 3.7 (stat) $^{+3.5}_{-2.9}$ (sys) % of the
mean SSFR level on the main sequence as also derived from CCSNe. We find the
median optical spectrum of elliptical CCSN hosts is statistically consistent
with that of a control sample of ellipticals that do not host CCSNe, implying
that these SN-derived results are well-representative of the total low-z
elliptical population.
","[{""version"":""v1"",""created"":""Fri, 25 Jun 2021 18:00:02 GMT""}]","2021-06-29"
"2106.13813","Steven Finkelstein","Steven L. Finkelstein (UT Austin), Micaela Bagley (UT Austin), Mimi
  Song (UMass Amherst), Rebecca Larson (UT Austin), Casey Papovich (TAMU), Mark
  Dickinson (NOIRLab), Keely Finkelstein (UT Austin), Anton M. Koekemoer
  (STScI), Norbert Pirzkal (STScI), Rachel S. Somerville (CCA), L. Y. Aaron
  Yung (NASA GSFC), Peter Behroozi (Arizona), Harry Ferguson (STScI), Mauro
  Giavalisco (UMass Amherst), Norman Grogin (STScI), Nimish Hathi (STScI),
  Taylor Hutchison (TAMU), Intae Jung (NASA GSFC), Dale Kocevski (Colby),
  Lalitwadee Kawinwanichakij (Kavli IPMU), Sofia Rojas-Ruiz (MPIA), Russell
  Ryan Jr. (STScI), Gregory F. Snyder (STScI) and Sandro Tacchella (Harvard
  CfA)","A Census of the Bright z=8.5-11 Universe with the Hubble and Spitzer
  Space Telescopes in the CANDELS Fields","47 figures, 25 pages, 10 tables, Accepted to the Astrophysical
  Journal. Photometric catalogs available via email request to lead author",,"10.3847/1538-4357/ac3aed",,"astro-ph.GA","http://arxiv.org/licenses/nonexclusive-distrib/1.0/","  We present the results from a new search for candidate galaxies at z ~ 8.5-11
discovered over the 850 arcmin^2 area probed by the Cosmic Assembly
Near-Infrared Deep Extragalactic Legacy Survey (CANDELS). We use a photometric
redshift selection including both Hubble and Spitzer Space Telescope photometry
to robustly identify galaxies in this epoch at F160W < 26.6. We use a detailed
vetting procedure, including screening for persistence, stellar contamination,
inclusion of ground-based imaging, and followup space-based imaging to build a
robust sample of 11 candidate galaxies, three presented here for the first
time. The inclusion of Spitzer/IRAC photometry in the selection process reduces
contamination, and yields more robust redshift estimates than Hubble alone. We
constrain the evolution of the rest-frame ultraviolet luminosity function via a
new method of calculating the observed number densities without choosing a
prior magnitude bin size. We find that the abundance at our brightest probed
luminosities (M_UV=-22.3) is consistent with predictions from simulations which
assume that galaxies in this epoch have gas depletion times at least as short
as those in nearby starburst galaxies. Due to large Poisson and cosmic variance
uncertainties we cannot conclusively rule out either a smooth evolution of the
luminosity function continued from z=4-8, or an accelerate decline at z > 8. We
calculate that the presence of seven galaxies in a single field (EGS) is an
outlier at the 2-sigma significance level, implying the discovery of a
significant overdensity. These scenarios will be imminently testable to high
confidence within the first year of observations of the James Webb Space
Telescope.
","[{""version"":""v1"",""created"":""Fri, 25 Jun 2021 18:00:02 GMT""},{""version"":""v2"",""created"":""Fri, 19 Nov 2021 21:40:03 GMT""}]","2022-04-06"
"2106.13814","Jacob Biamonte D","E. Campos, D. Rabinovich, V. Akshay, J. Biamonte","Training Saturation in Layerwise Quantum Approximate Optimisation","7 pages; RevTEX","Phys. Rev. A 104, 030401 (2021)","10.1103/PhysRevA.104.L030401",,"quant-ph cond-mat.dis-nn cs.LG","http://creativecommons.org/licenses/by/4.0/","  Quantum Approximate Optimisation (QAOA) is the most studied gate based
variational quantum algorithm today. We train QAOA one layer at a time to
maximize overlap with an $n$ qubit target state. Doing so we discovered that
such training always saturates -- called \textit{training saturation} -- at
some depth $p^*$, meaning that past a certain depth, overlap can not be
improved by adding subsequent layers. We formulate necessary conditions for
saturation. Numerically, we find layerwise QAOA reaches its maximum overlap at
depth $p^*=n$. The addition of coherent dephasing errors to training removes
saturation, recovering robustness to layerwise training. This study sheds new
light on the performance limitations and prospects of QAOA.
","[{""version"":""v1"",""created"":""Fri, 25 Jun 2021 18:00:02 GMT""}]","2021-09-22"
"2106.13815","Myles Mitchell","Myles A. Mitchell (1), C\'esar Hern\'andez-Aguayo (2,3,1), Christian
  Arnold (1), Baojiu Li (1) ((1) ICC, Durham, (2) MPA, Garching, (3) Excellence
  Cluster ORIGINS)","A general framework to test gravity using galaxy clusters IV: Cluster
  and halo properties in DGP gravity","18 pages, 14 figures, 1 table; version accepted for publication in
  MNRAS","MNRAS, 508, 4140 (2021)","10.1093/mnras/stab2817",,"astro-ph.CO","http://arxiv.org/licenses/nonexclusive-distrib/1.0/","  We study and model the properties of galaxy clusters in the normal-branch
Dvali-Gabadadze-Porrati (nDGP) model of gravity, which is representative of a
wide class of theories which exhibit the Vainshtein screening mechanism. Using
the first cosmological simulations which incorporate both full baryonic physics
and nDGP, we find that, despite being efficiently screened within clusters, the
fifth force can raise the temperature of the intra-cluster gas, affecting the
scaling relations between the cluster mass and three observable mass proxies:
the gas temperature, the Compton $Y$-parameter of the Sunyaev-Zel'dovich effect
and the X-ray analogue of the $Y$-parameter. Therefore, unless properly
accounted for, this could lead to biased measurements of the cluster mass in
tests that make use of cluster observations, such as cluster number counts, to
probe gravity. Using a suite of dark-matter-only simulations, which span a wide
range of box sizes and resolutions, and which feature very different strengths
of the fifth force, we also calibrate general fitting formulae which can
reproduce the nDGP halo concentration at percent accuracy for $0\leq z\leq1$,
and halo mass function with $\lesssim3\%$ accuracy at $0\leq z\leq1$
(increasing to $\lesssim5\%$ for $1\leq z\leq 2$), over a halo mass range
spanning four orders of magnitude. Our model for the concentration can be used
for converting between halo mass overdensities and predicting statistics such
as the nonlinear matter power spectrum. The results of this work will form part
of a framework for unbiased constraints of gravity using the data from ongoing
and upcoming cluster surveys.
","[{""version"":""v1"",""created"":""Fri, 25 Jun 2021 18:00:05 GMT""},{""version"":""v2"",""created"":""Mon, 27 Sep 2021 14:30:28 GMT""}]","2021-11-03"
"2106.13816","Anne Ersbak Bang Nielsen","Sourav Manna, Callum W. Duncan, Carrie A. Weidner, Jacob F. Sherson,
  Anne E. B. Nielsen","Anyon braiding on a fractal lattice with a local Hamiltonian","6 pages, 2 figures, accepted version","Phys. Rev. A 105, L021302 (2022); Phys. Rev. A 107, 069901 (2023)","10.1103/PhysRevA.105.L021302; 10.1103/PhysRevA.107.069901",,"cond-mat.quant-gas cond-mat.str-el","http://arxiv.org/licenses/nonexclusive-distrib/1.0/","  There is a growing interest in searching for topology in fractal dimensions
with the aim of finding different properties and advantages compared to the
integer dimensional case. Here, we construct a local Hamiltonian on a fractal
lattice whose ground state exhibits topological braiding properties. The
fractal lattice is obtained from a second generation Sierpinski carpet with
Hausdorff dimension 1.89. We use local potentials to trap and exchange anyons
in the model, and the numerically obtained results for the exchange statistics
of the anyons are close to the ideal statistics for quasiholes in a bosonic
Laughlin state at half filling. For the considered system size, the energy gap
is about three times larger for the fractal lattice than for a two-dimensional
square lattice, and we find that the braiding results obtained on the fractal
lattice are more robust against disorder. We propose a scheme to implement both
fractal lattices and our proposed local Hamiltonian with ultracold atoms in
optical lattices.
","[{""version"":""v1"",""created"":""Fri, 25 Jun 2021 18:00:07 GMT""},{""version"":""v2"",""created"":""Sun, 13 Feb 2022 10:48:37 GMT""}]","2023-06-05"
"2106.13817","Fernando Iemini","Leonardo da Silva Souza, Gonzalo Manzano, Rosario Fazio, Fernando
  Iemini","Collective effects on the performance and stability of quantum heat
  engines","20 pages, 10 figures","Phys. Rev. E 106, 014143 (2022)","10.1103/PhysRevE.106.014143",,"quant-ph cond-mat.stat-mech","http://arxiv.org/licenses/nonexclusive-distrib/1.0/","  Recent predictions for quantum-mechanical enhancements in the operation of
small heat engines have raised renewed interest in their study from both a
fundamental perspective and in view of applications. One essential question is
whether collective effects may help to carry enhancements over larger scales,
when increasing the number of systems composing the working substance of the
engine. Such enhancements may consider not only power and efficiency, that is
its performance, but, additionally, its constancy, i.e. the stability of the
engine with respect to unavoidable environmental fluctuations. We explore this
issue by introducing a many-body quantum heat engine model composed by spin
pairs working in continuous operation. We study how power, efficiency and
constancy scale with the number of spins composing the engine and introduce a
well-defined macroscopic limit where analytical expressions are obtained. Our
results predict power enhancements, both in finite-size and macroscopic cases,
for a broad range of system parameters and temperatures, without compromising
the engine efficiency, accompanied by coherence-enhanced constancy for finite
sizes. We discuss these quantities in connection to Thermodynamic Uncertainty
Relations (TUR).
","[{""version"":""v1"",""created"":""Fri, 25 Jun 2021 18:00:07 GMT""},{""version"":""v2"",""created"":""Tue, 12 Apr 2022 18:25:03 GMT""}]","2022-07-29"
"2106.13818","Matthew Lapa","Matthew F. Lapa","Momentum occupation number bounds for interacting fermions","5 + 6 pages",,,,"cond-mat.str-el math-ph math.MP","http://arxiv.org/licenses/nonexclusive-distrib/1.0/","  We derive rigorous bounds on the average momentum occupation numbers $\langle
n_{\mathbf{k}\sigma}\rangle$ in the Hubbard and Kondo models in the ground
state and at non-zero temperature ($T>0$) in the grand canonical ensemble. For
the Hubbard model with $T>0$ our bound proves that, when interaction strength
$\ll k_B T\ll$ Fermi energy, $\langle n_{\mathbf{k}\sigma}\rangle$ is
guaranteed to be close to its value in a low temperature free fermion system.
For the Kondo model with any $T>0$ our bound proves that $\langle
n_{\mathbf{k}\sigma}\rangle$ tends to its non-interacting value in the infinite
volume limit. In the ground state case our bounds instead show that $\langle
n_{\mathbf{k}\sigma}\rangle$ approaches its non-interacting value as
$\mathbf{k}$ moves away from a certain surface in momentum space. For the
Hubbard model at half-filling on a bipartite lattice, this surface coincides
with the non-interacting Fermi surface. In the Supplemental Material we extend
our results to some generalized versions of the Hubbard and Kondo models. Our
proofs use the Fermi statistics of the particles in a fundamental way.
","[{""version"":""v1"",""created"":""Fri, 25 Jun 2021 18:00:11 GMT""}]","2021-06-29"
"2106.13819","Alexandre Toubiana","Alexandre Toubiana, Kaze W.K. Wong, Stanislav Babak, Enrico Barausse,
  Emanuele Berti, Jonathan R. Gair, Sylvain Marsat, Stephen R. Taylor","Discriminating between different scenarios for the formation and
  evolution of massive black holes with LISA","Matches PRD version, minor changes",,"10.1103/PhysRevD.104.083027",,"gr-qc astro-ph.GA astro-ph.HE","http://arxiv.org/licenses/nonexclusive-distrib/1.0/","  Electromagnetic observations have provided strong evidence for the existence
of massive black holes in the center of galaxies, but their origin is still
poorly known. Different scenarios for the formation and evolution of massive
black holes lead to different predictions for their properties and merger
rates. LISA observations of coalescing massive black hole binaries could be
used to reverse engineer the problem and shed light on these mechanisms. In
this paper, we introduce a pipeline based on hierarchical Bayesian inference to
infer the mixing fraction between different theoretical models by comparing
them to LISA observations of massive black hole mergers. By testing this
pipeline against simulated LISA data, we show that it allows us to accurately
infer the properties of the massive black hole population as long as our
theoretical models provide a reliable description of the Universe. We also show
that measurement errors, including both instrumental noise and weak lensing
errors, have little impact on the inference.
","[{""version"":""v1"",""created"":""Fri, 25 Jun 2021 18:00:12 GMT""},{""version"":""v2"",""created"":""Thu, 28 Oct 2021 16:43:37 GMT""}]","2021-11-03"
"2106.13820","Theodore Brennan","T. Daniel Brennan","Index-like Theorem for Massless Fermions in Spherically Symmetric
  Monopole Backgrounds","30 pages, no figures",,"10.1007/JHEP03(2022)095",,"hep-th math.DG","http://creativecommons.org/licenses/by/4.0/","  In this paper we study massless fermions coupled to spherically symmetric
$SU(N)$ monopoles without Yukawa couplings between the Higgs and fermion
fields. The corresponding Dirac operator is not Fredholm and the associated
eigenfunctions are not $L^2$-normalizable. Here we derive a formula for the
dimension of the plane-wave normalizable kernel of such a Dirac operator for
fermions of any representation of $SU(N)$ in the presence of any spherically
symmetric monopole background. Notably, our results also apply to fermions
coupled to monopoles that preserve non-abelian gauge symmetry.
","[{""version"":""v1"",""created"":""Fri, 25 Jun 2021 18:00:12 GMT""},{""version"":""v2"",""created"":""Thu, 30 Sep 2021 23:47:40 GMT""},{""version"":""v3"",""created"":""Mon, 27 Dec 2021 21:30:58 GMT""}]","2022-03-30"
