"2106.13888","Katia Colaneri","Katia Colaneri, Alessandra Cretarola, Benedetta Salterini","Optimal investment and proportional reinsurance in a regime-switching
  market model under forward preferences","32 pages, 6 figures, 1 table",,,,"q-fin.PM","http://arxiv.org/licenses/nonexclusive-distrib/1.0/","  In this paper we study the optimal investment and reinsurance problem of an
insurance company whose investment preferences are described via a forward
dynamic exponential utility in a regime-switching market model. Financial and
actuarial frameworks are dependent since stock prices and insurance claims vary
according to a common factor given by a continuous time finite state Markov
chain. We construct the value function and we prove that it is a forward
dynamic utility. Then, we characterize the investment strategy and the optimal
proportional level of reinsurance. We also perform numerical experiments and
provide sensitivity analyses with respect to some model parameters.
","[{""version"":""v1"",""created"":""Fri, 25 Jun 2021 21:28:41 GMT""}]","2021-06-29"
"2106.13889","Benedetta Flebus","B. Flebus and A. H. MacDonald","Charged Defects and Phonon Hall Effects in Ionic Crystals",,,"10.1103/PhysRevB.105.L220301",,"cond-mat.mes-hall","http://arxiv.org/licenses/nonexclusive-distrib/1.0/","  It has been known for decades that a magnetic field can deflect phonons as
they flow in response to a thermal gradient, producing a thermal Hall effect.
Several recent experiments have revealed ratios of the phonon Hall conductivity
to the phonon longitudinal conductivity in oxide dielectrics that are larger
than $10^{-3}$ when phonon mean-free-paths exceed phonon wavelengths. At the
same time $\kappa_{H}/\kappa_{L}$ is not strongly temperature dependent. We
argue that these two properties together imply a mechanism related to phonon
scattering from defects that break time-reversal symmetry, and we show that
Lorentz forces acting on charged defects produce substantial skew-scattering
amplitudes, and related thermal Hall effects that are consistent with recent
observations.
","[{""version"":""v1"",""created"":""Fri, 25 Jun 2021 21:30:53 GMT""},{""version"":""v2"",""created"":""Tue, 29 Jun 2021 01:01:23 GMT""},{""version"":""v3"",""created"":""Mon, 26 Jul 2021 19:48:05 GMT""}]","2022-06-15"
"2106.13890","Gianmarco Pinton","Danai Eleni Soulioti, Francisco Santibanez, Gianmarco Pinton","Deconstruction and reconstruction of image-degrading effects in the
  human abdomen using Fullwave: phase aberration, multiple reverberation, and
  trailing reverberation",,,,,"physics.med-ph eess.IV","http://creativecommons.org/licenses/by/4.0/","  Ultrasound image degradation in the human body is complex and occurs due to
the distortion of the wave as it propagates to and from the target. Here, we
establish a simulation based framework that deconstructs the sources of image
degradation into a separable parameter space that includes phase aberration
from speed variation, multiple reverberations, and trailing reverberation.
These separable parameters are then used to reconstruct images with known and
independently modulable amounts of degradation using methods that depend on the
additive or multiplicative nature of the degradation. Experimental measurements
and Fullwave simulations in the human abdomen demonstrate this calibrated
process in abdominal imaging by matching relevant imaging metrics such as phase
aberration, reverberation strength, speckle brightness and coherence length.
Applications of the reconstruction technique are illustrated for beamforming
strategies (phase aberration correction, spatial coherence imaging), in a
standard abdominal environment, as well as in impedance ranges much higher than
those naturally occurring in the body.
","[{""version"":""v1"",""created"":""Fri, 25 Jun 2021 21:33:53 GMT""}]","2021-06-29"
"2106.13891","Taher Ahmed Ghaleb","Rongqi Pan, Mojtaba Bagherzadeh, Taher A. Ghaleb, and Lionel Briand","Test Case Selection and Prioritization Using Machine Learning: A
  Systematic Literature Review",,"Empirical Software Engineering (EMSE). (2021) 1-34","10.1007/s10664-021-10066-6",,"cs.SE","http://arxiv.org/licenses/nonexclusive-distrib/1.0/","  Regression testing is an essential activity to assure that software code
changes do not adversely affect existing functionalities. With the wide
adoption of Continuous Integration (CI) in software projects, which increases
the frequency of running software builds, running all tests can be
time-consuming and resource-intensive. To alleviate that problem, Test case
Selection and Prioritization (TSP) techniques have been proposed to improve
regression testing by selecting and prioritizing test cases in order to provide
early feedback to developers. In recent years, researchers have relied on
Machine Learning (ML) techniques to achieve effective TSP (ML-based TSP). Such
techniques help combine information about test cases, from partial and
imperfect sources, into accurate prediction models. This work conducts a
systematic literature review focused on ML-based TSP techniques, aiming to
perform an in-depth analysis of the state of the art, thus gaining insights
regarding future avenues of research. To that end, we analyze 29 primary
studies published from 2006 to 2020, which have been identified through a
systematic and documented process. This paper addresses five research questions
addressing variations in ML-based TSP techniques and feature sets for training
and testing ML models, alternative metrics used for evaluating the techniques,
the performance of techniques, and the reproducibility of the published
studies. We summarize the results related to our research questions in a
high-level summary that can be used as a taxonomy for classifying future TSP
studies.
","[{""version"":""v1"",""created"":""Fri, 25 Jun 2021 21:35:02 GMT""},{""version"":""v2"",""created"":""Tue, 5 Oct 2021 19:09:38 GMT""}]","2022-09-07"
"2106.13892","Kevin Vynck","Kevin Vynck, Romain Pierrat, R\'emi Carminati, Luis S. Froufe-P\'erez,
  Frank Scheffold, Riccardo Sapienza, Silvia Vignolini, Juan Jos\'e S\'aenz","Light in correlated disordered media","Submitted to Reviews of Modern Physics. Feedbacks are welcome",,,,"physics.optics cond-mat.dis-nn cond-mat.mes-hall cond-mat.soft","http://creativecommons.org/licenses/by/4.0/","  The optics of correlated disordered media is a fascinating research topic
emerging at the interface between the physics of waves in complex media and
nanophotonics. Inspired by photonic structures in nature and enabled by
advances in nanofabrication processes, recent investigations have unveiled how
the design of structural correlations down to the subwavelength scale could be
exploited to control the scattering, transport and localization of light in
matter. From optical transparency to superdiffusive light transport to photonic
gaps, the optics of correlated disordered media challenges our physical
intuition and offers new perspectives for applications. This article reviews
the theoretical foundations, state-of-the-art experimental techniques and major
achievements in the study of light interaction with correlated disorder,
covering a wide range of systems -- from short-range correlated photonic
liquids, to L\'evy glasses containing fractal heterogeneities, to hyperuniform
disordered photonic materials. The mechanisms underlying light scattering and
transport phenomena are elucidated on the basis of rigorous theoretical
arguments. We overview the exciting ongoing research on mesoscopic phenomena,
such as transport phase transitions and speckle statistics, and the current
development of disorder engineering for applications such as light-energy
management and visual appearance design. Special efforts are finally made to
identify the main theoretical and experimental challenges to address in the
near future.
","[{""version"":""v1"",""created"":""Fri, 25 Jun 2021 21:41:07 GMT""}]","2021-06-29"
"2106.13893","Francisco Lobo","Khadije Jafarzade, Mahdi Kord Zangeneh, Francisco S. N. Lobo","Observational optical constraints of regular black holes","9 pages, 8 figures. V2: 11 pages, 8 figures. Title changed, analysis
  corrected and extended, second solution added","Annals Phys. 446 (2022) 169126","10.1016/j.aop.2022.169126",,"gr-qc astro-ph.HE hep-th","http://arxiv.org/licenses/nonexclusive-distrib/1.0/","  In this work, we consider two recently introduced novel regular black hole
solutions and investigate the circular null geodesics to find the connection
between the photon sphere, the horizon and the black hole shadow radii. We also
study the energy emission rate for these solutions and discuss how the
parameters of models affect the emission of particles around the black holes.
Furthermore, we compare the resulting shadow of these regular black holes with
observational data of the Event Horizon Telescope and find the allowed regions
of the model parameters for which the obtained shadow is consistent with the
data. Finally, we employ the correspondence between the quasinormal modes in
the eikonal limit and shadow radius to study the scalar field perturbations in
these backgrounds.
","[{""version"":""v1"",""created"":""Fri, 25 Jun 2021 21:44:43 GMT""},{""version"":""v2"",""created"":""Sun, 8 Aug 2021 18:22:25 GMT""}]","2022-11-01"
"2106.13894","Kevin Shu","Kevin Shu","Extreme Nonnegative Quadratics over Stanley Reisner Varieties",,,,,"math.AG","http://arxiv.org/licenses/nonexclusive-distrib/1.0/","  We consider the convex geometry of the cone of nonnegative quadratics over
Stanley-Reisner varieties. Stanley-Reisner varieties (which are unions of
coordinate planes) are amongst the simplest real projective varieties, so this
is potentially a starting point that can generalize to more complicated real
projective varieties. This subject has some suprising connections to algebraic
topology and category theory, which we exploit heavily in our work.
  These questions are also valuable in applied math, because they directly
translate to questions about positive semidefinite (PSD) matrices. In
particular, this relates to a long line of work concerning the extent to which
it is possible to approximately check that a matrix is PSD by checking that
some principle submatrices are PSD, or to check if a partial matrix can be
approximately completed to full PSD matrix.
  We systematize both these practical and theoretical questions using a
framework based on algebraic topology, category theory, and convex geometry. As
applications of this framework we are able to classify the extreme nonnegative
quadratics over many Stanley-Reisner varieties. We plan to follow these
structural results with a paper that is more focused on quantitative questions
about PSD matrix completion, which have applications in sparse semidefinite
programming.
","[{""version"":""v1"",""created"":""Fri, 25 Jun 2021 21:45:57 GMT""},{""version"":""v2"",""created"":""Wed, 30 Jun 2021 05:06:26 GMT""}]","2021-07-01"
"2106.13895","Kaushik Roy","Kaushik Roy and Qi Zhang and Manas Gaur and Amit Sheth","Knowledge Infused Policy Gradients with Upper Confidence Bound for
  Relational Bandits","Accepted for publication in the research track at ECML-PKDD 2021",,,,"cs.LG cs.AI","http://creativecommons.org/licenses/by/4.0/","  Contextual Bandits find important use cases in various real-life scenarios
such as online advertising, recommendation systems, healthcare, etc. However,
most of the algorithms use flat feature vectors to represent context whereas,
in the real world, there is a varying number of objects and relations among
them to model in the context. For example, in a music recommendation system,
the user context contains what music they listen to, which artists create this
music, the artist albums, etc. Adding richer relational context representations
also introduces a much larger context space making exploration-exploitation
harder. To improve the efficiency of exploration-exploitation knowledge about
the context can be infused to guide the exploration-exploitation strategy.
Relational context representations allow a natural way for humans to specify
knowledge owing to their descriptive nature. We propose an adaptation of
Knowledge Infused Policy Gradients to the Contextual Bandit setting and a novel
Knowledge Infused Policy Gradients Upper Confidence Bound algorithm and perform
an experimental analysis of a simulated music recommendation dataset and
various real-life datasets where expert knowledge can drastically reduce the
total regret and where it cannot.
","[{""version"":""v1"",""created"":""Fri, 25 Jun 2021 21:54:08 GMT""}]","2021-06-29"
"2106.13896","Alireza Khodaei","Alireza Khodaei and Jitender Deogun","Optical MIMO Communication Using Holographic Spectral Multiplexing of
  Pulsed Ultrashort Laser","Needs more improvement",,,,"cs.NI eess.SP","http://creativecommons.org/licenses/by-nc-nd/4.0/","  In this paper, we introduce Holographic Spectral Multiplexing (HSM) as a
novel technique to enable multiple-input multiple-output (MIMO) communication
in optical networks. HSM uses the spectral space of ultrashort laser pulses to
create line codes in the form of 2D holograms. The pulse processing is
performed in the temporal Fourier domain by spatially dispersing the pulse
frequency components in a spectral processing device (SPD). The 2D holograms
are composed of the patterns of intensity disparities that an SLM inscribes on
the spectrally-decomposed Fourier plane of the pulse. The holographic line
codes defined in this way transform the ultrashort laser pulses into
high-entropy data symbols, hence, enhance the communication's spectral
efficiency. Unlike conventional optical multiplexing schemes (e.g., TDM, WDM,
or SDM), HSM does not physically or abstractly separate the communication
propagation space into subchannels. Rather, HSM realizes a MIMO communication
paradigm by allowing the photonic waves under the pulse envelope to propagate
in the same space so they scatter and interfere by chromatic dispersion. This
allows HSM to form beams between the pixels of SLM at the sender and receiver
sides and optimize the beam to adapt to channel scattering situations. In this
way, HSM delivers a rate gain that in the best case exponentially increases the
information rate of communication.
","[{""version"":""v1"",""created"":""Fri, 25 Jun 2021 21:57:55 GMT""},{""version"":""v2"",""created"":""Wed, 2 Feb 2022 17:39:58 GMT""}]","2022-02-03"
"2106.13897","Yatin Dandi","Yatin Dandi, Luis Barba, Martin Jaggi","Implicit Gradient Alignment in Distributed and Federated Learning","AAAI Conference on Artificial Intelligence, 2022",,,,"cs.LG stat.ML","http://arxiv.org/licenses/nonexclusive-distrib/1.0/","  A major obstacle to achieving global convergence in distributed and federated
learning is the misalignment of gradients across clients, or mini-batches due
to heterogeneity and stochasticity of the distributed data. In this work, we
show that data heterogeneity can in fact be exploited to improve generalization
performance through implicit regularization. One way to alleviate the effects
of heterogeneity is to encourage the alignment of gradients across different
clients throughout training. Our analysis reveals that this goal can be
accomplished by utilizing the right optimization method that replicates the
implicit regularization effect of SGD, leading to gradient alignment as well as
improvements in test accuracies. Since the existence of this regularization in
SGD completely relies on the sequential use of different mini-batches during
training, it is inherently absent when training with large mini-batches. To
obtain the generalization benefits of this regularization while increasing
parallelism, we propose a novel GradAlign algorithm that induces the same
implicit regularization while allowing the use of arbitrarily large batches in
each update. We experimentally validate the benefits of our algorithm in
different distributed and federated learning settings.
","[{""version"":""v1"",""created"":""Fri, 25 Jun 2021 22:01:35 GMT""},{""version"":""v2"",""created"":""Fri, 29 Oct 2021 19:33:02 GMT""},{""version"":""v3"",""created"":""Mon, 13 Dec 2021 00:18:10 GMT""}]","2021-12-14"
"2106.13898","Ramin Hasani","Ramin Hasani, Mathias Lechner, Alexander Amini, Lucas Liebenwein,
  Aaron Ray, Max Tschaikowski, Gerald Teschl, Daniela Rus","Closed-form Continuous-time Neural Models","40 pages","Nature Machine Intelligence 4, 992--1003 (2022)","10.1038/s42256-022-00556-7",,"cs.LG cs.AI cs.NE cs.RO math.DS","http://creativecommons.org/licenses/by-nc-sa/4.0/","  Continuous-time neural processes are performant sequential decision-makers
that are built by differential equations (DE). However, their expressive power
when they are deployed on computers is bottlenecked by numerical DE solvers.
This limitation has significantly slowed down the scaling and understanding of
numerous natural physical phenomena such as the dynamics of nervous systems.
Ideally, we would circumvent this bottleneck by solving the given dynamical
system in closed form. This is known to be intractable in general. Here, we
show it is possible to closely approximate the interaction between neurons and
synapses -- the building blocks of natural and artificial neural networks --
constructed by liquid time-constant networks (LTCs) efficiently in closed-form.
To this end, we compute a tightly-bounded approximation of the solution of an
integral appearing in LTCs' dynamics, that has had no known closed-form
solution so far. This closed-form solution substantially impacts the design of
continuous-time and continuous-depth neural models; for instance, since time
appears explicitly in closed-form, the formulation relaxes the need for complex
numerical solvers. Consequently, we obtain models that are between one and five
orders of magnitude faster in training and inference compared to differential
equation-based counterparts. More importantly, in contrast to ODE-based
continuous networks, closed-form networks can scale remarkably well compared to
other deep learning instances. Lastly, as these models are derived from liquid
networks, they show remarkable performance in time series modeling, compared to
advanced recurrent models.
","[{""version"":""v1"",""created"":""Fri, 25 Jun 2021 22:08:51 GMT""},{""version"":""v2"",""created"":""Wed, 2 Mar 2022 20:24:33 GMT""}]","2023-02-22"
"2106.13899","Joao Monteiro","Joao Monteiro, Xavier Gibert, Jianqiao Feng, Vincent Dumoulin,
  Dar-Shyang Lee","Domain Conditional Predictors for Domain Adaptation","Part of the pre-registration workshop at NeurIPS 2020:
  https://preregister.science/",,,,"cs.LG cs.AI cs.CV","http://arxiv.org/licenses/nonexclusive-distrib/1.0/","  Learning guarantees often rely on assumptions of i.i.d. data, which will
likely be violated in practice once predictors are deployed to perform
real-world tasks. Domain adaptation approaches thus appeared as a useful
framework yielding extra flexibility in that distinct train and test data
distributions are supported, provided that other assumptions are satisfied such
as covariate shift, which expects the conditional distributions over labels to
be independent of the underlying data distribution. Several approaches were
introduced in order to induce generalization across varying train and test data
sources, and those often rely on the general idea of domain-invariance, in such
a way that the data-generating distributions are to be disregarded by the
prediction model. In this contribution, we tackle the problem of generalizing
across data sources by approaching it from the opposite direction: we consider
a conditional modeling approach in which predictions, in addition to being
dependent on the input data, use information relative to the underlying
data-generating distribution. For instance, the model has an explicit mechanism
to adapt to changing environments and/or new data sources. We argue that such
an approach is more generally applicable than current domain adaptation methods
since it does not require extra assumptions such as covariate shift and further
yields simpler training algorithms that avoid a common source of training
instabilities caused by minimax formulations, often employed in
domain-invariant methods.
","[{""version"":""v1"",""created"":""Fri, 25 Jun 2021 22:15:54 GMT""}]","2021-06-29"
"2106.13900","Eman AlOmar","Eman Abdullah AlOmar and Mohamed Wiem Mkaouer and Christian Newman and
  Ali Ouni","On Preserving the Behavior in Software Refactoring: A Systematic Mapping
  Study",,,,,"cs.SE","http://creativecommons.org/publicdomain/zero/1.0/","  Context: Refactoring is the art of modifying the design of a system without
altering its behavior. The idea is to reorganize variables, classes and methods
to facilitate their future adaptations and comprehension. As the concept of
behavior preservation is fundamental for refactoring, several studies, using
formal verification, language transformation and dynamic analysis, have been
proposed to monitor the execution of refactoring operations and their impact on
the program semantics. However, there is no existing study that examines the
available behavior preservation strategies for each refactoring operation.
  Objective: This paper identifies behavior preservation approaches in the
research literature.
  Method: We conduct, in this paper, a systematic mapping study, to capture all
existing behavior preservation approaches that we classify based on several
criteria including their methodology, applicability, and their degree of
automation.
  Results: The results indicate that several behavior preservation approaches
have been proposed in the literature. The approaches vary between using
formalisms and techniques, developing automatic refactoring safety tools, and
performing a manual analysis of the source code.
  Conclusion: Our taxonomy reveals that there exist some types of refactoring
operations whose behavior preservation is under-researched. Our classification
also indicates that several possible strategies can be combined to better
detect any violation of the program semantics.
","[{""version"":""v1"",""created"":""Fri, 25 Jun 2021 22:29:49 GMT""},{""version"":""v2"",""created"":""Wed, 21 Jul 2021 21:36:22 GMT""}]","2021-07-23"
"2106.13901","Ramya Srinivasan","Ramya Srinivasan and Devi Parikh","Building Bridges: Generative Artworks to Explore AI Ethics",,"CVPR Workshop on Ethical Considerations in Creative Applications
  of Computer Vision, 2022",,,"cs.CY cs.AI","http://creativecommons.org/licenses/by-nc-nd/4.0/","  In recent years, there has been an increased emphasis on understanding and
mitigating adverse impacts of artificial intelligence (AI) technologies on
society. Across academia, industry, and government bodies, a variety of
endeavours are being pursued towards enhancing AI ethics. A significant
challenge in the design of ethical AI systems is that there are multiple
stakeholders in the AI pipeline, each with their own set of constraints and
interests. These different perspectives are often not understood, due in part
to communication gaps.For example, AI researchers who design and develop AI
models are not necessarily aware of the instability induced in consumers' lives
by the compounded effects of AI decisions. Educating different stakeholders
about their roles and responsibilities in the broader context becomes
necessary. In this position paper, we outline some potential ways in which
generative artworks can play this role by serving as accessible and powerful
educational tools for surfacing different perspectives. We hope to spark
interdisciplinary discussions about computational creativity broadly as a tool
for enhancing AI ethics.
","[{""version"":""v1"",""created"":""Fri, 25 Jun 2021 22:31:55 GMT""}]","2022-05-18"
"2106.13902","Thomas Trogdon","Xiucai Ding and Thomas Trogdon","The conjugate gradient algorithm on a general class of spiked covariance
  matrices",,,,,"math.NA cs.NA math.PR","http://arxiv.org/licenses/nonexclusive-distrib/1.0/","  We consider the conjugate gradient algorithm applied to a general class of
spiked sample covariance matrices. The main result of the paper is that the
norms of the error and residual vectors at any finite step concentrate on
deterministic values determined by orthogonal polynomials with respect to a
deformed Marchenko--Pastur law. The first-order limits and fluctuations are
shown to be universal. Additionally, for the case where the bulk eigenvalues
lie in a single interval we show a stronger universality result in that the
asymptotic rate of convergence of the conjugate gradient algorithm only depends
on the support of the bulk, provided the spikes are well-separated from the
bulk. In particular, this shows that the classical condition number bound for
the conjugate gradient algorithm is pessimistic for spiked matrices.
","[{""version"":""v1"",""created"":""Fri, 25 Jun 2021 22:33:27 GMT""}]","2021-06-29"
