"2106.15864","Sebastian Doliwa","Sebastian Doliwa and Muhammad Ayaz Hussain and Tim Sziburis and
  Ioannis Iossifidis","Biologically Inspired Model for Timed Motion in Robotic Systems",,,,,"cs.RO math.DS","http://creativecommons.org/licenses/by-nc-nd/4.0/","  The goal of this work is the development of a motion model for sequentially
timed movement actions in robotic systems under specific consideration of
temporal stabilization, that is maintaining an approximately constant overall
movement time (isochronous behavior). This is demonstrated both in simulation
and on a physical robotic system for the task of intercepting a moving target
in three-dimensional space. Motivated from humanoid motion, timing plays a
vital role to generate a naturalistic behavior in interaction with the dynamic
environment as well as adaptively planning and executing action sequences
on-line. In biological systems, many of the physiological and anatomical
functions follow a particular level of periodicity and stabilization, which
exhibit a certain extent of resilience against external disturbances. A main
aspect thereof is stabilizing movement timing against limited perturbations.
Especially human arm movement, namely when it is tasked to reach a certain goal
point, pose or configuration, shows a stabilizing behavior. This work
incorporates the utilization of an extended Kalman filter (EKF) which was
implemented to predict the target position while coping with non-linear system
dynamics. The periodicity and temporal stabilization in biological systems was
artificially generated by a Hopf oscillator, yielding a sinusoidal velocity
profile for smooth and repeatable motion.
","[{""version"":""v1"",""created"":""Wed, 30 Jun 2021 07:47:55 GMT""},{""version"":""v2"",""created"":""Thu, 29 Jul 2021 09:38:11 GMT""}]","2021-07-30"
"2106.15865","Sujay Mukhoti","Soham Ghosh and Sujay Mukhoti","Non-parametric generalised newsvendor model",,,,,"stat.ME","http://creativecommons.org/licenses/by/4.0/","  In classical newsvendor model, piece-wise linear shortage and excess costs
are balanced out to determine the optimal order quantity. However, for critical
perishable commodities, severity of the costs may be much more than linear. In
this paper we discuss a generalisation of the newsvendor model with piece-wise
polynomial cost functions to accommodate their severity. In addition, the
stochastic demand has been assumed to follow a completely unknown probability
distribution. Subsequently, non-parametric estimator of the optimal order
quantity has been developed from a random polynomial type estimating equation
using a random sample on demand. Strong consistency of the estimator has been
proven when the true optimal order quantity is unique. The result has been
extended to the case where multiple solutions for optimal order quantity are
available. Probability of existence of the estimated optimal order quantity has
been studied through extensive simulation experiments. Simulation results
indicate that the non-parametric method provides robust yet efficient estimator
of the optimal order quantity in terms of mean square error.
","[{""version"":""v1"",""created"":""Wed, 30 Jun 2021 07:48:57 GMT""}]","2021-07-01"
"2106.15866","Francesco Ferranti","Oded Cats and Francesco Ferranti","Unravelling the Spatial Properties of Individual Mobility Patterns using
  Longitudinal Travel Data",,,,,"physics.soc-ph","http://creativecommons.org/licenses/by/4.0/","  The analysis of longitudinal travel data enables investigating how mobility
patterns vary across the population and identify the spatial properties
thereof. The objective of this study is to identify the extent to which users
explore different parts of the network as well as identify distinctive user
groups in terms of the spatial extent of their mobility patterns. To this end,
we propose two means for representing spatial mobility profiles and clustering
travellers accordingly. We represent users patterns in terms of zonal visiting
frequency profiles and grid-cells spatial extent heatmaps. We apply the
proposed analysis to a large-scale multi-modal mobility data set from the
public transport system in Stockholm, Sweden. We unravel three clusters -
locals, commuters and explorers - that best describe the zonal visiting
frequency and show that their composition varies considerably across users'
place of residence and related demographics. We also identify 18 clusters of
visiting spatial extent which form four groups that follow similar shapes of
travel extent yet oriented in different directions. The approach proposed and
applied in this study could be applied for any longitudinal individual travel
demand data.
","[{""version"":""v1"",""created"":""Wed, 30 Jun 2021 07:49:46 GMT""}]","2021-07-01"
"2106.15867","D\'avid K\'osz\'o","Manfred Droste, Zolt\'an F\""ul\""op, D\'avid K\'osz\'o, Heiko Vogler","Finite-image property of weighted tree automata over past-finite
  monotonic strong bimonoids","42 pages, 4 figures, 1 algorithm",,,,"cs.FL","http://arxiv.org/licenses/nonexclusive-distrib/1.0/","  We consider weighted tree automata over strong bimonoids (for short: wta). A
wta $\mathcal{A}$ has the finite-image property if its recognized weighted tree
language $[\![\mathcal{A}]\!]$ has finite image; moreover, $\mathcal{A}$ has
the preimage property if the preimage under $[\![\mathcal{A}]\!]$ of each
element of the underlying strong bimonoid is a recognizable tree language. For
each wta $\mathcal{A}$ over a past-finite monotonic strong bimonoid we prove
the following results. In terms of $\mathcal{A}$'s structural properties, we
characterize whether it has the finite-image property. We characterize those
past-finite monotonic strong bimonoids such that for each wta $\mathcal{A}$ it
is decidable whether $\mathcal{A}$ has the finite-image property. In
particular, the finite-image property is decidable for wta over past-finite
monotonic semirings. Moreover, we prove that $\mathcal{A}$ has the preimage
property. All our results also hold for weighted string automata.
","[{""version"":""v1"",""created"":""Wed, 30 Jun 2021 07:51:00 GMT""}]","2021-07-01"
"2106.15868","Per R. Leikanger","Per R. Leikanger","Decomposing the Prediction Problem; Autonomous Navigation by neoRL
  Agents","Accepted at A-life 2021",,,,"cs.RO cs.AI","http://arxiv.org/licenses/nonexclusive-distrib/1.0/","  Navigating the world is a fundamental ability for any living entity.
Accomplishing the same degree of freedom in technology has proven to be
difficult. The brain is the only known mechanism capable of voluntary
navigation, making neuroscience our best source of inspiration toward autonomy.
Assuming that state representation is key, we explore the difference in how the
brain and the machine represent the navigational state. Where Reinforcement
Learning (RL) requires a monolithic state representation in accordance with the
Markov property, Neural Representation of Euclidean Space (NRES) reflects
navigational state via distributed activation patterns. We show how
NRES-Oriented RL (neoRL) agents are possible before verifying our theoretical
findings by experiments. Ultimately, neoRL agents are capable of behavior
synthesis across state spaces -- allowing for decomposition of the problem into
smaller spaces, alleviating the curse of dimensionality.
","[{""version"":""v1"",""created"":""Wed, 30 Jun 2021 07:57:36 GMT""}]","2021-07-01"
"2106.15869","Yuhao Huang","Yuhao Huang","Improved Fast Iterative Algorithm for Eikonal Equation for GPU Computing","18 pages, 14 figures",,,,"math.NA cs.NA","http://creativecommons.org/licenses/by/4.0/","  In this paper we propose an improved fast iterative method to solve the
Eikonal equation, which can be implemented in parallel. We improve the fast
iterative method for Eikonal equation in two novel ways, in the value update
and in the error correction. The new value update is very similar to the fast
iterative method in that we selectively update the points, chosen by a
convergence measure, in the active list. However, in order to reduce running
time, the improved algorithm does not run a convergence check of the
neighboring points of the narrow band as the fast iterative method usually
does. The additional error correction step is to correct the errors that the
previous value update step may cause. The error correction step consists of
finding and recalculating the point values in a separate remedy list which is
quite easy to implement on a GPU. In contrast to the fast marching method and
the fast sweeping method for the Eikonal equation, our improved method does not
need to compute the solution with any special ordering in neither the remedy
list nor the active list. Therefore, our algorithm can be implemented in
parallel. In our experiments, we implemente our new algorithm in parallel on a
GPU and compare the elapsed time with other current algorithms. The improved
fast iterative method runs faster than the other algorithms in most cases
through our numercal studies.
","[{""version"":""v1"",""created"":""Wed, 30 Jun 2021 07:57:42 GMT""},{""version"":""v2"",""created"":""Thu, 15 Jul 2021 13:55:05 GMT""},{""version"":""v3"",""created"":""Mon, 2 Aug 2021 02:42:54 GMT""}]","2021-08-03"
"2106.15870","Josef Kluson","J. Kluson","Note About String Theory with Deformed Dispersion Relations","9 pages, references added",,,,"hep-th","http://creativecommons.org/publicdomain/zero/1.0/","  The goal of this short paper is to find Lagrangian for bosonic string with
deformed dispersion relation proposed by J.Magueijo and L. Smolin in 2004.
","[{""version"":""v1"",""created"":""Wed, 30 Jun 2021 08:00:02 GMT""},{""version"":""v2"",""created"":""Fri, 9 Jul 2021 17:38:46 GMT""}]","2021-07-12"
"2106.15871","Ryohei Seto","Zhiyuan Zhao, Boyi Wang, Shigeyuki Komura, Mingcheng Yang, Fangfu Ye,
  Ryohei Seto","Emergent Stripes of Active Rotors in Shear Flows","13 pages, 16 figures","Phys. Rev. Research, 3:043229, Dec 2021","10.1103/PhysRevResearch.3.043229",,"cond-mat.soft cond-mat.stat-mech physics.flu-dyn","http://arxiv.org/licenses/nonexclusive-distrib/1.0/","  The shear-induced self-organization of active rotors into stripy aggregates
is studied by carrying out computational simulations. The rotors, modeled by
monolayers of frictional spheres, develop to stripy microstructures only when
they counterrotate with respect to the vorticity of the imposed shear flow. The
average width of the stripes is demonstrated to be linearly dependent on the
relative intensity of active torque to the shear rate. By giving insight into
three collective particle behaviors, i.e., shear-induced diffusion,
rotation-induced rearrangement, and edge flows, we explain the mechanisms of
formation of the particle stripes. Additionally, the rheological result shows
the dependence of shear and rotational viscosities on the active torque
direction and the oddness of the normal stress response. By exhibiting a
collective phenomenon of active rotors, our study paves the way to
understanding chiral active matter.
","[{""version"":""v1"",""created"":""Wed, 30 Jun 2021 08:01:27 GMT""},{""version"":""v2"",""created"":""Mon, 17 Jan 2022 08:42:03 GMT""}]","2022-01-19"
"2106.15872","Jakob Egetenmeyer","Jakob Egetenmeyer","Genre determining prediction: Non-standard TAM marking in football
  language","23 pages, submitted to Frontiers in Communication",,"10.3389/fcomm.2021.730914",,"cs.CL","http://creativecommons.org/licenses/by/4.0/","  German and French football language display tense-aspect-mood (TAM) forms
which differ from the TAM use in other genres. In German football talk, the
present indicative may replace the pluperfect subjunctive. In French reports of
football matches, the imperfective past may occur instead of a perfective past
tense-aspect form. We argue that the two phenomena share a functional core and
are licensed in the same way, which is a direct result of the genre they occur
in. More precisely, football match reports adhere to a precise script and
specific events are temporally determined in terms of objective time. This
allows speakers to exploit a secondary function of TAM forms, namely, they
shift the temporal perspective. We argue that it is on the grounds of the genre
that comprehenders predict the deviating forms and are also able to decode
them. We present various corpus studies where we explore the functioning of
these phenomena in order to gain insights into their distribution,
grammaticalization and their functioning in discourse. Relevant factors are
Aktionsart properties, rhetorical relations and their interaction with other
TAM forms. This allows us to discuss coping mechanisms on the part of the
comprehender. We broaden our understanding of the phenomena, which have only
been partly covered for French and up to now seem to have been ignored in
German.
","[{""version"":""v1"",""created"":""Wed, 30 Jun 2021 08:01:57 GMT""}]","2021-09-20"
"2106.15873","Evgeny F. Talantsev","E.F. Talantsev","Classifying charge carrier interaction in highly-compressed elements and
  silane","13 pages, 4 figures","Materials 14, 4322 (2021)","10.3390/ma14154322",,"cond-mat.supr-con","http://arxiv.org/licenses/nonexclusive-distrib/1.0/","  Since pivotal experimental discovery of the near-room-temperature
superconductivity (NRTS) in highly-compressed sulphur hydride by Drozdov et al
(2015 Nature 525 73-76), more than a dozen of binary and of ternary
hydrogen-rich phases exhibited superconducting transition above 100 K have been
discovered to date. There is a widely accepted theoretical point of view that
primary mechanism governing the emergence of superconductivity in hydrogen-rich
phases is the electron-phonon pairing. However, our recent analysis of
experimental temperature dependent resistance in $H_{3}S$, $LaH_{x}$, $PrH_{9}$
and $BaH_{12}$ (arXiv: 2104.14145) showed that these compounds exhibit the
dominance of non-electron-phonon charge carrier interaction and, thus, it is
unlikely that the electron-phonon pairing is the primary mechanism for the
emergence of superconductivity in these materials. Here we use the same
approach to reveal charge carrier interaction in highly-compressed lithium,
black phosphorous, sulfur, and silane. We found that all these superconductors
exhibit the dominance of non-electron-phonon charge carrier interaction. This
explains the failure of high-Tc values predicted for these materials by the
first-principles calculations which utilized the electron-phonon pairing as the
mechanism for the emergence of superconductivity in these materials. Our result
implies that alternative pairing mechanisms (i.e., electron-magnon,
electron-polaron, electron-electron, etc.) should be tested within
first-principles calculations approach as possible mechanisms for the emergence
of superconductivity in highly-compressed superconductors.
","[{""version"":""v1"",""created"":""Wed, 30 Jun 2021 08:04:15 GMT""}]","2021-08-04"
"2106.15874","Naoya Kuse","Naoya Kuse, Gabriele Navickaite, Michael Geiselmann, Takeshi Yasui,
  Kaoru Minoshima","Frequency-scanned microresonator soliton comb with the tracking of the
  frequency of all comb modes",,"Optics Letters Vol. 46, Issue 14, pp. 3400-3403 (2021)","10.1364/OL.426841",,"physics.optics physics.app-ph","http://creativecommons.org/licenses/by/4.0/","  Rapid and large scanning of a dissipative Kerr-microresonator soliton comb
with the characterization of all comb modes along with the separation of the
comb modes is imperative for the emerging applications of the frequency-scanned
soliton combs. However, the scan speed is limited by the gain of feedback
systems and the measurement of the frequency shift of all comb modes has not
been demonstrated. To overcome the limitation of the feedback, we incorporate
the feedback with the feedforward. With the additional gain of > 40 dB by a
feedforward signal, a dissipative Kerr-microresonator soliton comb is scanned
by 70 GHz in 500 $\mu$s, 50 GHz in 125 $\mu$s, and 25 GHz in 50 $\mu$s (= 500
THz/s). Furthermore, we propose and demonstrate a method to measure the
frequency shift of all comb modes, in which an imbalanced Mach-Zehnder
interferometer with two outputs with different wavelengths is used. Because of
the two degrees of freedom of optical frequency combs, the measurement at the
two different wavelengths enables the estimation of the frequency shift of all
comb modes.
","[{""version"":""v1"",""created"":""Wed, 30 Jun 2021 08:04:22 GMT""}]","2021-07-14"
"2106.15875","Fan  Zhang","Fan Zhang","A magnetospheric dichotomy for pulsars with extreme inclinations","20 pages, 7 figures, published version","Universe 2021, 7(12), 455",,,"astro-ph.HE","http://creativecommons.org/licenses/by-nc-nd/4.0/","  Expanding on the comment by Lyne et al (2017), that intermittent pulsars tend
to congregate near a stripe in the logarithmic period versus period-derivative
diagram, representing a small range of polar cap electric potential, as well as
the fact (already apparent in their Fig.~7, but not explicitly stated there)
that high-fraction nulling pulsars also tend to reside within this and an
additional stripe, we make the observation that the two stripes further match
the ""death lines"" for double and single-pole interpulses, associated with
nearly orthogonal and aligned rotators respectively. These extreme inclinations
are known to suffer from pair production deficiencies, so we propose to explain
intermittency and high-fraction nulling by reinvigorating some older quiescent
(no pulsar wind or radio emission) ""electrosphere"" solutions. Specifically, as
the polar potential drops below the two threshold bands (i.e., the two
stripes), corresponding to the aligned and orthogonal rotators, their
respective magnetospheres transition from being of the active
pair-production-sustained type into becoming the electrospheres, in which
charges are only lifted from the star. The borderline cases sitting in the gap
outside of the stable regime of either case manifest as high-fraction nullers.
Hall evolution of the magnetic field inside orthogonally rotating neutron stars
can furthermore drive secular regime changes, resulting in intermittent
pulsars.
","[{""version"":""v1"",""created"":""Wed, 30 Jun 2021 08:04:46 GMT""},{""version"":""v2"",""created"":""Tue, 23 Nov 2021 08:29:00 GMT""}]","2021-11-24"
"2106.15876","Paheli Bhattacharya","Paheli Bhattacharya and Soham Poddar and Koustav Rudra and Kripabandhu
  Ghosh and Saptarshi Ghosh","Incorporating Domain Knowledge for Extractive Summarization of Legal
  Case Documents","Accepted at the 18th International Conference on Artificial
  Intelligence and Law (ICAIL) 2021",,,,"cs.CL cs.IR","http://creativecommons.org/licenses/by/4.0/","  Automatic summarization of legal case documents is an important and practical
challenge. Apart from many domain-independent text summarization algorithms
that can be used for this purpose, several algorithms have been developed
specifically for summarizing legal case documents. However, most of the
existing algorithms do not systematically incorporate domain knowledge that
specifies what information should ideally be present in a legal case document
summary. To address this gap, we propose an unsupervised summarization
algorithm DELSumm which is designed to systematically incorporate guidelines
from legal experts into an optimization setup. We conduct detailed experiments
over case documents from the Indian Supreme Court. The experiments show that
our proposed unsupervised method outperforms several strong baselines in terms
of ROUGE scores, including both general summarization algorithms and
legal-specific ones. In fact, though our proposed algorithm is unsupervised, it
outperforms several supervised summarization models that are trained over
thousands of document-summary pairs.
","[{""version"":""v1"",""created"":""Wed, 30 Jun 2021 08:06:15 GMT""}]","2021-07-01"
"2106.15877","Jialin Liu Ph.D","Tianye Shu, Jialin Liu, Georgios N. Yannakakis","Experience-Driven PCG via Reinforcement Learning: A Super Mario Bros
  Study","This paper is accepted by the 2021 IEEE Conference on Games",,,,"cs.AI","http://arxiv.org/licenses/nonexclusive-distrib/1.0/","  We introduce a procedural content generation (PCG) framework at the
intersections of experience-driven PCG and PCG via reinforcement learning,
named ED(PCG)RL, EDRL in short. EDRL is able to teach RL designers to generate
endless playable levels in an online manner while respecting particular
experiences for the player as designed in the form of reward functions. The
framework is tested initially in the Super Mario Bros game. In particular, the
RL designers of Super Mario Bros generate and concatenate level segments while
considering the diversity among the segments. The correctness of the generation
is ensured by a neural net-assisted evolutionary level repairer and the
playability of the whole level is determined through AI-based testing. Our
agents in this EDRL implementation learn to maximise a quantification of
Koster's principle of fun by moderating the degree of diversity across level
segments. Moreover, we test their ability to design fun levels that are diverse
over time and playable. Our proposed framework is capable of generating
endless, playable Super Mario Bros levels with varying degrees of fun,
deviation from earlier segments, and playability. EDRL can be generalised to
any game that is built as a segment-based sequential process and features a
built-in compressed representation of its game content.
","[{""version"":""v1"",""created"":""Wed, 30 Jun 2021 08:10:45 GMT""},{""version"":""v2"",""created"":""Mon, 5 Jul 2021 01:30:15 GMT""}]","2021-07-06"
"2106.15878","Benjamin Maschler","Matthias Wei{\ss}, Philipp Marks, Benjamin Maschler, Dustin White,
  Pascal Kesseli and Michael Weyrich","Towards establishing formal verification and inductive code synthesis in
  the PLC domain","8 pages, 6 figures, 1 table. Accepted for publication at IEEE INDIN
  2021",,,,"cs.SE cs.FL cs.PL cs.SY eess.SY","http://arxiv.org/licenses/nonexclusive-distrib/1.0/","  Nowadays, formal methods are used in various areas for the verification of
programs or for code generation from models in order to increase the quality of
software and to reduce costs. However, there are still fields in which formal
methods have not been widely adopted, despite the large set of possible
benefits offered. This is the case for the area of programmable logic
controllers (PLC). This article aims to evaluate the potential of formal
methods in the context of PLC development. For this purpose, the general
concepts of formal methods are first introduced and then transferred to the PLC
area, resulting in an engineering-oriented description of the technology that
is based on common concepts from PLC development. Based on this description,
PLC professionals with varying degrees of experience were interviewed for their
perspective on the topic and to identify possible use cases within the PLC
domain. The survey results indicate the technology's high potential in the PLC
area, either as a tool to directly support the developer or as a key element
within a model-based systems engineering toolchain. The evaluation of the
survey results is performed with the aid of a demo application that
communicates with the Totally Integrated Automation Portal from Siemens and
generates programs via Fastsynth, a model-based open source code generator.
Benchmarks based on an industry-related PLC project show satisfactory synthesis
times and a successful integration into the workflow of a PLC developer.
","[{""version"":""v1"",""created"":""Wed, 30 Jun 2021 08:13:10 GMT""}]","2021-07-01"
"2106.15879","Jorge Villavicencio","J. Villavicencio, E. Cota, F. Rojas, J. A. Maytorena, and D. Morachis
  Galindo","Uhlmann phase in composite systems with entanglement","10 pages, 8 figures","Phys. Rev. A 104, 042204 (2021)","10.1103/PhysRevA.104.042204",,"quant-ph cond-mat.other","http://creativecommons.org/licenses/by/4.0/","  We study the geometric Uhlmann phase of entangled mixed states in a composite
system made of two coupled spin-$\frac 1 2$ particles with a magnetic field
acting on one of them. Within a depolarizing channel setup, an exact analytical
expression for such a phase in each subsystem is derived. We find an explicit
connection to the concurrence of the depolarizing channel density matrix, which
allows to characterize the features of the Uhlmann phase in terms of the degree
of entanglement in the system. In the space of field direction and coupling
parameter, it exhibits a phase singularity revealing a topological transition
between orders with different winding numbers. The transition occurs for fields
lying in the equator of the sphere of directions and at critical values of the
coupling which can be controlled by tuning the depolarization strength.
Notably, under these conditions the concurrence of the composite system is
bounded to the range $[0,1/2]$. We also compare the calculated Uhlmann phase to
an interferometric phase, which has been formulated as an alternative for
density matrices. The latter does not present a phase vortex, although they
coincide in the weak entanglement regime, for vanishing depolarization (pure
states). Otherwise they behave clearly different in the strong entanglement
regime.
","[{""version"":""v1"",""created"":""Wed, 30 Jun 2021 08:14:11 GMT""}]","2021-10-13"
