"2106.16009","Stefan Becker","Stefan Becker and Ronny Hug and Wolfgang H\""ubner and Michael Arens
  and Brendan T. Morris","MissFormer: (In-)attention-based handling of missing observations for
  trajectory filtering and prediction","Accepted at the International Symposium on Visual Computing (ISVC)
  2021",,"10.1007/978-3-030-90439-5_41",,"cs.CV","http://arxiv.org/licenses/nonexclusive-distrib/1.0/","  In applications such as object tracking, time-series data inevitably carry
missing observations. Following the success of deep learning-based models for
various sequence learning tasks, these models increasingly replace classic
approaches in object tracking applications for inferring the objects' motion
states. While traditional tracking approaches can deal with missing
observations, most of their deep counterparts are, by default, not suited for
this.
  Towards this end, this paper introduces a transformer-based approach for
handling missing observations in variable input length trajectory data. The
model is formed indirectly by successively increasing the complexity of the
demanded inference tasks. Starting from reproducing noise-free trajectories,
the model then learns to infer trajectories from noisy inputs. By providing
missing tokens, binary-encoded missing events, the model learns to in-attend to
missing data and infers a complete trajectory conditioned on the remaining
inputs. In the case of a sequence of successive missing events, the model then
acts as a pure prediction model. The abilities of the approach are demonstrated
on synthetic data and real-world data reflecting prototypical object tracking
scenarios.
","[{""version"":""v1"",""created"":""Wed, 30 Jun 2021 12:12:52 GMT""},{""version"":""v2"",""created"":""Thu, 1 Jul 2021 09:09:34 GMT""},{""version"":""v3"",""created"":""Tue, 6 Jul 2021 11:44:00 GMT""},{""version"":""v4"",""created"":""Thu, 2 Dec 2021 16:59:10 GMT""}]","2021-12-03"
"2106.16010","Oscar Randal-Williams","Alexander Kupers, Oscar Randal-Williams","On the Torelli Lie algebra","41 pages; v2. 45 pages, accepted version to appear in Forum of
  Mathematics, Pi",,,"CPH-GEOTOP-DNRF151","math.AT math.GT","http://arxiv.org/licenses/nonexclusive-distrib/1.0/","  We prove two theorems about the Malcev Lie algebra associated to the Torelli
group of a surface of genus $g$: stably, it is Koszul and the kernel of the
Johnson homomorphism consists only of trivial
$Sp_{2g}(\mathbb{Z})$-representations lying in the centre.
","[{""version"":""v1"",""created"":""Wed, 30 Jun 2021 12:14:03 GMT""},{""version"":""v2"",""created"":""Fri, 3 Mar 2023 09:33:21 GMT""}]","2023-03-06"
"2106.16011","Drew Heard","Tobias Barthel and Drew Heard and Beren Sanders","Stratification and the comparison between homological and tensor
  triangular support","18 pages, comments welcome. v2 - updated to include referee comments.
  Version to appear in The Quarterly Journal of Mathematics",,"10.1093/qmath/haac040",,"math.AT math.AG math.CT math.RT","http://arxiv.org/licenses/nonexclusive-distrib/1.0/","  We compare the homological support and tensor triangular support for `big'
objects in a rigidly-compactly generated tensor triangulated category. We prove
that the comparison map from the homological spectrum to the tensor triangular
spectrum is a bijection and that the two notions of support coincide whenever
the category is stratified, extending work of Balmer. Moreover, we clarify the
relations between salient properties of support functions and exhibit
counter-examples highlighting the differences between homological and tensor
triangular support.
","[{""version"":""v1"",""created"":""Wed, 30 Jun 2021 12:15:45 GMT""},{""version"":""v2"",""created"":""Wed, 4 Jan 2023 08:55:00 GMT""}]","2023-01-05"
"2106.16012","Lloren\c{c} Espinosa-Portal\'es","Llorenc Espinosa-Portales and Juan Garcia-Bellido","Covariant formulation of non-equilibrium thermodynamics in General
  Relativity","14 pages. Comments and references added. New section dealing with
  real fluids added. Matches accepted version by PDU","Physics of the Dark Universe 34 (2021) 100893","10.1016/j.dark.2021.100893","IFT-UAM/CSIC-21-74","gr-qc astro-ph.CO","http://arxiv.org/licenses/nonexclusive-distrib/1.0/","  We construct a generally-covariant formulation of non-equilibrium
thermodynamics in General Relativity. We find covariant entropic forces arising
from gradients of the entropy density, and a corresponding non-conservation of
the energy momentum tensor in terms of these forces. We also provide a
Hamiltonian formulation of General Relativity in the context of non-equilibrium
phenomena and write the Raychaudhuri equations for a congruence of geodesics.
We find that a fluid satisfying the strong energy condition could avoid
collapse for a positive and sufficiently large entropic-force contribution. We
then study the forces arising from gradients of the bulk entropy of
hydrodynamical matter, as well as the entropy of boundary terms in the action,
like those of black hole horizons. Finally, we apply the covariant formulation
of non-equilibrium thermodynamics to the expanding universe and obtain the
modified Friedmann equations, with an extra term corresponding to an entropic
force satisfying the second law of thermodynamics.
","[{""version"":""v1"",""created"":""Wed, 30 Jun 2021 12:20:56 GMT""},{""version"":""v2"",""created"":""Tue, 19 Oct 2021 15:27:56 GMT""}]","2021-10-20"
"2106.16013","Razieh Baradaran","Razieh Baradaran and Hossein Amirkhani","Zero-Shot Estimation of Base Models' Weights in Ensemble of Machine
  Reading Comprehension Systems for Robust Generalization",,,,,"cs.CL","http://creativecommons.org/licenses/by/4.0/","  One of the main challenges of the machine reading comprehension (MRC) models
is their fragile out-of-domain generalization, which makes these models not
properly applicable to real-world general-purpose question answering problems.
In this paper, we leverage a zero-shot weighted ensemble method for improving
the robustness of out-of-domain generalization in MRC models. In the proposed
method, a weight estimation module is used to estimate out-of-domain weights,
and an ensemble module aggregate several base models' predictions based on
their weights. The experiments indicate that the proposed method not only
improves the final accuracy, but also is robust against domain changes.
","[{""version"":""v1"",""created"":""Wed, 30 Jun 2021 12:22:30 GMT""}]","2021-07-01"
"2106.16014","Lloren\c{c} Espinosa-Portal\'es","Juan Garcia-Bellido and Llorenc Espinosa-Portales","Cosmic acceleration from first principles","6 pages, 5 figures. Comments added. Matches version accepted by PDU","Physics of the Dark Universe 34 (2021) 100892","10.1016/j.dark.2021.100892","IFT-UAM/CSIC-21-75","gr-qc astro-ph.CO","http://arxiv.org/licenses/nonexclusive-distrib/1.0/","  General relativistic entropic acceleration theory may explain the present
cosmic acceleration from first principles without the need of introducing a
cosmological constant. Following the covariant formulation of non-equilibrium
phenomena in the context of a homogeneous and isotropic
Friedmann-Lemaitre-Robertson-Walker (FLRW) metric, we find that the growth of
entropy associated with the causal horizon of our universe (inside a finite
bubble in eternal inflation) induces an acceleration that is essentially
indistinguishable from that of $\Lambda$CDM, except for a slightly larger
present rate of expansion compared to what would be expected from the CMB in
$\Lambda$CDM, possibly solving the so-called $H_0$ tension. The matter content
of the universe is unchanged and the coincidence problem is resolved since it
is the growth of the causal horizon of matter that introduces this new
relativistic entropic force. The cosmological constant is made unnecessary and
the future hypersurface is Minkowsky rather than de Sitter.
","[{""version"":""v1"",""created"":""Wed, 30 Jun 2021 12:30:26 GMT""},{""version"":""v2"",""created"":""Tue, 19 Oct 2021 15:33:49 GMT""}]","2021-10-20"
"2106.16015","Hugo Jacob","Hugo Jacob, Thomas Bellitto, Oscar Defrain, Marcin Pilipczuk","Close relatives (of Feedback Vertex Set), revisited","32 pages, 4 figures",,,,"cs.DM cs.CC cs.DS math.CO","http://creativecommons.org/licenses/by/4.0/","  At IPEC 2020, Bergougnoux, Bonnet, Brettell, and Kwon showed that a number of
problems related to the classic Feedback Vertex Set (FVS) problem do not admit
a $2^{o(k \log k)} \cdot n^{\mathcal{O}(1)}$-time algorithm on graphs of
treewidth at most $k$, assuming the Exponential Time Hypothesis. This contrasts
with the $3^{k} \cdot k^{\mathcal{O}(1)} \cdot n$-time algorithm for FVS using
the Cut&Count technique.
  During their live talk at IPEC 2020, Bergougnoux et al.~posed a number of
open questions, which we answer in this work.
  - Subset Even Cycle Transversal, Subset Odd Cycle Transversal, Subset
Feedback Vertex Set can be solved in time $2^{\mathcal{O}(k \log k)} \cdot n$
in graphs of treewidth at most $k$. This matches a lower bound for Even Cycle
Transversal of Bergougnoux et al.~and improves the polynomial factor in some of
their upper bounds.
  - Subset Feedback Vertex Set and Node Multiway Cut can be solved in time
$2^{\mathcal{O}(k \log k)} \cdot n$, if the input graph is given as a
clique-width expression of size $n$ and width $k$.
  - Odd Cycle Transversal can be solved in time $4^k \cdot k^{\mathcal{O}(1)}
\cdot n$ if the input graph is given as a clique-width expression of size $n$
and width $k$. Furthermore, the existence of a constant $\varepsilon > 0$ and
an algorithm performing this task in time $(4-\varepsilon)^k \cdot
n^{\mathcal{O}(1)}$ would contradict the Strong Exponential Time Hypothesis.
","[{""version"":""v1"",""created"":""Wed, 30 Jun 2021 12:30:32 GMT""}]","2021-07-01"
"2106.16016","Alessandro Brighente","Alessandro Brighente, Mauro Conti, Denis Donadel, Federico Turrin","EVScout2.0: Electric Vehicle Profiling Through Charging Profile",,,,,"cs.CR","http://creativecommons.org/licenses/by/4.0/","  EVs (Electric Vehicles) represent a green alternative to traditional
fuel-powered vehicles. To enforce their widespread use, both the technical
development and the security of users shall be guaranteed. Privacy of users
represents one of the possible threats impairing EVs adoption. In particular,
recent works showed the feasibility of identifying EVs based on the current
exchanged during the charging phase. In fact, while the resource negotiation
phase runs over secure communication protocols, the signal exchanged during the
actual charging contains features peculiar to each EV. A suitable feature
extractor can hence associate such features to each EV, in what is commonly
known as profiling. In this paper, we propose EVScout2.0, an extended and
improved version of our previously proposed framework to profile EVs based on
their charging behavior. By exploiting the current and pilot signals exchanged
during the charging phase, our scheme is able to extract features peculiar for
each EV, allowing hence for their profiling. We implemented and tested
EVScout2.0 over a set of real-world measurements considering over 7500 charging
sessions from a total of 137 EVs. In particular, numerical results show the
superiority of EVScout2.0 with respect to the previous version. EVScout2.0 can
profile EVs, attaining a maximum of 0.88 recall and 0.88 precision. To the best
of the authors' knowledge, these results set a new benchmark for upcoming
privacy research for large datasets of EVs.
","[{""version"":""v1"",""created"":""Wed, 30 Jun 2021 12:32:39 GMT""}]","2021-07-01"
"2106.16017","Maximilian Holdt","Maximilian Holdt","Hyperk\""ahler metrics on the moduli space of weakly parabolic Higgs
  bundles","115 pages, 5 figures; minor improvements to section 2, added section
  7, revised section 8, typos corrected; reorganized section 3,7 & 8, changed
  an erroneous proof for the optimal decay rate",,,,"math.DG","http://creativecommons.org/licenses/by/4.0/","  We use the theory of Gaiotto, Moore and Neitzke to construct a set of Darboux
coordinates on the moduli space $\mathcal{M}$ of weakly parabolic
$SL(2,\mathbb{C})$-Higgs bundles. For generic Higgs bundles
($\mathcal{E},R\Phi)$ with $R\gg 0$ the coordinates are shown to be dominated
by a leading term that is given by the coordinates for a corresponding simpler
space of limiting configurations and we prove that the deviation from the
limiting term is given by a remainder that is exponentially suppressed in $R$.
  We then use this result to solve an associated Riemann-Hilbert problem and
construct a twistorial hyperk\""ahler metric $g_{\text{twist}}$ on
$\mathcal{M}$. Comparing this metric to the simpler semiflat metric
$g_{\text{sf}}$, we show that their difference is
$g_{\text{twist}}-g_{\text{sf}}=O\left(e^{-\mu R}\right)$, where $\mu$ is a
minimal period of the determinant of the Higgs field.
","[{""version"":""v1"",""created"":""Wed, 30 Jun 2021 12:34:41 GMT""},{""version"":""v2"",""created"":""Sat, 18 Dec 2021 13:54:21 GMT""},{""version"":""v3"",""created"":""Tue, 30 Aug 2022 00:15:58 GMT""}]","2022-08-31"
"2106.16018","Ehsan Azmoodeh","Ehsan Azmoodeh, Peter Eichelsbacher and Christoph Th\""ale","Optimal Variance--Gamma approximation on the second Wiener chaos","25 pages",,,,"math.PR","http://arxiv.org/licenses/nonexclusive-distrib/1.0/","  In this paper, we consider a target random variable $Y \sim \CVG$ distributed
according to a centered Variance--Gamma distribution. For a generic random
element $F=I_2(f)$ in the second Wiener chaos with $\E[F^2]= \E[Y^2]$ we
establish a non-asymptotic optimal bound on the distance between $F$ and $Y$ in
terms of the maximum of difference of the first six cumulants. This six moment
theorem extends the celebrated optimal fourth moment theorem of I.\ Nourdin \&
G.\ Peccati for normal approximation. The main body of our analysis constitutes
a splitting technique for test functions in the Banach space of Lipschitz
functions relying on the compactness of the Stein operator. The recent
developments around Stein method for Variance--Gamma approximation by R.\ Gaunt
play a significant role in our study. As an application we consider the
generalized Rosenblatt process at the extreme critical exponent, first studied
by S.\ Bai \& M.\ Taqqu.
","[{""version"":""v1"",""created"":""Wed, 30 Jun 2021 12:34:57 GMT""}]","2021-07-01"
"2106.16019","Pavel Exner","Marzieh Baradaran and Pavel Exner","Kagome network with vertex coupling of a preferred orientation","29 pages, 11 figures",,"10.1063/5.0093546",,"math-ph math.MP math.SP quant-ph","http://creativecommons.org/licenses/by/4.0/","  We investigate spectral properties of periodic quantum graphs in the form of
a kagome or a triangular lattice in the situation when the condition matching
the wave functions at the lattice vertices is chosen of a particular form
violating the time-reversal invariance. The positive spectrum consists of
infinite number of bands, some of which may be flat; the negative one has at
most three and two bands, respectively. The kagome lattice example shows that
even in graphs with such an uncommon vertex coupling spectral universality may
hold: if its edges are incommensurate, the probability that a randomly chosen
positive number is contained in the spectrum is $\approx 0.639$.
","[{""version"":""v1"",""created"":""Wed, 30 Jun 2021 12:35:12 GMT""}]","2022-08-31"
"2106.16020","Damien Fourure","Damien Fourure, Muhammad Usama Javaid, Nicolas Posocco, Simon Tihon","Anomaly Detection: How to Artificially Increase your F1-Score with a
  Biased Evaluation Protocol","16 pages, 7 figures, to be published in ECML-PKDD 2021, for official
  implementation see https://github.com/euranova/F1-Score-is-Biased",,,,"cs.LG","http://creativecommons.org/licenses/by/4.0/","  Anomaly detection is a widely explored domain in machine learning. Many
models are proposed in the literature, and compared through different metrics
measured on various datasets. The most popular metrics used to compare
performances are F1-score, AUC and AVPR. In this paper, we show that F1-score
and AVPR are highly sensitive to the contamination rate. One consequence is
that it is possible to artificially increase their values by modifying the
train-test split procedure. This leads to misleading comparisons between
algorithms in the literature, especially when the evaluation protocol is not
well detailed. Moreover, we show that the F1-score and the AVPR cannot be used
to compare performances on different datasets as they do not reflect the
intrinsic difficulty of modeling such data. Based on these observations, we
claim that F1-score and AVPR should not be used as metrics for anomaly
detection. We recommend a generic evaluation procedure for unsupervised anomaly
detection, including the use of other metrics such as the AUC, which are more
robust to arbitrary choices in the evaluation protocol.
","[{""version"":""v1"",""created"":""Wed, 30 Jun 2021 12:36:01 GMT""}]","2021-07-01"
"2106.16021","Michael Blank","Michael Blank","Invariant measures of torus piecewise isometries","19 pages, Advances in Mathematics (accepted)",,,,"math.DS","http://creativecommons.org/licenses/by/4.0/","  We study measure-theoretical aspects of torus piecewise isometries. Not much
is known about this type of dynamical systems, except for the special case of
one-dimensional interval exchange mappings. The last case is fundamentally
different from the general situation in the presence of an invariant measure
(Lebesgue measure), which helps a lot in the analysis. Due to the absence of
good methods of analysis of general systems with discontinuities, even the
existence of invariant measures of the torus piecewise isometries was an open
question. We establish sufficient conditions for the existence/absence of
invariant measures for this class of systems. Technically, our results are
based on the approximation of the maps under study by weakly periodic ones.
","[{""version"":""v1"",""created"":""Wed, 30 Jun 2021 12:37:49 GMT""},{""version"":""v2"",""created"":""Sun, 5 Jun 2022 07:37:48 GMT""}]","2022-06-07"
"2106.16022","Jamil Ownuk","Jamil Ownuk and Ahmad Nezakati and Hossein Baghishani","Developing flexible classes of distributions to account for both
  skewness and bimodality",,,,,"stat.ME stat.AP","http://creativecommons.org/licenses/by/4.0/","  We develop two novel approaches for constructing skewed and bimodal flexible
distributions that can effectively generalize classical symmetric
distributions. We illustrate the application of introduced techniques by
extending normal, student-t, and Laplace distributions. We also study the
properties of the newly constructed distributions. The method of maximum
likelihood is proposed for estimating the model parameters. Furthermore, the
application of new distributions is represented using real-life data.
","[{""version"":""v1"",""created"":""Wed, 30 Jun 2021 12:39:44 GMT""}]","2021-07-01"
"2106.16023","Ramin Javadi","Ramin Javadi and Meysam Miralaei","Multicolor Size-Ramsey Number of Cycles",,,,,"math.CO","http://arxiv.org/licenses/nonexclusive-distrib/1.0/","  Given a positive integer $ r $, the $ r $-color size-Ramsey number of a graph
$ H $, denoted by $ \hat{R}(H, r) $, is the smallest integer $ m $ for which
there exists a graph $ G $ with $ m $ edges such that, in any edge coloring of
$ G $ with $ r $ colors, $G$ contains a monochromatic copy of $ H $. Haxell,
Kohayakawa and \L uczak showed that the size-Ramsey number of a cycle $ C_n $
is linear in $ n $ i.e. $ \hat{R}(C_n, r) \leq c_rn $, for some constant $ c_r
$. Their proof, however, is based on the Szemer\'edi's regularity lemma and so
no specific constant $ c_r $ is known. Javadi, Khoeini, Omidi and Pokrovskiy
gave an alternative proof for this result which avoids using of the regularity
lemma. Indeed, they proved that if $ n $ is even, then $ c_r $ is exponential
in $ r $ and if $ n $ is odd, then $ c_r $ is doubly exponential in $ r $.
  \noindent In this paper, we improve the bound $c_r$ and prove that $c_r$ is
polynomial in $r$ when $n$ is even and is exponential in $r$ when $n$ is odd.
We also prove that in the latter case, it cannot be improved to a polynomial
bound in $r$. More precisely, we prove that there are some positive constants
$c_1,c_2$ such that for every even integer $n$, we have $c_1r^2n\leq
\hat{R}(C_n,r)\leq c_2r^{120}(\log^2 r)n$ and for every odd integer $n$, we
have
  $c_1 2^{r}n \leq \hat{R}(C_n, r)\leq c_22^{16 r^2+2\log r}n $.
","[{""version"":""v1"",""created"":""Wed, 30 Jun 2021 12:43:32 GMT""}]","2021-07-01"
"2106.16024","Norbert Kolotzek","Norbert Kolotzek, Pierre G. Aublin and Bernhard U. Seeber","Fast processing explains the effect of sound reflection on binaural
  unmasking","Preprint from June 2nd , 2021",,,,"eess.AS cs.SD","http://arxiv.org/licenses/nonexclusive-distrib/1.0/","  Sound reflections and late reverberation alter energetic and binaural cues of
a target source, thereby affecting it's detection in noise. Two experiments
investigated detection of harmonic complex tones, centered around 500 Hz, in
noise in a virtual room with different modifications of simulated room impulse
responses (RIR). Stimuli were auralized using the SOFE's loudspeakers in
anechoic space. The target was presented from the front or at 0$^\circ$
azimuth, while an anechoic noise masker was simultaneously presented at
0$^\circ$. In the first experiment, early reflections were progressively added
to the RIR and detection thresholds of the reverberant target were measured.
For a frontal sound source, detection thresholds decreased while adding the
first 45 ms of early reflections, whereas for a lateral sound source thresholds
remained constant. In the second experiment, early reflections were cut out
while late reflections were kept along with the direct sound. Results for a
target at 0$^\circ$ show that even reflections as late as 150 ms reduce
detection thresholds compared to only the direct sound. A binaural model with a
sluggishness component following the computation of binaural unmasking in short
windows predicts measured and literature results better than when large windows
are used.
","[{""version"":""v1"",""created"":""Wed, 30 Jun 2021 12:45:33 GMT""}]","2021-07-01"
"2106.16025","Maximilian Bauernfeind","Maximilian Bauernfeind, Jonas Erhardt, Philipp Eck, Pardeep K. Thakur,
  Judith Gabel, Tien-Lin Lee, J\""org Sch\""afer, Simon Moser, Domenico Di Sante,
  Ralph Claessen, Giorgio Sangiovanni","Design and realization of topological Dirac fermions on a triangular
  lattice",,"Nat. Commun., 12, 5396 (2021)","10.1038/s41467-021-25627-y",,"cond-mat.mtrl-sci cond-mat.mes-hall cond-mat.str-el cond-mat.supr-con quant-ph","http://creativecommons.org/licenses/by/4.0/","  Large-gap quantum spin Hall insulators are promising materials for
room-temperature applications based on Dirac fermions. Key to engineer the
topologically non-trivial band ordering and sizable band gaps is strong
spin-orbit interaction. Following Kane and Mele's original suggestion, one
approach is to synthesize monolayers of heavy atoms with honeycomb coordination
accommodated on templates with hexagonal symmetry. Yet, in the majority of
cases, this recipe leads to triangular lattices, typically hosting metals or
trivial insulators. Here, we conceive and realize ""indenene"", a triangular
monolayer of indium on SiC exhibiting non-trivial valley physics driven by
local spin-orbit coupling, which prevails over inversion-symmetry breaking
terms. By means of tunneling microscopy of the 2D bulk we identify the quantum
spin Hall phase of this triangular lattice and unveil how a hidden honeycomb
connectivity emerges from interference patterns in Bloch $p_x \pm ip_y$-derived
wave functions.
","[{""version"":""v1"",""created"":""Wed, 30 Jun 2021 12:46:28 GMT""}]","2021-09-14"
"2106.16026","Chuwen Ma","Chuwen Ma and Weiying Zheng","High-order finite element methods for nonlinear convection-diffusion
  equation on time-varying domain",,,,,"math.NA cs.NA","http://arxiv.org/licenses/nonexclusive-distrib/1.0/","  A high-order finite element method is proposed to solve the nonlinear
convection-diffusion equation on a time-varying domain whose boundary is
implicitly driven by the solution of the equation. The method is semi-implicit
in the sense that the boundary is traced explicitly with a high-order
surface-tracking algorithm, while the convection-diffusion equation is solved
implicitly with high-order backward differentiation formulas and
fictitious-domain finite element methods. By two numerical experiments for
severely deforming domains, we show that optimal convergence orders are
obtained in energy norm for third-order and fourth-order methods.
","[{""version"":""v1"",""created"":""Wed, 30 Jun 2021 12:47:53 GMT""},{""version"":""v2"",""created"":""Thu, 30 Dec 2021 08:04:47 GMT""}]","2022-01-03"
