"2101.01481","Anamaria Gkini","Anamaria Gkini, Manolis Plionis, Maria Chira, Elias Koulouridis","Host galaxy and orientation differences between AGN different types","Accepted for publication in A&A","A&A 650, A75 (2021)","10.1051/0004-6361/202140278",,"astro-ph.GA","http://creativecommons.org/licenses/by/4.0/","  Aims.The main purpose of this study is to investigate aspects regarding the
validity of the active galactic nucleus (AGN) unification paradigm (UP). In
particular, we focus on the AGN host galaxies, which according to the UP should
show no systematic differences depending on the AGN classification. Methods.For
the purpose of this study, we used (a) the spectroscopic Sloan Digital Sky
Survey (SDSS) Data Release (DR) 14 catalogue, in order to select and classify
AGNs using emission line diagnostics, up to a redshift of z=0.2, and (b) the
Galaxy Zoo Project catalogue, which classifies SDSS galaxies in two broad
Hubble types: spirals and ellipticals. Results.We find that the fraction of
type 1 Seyfert nuclei (Sy1) hosted in elliptical galaxies is significantly
larger than the corresponding fraction of any other AGN type, while there is a
gradient of increasing spiral-hosts from Sy1 to LINER, type 2 Seyferts (Sy2)
and composite nuclei. These findings cannot be interpreted within the simple
unified model, but possibly by a co-evolution scheme for supermassive black
holes (SMBH) and galactic bulges. Furthermore, for the case of spiral host
galaxies we find the Sy1 population to be strongly skewed towards face-on
configurations, while the corresponding Sy2 population range in all host galaxy
orientation configurations has a similar, but not identical, orientation
distribution to star-forming (SF) galaxies. These results also cannot be
interpreted by the standard unification paradigm, but point towards a
significant contribution of the galactic disc to the obscuration of the nuclear
region. This is also consistent with the observed preference of Sy1 nuclei to
be hosted by ellipticals, that is, the dusty disc of spiral hosts contributes
to the obscuration of the broad-line region (BLR), and thus relatively more
ellipticals are expected to appear hosting Sy1 nuclei.
","[{""version"":""v1"",""created"":""Tue, 5 Jan 2021 12:27:18 GMT""},{""version"":""v2"",""created"":""Thu, 2 Sep 2021 12:25:23 GMT""}]","2021-09-03"
"2101.01482","Facundo Cabrera","Facundo Cabrera and Pablo J. Cobelli","Design, construction and validation of an instrumented particle for the
  lagrangian characterization of flows. Application to gravity wave turbulence",,,"10.1007/s00348-020-03121-3",,"physics.flu-dyn","http://creativecommons.org/licenses/by-nc-nd/4.0/","  The design and application of an instrumented particle for the lagrangian
characterization of turbulent free surface flows is presented in this study.
This instrumented particle constitutes a local measurement device capable of
measuring both its instantaneous 3D translational acceleration and angular
velocity components, as well as recording them on an embarked removeable memory
card. A lithium ion polymer battery provides the instrumented particle with up
to 8 hours of autonomous operation. Entirely composed of commercial off the
shelf electronic components, it features accelerometer and gyroscope sensors
with a resolution of 16 bits for each individual axis, and maximum data
acquisition rates of 1 and 8 kHz, respectively, as well as several user
programmable dynamic ranges. Its ABS 3D printed body takes the form of a 36 mm
diameter hollow sphere, and has a total mass of (19.6 $\pm$ 0.5) g. Controlled
experiments, carried out to calibrate and validate its performance showed good
agreement when compared to reference techniques. In order to assess the
practicality of the instrumented particle, we apply it to the statistical
characterization of floater dynamics in experiments of surface wave turbulence.
In this feasibility study, we focused our attention on the distribution of
acceleration and angular velocity fluctuations as a function of the forcing
intensity. The IP's motion is also simultaneously registered by a 3D particle
tracking velocimetry (PTV) system, for the purposes of comparison. Beyond the
results particular to this study case, it constitutes a proof of both the
feasibility and potentiality of the IP as a tool for the experimental
characterization of particle dynamics in such flows.
","[{""version"":""v1"",""created"":""Tue, 5 Jan 2021 12:29:27 GMT""}]","2021-01-06"
"2101.01483","Pieter Kok","Phattharaporn Singkanipa and Pieter Kok","Quantum Conference Key Agreement with Photon Loss","11 pages, 11 figures",,,,"quant-ph","http://creativecommons.org/licenses/by/4.0/","  Conference key agreement (CKA) is an information processing task where more
than two parties want to share a common secret key. Here, we present a
loss-resilient protocol for CKA, based on redundant encoding and error
correction. Our protocol provides a speed-up in transmission rate over the
existing lossy CKA protocol. However, encoding and error correction come with
extra cost. We show that, using photon sources with creation probability p >
0.3, our protocol's secret key rate can overcome the existing protocol's.
Hence, high probability entangled photon sources are required for realistic
implementation of our loss-resilient protocol.
","[{""version"":""v1"",""created"":""Tue, 5 Jan 2021 12:31:03 GMT""},{""version"":""v2"",""created"":""Tue, 12 Jan 2021 15:27:41 GMT""}]","2021-01-13"
"2101.01484","Tantan Zhao","Tantan Zhao, Lijun He, Xinyu Huang, Fan Li","QoE-driven Secure Video Transmission in Cloud-edge Collaborative
  Networks","14 pages, 8 figures",,,,"cs.MM","http://creativecommons.org/licenses/by/4.0/","  Video transmission over the backhaul link in cloud-edge collaborative
networks usually suffers security risks, which is ignored in most of the
existing studies. The characteristics that video service can flexibly adjust
the encoding rates and provide acceptable encoding qualities, make the security
requirements more possible to be satisfied but tightly coupled with video
encoding by introducing more restrictions on edge caching. In this paper, by
considering the interaction between video encoding and edge caching, we
investigate the quality of experience (QoE)-driven cross-layer optimization of
secure video transmission over the wireless backhaul link in cloud-edge
collaborative networks. First, we develop a secure transmission model based on
video encoding and edge caching. By employing this model as the security
constraint, then we formulate a QoE-driven joint optimization problem subject
to limited available caching capacity. To solve the optimization problem, we
propose two algorithms: a near-optimal iterative algorithm (EC-VE) and a greedy
algorithm with low computational complexity (Greedy EC-VE). Simulation results
show that our proposed EC-VE can greatly improve user QoE within security
constraints, and the proposed Greedy EC-VE can obtain the tradeoff between QoE
and computational complexity.
","[{""version"":""v1"",""created"":""Tue, 5 Jan 2021 12:39:47 GMT""},{""version"":""v2"",""created"":""Sun, 31 Oct 2021 02:09:48 GMT""},{""version"":""v3"",""created"":""Tue, 2 Nov 2021 02:11:21 GMT""}]","2021-11-03"
"2101.01485","Simran Sandhu","Andrew Yu. Morozov, Oleg Kuzenkov and Simran K. Sandhu","Global Optimisation in Hilbert Spaces using the Survival of the Fittest
  Algorithm","19 pages, 4 figures",,,,"math.OC math.DS","http://creativecommons.org/licenses/by/4.0/","  Global optimisation problems in high-dimensional and infinite dimensional
spaces arise in various real-world applications such as engineering, economics,
geophysics, biology, machine learning, optimal control, etc. Among stochastic
approaches to global optimisation, biology-inspired methods are currently
popular in the literature, imitating natural ecological and evolutionary
processes and reported to be efficient in many practical study cases. However,
many of bio-inspired methods have some vital drawbacks. Due to their
semi-empirical nature, convergence to the globally optimal solution cannot
always be guaranteed and struggles with the high dimensionality of space,
showing a slow convergence. Here, we present a bio-inspired global stochastic
optimisation method, applicable in Hilbert function spaces, inspired by
Darwin's' famous idea of the survival of the fittest, therefore, referred to as
the `Survival of the Fittest Algorithm' (SoFA). Mathematically, the convergence
of SoFA is a consequence of a fundamental property of localisation of
probabilistic measure in a Hilbert space, we rigorously prove the convergence
of the introduced algorithm for a generic class of functionals. As an
insightful real-world problem, we apply SoFA to find globally optimal
trajectories for daily vertical migrations of zooplankton in ocean and lakes,
considered to be the largest synchronised movement of biomass on Earth. We
maximise fitness in a function space derived from a von-Foerster
stage-structured population model with biologically realistic parameters. We
show that for problems of fitness maximisation in high-dimensional spaces, SoFA
performs better than some other stochastic global optimisation algorithms. We
highlight the links between the new optimisation algorithm and natural
selection process in ecosystems occurring within a population via gradual
exclusion of competitive con-specific strains.
","[{""version"":""v1"",""created"":""Tue, 5 Jan 2021 12:43:10 GMT""}]","2021-01-06"
"2101.01486","Elena Raycheva","Elena Raycheva, Jared Garrison, Christian Schaffner, Gabriela Hug","High Resolution Generation Expansion Planning Considering Flexibility
  Needs: The Case of Switzerland in 2030","6 pages, 4 figures, to appear in the Proceedings of the 2020
  Mediterranean Conference on Power Generation, Transmission, Distribution and
  Energy Conversion (MEDPOWER 2020)",,"10.1049/icp.2021.1256",,"math.OC","http://arxiv.org/licenses/nonexclusive-distrib/1.0/","  This paper presents a static generation expansion planning formulation in
which operational and investment decisions for a wide range of technologies are
co-optimized from a centralized perspective. The location, type and quantity of
new generation and storage capacities are provided such that system demand and
flexibility requirements are satisfied. Depending on investments in new
intermittent renewables (wind, PV), the flexibility requirements are adapted in
order to fully capture RES integration costs and ensure normal system operating
conditions. To position candidate units, we incorporate DC constraints, nodal
demand and production of existing generators as well as imports and exports
from other interconnected zones. To show the capabilities of the formulation,
high-temporal resolution simulations are conducted on a 162-bus system
consisting of the full Swiss transmission grid and aggregated neighboring
countries.
","[{""version"":""v1"",""created"":""Tue, 5 Jan 2021 12:47:16 GMT""}]","2021-08-26"
"2101.01487","Terese Besker Ms","Terese Besker, Antonio Martini and Jan Bosch","The use of incentives to promote Technical Debt management",,,,,"cs.SE","http://creativecommons.org/licenses/by-nc-nd/4.0/","  When developing software, it is vitally important to keep the level of
technical debt down since it is well established from several studies that
technical debt can, e.g., lower the development productivity, decrease the
developers' morale, and compromise the overall quality of the software.
However, even if researchers and practitioners working in today's software
development industry are quite familiar with the concept of technical debt and
its related negative consequences, there has been no empirical research
focusing specifically on how software managers actively communicate and manage
the need to keep the level of technical debt as low as possible.
","[{""version"":""v1"",""created"":""Tue, 5 Jan 2021 12:47:54 GMT""}]","2021-01-06"
"2101.01488","Ayan Bhattacharjee","Ayan Bhattacharjee and Sandip K. Chakrabarti","Two-Component Advective Flows around Neutron Stars","4 Pages, 5 Figures, 1 Table. Submitted to Journal of Korean
  Astronomical Society. arXiv admin note: substantial text overlap with
  arXiv:1906.10630",,,,"astro-ph.HE","http://arxiv.org/licenses/nonexclusive-distrib/1.0/","  The fundamental difference between accretion around black holes and neutron
stars is the inner boundary condition, which affects the behavior of matter
very close to the compact objects. This leads to formation of additional shocks
and boundary layers for neutron stars. Previous studies on the formation of
such boundary layers focused on Keplerian flows that reached the surface of the
star, either directly or through the formation of a transition layer. However,
behavior of sub-Keplerian matter near the surface of a neutron star has not
been studied in detail. Here, we study the effect of viscosity, in presence of
cooling, on the sub-Keplerian flows around neutron stars, using Smoothed
Particle Hydrodynamics. Our time-dependent study shows that multiple shocks,
transition and boundary layers form in such type of accretion, when viscosity
is significant, and one or more layers are absent when the viscosity is
moderate. These flows are particularly of interest for the wind dominated
systems such as Cir X-1. We also report the formation of a generalized flow
configuration, Two-Component Advective Flow, for the first time.
","[{""version"":""v1"",""created"":""Tue, 5 Jan 2021 12:52:30 GMT""}]","2021-01-06"
"2101.01489","Amit Hogadi","Utsav Choudhury and Amit Hogadi","The Hurewicz map in motivic homotopy theory","9 pages","Ann. K-Th. 7 (2022) 179-190","10.2140/akt.2022.7.179",,"math.AG math.AT","http://creativecommons.org/licenses/by/4.0/","  For an $\A^1$-connected pointed simplicial sheaf $\sX$ over a perfect field
$k$, we prove that the Hurewicz map $\pi_1^{\A^1}(\sX) \to H_1^{\A^1}(\sX)$ is
surjective. We also observe that the Hurewicz map for $\P^1_k$ is the
abelianisation map. In the course of proving this result, we also show that for
any morphism $\phi$ of strongly $\A^1$-invariant sheaves of groups, the image
and kernel of $\phi$ are also strongly $\A^1$-invariant.
","[{""version"":""v1"",""created"":""Tue, 5 Jan 2021 12:54:02 GMT""},{""version"":""v2"",""created"":""Thu, 25 Feb 2021 10:34:07 GMT""}]","2022-06-22"
"2101.01490","Nejc \v{C}eplak","Nejc Ceplak and David Vegh","Pole-skipping and Rarita-Schwinger fields","9 pages, 2 figures","Phys. Rev. D 103, 106009 (2021)","10.1103/PhysRevD.103.106009","QMUL-PH-21-01","hep-th gr-qc","http://creativecommons.org/licenses/by/4.0/","  In this note we analyse the equations of motion of a minimally coupled
Rarita-Schwinger field near the horizon of an anti-de Sitter-Schwarzschild
geometry. We find that at special complex values of the frequency and momentum
there exist two independent regular solutions that are ingoing at the horizon.
These special points in Fourier space are associated with the `pole-skipping'
phenomenon in thermal two-point functions of operators that are holographically
dual to the bulk fields. We find that the leading pole-skipping point is
located at a positive imaginary frequency with the distance from the origin
being equal to half of the Lyapunov exponent for maximally chaotic theories.
","[{""version"":""v1"",""created"":""Tue, 5 Jan 2021 12:55:44 GMT""}]","2021-05-19"
"2101.01491","Maximilian Engel","Maxime Breden and Maximilian Engel","Computer-assisted proof of shear-induced chaos in stochastically
  perturbed Hopf systems",,,,,"math.DS math.PR","http://arxiv.org/licenses/nonexclusive-distrib/1.0/","  We confirm a long-standing conjecture concerning shear-induced chaos in
stochastically perturbed systems exhibiting a Hopf bifurcation. The method of
showing the main chaotic property, a positive Lyapunov exponent, is a
computer-assisted proof. Using the recently developed theory of conditioned
Lyapunov exponents on bounded domains and the modified Furstenberg-Khasminskii
formula, the problem boils down to the rigorous computation of eigenfunctions
of the Kolmogorov operators describing distributions of the underlying
stochastic process.
","[{""version"":""v1"",""created"":""Tue, 5 Jan 2021 12:56:27 GMT""}]","2021-01-06"
"2101.01492","Zhenghe Bai","Zhenghe Bai, Penghui Yang, Guangyao Feng, Weimin Li, Lin Wang","Locally symmetric lattices for storage ring light sources",,,,,"physics.acc-ph","http://creativecommons.org/licenses/by/4.0/","  In this paper, a new lattice concept called the locally symmetric lattice is
proposed for storage ring light sources. In this new lattice, beta functions
are made locally symmetric about two mirror planes of the lattice cell, and the
phase advances between the two mirror planes satisfy the condition of nonlinear
dynamics cancellation. There are two kinds of locally symmetric lattices,
corresponding to two symmetric representations of lattice cell. In a locally
symmetric lattice, main nonlinear effects caused by sextupoles can be
effectively cancelled within one lattice cell, and generally there can also be
many knobs of sextupoles available for further optimizing the nonlinear
dynamics. Two kinds of locally symmetric lattices are designed for a 2.2 GeV
diffraction-limited storage ring to demonstrate the lattice concept.
","[{""version"":""v1"",""created"":""Tue, 5 Jan 2021 13:12:39 GMT""}]","2021-01-06"
"2101.01493","Felix Gerick","Felix Gerick, Dominique Jault, Jerome Noir","Fast Quasi-Geostrophic Magneto-Coriolis Modes in the Earth's core",,,"10.1029/2020GL090803",,"physics.geo-ph physics.flu-dyn","http://creativecommons.org/licenses/by-nc-nd/4.0/","  Fast changes of Earth's magnetic field could be explained by inviscid and
diffusion-less quasi-geostrophic (QG) Magneto-Coriolis modes. We present a
hybrid QG model with columnar flows and three-dimensional magnetic fields and
find modes with periods of a few years at parameters relevant to Earth's core.
For the simple poloidal magnetic field that we consider here they show a
localization of kinetic and magnetic energy in the equatorial region. This
concentration of energy near the equator and the high frequency make them a
plausible mechanism to explain similar features observed in recent geomagnetic
field observations. Our model potentially opens a way to probe the otherwise
inaccessible magnetic field structure in the Earth's outer core.
","[{""version"":""v1"",""created"":""Tue, 5 Jan 2021 13:13:10 GMT""},{""version"":""v2"",""created"":""Tue, 23 Feb 2021 10:04:27 GMT""}]","2021-02-24"
"2101.01494","Tim Verdonck","Jakob Raymaekers, Wouter Verbeke, Tim Verdonck","Weight-of-evidence 2.0 with shrinkage and spline-binning","New version: duplicate paragraph omitted",,,,"stat.ML cs.LG","http://arxiv.org/licenses/nonexclusive-distrib/1.0/","  In many practical applications, such as fraud detection, credit risk modeling
or medical decision making, classification models for assigning instances to a
predefined set of classes are required to be both precise as well as
interpretable. Linear modeling methods such as logistic regression are often
adopted, since they offer an acceptable balance between precision and
interpretability. Linear methods, however, are not well equipped to handle
categorical predictors with high-cardinality or to exploit non-linear relations
in the data. As a solution, data preprocessing methods such as
weight-of-evidence are typically used for transforming the predictors. The
binning procedure that underlies the weight-of-evidence approach, however, has
been little researched and typically relies on ad-hoc or expert driven
procedures. The objective in this paper, therefore, is to propose a formalized,
data-driven and powerful method.
  To this end, we explore the discretization of continuous variables through
the binning of spline functions, which allows for capturing non-linear effects
in the predictor variables and yields highly interpretable predictors taking
only a small number of discrete values. Moreover, we extend upon the
weight-of-evidence approach and propose to estimate the proportions using
shrinkage estimators. Together, this offers an improved ability to exploit both
non-linear and categorical predictors for achieving increased classification
precision, while maintaining interpretability of the resulting model and
decreasing the risk of overfitting.
  We present the results of a series of experiments in a fraud detection
setting, which illustrate the effectiveness of the presented approach. We
facilitate reproduction of the presented results and adoption of the proposed
approaches by providing both the dataset and the code for implementing the
experiments and the presented approach.
","[{""version"":""v1"",""created"":""Tue, 5 Jan 2021 13:13:16 GMT""},{""version"":""v2"",""created"":""Tue, 2 Feb 2021 08:02:49 GMT""},{""version"":""v3"",""created"":""Fri, 24 Sep 2021 15:28:53 GMT""}]","2021-09-27"
"2101.01495","Marc Chaumont","Hugo Ruiz, Mehdi Yedroudj, Marc Chaumont, Fr\'ed\'eric Comby, G\'erard
  Subsol","LSSD: a Controlled Large JPEG Image Database for Deep-Learning-based
  Steganalysis ""into the Wild""","ICPR'2021, International Conference on Pattern Recognition,
  MMForWILD'2021, Workshop on MultiMedia FORensics in the WILD, Lecture Notes
  in Computer Science, LNCS, Springer. January 10-15, 2021, Virtual Conference
  due to Covid (formerly Milan, Italy). Version of December 2020",,,,"cs.CR","http://creativecommons.org/licenses/by/4.0/","  For many years, the image databases used in steganalysis have been relatively
small, i.e. about ten thousand images. This limits the diversity of images and
thus prevents large-scale analysis of steganalysis algorithms.
  In this paper, we describe a large JPEG database composed of 2 million colour
and grey-scale images. This database, named LSSD for Large Scale Steganalysis
Database, was obtained thanks to the intensive use of \enquote{controlled}
development procedures. LSSD has been made publicly available, and we aspire it
could be used by the steganalysis community for large-scale experiments.
  We introduce the pipeline used for building various image database versions.
We detail the general methodology that can be used to redevelop the entire
database and increase even more the diversity. We also discuss computational
cost and storage cost in order to develop images.
","[{""version"":""v1"",""created"":""Tue, 5 Jan 2021 13:14:41 GMT""}]","2021-01-06"
"2101.01496","Maoyuan Xu","Maoyuan Xu and Xiaoping Xie","An efficient feature-preserving PDE algorithm for image denoising based
  on a spatial-fractional anisotropic diffusion equation","23 pages, 8 figures",,,,"math.NA cs.NA eess.IV","http://arxiv.org/licenses/nonexclusive-distrib/1.0/","  How to effectively remove the noise while preserving the image structure
features is a challenging issue in the field of image denoising. In recent
years, fractional PDE based methods have attracted more and more research
efforts due to the ability to balance the noise removal and the preservation of
image edges and textures. Among the existing fractional PDE algorithms, there
are only a few using spatial fractional order derivatives, and all the
fractional derivatives involved are one-sided derivatives. In this paper, an
efficient feature-preserving fractional PDE algorithm is proposed for image
denoising based on a nonlinear spatial-fractional anisotropic diffusion
equation. Two-sided Grumwald-Letnikov fractional derivatives were used in the
PDE model which are suitable to depict the local self-similarity of images. The
Short Memory Principle is employed to simplify the approximation scheme.
Experimental results show that the proposed method is of a satisfactory
performance, i.e. it keeps a remarkable balance between noise removal and
feature preserving, and has an extremely high structural retention property.
","[{""version"":""v1"",""created"":""Tue, 5 Jan 2021 13:17:41 GMT""},{""version"":""v2"",""created"":""Sun, 7 Feb 2021 12:10:31 GMT""},{""version"":""v3"",""created"":""Sat, 8 May 2021 06:39:32 GMT""}]","2021-05-11"
"2101.01497","Jialai Kang","Jia-Lai Kang, Jun-Xian Wang, Wen-Yong Kang","Distinct High Energy Cutoff Variation Patterns in Two Seyfert Galaxies","9 pages, 6 figures, accepted by MNRAS",,"10.1093/mnras/stab039",,"astro-ph.HE astro-ph.GA","http://arxiv.org/licenses/nonexclusive-distrib/1.0/","  Investigating how the cutoff energy $E_{\rm cut}$ varies with X-ray flux and
photon index $\Gamma$ in individual AGNs opens a new window to probe the yet
unclear coronal physics. So far $E_{\rm cut}$ variations have only been
detected in several AGNs but different patterns have been reported. Here we
report new detections of $E_{\rm cut}$ variations in two Seyfert galaxies with
multiple NuSTAR exposures. While in NGC 3227 $E_{\rm cut}$ monotonically
increases with $\Gamma$, the $E_{\rm cut}$-$\Gamma$ relation exhibits a
$\Lambda$ shape in SWIFT J2127.4+5654 ($E_{\rm cut}$ increasing with $\Gamma$
at $\Gamma$ $\lesssim$ 2.05, but reversely decreasing at $\Gamma$ $\gtrsim$
2.05), indicating more than a single underlying mechanism is involved.
Meanwhile both galaxies show softer spectra while they brighten in X-ray, a
common phenomenon in Seyfert galaxies. Plotting all 7 AGNs with $E_{\rm cut}$
variations ever reported with NuSTAR observations in the $E_{\rm cut}$-$\Gamma$
diagram, we find they could be unified with the $\Lambda$ pattern. Although the
sample is small and SWIFT J2127.4+5654 is the only source with $\Gamma$ varying
across the break point thus the only one exhibiting the complete $\Lambda$
pattern in a single source, the discoveries shed new light on the coronal
physics in AGNs. Possible underlying physical mechanisms are discussed.
","[{""version"":""v1"",""created"":""Tue, 5 Jan 2021 13:25:36 GMT""}]","2021-01-13"
