"2101.01332","Yichen Yang","Yichen Yang, Phitchaya Mangpo Phothilimtha, Yisu Remy Wang, Max
  Willsey, Sudip Roy, Jacques Pienaar","Equality Saturation for Tensor Graph Superoptimization",,,,,"cs.AI cs.DC","http://arxiv.org/licenses/nonexclusive-distrib/1.0/","  One of the major optimizations employed in deep learning frameworks is graph
rewriting. Production frameworks rely on heuristics to decide if rewrite rules
should be applied and in which order. Prior research has shown that one can
discover more optimal tensor computation graphs if we search for a better
sequence of substitutions instead of relying on heuristics. However, we observe
that existing approaches for tensor graph superoptimization both in production
and research frameworks apply substitutions in a sequential manner. Such
sequential search methods are sensitive to the order in which the substitutions
are applied and often only explore a small fragment of the exponential space of
equivalent graphs. This paper presents a novel technique for tensor graph
superoptimization that employs equality saturation to apply all possible
substitutions at once. We show that our approach can find optimized graphs with
up to 16% speedup over state-of-the-art, while spending on average 48x less
time optimizing.
","[{""version"":""v1"",""created"":""Tue, 5 Jan 2021 03:30:35 GMT""},{""version"":""v2"",""created"":""Wed, 17 Mar 2021 15:05:06 GMT""}]","2021-03-18"
"2101.01333","Hai Li Dr","Hai Li, Xiang Hu, and Gang Ouyang","Anisotropic Andreev reflection in semi-Dirac materials",,,,,"cond-mat.mes-hall cond-mat.supr-con","http://arxiv.org/licenses/nonexclusive-distrib/1.0/","  In the framework of Bogoliubov-de Gennes equation, we theoretically study the
Andreev reflection in normal-superconducting junctions based on semi-Dirac
materials. Owing to the intrinsic anisotropy of semi-Dirac materials, the
configuration of Andreev reflection and differential conductance are strongly
orientation-dependent. For the transport along the linear dispersion direction,
the differential conductance exhibits a clear crossover from retro Andreev
reflection to specular Andreev reflection with an increasing bias-voltage, and
the differential conductance oscillates without a decaying profile when the
interfacial barrier strength increases. However, for the transport along the
quadratic dispersion direction, the boundary between the retro Andreev
reflection and specular Andreev reflection is ambiguous, and the differential
conductance decays with increasing the momentum mismatch or the interfacial
barrier strength. We illustrate the pseudo-spin textures to reveal the
underling physics behind the anisotropic coherent transport properties. These
results enrich the understanding of the superconducting coherent transport in
semi-Dirac materials.
","[{""version"":""v1"",""created"":""Tue, 5 Jan 2021 03:34:30 GMT""}]","2021-01-06"
"2101.01334","Sonu Aggarwal","Akshay Agarwal, Shashank Maiya, Sonu Aggarwal","Evaluating Empathetic Chatbots in Customer Service Settings","8 pages, 7 figures",,,,"cs.CL","http://creativecommons.org/licenses/by/4.0/","  Customer service is a setting that calls for empathy in live human agent
responses. Recent advances have demonstrated how open-domain chatbots can be
trained to demonstrate empathy when responding to live human utterances. We
show that a blended skills chatbot model that responds to customer queries is
more likely to resemble actual human agent response if it is trained to
recognize emotion and exhibit appropriate empathy, than a model without such
training. For our analysis, we leverage a Twitter customer service dataset
containing several million customer<->agent dialog examples in customer service
contexts from 20 well-known brands.
","[{""version"":""v1"",""created"":""Tue, 5 Jan 2021 03:34:35 GMT""}]","2021-01-06"
"2101.01335","Hoang-Dung Do","Hoang-Dung Do, Valerie Hayot-Sasson, Rafael Ferreira da Silva,
  Christopher Steele, Henri Casanova, Tristan Glatard","Modeling the Linux page cache for accurate simulation of data-intensive
  applications","10 pages, 8 figures, CCGrid",,,,"cs.DC cs.PF","http://arxiv.org/licenses/nonexclusive-distrib/1.0/","  The emergence of Big Data in recent years has resulted in a growing need for
efficient data processing solutions. While infrastructures with sufficient
compute power are available, the I/O bottleneck remains. The Linux page cache
is an efficient approach to reduce I/O overheads, but few experimental studies
of its interactions with Big Data applications exist, partly due to limitations
of real-world experiments. Simulation is a popular approach to address these
issues, however, existing simulation frameworks do not simulate page caching
fully, or even at all. As a result, simulation-based performance studies of
data-intensive applications lead to inaccurate results.
  In this paper, we propose an I/O simulation model that includes the key
features of the Linux page cache. We have implemented this model as part of the
WRENCH workflow simulation framework, which itself builds on the popular
SimGrid distributed systems simulation framework. Our model and its
implementation enable the simulation of both single-threaded and multithreaded
applications, and of both writeback and writethrough caches for local or
network-based filesystems. We evaluate the accuracy of our model in different
conditions, including sequential and concurrent applications, as well as local
and remote I/Os. We find that our page cache model reduces the simulation error
by up to an order of magnitude when compared to state-of-the-art, cacheless
simulations.
","[{""version"":""v1"",""created"":""Tue, 5 Jan 2021 03:36:36 GMT""}]","2021-01-06"
"2101.01336","Qiyu Hu","Qiyu Hu, Yanzhen Liu, Yunlong Cai, Guanding Yu, and Zhi Ding","Joint Deep Reinforcement Learning and Unfolding: Beam Selection and
  Precoding for mmWave Multiuser MIMO with Lens Arrays",,,,,"cs.IT cs.LG eess.SP math.IT","http://arxiv.org/licenses/nonexclusive-distrib/1.0/","  The millimeter wave (mmWave) multiuser multiple-input multiple-output
(MU-MIMO) systems with discrete lens arrays (DLA) have received great attention
due to their simple hardware implementation and excellent performance. In this
work, we investigate the joint design of beam selection and digital precoding
matrices for mmWave MU-MIMO systems with DLA to maximize the sum-rate subject
to the transmit power constraint and the constraints of the selection matrix
structure. The investigated non-convex problem with discrete variables and
coupled constraints is challenging to solve and an efficient framework of joint
neural network (NN) design is proposed to tackle it. Specifically, the proposed
framework consists of a deep reinforcement learning (DRL)-based NN and a
deep-unfolding NN, which are employed to optimize the beam selection and
digital precoding matrices, respectively. As for the DRL-based NN, we formulate
the beam selection problem as a Markov decision process and a double deep
Q-network algorithm is developed to solve it. The base station is considered to
be an agent, where the state, action, and reward function are carefully
designed. Regarding the design of the digital precoding matrix, we develop an
iterative weighted minimum mean-square error algorithm induced deep-unfolding
NN, which unfolds this algorithm into a layerwise structure with introduced
trainable parameters. Simulation results verify that this jointly trained NN
remarkably outperforms the existing iterative algorithms with reduced
complexity and stronger robustness.
","[{""version"":""v1"",""created"":""Tue, 5 Jan 2021 03:55:04 GMT""}]","2021-01-06"
"2101.01337","Mohammed Alawad","Mohammed Alawad, Shang Gao, Mayanka Chandra Shekar, S.M.Shamimul
  Hasan, J. Blair Christian, Xiao-Cheng Wu, Eric B. Durbin, Jennifer Doherty,
  Antoinette Stroup, Linda Coyle, Lynne Penberthy, Georgia Tourassi","Integration of Domain Knowledge using Medical Knowledge Graph Deep
  Learning for Cancer Phenotyping",,,,,"cs.CL cs.LG","http://arxiv.org/licenses/nonexclusive-distrib/1.0/","  A key component of deep learning (DL) for natural language processing (NLP)
is word embeddings. Word embeddings that effectively capture the meaning and
context of the word that they represent can significantly improve the
performance of downstream DL models for various NLP tasks. Many existing word
embeddings techniques capture the context of words based on word co-occurrence
in documents and text; however, they often cannot capture broader
domain-specific relationships between concepts that may be crucial for the NLP
task at hand. In this paper, we propose a method to integrate external
knowledge from medical terminology ontologies into the context captured by word
embeddings. Specifically, we use a medical knowledge graph, such as the unified
medical language system (UMLS), to find connections between clinical terms in
cancer pathology reports. This approach aims to minimize the distance between
connected clinical concepts. We evaluate the proposed approach using a
Multitask Convolutional Neural Network (MT-CNN) to extract six cancer
characteristics -- site, subsite, laterality, behavior, histology, and grade --
from a dataset of ~900K cancer pathology reports. The results show that the
MT-CNN model which uses our domain informed embeddings outperforms the same
MT-CNN using standard word2vec embeddings across all tasks, with an improvement
in the overall micro- and macro-F1 scores by 4.97\%and 22.5\%, respectively.
","[{""version"":""v1"",""created"":""Tue, 5 Jan 2021 03:59:43 GMT""}]","2021-01-06"
"2101.01338","Zhaohui Yang","Zhaohui Yang, Mingzhe Chen, Kai-Kit Wong, H. Vincent Poor, Shuguang
  Cui","Federated Learning for 6G: Applications, Challenges, and Opportunities",,,,,"cs.IT math.IT","http://creativecommons.org/licenses/by-sa/4.0/","  Traditional machine learning is centralized in the cloud (data centers).
Recently, the security concern and the availability of abundant data and
computation resources in wireless networks are pushing the deployment of
learning algorithms towards the network edge. This has led to the emergence of
a fast growing area, called federated learning (FL), which integrates two
originally decoupled areas: wireless communication and machine learning. In
this paper, we provide a comprehensive study on the applications of FL for
sixth generation (6G) wireless networks. First, we discuss the key requirements
in applying FL for wireless communications. Then, we focus on the motivating
application of FL for wireless communications. We identify the main problems,
challenges, and provide a comprehensive treatment of implementing FL techniques
for wireless communications.
","[{""version"":""v1"",""created"":""Tue, 5 Jan 2021 04:02:44 GMT""}]","2021-01-06"
"2101.01339","Sudipta Mallik","Sudipta Mallik","A New Formula for the Minimum Distance of an Expander Code",,,,,"math.CO cs.IT math.IT","http://arxiv.org/licenses/nonexclusive-distrib/1.0/","  An expander code is a binary linear code whose parity-check matrix is the
bi-adjacency matrix of a bipartite expander graph. We provide a new formula for
the minimum distance of such codes. We also provide a new proof of the result
that $2(1-\varepsilon) \gamma n$ is a lower bound of the minimum distance of
the expander code given by a $(m,n,d,\gamma,1-\varepsilon)$ expander bipartite
graph.
","[{""version"":""v1"",""created"":""Tue, 5 Jan 2021 04:03:02 GMT""}]","2021-01-06"
"2101.01340","Ying Liu","Jiaxing Chen, Ying Liu, Ming Tang, Jing Yue","Asymmetrically interacting dynamics with mutual confirmation from
  multi-source on multiplex networks","13 pages,8 figures",,,,"physics.soc-ph","http://arxiv.org/licenses/nonexclusive-distrib/1.0/","  In the early stage of epidemics, individuals' determination on adopting
protective measures, which can reduce their risk of infection and suppress
disease spreading, is likely to depend on multiple information sources and
their mutual confirmation due to inadequate exact information. Here we
introduce the inter-layer mutual confirmation mechanism into the
information-disease interacting dynamics on multiplex networks. In our model,
an individual increases the information transmission rate and willingness to
adopt protective measures once he confirms the authenticity of news and
severity of disease from neighbors status in multiple layers. By using the
microscopic Markov chain approach, we analytically calculate the epidemic
threshold and the awareness and infected density in the stationary state, which
agree well with simulation results. We find that the increment of epidemic
threshold when confirming the aware neighbors on communication layer is larger
than that of the contact layer. On the contrary, the confirmation of neighbors'
awareness and infection from the contact layer leads to a lower final infection
density and a higher awareness density than that of the communication layer.
The results imply that individuals' explicit exposure of their infection and
awareness status to neighbors, especially those with real contacts, is helpful
in suppressing epidemic spreading.
","[{""version"":""v1"",""created"":""Tue, 5 Jan 2021 04:03:08 GMT""}]","2021-01-06"
"2101.01341","Bo Hui","Bo Hui, Yuchen Yang, Haolin Yuan, Philippe Burlina, Neil Zhenqiang
  Gong and Yinzhi Cao","Practical Blind Membership Inference Attack via Differential Comparisons",,,"10.14722/ndss.2021.24293",,"cs.CR cs.LG","http://arxiv.org/licenses/nonexclusive-distrib/1.0/","  Membership inference (MI) attacks affect user privacy by inferring whether
given data samples have been used to train a target learning model, e.g., a
deep neural network. There are two types of MI attacks in the literature, i.e.,
these with and without shadow models. The success of the former heavily depends
on the quality of the shadow model, i.e., the transferability between the
shadow and the target; the latter, given only blackbox probing access to the
target model, cannot make an effective inference of unknowns, compared with MI
attacks using shadow models, due to the insufficient number of qualified
samples labeled with ground truth membership information.
  In this paper, we propose an MI attack, called BlindMI, which probes the
target model and extracts membership semantics via a novel approach, called
differential comparison. The high-level idea is that BlindMI first generates a
dataset with nonmembers via transforming existing samples into new samples, and
then differentially moves samples from a target dataset to the generated,
non-member set in an iterative manner. If the differential move of a sample
increases the set distance, BlindMI considers the sample as non-member and vice
versa.
  BlindMI was evaluated by comparing it with state-of-the-art MI attack
algorithms. Our evaluation shows that BlindMI improves F1-score by nearly 20%
when compared to state-of-the-art on some datasets, such as Purchase-50 and
Birds-200, in the blind setting where the adversary does not know the target
model's architecture and the target dataset's ground truth labels. We also show
that BlindMI can defeat state-of-the-art defenses.
","[{""version"":""v1"",""created"":""Tue, 5 Jan 2021 04:07:15 GMT""},{""version"":""v2"",""created"":""Thu, 7 Jan 2021 02:24:04 GMT""}]","2022-08-17"
"2101.01342","Masato Shirasaki","Masato Shirasaki, Eiichi Egami, Nobuhiro Okabe, Satoshi Miyazaki","Stacked phase-space density of galaxies around massive clusters:
  Comparison of dynamical and lensing masses","22 pages, 8 figures, 3 tables. Accepted for publication in MNRAS",,"10.1093/mnras/stab1961",,"astro-ph.GA astro-ph.CO","http://arxiv.org/licenses/nonexclusive-distrib/1.0/","  We present a measurement of average histograms of line-of-sight velocities
over pairs of galaxies and galaxy clusters. Since the histogram can be measured
at different galaxy-cluster separations, this observable is commonly referred
to as the stacked phase-space density. We formulate the stacked phase-space
density based on a halo-model approach so that the model can be applied to real
samples of galaxies and clusters. We examine our model by using an actual
sample of massive clusters with known weak-lensing masses and spectroscopic
observations of galaxies around the clusters. A likelihood analysis with our
model enables us to infer the spherical-symmetric velocity dispersion of
observed galaxies in massive clusters. We find the velocity dispersion of
galaxies surrounding clusters with their lensing masses of $1.1\times10^{15}\,
h^{-1}M_{\odot}$ to be $1180^{+83}_{-70}\, \mathrm{km/s}$ at the 68\%
confidence level. Our constraint confirms that the relation between the galaxy
velocity dispersion and the host cluster mass in our sample is consistent with
the prediction in dark-matter-only N-body simulations under General Relativity.
Assuming that the Poisson equation in clusters can be altered by an effective
gravitational constant of $G_\mathrm{eff}$, our measurement of the velocity
dispersion can place a tight constraint of $0.88 < G_\mathrm{eff}/G_\mathrm{N}
< 1.29\, (68\%)$ at length scales of a few Mpc about $2.5$ Giga years ago,
where $G_\mathrm{N}$ is the Newton's constant.
","[{""version"":""v1"",""created"":""Tue, 5 Jan 2021 04:11:17 GMT""},{""version"":""v2"",""created"":""Wed, 7 Jul 2021 02:09:28 GMT""}]","2021-07-21"
"2101.01343","Hsiang-Kuang Chang","Jr-Yue Hsiang and Hsiang-Kuang Chang","The power-law component of the X-ray emissions from pulsar wind nebulae
  and their pulsars","10 pages, 5 figures, accepted for publication in MNRAS",,"10.1093/mnras/stab025",,"astro-ph.HE","http://arxiv.org/licenses/nonexclusive-distrib/1.0/","  To look for possible phenomenological connections between pulsar's timing
properties and emissions from pulsar wind nebulae and their pulsars, we studied
the power-law component of the X-ray emissions from 35 pulsar wind nebulae
which have a detected pulsar in X-rays. Our major results are in the following:
(1) The power-law component of the X-ray luminosities, in the energy range from
0.5 keV to 8 keV, of the nebulae and of the pulsar both show a strong
correlation with the pulsar spin-down power ($\dot{E}$), consistent with
earlier studies. However, equally significant correlations with the magnetic
field strength at the light cylinder ($B_{\rm lc}$) are also found. The similar
significance level of the correlations with $\dot{E}$ and with $B_{\rm lc}$
suggests that not only $\dot{E}$ but also $B_{\rm lc}$ plays an important role
in understanding these power-law emissions. (2) Thermal X-ray emissions are
detected in 12 pulsars among the 35 samples. With derived temperature as one
additional variable, we found that the photon indices of pulsar's non-thermal
X-ray power-law spectra can be well described by a linear function of $\log P$,
$\log\dot{P}$ and temperature logarithm $\log T$. It indicates that the surface
temperature of neutron stars plays an important role in determining the energy
distribution of the radiating pair plasma in pulsar's magnetospheres.
","[{""version"":""v1"",""created"":""Tue, 5 Jan 2021 04:14:48 GMT""}]","2021-10-13"
"2101.01344","Leiyi Li","Hui Deng, Jing Gao, Lei-Yi Li, Cai-Dian L\""u, Yue-Long Shen, Chun-Xu
  Yu","Study on pure annihilation type B to V gamma decays","radiative decay, annihilation topology, vector meson mixing","Phys. Rev. D 103, 076004 (2021)","10.1103/PhysRevD.103.076004",,"hep-ph","http://creativecommons.org/licenses/by/4.0/","  We investigate the pure annihilation type radiative $B$ meson decays $B^0 \to
\phi \gamma$ and $B_s \to \rho^0(\omega)\gamma$ in the soft-collinear effective
theory. We consider three types of contributions to the decay amplitudes,
including the direct annihilation topology, the contribution from the
electro-magnetic penguin operator and the contribution of the neutral vector
meson mixings. The numerical analysis shows that the decay amplitudes are
dominated by the $\omega-\phi$ mixing effect in the $B^0 \to \phi\gamma$ and
$B_s \to \omega\gamma$ modes. The corresponding decay branching ratios are
enhanced about three orders of magnitudes relative to the pure annihilation
type contribution in these two decay channels. The decay rate of $B_s \to
\rho^0\gamma$ is much smaller than that of $B_s \to \omega\gamma$ because of
the smaller $\rho^0-\phi$ mixing. The predicted branching ratios
$B(B^{0}\rightarrow\phi\gamma)=(3.99^{+1.67}_{-1.46}
)\times10^{-9},\,B(B_s\rightarrow\omega\gamma)=(2.01^{+0.81}_{-0.71}
)\times10^{-7}$ are to be tested by the Belle-II and LHC-b experiments.
","[{""version"":""v1"",""created"":""Tue, 5 Jan 2021 04:21:13 GMT""}]","2021-04-14"
"2101.01345","Sam Walters","Samuel G. Walters","K-Theory of Approximately Central Projections in the Flip Orbifold","51 pages, 2 figures",,,,"math.OA","http://arxiv.org/licenses/nonexclusive-distrib/1.0/","  For an approximately central (AC) Powers-Rieffel projection $e$ in the
irrational Flip orbifold C*-algebra $A_\theta^\Phi,$ where $\Phi$ is the Flip
automorphism of the rotation C*-algebra $A_\theta,$ we compute the Connes-Chern
character of the cutdown of any projection by $e$ in terms of K-theoretic
invariants of these projections. This result is then applied to computing a
complete K-theoretic invariant for the projection $e$ with respect to central
equivalence (within the orbifold). Thus, in addition to the canonical trace,
there is a $4\times6$ K-matrix invariant $K(e)$ arising from unbounded traces
of the cutdowns of a canonically constructed basis for $K_0(A_\theta^\Phi) =
\mathbb Z^6$. Thanks to a theorem of Kishimoto, this enables us to tell when AC
projections in $A_\theta^\Phi$ are Murray-von Neumann equivalent via an
approximately central partial isometry (or unitary) in $A_\theta^\Phi$. As
additional application, we obtain the K-matrix of canonical SL$(2,\mathbb
Z)$-automorphisms of $e$ and show that there is a subsequence of $e$ such that
$e, \sigma(e), \kappa(e), \kappa^2(e), \sigma\kappa(e), \sigma\kappa^2(e)$ --
which are the orbit elements of $e$ under the symmetric group $S_3 \subset$
SL$(2,\mathbb Z)$ -- are pairwise centrally not equivalent, and that each
SL$(2,\mathbb Z)$ image of $e$ is centrally equivalent to one of these, where
$\sigma, \kappa$ are the Fourier and Cubic transform automorphisms of the
rotation algebra.
","[{""version"":""v1"",""created"":""Tue, 5 Jan 2021 04:26:57 GMT""}]","2021-01-06"
"2101.01346","Dorin Popescu","Dorin Popescu","Valuation rings of mixed characteristic as limits of complete
  intersection rings","arXiv admin note: text overlap with arXiv:2004.11004",,,,"math.AC","http://creativecommons.org/publicdomain/zero/1.0/","  We show that a mixed characteristic valuation ring with a value group
$\Gamma$ and a residue field $k$ of characteristic $p>0$, is a filtered direct
limit of complete intersection $\bf Z$-algebras if $\Gamma/{\bf Z}\val(p)$ has
no torsion, $k$ is separably generated over $F_p$ and either $V$ is Henselian,
or $\dim V=1$ .
","[{""version"":""v1"",""created"":""Tue, 5 Jan 2021 04:37:38 GMT""}]","2021-01-06"
"2101.01347","Jaime Besprosvany","J. Besprosvany","Compositeness, Bargmann-Wigner solutions within a U(1)-interaction
  quantum-field-theory expansion, and charge","25 pages, 1 figure, 57 references",,,,"hep-ph hep-th","http://creativecommons.org/licenses/by-nc-nd/4.0/","  New solutions of the Bargmann-Wigner equations are obtained: free
fermion-antifermion pairs, each satisfying Dirac's equation, with parallel
momenta and momenta on a plane, produce vectors satisfying Proca's equations.
These equations are consistent with Dirac's and Maxwell's equations, as
zero-order conditions within a Lagrangian expansion for the U(1)-symmetry
quantum field theory. Such vector solutions' demand that they satisfy Maxwell's
equations and quantization fix the charge. The current equates the vector
field, reproducing the superconductivity London equations, thus, binding and
screening conditions. The derived vertex connects to QCD superconductivity and
constrains four-fermion interaction composite models.
","[{""version"":""v1"",""created"":""Tue, 5 Jan 2021 04:42:06 GMT""}]","2021-01-06"
"2101.01348","Taekyun Kim","Taekyun Kim, Dae San Kim, Lee-Chae Jang, Hyunseok Lee, Han-Young Kim","Complete and incomplete Bell polynomials associated with Lah-Bell
  numbers and polynomials","10 pages",,,,"math.CO math.NT","http://creativecommons.org/publicdomain/zero/1.0/","  The nth r-extended Lah-Bell number is defined as the number of ways a set
with $n+r$ elements can be partitioned into ordered blocks such that r
distinguished elements have to be in distinct ordered blocks. The aim of this
paper is to introduce incomplete r-extended Lah-Bell polynomials and complete
$r$-extended Lah-Bell polynomials respectively as multivariate versions of
$r$-Lah numbers and the r-extended Lah-Bell numbers and to investigate some
properties and identities for these polynomials. From these investigations, we
obtain some expressions for the r-Lah numbers and the r-extended Lah-Bell
numbers as finite sums.
","[{""version"":""v1"",""created"":""Tue, 5 Jan 2021 04:42:44 GMT""}]","2021-01-06"
