"2101.01202","Daniel Jontof-Hutter","Daniel Jontof-Hutter, Angie Wolfgang, Eric B. Ford, Jack J. Lissauer,
  Daniel C. Fabrycky and Jason F. Rowe","Following up the Kepler field: Masses of Targets for transit timing and
  atmospheric characterization","70 pages, 33 figures","AJ,161,246J (2021)","10.3847/1538-3881/abd93f",,"astro-ph.EP","http://creativecommons.org/licenses/by-nc-nd/4.0/","  We identify a set of planetary systems observed by Kepler that merit transit
timing variation (TTV) analysis given the orbital periods of transiting
planets, the uncertainties for their transit times and the number of transits
observed during the Kepler mission. We confirm the planetary nature of 4 KOIs
within multicandidate systems. We forward model each of the planetary systems
identified to determine which systems are likely to yield mass constraints that
may be significantly improved upon with follow-up transit observations. We find
projected TTVs diverge by more than 90 minutes after 6000 days in 27 systems,
including 22 planets with orbital periods exceeding 25 days. Such targets would
benefit the most from additional transit timing data. TTV follow-up could push
exoplanet characterization to lower masses, at greater orbital periods and at
cooler equilibrium temperatures than is currently possible from the Kepler
dataset alone. Combining TTVs and recently revised stellar parameters, we
characterize an ensemble of homogeneously selected planets and identify planets
in the Kepler field with large enough estimated transmission annuli for
atmospheric characterization with JWST.
","[{""version"":""v1"",""created"":""Mon, 4 Jan 2021 19:06:33 GMT""},{""version"":""v2"",""created"":""Thu, 27 May 2021 19:31:07 GMT""}]","2021-05-31"
"2101.01203","Paul Rodgers Mr","Oscar J. C. Dias, Ramon Masachs, Paul Rodgers","Boson stars and solitons confined in a Minkowski box","35 pages; 17 figures. v2: Added right panel of Fig. 2 with details of
  secondary soliton family and associated discussion",,"10.1007/JHEP04(2021)236",,"gr-qc hep-th","http://arxiv.org/licenses/nonexclusive-distrib/1.0/","  We consider the static charged black hole bomb system, originally designed
for a (uncharged) rotating superradiant system by Press and Teukolsky. A
charged scalar field confined in a Minkowski cavity with a Maxwell gauge field
has a quantized spectrum of normal modes that can fit inside the box.
Back-reacting non-linearly these normal modes, we find the hairy solitons,
a.k.a boson stars (depending on the chosen $U(1)$ gauge), of the theory. The
scalar condensate is totally confined inside the box and, outside it, we have
the Reissner-Nordstr\""om solution. The Israel junction conditions at the box
surface layer determine the stress tensor that the box must have to confine the
scalar hair. Some of these horizonless hairy solutions exist for any value of
the scalar field charge and not only above the natural critical charges of the
theory (namely, the critical charges for the onset of the near-horizon and
superradiant instabilities of the Reissner-Nordstr\""om black hole). However,
the ground state solutions have a non-trivial intricate phase diagram with a
main and a secondary family of solitons (some with a Chandrasekhar mass limit
but others without) and there are a third and a fourth critical scalar field
charges where the soliton spectra changes radically. Most of these intricate
properties are not captured by a higher order perturbative analysis of the
problem where we simply back-react a normal mode of the system.
","[{""version"":""v1"",""created"":""Mon, 4 Jan 2021 19:08:31 GMT""},{""version"":""v2"",""created"":""Thu, 11 Feb 2021 09:19:20 GMT""}]","2021-05-12"
"2101.01204","Lawrence Thul","Lawrence Thul, Warren Powell","Stochastic Optimization for Vaccine and Testing Kit Allocation for the
  COVID-19 Pandemic",,,,,"cs.AI cs.LG","http://creativecommons.org/licenses/by-nc-nd/4.0/","  The pandemic caused by the SARS-CoV-2 virus has exposed many flaws in the
decision-making strategies used to distribute resources to combat global health
crises. In this paper, we leverage reinforcement learning and optimization to
improve upon the allocation strategies for various resources. In particular, we
consider a problem where a central controller must decide where to send testing
kits to learn about the uncertain states of the world (active learning); then,
use the new information to construct beliefs about the states and decide where
to allocate resources. We propose a general model coupled with a tunable
lookahead policy for making vaccine allocation decisions without perfect
knowledge about the state of the world. The lookahead policy is compared to a
population-based myopic policy which is more likely to be similar to the
present strategies in practice. Each vaccine allocation policy works in
conjunction with a testing kit allocation policy to perform active learning.
Our simulation results demonstrate that an optimization-based lookahead
decision making strategy will outperform the presented myopic policy.
","[{""version"":""v1"",""created"":""Mon, 4 Jan 2021 19:08:32 GMT""}]","2021-01-06"
"2101.01205","Alexa Morales","Alexa Morales, Charlotte Mason, Sean Bruton, Max Gronke, Francesco
  Haardt, Claudia Scarlata","The Evolution of the Lyman-Alpha Luminosity Function During Reionization","20 pages, 10 figures, submitted to ApJ",,"10.3847/1538-4357/ac1104",,"astro-ph.GA astro-ph.CO","http://arxiv.org/licenses/nonexclusive-distrib/1.0/","  The time frame in which hydrogen reionization occurred is highly uncertain,
but can be constrained by observations of Lyman-alpha (Ly$\alpha$) emission
from distant sources. Neutral hydrogen in the intergalactic medium (IGM)
attenuates Ly$\alpha$~photons emitted by galaxies. As reionization progressed
the IGM opacity decreased, increasing Ly$\alpha$~visibility. The galaxy
Ly$\alpha$~luminosity function (LF) is thus a useful tool to constrain the
timeline of reionization. In this work, we model the Ly$\alpha$~LF as a
function of redshift, $z=5-10$, and average IGM neutral hydrogen fraction,
$\overline{x}_\textsc{hi}$. We combine the Ly$\alpha$~luminosity probability
distribution obtained from inhomogeneous reionization simulations with a model
for the UV LF to model the Ly$\alpha$~LF. As the neutral fraction increases,
the average number density of Ly$\alpha$~emitting galaxies decreases, and are
less luminous, though for $\overline{x}_\textsc{hi} \lesssim 0.4$ there is only
a small decrease of the Ly$\alpha$~LF. We use our model to infer the IGM
neutral fraction at $z=6.6, 7.0, 7.3$ from observed Ly$\alpha$~LFs. We conclude
that there is a significant increase in the neutral fraction with increasing
redshift: $\overline{x}_\textsc{hi}(z=6.6)=0.08^{+ 0.08}_{- 0.05}, \,
\overline{x}_\textsc{hi}(z=7.0)=0.28 \pm 0.05$ and
$\overline{x}_\textsc{hi}(z=7.3)=0.83^{+ 0.06}_{- 0.07}$. We predict trends in
the Ly$\alpha$~luminosity density and Schechter parameters as a function of
redshift and the neutral fraction. We find that the Ly$\alpha$~luminosity
density decreases as the universe becomes more neutral. Furthermore, as the
neutral fraction increases, the faint-end slope of the Ly$\alpha$~LF steepens,
and the characteristic Ly$\alpha$~luminosity shifts to lower values, concluding
that the evolving shape of the Ly$\alpha$~LF -- not just its integral -- is an
important tool to study reionization.
","[{""version"":""v1"",""created"":""Mon, 4 Jan 2021 19:10:30 GMT""},{""version"":""v2"",""created"":""Thu, 1 Jul 2021 17:43:27 GMT""},{""version"":""v3"",""created"":""Fri, 2 Jul 2021 15:06:54 GMT""}]","2021-10-05"
"2101.01206","Zhichao Wang","Zhichao Wang","Conformal upper bounds for the volume spectrum","17 pages; comments are welcome!",,,,"math.DG math.GT math.SP","http://creativecommons.org/licenses/by/4.0/","  In this paper, we prove upper bounds for the volume spectrum of a Riemannian
manifold that depend only on the volume, dimension and a conformal invariant.
","[{""version"":""v1"",""created"":""Mon, 4 Jan 2021 19:14:37 GMT""}]","2021-01-06"
"2101.01207","Chloe He","Chloe He, Raksha Jain, J\'er\^ome Chambost, C\'eline Jacques, Cristina
  Hickman","Semantic Video Segmentation for Intracytoplasmic Sperm Injection
  Procedures","Accepted at the 'Medical Imaging meets NeurIPS Workshop' at the 34th
  Conference on Neural Information Processing Systems",,,,"cs.CV cs.LG","http://creativecommons.org/licenses/by/4.0/","  We present the first deep learning model for the analysis of intracytoplasmic
sperm injection (ICSI) procedures. Using a dataset of ICSI procedure videos, we
train a deep neural network to segment key objects in the videos achieving a
mean IoU of 0.962, and to localize the needle tip achieving a mean pixel error
of 3.793 pixels at 14 FPS on a single GPU. We further analyze the variation
between the dataset's human annotators and find the model's performance to be
comparable to human experts.
","[{""version"":""v1"",""created"":""Mon, 4 Jan 2021 19:33:12 GMT""}]","2023-03-03"
"2101.01208","Kumbakonam Rajagopal","K. R. Rajagopal","An implicit constitutive relation in which the stress and the linearized
  strain appear linearly, for describing the small displacement gradient
  response of elastic solids",,,,,"physics.class-ph","http://arxiv.org/licenses/nonexclusive-distrib/1.0/","  In this short note we develop a constitutive relation that is linear in both
the Cauchy stress and the linearized strain, by linearizing implicit
constitutive relations between the stress and the deformation gradient that
have been put into place to describe the response of elastic bodies (see
\cite{rajagopal2003implicit}), by assuming that the displacement gradient is
small. These implicit equations include the classical linearized elastic
constitutive approximation as well as constitutive relations that imply
limiting strain, as special subclasses.
","[{""version"":""v1"",""created"":""Mon, 4 Jan 2021 19:35:15 GMT""}]","2021-01-06"
"2101.01209","Christopher Shingledecker","Ella Mullikin, Hannah Anderson, Natalie O'Hern, Megan Farrah,
  Christopher R. Arumainayagam, Ewine F. van Dishoeck, Perry A. Gerakines,
  Anton I. Vasyunin, Liton Majumdar, Paola Caselli, and Christopher N.
  Shingledecker","A New Method for Simulating Photoprocesses in Astrochemical Models","ApJ, accepted: 15 pages, 3 figures",,"10.3847/1538-4357/abd778",,"astro-ph.GA cond-mat.mtrl-sci physics.chem-ph physics.comp-ph physics.space-ph","http://creativecommons.org/licenses/by/4.0/","  We propose a new model for treating solid-phase photoprocesses in
interstellar ice analogues. In this approach, photoionization and
photoexcitation are included in more detail, and the production of
electronically-excited (suprathermal) species is explicitly considered. In
addition, we have included non-thermal, non-diffusive chemistry to account for
the low-temperature characteristic of cold cores. As an initial test of our
method, we have simulated two previous experimental studies involving the UV
irradiation of pure solid O$_2$. In contrast to previous solid-state
astrochemical model calculations which have used gas-phase photoabsorption
cross-sections, we have employed solid-state cross-sections in our
calculations. This method allows the model to be tested using well-constrained
experiments rather than poorly constrained gas-phase abundances in ISM regions.
Our results indicate that inclusion of non-thermal reactions and suprathermal
species allows for reproduction of low-temperature solid-phase photoprocessing
that simulate interstellar ices within cold ($\sim$ 10 K) dense cores such as
TMC-1.
","[{""version"":""v1"",""created"":""Mon, 4 Jan 2021 19:38:45 GMT""},{""version"":""v2"",""created"":""Fri, 5 Feb 2021 20:22:57 GMT""}]","2021-04-07"
"2101.01210","Andreas Kleefeld","Andreas Kleefeld","The hot spots conjecture can be false: Some numerical examples","31 pages, 28 figures, 6 tables",,,,"math.NA cs.NA math.AP","http://creativecommons.org/licenses/by/4.0/","  The hot spots conjecture is only known to be true for special geometries. It
can be shown numerically that the hot spots conjecture can fail to be true for
easy to construct bounded domains with one hole. The underlying eigenvalue
problem for the Laplace equation with Neumann boundary condition is solved with
boundary integral equations yielding a non-linear eigenvalue problem. Its
discretization via the boundary element collocation method in combination with
the algorithm by Beyn yields highly accurate results both for the first
non-zero eigenvalue and its corresponding eigenfunction which is due to
superconvergence. Additionally, it can be shown numerically that the ratio
between the maximal/minimal value inside the domain and its maximal/minimal
value on the boundary can be larger than $1+10^{-3}$. Finally, numerical
examples for easy to construct domains with up to five holes are provided which
fail the hot spots conjecture as well.
","[{""version"":""v1"",""created"":""Mon, 4 Jan 2021 19:47:54 GMT""}]","2021-01-06"
"2101.01211","Mikael Pichot","Sylvain Barre, Mikael Pichot","Surgery on Aut(F2)",,,,,"math.GR","http://creativecommons.org/licenses/by/4.0/","  We study a geometric construction of certain finite index subgroups of
Aut(F2).
","[{""version"":""v1"",""created"":""Mon, 4 Jan 2021 19:48:21 GMT""}]","2021-01-06"
"2101.01212","Zhong Yang","Zhong Yang, Yuanwei Liu, Yue Chen, Naofal Al-Dhahir","Machine Learning for User Partitioning and Phase Shifters Design in
  RIS-Aided NOMA Networks","30 pages, 10 figures",,,,"cs.IT math.IT","http://arxiv.org/licenses/nonexclusive-distrib/1.0/","  A novel reconfigurable intelligent surface (RIS) aided non-orthogonal
multiple access (NOMA) downlink transmission framework is proposed. We
formulate a long-term stochastic optimization problem that involves a joint
optimization of NOMA user partitioning and RIS phase shifting, aiming at
maximizing the sum data rate of the mobile users (MUs) in NOMA downlink
networks. To solve the challenging joint optimization problem, we invoke a
modified object migration automation (MOMA) algorithm to partition the users
into equal-size clusters. To optimize the RIS phase-shifting matrix, we propose
a deep deterministic policy gradient (DDPG) algorithm to collaboratively
control multiple reflecting elements (REs) of the RIS. Different from
conventional training-then-testing processing, we consider a long-term
self-adjusting learning model where the intelligent agent is capable of
learning the optimal action for every given state through exploration and
exploitation. Extensive numerical results demonstrate that: 1) The proposed
RIS-aided NOMA downlink framework achieves an enhanced sum data rate compared
with the conventional orthogonal multiple access (OMA) framework. 2) The
proposed DDPG algorithm is capable of learning a dynamic resource allocation
policy in a long-term manner. 3) The performance of the proposed RIS-aided NOMA
framework can be improved by increasing the granularity of the RIS phase
shifts. The numerical results also show that reducing the granularity of the
RIS phase shifts and increasing the number of REs are two efficient methods to
improve the sum data rate of the MUs.
","[{""version"":""v1"",""created"":""Mon, 4 Jan 2021 19:54:04 GMT""}]","2021-01-06"
"2101.01213","Ana Sofia Medeiros Oliveira","Sofia Oliveira and Daniel Loureiro and Al\'ipio Jorge","Improving Portuguese Semantic Role Labeling with Transformers and
  Transfer Learning","30 pages, 3 figures; Fixed broken links in References","2021 IEEE 8th International Conference on Data Science and
  Advanced Analytics (DSAA), 2021, pp. 1-9","10.1109/DSAA53316.2021.9564238",,"cs.CL","http://arxiv.org/licenses/nonexclusive-distrib/1.0/","  The Natural Language Processing task of determining ""Who did what to whom"" is
called Semantic Role Labeling. For English, recent methods based on Transformer
models have allowed for major improvements in this task over the previous state
of the art. However, for low resource languages, like Portuguese, currently
available semantic role labeling models are hindered by scarce training data.
In this paper, we explore a model architecture with only a pre-trained
Transformer-based model, a linear layer, softmax and Viterbi decoding. We
substantially improve the state-of-the-art performance in Portuguese by over 15
F1. Additionally, we improve semantic role labeling results in Portuguese
corpora by exploiting cross-lingual transfer learning using multilingual
pre-trained models, and transfer learning from dependency parsing in
Portuguese, evaluating the various proposed approaches empirically.
","[{""version"":""v1"",""created"":""Mon, 4 Jan 2021 19:56:01 GMT""},{""version"":""v2"",""created"":""Wed, 6 Jan 2021 11:05:52 GMT""},{""version"":""v3"",""created"":""Sat, 30 Oct 2021 19:00:10 GMT""}]","2021-11-02"
"2101.01214","Eric Guzman","Eric Guzman and Joel Meyers","Reconstructing Patchy Reionization with Deep Learning","14 pages, 9 figures. Updated to match published version. Code
  available from https://github.com/EEmGuzman/resunet-cmb","Phys. Rev. D 104, 043529 (2021)","10.1103/PhysRevD.104.043529",,"astro-ph.CO cs.CV stat.ML","http://arxiv.org/licenses/nonexclusive-distrib/1.0/","  The precision anticipated from next-generation cosmic microwave background
(CMB) surveys will create opportunities for characteristically new insights
into cosmology. Secondary anisotropies of the CMB will have an increased
importance in forthcoming surveys, due both to the cosmological information
they encode and the role they play in obscuring our view of the primary
fluctuations. Quadratic estimators have become the standard tools for
reconstructing the fields that distort the primary CMB and produce secondary
anisotropies. While successful for lensing reconstruction with current data,
quadratic estimators will be sub-optimal for the reconstruction of lensing and
other effects at the expected sensitivity of the upcoming CMB surveys. In this
paper we describe a convolutional neural network, ResUNet-CMB, that is capable
of the simultaneous reconstruction of two sources of secondary CMB
anisotropies, gravitational lensing and patchy reionization. We show that the
ResUNet-CMB network significantly outperforms the quadratic estimator at low
noise levels and is not subject to the lensing-induced bias on the patchy
reionization reconstruction that would be present with a straightforward
application of the quadratic estimator.
","[{""version"":""v1"",""created"":""Mon, 4 Jan 2021 19:58:28 GMT""},{""version"":""v2"",""created"":""Fri, 20 Aug 2021 15:40:26 GMT""}]","2021-08-25"
"2101.01215","Teofilo de Campos","Tiago de C. G. Pereira and Teofilo E. de Campos","Learn by Guessing: Multi-Step Pseudo-Label Refinement for Person
  Re-Identification","11 pages, 2 fitures, 48 references. Submitted to a computer vision
  conference",,,,"cs.CV cs.AI","http://arxiv.org/licenses/nonexclusive-distrib/1.0/","  Unsupervised Domain Adaptation (UDA) methods for person Re-Identification
(Re-ID) rely on target domain samples to model the marginal distribution of the
data. To deal with the lack of target domain labels, UDA methods leverage
information from labeled source samples and unlabeled target samples. A
promising approach relies on the use of unsupervised learning as part of the
pipeline, such as clustering methods. The quality of the clusters clearly plays
a major role in methods performance, but this point has been overlooked. In
this work, we propose a multi-step pseudo-label refinement method to select the
best possible clusters and keep improving them so that these clusters become
closer to the class divisions without knowledge of the class labels. Our
refinement method includes a cluster selection strategy and a camera-based
normalization method which reduces the within-domain variations caused by the
use of multiple cameras in person Re-ID. This allows our method to reach
state-of-the-art UDA results on DukeMTMC-Market1501 (source-target). We surpass
state-of-the-art for UDA Re-ID by 3.4% on Market1501-DukeMTMC datasets, which
is a more challenging adaptation setup because the target domain (DukeMTMC) has
eight distinct cameras. Furthermore, the camera-based normalization method
causes a significant reduction in the number of iterations required for
training convergence.
","[{""version"":""v1"",""created"":""Mon, 4 Jan 2021 20:00:33 GMT""}]","2021-01-06"
"2101.01216","Nicola Sansonetto","Paula Balseiro and Nicola Sansonetto","First Integrals and symmetries of nonholonomic systems","For the most updated version of the article see DOI:
  10.1007/s00205-022-01753-9","Archive for Rational Mechanics and AnalysisVolume 244, Issue 2,
  (2022) 343 - 389","10.1007/s00205-022-01753-9",,"math.DS math-ph math.DG math.MP","http://creativecommons.org/licenses/by/4.0/","  In nonholonomic mechanics, the presence of constraints in the velocities
breaks the well-under\-stood link between symmetries and first integrals of
holonomic systems, expressed in Noether's Theorem. However there is a known
special class of first integrals of nonholonomic systems generated by vector
fields tangent to the group orbits, called {\it horizontal gauge momenta}, that
suggest that some version of this link should still hold. In this paper we
prove that, under certain conditions on the symmetry Lie group, the
(nonholonomic) momentum map is conserved along the nonholonomic dynamics, thus
extending Noether Theorem to the nonholonomic framework. Our analysis leads to
a constructive method, with fundamental consequences to the integrability of
some nonholonomic systems as well as their hamiltonization. We apply our
results to three paradigmatic examples: the snakeboard, a solid of revolution
rolling without sliding on a plane and a heavy homogeneous ball that rolls
without sliding inside a convex surface of revolution. In particular, for the
snakeboard we show the existence of a new horizontal gauge momentum that
reveals new aspects of its integrability.
","[{""version"":""v1"",""created"":""Mon, 4 Jan 2021 20:01:53 GMT""},{""version"":""v2"",""created"":""Sun, 17 Jan 2021 16:37:40 GMT""},{""version"":""v3"",""created"":""Thu, 10 Feb 2022 08:13:03 GMT""}]","2022-07-06"
"2101.01218","Mar\'ia Arias Dra.","M. Laura Arias and M. Celeste Gonzalez","Proper splittings and reduced solutions of matrix equations",,,,,"math.FA","http://arxiv.org/licenses/nonexclusive-distrib/1.0/","  In this article we apply proper splittings of matrices to develop an
iterative process to approximate solutions of matrix equations of the form TX =
W. Moreover, by using the partial order induced by positive semidefinite
matrices, we obtain equivalent conditions to the convergence of this process.
We also include some speed comparison results of the convergence of this
method. In addition, for all matrix T we propose a proper splitting based on
the polar decomposition of T.
","[{""version"":""v1"",""created"":""Mon, 4 Jan 2021 20:04:09 GMT""},{""version"":""v2"",""created"":""Mon, 8 Feb 2021 21:13:19 GMT""}]","2021-02-10"
"2101.01219","Madeline Marshall","Madeline A. Marshall, J. Stuart B. Wyithe, Rogier A. Windhorst,
  Tiziana Di Matteo, Yueying Ni, Stephen Wilkins, Rupert A.C. Croft, and Mira
  Mechtley","Observing the host galaxies of high-redshift quasars with JWST:
  predictions from the BlueTides simulation","21 pages, 14 figures. Resubmitted to MNRAS following referee
  feedback, with most notable improvements in Section 5",,"10.1093/mnras/stab1763",,"astro-ph.GA","http://arxiv.org/licenses/nonexclusive-distrib/1.0/","  The bright emission from high-redshift quasars completely conceals their host
galaxies in the rest-frame ultraviolet/optical, with detection of the hosts in
these wavelengths eluding even the Hubble Space Telescope (HST) using detailed
point spread function (PSF) modelling techniques. In this study we produce mock
images of a sample of z=7 quasars extracted from the BlueTides simulation, and
apply Markov Chain Monte Carlo-based PSF modelling to determine the
detectability of their host galaxies with the James Webb Space Telescope
(JWST). While no statistically significant detections are made with HST, we
predict that at the same wavelengths and exposure times JWST NIRCam imaging
will detect ~50% of quasar host galaxies. We investigate various observational
strategies, and find that NIRCam wide-band imaging in the long-wavelength
filters results in the highest fraction of successful quasar host detections,
detecting >80% of the hosts of bright quasars in exposure times of 5 ks.
Exposure times of ~5 ks are required to detect the majority of host galaxies in
the NIRCam wide-band filters, however even 10 ks exposures with MIRI result in
<30% successful host detections. We find no significant trends between galaxy
properties and their detectability. The PSF modelling can accurately recover
the host magnitudes, radii, and spatial distribution of the larger-scale
emission, when accounting for the central core being contaminated by residual
quasar flux. Care should be made when interpreting the host properties measured
using PSF modelling.
","[{""version"":""v1"",""created"":""Mon, 4 Jan 2021 20:04:16 GMT""},{""version"":""v2"",""created"":""Wed, 9 Jun 2021 18:00:04 GMT""}]","2021-06-30"
