"2108.04762","Zuoshunhua Shi","Yangkendi Deng, Zuoshunhua Shi and Dunyan Yan","$L^2$ estimates of trilinear oscillatory integrals of convolution type
  on $\mathbb{R}^2$","26 pages",,,,"math.CA","http://creativecommons.org/publicdomain/zero/1.0/","  This paper is devoted to $L^2$ estimates for trilinear oscillatory integrals
of convolution type on $\mathbb{R}^2$. The phases in the oscillatory factors
include smooth functions and polynomials. We shall establish sharp $L^2$ decay
estimates of trilinear oscillatory integrals with smooth phases, and then give
$L^2$ uniform estimates for these integrals with polynomial phases.
","[{""version"":""v1"",""created"":""Tue, 10 Aug 2021 16:00:15 GMT""},{""version"":""v2"",""created"":""Thu, 12 Aug 2021 13:35:52 GMT""}]","2021-08-13"
"2108.04763","Kamil Ciosek","Kamil Ciosek","Imitation Learning by Reinforcement Learning","Published in ICLR 2022",,,,"stat.ML cs.LG","http://arxiv.org/licenses/nonexclusive-distrib/1.0/","  Imitation learning algorithms learn a policy from demonstrations of expert
behavior. We show that, for deterministic experts, imitation learning can be
done by reduction to reinforcement learning with a stationary reward. Our
theoretical analysis both certifies the recovery of expert reward and bounds
the total variation distance between the expert and the imitation learner,
showing a link to adversarial imitation learning. We conduct experiments which
confirm that our reduction works well in practice for continuous control tasks.
","[{""version"":""v1"",""created"":""Tue, 10 Aug 2021 16:14:41 GMT""},{""version"":""v2"",""created"":""Tue, 15 Mar 2022 14:39:22 GMT""}]","2022-03-16"
"2108.04764","Ramanathan Sundara Rajan","Jessy Sujana G., T.M. Rajalaxmi, Indra Rajasingh, and R. Sundara Rajan","Edge Forcing in Butterfly Networks","15 pages, 8 figures","Fundamenta Informaticae, Volume 182, Issue 3 (November 18, 2021)
  fi:8644","10.3233/FI-2021-2074",,"math.CO","http://creativecommons.org/publicdomain/zero/1.0/","  A zero forcing set is a set $S$ of vertices of a graph $G$, called forced
vertices of $G$, which are able to force the entire graph by applying the
following process iteratively: At any particular instance of time, if any
forced vertex has a unique unforced neighbor, it forces that neighbor. In this
paper, we introduce a variant of zero forcing set that induces independent
edges and name it as edge-forcing set. The minimum cardinality of an
edge-forcing set is called the edge-forcing number. We prove that the
edge-forcing problem of determining the edge-forcing number is NP-complete.
Further, we study the edge-forcing number of butterfly networks. We obtain a
lower bound on the edge-forcing number of butterfly networks and prove that
this bound is tight for butterfly networks of dimensions 2, 3, 4 and 5 and
obtain an upper bound for the higher dimensions.
","[{""version"":""v1"",""created"":""Tue, 10 Aug 2021 16:15:11 GMT""},{""version"":""v2"",""created"":""Sat, 30 Oct 2021 09:52:18 GMT""}]","2021-12-11"
"2108.04765","Julian Braun","Julian Braun, Thomas Hudson, Christoph Ortner","Asymptotic Expansion of the Elastic Far-Field of a Crystalline Defect",,,"10.1007/s00205-022-01810-3",,"math.AP","http://arxiv.org/licenses/nonexclusive-distrib/1.0/","  Lattice defects in crystalline materials create long-range elastic fields
which can be modelled on the atomistic scale using an infinite system of
discrete nonlinear force balance equations. Starting with these equations, this
work rigorously derives a novel far-field expansion of these fields: The
expansion is computable and is expressed as a sum of continuum correctors and
discrete multipole terms which decay with increasing algebraic rate as the
order of the expansion increases. Truncating the expansion leaves a remainder
describing the defect core structure, which is localised in the sense that it
decays with an algebraic rate corresponding to the order at which the
truncation occurred.
","[{""version"":""v1"",""created"":""Tue, 10 Aug 2021 16:15:34 GMT""}]","2022-08-10"
"2108.04766","Nalin Asanka Gamagedara Arachchilage","Asangi Jayatilaka and Nalin Asanka Gamagedara Arachchilage and
  Muhammad Ali Babar","Falling for Phishing: An Empirical Investigation into People's Email
  Response Behaviors","The 42nd International Conference on Information Systems (ICIS'21),
  Austin, Texas, USA, 2021, 17","The 42nd International Conference on Information Systems
  (ICIS'21), Austin, Texas, USA, 2021, 17",,,"cs.CR cs.CY cs.HC","http://creativecommons.org/licenses/by/4.0/","  Despite sophisticated phishing email detection systems, and training and
awareness programs, humans continue to be tricked by phishing emails. In an
attempt to better understand why phishing email attacks still work and how best
to mitigate them, we have carried out an empirical study to investigate
people's thought processes when reading their emails. We used a scenario-based
role-play ""think aloud"" method and follow-up interviews to collect data from 19
participants. The experiment was conducted using a simulated web email client,
and real phishing and legitimate emails adapted to the given scenario. The
analysis of the collected data has enabled us to identify eleven factors that
influence people's response decisions to both phishing and legitimate emails.
Furthermore, based on the user study findings, we discuss novel insights into
flaws in the general email decision-making behaviors that could make people
susceptible to phishing attacks.
","[{""version"":""v1"",""created"":""Tue, 10 Aug 2021 16:19:01 GMT""},{""version"":""v2"",""created"":""Thu, 7 Oct 2021 01:38:14 GMT""}]","2021-10-08"
"2108.04767","Alfred Michel Grundland","A. Michel Grundland","Symmetries and Riemann Invariants","Conference dedicated to the memory of Pavel Winternitz",,,,"math-ph math.MP","http://creativecommons.org/licenses/by/4.0/","  To establish a relation between two approaches to the construction of Riemann
k-wave solutions of hydrodynamic-type systems, namely the symmetry reduction
method and the generalized method of characteristics.
","[{""version"":""v1"",""created"":""Tue, 10 Aug 2021 16:19:53 GMT""}]","2021-08-11"
"2108.04768","Guozhen Lu","Lu Chen, Guozhen Lu, Qiaohua Yang and Maochun Zhu","Sharp critical and subcritical trace Trudinger-Moser and Adams
  inequalities on the upper half spaces","30 pages",,,,"math.AP math.CA","http://arxiv.org/licenses/nonexclusive-distrib/1.0/","  In this paper, we establish the sharp critical and subcritical trace
Trudinger-Moser and Adams inequalities on the half spaces and prove the
existence of their extremals through the method based on the Fourier
rearrangement, harmonic extension and scaling invariance. These trace
Trudinger-Moser and Adams inequalities can be considered as the borderline case
of the Sobolev trace inequalities of first and higher orders. Furthermore, we
show the existence of the least energy solutions for a class of bi-harmonic
equations with nonlinear Neumann boundary condition associated with the trace
Adams inequalities.
","[{""version"":""v1"",""created"":""Tue, 10 Aug 2021 16:22:21 GMT""}]","2021-08-11"
"2108.04769","Roland Kaminski","Roland Kaminski and Torsten Schaub","On the Foundations of Grounding in Answer Set Programming","unpublished draft",,,,"cs.AI","http://creativecommons.org/licenses/by-sa/4.0/","  We provide a comprehensive elaboration of the theoretical foundations of
variable instantiation, or grounding, in Answer Set Programming (ASP). Building
on the semantics of ASP's modeling language, we introduce a formal
characterization of grounding algorithms in terms of (fixed point) operators. A
major role is played by dedicated well-founded operators whose associated
models provide semantic guidance for delineating the result of grounding along
with on-the-fly simplifications. We address an expressive class of logic
programs that incorporates recursive aggregates and thus amounts to the scope
of existing ASP modeling languages. This is accompanied with a plain
algorithmic framework detailing the grounding of recursive aggregates. The
given algorithms correspond essentially to the ones used in the ASP grounder
gringo.
","[{""version"":""v1"",""created"":""Tue, 10 Aug 2021 16:23:49 GMT""},{""version"":""v2"",""created"":""Tue, 11 Jan 2022 09:22:11 GMT""},{""version"":""v3"",""created"":""Mon, 25 Jul 2022 11:29:01 GMT""}]","2022-07-26"
"2108.04770","Arnav Kartikeya","Arnav Kartikeya","Examining correlation between trust and transparency with explainable
  artificial intelligence","6 pages, 1 figure, 1 table",,,,"cs.HC","http://creativecommons.org/publicdomain/zero/1.0/","  Trust between humans and artificial intelligence(AI) is an issue which has
implications in many fields of human computer interaction. The current issue
with artificial intelligence is a lack of transparency into its decision
making, and literature shows that increasing transparency increases trust.
Explainable artificial intelligence has the ability to increase transparency of
AI, which could potentially increase trust for humans. This paper attempts to
use the task of predicting yelp review star ratings with assistance from an
explainable and non explainable artificial intelligence to see if trust is
increased with increased transparency. Results show that for these tasks,
explainable artificial intelligence provided significant increase in trust as a
measure of influence.
","[{""version"":""v1"",""created"":""Tue, 10 Aug 2021 16:24:30 GMT""}]","2021-08-11"
"2108.04771","Matthias Benjamin Jungfleisch","Weipeng Wu, Charles Yaw Ameyaw, Matthew F. Doty, and M. Benjamin
  Jungfleisch","Principles of spintronic THz emitters",,"J. Appl. Phys. 130, 091101 (2021)","10.1063/5.0057536",,"cond-mat.mtrl-sci physics.app-ph","http://arxiv.org/licenses/nonexclusive-distrib/1.0/","  Significant progress has been made in answering fundamental questions about
how and, more importantly, on what time scales interactions between electrons,
spins, and phonons occur in solid state materials. These complex interactions
are leading to the first real applications of terahertz (THz) spintronics: THz
emitters that can compete with traditional THz sources and provide additional
functionalities enabled by the spin degree of freedom. This tutorial article is
intended to provide the background necessary to understand, use, and improve
THz spintronic emitters. A particular focus is the introduction of the physical
effects that underlie the operation of spintronic THz emitters. These effects
were, for the most part, first discovered through traditional spin-transport
and spintronic studies. We therefore begin with a review of the historical
background and current theoretical understanding of ultrafast spin physics that
has been developed over the past twenty-five years. We then discuss standard
experimental techniques for the characterization of spintronic THz emitters and
- more broadly - ultrafast magnetic phenomena. We next present the principles
and methods of the synthesis and fabrication of various types of spintronic THz
emitters. Finally, we review recent developments in this exciting field
including the integration of novel material platforms such as topological
insulators as well as antiferromagnets and materials with unconventional spin
textures.
","[{""version"":""v1"",""created"":""Tue, 10 Aug 2021 16:25:02 GMT""}]","2021-09-02"
"2108.04772","Yonathan Stone","Yonathan Stone","Leopold Kronecker's ""On Equations of Fifth Degree""","Translated to English from German by Yonathan Stone",,,,"math.AG","http://arxiv.org/licenses/nonexclusive-distrib/1.0/","  This is a translation of Kronecker's ""\""Uber die Gleichungen f\""unften
Grades"" (On equations of fifth degree), excerpted from the monthly report to
the Berlin Academy of Sciences from June 1861.
","[{""version"":""v1"",""created"":""Tue, 10 Aug 2021 16:30:43 GMT""}]","2021-08-11"
"2108.04773","Ehab Ibrahim","Ehab M. Ibrahim, Linyan Mei, Marian Verhelst","Taxonomy and Benchmarking of Precision-Scalable MAC Arrays Under
  Enhanced DNN Dataflow Representation",,"IEEE Transactions on Circuits and Systems I: Regular Papers (Early
  Access) (2022)","10.1109/tcsi.2022.3141519",,"cs.DC","http://creativecommons.org/licenses/by/4.0/","  Reduced-precision and variable-precision multiply-accumulate (MAC) operations
provide opportunities to significantly improve energy efficiency and throughput
of DNN accelerators with no/limited algorithmic performance loss, paving a way
towards deploying AI applications on resource-constraint edge devices.
Accordingly, various precision-scalable MAC array (PSMA) architectures were
proposed recently. However, it is difficult to make a fair comparison between
those alternatives, as each proposed PSMA is demonstrated in different systems
and technologies. This work aims to provide a clear view of the design space of
PSMA and offer insights for selecting the optimal architectures based on
designers' needs. First, we introduce a precision-enhanced for-loop
representation for DNN dataflows. Next, we use this new representation towards
a comprehensive PSMA taxonomy, capable of systematically covering most
prominent state-of-the-art PSMAs, as well as uncovering new PSMA architectures.
Following that, we build a highly parameterized PSMA template that can be
design-time configured into a huge subset of the design space spanned by the
taxonomy. This allows to fairly and thoroughly benchmark 72 different PSMA
architectures. We perform such studies in 28nm technology targeting run-time
precision scalability from 8 to 2 bits, operating at 200 MHz and 1 GHz.
Analyzing resulting energy and area breakdowns reveals key design guidelines
for PSMA architectures.
","[{""version"":""v1"",""created"":""Tue, 10 Aug 2021 16:31:26 GMT""},{""version"":""v2"",""created"":""Mon, 17 Jan 2022 16:10:22 GMT""}]","2022-01-20"
"2108.04774","Jeffrey Larson","Jeffrey S. Eldred, Jeffrey Larson, Misha Padidar, Eric Stern, and
  Stefan M. Wild","Derivative-Free Optimization of a Rapid-Cycling Synchrotron","24 pages, 12 figures",,"10.1007/s11081-022-09733-4",,"math.OC physics.acc-ph","http://arxiv.org/licenses/nonexclusive-distrib/1.0/","  We develop and solve a constrained optimization model to identify an
integrable optics rapid-cycling synchrotron lattice design that performs well
in several capacities. Our model encodes the design criteria into 78 linear and
nonlinear constraints, as well as a single nonsmooth objective, where the
objective and some constraints are defined from the output of Synergia, an
accelerator simulator. We detail the difficulties of the 23-dimensional
simulation-constrained decision space and establish that the space is nonempty.
We use a derivative-free manifold sampling algorithm to account for structured
nondifferentiability in the objective function. Our numerical results quantify
the dependence of solutions on constraint parameters and the effect of the form
of objective function.
","[{""version"":""v1"",""created"":""Tue, 10 Aug 2021 16:40:47 GMT""}]","2022-08-22"
"2108.04775","Yuchao Dai Dr.","Bin Fan and Yuchao Dai and Mingyi He","SUNet: Symmetric Undistortion Network for Rolling Shutter Correction","Accepted by IEEE International Conference on Computer Vision (ICCV)
  2021",,,,"cs.CV cs.RO","http://creativecommons.org/licenses/by/4.0/","  The vast majority of modern consumer-grade cameras employ a rolling shutter
mechanism, leading to image distortions if the camera moves during image
acquisition. In this paper, we present a novel deep network to solve the
generic rolling shutter correction problem with two consecutive frames. Our
pipeline is symmetrically designed to predict the global shutter image
corresponding to the intermediate time of these two frames, which is difficult
for existing methods because it corresponds to a camera pose that differs most
from the two frames. First, two time-symmetric dense undistortion flows are
estimated by using well-established principles: pyramidal construction,
warping, and cost volume processing. Then, both rolling shutter images are
warped into a common global shutter one in the feature space, respectively.
Finally, a symmetric consistency constraint is constructed in the image decoder
to effectively aggregate the contextual cues of two rolling shutter images,
thereby recovering the high-quality global shutter image. Extensive experiments
with both synthetic and real data from public benchmarks demonstrate the
superiority of our proposed approach over the state-of-the-art methods.
","[{""version"":""v1"",""created"":""Tue, 10 Aug 2021 16:43:13 GMT""}]","2021-08-11"
"2108.04776","Emre Sefer","Emre Sefer","BioCode: A Data-Driven Procedure to Learn the Growth of Biological
  Networks",,,,,"q-bio.MN q-bio.QM","http://creativecommons.org/licenses/by/4.0/","  Probabilistic biological network growth models have been utilized for many
tasks including but not limited to capturing mechanism and dynamics of
biological growth activities, null model representation, capturing anomalies,
etc. Well-known examples of these probabilistic models are Kronecker model,
preferential attachment model, and duplication-based model. However, we should
frequently keep developing new models to better fit and explain the observed
network features while new networks are being observed. Additionally, it is
difficult to develop a growth model each time we study a new network. In this
paper, we propose BioCode, a framework to automatically discover novel
biological growth models matching user-specified graph attributes in directed
and undirected biological graphs. BioCode designs a basic set of instructions
which are common enough to model a number of well-known biological graph growth
models. We combine such instruction-wise representation with a genetic
algorithm based optimization procedure to encode models for various biological
networks. We mainly evaluate the performance of BioCode in discovering models
for biological collaboration networks, gene regulatory networks, metabolic
networks, and protein interaction networks which features such as
assortativity, clustering coefficient, degree distribution closely match with
the true ones in the corresponding real biological networks. As shown by the
tests on the simulated graphs, the variance of the distributions of biological
networks generated by BioCode is similar to the known models' variance for
these biological network types.
","[{""version"":""v1"",""created"":""Tue, 10 Aug 2021 16:44:10 GMT""},{""version"":""v2"",""created"":""Sun, 5 Sep 2021 07:41:51 GMT""}]","2021-09-07"
"2108.04777","Till Massing","Till Massing","Approximation and Error Analysis of Forward-Backward SDEs driven by
  General L\'evy Processes using Shot Noise Series Representations",,,,,"math.PR","http://creativecommons.org/licenses/by/4.0/","  We consider the simulation of a system of decoupled forward-backward
stochastic differential equations (FBSDEs) driven by a pure jump L\'evy process
$L$ and an independent Brownian motion $B$. We allow the L\'evy process $L$ to
have an infinite jump activity. Therefore, it is necessary for the simulation
to employ a finite approximation of its L\'evy measure. We use the generalized
shot noise series representation method by Rosinski (2001) to approximate the
driving L\'evy process $L$. We compute the $L^p$ error, $p\ge2$, between the
true and the approximated FBSDEs which arises from the finite truncation of the
shot noise series (given sufficient conditions for existence and uniqueness of
the FBSDE). We also derive the $L^p$ error between the true solution and the
discretization of the approximated FBSDE using an appropriate backward Euler
scheme.
","[{""version"":""v1"",""created"":""Tue, 10 Aug 2021 16:45:37 GMT""},{""version"":""v2"",""created"":""Mon, 31 Jan 2022 16:37:28 GMT""},{""version"":""v3"",""created"":""Thu, 3 Nov 2022 10:34:24 GMT""},{""version"":""v4"",""created"":""Thu, 20 Apr 2023 13:56:19 GMT""}]","2023-04-21"
"2108.04778","Martin Paegert","Martin Paegert, Keivan G. Stassun, Karen A. Collins, Joshua Pepper,
  Guillermo Torres, Jon Jenkins, Joseph D. Twicken and David W. Latham","TESS Input Catalog versions 8.1 and 8.2: Phantoms in the 8.0 Catalog and
  How to Handle Them","11 pages, 8 figures",,,,"astro-ph.EP astro-ph.IM","http://creativecommons.org/licenses/by-nc-sa/4.0/","  We define various types of ""phantom"" stars that may appear in the TESS Input
Catalog (TIC), and provide examples and lists of currently known cases. We
present a methodology that can be used to check for phantoms around any object
of interest in the TIC, and we present an approach for correcting the
TIC-reported flux contamination factors accordingly. We checked all 2077 TESS
Objects of Interest (TOIs) known as of July 21st 2020 (Sectors 1 to 24) and
sent corrections for 291 stars to MAST where they are integrated into the
publicly available TIC-8, updating it to TIC 8.1. We used the experience gained
to construct an all-sky algorithm searching for ""phantoms"" which led to 34
million updates integrated into TIC 8.2.
","[{""version"":""v1"",""created"":""Tue, 10 Aug 2021 16:47:10 GMT""}]","2021-08-11"
"2108.04779","Xiaoyun Ding","Gazendra Shakya, Tao Yang, Yu Gao, Apresio K. Fajrial, Baowen Li,
  Massimo Ruzzene, Mark A. Borden, Xiaoyun Ding","Acoustically Manipulating Internal Structure of Disk-in-Sphere
  Endoskeletal Droplets",,,"10.1038/s41467-022-28574-4",,"physics.app-ph cond-mat.mtrl-sci physics.flu-dyn","http://arxiv.org/licenses/nonexclusive-distrib/1.0/","  Manipulation of micro/nano particles has been well studied and demonstrated
by optical, electromagnetic, and acoustic approaches, or their combinations.
Manipulation of internal structure of droplet/particle is rarely explored and
remains challenging due to its complicated nature. Here we demonstrated the
manipulation of internal structure of disk-in-sphere endoskeletal droplets
using acoustic wave for the first time. We developed a model to investigate the
physical mechanisms behind this novel phenomenon. Theoretical analysis of the
acoustic interactions indicated that these assembly dynamics arise from a
balance of the primary and secondary radiation forces. Additionally, the disk
orientation was found to change with acoustic driving frequency, which allowed
on-demand, reversible adjusting disk orientations with respect to the
substrate. This novel dynamic behavior leads to unique reversible arrangements
of the endoskeletal droplets and their internal architecture, which may provide
a new avenue for directed assembly of novel hierarchical colloidal
architectures and intracellular organelles or intra-organoid structures.
","[{""version"":""v1"",""created"":""Tue, 10 Aug 2021 16:47:25 GMT""}]","2022-03-09"
"2108.04780","Manish Kesarwani","Manish Kesarwani, Akshar Kaul, Stefano Braghin, Naoise Holohan, Spiros
  Antonatos","Secure k-Anonymization over Encrypted Databases",,,,,"cs.CR","http://arxiv.org/licenses/nonexclusive-distrib/1.0/","  Data protection algorithms are becoming increasingly important to support
modern business needs for facilitating data sharing and data monetization.
Anonymization is an important step before data sharing. Several organizations
leverage on third parties for storing and managing data. However, third parties
are often not trusted to store plaintext personal and sensitive data; data
encryption is widely adopted to protect against intentional and unintentional
attempts to read personal/sensitive data. Traditional encryption schemes do not
support operations over the ciphertexts and thus anonymizing encrypted datasets
is not feasible with current approaches. This paper explores the feasibility
and depth of implementing a privacy-preserving data publishing workflow over
encrypted datasets leveraging on homomorphic encryption. We demonstrate how we
can achieve uniqueness discovery, data masking, differential privacy and
k-anonymity over encrypted data requiring zero knowledge about the original
values. We prove that the security protocols followed by our approach provide
strong guarantees against inference attacks. Finally, we experimentally
demonstrate the performance of our data publishing workflow components.
","[{""version"":""v1"",""created"":""Tue, 10 Aug 2021 16:49:56 GMT""}]","2021-08-11"
"2108.04781","Yossathorn Tawabutr","Yossathorn Tawabutr","Single-Logarithmic Corrections to Small-$x$ Helicity Evolution","Minor edits to appear in SciPost. 7 pages, 3 figures","SciPost Physics Proceedings. 8 (2022) 103","10.21468/SciPostPhysProc.8.103",,"hep-ph hep-ex nucl-ex nucl-th","http://creativecommons.org/licenses/by/4.0/","  The small-$x$ quark helicity evolution equations at double-logarithmic order,
with the kernel $\sim\alpha_s\ln^2(1/x)$, have been derived previously. In this
work, we derive the single-logarithmic corrections to the equations, to order
$\alpha_s\ln(1/x)$ of the evolution kernel. The new equations include the
effects of the running coupling and the unpolarized small-$x$ evolution, both
of which are parametrically significant at single-logarithmic order. The
large-$N_c$ and large-$N_c\& N_f$ approximations to the equation are computed.
(Here, $N_c$ and $N_f$ are the numbers of quark colors and flavors,
respectively.) Their solutions will provide more precise estimates of the quark
helicity distribution at small $x$, contributing to the resolution of the
proton spin puzzle.
","[{""version"":""v1"",""created"":""Tue, 10 Aug 2021 16:50:31 GMT""},{""version"":""v2"",""created"":""Sun, 20 Mar 2022 10:58:23 GMT""}]","2022-07-22"
