"2108.05040","Owen Bradley","Owen Bradley, Rajiv R. P. Singh","Instabilities of spin-1 Kitaev spin liquid phase in presence of
  single-ion anisotropies","7 pages and 8 figures. v2: Matches published version","Phys. Rev. B 105, L060405 (2022)","10.1103/PhysRevB.105.L060405",,"cond-mat.str-el","http://arxiv.org/licenses/nonexclusive-distrib/1.0/","  We study the spin-one Kitaev model on the honeycomb lattice in the presence
of single-ion anisotropies. We consider two types of single ion anisotropies: A
$D_{111}$ anisotropy which preserves the symmetry between $X$, $Y$, and $Z$
bonds but violates flux conservation and a $D_{100}$ anisotropy that breaks the
symmetry between $X$, $Y$, and $Z$ bonds but preserves flux conservation. We
use series expansion methods, degenerate perturbation theory, and exact
diagonalization to study these systems. Large positive $D_{111}$ anisotropy
leads to a simple product ground state with conventional magnon-like
excitations, while large negative $D_{111}$ leads to a broken symmetry and
degenerate ground states. For both signs there is a phase transition at a small
$|D_{111}| \approx 0.12$ separating the more conventional phases from the
Kitaev spin liquid phase. With large $D_{100}$ anisotropy, the ground state is
a simple product state, but the model lacks conventional dispersive excitations
due to the large number of conservation laws. Large negative $D_{100}$ leads to
decoupled one-dimensional systems and many degenerate ground states. No
evidence of a phase transition is seen in our numerical studies at any finite
$D_{100}$. Convergence of the series expansion extrapolations all the way to
$D_{100}=0$ suggests that the nontrivial Kitaev spin liquid is a singular limit
of this type of single-ion anisotropy going to zero, which also restores
symmetry between the $X$, $Y$, and $Z$ bonds.
","[{""version"":""v1"",""created"":""Wed, 11 Aug 2021 05:35:21 GMT""},{""version"":""v2"",""created"":""Wed, 20 Apr 2022 21:11:41 GMT""}]","2022-04-22"
"2108.05041","Tiangang Yang","Tiangang Yang, Bin Zhao, Gary K. Chen, Hua Guo, Wesley C. Campbell,
  Eric R. Hudson","Determining Reaction Pathways at Low Temperatures by Isotopic
  Substitution: The Case of BeD+ + H2O",,,"10.1088/1367-2630/ac2ae3",,"physics.chem-ph physics.atom-ph","http://arxiv.org/licenses/nonexclusive-distrib/1.0/","  Trapped Be+ ions are a leading platform for quantum information science [1],
but reactions with background gas species, such as H2 and H2O, result in qubit
loss. Our experiment reveals that the BeOH+ ion is the final trapped ion
species when both H2 and H2O exist in a vacuum system with cold, trapped Be+.
To understand the loss mechanism, low-temperature reactions between
sympathetically cooled BeD+ ions and H2O molecules have been investigated using
an integrated, laser-cooled Be+ ion trap and high-resolution Time-of-Flight
(TOF) mass spectrometer (MS) [2]. Among all the possible products,BeH2O+,
H2DO+, BeOD+, and BeOH+, only the BeOH+ molecular ion was observed
experimentally, with the assumed co-product of HD. Theoretical analyses based
on explicitly correlated restricted coupled cluster singles, doubles, and
perturbative triples (RCCSD(T)-F12) method with the augmented
correlation-consistent polarized triple zeta (AVTZ) basis set reveal that two
intuitive direct abstraction product channels, Be + H2DO+ and D + BeH2O+, are
not energetically accessible at the present reaction temperature (~150 K).
Instead, a double displacement BeOH+ + HD product channel is accessible due to
a large exothermicity of 1.885 eV through a submerged barrier in the reaction
pathway. While the BeOD+ + H2 product channel has a similar exothermicity, the
reaction pathway is dynamically unfavourable, as suggested by a Sudden Vector
Projection analysis. This work sheds light on the origin of the loss and
contaminations of the laser-cooled Be+ ions in quantum-information experiments.
","[{""version"":""v1"",""created"":""Wed, 11 Aug 2021 05:41:38 GMT""}]","2021-11-17"
"2108.05042","Rongchan Zhu","Zimo Hao, Xicheng Zhang, Rongchan Zhu, Xiangchan Zhu","Singular kinetic equations and applications","67 pages",,,,"math.PR math.AP","http://arxiv.org/licenses/nonexclusive-distrib/1.0/","  In this paper we study singular kinetic equations on $\mathbb{R}^{2d}$ by the
paracontrolled distribution method introduced in \cite{GIP15}. We first develop
paracontrolled calculus in the kinetic setting, and use it to establish the
global well-posedness for the linear singular kinetic equations under the
assumptions that the products of singular terms are well-defined. We also
demonstrate how the required products can be defined in the case that singular
term is a Gaussian random field by probabilistic calculation. Interestingly,
although the terms in the zeroth Wiener chaos of regularization approximation
are not zero, they converge in suitable weighted Besov spaces and no
renormalization is required. As applications the global well-posedness for a
nonlinear kinetic equation with singular coefficients is obtained by the
entropy method. Moreover, we also solve the martingale problem for nonlinear
kinetic distribution dependent stochastic differential equations with singular
drifts.
","[{""version"":""v1"",""created"":""Wed, 11 Aug 2021 05:42:51 GMT""}]","2021-08-12"
"2108.05043","Rang Liu","Rang Liu, Ming Li, Qian Liu, and A. Lee Swindlehurst","Dual-Functional Radar-Communication Waveform Design: A Symbol-Level
  Precoding Approach","16 pages, 9 figures, submitted to IEEE journal","IEEE Journal of Selected Topics in Signal Processing, vol. 15, no.
  6, pp. 1316-1331, Nov. 2021","10.1109/JSTSP.2021.3111438",,"eess.SP","http://creativecommons.org/licenses/by/4.0/","  Dual-functional radar-communication (DFRC) systems can simultaneously perform
both radar and communication functionalities using the same hardware platform
and spectrum resource. In this paper, we consider multi-input multi-output
(MIMO) DFRC systems and focus on transmit beamforming designs to provide both
radar sensing and multi-user communications. Unlike conventional block-level
precoding techniques, we propose to use the recently emerged symbol-level
precoding approach in DFRC systems, which provides additional degrees of
freedom (DoFs) that guarantee preferable instantaneous transmit beampatterns
for radar sensing and achieve better communication performance. In particular,
the squared error between the designed and desired beampatterns is minimized
subject to the quality-of-service (QoS) requirements of the communication users
and the constant-modulus power constraint. Two efficient algorithms are
developed to solve this non-convex problem on both the Euclidean and Riemannian
spaces. The first algorithm employs penalty dual decomposition (PDD),
majorization-minimization (MM), and block coordinate descent (BCD) methods to
convert the original optimization problem into two solvable sub-problems, and
iteratively solves them using efficient algorithms. The second algorithm
provides a much faster solution at the price of a slight performance loss,
first transforming the original problem into Riemannian space, and then
utilizing the augmented Lagrangian method (ALM) to obtain an unconstrained
problem that is subsequently solved via a Riemannian
Broyden-Fletcher-Goldfarb-Shanno (RBFGS) algorithm. Extensive simulations
verify the distinct advantages of the proposed symbol-level precoding designs
in both radar sensing and multi-user communications.
","[{""version"":""v1"",""created"":""Wed, 11 Aug 2021 05:44:38 GMT""}]","2022-01-25"
"2108.05044","Chaebin Kim","Chaebin Kim, Heung-Sik Kim, and Je-Geun Park","Spin-orbital entangled state and realization of Kitaev physics in 3d
  cobalt compounds: a progress report","45 pages, 13 figures, accepted as Topical Review in Journal of
  Physics: Condensed Matter",,"10.1088/1361-648X/ac2d5d",,"cond-mat.str-el cond-mat.mtrl-sci","http://arxiv.org/licenses/nonexclusive-distrib/1.0/","  The realization of Kitaev's honeycomb magnetic model in real materials has
become one of the most pursued topics in condensed matter physics and materials
science. If found, it is expected to host exotic quantum phases of matter and
offers potential realizations of fault$-$tolerant quantum computations. Over
the past years, much effort was made on 4d$-$ or 5d$-$ heavy transition metal
compounds because of their intrinsic strong spin$-$orbit coupling. But more
recently, there have been growing shreds of evidence that the Kitaev model
could also be realized in 3d$-$transition metal systems with much weaker
spin$-$orbit coupling. This review intends to serve as a guide to this
fast$-$developing field focusing on systems with d$^7$ transition metal
occupation. It overviews the current theoretical and experimental progress on
realizing the Kitaev model in those systems. We examine the recent experimental
observations of candidate materials with Co$^{2+}$ ions: e.g., CoPS$_3$,
Na$_3$Co$_2$SbO$_6$, and Na$_2$Co$_2$TeO$_6$, followed by a brief review of
theoretical backgrounds. We conclude this article by comparing experimental
observations with density functional theory (DFT) calculations. We stress the
importance of inter$-t_{2g}$ hopping channels and Hund's coupling in the
realization of Kitaev interactions in Co$-$based compounds, which has been
overlooked in previous studies. This review suggests future directions in the
search for Kitaev physics in 3d cobalt compounds and beyond.
","[{""version"":""v1"",""created"":""Wed, 11 Aug 2021 06:05:29 GMT""},{""version"":""v2"",""created"":""Mon, 27 Sep 2021 07:08:09 GMT""},{""version"":""v3"",""created"":""Wed, 6 Oct 2021 06:32:30 GMT""}]","2021-12-08"
"2108.05045","He Lingxiao","Lingxiao He, Wu Liu, Jian Liang, Kecheng Zheng, Xingyu Liao, Peng
  Cheng, Tao Mei","Semi-Supervised Domain Generalizable Person Re-Identification",,,,,"cs.CV","http://arxiv.org/licenses/nonexclusive-distrib/1.0/","  Existing person re-identification (re-id) methods are stuck when deployed to
a new unseen scenario despite the success in cross-camera person matching.
Recent efforts have been substantially devoted to domain adaptive person re-id
where extensive unlabeled data in the new scenario are utilized in a
transductive learning manner. However, for each scenario, it is required to
first collect enough data and then train such a domain adaptive re-id model,
thus restricting their practical application. Instead, we aim to explore
multiple labeled datasets to learn generalized domain-invariant representations
for person re-id, which is expected universally effective for each new-coming
re-id scenario. To pursue practicability in real-world systems, we collect all
the person re-id datasets (20 datasets) in this field and select the three most
frequently used datasets (i.e., Market1501, DukeMTMC, and MSMT17) as unseen
target domains. In addition, we develop DataHunter that collects over 300K+
weak annotated images named YouTube-Human from YouTube street-view videos,
which joins 17 remaining full labeled datasets to form multiple source domains.
On such a large and challenging benchmark called FastHuman (~440K+ labeled
images), we further propose a simple yet effective Semi-Supervised Knowledge
Distillation (SSKD) framework. SSKD effectively exploits the weakly annotated
data by assigning soft pseudo labels to YouTube-Human to improve models'
generalization ability. Experiments on several protocols verify the
effectiveness of the proposed SSKD framework on domain generalizable person
re-id, which is even comparable to supervised learning on the target domains.
Lastly, but most importantly, we hope the proposed benchmark FastHuman could
bring the next development of domain generalizable person re-id algorithms.
","[{""version"":""v1"",""created"":""Wed, 11 Aug 2021 06:08:25 GMT""},{""version"":""v2"",""created"":""Thu, 9 Sep 2021 02:54:03 GMT""}]","2021-09-10"
"2108.05046","Thomas Klotz","Thomas Klotz, Leonardo Gizzi, Oliver R\""ohrle","Investigating the spatial resolution of EMG and MMG based on a systemic
  multi-scale model","Preprint, Submitted to Biomechanics and Modeling in Mechanobiology",,,,"q-bio.TO q-bio.NC q-bio.QM","http://creativecommons.org/licenses/by/4.0/","  While electromyography (EMG) and magnetomyography (MMG) are both methods to
measure the electrical activity of skeletal muscles, no systematic comparison
between both signals exists. Within this work, we propose a systemic in silico
model for EMG and MMG and test the hypothesis that MMG surpasses EMG in terms
of spatial selectivity. The results show that MMG provides a slightly better
spatial selectivity than EMG when recorded directly on the muscle surface.
However, there is a remarkable difference in spatial selectivity for
non-invasive surface measurements. The spatial selectivity of the MMG
components aligned with the muscle fibres and normal to the body surface
outperforms the spatial selectivity of surface EMG. Particularly, for the MMG's
normal-to-the-surface component the influence of subcutaneous fat is minimal.
Further, for the first time, we analyse the contribution of different
structural components, i.e., muscle fibres from different motor units and the
extracellular space, to the measurable biomagnetic field. Notably, the
simulations show that the normal-to-the-surface MMG component, the contribution
from volume currents in the extracellular space and in surrounding inactive
tissues is negligible. Further, our model predicts a surprisingly high
contribution of the passive muscle fibres to the observable magnetic field.
","[{""version"":""v1"",""created"":""Wed, 11 Aug 2021 06:21:34 GMT""}]","2021-08-12"
"2108.05047","Wentao Cheng","Wentao Cheng, Sheng Yang, Maomin Zhou, Ziyuan Liu, Yiming Chen,
  Mingyang Li","Road Mapping and Localization using Sparse Semantic Visual Features","Published at IEEE ROBOTICS AND AUTOMATION LETTERS",,,,"cs.RO","http://creativecommons.org/publicdomain/zero/1.0/","  We present a novel method for visual mapping and localization for autonomous
vehicles, by extracting, modeling, and optimizing semantic road elements.
Specifically, our method integrates cascaded deep models to detect standardized
road elements instead of traditional point features, to seek for improved pose
accuracy and map representation compactness. To utilize the structural
features, we model road lights and signs by their representative deep keypoints
for skeleton and boundary, and parameterize lanes via piecewise cubic splines.
Based on the road semantic features, we build a complete pipeline for mapping
and localization, which includes a) image processing front-end, b) sensor
fusion strategies, and c) optimization backend. Experiments on public datasets
and our testing platform have demonstrated the effectiveness and advantages of
our method by outperforming traditional approaches.
","[{""version"":""v1"",""created"":""Wed, 11 Aug 2021 06:26:35 GMT""}]","2021-08-12"
"2108.05048","Simon Breneis","Christian Bayer, Simon Breneis","Markovian approximations of stochastic Volterra equations with the
  fractional kernel",,,,,"q-fin.CP math.PR","http://arxiv.org/licenses/nonexclusive-distrib/1.0/","  We consider rough stochastic volatility models where the variance process
satisfies a stochastic Volterra equation with the fractional kernel, as in the
rough Bergomi and the rough Heston model. In particular, the variance process
is therefore not a Markov process or semimartingale, and has quite low
H\""older-regularity. In practice, simulating such rough processes thus often
results in high computational cost. To remedy this, we study approximations of
stochastic Volterra equations using an $N$-dimensional diffusion process
defined as solution to a system of ordinary stochastic differential equation.
If the coefficients of the stochastic Volterra equation are Lipschitz
continuous, we show that these approximations converge strongly with
superpolynomial rate in $N$. Finally, we apply this approximation to compute
the implied volatility smile of a European call option under the rough Bergomi
and the rough Heston model.
","[{""version"":""v1"",""created"":""Wed, 11 Aug 2021 06:28:43 GMT""},{""version"":""v2"",""created"":""Mon, 18 Jul 2022 10:48:16 GMT""}]","2022-07-19"
"2108.05049","Taekyun Kim","Dae san Kim and Taekyun Kim","Representing polynomials by degenerate Bernoulli polynomials","19 pages",,,,"math.NT","http://creativecommons.org/licenses/by/4.0/","  In this paper, we consider the problem of representing any polynomial in
terms of the degenerate Bernoulli polynomials and more generally of the
higher-order degenerate Bernoulli polynomials. We derive explicit formulas with
the help of umbral calculus and illustrate our results with some examples.
","[{""version"":""v1"",""created"":""Wed, 11 Aug 2021 06:33:00 GMT""}]","2021-08-12"
"2108.05050","Massimo Sorella","Vikram Giri and Massimo Sorella","Non-uniqueness of integral curves for autonomous Hamiltonian vector
  fields","15 pages",,,,"math.AP","http://arxiv.org/licenses/nonexclusive-distrib/1.0/","  In this work we prove the existence of an autonomous Hamiltonian vector field
in W^{1,r}(T^d;R^d) with r< d-1and d>=4 for which the associated transport
equation has non-unique positive solutions. As a consequence of Ambrosio
superposition principle, we show that this vector field has non-unique integral
curves with a positive Lebesgue measure set of initial data and moreover we
show that the Hamiltonian is not constant along these integral curves.
","[{""version"":""v1"",""created"":""Wed, 11 Aug 2021 06:33:43 GMT""}]","2021-08-12"
"2108.05051","Motoyuki Ishikado","Motoyuki Ishikado, Katsuaki Kodama, Ryoichi Kajimoto, Mitsutaka
  Nakamura, Yasuhiro Inamura, Kazuhiko Ikeuchi, Sungdae Ji, Masatoshi Arai, and
  Shin-ichi Shamoto","Q Dependence of Magnetic Resonance Mode on FeTe$_{0.5}$Se$_{0.5}$
  Studied by Inelastic Neutron Scattering","10 pages, 3 figures","Condens. Matter 4, 69 (2019)","10.3390/condmat4030069",,"cond-mat.supr-con","http://creativecommons.org/licenses/by/4.0/","  Inelastic neutron scattering measurements have been performed on a
superconducting single crystal FeTe$_{0.5}$Se$_{0.5}$ to examine the ${\bf
Q}$-dependent enhancement of the dynamical structure factor, $S({\bf Q},E)$,
from ${\bf Q}$ = (0, 0) to ($\pi$, $\pi$), including ($\pi$, 0) in the
superconducting state. In most of iron-based superconductors, $S({\bf Q},E)$ is
enhanced at ${\bf Q}$ = ($\pi$, 0), where the ""magnetic resonance mode"" is
commonly observed in the unfolded Brillouin zone. Constant-$E$ cuts of $S({\bf
Q},E)$ suggest that the enhancement is not uniform in the magnetic excitation,
and limited around ${\bf Q}$ = ($\pi$, 0). This result is consistent with the
theoretical simulation of the magnetic resonance mode due to the
Bardeen$-$Cooper$-$Schrieffer coherence factor with the sign-reversing order
parameter of s$_{\pm}$ wave.
","[{""version"":""v1"",""created"":""Wed, 11 Aug 2021 06:33:46 GMT""}]","2021-08-12"
"2108.05052","Andrius \v{C}iginas","Andrius \v{C}iginas","Design-based composite estimation rediscovered",,,,,"stat.ME","http://creativecommons.org/licenses/by/4.0/","  Small area estimation methods are used in surveys, where sample sizes are too
small to get reliable direct estimates of parameters in some population
domains. We consider design-based linear combinations of direct and synthetic
estimators and propose a two-step procedure to approach the optimal
combination. We construct the mean square error estimator suitable for this and
any other linear composition that estimates the optimal one. We apply the
theory to two design-based compositions analogous to the empirical best linear
unbiased predictors (EBLUPs) based on the basic area- and unit-level models.
The simulation study shows that the new methods are efficient compared to
estimation using EBLUP.
","[{""version"":""v1"",""created"":""Wed, 11 Aug 2021 06:36:03 GMT""}]","2021-08-12"
"2108.05053","Laurel Orr","Laurel Orr, Atindriyo Sanyal, Xiao Ling, Karan Goel, and Megan
  Leszczynski","Managing ML Pipelines: Feature Stores and the Coming Wave of Embedding
  Ecosystems",,"VLDB 2021",,,"cs.LG cs.DB","http://arxiv.org/licenses/nonexclusive-distrib/1.0/","  The industrial machine learning pipeline requires iterating on model
features, training and deploying models, and monitoring deployed models at
scale. Feature stores were developed to manage and standardize the engineer's
workflow in this end-to-end pipeline, focusing on traditional tabular feature
data. In recent years, however, model development has shifted towards using
self-supervised pretrained embeddings as model features. Managing these
embeddings and the downstream systems that use them introduces new challenges
with respect to managing embedding training data, measuring embedding quality,
and monitoring downstream models that use embeddings. These challenges are
largely unaddressed in standard feature stores. Our goal in this tutorial is to
introduce the feature store system and discuss the challenges and current
solutions to managing these new embedding-centric pipelines.
","[{""version"":""v1"",""created"":""Wed, 11 Aug 2021 06:36:57 GMT""}]","2021-08-12"
"2108.05054","Sung-Jin Cho","Sung-Jin Cho, Seo-Won Ji, Jun-Pyo Hong, Seung-Won Jung, Sung-Jea Ko","Rethinking Coarse-to-Fine Approach in Single Image Deblurring","Accepted by IEEE International Conference on Computer Vision (ICCV)
  2021",,,,"cs.CV cs.AI","http://creativecommons.org/licenses/by-sa/4.0/","  Coarse-to-fine strategies have been extensively used for the architecture
design of single image deblurring networks. Conventional methods typically
stack sub-networks with multi-scale input images and gradually improve
sharpness of images from the bottom sub-network to the top sub-network,
yielding inevitably high computational costs. Toward a fast and accurate
deblurring network design, we revisit the coarse-to-fine strategy and present a
multi-input multi-output U-net (MIMO-UNet). The MIMO-UNet has three distinct
features. First, the single encoder of the MIMO-UNet takes multi-scale input
images to ease the difficulty of training. Second, the single decoder of the
MIMO-UNet outputs multiple deblurred images with different scales to mimic
multi-cascaded U-nets using a single U-shaped network. Last, asymmetric feature
fusion is introduced to merge multi-scale features in an efficient manner.
Extensive experiments on the GoPro and RealBlur datasets demonstrate that the
proposed network outperforms the state-of-the-art methods in terms of both
accuracy and computational complexity. Source code is available for research
purposes at https://github.com/chosj95/MIMO-UNet.
","[{""version"":""v1"",""created"":""Wed, 11 Aug 2021 06:37:01 GMT""},{""version"":""v2"",""created"":""Thu, 16 Sep 2021 09:04:59 GMT""}]","2021-09-17"
"2108.05055","Shuangchi He","Shuangchi He, Zehui Lin, Xin Yang, Chaoyu Chen, Jian Wang, Xue Shuang,
  Ziwei Deng, Qin Liu, Yan Cao, Xiduo Lu, Ruobing Huang, Nishant Ravikumar,
  Alejandro Frangi, Yuanji Zhang, Yi Xiong, Dong Ni","Statistical Dependency Guided Contrastive Learning for Multiple Labeling
  in Prenatal Ultrasound","Accepted by MICCAI-MLMI 2021",,,,"cs.CV","http://arxiv.org/licenses/nonexclusive-distrib/1.0/","  Standard plane recognition plays an important role in prenatal ultrasound
(US) screening. Automatically recognizing the standard plane along with the
corresponding anatomical structures in US image can not only facilitate US
image interpretation but also improve diagnostic efficiency. In this study, we
build a novel multi-label learning (MLL) scheme to identify multiple standard
planes and corresponding anatomical structures of fetus simultaneously. Our
contribution is three-fold. First, we represent the class correlation by word
embeddings to capture the fine-grained semantic and latent statistical
concurrency. Second, we equip the MLL with a graph convolutional network to
explore the inner and outer relationship among categories. Third, we propose a
novel cluster relabel-based contrastive learning algorithm to encourage the
divergence among ambiguous classes. Extensive validation was performed on our
large in-house dataset. Our approach reports the highest accuracy as 90.25% for
standard planes labeling, 85.59% for planes and structures labeling and mAP as
94.63%. The proposed MLL scheme provides a novel perspective for standard plane
recognition and can be easily extended to other medical image classification
tasks.
","[{""version"":""v1"",""created"":""Wed, 11 Aug 2021 06:39:26 GMT""},{""version"":""v2"",""created"":""Sun, 27 Mar 2022 10:38:40 GMT""},{""version"":""v3"",""created"":""Fri, 20 May 2022 11:42:29 GMT""}]","2022-05-23"
"2108.05056","Adrian Korban","Steven T. Dougherty, Joe Gildea, Adrian Korban, Adam M. Roberts","Group LCD and Group Reversible LCD Codes","17 pages",,,,"cs.IT math.IT","http://creativecommons.org/licenses/by/4.0/","  In this paper, we give a new method for constructing LCD codes. We employ
group rings and a well known map that sends group ring elements to a subring of
the $n \times n$ matrices to obtain LCD codes. Our construction method
guarantees that our LCD codes are also group codes, namely, the codes are
ideals in a group ring. We show that with a certain condition on the group ring
element $v,$ one can construct non-trivial group LCD codes. Moreover, we also
show that by adding more constraints on the group ring element $v,$ one can
construct group LCD codes that are reversible. We present many examples of
binary group LCD codes of which some are optimal and group reversible LCD codes
with different parameters.
","[{""version"":""v1"",""created"":""Wed, 11 Aug 2021 06:41:53 GMT""}]","2021-08-12"
