"2108.04906","Kranti Kumar Parida","Kranti Kumar Parida, Siddharth Srivastava, Neeraj Matiyali, Gaurav
  Sharma","Depth Infused Binaural Audio Generation using Hierarchical Cross-Modal
  Attention","Presented at Sight and Sound Workshop, CVPR 2021",,,,"cs.SD cs.CV cs.MM","http://creativecommons.org/licenses/by/4.0/","  Binaural audio gives the listener the feeling of being in the recording place
and enhances the immersive experience if coupled with AR/VR. But the problem
with binaural audio recording is that it requires a specialized setup which is
not possible to fabricate within handheld devices as compared to traditional
mono audio that can be recorded with a single microphone. In order to overcome
this drawback, prior works have tried to uplift the mono recorded audio to
binaural audio as a post processing step conditioning on the visual input. But
all the prior approaches missed other most important information required for
the task, i.e. distance of different sound producing objects from the recording
setup. In this work, we argue that the depth map of the scene can act as a
proxy for encoding distance information of objects in the scene and show that
adding depth features along with image features improves the performance both
qualitatively and quantitatively. We propose a novel encoder-decoder
architecture, where we use a hierarchical attention mechanism to encode the
image and depth feature extracted from individual transformer backbone, with
audio features at each layer of the decoder.
","[{""version"":""v1"",""created"":""Tue, 10 Aug 2021 20:26:44 GMT""}]","2021-08-12"
"2108.04907","Marcin Sendera","Marcin Sendera, Marek \'Smieja, {\L}ukasz Maziarka, {\L}ukasz Struski,
  Przemys{\l}aw Spurek, Jacek Tabor","Flow-based SVDD for anomaly detection","arXiv admin note: text overlap with arXiv:2010.03002",,,,"cs.LG","http://creativecommons.org/licenses/by/4.0/","  We propose FlowSVDD -- a flow-based one-class classifier for anomaly/outliers
detection that realizes a well-known SVDD principle using deep learning tools.
Contrary to other approaches to deep SVDD, the proposed model is instantiated
using flow-based models, which naturally prevents from collapsing of bounding
hypersphere into a single point. Experiments show that FlowSVDD achieves
comparable results to the current state-of-the-art methods and significantly
outperforms related deep SVDD methods on benchmark datasets.
","[{""version"":""v1"",""created"":""Tue, 10 Aug 2021 20:33:15 GMT""}]","2021-08-21"
"2108.04909","Fabian Dablander","Fabian Dablander, Karoline Huth, Quentin F. Gronau, Alexander Etz,
  Eric-Jan Wagenmakers","A Puzzle of Proportions: Two Popular Bayesian Tests Can Yield
  Dramatically Different Conclusions","16 pages, 7 figures",,,,"stat.AP","http://creativecommons.org/licenses/by/4.0/","  Testing the equality of two proportions is a common procedure in science,
especially in medicine and public health. In these domains it is crucial to be
able to quantify evidence for the absence of a treatment effect. Bayesian
hypothesis testing by means of the Bayes factor provides one avenue to do so,
requiring the specification of prior distributions for parameters. The most
popular analysis approach views the comparison of proportions from a
contingency table perspective, assigning prior distributions directly to the
two proportions. Another, less popular approach views the problem from a
logistic regression perspective, assigning prior distributions to
logit-transformed parameters. Reanalyzing 39 null results from the New England
Journal of Medicine with both approaches, we find that they can lead to
markedly different conclusions, especially when the observed proportions are at
the extremes (i.e., very low or very high). We explain these stark differences
and provide recommendations for researchers interested in testing the equality
of two proportions and users of Bayes factors more generally. The test that
assigns prior distributions to logit-transformed parameters creates prior
dependence between the two proportions and yields weaker evidence when the
observations are at the extremes. When comparing two proportions, we argue that
this test should become the new default.
","[{""version"":""v1"",""created"":""Tue, 10 Aug 2021 20:33:44 GMT""},{""version"":""v2"",""created"":""Tue, 30 Nov 2021 14:35:43 GMT""}]","2021-12-01"
"2108.04910","Bjoern Klose","Bjoern F. Klose, Geoffrey R. Spedding, Gustaaf B. Jacobs","Direct numerical simulation of cambered airfoil aerodynamics at Re =
  20,000",,,,,"physics.flu-dyn","http://arxiv.org/licenses/nonexclusive-distrib/1.0/","  A comprehensive and detailed overview of the flow topology over a cambered
NACA 65(1)-412 airfoil at Re = 20,000 is presented for angles of attack ranging
from 0{\deg} to 10{\deg} using high-order direct numerical simulations. It is
shown that instabilities bifurcate the flow and cause it to change at a
critical angle of attack from laminar separation without reattachment over a
laminar separation bubble at the trailing edge to a bubble at the leading edge.
The transition of the flow regimes is governed by the Karman vortex shedding of
the pressure side boundary layer at the trailing edge, Kelvin-Helmholtz
instabilities within the separated shear layer on the suction side, as well as
three-dimensional instabilities of elliptic flow within the vortex cores and
hyperbolic flow in the shear layer between subsequent Karman vortices. As the
suction side shear layer transitions and reattaches, the interaction of the two
and three-dimensional instabilities results in three-dimensional tubular
structures and large-scale turbulent puffs. The formation and shifting of the
laminar separation bubble defines the far-wake topology several chord-lengths
behind the airfoil and is accompanied by a sudden increase of the lift force
and decrease in the drag that underscores the sensitive nature of low-Reynolds
number airfoil aerodynamics. Lift and drag polars are presented for direct
numerical simulations, wind tunnel experiments, and simplified numerical
procedures where incorrect prediction of the force coefficients is caused by
the failure to correctly model the low-pressure region at the trailing edge
that is caused by the time-dependent generation of the Karman vortices.
","[{""version"":""v1"",""created"":""Tue, 10 Aug 2021 20:37:12 GMT""}]","2021-08-12"
"2108.04911","Rodrigo Maier","Rodrigo Maier","Yukawa Black Holes from Interacting Vacuum","Accepted for publication in Classical and Quantum Gravity","Class. Quantum Grav. 39 155008, 2022","10.1088/1361-6382/ac7d8e",,"gr-qc","http://arxiv.org/licenses/nonexclusive-distrib/1.0/","  In this paper we obtain an exact solution of Einstein field equations
assuming an interaction between a vacuum component and the Maxwell field. The
key feature of such interaction refers to a simple stress exchange so that the
electromagnetic field naturally incorporates the Yukawa potential. It is shown
that the resulting spacetime thus obtained can either be a naked singularity or
a black hole with an inner Cauchy horizon $R_-$ and an exterior event horizon
$R_+$. For this latter configuration we examine the group velocity of test
photons in the region $R>R_+$. Beyond a lower bound for the frequency we show
that superluminal velocities arise in a neighbourhood of the event horizon and
that the coupling parameter of the interaction is actually connected to a
nonvanishing rest mass for the photon.
","[{""version"":""v1"",""created"":""Tue, 10 Aug 2021 20:37:43 GMT""},{""version"":""v2"",""created"":""Fri, 24 Sep 2021 15:13:31 GMT""},{""version"":""v3"",""created"":""Thu, 30 Jun 2022 16:54:26 GMT""}]","2022-07-21"
"2108.04912","Yan Wu","Yan Wu, Yajun Ma, Youngwook Kee, Nataliya Kovalchuk, Dante Capaldi,
  Hongyi Ren, Steven Hancock, Eric Chang, Marcus Alley, John Pauly, Jiang Du,
  Shreyas Vasanawala, Lei Xing","Quantitative Parametric Mapping of Tissues Properties from Standard
  Magnetic Resonance Imaging Enabled by Deep Learning",,,,,"physics.med-ph","http://arxiv.org/licenses/nonexclusive-distrib/1.0/","  Magnetic resonance imaging (MRI) offers superior soft tissue contrast and is
widely used in biomedicine. However, conventional MRI is not quantitative,
which presents a bottleneck in image analysis and digital healthcare.
Typically, additional scans are required to disentangle the effect of multiple
parameters of MR and extract quantitative tissue properties. Here we
investigate a data-driven strategy Q^2 MRI (Qualitative and Quantitative MRI)
to derive quantitative parametric maps from standard MR images without
additional data acquisition. By taking advantage of the interdependency between
various MRI parametric maps buried in training data, the proposed deep learning
strategy enables accurate prediction of tissue relaxation properties as well as
other biophysical and biochemical characteristics from a single or a few images
with conventional T_1/T_2 weighting. Superior performance has been achieved in
quantitative MR imaging of the knee and liver. Q^2 MRI promises to provide a
powerful tool for a variety of biomedical applications and facilitate the next
generation of digital medicine.
","[{""version"":""v1"",""created"":""Tue, 10 Aug 2021 20:39:23 GMT""}]","2023-03-06"
"2108.04913","ShahRukh Athar","ShahRukh Athar, Zhixin Shu, Dimitris Samaras","FLAME-in-NeRF : Neural control of Radiance Fields for Free View Face
  Animation","version 1.0.0",,,,"cs.CV","http://creativecommons.org/licenses/by/4.0/","  This paper presents a neural rendering method for controllable portrait video
synthesis. Recent advances in volumetric neural rendering, such as neural
radiance fields (NeRF), has enabled the photorealistic novel view synthesis of
static scenes with impressive results. However, modeling dynamic and
controllable objects as part of a scene with such scene representations is
still challenging. In this work, we design a system that enables both novel
view synthesis for portrait video, including the human subject and the scene
background, and explicit control of the facial expressions through a
low-dimensional expression representation. We leverage the expression space of
a 3D morphable face model (3DMM) to represent the distribution of human facial
expressions, and use it to condition the NeRF volumetric function. Furthermore,
we impose a spatial prior brought by 3DMM fitting to guide the network to learn
disentangled control for scene appearance and facial actions. We demonstrate
the effectiveness of our method on free view synthesis of portrait videos with
expression controls. To train a scene, our method only requires a short video
of a subject captured by a mobile device.
","[{""version"":""v1"",""created"":""Tue, 10 Aug 2021 20:41:15 GMT""}]","2021-08-12"
"2108.04914","Dmitry V. Dylov","Artem Razumov, Oleg Y. Rogov, Dmitry V. Dylov","Optimal MRI Undersampling Patterns for Ultimate Benefit of Medical
  Vision Tasks",,"MICCAI 2022","10.1007/978-3-031-16446-0_73",,"eess.IV cs.CV","http://creativecommons.org/licenses/by-nc-nd/4.0/","  To accelerate MRI, the field of compressed sensing is traditionally concerned
with optimizing the image quality after a partial undersampling of the
measurable $\textit{k}$-space. In our work, we propose to change the focus from
the quality of the reconstructed image to the quality of the downstream image
analysis outcome. Specifically, we propose to optimize the patterns according
to how well a sought-after pathology could be detected or localized in the
reconstructed images. We find the optimal undersampling patterns in
$\textit{k}$-space that maximize target value functions of interest in
commonplace medical vision problems (reconstruction, segmentation, and
classification) and propose a new iterative gradient sampling routine
universally suitable for these tasks. We validate the proposed MRI acceleration
paradigm on three classical medical datasets, demonstrating a noticeable
improvement of the target metrics at the high acceleration factors (for the
segmentation problem at $\times$16 acceleration, we report up to 12%
improvement in Dice score over the other undersampling patterns).
","[{""version"":""v1"",""created"":""Tue, 10 Aug 2021 20:48:47 GMT""}]","2022-11-15"
"2108.04915","Seyyed Halataei","Seyyed M.H. Halataei","Caldeira-Leggett oscillator bath simulation of the Prokof'ev-Stamp spin
  bath in strong coupling limits","16 pages, 8 figures",,,,"quant-ph cond-mat.mes-hall physics.chem-ph","http://creativecommons.org/licenses/by/4.0/","  Open quantum systems are subject to interaction with their surrounding
environments. The environments are in general complex and intractable. At low
temperatures, quantum environments are mapped onto two simpler universality
classes of models, namely oscillator bath and spin bath models. The two models
are commonly recognized as completely distinct at strong coupling limits. In
particular, it is believed, that they cause two different dissipative
relaxation rates when they act on qubits. It is also believed that at such a
limit the relaxation rate caused by the spin bath model cannot be simulated by
the oscillator bath model. In this paper, I show, in contrast, that the
oscillator bath model can simulate the effect of the spin bath model in the
strong coupling limit of the spin bath. I demonstrate that, by choosing the
right parameters for the oscillator bath model such that it induces the same
rate and amount of bias energy fluctuations as those of the spin bath, the
oscillator bath model can produce a relaxation rate equivalent to that of the
spin bath model. This result implies that, as far as the relaxation rate is
concerned, the distinction between the oscillator bath model and the spin bath
model is far less than has been previously recognized.
","[{""version"":""v1"",""created"":""Tue, 10 Aug 2021 20:52:47 GMT""}]","2021-08-12"
"2108.04916","Iosif Pinelis","Iosif Pinelis","Best lower bound on the probability of a binomial exceeding its
  expectation","7 pages; to appear in Statistics and Probability Letters",,,,"math.PR math.ST stat.TH","http://arxiv.org/licenses/nonexclusive-distrib/1.0/","  Let $X$ be a random variable distributed according to the binomial
distribution with parameters $n$ and $p$. It is shown that $P(X>EX)\ge1/4$ if
$1>p\ge c/n$, where $c:=\ln(4/3)$, the best possible constant factor.
","[{""version"":""v1"",""created"":""Tue, 10 Aug 2021 20:58:21 GMT""}]","2021-08-12"
"2108.04917","Eli Kasai","E. Kasai (1), P. Goldoni (2), M. Backes (1 and 3), G. Cotter (4), S.
  Pita (2), C. Boisson (5), D. A. Williams (6), F D'Ammando (7), E. Lindfors
  (8), U. Barres de Almeida (9), W. Max-Moerbeck (10), V. Navarro-Aranguiz
  (10), J. Becerra-Gonzalez (11 and 12), O. Hervet (6), J.-P. Lenain (13), H.
  Sol (5) and S. Wagner (14) (for the CTA Collaboration, (1) Department of
  Physics, Chemistry & Material Science, University of Namibia, Windhoek,
  Namibia, (2) APC, AstroParticule et Cosmologie, Universite Paris Diderot,
  Paris, France, (3) Centre for Space Research, North-West University,
  Potchefstroom, South Africa, (4) University of Oxford, Oxford Astrophysics,
  Oxford, United Kingdom, (5) LUTH, Observatoire de Paris, Paris, France, (6)
  Santa Cruz Institute for Particle Physics and Department of Physics,
  University of California, Santa Cruz, CA, (7) INAF - Istituto di
  Radioastronomia, Bologna, Italy, (8) Finnish Centre for Astronomy with ESO,
  University of Turku, Finland, (9) Centro Brasileiro de Pesquisas Fisicas, Rio
  de Janeiro, Brazil, (10) Departamento de Astronomia, Universidad de Chile,
  Santiago, Chile, (11) Universidad de La Laguna (ULL), Departamento de
  Astrofisica, Tenerife, Spain, (12) Instituto de Astrofisica de Canarias,
  Tenerife, Spain, (13) Sorbonne Universite, Universite Paris Diderot, Paris,
  France, (14) Landessternwarte, Universitat Heidelberg, Heidelberg, Germany)","Southern African Large Telescope Spectroscopy of BL Lacs for the CTA
  project","15 pages, 4 figures, 37th International Cosmic Ray Conference","Proceedings of Science, PoS(ICRC2021)881",,,"astro-ph.HE hep-ex","http://creativecommons.org/licenses/by-nc-nd/4.0/","  In the last two decades, very-high-energy gamma-ray astronomy has reached
maturity: over 200 sources have been detected, both Galactic and extragalactic,
by ground-based experiments. At present, Active Galactic Nuclei (AGN) make up
about 40% of the more than 200 sources detected at very high energies with
ground-based telescopes, the majority of which are blazars, i.e. their jets are
closely aligned with the line of sight to Earth and three quarters of which are
classified as high-frequency peaked BL Lac objects. One challenge to studies of
the cosmological evolution of BL Lacs is the difficulty of obtaining redshifts
from their nearly featureless, continuum- dominated spectra. It is expected
that a significant fraction of the AGN to be detected with the future Cherenkov
Telescope Array (CTA) observatory will have no spectroscopic redshifts,
compromising the reliability of BL Lac population studies, particularly of
their cosmic evolution. We started an effort in 2019 to measure the redshifts
of a large fraction of the AGN that are likely to be detected with CTA, using
the Southern African Large Telescope (SALT). In this contribution, we present
two results from an on-going SALT program focused on the determination of BL
Lac object redshifts that will be relevant for the CTA observatory.
","[{""version"":""v1"",""created"":""Tue, 10 Aug 2021 20:58:21 GMT""}]","2021-08-23"
"2108.04918","Ekram Hossain","Taniya Shafique, Hina Tabassum, and Ekram Hossain","Stochastic Geometry Analysis of IRS-Assisted Downlink Cellular Networks",,,,,"cs.IT math.IT","http://arxiv.org/licenses/nonexclusive-distrib/1.0/","  Using stochastic geometry tools, we develop a comprehensive framework to
analyze the downlink coverage probability, ergodic capacity, and energy
efficiency (EE) of various types of users (e.g., users served by direct base
station (BS) transmissions and indirect intelligent reflecting surface
(IRS)-assisted transmissions) in a cellular network with multiple BSs and IRSs.
The proposed stochastic geometry framework can capture the impact of channel
fading, locations of BSs and IRSs, arbitrary phase-shifts and interference
experienced by a typical user supported by direct transmission and/or
IRS-assisted transmission. For IRS-assisted transmissions, we first model the
desired signal power from the nearest IRS as a sum of scaled generalized gamma
(GG) random variables whose parameters are functions of the IRS phase shifts.
Then, we derive the Laplace Transform (LT) of the received signal power in a
closed form. Also, we model the aggregate interference from multiple IRSs as
the sum of normal random variables. Then, we derive the LT of the aggregate
interference from all IRSs and BSs. The derived LT expressions are used to
calculate coverage probability, ergodic capacity, and EE for users served by
direct BS transmissions as well as users served by IRS-assisted transmissions.
Finally, we derive the overall network coverage probability, ergodic capacity,
and EE based on the fraction of direct and IRS-assisted users, which is defined
as a function of the deployment intensity of IRSs, as well as blockage
probability of direct transmission links. Numerical results validate the
derived analytical expressions and extract useful insights related to the
number of IRS elements, large-scale deployment of IRSs and BSs, and the impact
of IRS interference on direct transmissions.
","[{""version"":""v1"",""created"":""Tue, 10 Aug 2021 20:58:41 GMT""}]","2021-08-12"
"2108.04919","Ankur Sensharma","Dipa Saha, Sayantan Mitra, Bishnu Bhowmik and Ankur Sensharma","Isotropic random geometric networks in two dimensions with a penetrable
  cavity","Accepted in Physica A: Statistical Mechanics and its Applications, 37
  pages, 12 figures",,"10.1016/j.physa.2021.126297",,"physics.soc-ph cond-mat.stat-mech","http://arxiv.org/licenses/nonexclusive-distrib/1.0/","  In this work, a novel model of the random geometric graph (RGG), namely the
isotropic random geometric graph (IRGG) has been developed and its topological
properties in two dimensions have been studied in details. The defining
characteristics of RGG and IRGG are the same --- two nodes are connected by an
edge if their distance is less than a fixed value, called the connection
radius. However, IRGGs have two major differences from regular RGGs. Firstly,
the shape of their boundaries --- which is circular. It brings very little
changes in final results but gives a significant advantage in analytical
calculations of the network properties. Secondly, it opens up the possibility
of an empty concentric region inside the network. The empty region contains no
nodes but allows the communicating edges between the nodes to pass through it.
This second difference causes significant alterations in physically relevant
network properties such as average degree, connectivity, clustering coefficient
and average shortest path. Analytical expressions for most of these features
have been provided. These results agree well with those obtained from
simulations. Apart from the applicability of the model due to its symmetry and
simplicity, the scope of incorporating a penetrable cavity makes it suitable
for potential applications in wireless communication networks that often have a
node-free region.
","[{""version"":""v1"",""created"":""Tue, 10 Aug 2021 21:02:35 GMT""}]","2021-08-12"
"2108.04920","Hugo Alberto Ayala Solares","Hugo Ayala (for the AMON Group, for the IceCube Collaboration, for the
  HAWC Collaboration, for the ANTARES Collaboration)","Multimessenger NuEM Alerts with AMON","Presented at the 37th International Cosmic Ray Conference (ICRC
  2021). See arXiv:2107.06966 for all IceCube contributions",,,"PoS-ICRC2021-958","astro-ph.HE astro-ph.IM","http://arxiv.org/licenses/nonexclusive-distrib/1.0/","  The Astrophysical Multimessenger Observatory Network (AMON), has developed a
real-time multi-messenger alert system. The system performs coincidence
analyses of datasets from gamma-ray and neutrino detectors, making the
Neutrino-Electromagnetic (NuEM) alert channel. For these analyses, AMON takes
advantage of sub-threshold events, i.e., events that by themselves are not
significant in the individual detectors. The main purpose of this channel is to
search for gamma-ray counterparts of neutrino events. We will describe the
different analyses that make up this channel and present a selection of recent
results.
","[{""version"":""v1"",""created"":""Tue, 10 Aug 2021 21:02:55 GMT""}]","2021-08-23"
"2108.04921","Yury Kashnitsky","Yury Kashnitsky, Vaishnavi Kandala, Egbert van Wezenbeek, IJsbrand Jan
  Aalbersberg, Catriona Fennell, Georgios Tsatsaronis","How near-duplicate detection improves editors' and authors' publishing
  experience","short paper, 2 pages, 1 figure, presented at Computational Research
  Integrity 2021 conference",,,,"cs.DL","http://creativecommons.org/licenses/by/4.0/","  We describe a system that helps identify manuscripts submitted to multiple
journals at the same time. Also, we discuss potential applications of the
near-duplicate detection technology when run with manuscript text content,
including identification of simultaneous submissions, prevention of duplicate
published articles, and improving article transfer service.
","[{""version"":""v1"",""created"":""Tue, 10 Aug 2021 21:11:27 GMT""}]","2021-08-12"
"2108.04922","Sivaramakrishnan Ravichandran","G. R. Vybhav and S. Ravichandran","Entrainment in dry and moist thermals","22 pages, 19 figures","Phys. Rev. Fluids 7, 050501 (2022)","10.1103/PhysRevFluids.7.050501",,"physics.flu-dyn physics.ao-ph","http://creativecommons.org/licenses/by-nc-nd/4.0/","  We study entrainment in dry thermals in neutrally and unstably stratified
ambients, and moist thermals in dry-neutrally stratified ambients using direct
numerical simulations (DNS). We find, in agreement with results of Lecoanet and
Jeevanjee \tb{[J. Atmos. Sci. 76(12), 3785-3801, (2019)]} that turbulence plays
a minor role in entrainment in dry thermals in a neutral ambient for Reynolds
numbers $Re \lesssim 10^4$. We then show that the net entrainment rate
increases when the buoyancy of the thermals increases, either by condensation
heating or because of an unstably stratified ambient. This is in contrast with
the findings of Morrison et al. [J. Atmos. Sci. 78(3), 797-816, (2021)]. We
also show that the role of turbulence is greater in these cases than in dry
thermals and, significantly, that the combined action of condensation heating
and turbulence creates intense small scale vorticity, destroying the {coherent}
vortex ring that is seen in dry and moist laminar thermals. These findings
suggest that fully resolved simulations at Reynolds numbers significantly
larger than the mixing transition Reynolds number $Re=10^4$ are necessary to
understand the role of turbulence in the entrainment in growing cumulus clouds,
which consist of a series of thermals rising and decaying in succession.
","[{""version"":""v1"",""created"":""Tue, 10 Aug 2021 21:14:23 GMT""},{""version"":""v2"",""created"":""Wed, 18 May 2022 09:50:43 GMT""}]","2022-05-19"
