"2108.05152","Asia Biega","\""Omer K{\i}rnap, Fernando Diaz, Asia Biega, Michael Ekstrand, Ben
  Carterette, Emine Y{\i}lmaz","Estimation of Fair Ranking Metrics with Incomplete Judgments","Published in Proceedings of the Web Conference 2021 (WWW '21)",,,,"cs.IR cs.CY cs.LG","http://arxiv.org/licenses/nonexclusive-distrib/1.0/","  There is increasing attention to evaluating the fairness of search system
ranking decisions. These metrics often consider the membership of items to
particular groups, often identified using protected attributes such as gender
or ethnicity. To date, these metrics typically assume the availability and
completeness of protected attribute labels of items. However, the protected
attributes of individuals are rarely present, limiting the application of fair
ranking metrics in large scale systems. In order to address this problem, we
propose a sampling strategy and estimation technique for four fair ranking
metrics. We formulate a robust and unbiased estimator which can operate even
with very limited number of labeled items. We evaluate our approach using both
simulated and real world data. Our experimental results demonstrate that our
method can estimate this family of fair ranking metrics and provides a robust,
reliable alternative to exhaustive or random data annotation.
","[{""version"":""v1"",""created"":""Wed, 11 Aug 2021 10:57:00 GMT""}]","2021-08-12"
"2108.05153","Duncan V. Mifsud","Duncan V. Mifsud, Perry A. Hailey, Alejandra Traspas Muina, Olivier
  Auriacombe, Sergio Ioppolo, Nigel J. Mason","The Role of Terahertz and Far-IR Spectroscopy in Understanding the
  Formation and Evolution of Interstellar Prebiotic Molecules","Submitted for publication in Frontiers in Astronomy and Space Science",,"10.3389/fspas.2021.757619",,"astro-ph.GA astro-ph.EP astro-ph.IM","http://creativecommons.org/licenses/by-nc-nd/4.0/","  Stellar systems are often formed through the collapse of dense molecular
clouds which, in turn, return copious amounts of atomic and molecular material
to the interstellar medium. An in-depth understanding of chemical evolution
during this cyclic interaction between the stars and the interstellar medium is
at the heart of astrochemistry. Systematic chemical composition changes as
interstellar clouds evolve from the diffuse stage to dense, quiescent molecular
clouds to star-forming regions and proto-planetary disks further enrich the
molecular diversity leading to the evolution of ever more complex molecules. In
particular, the icy mantles formed on interstellar dust grains and their
irradiation are thought to be the origin of many of the observed molecules,
including those that are deemed to be prebiotic; that is those molecules
necessary for the origin of life. This review will discuss both observational
(e.g., ALMA, SOFIA, Herschel) and laboratory investigations using millimeter,
submillimeter, and terahertz and far-IR (THz/F-IR) spectroscopies and the role
that they play in contributing to our understanding of the formation of
prebiotic molecules. Mid-IR spectroscopy has typically been the primary tool
used in laboratory studies. However, THz/F-IR spectroscopy offers an additional
and complementary approach in that it provides the ability to investigate
intermolecular interactions compared to the intramolecular modes available in
the mid-IR. THz/F-IR spectroscopy is still somewhat under-utilized, but with
the additional capability it brings, its popularity is likely to significantly
increase in the near future. This review will discuss the strengths and
limitations of such methods, and will also provide some suggestions on future
research areas that should be pursued in the coming decade exploiting both
space-borne and laboratory facilities.
","[{""version"":""v1"",""created"":""Wed, 11 Aug 2021 10:57:47 GMT""}]","2022-01-26"
"2108.05154","Daniel Graves","Daniel Graves","E-infinity structure in hyperoctahedral homology","14 pages. New section added treating hyperoctahedral homology in
  degree zero. To appear in Homology, Homotopy and Applications",,"10.4310/HHA.2023.v25.n1.a1",,"math.AT","http://creativecommons.org/licenses/by/4.0/","  Hyperoctahedral homology for involutive algebras is the homology theory
associated to the hyperoctahedral crossed simplicial group. It is related to
equivariant stable homotopy theory via the homology of equivariant infinite
loop spaces. In this paper we show that there is an E-infinity algebra
structure on the simplicial module that computes hyperoctahedral homology. We
deduce that hyperoctahedral homology admits Dyer-Lashof homology operations.
Furthermore, there is a Pontryagin product which gives hyperoctahedral homology
the structure of an associative, graded-commutative algebra. We also give an
explicit description of hyperoctahedral homology in degree zero. Combining this
description and the Pontryagin product we show that hyperoctahedral homology
fails to preserve Morita equivalence.
","[{""version"":""v1"",""created"":""Wed, 11 Aug 2021 11:00:48 GMT""},{""version"":""v2"",""created"":""Fri, 14 Jan 2022 12:22:47 GMT""}]","2023-03-22"
"2108.05155","Ovidiu Patu","Ovidiu I. Patu","Dynamical fermionization in a one-dimensional Bose-Fermi mixture","25 pages, 3 figures, RevTeX 4.2","Phys. Rev. A 105, 063309 (2022)","10.1103/PhysRevA.105.063309",,"cond-mat.quant-gas cond-mat.stat-mech","http://arxiv.org/licenses/nonexclusive-distrib/1.0/","  After release from the trap the momentum distribution of an impenetrable gas
asymptotically approaches that of a spinless noninteracting Fermi gas in the
initial trap. This phenomenon is called dynamical fermionization and, very
recently, has been experimentally confirmed in the case of the Lieb-Liniger
model in the Tonks-Girardeau regime. We prove analytically and confirm
numerically that following the removal of axial confinement the strongly
interacting Bose-Fermi mixture exhibits dynamical fermionization and the
asymptotical momentum distribution of each component has the same shape as its
density profile at $t=0$. Under a sudden change of the trap frequency to a new
non-zero value the dynamics of both fermionic and bosonic momentum
distributions presents characteristics which are similar to the case of single
component bosons experiencing a similar quench. Our results are derived using a
product representation for the correlation functions which, in addition to
analytical considerations, can be implemented numerically very easily with
complexity which scales polynomially in the number of particles.
","[{""version"":""v1"",""created"":""Wed, 11 Aug 2021 11:01:52 GMT""},{""version"":""v2"",""created"":""Sun, 29 Aug 2021 07:41:41 GMT""},{""version"":""v3"",""created"":""Wed, 15 Sep 2021 12:09:37 GMT""},{""version"":""v4"",""created"":""Fri, 5 Nov 2021 08:24:47 GMT""},{""version"":""v5"",""created"":""Fri, 10 Jun 2022 10:45:48 GMT""}]","2022-06-13"
"2108.05156","Lahoucine Bahmad","S. Idrissi, L. Bahmad and A. Benyoussef","Electronic properties of the Rutile-type dioxide SnO2 material doped by
  sulfur element: DFT study",,,,,"cond-mat.mtrl-sci cond-mat.stat-mech","http://arxiv.org/licenses/nonexclusive-distrib/1.0/","  In this work, we study the effect of doping the Rutile-type dioxide SnO2
material by the non-metal Sulfur (S) atoms on the electronic properties. In
fact, we have used the ab-initio method applied on the basis of the Density
Functional Theory (DFT) using the Quantum Espresso code. Through the density of
states and the band structure calculations for different concentrations have
been deduced. When doping the SnO2 material with 6% of Sulfur (S), we found a
perfect symmetry between up and down spin states in the total DOS confirming
the non-magnetic behavior of this material doped SnO2 with 6% of Sulfur. It is
also worth to note that the SnO2 material doped with 6% of Sulfur, exhibits a
semiconductor of the P-type. Moreover the band gap decreases when increasing
the concentration of doping the SnO2 by Sulfur. Our results are in good
agreement with the existing literature both experimental and theoretical.
","[{""version"":""v1"",""created"":""Wed, 11 Aug 2021 11:03:36 GMT""}]","2021-08-12"
"2108.05157","Giampaolo Liuzzi","Andrea Brilli and Giampaolo Liuzzi and Stefano Lucidi","An interior point method for nonlinear constrained derivative-free
  optimization","We dropped the convexity assumption to take into account that
  convexity is no longer required, we changed the theoretical analysis,
  exposition of the main algorithm has changed. We first present a simpler
  method and then the main algorithm. Numerical results have been a lot
  extended by adding some comparison",,,,"math.OC","http://arxiv.org/licenses/nonexclusive-distrib/1.0/","  In this paper we consider constrained optimization problems where both the
objective and constraint functions are of the black-box type. Furthermore, we
assume that the nonlinear inequality constraints are non-relaxable, i.e. their
values and that of the objective function cannot be computed outside of the
feasible region. This situation happens frequently in practice especially in
the black-box setting where function values are typically computed by means of
complex simulation programs which may fail to execute if the considered point
is outside of the feasible region. For such problems, we propose a new
derivative-free optimization method which is based on the use of a merit
function that handles inequality constraints by means of a log-barrier approach
and equality constraints by means of a quadratic penalty approach. We prove
convergence of the proposed method to KKT stationary points of the problem
under quite mild assumptions. Furthermore, we also carry out a preliminary
numerical experience on standard test problems and comparison with a
state-of-the-art solver which shows efficiency of the proposed method.
","[{""version"":""v1"",""created"":""Wed, 11 Aug 2021 11:04:17 GMT""},{""version"":""v2"",""created"":""Tue, 19 Jul 2022 14:02:43 GMT""}]","2022-07-21"
"2108.05158","Donggeon Lee","Donggeon Lee, Seongho Choi, Youwon Jang, Byoung-Tak Zhang","Mounting Video Metadata on Transformer-based Language Model for
  Open-ended Video Question Answering","5 pages, 1 figure",,,,"cs.CV cs.AI","http://arxiv.org/licenses/nonexclusive-distrib/1.0/","  Video question answering has recently received a lot of attention from
multimodal video researchers. Most video question answering datasets are
usually in the form of multiple-choice. But, the model for the multiple-choice
task does not infer the answer. Rather it compares the answer candidates for
picking the correct answer. Furthermore, it makes it difficult to extend to
other tasks. In this paper, we challenge the existing multiple-choice video
question answering by changing it to open-ended video question answering. To
tackle open-ended question answering, we use the pretrained GPT2 model. The
model is fine-tuned with video inputs and subtitles. An ablation study is
performed by changing the existing DramaQA dataset to an open-ended question
answering, and it shows that performance can be improved using video metadata.
","[{""version"":""v1"",""created"":""Wed, 11 Aug 2021 11:11:43 GMT""}]","2021-08-12"
"2108.05159","Johannes Obenaus","Johannes Obenaus and Joachim Orthaber","Edge Partitions of Complete Geometric Graphs (Part 1)",,,,,"math.CO cs.CG","http://arxiv.org/licenses/nonexclusive-distrib/1.0/","  In this paper, we disprove the long-standing conjecture that any complete
geometric graph on $2n$ vertices can be partitioned into $n$ plane spanning
trees. Our construction is based on so-called bumpy wheel sets. We fully
characterize which bumpy wheels can and in particular which \emph{cannot} be
partitioned into plane spanning trees (or even into arbitrary plane
\emph{subgraphs}), including a complete description of all possible partitions
(into plane spanning trees).
  Furthermore, we show a sufficient condition for \emph{generalized wheels} to
not admit a partition into plane spanning trees, and give a complete
characterization when they admit a partition into plane spanning double stars.
","[{""version"":""v1"",""created"":""Wed, 11 Aug 2021 11:18:31 GMT""},{""version"":""v2"",""created"":""Fri, 17 Dec 2021 09:52:22 GMT""}]","2021-12-20"
"2108.05160","Lahoucine Bahmad","S. Idrissi, S. Ziti, H. Labrim, L. Bahmad and A. Benyoussef","DFT and Monte Carlo simulations of the equiatomic quaternary Heusler
  Alloy CoFeCrP",,,,,"cond-mat.mtrl-sci","http://arxiv.org/licenses/nonexclusive-distrib/1.0/","  In this work, we study the equiatomic quaternary Heusler Alloy CoFeCrP using
two methods: DFT and Monte Carlo simulations. The DFT method allowed us to
illustrate the structural, electronic and magnetic properties of this alloy.
The ground state phase diagrams have been presented to show the stable
configurations in different physical parameter planes. On the other hand, the
Monte Carlo simulations, performed under the Metropolis algorithm, permitted to
deduce the critical the behavior of the equiatomic quaternary Heusler alloy
CoFeCrP. The structural properties results show that the phase of type I, of
this alloy is the most stable configuration. In addition, the band structures,
and density of states calculations results show that this compound exhibits a
half-metallic character with a 100 % of spin polarization (SP) at the
Fermi-level. The total magnetic moment of the Heusler compound is found to be
4.00 mu_B. Moreover, it is found that the Slater-Pauling is well described for
this alloy. Our results show that this material is a potential candidate for
the spintronic applications. This is due to its half-metallicity, its high spin
moments, its complete SP polarization and its high Curie temperature.
","[{""version"":""v1"",""created"":""Wed, 11 Aug 2021 11:19:35 GMT""}]","2021-08-12"
"2108.05161","Vladimir Zorich","V. A. Zorich","A generalization of the Picard theorem",,,,,"math.CV","http://arxiv.org/licenses/nonexclusive-distrib/1.0/","  We recall the notions of conformal and quasiconformal mappings \textit{in the
sense of Gromov}, extending the classical notions of conformal and
quasiconformal mappings, and prove the following theorem. {\em If the mapping $
F: \mathbb{R}^{n} \to \mathbb{R}^{2} $, where $ n \geq 2 $, quasiconformal in
the sense of Gromov, omits more than one value on the plane $\mathbb{R}^{2} $,
then it is a constant mapping.}
","[{""version"":""v1"",""created"":""Wed, 11 Aug 2021 11:24:55 GMT""}]","2021-08-22"
"2108.05162","Lahoucine Bahmad","S. Idrissi, S. Ziti, H. Labrim and L. Bahmad","Critical Magnetic Behavior of the Half Heusler Alloy RhCrSi: Monte Carlo
  Study",,,,,"cond-mat.mtrl-sci","http://arxiv.org/licenses/nonexclusive-distrib/1.0/","  In this paper, we study the critical magnetic properties of the Half Heusler
alloy RhCrSi, using Monte Carlo simulations (MCS) under the Metropolis
algorithm. In fact, to study this alloy, we apply an Ising model using the MCS
simulations, we concentrate only on the magnetic atoms: Rh and Cr. For this
purpose, these magnetic atoms are modeled by the spin moments S=5/2 for Rh
atoms and sigma=2 for Cr atoms, respectively. In addition, we discuss the
ground state phase diagrams in different planes corresponding to different
physical parameters. On the other hand, for non-null temperature values, we
perform the Monte Carlo simulations (MCS) to study the critical behavior of the
compound RhCrSi, in the Ising approximation. Indeed, we present a detailed
discussion of the obtained results for the magnetizations as a function of the
temperature, the crystal field and the exchange coupling interactions.
Additionally, we give the reliance of the basic temperature as an element of
precious crystal field when fixing the exchange coupling interactions. To
finish this work, we built up and examined the magnetic hysteresis cycles and
the relating coercive fields as a part of the external magnetic field.
","[{""version"":""v1"",""created"":""Wed, 11 Aug 2021 11:27:21 GMT""}]","2021-08-12"
"2108.05163","Louis Gallagher","Louis Gallagher and John B. McDonald","Efficient Surfel Fusion Using Normalised Information Distance","4 pages, 4 figures, presented at CVPR 2019 Workshop on 3D Scene
  Understanding for Vision, Graphics, and Robotics",,,,"cs.CV","http://arxiv.org/licenses/nonexclusive-distrib/1.0/","  We present a new technique that achieves a significant reduction in the
quantity of measurements required for a fusion based dense 3D mapping system to
converge to an accurate, de-noised surface reconstruction. This is achieved
through the use of a Normalised Information Distance metric, that computes the
novelty of the information contained in each incoming frame with respect to the
reconstruction, and avoids fusing those frames that exceed a redundancy
threshold. This provides a principled approach for opitmising the trade-off
between surface reconstruction accuracy and the computational cost of
processing frames. The technique builds upon the ElasticFusion (EF) algorithm
where we report results of the technique's scalability and the accuracy of the
resultant maps by applying it to both the ICL-NUIM and TUM RGB-D datasets.
These results demonstrate the capabilities of the approach in performing
accurate surface reconstructions whilst utilising a fraction of the frames when
compared to the original EF algorithm.
","[{""version"":""v1"",""created"":""Wed, 11 Aug 2021 11:28:31 GMT""}]","2021-08-12"
"2108.05164","{\DJ}or{\dj}e Mitrovi\'c","Ademir Hujdurovi\'c, {\DJ}or{\dj}e Mitrovi\'c and Dave Witte Morris","Automorphisms of the double cover of a circulant graph of valency at
  most 7","48 pages (plus 3 pages of notes to aid the referee), MAGMA and
  sagemath source codes for checking stability of circulant graphs are
  available in the ancillary files",,,,"math.CO","http://creativecommons.org/licenses/by/4.0/","  A graph $X$ is said to be unstable if the direct product $X \times K_2$ (also
called the canonical double cover of $X$) has automorphisms that do not come
from automorphisms of its factors $X$ and $K_2$. It is nontrivially unstable if
it is unstable, connected, and non-bipartite, and no two distinct vertices of X
have exactly the same neighbors.
  We find all of the nontrivially unstable circulant graphs of valency at most
$7$. (They come in several infinite families.) We also show that the
instability of each of these graphs is explained by theorems of Steve Wilson.
This is best possible, because there is a nontrivially unstable circulant graph
of valency $8$ that does not satisfy the hypotheses of any of Wilson's four
instability theorems for circulant graphs.
","[{""version"":""v1"",""created"":""Wed, 11 Aug 2021 11:33:39 GMT""}]","2021-08-12"
"2108.05165","Selin Eyupoglu","Selin Eyupoglu, Muge Fidan, Yavuz Gulesen, Ilayda Begum Izci, Berkan
  Teber, Baturay Yilmaz, Ahmet Alkan, Esra Erdem","Stable Marriage Problems with Ties and Incomplete Preferences: An
  Empirical Comparison of ASP, SAT, ILP, CP, and Local Search Methods","This paper is under consideration for acceptance in Theory and
  Practice of Logic Programming (TPLP)",,,,"cs.AI","http://arxiv.org/licenses/nonexclusive-distrib/1.0/","  We study a variation of the Stable Marriage problem, where every man and
every woman express their preferences as preference lists which may be
incomplete and contain ties. This problem is called the Stable Marriage problem
with Ties and Incomplete preferences (SMTI). We consider three optimization
variants of SMTI, Max Cardinality, Sex-Equal and Egalitarian, and empirically
compare the following methods to solve them: Answer Set Programming, Constraint
Programming, Integer Linear Programming. For Max Cardinality, we compare these
methods with Local Search methods as well. We also empirically compare Answer
Set Programming with Propositional Satisfiability, for SMTI instances. This
paper is under consideration for acceptance in Theory and Practice of Logic
Programming (TPLP).
","[{""version"":""v1"",""created"":""Wed, 11 Aug 2021 11:39:51 GMT""},{""version"":""v2"",""created"":""Tue, 17 Aug 2021 12:43:22 GMT""}]","2021-08-18"
"2108.05166","Philip Avraam","P. Avraam, D. McGonegle, P. G. Heighway, C. E. Wehrenberg, E. Floyd,
  A. Comley, J. M. Foster, J. Turner, S. Case, J. S. Wark","Crystal plasticity finite element simulation of lattice rotation and
  x-ray diffraction during laser shock-compression of Tantalum","7 pages, 4 figures in main article; 4 pages, 3 figures in
  supplemental material",,,,"cond-mat.mtrl-sci","http://creativecommons.org/licenses/by-nc-nd/4.0/","  Wehrenberg et. al. [Nature 550 496 (2017)] used ultrafast in situ x-ray
diffraction at the LCLS x-ray free-electron laser facility to measure large
lattice rotations resulting from slip and deformation twinning in
shock-compressed laser-driven [110] fibre textured tantalum polycrystal. We
employ a crystal plasticity finite element method model, with slip kinetics
based closely on the isotropic dislocation-based Livermore Multiscale Model
[Barton et. al., J. Appl. Phys. 109 (2011)], to analyse this experiment. We
elucidate the link between the degree of lattice rotation and the kinetics of
plasticity, demonstrating that a transition occurs at shock pressures of
$\sim$27 GPa, between a regime of relatively slow kinetics, resulting in a
balanced pattern of slip system activation and therefore relatively small net
lattice rotation, and a regime of fast kinetics, due to the onset of
nucleation, resulting in a lop-sided pattern of deformation-system activation
and therefore large net lattice rotations. We demonstrate a good fit between
this model and experimental x-ray diffraction data of lattice rotation, and
show that this data is constraining of deformation kinetics.
","[{""version"":""v1"",""created"":""Wed, 11 Aug 2021 11:45:48 GMT""},{""version"":""v2"",""created"":""Wed, 18 Aug 2021 10:28:13 GMT""}]","2021-08-19"
"2108.05167","Edward Hirst","Jiakang Bao, Amihay Hanany, Yang-Hui He, Edward Hirst","Some Open Questions in Quiver Gauge Theory","25 pages, invited contribution to a special volume of Proyecciones,
  E. Gasparim, Ed","Proyecciones Journal of Mathematics, Vol. 41 No. 2 (2022): Special
  Issue on Open Questions in Geometry","10.22199/issn.0717-6279-5274","Imperial/TP/21/AH/04, LIMS-2021-009","hep-th math.AG math.RT","http://arxiv.org/licenses/nonexclusive-distrib/1.0/","  Quivers, gauge theories and singular geometries are of great interest in both
mathematics and physics. In this note, we collect a few open questions which
have arisen in various recent works at the intersection between gauge theories,
representation theory, and algebraic geometry. The questions originate from the
study of supersymmetric gauge theories in different dimensions with different
supersymmetries. Although these constitute merely the tip of a vast iceberg, we
hope this guide can give a hint of possible directions in future research. This
is an invited contribution to a special volume of Proyecciones, E. Gasparim,
Ed., and it is the hope that the questions are specific enough for research
projects aimed at PhD students.
","[{""version"":""v1"",""created"":""Wed, 11 Aug 2021 11:47:35 GMT""}]","2022-04-12"
"2108.05168","Hua Jiang","Bing-Lan Wu, Zi-Bo Wang, Zhi-Qiang Zhang, and Hua Jiang","Building programable integrated circuits through disordered Chern
  insulators","5 figures","Phys. Rev. B 104, 195416 (2021)","10.1103/PhysRevB.104.195416",,"cond-mat.mes-hall cond-mat.dis-nn","http://creativecommons.org/licenses/by/4.0/","  We study the construction of programable integrated circuits with the help of
disordered Chern insulators (CIs) in this letter. Specifically, the schemes for
low dissipation logic devices and connecting wires are proposed. We use the
external-gate-induced step voltage to construct spatially adjustable channels,
where these channels take the place of the conventional wires. Our numerical
calculation manifests that the external gates can be adopted to program the
arbitrary number of wires ($n$-to-$m$ connections). We find that their electron
transport is dissipationless and robust against gate voltage fluctuation and
disorder strength. Furthermore, seven basic logic gates distinct from the
conventional structures are proposed. Our proposal has potential applications
in low power integrated circuits and enlightens the building of integrated
circuits in topological materials.
","[{""version"":""v1"",""created"":""Wed, 11 Aug 2021 11:51:09 GMT""}]","2021-11-24"
"2108.05169","Joshua Foo","Joshua Foo, Estelle Asmodelle, Austin P. Lund, Timothy C. Ralph","Relativistic Bohmian trajectories of photons via weak measurements","11 pages, 6 figures. Published in Nature Communications","Nature Communications 13, 4002 (2022)","10.1038/s41467-022-31608-6",,"quant-ph gr-qc","http://creativecommons.org/licenses/by/4.0/","  Bohmian mechanics is a nonlocal hidden-variable interpretation of quantum
theory which predicts that particles follow deterministic trajectories in
spacetime. Historically, the study of Bohmian trajectories has mainly been
restricted to nonrelativistic regimes due to the widely held belief that the
theory is incompatible with special relativity. Here we derive expressions for
the relativistic velocity and spacetime trajectories of photons in a
Michelson-Sagnac-type interferometer. The trajectories satisfy
quantum-mechanical continuity and the relativistic velocity addition rule. Our
new velocity equation is operationally defined in terms of weak measurements of
momentum and energy. We finally propose a modified Alcubierre metric which
could give rise to these trajectories within the paradigm of general
relativity.
","[{""version"":""v1"",""created"":""Wed, 11 Aug 2021 11:51:32 GMT""},{""version"":""v2"",""created"":""Mon, 6 Dec 2021 05:54:51 GMT""},{""version"":""v3"",""created"":""Fri, 15 Jul 2022 23:45:36 GMT""}]","2022-07-19"
