"2108.10948","Anton Dochtermann","Anton Dochtermann and Anurag Singh","Homomorphism complexes, reconfiguration, and homotopy for directed
  graphs","34 pages, 10 figures",,,,"math.CO math.AT","http://creativecommons.org/licenses/by/4.0/","  The neighborhood complex of a graph was introduced by Lov\'asz to provide
topological lower bounds on chromatic number, and more general homomorphism
complexes of graphs were further studied by Babson and Kozlov. Such `Hom
complexes' are also related to reconfiguration problems and a notion of
discrete homotopy for graphs. Here we initiate the detailed study of Hom
complexes for directed graphs, which have applications in the study of graded
posets and resolutions of monomial ideals. Our construction can be seen as a
special case of the poset structure on the set of multihomomorphisms in more
general categories, as introduced by Kozlov, Matsushita, and others. We relate
the topological properties of Hom complexes to certain digraph operations
including products, adjunctions, and foldings. We introduce a notion of a
neighborhood complex for a directed graph and prove that its homotopy type is
recovered as a certain Hom complex. We establish a number of results regarding
the topology of these complexes, including the dependence on directed bipartite
subgraphs, a directed version of the Mycielksi construction, as well as
vanishing theorems for higher homology. Inspired by notions of reconfigurations
of directed graph colorings we study the connectivity of Hom complexes into
tournaments $T_n$. We obtain a complete answer for the case of transitive
$T_n$, where we also describe a connection to mixed subdivisions of dilated
simplices. Finally we use paths in the internal hom objects of directed graphs
to define various notions of homotopy, and discuss connections to the topology
of Hom complexes.
","[{""version"":""v1"",""created"":""Tue, 24 Aug 2021 20:48:12 GMT""}]","2021-08-26"
"2108.10949","Vera Provatorova","Vera Provatorova, Svitlana Vakulenko, Samarth Bhargav, Evangelos
  Kanoulas","Robustness Evaluation of Entity Disambiguation Using Prior Probes:the
  Case of Entity Overshadowing",,"Proceedings of the 2021 Conference on Empirical Methods in Natural
  Language Processing (2021) 10501-10510",,,"cs.CL","http://arxiv.org/licenses/nonexclusive-distrib/1.0/","  Entity disambiguation (ED) is the last step of entity linking (EL), when
candidate entities are reranked according to the context they appear in. All
datasets for training and evaluating models for EL consist of convenience
samples, such as news articles and tweets, that propagate the prior probability
bias of the entity distribution towards more frequently occurring entities. It
was previously shown that the performance of the EL systems on such datasets is
overestimated since it is possible to obtain higher accuracy scores by merely
learning the prior. To provide a more adequate evaluation benchmark, we
introduce the ShadowLink dataset, which includes 16K short text snippets
annotated with entity mentions. We evaluate and report the performance of
popular EL systems on the ShadowLink benchmark. The results show a considerable
difference in accuracy between more and less common entities for all of the EL
systems under evaluation, demonstrating the effects of prior probability bias
and entity overshadowing.
","[{""version"":""v1"",""created"":""Tue, 24 Aug 2021 20:54:56 GMT""},{""version"":""v2"",""created"":""Tue, 14 Dec 2021 16:45:21 GMT""}]","2022-10-13"
"2108.10950","Navin McGinnis","Radovan Dermisek, Keith Hermanek, Navin McGinnis","Di-Higgs and tri-Higgs boson signals of muon $g-2$ at a muon collider","4 pages + references, 4 figures. v2: minor additions to text and
  added appendix to match published version",,"10.1103/PhysRevD.104.L091301",,"hep-ph","http://arxiv.org/licenses/nonexclusive-distrib/1.0/","  We show that new physics explanations of the muon $g-2$ anomaly by the
contributions of new leptons mediated by the standard model Higgs boson
necessarily lead to large rates for $\mu^+ \mu^- \to hh$ and $\mu^+ \mu^- \to
hhh$ irrespectively of details of the model or the scale of new physics. For
new leptons with the same quantum numbers as the standard model leptons, cross
sections are expected to be about 240 ab for $\mu^+ \mu^- \to hh$ independently
of the center of mass energy, $\sqrt{s}$, and about 2.7 ab for $\mu^+ \mu^- \to
hhh$ for $\sqrt{s} = 1$ TeV and growing quadratically with $\sqrt{s}$.
Predictions for models featuring new leptons with different quantum numbers and
for a type-II two Higgs doublet model, where additional Higgs bosons can
contribute to muon $g-2$, are also presented.
","[{""version"":""v1"",""created"":""Tue, 24 Aug 2021 20:55:07 GMT""},{""version"":""v2"",""created"":""Thu, 4 Nov 2021 17:19:55 GMT""}]","2021-11-24"
"2108.10951","Ekaterina Simarova","Ekaterina Simarova","Extremal random beta polytopes","23 pages. arXiv admin note: text overlap with arXiv:2010.04460",,,,"math.PR","http://arxiv.org/licenses/nonexclusive-distrib/1.0/","  The convex hull of several i.i.d. beta distributed random vectors in $\mathbb
R^d$ is called the random beta polytope. Recently, the expected values of their
intrinsic volumes, number of faces, normal and tangent angles and other
quantities have been calculated, explicitly and asymptotically. In this paper,
we aim to investigate the asymptotic behavior of the beta polytopes with
extremal intrinsic volumes. We suggest a conjecture and solve it in dimension
2. To this end, we obtain some general limit relation for a wide class of
$U$-$\max$ statistics whose kernels include the perimeter and the area of the
convex hull of the arguments.
","[{""version"":""v1"",""created"":""Tue, 24 Aug 2021 20:55:33 GMT""},{""version"":""v2"",""created"":""Sun, 14 Nov 2021 11:49:42 GMT""}]","2021-11-16"
"2108.10952","Saiyad Ashanujjaman","Saiyad Ashanujjaman and Kirtiman Ghosh","Revisiting Type-II see-saw: Present Limits and Future Prospects at LHC","23 pages, 11 figures",,"10.1007/JHEP03(2022)195",,"hep-ph hep-ex","http://creativecommons.org/licenses/by/4.0/","  The type-II see-saw mechanism based on the annexation of the Standard Model
by weak gauge triplet scalar field proffers a natural explanation for the very
minuteness of neutrino masses. Noting that the phenomenology for the
non-degenerate triplet Higgs spectrum is substantially contrasting than that
for the degenerate one, we perform a comprehensive study for an extensive model
parameter space parametrised by the triplet scalar vacuum expectation value
(VEV), the mass-splitting between the triplet-like doubly and singly charged
scalars and the mass of the doubly charged scalar. Considering all Drell-Yan
production mechanisms for the triplet-like scalars and taking into account the
all-encompassing complexity of their decays, we derive the most stringent 95%
CL lower limits on the mass of the doubly charged scalar for a vast model
parameter space by implementing already existing direct collider searches by
CMS and ATLAS. These estimated limits are beyond those from the existing LHC
searches by approximately 50-230 GeV. However, we also find that a specific
region of the parameter space is not constrained by the LHC searches. Then, we
forecast future limits by extending an ATLAS search at high-luminosity, and we
propose a search strategy that yields improved limits for a part of the
parameter space.
","[{""version"":""v1"",""created"":""Tue, 24 Aug 2021 20:56:07 GMT""}]","2022-04-13"
"2108.10953","Alan Zhao","Alan Zhao","Heights of Rational Points on Mordell Curves","14 pages",,,,"math.NT","http://arxiv.org/licenses/nonexclusive-distrib/1.0/","  We conjecture a lower bound for the minimal canonical height of non-torsion
rational points on a natural density 1 subset of the sextic twist family of
Mordell curves. We then establish a lower bound that yields a partial result
towards this conjecture.
","[{""version"":""v1"",""created"":""Tue, 24 Aug 2021 21:01:14 GMT""},{""version"":""v2"",""created"":""Fri, 22 Apr 2022 00:53:16 GMT""}]","2022-04-25"
"2108.10954","Julian Gargiulo Dr.","Mariano Barella, Ianina L. Violi, Julian Gargiulo, Luciana P.
  Martinez, Florian Goschin, Victoria Guglielmotti, Diego Pallarola, Sebastian
  Schl\""ucker, Mauricio Pilo-Pais, Guillermo P. Acuna, Stefan A. Maier,
  Emiliano Cortes, Fernando D. Stefani","In Situ Photothermal Response of Single Gold Nanoparticles Through
  Hyperspectral Imaging AntiStokes Thermometry",,,,,"physics.optics physics.app-ph","http://creativecommons.org/licenses/by/4.0/","  Several fields of applications require a reliable characterization of the
photothermal response and heat dissipation of nanoscopic systems, which remains
a challenging task both for modeling and experimental measurements. Here, we
present a new implementation of anti-Stokes thermometry that enables the in
situ photothermal characterization of individual nanoparticles (NPs) from a
single hyperspectral photoluminescence confocal image. The method is
label-free, applicable to any NP with detectable anti-Stokes emission, and does
not require any prior information about the NP itself or the surrounding media.
With it, we first studied the photothermal response of spherical gold NPs of
different sizes on glass substrates, immersed in water, and found that heat
dissipation is mainly dominated by the water for NPs larger than 50 nm. Then,
the role of the substrate was studied by comparing the photothermal response of
80 nm gold NPs on glass with sapphire and graphene, two materials with high
thermal conductivity. For a given irradiance level, the NPs reach temperatures
18% lower on sapphire and 24% higher on graphene than on bare glass. The fact
that the presence of a highly conductive material such as graphene leads to a
poorer thermal dissipation demonstrates that interfacial thermal resistances
play a very significant role in nanoscopic systems, and emphasize the need for
in situ experimental thermometry techniques. The developed method will allow
addressing several open questions about the role of temperature in
plasmon-assisted applications, especially ones where NPs of arbitrary shapes
are present in complex matrixes and environments.
","[{""version"":""v1"",""created"":""Tue, 24 Aug 2021 21:01:28 GMT""}]","2021-08-26"
"2108.10955","Ricardo Puebla","Ricardo Puebla, Alberto Imparato, Alessio Belenchia, Mauro Paternostro","Open Quantum Rotors: Connecting Correlations and Physical Currents","9 pages, 9 figures; comments welcome!","Phys. Rev. Research 4, 043066 (2022)","10.1103/PhysRevResearch.4.043066",,"quant-ph cond-mat.stat-mech","http://creativecommons.org/licenses/by/4.0/","  We consider a finite one-dimensional chain of quantum rotors interacting with
a set of thermal baths at different temperatures. When the interaction between
the rotors is made chiral, such a system behaves as an autonomous thermal
motor, converting heat currents into non-vanishing rotational ones. Such a
dynamical response is strongly pronounced in the range of the Hamiltonian
parameters for which the ground state of the system in the thermodynamic limit
exhibits a quantum phase transition. Such working points are associated with
large quantum coherence and multipartite quantum correlations within the state
of the system. This suggests that the optimal operating regime of such quantum
autonomous motor is one of maximal quantumness.
","[{""version"":""v1"",""created"":""Tue, 24 Aug 2021 21:01:50 GMT""}]","2022-11-08"
"2108.10956","Sunil Chebolu","Sunil K. Chebolu and Keir Lockridge","Gaussian Binomial Coefficients in Group Theory, Field Theory, and
  Topology","8 pages, to appear in American Math. Monthly",,,,"math.GR math.AT","http://creativecommons.org/licenses/by-nc-nd/4.0/","  In this article, we offer group-theoretic, field-theoretic, and topological
interpretations of the Gaussian binomial coefficients and their sum. For a
finite $p$-group $G$ of rank $n$, we show that the Gaussian binomial
coefficient $\binom{n}{k}_p$ is the number of subgroups of $G$ that are
minimally expressible as an intersection of $n - k$ maximal subgroups of $G$,
and their sum is precisely the number of subgroups that are either $G$ or an
intersection of maximal subgroups of $G$. We provide a field-theoretic
interpretation of these quantities through the lens of Galois theory and a
topological interpretation involving covering spaces
","[{""version"":""v1"",""created"":""Tue, 24 Aug 2021 21:04:47 GMT""}]","2021-08-26"
"2108.10957","Diego Fernando Ram\'irez-Jim\'enez","D. F. Ram\'irez Jim\'enez and N. G. Kelkar","Formal Aspects of Quantum Decay","47 pages, 12 figures","Phys. Rev. A 104, 022214 (2021)","10.1103/PhysRevA.104.022214",,"quant-ph hep-ph nucl-th","http://creativecommons.org/licenses/by/4.0/","  The Fock-Krylov formalism for the calculation of survival probabilities of
unstable states is revisited paying particular attention to the mathematical
constraints on the density of states, the Fourier transform of which gives the
survival amplitude. We show that it is not possible to construct a density of
states corresponding to a purely exponential survival amplitude. he survival
probability $P(t)$ and the autocorrelation function of the density of states
are shown to form a pair of cosine Fourier transforms. This result is a
particular case of the Wiener Khinchin theorem and forces $P(t)$ to be an even
function of time which in turn forces the density of states to contain a form
factor which vanishes at large energies. Subtle features of the transition
regions from the non-exponential to the exponential at small times and the
exponential to the power law decay at large times are discussed by expressing
$P(t)$ as a function of the number of oscillations, $n$, performed by it. The
transition at short times is shown to occur when the survival probability has
completed one oscillation. The number of oscillations depend on the properties
of the resonant state and a complete description of the evolution of the
unstable state is provided by determining the limits on the number of
oscillations in each region.
","[{""version"":""v1"",""created"":""Tue, 24 Aug 2021 21:06:25 GMT""}]","2021-08-26"
"2108.10958","Bryan Arguello","Bryan Arguello, Emma S. Johnson, Jared L. Gearhart","A Trilevel Model for Segmentation of the Power Transmission Grid Cyber
  Network","12 pages, 4 figures",,,,"math.OC","http://arxiv.org/licenses/nonexclusive-distrib/1.0/","  Network segmentation of a power grid's communication system is one way to
make the grid more resilient to cyber attacks. We develop a novel trilevel
programming model to optimally segment a grid communication system, taking into
account the actions of an information technology (IT) administrator, attacker,
and grid operator. The IT administrator is given an allowance to segment
existing networks, and the attacker is given a fixed budget to attack the
segmented communication system in an attempt to inflict damage on the grid.
Finally, the grid operator is allowed to redispatch the grid after the attack
in order to minimize damage. The resulting problem is a trilevel interdiction
problem, which we solve by leveraging current research in bilevel branch and
bound. We demonstrate the benefits of optimal network segmentation through case
studies on the 9-bus WSCC system and the 30-bus IEEE system. These examples
illustrate that network segmentation can significantly reduce the threat.
","[{""version"":""v1"",""created"":""Tue, 24 Aug 2021 21:09:43 GMT""},{""version"":""v2"",""created"":""Thu, 2 Sep 2021 16:06:51 GMT""}]","2021-09-03"
"2108.10959","Madison Berger","Madison B. Berger, Alice R. Walker, Erik Antonio V\'azquez Montelongo
  and G. Andr\'es Cisneros","Computational Investigations of Selected Enzymes From Two Iron and
  {\alpha}-ketoglutarate-Dependent Families",,,"10.1039/D1CP03800A",,"physics.bio-ph","http://creativecommons.org/licenses/by-nc-nd/4.0/","  DNA alkylation is used as the key epigenetic mark in eukaryotes, however,
most alkylation in DNA can result in deleterious effects. Therefore, this
process needs to be tightly regulated. AlkB and TET are families within the Fe
and $\alpha$-kg-dependent superfamily of enzymes that are tasked with
dealkylating DNA and RNA in cells. Members of these families span all species
and are an integral part of transcriptional regulation. While both families
catalyze oxidative dealkylation of various bases, each has specific preference
for alkylated base type as well as distinct catalytic mechanisms. This
perspective aims to provide an overview of computational work carried out to
investigate several members of these enzyme families including AlkB, ALKBH2,
ALKBH3 and TET2. Insights into structural details, mutagenesis studies,
reaction path analysis, electronic structure features in the active site, and
substrate preferences are presented and discussed
","[{""version"":""v1"",""created"":""Tue, 24 Aug 2021 21:12:10 GMT""}]","2021-11-03"
"2108.10960","Marcelo Byrro Ribeiro","Osvaldo L. Santos-Pereira, Everton M. C. Abreu and Marcelo B. Ribeiro","Perfect fluid warp drive solutions with the cosmological constant","15 pages, LaTeX. Accepted for publication in The European Physical
  Journal Plus. arXiv admin note: text overlap with arXiv:2101.11467","Eur. Phys. J. Plus 136 (2021) 902","10.1140/epjp/s13360-021-01899-7",,"gr-qc","http://creativecommons.org/licenses/by/4.0/","  The Alcubierre metric describes a spacetime geometry that allows a massive
particle inside a spacetime distortion, called warp bubble, to travel with
superluminal global velocities. In this work we advance solutions of the
Einstein equations with the cosmological constant for the Alcubierre warp drive
metric having the perfect fluid as source. We also consider the particular dust
case with the cosmological constant, which generalizes our previous dust
solution (arXiv:2008.06560) and led to vacuum solutions connecting the warp
drive with shock waves via the Burgers equation, as well as our perfect fluid
solution without the cosmological constant (arXiv:2101.11467). All energy
conditions are also analyzed. The results show that the shift vector in the
direction of the warp bubble motion creates a coupling in the Einstein
equations that requires off-diagonal terms in the energy-momentum source.
Therefore, it seems that to achieve superluminal speeds by means of the
Alcubierre warp drive spacetime geometry one may require a complex
configuration and distribution of energy, matter and momentum as source in
order to produce a warp drive bubble. In addition, warp speeds seem to require
more complex forms of matter than dust for stable solutions and that negative
matter may not be a strict requirement to achieve global superluminal speeds.
","[{""version"":""v1"",""created"":""Tue, 24 Aug 2021 21:13:06 GMT""}]","2021-09-06"
"2108.10961","Khang Le","Khang Le and Dung Le and Huy Nguyen and Dat Do and Tung Pham and Nhat
  Ho","Entropic Gromov-Wasserstein between Gaussian Distributions","52 pages, 3 figures. Khang Le, Dung Le, Huy Nguyen contributed
  equally to this work",,,,"math.ST cs.IT math.IT stat.ML stat.TH","http://arxiv.org/licenses/nonexclusive-distrib/1.0/","  We study the entropic Gromov-Wasserstein and its unbalanced version between
(unbalanced) Gaussian distributions with different dimensions. When the metric
is the inner product, which we refer to as inner product Gromov-Wasserstein
(IGW), we demonstrate that the optimal transportation plans of entropic IGW and
its unbalanced variant are (unbalanced) Gaussian distributions. Via an
application of von Neumann's trace inequality, we obtain closed-form
expressions for the entropic IGW between these Gaussian distributions. Finally,
we consider an entropic inner product Gromov-Wasserstein barycenter of multiple
Gaussian distributions. We prove that the barycenter is a Gaussian distribution
when the entropic regularization parameter is small. We further derive a
closed-form expression for the covariance matrix of the barycenter.
","[{""version"":""v1"",""created"":""Tue, 24 Aug 2021 21:27:11 GMT""},{""version"":""v2"",""created"":""Thu, 21 Oct 2021 02:05:55 GMT""},{""version"":""v3"",""created"":""Thu, 24 Feb 2022 06:23:11 GMT""}]","2022-02-25"
"2108.10962","Philip Jameson Graber","P. Jameson Graber and Marcus Laurel","Parameter sensitivity analysis for mean field games of production",,,,,"math.AP math.OC","http://creativecommons.org/licenses/by/4.0/","  We study a mean field game system introduced by Chan and Sircar (AMO, 2015)
to model production of an exhaustible resource. In particular, we study the
sensitivity of the solution with respect to a parameter $\varepsilon$, which
measures the degree to which producers are interchangeable. We prove that on
some interval $[0,\varepsilon_0]$, where $\varepsilon_0 > 0$, the solution is
infinitely differentiable with respect to $\varepsilon$. The result is based on
a set of new a priori estimates for forward-backward systems of linear partial
differential equations.
","[{""version"":""v1"",""created"":""Tue, 24 Aug 2021 21:27:47 GMT""},{""version"":""v2"",""created"":""Thu, 26 Aug 2021 14:18:37 GMT""},{""version"":""v3"",""created"":""Mon, 11 Apr 2022 15:15:17 GMT""}]","2022-04-12"
"2108.10963","Christopher Cowden","N. Akchurin, C. Cowden, J. Damgov, A. Hussain, and S. Kunori","Perspectives on the Calibration of CNN Energy Reconstruction in Highly
  Granular Calorimeters",,,,,"physics.ins-det hep-ex","http://creativecommons.org/licenses/by/4.0/","  We present a study which shows encouraging stability of the response
linearity for a simulated high granularity calorimeter module reconstructed by
a CNN model to miscalibration, bias, and noise effects. Our results also show
an intuitive, quantifiable relationship between these factors and the
calibration parameters. We trained a CNN model to reconstruct energy in the
calorimeter module using simulated single-pion events; we then observed the
response of the model under various miscalibration, bias, and noise conditions
that affected the model input. From these data, we estimated linear response
models to calibrate the CNN. We also quantified the relationship between these
factors and the calibration parameters by regression analysis.
","[{""version"":""v1"",""created"":""Tue, 24 Aug 2021 21:29:13 GMT""},{""version"":""v2"",""created"":""Wed, 20 Jul 2022 18:39:12 GMT""},{""version"":""v3"",""created"":""Mon, 8 Aug 2022 22:21:32 GMT""}]","2022-08-10"
"2108.10964","Ramin Ayanzadeh","Ramin Ayanzadeh, Poulami Das, Swamit S. Tannu and Moinuddin Qureshi","EQUAL: Improving the Fidelity of Quantum Annealers by Injecting
  Controlled Perturbations",,,,,"quant-ph cs.AR cs.ET","http://creativecommons.org/licenses/by/4.0/","  Quantum computing is an information processing paradigm that uses
quantum-mechanical properties to speedup computationally hard problems.
Although promising, existing gate-based quantum computers consist of only a few
dozen qubits and are not large enough for most applications. On the other hand,
existing QAs with few thousand of qubits have the potential to solve some
domain-specific optimization problems. QAs are single instruction machines and
to execute a program, the problem is cast to a Hamiltonian, embedded on the
hardware, and a single quantum machine instruction (QMI) is run. Unfortunately,
noise and imperfections in hardware result in sub-optimal solutions on QAs even
if the QMI is run for thousands of trials.
  The limited programmability of QAs mean that the user executes the same QMI
for all trials. This subjects all trials to a similar noise profile throughout
the execution, resulting in a systematic bias. We observe that systematic bias
leads to sub-optimal solutions and cannot be alleviated by executing more
trials or using existing error-mitigation schemes. To address this challenge,
we propose EQUAL (Ensemble Quantum Annealing). EQUAL generates an ensemble of
QMIs by adding controlled perturbations to the program QMI. When executed on
the QA, the ensemble of QMIs steers the program away from encountering the same
bias during all trials and thus, improves the quality of solutions. Our
evaluations using the 2041-qubit D-Wave QA show that EQUAL bridges the
difference between the baseline and the ideal by an average of 14% (and up to
26%), without requiring any additional trials. EQUAL can be combined with
existing error mitigation schemes to further bridge the difference between the
baseline and ideal by an average of 55% (and up to 68%).
","[{""version"":""v1"",""created"":""Tue, 24 Aug 2021 21:29:59 GMT""}]","2021-08-26"
