"2108.11218","John Webb","John K. Webb, Robert F. Carswell, Chung-Chi Lee","Precision in high resolution absorption line modelling, analytic Voigt
  derivatives, and optimisation methods","15 pages, 7 figures, to appear in MNRAS",,"10.1093/mnras/stab2895",,"astro-ph.IM physics.comp-ph physics.data-an","http://arxiv.org/licenses/nonexclusive-distrib/1.0/","  This paper describes the optimisation theory on which VPFIT, a non-linear
least-squares program for modelling absorption spectra, is based. Particular
attention is paid to precision. Voigt function derivatives have previously been
calculated using numerical finite difference approximations. We show how these
can instead be computed analytically using Taylor series expansions and look-up
tables. We introduce a new optimisation method for an efficient descent path to
the best-fit, combining the principles used in both the Gauss-Newton and
Levenberg-Marquardt algorithms. A simple practical fix for ill-conditioning is
described, a common problem when modelling quasar absorption systems. We also
summarise how unbiased modelling depends on using an appropriate information
criterion to guard against over- or under-fitting.
  The methods and the new implementations introduced in this paper are aimed at
optimal usage of future data from facilities such as ESPRESSO/VLT and
HIRES/ELT, particularly for the most demanding applications such as searches
for spacetime variations in fundamental constants and attempts to detect
cosmological redshift drift.
","[{""version"":""v1"",""created"":""Wed, 25 Aug 2021 13:10:09 GMT""},{""version"":""v2"",""created"":""Mon, 4 Oct 2021 15:09:21 GMT""}]","2021-10-20"
"2108.11219","Huang-Hsiang Lin","Huang-Hsiang Lin, Alexander Croy, Rafael Guti\'errez, Christian
  Joachim and Gianaurelio Cuniberti","A Nanographene Disk Rotating a single Molecule Gear on a Cu(111) Surface",,,"10.1088/1361-6528/ac4b4b",,"cond-mat.mes-hall cond-mat.soft","http://creativecommons.org/licenses/by/4.0/","  Lubricants are widely used in macroscopic mechanical systems to reduce
friction and wear. However, on the microscopic scale, it is not clear to what
extent lubricants are beneficial. Therefore, in this study, we consider two
diamond solid-state gears at the nanoscale immersed in different lubricant
molecules and perform classical MD simulations to investigate the rotational
transmission of motion. We find that lubricants can help to synchronize the
rotational transmission between gears regardless of the molecular species and
the center-of-mass distance. Moreover, the influence of the angular velocity of
the driving gear is investigated and shown to be related to the bond formation
process between gears.
","[{""version"":""v1"",""created"":""Wed, 25 Aug 2021 13:11:00 GMT""},{""version"":""v2"",""created"":""Thu, 26 Aug 2021 10:01:40 GMT""}]","2022-02-16"
"2108.11220","Jorge L\'opez","Jorge L\'opez, Maxime Labonne and Claude Poletti","Toward Formal Data Set Verification for Building Effective Machine
  Learning Models","Preprint submitted to IC3K 2021",,,,"cs.SE cs.LG","http://creativecommons.org/licenses/by-nc-nd/4.0/","  In order to properly train a machine learning model, data must be properly
collected. To guarantee a proper data collection, verifying that the collected
data set holds certain properties is a possible solution. For example,
guaranteeing that the data set contains samples across the whole input space,
or that the data set is balanced w.r.t. different classes. We present a formal
approach for verifying a set of arbitrarily stated properties over a data set.
The proposed approach relies on the transformation of the data set into a first
order logic formula, which can be later verified w.r.t. the different
properties also stated in the same logic. A prototype tool, which uses the z3
solver, has been developed; the prototype can take as an input a set of
properties stated in a formal language and formally verify a given data set
w.r.t. to the given set of properties. Preliminary experimental results show
the feasibility and performance of the proposed approach, and furthermore the
flexibility for expressing properties of interest.
","[{""version"":""v1"",""created"":""Wed, 25 Aug 2021 13:22:24 GMT""}]","2021-08-26"
"2108.11221","Jiri Stehlik","D. M. Zajac, J. Stehlik, D. L. Underwood, T. Phung, J. Blair, S.
  Carnevale, D. Klaus, G. A. Keefe, A. Carniol, M. Kumph, Matthias Steffen, O.
  E. Dial","Spectator Errors in Tunable Coupling Architectures",,,,,"quant-ph","http://arxiv.org/licenses/nonexclusive-distrib/1.0/","  The addition of tunable couplers to superconducting quantum architectures
offers significant advantages for scaling compared to fixed coupling
approaches. In principle, tunable couplers allow for exact cancellation of
qubit-qubit coupling through the interference of two parallel coupling pathways
between qubits. However, stray microwave couplings can introduce additional
pathways which complicate the interference effect. Here we investigate the
primary spectator induced errors of the bus below qubit (BBQ) architecture in a
six qubit device. We identify the key design parameters which inhibit ideal
cancellation and demonstrate that dynamic cancellation pulses can further
mitigate spectator errors.
","[{""version"":""v1"",""created"":""Wed, 25 Aug 2021 13:22:26 GMT""}]","2021-08-26"
"2108.11222","Kevin Fossez","Yu-Xuan Luo and K. Fossez and Quan Liu and Jian-You Guo","Role of quadrupole deformation and continuum effects in the ""island of
  inversion'' nuclei $^{28,29,31}$F",,"Phys. Rev. C 104, 014307 (2021)","10.1103/PhysRevC.104.014307",,"nucl-th","http://creativecommons.org/licenses/by/4.0/","  The properties of nuclei in the ``island of inversion'' (IOI) around Z=10 and
N=20 are the focus of current nuclear physics research. Recent studies showed
that $^{28}$F has a negative-parity ground state (g.s.) and thus lies within
the southern shore of the IOI, and $^{29}$F presents a halo structure in its
g.s., but it is unclear which effects, such as deformation, shell evolution due
to tensor forces, or couplings to the continuum, lead to this situation. We
investigate the role of quadrupole deformation and continuum effects on the
single-particle (s.p.) structure of $^{28,29,31}$F from a relativistic
mean-field (RMF) approach, and show how both phenomena can lead to a
negative-parity g.s. in $^{28}$F and halo structures in $^{29,31}$F. We solve
the Dirac equation in the complex-momentum (Berggren) representation for a
potential with quadrupole deformation at the first order obtained from RMF
calculations using the NL3 interaction, and calculate the continuum level
densities using the Green's function method. We extract s.p. energies and
widths from the continuum level densities to construct Nilsson diagrams, and
analyse the evolution of both the widths and occupation probabilities of
relevant Nilsson orbitals in $^{28}$F and find that some amount of prolate
deformation must be present. In addition, we calculate the density
distributions for bound Nilsson orbitals near the Fermi surface in $^{29,31}$F
and reveal that for a quadrupole deformation $0.3 \leq \beta_2 \leq 0.45$
(prolate), halo tails appear at large distances. We also demonstrate that while
in the spherical case the $pf$ shells are already inverted and close to the
neutron emission threshold, a small amount of quadrupole deformation can reduce
the gap between $fp$ shells and increase the role of the continuum, ultimately
leading to the negative parity in the g.s. of $^{28}$F and the halo structures
in $^{29,31}$F.
","[{""version"":""v1"",""created"":""Wed, 25 Aug 2021 13:22:59 GMT""}]","2021-08-26"
"2108.11223","Giulio Maria Bianco Mr","Giulio M. Bianco and Cecilia Occhiuzzi and Nicoletta Panunzio and
  Gaetano Marrocco","A Survey on Radio Frequency Identification as a Scalable Technology to
  Face Pandemics","21 pages. Accepted for publication in IEEE Journal of Radio Frequency
  Identification",,"10.1109/JRFID.2021.3117764",,"eess.SY cs.SY","http://creativecommons.org/licenses/by/4.0/","  The COVID-19 pandemic drastically changed our way of living. To minimize life
losses, multi-level strategies requiring collective efforts were adopted while
waiting for the vaccines' rollout. The management of such complex processes has
taken benefit from the rising framework of the Internet of Things (IoT), and
particularly the Radiofrequency Identification (RFID) since it is probably the
most suitable approach to both the micro (user) and the macro (processes)
scale. Hence, a single infrastructure can support both the logistic and
monitoring issues related to the war against a pandemic. Based on the COVID-19
experience, this paper is a survey on how state-of-the-art RFID systems can be
employed in facing future pandemic outbreaks. The three pillars of the contrast
of the pandemic are addressed: 1) use of Personal Protective Equipment (PPE),
2) access control and social distancing, and 3) early detection of symptoms.
For each class, the envisaged RFID devices and procedures are discussed based
on the available technology and the current worldwide research. This survey
that RFID could generate an extraordinary amount of data so that complementary
paradigms of Edge Computing and Artificial intelligence can be tightly
integrated to extract profiles and identify anomalous events in compliance with
privacy and security.
","[{""version"":""v1"",""created"":""Wed, 25 Aug 2021 13:24:48 GMT""},{""version"":""v2"",""created"":""Mon, 4 Oct 2021 06:35:46 GMT""}]","2021-10-05"
"2108.11224","Petra Bevandi\'c","Petra Bevandi\'c, Marin Or\v{s}i\'c, Ivan Grubi\v{s}i\'c, Josip
  \v{S}ari\'c, Sini\v{s}a \v{S}egvi\'c","Multi-domain semantic segmentation with overlapping labels","18 pages, 8 figures, 11 tables",,,,"cs.CV","http://arxiv.org/licenses/nonexclusive-distrib/1.0/","  Deep supervised models have an unprecedented capacity to absorb large
quantities of training data. Hence, training on many datasets becomes a method
of choice towards graceful degradation in unusual scenes. Unfortunately,
different datasets often use incompatible labels. For instance, the Cityscapes
road class subsumes all driving surfaces, while Vistas defines separate classes
for road markings, manholes etc. We address this challenge by proposing a
principled method for seamless learning on datasets with overlapping classes
based on partial labels and probabilistic loss. Our method achieves competitive
within-dataset and cross-dataset generalization, as well as ability to learn
visual concepts which are not separately labeled in any of the training
datasets. Experiments reveal competitive or state-of-the-art performance on two
multi-domain dataset collections and on the WildDash 2 benchmark.
","[{""version"":""v1"",""created"":""Wed, 25 Aug 2021 13:25:41 GMT""},{""version"":""v2"",""created"":""Tue, 2 Nov 2021 17:25:44 GMT""}]","2021-11-03"
"2108.11225","Fabio Leoni","Fabio Leoni, Carles Calero, and Giancarlo Franzese","Nanoconfined fluids: Uniqueness of water compared to other liquids",,"ACS Nano 2021, 15, 12, 19864 -- 19876","10.1021/acsnano.1c07381",,"cond-mat.soft","http://arxiv.org/licenses/nonexclusive-distrib/1.0/","  Nanoconfinement can drastically change the behavior of liquids, puzzling us
with counterintuitive properties. Moreover, it is relevant in applications,
including decontamination and crystallization control. It still lacks a
systematic analysis for fluids with different bulk properties. Here we fill
this gap. We compare, by molecular dynamics simulations, three different
liquids in a graphene slit pore: (A) A simple fluid, such as argon, described
by a Lennard-Jones potential; (B) An anomalous fluid, such as a liquid metal,
modeled with an isotropic core-softened potential; (C) Water, the prototypical
anomalous liquid, with directional hydrogen bonds. We study how the slit-pore
width affects the structure, thermodynamics, and dynamics of the fluids. We
check that all the fluids, as expected, show similar oscillating properties by
changing the pore size. However, the nature of the free-energy minima for the
three fluids is quite different: i) only for the simple liquid all the minima
are energy-driven, while their structural order increases with decreasing
slit-pore width; ii) only for the isotropic core-softened potential all the
minima are entropy-driven, while the energy in the minima increases with
decreasing slit-pore width; iii) only the water has a changing nature of the
minima: the monolayer minimum is entropy-driven, at variance with the simple
liquid, while the bilayer minimum is energy-driven, at variance with the other
anomalous liquid. Also, water diffusion has a large increase for sub-nm
slit-pores, becoming faster than bulk. Instead, the other two fluids have
diffusion oscillations much smaller than water slowing down for decreasing
slit-pore width. Our results clarify that nanoconfined water is unique compared
to other (simple or anomalous) fluids under similar confinement, and are
possibly relevant in nanopores applications, e.g., in water purification from
contaminants.
","[{""version"":""v1"",""created"":""Wed, 25 Aug 2021 13:26:19 GMT""}]","2022-07-01"
"2108.11227","Kentaro Inoue","Kentaro Inoue","Construction of quasi-canonical liftings of K3 surfaces of finite height
  in odd characteristic","14 pages",,,,"math.AG","http://arxiv.org/licenses/nonexclusive-distrib/1.0/","  We construct a quasi-canonical lifting of a $K3$ surface of finite height
over a finite field of characteristic $p\geq3$. Such results are previously
obtained by Nygaard-Ogus when $p\geq5$. For this purpose, we use the
display-theoretic deformation theory developed by Langer, Zink, and Lau. We
study the display structure of the crystalline cohomology of deformations of a
$K3$ surface of finite height in terms of the Dieudonn\'e display of the
enlarged formal Brauer group.
","[{""version"":""v1"",""created"":""Wed, 25 Aug 2021 13:37:06 GMT""}]","2021-08-26"
"2108.11228","Markus Reiher","Moritz Bensberg, Paul L. T\""urtscher, Jan P. Unsleber, Markus Reiher,
  and Johannes Neugebauer","Solvation Free Energies in Subsystem Density Functional Theory","54 pages, 11 figures",,"10.1021/acs.jctc.1c00864",,"physics.chem-ph cond-mat.other physics.comp-ph","http://arxiv.org/licenses/nonexclusive-distrib/1.0/","  For many chemical processes the accurate description of solvent effects are
vitally important. Here, we describe a hybrid ansatz for the explicit quantum
mechanical description of solute-solvent and solvent-solvent interactions based
on subsystem density functional theory and continuum solvation schemes. Since
explicit solvent molecules may compromise scalability of the model and
transferability of the predicted solvent effect, we aim to retain both, for
different solutes as well as for different solvents. The key for the
transferability is the consistent subsystem decomposition of solute and
solvent. The key for the scalability is the performance of subsystem DFT for
increasing numbers of subsystems. We investigate molecular dynamics and
stationary point sampling of solvent configurations and compare the resulting
(Gibbs) free energies to experiment and theoretical methods. We can show that
with our hybrid model reaction barriers and reaction energies are accurately
reproduced compared to experimental data.
","[{""version"":""v1"",""created"":""Wed, 25 Aug 2021 13:37:45 GMT""}]","2022-01-14"
"2108.11229","Kalman Varga","Alexander Ahrens, Chenhang Huang, Matt Beutel, Cody Covington, and
  Kalman Varga","Stochastic Variational Approach to Small Atoms and Molecules Coupled to
  Quantum Field Modes",,,"10.1103/PhysRevLett.127.273601",,"cond-mat.mes-hall quant-ph","http://creativecommons.org/licenses/by/4.0/","  In this work, we present a stochastic variational calculation (SVM) of
energies and wave functions of few particle systems coupled to quantum fields
in cavity QED. The light-matter coupled system is described by the Pauli-Fierz
Hamiltonian. The spatial wave function and the photon spaces are optimized by a
random selection process. Examples for a two-dimensional trion and confined
electrons as well as for the He atom and the Hydrogen molecule are presented
showing that the light-matter coupling drastically changes the electronic
states.
","[{""version"":""v1"",""created"":""Wed, 25 Aug 2021 13:40:42 GMT""}]","2022-01-05"
"2108.11230","Brigitta Goger","Brigitta Goger, Ivana Stiperski, Lindsey Nicholson, Tobias Sauter","Large-eddy Simulations of the Atmospheric Boundary Layer over an Alpine
  Glacier: Impact of Synoptic Flow Direction and Governing Processes",,,"10.1002/qj.4263",,"physics.ao-ph physics.comp-ph physics.flu-dyn","http://creativecommons.org/licenses/by/4.0/","  The mass balance of mountain glaciers is of interest for several applications
(local hydrology or climate projections), and turbulent fluxes can be an
important contributor to glacier surface mass balance during strong melting
events. The underlying complex terrain leads to spatial heterogeneity and
non-stationarity of turbulent fluxes. Due to the contribution of
thermally-induced flows and gravity waves, exchange mechanisms are fully
three-dimensional, instead of only vertical. Additionally, glaciers have their
own distinct microclimate, governed by a down-glacier katabatic wind, which
protects the glacier ice and interacts with the surrounding flows on multiple
scales. In this study, we perform large-eddy simulations with the WRF model
with dx=48 m to gain insight on the boundary-layer processes over an Alpine
valley glacier, the Hintereisferner (HEF). We choose two case studies from a
measurement campaign (August 2018) with different synoptic wind directions
(South-West and North-West). Model evaluation with an array of eddy-covariance
stations on the glacier tongue and surroundings reveals that WRF is able to
simulate the general glacier boundary-layer structure. Under southwesterly
airflow, the down-glacier wind is supported by the South-Western synoptic wind
direction, a stable boundary layer is present over the ice surface, and local
processes govern the turbulence kinetic energy production. Under northwesterly
airflow, a cross-glacier valley flow and a breaking gravity wave lead strong
turbulent mixing and to the subsequent erosion of the glacier boundary layer.
Stationarity analyses of the sensible heat flux suggest non-stationary
behaviour for both case study days, while non-stationarity is highest on the NW
day during the gravity-wave event. These results suggest that the synoptic wind
direction has, in addition to upstream topography and the atmospheric
stability, a strong impact on whether a local glacier boundary layer can form
or not, influencing whether a glacier is able to maintain its own microclimate.
","[{""version"":""v1"",""created"":""Wed, 25 Aug 2021 13:42:00 GMT""}]","2022-03-15"
"2108.11231","Vasilis Oikonomou","S.D. Odintsov, V.K. Oikonomou, F.P. Fronimos","Quantitative Predictions for $f(R)$ Gravity Primordial Gravitational
  Waves","Version Accepted by PDU",,,,"gr-qc astro-ph.CO hep-th","http://arxiv.org/licenses/nonexclusive-distrib/1.0/","  In this work we shall develop a quantitative approach for extracting
predictions on the primordial gravitational waves energy spectrum for $f(R)$
gravity. We shall consider two distinct models which yield different
phenomenology, one pure $f(R)$ gravity model and one Chern-Simons corrected
potential-less $k$-essence $f(R)$ gravity model in the presence of radiation
and non-relativistic perfect matter fluids. The two $f(R)$ gravity models were
carefully chosen in order for them to describe in a unified way inflation and
the dark energy era, in both cases viable and compatible with the latest Planck
data. Also both models mimic the $\Lambda$-Cold-Dark-Matter model and
specifically the pure $f(R)$ model only at late times, but the Chern-Simons
$k$-essence model during the whole evolution of the model up to the radiation
domination era. In addition they guarantee a smooth transition from the
inflationary era to the radiation, matter domination and subsequently to the
dark energy era. Using a WKB approach introduced in the relevant literature by
Nishizawa, we derive formulas depending on the redshift that yield the modified
gravity effect, quantified by a multiplicative factor, a ``damping'' in front
of the General Relativistic waveform. In order to calculate the effect of the
modified gravity, which is the ``damping'' factor, we solve numerically the
Friedmann equations using appropriate initial conditions and by introducing
specific statefinder quantities. As we show, the pure $f(R)$ gravity
gravitational wave energy spectrum is slightly enhanced, but it remains well
below the sensitivity curves of future gravitational waves experiments. In
contrast, the Chern-Simons $k$-essence $f(R)$ gravity model gravitational wave
energy spectrum is significantly enhanced and two signals are predicted which
can be verified by future gravitational wave experiments.
","[{""version"":""v1"",""created"":""Wed, 25 Aug 2021 13:43:04 GMT""},{""version"":""v2"",""created"":""Sun, 9 Jan 2022 15:53:13 GMT""}]","2022-01-11"
"2108.11232","Ma{\l}gorzata Cury{\l}o Ms.","Ma{\l}gorzata Cury{\l}o, Tomasz Bulik","Predictions for LISA and PTA based on SHARK galaxy simulations","11 pages, 6 figures, v2, Accepted in A&A","A&A 660, A68 (2022)","10.1051/0004-6361/202141987",,"astro-ph.CO astro-ph.GA","http://arxiv.org/licenses/nonexclusive-distrib/1.0/","  We present our analysis of a set of populations of massive black hole (MBH)
binaries generated in the recent semi-analytic model of galaxy evolution
(SHARK). We focus on studying gravitational wave (GW) emission produced during
MBH mergers in terms of their detectability with current and future detectors,
namely, Pulsar Timing Arrays (PTAs) and Laser Interferometer Space Antenna
(LISA). The key advantage of SHARK is that it provides a way to explore a
number of distinct models of MBH and galaxy evolution processes within a
consistent framework and it was also successfully tested against current
constraints from electromagnetic observations. In our work, we studied 12
models that vary in terms of their MBH seed formation scenarios and we tested
two different MBH growth and feedback models.
  Based on our estimates, we find that LISA will be able to detect several to
several tens of merger events per year for the most and least massive seed
scenarios, respectively. We also show that the strength of this relation
depends on the MBH growth model, where in the most extreme case, we find twice
as many detected events for the same initial seed masses. Finally, we estimated
the amplitude of the GW background at nHz frequencies to be on the order of
$1.4\cdot10^{-16} - 1.1\cdot10^{-15}$. This value depends solely on the time
delay between the merger of galaxies and their MBHs.
","[{""version"":""v1"",""created"":""Wed, 25 Aug 2021 13:43:47 GMT""},{""version"":""v2"",""created"":""Sun, 13 Feb 2022 10:32:46 GMT""}]","2022-04-20"
"2108.11233","Wade Hindes","John R. Doyle, Vivian Olsiewski Healey, Wade Hindes, Rafe Jones","Galois groups and prime divisors in random quadratic sequences","22 pages",,,,"math.NT math.DS","http://arxiv.org/licenses/nonexclusive-distrib/1.0/","  Given a set $S=\{x^2+c_1,\dots,x^2+c_s\}$ defined over a field and an
infinite sequence $\gamma$ of elements of $S$, one can associate an arboreal
representation to $\gamma$, generalizing the case of iterating a single
polynomial. We study the probability that a random sequence $\gamma$ produces a
``large-image'' representation, meaning that infinitely many subquotients in
the natural filtration are maximal. We prove that this probability is positive
for most sets $S$ defined over $\mathbb{Z}[t]$, and we conjecture a similar
positive-probability result for suitable sets over $\mathbb{Q}$. As an
application of large-image representations, we prove a density-zero result for
the set of prime divisors of some associated quadratic sequences. We also
consider the stronger condition of the representation being finite-index, and
we classify all $S$ possessing a particular kind of obstruction that
generalizes the post-critically finite case in single-polynomial iteration.
","[{""version"":""v1"",""created"":""Wed, 25 Aug 2021 13:45:32 GMT""},{""version"":""v2"",""created"":""Fri, 10 Feb 2023 17:34:57 GMT""}]","2023-02-13"
