"2108.11081","Nina Ricci Nicomel","Nina Ricci Nicomel, Lila Otero-Gonzalez, Adam Williamson, Yong Sik Ok,
  Pascal Van Der Voort, Tom Hennebel, Gijs Du Laing","Selective copper recovery from ammoniacal waste streams using a
  systematic biosorption process","49 pages, 6 figures, 2 tables, 7 supplementary figures, 2
  supplementary tables","Chemosphere 286, 131935 (2021)","10.1016/j.chemosphere.2021.131935",,"physics.app-ph","http://creativecommons.org/licenses/by-nc-nd/4.0/","  Cu-NH3 bearing effluents arise from electroplating and metal extraction
industries, requiring innovative and sustainable Cu recovery technologies to
reduce their adverse environmental impact. CO32- and Zn are often co-occurring,
and thus, selective Cu recovery from these complex liquid streams is required
for economic viability. This study assessed 23 sustainable biosorbents
classified as tannin-rich, lignin-rich, chitosan/chitin, dead biomass,
macroalgae or biochar for their Cu adsorption capacity and selectivity in a
complex NH3-bearing bioleachate. Under a preliminary screen with 12 mM Cu in 1
M ammoniacal solution, most biosorbents showed optimal Cu adsorption at pH 11,
with pinecone remarkably showing high removal efficiencies (up to 68%) at all
tested pH values. Further refinements on select biosorbents with pH, contact
time, and presence of NH3, Zn and CO32- showed again that pinecone has a high
maximum adsorption capacity (1.07 mmol g-1), worked over pH 5-12 and was
Cu-selective with 3.97 selectivity quotient (KCu/Zn). Importantly, pinecone
performance was maintained in a real Cu/NH3/Zn/CO32- bioleachate, with 69.4% Cu
removal efficiency. Unlike synthetic adsorbents, pinecones require no
pre-treatment, which together with its abundance, selectivity, and efficiency
without the need for prior NH3 removal, makes it a competitive and sustainable
Cu biosorbent for complex Cu-NH3 bearing streams. Overall, this study
demonstrated the potential of integrating bioleaching and biosorption as a
clean Cu recovery technology utilizing only sustainable resources (i.e.,
bio-lixiviant and biosorbents). This presents a closed-loop approach to Cu
extraction and recovery from wastes, thus effectively addressing elemental
sustainability.
","[{""version"":""v1"",""created"":""Wed, 25 Aug 2021 07:00:38 GMT""}]","2021-08-26"
"2108.11082","Xuequan Lu","Yaping Jing, Xuequan Lu, and Shang Gao","3D Face Recognition: A Survey",,,,,"cs.CV cs.GR","http://arxiv.org/licenses/nonexclusive-distrib/1.0/","  Face recognition is one of the most studied research topics in the community.
In recent years, the research on face recognition has shifted to using 3D
facial surfaces, as more discriminating features can be represented by the 3D
geometric information. This survey focuses on reviewing the 3D face recognition
techniques developed in the past ten years which are generally categorized into
conventional methods and deep learning methods. The categorized techniques are
evaluated using detailed descriptions of the representative works. The
advantages and disadvantages of the techniques are summarized in terms of
accuracy, complexity and robustness to face variation (expression, pose and
occlusions, etc). The main contribution of this survey is that it
comprehensively covers both conventional methods and deep learning methods on
3D face recognition. In addition, a review of available 3D face databases is
provided, along with the discussion of future research challenges and
directions.
","[{""version"":""v1"",""created"":""Wed, 25 Aug 2021 07:00:59 GMT""}]","2021-08-26"
"2108.11083","Subhra Bhattacharya","Subhra Bhattacharya","Mimicking the $\Lambda$CDM Universe through inhomogeneous space-time","Under review","Annl. Phys., 450, 169238 (2023)","10.1016/j.aop.2023.169238",,"gr-qc","http://arxiv.org/licenses/nonexclusive-distrib/1.0/","  Starting from an inhomogeneous space-time model of the universe we could
recreate a scenario of recent time accelerating universe dominated by Dark
Energy type of fluid. The background matter component of such a universe was
considered to be made up of a combination of an anisotropic fluid, a barotropic
fluid and the presureless cold dark matter. It was found that inhomogeneity
exhibits itself as the curvature term in such a universe. We corroborated our
model with recent supernova Ia-JLA data together with $H_{0}$ data and BAO
data. Cosmographic analysis of the dynamical variables further show that the
model can mimic the $\Lambda$CDM cosmology very closely.
","[{""version"":""v1"",""created"":""Wed, 25 Aug 2021 07:04:44 GMT""}]","2023-02-06"
"2108.11084","Juncheng Li","Zhisheng Lu, Juncheng Li, Hong Liu, Chaoyan Huang, Linlin Zhang,
  Tieyong Zeng","Transformer for Single Image Super-Resolution","Accepted by CVPR workshop 2022",,,,"cs.CV","http://creativecommons.org/licenses/by/4.0/","  Single image super-resolution (SISR) has witnessed great strides with the
development of deep learning. However, most existing studies focus on building
more complex networks with a massive number of layers. Recently, more and more
researchers start to explore the application of Transformer in computer vision
tasks. However, the heavy computational cost and high GPU memory occupation of
the vision Transformer cannot be ignored. In this paper, we propose a novel
Efficient Super-Resolution Transformer (ESRT) for SISR. ESRT is a hybrid model,
which consists of a Lightweight CNN Backbone (LCB) and a Lightweight
Transformer Backbone (LTB). Among them, LCB can dynamically adjust the size of
the feature map to extract deep features with a low computational cost. LTB is
composed of a series of Efficient Transformers (ET), which occupies a small GPU
memory occupation, thanks to the specially designed Efficient Multi-Head
Attention (EMHA). Extensive experiments show that ESRT achieves competitive
results with low computational costs. Compared with the original Transformer
which occupies 16,057M GPU memory, ESRT only occupies 4,191M GPU memory. All
codes are available at https://github.com/luissen/ESRT.
","[{""version"":""v1"",""created"":""Wed, 25 Aug 2021 07:05:30 GMT""},{""version"":""v2"",""created"":""Thu, 28 Oct 2021 16:01:56 GMT""},{""version"":""v3"",""created"":""Fri, 22 Apr 2022 05:56:50 GMT""}]","2022-04-25"
"2108.11085","Laurent Manivel","Laurent Manivel (IMT)","Proof of a conjecture of Sturmfels, Timme and Zwiernik",,,,,"math.AG","http://arxiv.org/licenses/nonexclusive-distrib/1.0/","  We prove a conjecture of Sturmfels, Timme and Zwiernik on the ML-degrees of
linear covariance models in algebraic statistics. As in our previous works on
linear concentration models, the proof ultimately relies on the computation of
certain intersection numbers on the varieties of complete quadrics.
","[{""version"":""v1"",""created"":""Wed, 25 Aug 2021 07:12:14 GMT""}]","2021-08-26"
"2108.11086","Semenenko Vyacheslav L","Vyacheslav Semenenko, Mengkun Liu, Vasili Perebeinos","Simulation of Scanning Near-Field Optical Microscopy Spectra of 1D
  Plasmonic Graphene Junctions","15 pages, 6 figures","Optics Express 30, 9000 (2022)","10.1364/OE.450323",,"cond-mat.mtrl-sci","http://arxiv.org/licenses/nonexclusive-distrib/1.0/","  We present numerical simulations of scattering-type Scanning Near-Field
Optical Microscopy (s-SNOM) of 1D plasmonic graphene junctions. A comprehensive
analysis of simulated s-SNOM spectra is performed for three types of junctions.
We find conditions when the conventional interpretation of the plasmon
reflection coefficients from s-SNOM measurements does not apply. Our results
are applicable to other conducting 2D materials and provide a comprehensive
understanding of the s-SNOM techniques for probing local transport properties
of 2D materials.
","[{""version"":""v1"",""created"":""Wed, 25 Aug 2021 07:14:45 GMT""}]","2022-03-09"
"2108.11087","Truong Hoang Le","Nguyen Thi Anh Hang and Do Van Kien and Hoang Le Truong","Canonical stretched rings","Accepted Acta Mathematica Vietnamica",,"10.1007/s40306-021-00426-1",,"math.AC","http://creativecommons.org/licenses/by-sa/4.0/","  In this paper, we introduce the concept of canonical stretched rings, sparse
stretched rings and maximum sparse ideals. Then we give characterizations of
canonical stretched rings and sparse stretched rings; and a characterization of
Gorenstein rings in terms of their maximum sparse ideals. Several explicit
examples are provided along the paper to illustrate such rings.
","[{""version"":""v1"",""created"":""Wed, 25 Aug 2021 07:18:38 GMT""}]","2021-08-26"
"2108.11088","Abheejeet Mohapatra","P. Naga Yasasvi, Abheejeet Mohapatra, Suresh Chandra Srivastava","Robust AC Transmission Expansion Plans from A Novel Dual Based Bi-level
  Approach","There is a major error in the signs and notations of variables in
  (46) - (58). As a result, the proof of strong duality in Appendix A of the
  paper is not entirely correct","IEEE Trans. Power Syst. (2021)","10.1109/TPWRS.2021.3125719",,"eess.SY cs.SY","http://creativecommons.org/licenses/by/4.0/","  The rapid integration of Renewable Energy Sources (RESs) strengthens the need
for a power network that can robustly handle the system's uncertain scenarios.
Thus, this paper proposes the first nonlinear novel dual based bi-level
approach for robust AC Transmission Expansion Planning (TEP) plans with
uncertainties in RES generations and loads. It utilizes a convex relaxation and
is solved by Benders Decomposition (BD), where the master determines the robust
AC TEP plan. The novel dual slave model for the second level of BD circumvents
the issues in using the conventional conic dual theory and aids in the
worst-case realization of uncertainties using additional novel constraints. The
novel dual slave is solved using Interior Point Method (IPM), as it is not a
mixed-integer problem. The proposed work also includes additional linear
constraints to reduce the BD's slow convergence and direct the master towards
optimality. The robustness of the AC TEP plans is verified by Monte-Carlo
Simulation (MCS) of the actual nonlinear and non-convex AC Optimal Power Flow
(OPF). The effect of the budget of uncertainty on the AC TEP plans is also
investigated. A comparison with the results of a previous work reveals the
superiority of the proposed work.
","[{""version"":""v1"",""created"":""Wed, 25 Aug 2021 07:22:42 GMT""},{""version"":""v2"",""created"":""Thu, 26 Aug 2021 08:03:54 GMT""}]","2021-11-11"
"2108.11089","Thanh Tran","Thanh Tran, Nhat Truong Pham, Jan Lundgren","Detecting Drill Failure in the Small Short-sound Drill Dataset","8 pages, 10 figures, journal",,,,"cs.SD eess.AS","http://creativecommons.org/licenses/by-sa/4.0/","  Monitoring the conditions of machines is vital in the manufacturing industry.
Early detection of faulty components in machines for stopping and repairing the
failed components can minimize the downtime of the machine. This article
presents an approach to detect the failure occurring in drill machines based on
drill sounds from Valmet AB. The drill dataset includes three classes:
anomalous sounds, normal sounds, and irrelevant sounds, which are also labeled
as ""Broken"", ""Normal"", and ""Other"", respectively. Detecting drill failure
effectively remains a challenge due to the following reasons. The waveform of
drill sound is complex and short for detection. Additionally, in realistic
soundscapes, there are sounds and noise in the context at the same time.
Moreover, the balanced dataset is small to apply state-of-the-art deep learning
techniques. To overcome these aforementioned difficulties, we augmented sounds
to increase the number of sounds in the dataset. We then proposed a
convolutional neural network (CNN) combined with a long short-term memory
(LSTM) to extract features from log-Mel spectrograms and learn global
high-level feature representation for the classification of three classes. A
leaky rectified linear unit (Leaky ReLU) was utilized as the activation
function for our proposed CNN instead of the rectified linear unit (ReLU).
Moreover, we deployed an attention mechanism at the frame level after the LSTM
layer to learn long-term global feature representations. As a result, the
proposed method reached an overall accuracy of 92.35% for the drill failure
detection system.
","[{""version"":""v1"",""created"":""Wed, 25 Aug 2021 07:25:15 GMT""},{""version"":""v2"",""created"":""Tue, 9 Nov 2021 13:09:37 GMT""}]","2021-11-10"
"2108.11090","Taekyun Kim","Yuankui Ma, Taekyun Kim, Hyunseok Lee, Dae San Kim","Some identities of fully degenerate Dowling and fully degenerate Bell
  polynomials arising from lambda-umbral calculus","14 pages",,"10.1142/S0218348X22402575",,"math.NT","http://creativecommons.org/licenses/by/4.0/","  Recently, Kim-Kim introduced the lambda-umbral calculus, in which the
lambda-Sheffer sequences occupy the central position. In this paper, we
introduce the fully degenerate Bell and the fully degenerate Dowling
polynomials, and investigate some properties and identities relating to those
polynomials with the help oflambda-umbral calculus. Here we note that the fully
degenerate Bell poynomials and the fully degenerate Dowling polynomials are
respectively degenerate versions of the Bell polynomials and the Dowling
polynomials,
  of which the latters are the natural extension of the Whitney numbers of the
second kind.
","[{""version"":""v1"",""created"":""Wed, 25 Aug 2021 07:29:31 GMT""}]","2023-01-11"
"2108.11091","Elia Onofri","Elia Onofri and Alessandro Corbetta","RSSi-based visitor tracking in museums via cascaded AI classifiers and
  coloured graph representations",,"Collective Dynamics. v.6, p.1-17, 2021","10.17815/CD.2021.131",,"physics.soc-ph","http://arxiv.org/licenses/nonexclusive-distrib/1.0/","  Individual tracking of museum visitors based on portable radio beacons, an
asset for behavioural analyses and comfort/performance improvements, is seeing
increasing diffusion. Conceptually, this approach enables room-level
localisation based on a network of small antennas (thus, without invasive
modification of the existent structures). The antennas measure the intensity
(RSSi) of self-advertising signals broadcasted by beacons individually assigned
to the visitors. The signal intensity provides a proxy for the distance to the
antennas and thus indicative positioning. However, RSSi signals are well-known
to be noisy, even in ideal conditions (high antenna density, absence of
obstacles, absence of crowd, ...). In this contribution, we present a method to
perform accurate RSSi-based visitor tracking when the density of antennas is
relatively low, e.g. due to technical constraints imposed by historic
buildings. We combine an ensemble of ""simple"" localisers, trained based on
ground-truth, with an encoding of the museum topology in terms of a
total-coloured graph. This turns the localisation problem into a cascade
process, from large to small scales, in space and in time. Our use case is
visitors tracking in Galleria Borghese, Rome (Italy), for which our method
manages >96% localisation accuracy, significantly improving on our previous
work (J. Comput. Sci. 101357, 2021).
","[{""version"":""v1"",""created"":""Wed, 25 Aug 2021 07:29:40 GMT""}]","2022-02-08"
"2108.11092","Hanbo Zhang","Hanbo Zhang, Yunfan Lu, Cunjun Yu, David Hsu, Xuguang La, Nanning
  Zheng","INVIGORATE: Interactive Visual Grounding and Grasping in Clutter","10 pages, Accepted to RSS 2021",,,,"cs.RO","http://arxiv.org/licenses/nonexclusive-distrib/1.0/","  This paper presents INVIGORATE, a robot system that interacts with human
through natural language and grasps a specified object in clutter. The objects
may occlude, obstruct, or even stack on top of one another. INVIGORATE embodies
several challenges: (i) infer the target object among other occluding objects,
from input language expressions and RGB images, (ii) infer object blocking
relationships (OBRs) from the images, and (iii) synthesize a multi-step plan to
ask questions that disambiguate the target object and to grasp it successfully.
We train separate neural networks for object detection, for visual grounding,
for question generation, and for OBR detection and grasping. They allow for
unrestricted object categories and language expressions, subject to the
training datasets. However, errors in visual perception and ambiguity in human
languages are inevitable and negatively impact the robot's performance. To
overcome these uncertainties, we build a partially observable Markov decision
process (POMDP) that integrates the learned neural network modules. Through
approximate POMDP planning, the robot tracks the history of observations and
asks disambiguation questions in order to achieve a near-optimal sequence of
actions that identify and grasp the target object. INVIGORATE combines the
benefits of model-based POMDP planning and data-driven deep learning.
Preliminary experiments with INVIGORATE on a Fetch robot show significant
benefits of this integrated approach to object grasping in clutter with natural
language interactions. A demonstration video is available at
https://youtu.be/zYakh80SGcU.
","[{""version"":""v1"",""created"":""Wed, 25 Aug 2021 07:35:21 GMT""}]","2021-08-26"
"2108.11093","Murat Uzundag","Murat Uzundag, Alejandro H. C\'orsico, S. O. Kepler, Leandro G.
  Althaus, Klaus Werner, Nicole Reindl, Keaton J. Bell, Michael Higgins,
  Gabriela O. da Rosa, Maja Vu\v{c}kovi\'c, Alina Istrate","Pulsating hydrogen-deficient white dwarfs and pre-white dwarfs observed
  with TESS II. Discovery of two new GW Vir stars: TIC333432673 and
  TIC095332541","12 pages, 13 figures, Accepted for publication in A&A. arXiv admin
  note: text overlap with arXiv:2011.03629","A&A 655, A27 (2021)","10.5281/zenodo.5122978",,"astro-ph.SR","http://creativecommons.org/licenses/by-nc-sa/4.0/","  In this paper, we present the observations of two new GW Vir stars from the
extended \textit{TESS} mission in both 120\,s short-cadence and 20\,s
ultra-short-cadence mode of two pre-white dwarf stars showing hydrogen
deficiency. We performed an asteroseismological analysis of these stars on the
basis of PG~1159 evolutionary models that take into account the complete
evolution of the progenitor stars. We searched for patterns of uniform period
spacings in order to constrain the stellar mass of the stars, and employed the
individual observed periods to search for a representative seismological model.
The analysis of the {\it TESS} light curves of TIC\,333432673 and
TIC\,095332541 reveals the presence of several oscillations with periods
ranging from 350 to 500~s associated to typical gravity ($g$)-modes. From
follow-up ground-based spectroscopy, we find that both stars have similar
effective temperature ($T_\mathrm{eff} = 120,000 \pm 10,000$\,K) and surface
gravity ($\log g = 7.5 \pm 0.5$) but a different He/C composition. On the basis
of PG~1159 evolutionary tracks, we derived a spectroscopic mass of $M_{\star}$
= $0.58^{+0.16}_{-0.08}\,M_{\odot}$ for both stars. Our asteroseismological
analysis of TIC\,333432673 allowed us to find a constant period spacing
compatible with a stellar mass $M_{\star}\sim 0.60-0.61\,M_{\odot}$, and an
asteroseismological model for this star with a stellar mass $M_{\star}$ =
$0.589\pm 0.020$ $M_{\odot}$, and a seismological distance of $d=
459^{+188}_{-156}$ pc. For this star, we find an excellent agreement between
the different methods to infer the stellar mass, and also between the
seismological distance and that measured with {\it Gaia} ($d_{\rm Gaia}=
389^{+5.6}_{-5.2}$ pc). For TIC\,095332541, we have found a possible period
spacing that suggests a stellar mass of $M_{\star}\sim 0.55-0.57\,M_{\odot}$.
","[{""version"":""v1"",""created"":""Wed, 25 Aug 2021 07:37:58 GMT""}]","2021-11-10"
"2108.11094","Zeren Simon Wang","Kingman Cheung, Abner Soffer, Zeren Simon Wang, Yu-Heng Wu","Probing charged lepton flavor violation with axion-like particles at
  Belle II","v1, 27 pages, 9 figures, 3 tables; v2, minor changes, mainly updated
  beam-dump and lepton-flavor-universality constraints, accepted for
  publication in JHEP",,"10.1007/JHEP11(2021)218",,"hep-ph hep-ex","http://arxiv.org/licenses/nonexclusive-distrib/1.0/","  We study charged lepton flavor violation associated with a light leptophilic
axion-like particle (ALP), $X$, at the $B$-factory experiment Belle II. We
focus on production of the ALP in the tau decays $\tau \to X l$ with $l=e,\mu$,
followed by its decay via $X\to l^- l^+$. The ALP can be either promptly
decaying or long-lived. We perform Monte-Carlo simulations, recasting a prompt
search at Belle for lepton-flavor-violating $\tau$ decays, and propose a
displaced-vertex (DV) search. For both types of searches, we derive the
Belle~II sensitivity reaches in both the product of branching fractions and the
ALP coupling constants, as functions of the ALP mass and lifetime. The results
show that the DV search exceeds the sensitivity reach of the prompt search to
the relevant branching fractions by up to about a factor of 40 in the long
decay length regime.
","[{""version"":""v1"",""created"":""Wed, 25 Aug 2021 07:38:02 GMT""},{""version"":""v2"",""created"":""Fri, 19 Nov 2021 00:27:01 GMT""}]","2021-12-22"
"2108.11095","Sebastian H\""ahnle","S. H\""ahnle, K. Kouwenhoven, B. Buijtendorp, A. Endo, K. Karatsu, D.
  J. Thoen, V. Murugesan, J. J. A. Baselmans","Superconducting Microstrip Losses at Microwave and Sub-millimeter
  wavelengths","8 pages, 3 figures","Phys. Rev. Applied 16, 014019, July 2021",,,"physics.ins-det","http://creativecommons.org/licenses/by/4.0/","  We present a lab-on-chip experiment to accurately measure losses of
superconducting microstrip lines at microwave and sub-mm wavelengths. The
microstrips are fabricated from NbTiN, which is deposited using reactive
magnetron sputtering, and amorphous silicon which is deposited using
plasma-enhanced chemical vapor deposition (PECVD). Sub-mm wave losses are
measured using on-chip Fabry-P{\'e}rot resonators (FPR) operating around $350\
$GHz. Microwave losses are measured using shunted half-wave resonators with an
identical geometry and fabricated on the same chip. We measure a loss tangent
of the amorphous silicon at single-photon energies of $\tan\delta
=3.7\pm0.5\times10^{-5}$ at $6\ $GHz and $\tan\delta = 2.1\pm 0.1\times10^{-4}$
at $350\ $GHz. These results represent very low losses for deposited
dielectrics, but the sub-mm wave losses are significantly higher than the
microwave losses, which cannot be understood using the standard two-level
system loss model.
","[{""version"":""v1"",""created"":""Wed, 25 Aug 2021 07:41:04 GMT""}]","2021-08-26"
"2108.11096","Boris Chidlovskii","Shyamgopal Karthik and J\'erome Revaud and Boris Chidlovskii","Learning From Long-Tailed Data With Noisy Labels",,,,,"cs.CV cs.LG","http://arxiv.org/licenses/nonexclusive-distrib/1.0/","  Class imbalance and noisy labels are the norm rather than the exception in
many large-scale classification datasets. Nevertheless, most works in machine
learning typically assume balanced and clean data. There have been some recent
attempts to tackle, on one side, the problem of learning from noisy labels and,
on the other side, learning from long-tailed data. Each group of methods make
simplifying assumptions about the other. Due to this separation, the proposed
solutions often underperform when both assumptions are violated. In this work,
we present a simple two-stage approach based on recent advances in
self-supervised learning to treat both challenges simultaneously. It consists
of, first, task-agnostic self-supervised pre-training, followed by
task-specific fine-tuning using an appropriate loss. Most significantly, we
find that self-supervised learning approaches are effectively able to cope with
severe class imbalance. In addition, the resulting learned representations are
also remarkably robust to label noise, when fine-tuned with an imbalance- and
noise-resistant loss function. We validate our claims with experiments on
CIFAR-10 and CIFAR-100 augmented with synthetic imbalance and noise, as well as
the large-scale inherently noisy Clothing-1M dataset.
","[{""version"":""v1"",""created"":""Wed, 25 Aug 2021 07:45:40 GMT""},{""version"":""v2"",""created"":""Sun, 12 Sep 2021 17:06:20 GMT""}]","2021-09-14"
"2108.11097","Hiroshi Nakajima Dr.","Hiroshi Nakajima, Hirofumi Tsukasaki, Jiong Ding, Takuya Kimura,
  Takumi Nakano, Akira Nasu, Akihiko Hirata, Atsushi Sakuda, Akitoshi Hayashi,
  and Shigeo Mori","Crystallization behaviors in superionic conductor Na$_3$PS$_4$",,"Journal of Power Sources 511, 230444 (2021)","10.1016/j.jpowsour.2021.230444",,"cond-mat.mtrl-sci","http://arxiv.org/licenses/nonexclusive-distrib/1.0/","  All-solid-state batteries using sodium are promising candidates for
next-generation rechargeable batteries due to the limited lithium resources. A
practical sodium battery requires an electrolyte with high conductivity. Cubic
Na$_3$PS$_4$ exhibiting high conductivity of over 10$^{-4}$ S cm$^{-1}$ is
obtained by crystallizing amorphous Na$_3$PS$_4$ synthesized by ball milling.
Amorphous Na$_3$PS$_4$ crystallizes in a cubic structure and then is
transformed into a tetragonal phase upon heating. In this study, in situ
observation by transmission electron microscopy demonstrates that the
crystallite size drastically increases during the transition from the cubic
phase to the tetragonal phase. Moreover, an electron diffraction analysis
reveals that amorphous domains and nano-sized crystallites coexist in the cubic
Na$_3$PS$_4$ specimen, while the tetragonal phase contains micro-sized
crystallites. The nano-sized crystallites and the composite formed by
crystallites and amorphous domains are most likely responsible for the increase
in conductivity in the cubic Na$_3$PS$_4$ specimens.
","[{""version"":""v1"",""created"":""Wed, 25 Aug 2021 07:48:20 GMT""},{""version"":""v2"",""created"":""Fri, 3 Sep 2021 02:19:15 GMT""}]","2021-09-06"
